player_id,first_name,last_name,Date1,Date2,Date3,Date4,birth_year,birth_month,birth_day,birth_month2
8467867,Bryan,Adams,20-Mar-77,Mar-20-1977,3/20/77,3/20/77,1977,3,20,Mar
8445176,Donald,Audette,23-Sep-69,Sep-23-1969,9/23/69,9/23/69,1969,9,23,Sep
8460014,Eric,Bertrand,16-Apr-75,Apr-16-1975,4/16/75,4/16/75,1975,4,16,Apr
8460510,Jason,Botterill,19-May-76,May-19-1976,5/19/76,5/19/76,1976,5,19,May
8459596,Andrew,Brunette,24-Aug-73,Aug-24-1973,8/24/73,8/24/73,1973,8,24,Aug
8445733,Kelly,Buchberger,2-Dec-66,Dec-2-1966,12/2/66,12/2/66,1966,12,2,Dec
8460573,Hnat,Domenichelli,17-Feb-76,Feb-17-1976,2/17/76,2/17/76,1976,2,17,Feb
8459450,Shean,Donovan,22-Jan-75,Jan-22-1975,1/22/75,1/22/75,1975,1,22,Jan
8446675,Nelson,Emerson,17-Aug-67,Aug-17-1967,8/17/67,8/17/67,1967,8,17,Aug
8446823,Ray,Ferraro,23-Aug-64,Aug-23-1964,8/23/64,8/23/64,1964,8,23,Aug
8447071,Johan,Garpenlov,21-Mar-68,Mar-21-1968,3/21/68,3/21/68,1968,3,21,Mar
8460482,Stephen,Guolla,15-Mar-73,Mar-15-1973,3/15/73,3/15/73,1973,3,15,Mar
8460524,Matt,Johnson,23-Nov-75,Nov-23-1975,11/23/75,11/23/75,1975,11,23,Nov
8459571,Andreas,Karlsson,19-Aug-75,Aug-19-1975,8/19/75,8/19/75,1975,8,19,Aug
8458888,Denny,Lambert,7-Jan-70,Jan-7-1970,1/7/70,1/7/70,1970,1,7,Jan
8458649,Martin,Prochazka,3-Mar-72,Mar-3-1972,3/3/72,3/3/72,1972,3,3,Mar
8451673,Mike,Stapleton,5-May-66,May-5-1966,5/5/66,5/5/66,1966,5,5,May
8467055,Patrik,Stefan,16-Sep-80,Sep-16-1980,9/16/80,9/16/80,1980,9,16,Sep
8459562,Per,Svartvadet,17-May-75,May-17-1975,5/17/75,5/17/75,1975,5,17,May
8459414,Dean,Sylvester,30-Dec-72,Dec-30-1972,12/30/72,12/30/72,1972,12,30,Dec
8465975,Herbert,Vasiljevs,27-May-76,May-27-1976,5/27/76,5/27/76,1976,5,27,May
8458587,Vladimir,Vujtek,17-Feb-72,Feb-17-1972,2/17/72,2/17/72,1972,2,17,Feb
8458348,Ed,Ward,10-Nov-69,Nov-10-1969,11/10/69,11/10/69,1969,11,10,Nov
8462090,Petr,Buzek,26-Apr-77,Apr-26-1977,4/26/77,4/26/77,1977,4,26,Apr
8465122,Brett,Clark,23-Dec-76,Dec-23-1976,12/23/76,12/23/76,1976,12,23,Dec
8456024,Kevin,Dean,1-Apr-69,Apr-1-1969,4/1/69,4/1/69,1969,4,1,Apr
8459482,Maxim,Galanov,13-Mar-74,Mar-13-1974,3/13/74,3/13/74,1974,3,13,Mar
8456514,David,Harlock,16-Mar-71,Mar-16-1971,3/16/71,3/16/71,1971,3,16,Mar
8467949,Frantisek,Kaberle,8-Nov-73,Nov-8-1973,11/8/73,11/8/73,1973,11,8,Nov
8459098,Geordie,Kinnear,9-Jul-73,Jul-9-1973,7/9/73,7/9/73,1973,7,9,Jul
8457264,Chris,Mcalpine,1-Dec-71,Dec-1-1971,12/1/71,12/1/71,1971,12,1,Dec
8449754,Gord,Murphy,23-Feb-67,Feb-23-1967,2/23/67,2/23/67,1967,2,23,Feb
8460004,Ruman,Ndur,7-Jul-75,Jul-7-1975,7/7/75,7/7/75,1975,7,7,Jul
8451333,Darryl,Shannon,21-Jun-68,Jun-21-1968,6/21/68,6/21/68,1968,6,21,Jun
8458541,Steve,Staios,28-Jul-73,Jul-28-1973,7/28/73,7/28/73,1973,7,28,Jul
8458179,Chris,Tamer,17-Nov-70,Nov-17-1970,11/17/70,11/17/70,1970,11,17,Nov
8462177,Yannick,Tremblay,15-Nov-75,Nov-15-1975,11/15/75,11/15/75,1975,11,15,Nov
8462097,Sergei,Vyshedkevich,3-Jan-75,Jan-3-1975,1/3/75,1/3/75,1975,1,3,Jan
8460761,Scott,Fankhouser,1-Jul-75,Jul-1-1975,7/1/75,7/1/75,1975,7,1,Jul
8459453,Scott,Langkow,21-Apr-75,Apr-21-1975,4/21/75,4/21/75,1975,4,21,Apr
8459549,Norm,Maracle,2-Oct-74,Oct-2-1974,10/2/74,10/2/74,1974,10,2,Oct
8457791,Damian,Rhodes,28-May-69,May-28-1969,5/28/69,5/28/69,1969,5,28,May
8451834,Rick,Tabaracci,2-Jan-69,Jan-2-1969,1/2/69,1/2/69,1969,1,2,Jan
8468660,Darcy,Hordichuk,10-Aug-80,Aug-10-1980,8/10/80,8/10/80,1980,8,10,Aug
8462107,Tomi,Kallio,27-Jan-77,Jan-27-1977,1/27/77,1/27/77,1977,1,27,Jan
8460663,Ladislav,Kohn,4-Mar-75,Mar-4-1975,3/4/75,3/4/75,1975,3,4,Mar
8457566,Jeff,Odgers,31-May-69,May-31-1969,5/31/69,5/31/69,1969,5,31,May
8458575,Yves,Sarault,23-Dec-72,Dec-23-1972,12/23/72,12/23/72,1972,12,23,Dec
8451392,Jarrod,Skalde,26-Feb-71,Feb-26-1971,2/26/71,2/26/71,1971,2,26,Feb
8467658,Dan,Snyder,23-Feb-78,Feb-23-1978,2/23/78,2/23/78,1978,2,23,Feb
8468444,Brad,Tapper,28-Apr-78,Apr-28-1978,4/28/78,4/28/78,1978,4,28,Apr
8468443,Jean-Pierre,Vigier,11-Sep-76,Sep-11-1976,9/11/76,9/11/76,1976,9,11,Sep
8445783,Adam,Burt,15-Jan-69,Jan-15-1969,1/15/69,1/15/69,1969,1,15,Jan
8448380,Chris,Joseph,10-Sep-69,Sep-10-1969,9/10/69,9/10/69,1969,9,10,Sep
8468427,Brian,Pothier,15-Apr-77,Apr-15-1977,4/15/77,4/15/77,1977,4,15,Apr
8466282,Andrei,Skopintsev,28-Sep-71,Sep-28-1971,9/28/71,9/28/71,1971,9,28,Sep
8458052,Jiri,Slegr,30-May-71,May-30-1971,5/30/71,5/30/71,1971,5,30,May
8458584,Milan,Hnilicka,25-Jun-73,Jun-25-1973,6/25/73,6/25/73,1973,6,25,Jun
8466437,Lubos,Bartecko,14-Jul-76,Jul-14-1976,7/14/76,7/14/76,1976,7,14,Jul
8466183,Yuri,Butsayev,11-Oct-78,Oct-11-1978,10/11/78,10/11/78,1978,10,11,Oct
8446165,Bob,Corkum,18-Dec-67,Dec-18-1967,12/18/67,12/18/67,1967,12,18,Dec
8462419,Jeff,Cowan,27-Sep-76,Sep-27-1976,9/27/76,9/27/76,1976,9,27,Sep
8469997,Mark,Hartigan,15-Oct-77,Oct-15-1977,10/15/77,10/15/77,1977,10,15,Oct
8468482,Dany,Heatley,21-Jan-81,Jan-21-1981,1/21/81,1/21/81,1981,1,21,Jan
8448017,Tony,Hrkac,7-Jul-66,Jul-7-1966,7/7/66,7/7/66,1966,7,7,Jul
8469454,Ilya,Kovalchuk,15-Apr-83,Apr-15-1983,4/15/83,4/15/83,1983,4,15,Apr
8466212,Francis,Lessard,30-May-79,May-30-1979,5/30/79,5/30/79,1979,5,30,May
8468001,Derek,MacKenzie,11-Jun-81,Jun-11-1981,6/11/81,6/11/81,1981,6,11,Jun
8466336,Kamil,Piros,20-Nov-78,Nov-20-1978,11/20/78,11/20/78,1978,11,20,Nov
8459223,Pascal,Rheaume,21-Jun-73,Jun-21-1973,6/21/73,6/21/73,1973,6,21,Jun
8466240,Benjamin,Simon,14-Jun-78,Jun-14-1978,6/14/78,6/14/78,1978,6,14,Jun
8457783,Todd,Reirden,25-Jun-71,Jun-25-1971,6/25/71,6/25/71,1971,6,25,Jun
8467892,Kirill,Safronov,26-Feb-81,Feb-26-1981,2/26/81,2/26/81,1981,2,26,Feb
8467903,Luke,Sellars,21-May-81,May-21-1981,5/21/81,5/21/81,1981,5,21,May
8467304,Andy,Sutton,10-Mar-75,Mar-10-1975,3/10/75,3/10/75,1975,3,10,Mar
8462115,Daniel,Tjarnqvist,14-Oct-76,Oct-14-1976,10/14/76,10/14/76,1976,10,14,Oct
8468478,Mike,Weaver,2-May-78,May-2-1978,5/2/78,5/2/78,1978,5,2,May
8460696,Frederic,Cassivi,12-Jun-75,Jun-12-1975,6/12/75,6/12/75,1975,6,12,Jun
8469636,Pasi,Nurminen,17-Dec-75,Dec-17-1975,12/17/75,12/17/75,1975,12,17,Dec
8467941,Zdenek,Blatny,14-Jan-81,Jan-14-1981,1/14/81,1/14/81,1981,1,14,Jan
8466191,Jeff,Farkas,24-Jan-78,Jan-24-1978,1/24/78,1/24/78,1978,1,24,Jan
8468770,Simon,Gamache,3-Jan-81,Jan-3-1981,1/3/81,1/3/81,1981,1,3,Jan
8459159,Chris,Herperger,24-Feb-74,Feb-24-1974,2/24/74,2/24/74,1974,2,24,Feb
8456887,Vyacheslav,Kozlov,3-May-72,May-3-1972,5/3/72,5/3/72,1972,5,3,May
8457297,Shawn,McEachern,28-Feb-69,Feb-28-1969,2/28/69,2/28/69,1969,2,28,Feb
8462118,Marc,Savard,17-Jul-77,Jul-17-1977,7/17/77,7/17/77,1977,7,17,Jul
8467387,Joe,Dipenta,25-Feb-79,Feb-25-1979,2/25/79,2/25/79,1979,2,25,Feb
8468090,Garnet,Exelby,16-Aug-81,Aug-16-1981,8/16/81,8/16/81,1981,8,16,Aug
8468520,Kurtis,Foster,24-Nov-81,Nov-24-1981,11/24/81,11/24/81,1981,11,24,Nov
8448554,Uwe,Krupp,24-Jun-65,Jun-24-1965,6/24/65,6/24/65,1965,6,24,Jun
8458058,Richard,Smehlik,23-Jan-70,Jan-23-1970,1/23/70,1/23/70,1970,1,23,Jan
8455994,Byron,Dafoe,25-Feb-71,Feb-25-1971,2/25/71,2/25/71,1971,2,25,Feb
8460649,Serge,Aubin,15-Feb-75,Feb-15-1975,2/15/75,2/15/75,1975,2,15,Feb
8467427,Kip,Brennan,27-Aug-80,Aug-27-1980,8/27/80,8/27/80,1980,8,27,Aug
8465179,Daniel,Corso,3-Apr-78,Apr-3-1978,4/3/78,4/3/78,1978,4,3,Apr
8462082,Brad,Larsen,28-Jun-77,Jun-28-1977,6/28/77,6/28/77,1977,6,28,Jun
8458617,Bill,Lindsay,17-May-71,May-17-1971,5/17/71,5/17/71,1971,5,17,May
8465180,Ronald,Petrovicky,15-Feb-77,Feb-15-1977,2/15/77,2/15/77,1977,2,15,Feb
8466110,Randy,Robitaille,12-Oct-75,Oct-12-1975,10/12/75,10/12/75,1975,10,12,Oct
8468118,Tommi,Santala,27-Jun-79,Jun-27-1979,6/27/79,6/27/79,1979,6,27,Jun
8469786,Karl,Stewart,30-Jun-83,Jun-30-1983,6/30/83,6/30/83,1983,6,30,Jun
8460603,Brian,Swanson,24-Mar-76,Mar-24-1976,3/24/76,3/24/76,1976,3,24,Mar
8462211,Jean-Luc,Grand-Pierre,2-Feb-77,Feb-2-1977,2/2/77,2/2/77,1977,2,2,Feb
8463125,Shawn,Heins,24-Dec-73,Dec-24-1973,12/24/73,12/24/73,1973,12,24,Dec
8467450,Tomas,Kloucek,7-Mar-80,Mar-7-1980,3/7/80,3/7/80,1980,3,7,Mar
8469710,Ivan,Majesky,2-Sep-76,Sep-2-1976,9/2/76,9/2/76,1976,9,2,Sep
8467358,Kyle,Rossiter,9-Jun-80,Jun-9-1980,6/9/80,6/9/80,1980,6,9,Jun
8470140,Kari,Lehtonen,16-Nov-83,Nov-16-1983,11/16/83,11/16/83,1983,11,16,Nov
8467356,Ramzi,Abid,24-Mar-80,Mar-24-1980,3/24/80,3/24/80,1980,3,24,Mar
8466164,Scott,Barney,27-Mar-79,Mar-27-1979,3/27/79,3/27/79,1979,3,27,Mar
8445575,Peter,Bondra,7-Feb-68,Feb-7-1968,2/7/68,2/7/68,1968,2,7,Feb
8460720,Eric,Boulton,17-Aug-76,Aug-17-1976,8/17/76,8/17/76,1976,8,17,Aug
8467333,Rico,Fata,12-Feb-80,Feb-12-1980,2/12/80,2/12/80,1980,2,12,Feb
8447958,Bobby,Holik,1-Jan-71,Jan-1-1971,1/1/71,1/1/71,1971,1,1,Jan
8466148,Marian,Hossa,12-Jan-79,Jan-12-1979,1/12/79,1/12/79,1979,1,12,Jan
8470543,Chris,Kunitz,26-Sep-79,Sep-26-1979,9/26/79,9/26/79,1979,9,26,Sep
8449545,Scott,Mellanby,11-Jun-66,Jun-11-1966,6/11/66,6/11/66,1966,6,11,Jun
8470289,Jim,Slater,9-Dec-82,Dec-9-1982,12/9/82,12/9/82,1982,12,9,Dec
8470601,Braydon,Coburn,27-Feb-85,Feb-27-1985,2/27/85,2/27/85,1985,2,27,Feb
8467956,Niclas,Havelid,12-Apr-73,Apr-12-1973,4/12/73,4/12/73,1973,4,12,Apr
8460661,Shane,Hnidy,8-Nov-75,Nov-8-1975,11/8/75,11/8/75,1975,11,8,Nov
8467896,Steve,McCarthy,3-Feb-81,Feb-3-1981,2/3/81,2/3/81,1981,2,3,Feb
8457403,Jaroslav,Modry,27-Feb-71,Feb-27-1971,2/27/71,2/27/71,1971,2,27,Feb
8469488,Mark,Popovic,11-Oct-82,Oct-11-1982,10/11/82,10/11/82,1982,10,11,Oct
8460254,Greg,De Vries,4-Jan-73,Jan-4-1973,1/4/73,1/4/73,1973,1,4,Jan
8468720,Adam,Berkhoel,16-May-81,May-16-1981,5/16/81,5/16/81,1981,5,16,May
8456137,Mike,Dunham,1-Jun-72,Jun-1-1972,6/1/72,6/1/72,1972,6,1,Jun
8469529,Michael,Garnett,25-Nov-82,Nov-25-1982,11/25/82,11/25/82,1982,11,25,Nov
8458615,Steve,Shields,19-Jul-72,Jul-19-1972,7/19/72,7/19/72,1972,7,19,Jul
8465050,Eric,Belanger,16-Dec-77,Dec-16-1977,12/16/77,12/16/77,1977,12,16,Dec
8466393,Pascal,Dupuis,7-Apr-79,Apr-7-1979,4/7/79,4/7/79,1979,4,7,Apr
8462185,Denis,Hamel,10-May-77,May-10-1977,5/10/77,5/10/77,1977,5,10,May
8468121,Darren,Haydar,22-Oct-79,Oct-22-1979,10/22/79,10/22/79,1979,10,22,Oct
8467516,Niko,Kapanen,29-Apr-78,Apr-29-1978,4/29/78,4/29/78,1978,4,29,Apr
8467857,Jason,Krog,9-Oct-75,Oct-9-1975,10/9/75,10/9/75,1975,10,9,Oct
8462823,Glen,Metropolit,25-Jun-74,Jun-25-1974,6/25/74,6/25/74,1974,6,25,Jun
8459284,Steve,Rucchin,4-Jul-71,Jul-4-1971,7/4/71,7/4/71,1971,7,4,Jul
8465024,Jon,Sim,29-Sep-77,Sep-29-1977,9/29/77,9/29/77,1977,9,29,Sep
8458229,Keith,Tkachuk,28-Mar-72,Mar-28-1972,3/28/72,3/28/72,1972,3,28,Mar
8467352,Vitaly,Vishnevski,18-Mar-80,Mar-18-1980,3/18/80,3/18/80,1980,3,18,Mar
8458595,Alexei,Zhitnik,10-Oct-72,Oct-10-1972,10/10/72,10/10/72,1972,10,10,Oct
8460704,Johan,Hedberg,5-May-73,May-5-1973,5/5/73,5/5/73,1973,5,5,May
8469474,Colby,Armstrong,23-Nov-82,Nov-23-1982,11/23/82,11/23/82,1982,11,23,Nov
8470299,Erik,Christensen,17-Dec-83,Dec-17-1983,12/17/83,12/17/83,1983,12,17,Dec
8470937,Kevin,Doell,15-Jul-79,Jul-15-1979,7/15/79,7/15/79,1979,7,15,Jul
8471778,Jordan,Lavallee-Smotherman,11-May-86,May-11-1986,5/11/86,5/11/86,1986,5,11,May
8473412,Bryan,Little,12-Nov-87,Nov-12-1987,11/12/87,11/12/87,1987,11,12,Nov
8466399,Eric,Perrin,1-Nov-75,Nov-1-1975,11/1/75,11/1/75,1975,11,1,Nov
8450725,Mark,Recchi,1-Feb-68,Feb-1-1968,2/1/68,2/1/68,1968,2,1,Feb
8470737,Brett,Sterling,24-Apr-84,Apr-24-1984,4/24/84,4/24/84,1984,4,24,Apr
8469582,Colin,Stuart,8-Jul-82,Jul-8-1982,7/8/82,7/8/82,1982,7,8,Jul
8469501,Chris,Thorburn,3-Jun-83,Jun-3-1983,6/3/83,6/3/83,1983,6,3,Jun
8466392,Todd,White,21-May-75,May-21-1975,5/21/75,5/21/75,1975,5,21,May
8470828,Toby,Enstrom,5-Nov-84,Nov-5-1984,11/5/84,11/5/84,1984,11,5,Nov
8456850,Ken,Klee,24-Apr-71,Apr-24-1971,4/24/71,4/24/71,1971,4,24,Apr
8465168,Joel,Kwiatkowski,22-Mar-77,Mar-22-1977,3/22/77,3/22/77,1977,3,22,Mar
8471223,Boris,Valabik,14-Feb-86,Feb-14-1986,2/14/86,2/14/86,1986,2,14,Feb
8471715,Ondrej,Pavelec,31-Aug-87,Aug-31-1987,8/31/87,8/31/87,1987,8,31,Aug
8470156,Joey,Crabb,3-Apr-83,Apr-3-1983,4/3/83,4/3/83,1983,4,3,Apr
8474146,Spencer,Machacek,14-Oct-88,Oct-14-1988,10/14/88,10/14/88,1988,10,14,Oct
8470564,Joe,Motzko,14-Mar-80,Mar-14-1980,3/14/80,3/14/80,1980,3,14,Mar
8471514,Rich,Peverley,8-Jul-82,Jul-8-1982,7/8/82,7/8/82,1982,7,8,Jul
8464967,Marty,Reasoner,26-Feb-77,Feb-26-1977,2/26/77,2/26/77,1977,2,26,Feb
8468789,Jason,Williams,11-Aug-80,Aug-11-1980,8/11/80,8/11/80,1980,8,11,Aug
8474567,Zach,Bogosian,15-Jul-90,Jul-15-1990,7/15/90,7/15/90,1990,7,15,Jul
8468493,Ron,Hainsey,24-Mar-81,Mar-24-1981,3/24/81,3/24/81,1981,3,24,Mar
8471288,Scott,Lehman,5-Jan-86,Jan-5-1986,1/5/86,1/5/86,1986,1,5,Jan
8471253,Grant,Lewis,20-Jan-85,Jan-20-1985,1/20/85,1/20/85,1985,1,20,Jan
8470136,Nathan,Oystrick,17-Dec-82,Dec-17-1982,12/17/82,12/17/82,1982,12,17,Dec
8474557,Anssi,Salmela,13-Aug-84,Aug-13-1984,8/13/84,8/13/84,1984,8,13,Aug
8451224,Mathieu,Schneider,12-Jun-69,Jun-12-1969,6/12/69,6/12/69,1969,6,12,Jun
8472262,Clay,Wilson,5-Apr-83,Apr-5-1983,4/5/83,4/5/83,1983,4,5,Apr
8466202,Maxim,Afinogenov,4-Sep-79,Sep-4-1979,9/4/79,9/4/79,1979,9,4,Sep
8467353,Nik,Antropov,18-Feb-80,Feb-18-1980,2/18/80,2/18/80,1980,2,18,Feb
8469543,Evgeny,Artyukhin,4-Apr-83,Apr-4-1983,4/4/83,4/4/83,1983,4,4,Apr
8471697,Niclas,Bergfors,7-Mar-87,Mar-7-1987,3/7/87,3/7/87,1987,3,7,Mar
8475169,Evander,Kane,2-Aug-91,Aug-2-1991,8/2/91,8/2/91,1991,8,2,Aug
8470667,Clarke,MacArthur,6-Apr-85,Apr-6-1985,4/6/85,4/6/85,1985,4,6,Apr
8472379,Tim,Stapleton,19-Jul-82,Jul-19-1982,7/19/82,7/19/82,1982,7,19,Jul
8446053,Chris,Chelios,25-Jan-62,Jan-25-1962,1/25/62,1/25/62,1962,1,25,Jan
8465210,Pavel,Kubina,15-Apr-77,Apr-15-1977,4/15/77,4/15/77,1977,4,15,Apr
8473459,Arturs,Kulda,25-Jul-88,Jul-25-1988,7/25/88,7/25/88,1988,7,25,Jul
8469665,Johnny,Oduya,1-Oct-81,Oct-1-1981,10/1/81,10/1/81,1981,10,1,Oct
8469575,Christoph,Schubert,5-Feb-82,Feb-5-1982,2/5/82,2/5/82,1982,2,5,Feb
8475788,Alexander,Burmistrov,21-Oct-91,Oct-21-1991,10/21/91,10/21/91,1991,10,21,Oct
8474616,Patrice,Cormier,14-Jun-90,Jun-14-1990,6/14/90,6/14/90,1990,6,14,Jun
8470741,Nigel,Dawes,9-Feb-85,Feb-9-1985,2/9/85,2/9/85,1985,2,9,Feb
8462041,Radek,Dvorak,9-Mar-77,Mar-9-1977,3/9/77,3/9/77,1977,3,9,Mar
8470280,Ben,Eager,22-Jan-84,Jan-22-1984,1/22/84,1/22/84,1984,1,22,Jan
8475159,Carl,Klingberg,28-Jan-91,Jan-28-1991,1/28/91,1/28/91,1991,1,28,Jan
8471217,Andrew,Ladd,12-Dec-85,Dec-12-1985,12/12/85,12/12/85,1985,12,12,Dec
8473493,Ben,Maxwell,30-Mar-88,Mar-30-1988,3/30/88,3/30/88,1988,3,30,Mar
8460556,Freddy,Modin,8-Oct-74,Oct-8-1974,10/8/74,10/8/74,1974,10,8,Oct
8470321,Patrick,Rissmiller,26-Oct-78,Oct-26-1978,10/26/78,10/26/78,1978,10,26,Oct
8471238,Rob,Schremp,1-Jul-86,Jul-1-1986,7/1/86,7/1/86,1986,7,1,Jul
8470618,Anthony,Stewart,5-Jan-85,Jan-5-1985,1/5/85,1/5/85,1985,1,5,Jan
8471218,Blake,Wheeler,31-Aug-86,Aug-31-1986,8/31/86,8/31/86,1986,8,31,Aug
8470834,Dustin,Byfuglien,27-Mar-85,Mar-27-1985,3/27/85,3/27/85,1985,3,27,Mar
8470578,Freddy,Meyer,4-Jan-81,Jan-4-1981,1/4/81,1/4/81,1981,1,4,Jan
8474074,Paul,Postma,22-Feb-89,Feb-22-1989,2/22/89,2/22/89,1989,2,22,Feb
8462176,Brent,Sopel,7-Jan-77,Jan-7-1977,1/7/77,1/7/77,1977,1,7,Jan
8470614,Mark,Stuart,27-Apr-84,Apr-27-1984,4/27/84,4/27/84,1984,4,27,Apr
8469505,Noah,Welch,26-Aug-82,Aug-26-1982,8/26/82,8/26/82,1982,8,26,Aug
8471848,Andrey,Zubarev,3-Mar-87,Mar-3-1987,3/3/87,3/3/87,1987,3,3,Mar
8474771,Peter,Mannino,17-Feb-84,Feb-17-1984,2/17/84,2/17/84,1984,2,17,Feb
8462152,Chris,Mason,20-Apr-76,Apr-20-1976,4/20/76,4/20/76,1976,4,20,Apr
8444912,Steve,Alley,29-Dec-53,Dec-29-1953,12/29/53,12/29/53,1953,12,29,Dec
8444913,Ray,Allison,4-Mar-59,Mar-4-1959,3/4/59,3/4/59,1959,3,4,Mar
8445015,Mike,Antonovich,18-Oct-51,Oct-18-1951,10/18/51,10/18/51,1951,10,18,Oct
8445414,Bill,Bennett,31-May-53,May-31-1953,5/31/53,5/31/53,1953,5,31,May
8445618,Pat,Boutette,1-Mar-52,Mar-1-1952,3/1/52,3/1/52,1952,3,1,Mar
8445723,Jeff,Brubaker,24-Feb-58,Feb-24-1958,2/24/58,2/24/58,1958,2,24,Feb
8445981,Greg,Carroll,10-Oct-56,Oct-10-1956,10/10/56,10/10/56,1956,10,10,Oct
8446355,Dave,Debol,27-Mar-56,Mar-27-1956,3/27/56,3/27/56,1956,3,27,Mar
8446469,Jordy,Douglas,20-Jan-58,Jan-20-1958,1/20/58,1/20/58,1958,1,20,Jan
8446940,Nick,Fotiu,25-May-52,May-25-1952,5/25/52,5/25/52,1952,5,25,May
8447508,Al,Hangsleben,22-Feb-53,Feb-22-1953,2/22/53,2/22/53,1953,2,22,Feb
8447821,Brian,Hill,1-Dec-57,Dec-1-1957,12/1/57,12/1/57,1957,12,1,Dec
8448000,Gordie,Howe,31-Mar-28,Mar-31-1928,3/31/28,3/31/28,1928,3,31,Mar
8448108,Bobby,Hull,3-Jan-39,Jan-3-1939,1/3/39,1/3/39,1939,1,3,Jan
8448327,Bernie,Johnston,15-Sep-56,Sep-15-1956,9/15/56,9/15/56,1956,9,15,Sep
8448468,Dave,Keon,22-Mar-40,Mar-22-1940,3/22/40,3/22/40,1940,3,22,Mar
8448612,Andre,Lacroix,5-Jun-45,Jun-5-1945,6/5/45,6/5/45,1945,6,5,Jun
8449860,Ray,Neufeld,15-Apr-59,Apr-15-1959,4/15/59,4/15/59,1959,4,15,Apr
8450981,Mike,Rogers,24-Oct-54,Oct-24-1954,10/24/54,10/24/54,1954,10,24,Oct
8451028,Tom,Rowe,23-May-56,May-23-1956,5/23/56,5/23/56,1956,5,23,May
8451145,Jean,Savard,26-Apr-57,Apr-26-1957,4/26/57,4/26/57,1957,4,26,Apr
8451244,Maynard,Schurman,16-Jul-57,Jul-16-1957,7/16/57,7/16/57,1957,7,16,Jul
8451324,Timothy,Sheehy,3-Sep-48,Sep-3-1948,9/3/48,9/3/48,1948,9,3,Sep
8451696,Robert,Stephenson,1-Feb-54,Feb-1-1954,2/1/54,2/1/54,1954,2,1,Feb
8451770,Blaine,Stoughton,13-Mar-53,Mar-13-1953,3/13/53,3/13/53,1953,3,13,Mar
8452294,James,Warner,26-Mar-54,Mar-26-1954,3/26/54,3/26/54,1954,3,26,Mar
8447209,Larry,Giroux,28-Aug-51,Aug-28-1951,8/28/51,8/28/51,1951,8,28,Aug
8447911,Rick,Hodgson,23-May-56,May-23-1956,5/23/56,5/23/56,1956,5,23,May
8448002,Mark,Howe,28-May-55,May-28-1955,5/28/55,5/28/55,1955,5,28,May
8448005,Marty,Howe,18-Feb-54,Feb-18-1954,2/18/54,2/18/54,1954,2,18,Feb
8448838,Rick,Ley,2-Nov-48,Nov-2-1948,11/2/48,11/2/48,1948,11,2,Nov
8448906,Charles,Luksa,19-Feb-54,Feb-19-1954,2/19/54,2/19/54,1954,2,19,Feb
8450478,Ronald,Plumb,17-Jul-50,Jul-17-1950,7/17/50,7/17/50,1950,7,17,Jul
8450798,Mark,Renaud,21-Feb-59,Feb-21-1959,2/21/59,2/21/59,1959,2,21,Feb
8450905,Gordie,Roberts,2-Oct-57,Oct-2-1957,10/2/57,10/2/57,1957,10,2,Oct
8451364,Al,Sims,18-Apr-53,Apr-18-1953,4/18/53,4/18/53,1953,4,18,Apr
8451561,Stuart,Smith,17-Mar-60,Mar-17-1960,3/17/60,3/17/60,1960,3,17,Mar
8447066,John,Garrett,17-Jun-51,Jun-17-1951,6/17/51,6/17/51,1951,6,17,Jun
8451474,Al,Smith,10-Nov-45,Nov-10-1945,11/10/45,11/10/45,1945,11,10,Nov
8446819,Mike,Fidler,19-Aug-56,Aug-19-1956,8/19/56,8/19/56,1956,8,19,Aug
8447000,Michel,Galarneau,1-Mar-61,Mar-1-1961,3/1/61,3/1/61,1961,3,1,Mar
8449535,Rick,Meagher,2-Nov-53,Nov-2-1953,11/2/53,11/2/53,1953,11,2,Nov
8449629,Warren,Miller,15-Jun-54,Jun-15-1954,6/15/54,6/15/54,1954,6,15,Jun
8449789,Don,Nachbaur,30-Jan-59,Jan-30-1959,1/30/59,1/30/59,1959,1,30,Jan
8444892,Thommy,Abrahamsson,12-Apr-47,Apr-12-1947,4/12/47,4/12/47,1947,4,12,Apr
8445090,Fred,Arthur,6-Mar-61,Mar-6-1961,3/6/61,3/6/61,1961,3,6,Mar
8445270,Norm,Barnes,24-Aug-53,Aug-24-1953,8/24/53,8/24/53,1953,8,24,Aug
8448447,Kevin,Kemp,3-May-54,May-3-1954,5/3/54,5/3/54,1954,5,3,May
8448905,Gilles,Lupien,20-Apr-54,Apr-20-1954,4/20/54,4/20/54,1954,4,20,Apr
8449436,Jack,McIlhargey,7-Mar-52,Mar-7-1952,3/7/52,3/7/52,1952,3,7,Mar
8452235,Mickey,Volcan,3-Mar-62,Mar-3-1962,3/3/62,3/3/62,1962,3,3,Mar
8447927,Ken,Holland,10-Nov-55,Nov-10-1955,11/10/55,11/10/55,1955,11,10,Nov
8452205,Mike,Veisor,25-Aug-52,Aug-25-1952,8/25/52,8/25/52,1952,8,25,Aug
8445628,Dan,Bourbonnais,6-Mar-62,Mar-6-1962,3/6/62,3/6/62,1962,3,6,Mar
8446951,Ron,Francis,1-Mar-63,Mar-1-1963,3/1/63,3/1/63,1963,3,1,Mar
8446977,Dan,Fridgen,18-May-59,May-18-1959,5/18/59,5/18/59,1959,5,18,May
8447188,Don,Gillen,24-Dec-60,Dec-24-1960,12/24/60,12/24/60,1960,12,24,Dec
8447995,Garry,Howatt,26-Sep-52,Sep-26-1952,9/26/52,9/26/52,1952,9,26,Sep
8448707,Pierre,Larouche,16-Nov-55,Nov-16-1955,11/16/55,11/16/55,1955,11,16,Nov
8448914,George,Lyle,24-Nov-53,Nov-24-1953,11/24/53,11/24/53,1953,11,24,Nov
8448919,Paul,Macdermid,14-Apr-63,Apr-14-1963,4/14/63,4/14/63,1963,4,14,Apr
8448952,Randy,MacGregor,9-Jul-53,Jul-9-1953,7/9/53,7/9/53,1953,7,9,Jul
8448982,Rick,MacLeish,3-Jan-50,Jan-3-1950,1/3/50,1/3/50,1950,1,3,Jan
8449353,Rob,McClanahan,9-Jan-58,Jan-9-1958,1/9/58,1/9/58,1958,1,9,Jan
8449416,Mike,McDougall,30-Apr-58,Apr-30-1958,4/30/58,4/30/58,1958,4,30,Apr
8449565,Glenn,Merkosky,8-Apr-60,Apr-8-1960,4/8/60,4/8/60,1960,4,8,Apr
8451778,Doug,Sulliman,29-Aug-59,Aug-29-1959,8/29/59,8/29/59,1959,8,29,Aug
8444961,Russ,Anderson,12-Feb-55,Feb-12-1955,2/12/55,2/12/55,1955,2,12,Feb
8445715,Jeff,Brownschidle,1-Mar-59,Mar-1-1959,3/1/59,3/1/59,1959,3,1,Mar
8448529,Chris,Kotsopoulos,27-Nov-58,Nov-27-1958,11/27/58,11/27/58,1958,11,27,Nov
8449418,Girard,McDonald,18-Mar-58,Mar-18-1958,3/18/58,3/18/58,1958,3,18,Mar
8451352,Paul,Shmyr,28-Jan-46,Jan-28-1946,1/28/46,1/28/46,1946,1,28,Jan
8452370,Blake,Wesley,10-Jul-59,Jul-10-1959,7/10/59,7/10/59,1959,7,10,Jul
8449627,Greg,Millen,25-Jun-57,Jun-25-1957,6/25/57,6/25/57,1957,6,25,Jun
8444898,Greg,Adams,31-May-60,May-31-1960,5/31/60,5/31/60,1960,5,31,May
8447180,Randy,Gilhen,13-Jun-63,Jun-13-1963,6/13/63,6/13/63,1963,6,13,Jun
8447733,Archie,Henderson,17-Feb-57,Feb-17-1957,2/17/57,2/17/57,1957,2,17,Feb
8447917,Mike,Hoffman,26-Feb-63,Feb-26-1963,2/26/63,2/26/63,1963,2,26,Feb
8448304,Mark,Johnson,22-Sep-57,Sep-22-1957,9/22/57,9/22/57,1957,9,22,Sep
8448691,Paul,Lawless,2-Jul-64,Jul-2-1964,7/2/64,7/2/64,1964,7,2,Jul
8449100,Merlin,Malinowski,27-Sep-58,Sep-27-1958,9/27/58,9/27/58,1958,9,27,Sep
8449230,Paul,Marshall,7-Sep-60,Sep-7-1960,9/7/60,9/7/60,1960,9,7,Sep
8451782,Robert,Sullivan,29-Nov-57,Nov-29-1957,11/29/57,11/29/57,1957,11,29,Nov
8447980,Ed,Hospodar,9-Feb-59,Feb-9-1959,2/9/59,2/9/59,1959,2,9,Feb
8448615,Pierre,Lacroix,11-Apr-59,Apr-11-1959,4/11/59,4/11/59,1959,4,11,Apr
8450219,Mark,Paterson,22-Feb-64,Feb-22-1964,2/22/64,2/22/64,1964,2,22,Feb
8451362,Risto,Siltanen,31-Oct-58,Oct-31-1958,10/31/58,10/31/58,1958,10,31,Oct
8446219,Bob,Crawford,6-Apr-59,Apr-6-1959,4/6/59,4/6/59,1959,4,6,Apr
8446237,Mike,Crombeen,16-Apr-57,Apr-16-1957,4/16/57,4/16/57,1957,4,16,Apr
8446279,Tony,Currie,12-Nov-57,Nov-12-1957,11/12/57,11/12/57,1957,11,12,Nov
8446535,Norm,Dupont,5-Feb-57,Feb-5-1957,2/5/57,2/5/57,1957,2,5,Feb
8449101,Greg,Malone,8-Mar-56,Mar-8-1956,3/8/56,3/8/56,1956,3,8,Mar
8450384,Randy,Pierce,23-Nov-57,Nov-23-1957,11/23/57,11/23/57,1957,11,23,Nov
8450920,Torrie,Robertson,2-Aug-61,Aug-2-1961,8/2/61,8/2/61,1961,8,2,Aug
8451771,Steve,Stoyanovich,2-May-57,May-2-1957,5/2/57,5/2/57,1957,5,2,May
8451911,Dave,Tippett,25-Aug-61,Aug-25-1961,8/25/61,8/25/61,1961,8,25,Aug
8451988,Sylvain,Turgeon,17-Jan-65,Jan-17-1965,1/17/65,1/17/65,1965,1,17,Jan
8452555,Richard,Yates,18-Jun-59,Jun-18-1959,6/18/59,6/18/59,1959,6,18,Jun
8452694,Mike,Zuke,16-Apr-54,Apr-16-1954,4/16/54,4/16/54,1954,4,16,Apr
8445211,Reid,Bailey,28-May-56,May-28-1956,5/28/56,5/28/56,1956,5,28,May
8445719,Jack,Brownschidle,2-Oct-55,Oct-2-1955,10/2/55,10/2/55,1955,10,2,Oct
8446533,Richie,Dunn,12-May-57,May-12-1957,5/12/57,5/12/57,1957,5,12,May
8446985,Mark,Fusco,12-Mar-61,Mar-12-1961,3/12/61,3/12/61,1961,3,12,Mar
8447757,Bob,Hess,19-May-55,May-19-1955,5/19/55,5/19/55,1955,5,19,May
8450633,Joel,Quenneville,15-Sep-58,Sep-15-1958,9/15/58,9/15/58,1958,9,15,Sep
8451655,Ed,Staniowski,7-Jul-55,Jul-7-1955,7/7/55,7/7/55,1955,7,7,Jul
8446423,Kevin,Dineen,28-Oct-63,Oct-28-1963,10/28/63,10/28/63,1963,10,28,Oct
8446743,Dean,Evason,22-Aug-64,Aug-22-1964,8/22/64,8/22/64,1964,8,22,Aug
8446797,Paul,Fenton,22-Dec-59,Dec-22-1959,12/22/59,12/22/59,1959,12,22,Dec
8448272,David,Jensen,19-Aug-65,Aug-19-1965,8/19/65,8/19/65,1965,8,19,Aug
8448516,Scot,Kleinendorst,16-Jan-60,Jan-16-1960,1/16/60,1/16/60,1960,1,16,Jan
8448901,Dave,Lumley,1-Sep-54,Sep-1-1954,9/1/54,9/1/54,1954,9,1,Sep
8452367,Wally,Weir,3-Jun-54,Jun-3-1954,6/3/54,6/3/54,1954,6,3,Jun
8446181,Sylvain,Cote,19-Jan-66,Jan-19-1966,1/19/66,1/19/66,1966,1,19,Jan
8451107,Ulf,Samuelsson,26-Mar-64,Mar-26-1964,3/26/64,3/26/64,1964,3,26,Mar
8448865,Mike,Liut,7-Jan-56,Jan-7-1956,1/7/56,1/7/56,1956,1,7,Jan
8452355,Steve,Weeks,30-Jun-58,Jun-30-1958,6/30/58,6/30/58,1958,6,30,Jun
8444944,John,Anderson,28-Mar-57,Mar-28-1957,3/28/57,3/28/57,1957,3,28,Mar
8445207,Wayne,Babych,6-Jun-58,Jun-6-1958,6/6/58,6/6/58,1958,6,6,Jun
8447039,Bill,Gardner,18-Mar-60,Mar-18-1960,3/18/60,3/18/60,1960,3,18,Mar
8447078,Stew,Gavin,15-Mar-60,Mar-15-1960,3/15/60,3/15/60,1960,3,15,Mar
8448254,Doug,Jarvis,24-Mar-55,Mar-24-1955,3/24/55,3/24/55,1955,3,24,Mar
8449871,John,Newberry,8-Apr-62,Apr-8-1962,4/8/62,4/8/62,1962,4,8,Apr
8450345,Jorgen,Pettersson,11-Jul-56,Jul-11-1956,7/11/56,7/11/56,1956,7,11,Jul
8445208,Dave,Babych,23-May-61,May-23-1961,5/23/61,5/23/61,1961,5,23,May
8445604,Tim,Bothwell,6-May-55,May-6-1955,5/6/55,5/6/55,1955,5,6,May
8449420,Mike,McEwen,10-Aug-56,Aug-10-1956,8/10/56,8/10/56,1956,8,10,Aug
8449774,Dana,Murzyn,9-Dec-66,Dec-9-1966,12/9/66,12/9/66,1966,12,9,Dec
8451305,Brad,Shaw,28-Apr-64,Apr-28-1964,4/28/64,4/28/64,1964,4,28,Apr
8445273,Dave,Barr,30-Nov-60,Nov-30-1960,11/30/60,11/30/60,1960,11,30,Nov
8445682,Greg,Britz,1-Mar-61,Mar-1-1961,3/1/61,3/1/61,1961,3,1,Mar
8446071,Shane,Churla,24-Jun-65,Jun-24-1965,6/24/65,6/24/65,1965,6,24,Jun
8446203,Yves,Courteau,25-Apr-64,Apr-25-1964,4/25/64,4/25/64,1964,4,25,Apr
8448075,Pat,Hughes,25-Mar-55,Mar-25-1955,3/25/55,3/25/55,1955,3,25,Mar
8449610,Mike,Millar,28-Apr-65,Apr-28-1965,4/28/65,4/28/65,1965,4,28,Apr
8451298,Dave,Semenko,12-Jul-57,Jul-12-1957,7/12/57,7/12/57,1957,7,12,Jul
8451346,Gord,Sherven,21-Aug-63,Aug-21-1963,8/21/63,8/21/63,1963,8,21,Aug
8448616,Randy,Ladouceur,30-Jun-60,Jun-30-1960,6/30/60,6/30/60,1960,6,30,Jun
8446007,Lindsay,Carson,21-Nov-60,Nov-21-1960,11/21/60,11/21/60,1960,11,21,Nov
8449280,Tom,Martin,11-May-64,May-11-1964,5/11/64,5/11/64,1964,5,11,May
8450341,Brent,Peterson,15-Feb-58,Feb-15-1958,2/15/58,2/15/58,1958,2,15,Feb
8450741,Mark,Reeds,24-Jan-60,Jan-24-1960,1/24/60,1/24/60,1960,1,24,Jan
8452457,Dave,Williams,3-Feb-54,Feb-3-1954,2/3/54,2/3/54,1954,2,3,Feb
8452482,Carey,Wilson,19-May-62,May-19-1962,5/19/62,5/19/62,1962,5,19,May
8452569,Scott,Young,1-Oct-67,Oct-1-1967,10/1/67,10/1/67,1967,10,1,Oct
8445623,Charlie,Bourgeois,19-Nov-59,Nov-19-1959,11/19/59,11/19/59,1959,11,19,Nov
8451319,Neil,Sheehy,9-Feb-60,Feb-9-1960,2/9/60,2/9/60,1960,2,9,Feb
8452207,Mike,Vellucci,11-Aug-66,Aug-11-1966,8/11/66,8/11/66,1966,8,11,Aug
8445694,Richard,Brodeur,15-Sep-52,Sep-15-1952,9/15/52,9/15/52,1952,9,15,Sep
8451369,Peter,Sidorkiewicz,29-Jun-63,Jun-29-1963,6/29/63,6/29/63,1963,6,29,Jun
8447072,Dallas,Gaume,27-Aug-63,Aug-27-1963,8/27/63,8/27/63,1963,8,27,Aug
8448092,Jody,Hull,2-Feb-69,Feb-2-1969,2/2/69,2/2/69,1969,2,2,Feb
8448413,Ed,Kastelic,29-Jan-64,Jan-29-1964,1/29/64,1/29/64,1964,1,29,Jan
8448689,Brian,Lawton,29-Jun-65,Jun-29-1965,6/29/65,6/29/65,1965,6,29,Jun
8449102,Don,Maloney,5-Sep-58,Sep-5-1958,9/5/58,9/5/58,1958,9,5,Sep
8451914,Jim,Thomson,30-Dec-65,Dec-30-1965,12/30/65,12/30/65,1965,12,30,Dec
8452557,Terry,Yake,22-Oct-68,Oct-22-1968,10/22/68,10/22/68,1968,10,22,Oct
8448271,Grant,Jennings,5-May-65,May-5-1965,5/5/65,5/5/65,1965,5,5,May
8448961,Norm,MacIver,1-Sep-64,Sep-1-1964,9/1/64,9/1/64,1964,9,1,Sep
8450257,Jim,Pavese,8-Jun-62,Jun-8-1962,6/8/62,6/8/62,1962,6,8,Jun
8451983,Allan,Tuer,19-Jul-63,Jul-19-1963,7/19/63,7/19/63,1963,7,19,Jul
8452440,Kay,Whitmore,10-Apr-67,Apr-10-1967,4/10/67,4/10/67,1967,4,10,Apr
8444963,Mikael,Andersson,10-May-66,May-10-1966,5/10/66,5/10/66,1966,5,10,May
8445493,James,Black,15-Aug-69,Aug-15-1969,8/15/69,8/15/69,1969,8,15,Aug
8445567,Bob,Bodak,28-May-61,May-28-1961,5/28/61,5/28/61,1961,5,28,May
8446163,Yvon,Corriveau,8-Feb-67,Feb-8-1967,2/8/67,2/8/67,1967,2,8,Feb
8446261,Randy,Cunneyworth,10-May-61,May-10-1961,5/10/61,5/10/61,1961,5,10,May
8446527,Steve,Dykstra,1-Dec-62,Dec-1-1962,12/1/62,12/1/62,1962,12,1,Dec
8447313,Christopher,Govedaris,2-Feb-70,Feb-2-1970,2/2/70,2/2/70,1970,2,2,Feb
8448549,Todd,Krygier,12-Oct-65,Oct-12-1965,10/12/65,10/12/65,1965,10,12,Oct
8449477,Jim,McKenzie,3-Nov-69,Nov-3-1969,11/3/69,11/3/69,1969,11,3,Nov
8451863,Mike,Tomlak,17-Oct-64,Oct-17-1964,10/17/64,10/17/64,1964,10,17,Oct
8452216,Pat,Verbeek,24-May-64,May-24-1964,5/24/64,5/24/64,1964,5,24,May
8446257,Jim,Culhane,13-Mar-65,Mar-13-1965,3/13/65,3/13/65,1965,3,13,Mar
8448623,Marc,Laforge,3-Jan-68,Jan-3-1968,1/3/68,1/3/68,1968,1,3,Jan
8445689,Rob,Brown,10-Apr-68,Apr-10-1968,4/10/68,4/10/68,1968,4,10,Apr
8446251,John,Cullen,2-Aug-64,Aug-2-1964,8/2/64,8/2/64,1964,8,2,Aug
8446264,Paul,Cyr,31-Oct-63,Oct-31-1963,10/31/63,10/31/63,1963,10,31,Oct
8447383,Mark,Greig,25-Jan-70,Jan-25-1970,1/25/70,1/25/70,1970,1,25,Jan
8448106,Mark,Hunter,12-Nov-62,Nov-12-1962,11/12/62,11/12/62,1962,11,12,Nov
8450199,Jeff,Parker,7-Sep-64,Sep-7-1964,9/7/64,9/7/64,1964,9,7,Sep
8450357,Michel,Picard,7-Nov-69,Nov-7-1969,11/7/69,11/7/69,1969,11,7,Nov
8457921,Geoff,Sanderson,1-Feb-72,Feb-1-1972,2/1/72,2/1/72,1972,2,1,Feb
8451849,Chris,Tancill,7-Feb-68,Feb-7-1968,2/7/68,2/7/68,1968,2,7,Feb
8445195,Jergus,Baca,1-Apr-65,Apr-1-1965,4/1/65,4/1/65,1965,4,1,Apr
8445428,Marc,Bergevin,11-Aug-65,Aug-11-1965,8/11/65,8/11/65,1965,8,11,Aug
8455833,Brian,Chapman,10-Feb-68,Feb-10-1968,2/10/68,2/10/68,1968,2,10,Feb
8446238,Doug,Crossman,13-Jun-60,Jun-13-1960,6/13/60,6/13/60,1960,6,13,Jun
8447981,Doug,Houda,3-Jun-66,Jun-3-1966,6/3/66,6/3/66,1966,6,3,Jun
8457800,Todd,Richards,20-Oct-66,Oct-20-1966,10/20/66,10/20/66,1966,10,20,Oct
8451710,John,Stevens,4-May-66,May-4-1966,5/4/66,5/4/66,1966,5,4,May
8452584,Zarley,Zalapski,22-Apr-68,Apr-22-1968,4/22/68,4/22/68,1968,4,22,Apr
8449451,Ross,Mckay,3-Mar-64,Mar-3-1964,3/3/64,3/3/64,1964,3,3,Mar
8450702,Daryl,Reaugh,13-Feb-65,Feb-13-1965,2/13/65,2/13/65,1965,2,13,Feb
8446003,Andrew,Cassels,23-Jul-69,Jul-23-1969,7/23/69,7/23/69,1969,7,23,Jul
8446217,Murray,Craven,20-Jul-64,Jul-20-1964,7/20/64,7/20/64,1964,7,20,Jul
8456023,Joseph,Day,11-May-68,May-11-1968,5/11/68,5/11/68,1968,5,11,May
8447192,Paul,Gillis,31-Dec-63,Dec-31-1963,12/31/63,12/31/63,1963,12,31,Dec
8450271,Barry,Pederson,13-Mar-61,Mar-13-1961,3/13/61,3/13/61,1961,3,13,Mar
8458523,Patrick,Poulin,23-Apr-73,Apr-23-1973,4/23/73,4/23/73,1973,4,23,Apr
8451331,Daniel,Shank,12-May-67,May-12-1967,5/12/67,5/12/67,1967,5,12,May
8448419,Dan,Keczmer,25-May-68,May-25-1968,5/25/68,5/25/68,1968,5,25,May
8448521,Steve,Konroyd,10-Feb-61,Feb-10-1961,2/10/61,2/10/61,1961,2,10,Feb
8449905,Lee,Norwood,2-Feb-60,Feb-2-1960,2/2/60,2/2/60,1960,2,2,Feb
8450390,Frank,Pietrangelo,17-Dec-64,Dec-17-1964,12/17/64,12/17/64,1964,12,17,Dec
8456009,Scott,Daniels,19-Sep-69,Sep-19-1969,9/19/69,9/19/69,1969,9,19,Sep
8448225,Mark,Janssens,19-May-68,May-19-1968,5/19/68,5/19/68,1968,5,19,May
8448471,Tim,Kerr,5-Jan-60,Jan-5-1960,1/5/60,1/5/60,1960,1,5,Jan
8448542,Robert,Kron,27-Feb-67,Feb-27-1967,2/27/67,2/27/67,1967,2,27,Feb
8448539,Nick,Kypreos,4-Jun-66,Jun-4-1966,6/4/66,6/4/66,1966,6,4,Jun
8448771,Jamie,Leach,25-Aug-69,Aug-25-1969,8/25/69,8/25/69,1969,8,25,Aug
8458821,Barry,Nieckar,16-Dec-67,Dec-16-1967,12/16/67,12/16/67,1967,12,16,Dec
8458573,Michael,Nylander,3-Oct-72,Oct-3-1972,10/3/72,10/3/72,1972,10,3,Oct
8458946,Robert,Petrovicky,26-Oct-73,Oct-26-1973,10/26/73,10/26/73,1973,10,26,Oct
8444893,Jim,Agnew,21-Mar-66,Mar-21-1966,3/21/66,3/21/66,1966,3,21,Mar
8450270,Allen,Pedersen,13-Jan-65,Jan-13-1965,1/13/65,1/13/65,1965,1,13,Jan
8452353,Eric,Weinrich,19-Dec-66,Dec-19-1966,12/19/66,12/19/66,1966,12,19,Dec
8445769,Sean,Burke,29-Jan-67,Jan-29-1967,1/29/67,1/29/67,1967,1,29,Jan
8455996,Corrie,D'alessio,9-Sep-69,Sep-9-1969,9/9/69,9/9/69,1969,9,9,Sep
8447303,Mario,Gosselin,15-Jun-63,Jun-15-1963,6/15/63,6/15/63,1963,6,15,Jun
8457049,Mike,Lenarduzzi,14-Sep-72,Sep-14-1972,9/14/72,9/14/72,1972,9,14,Sep
8459363,Igor,Chibirev,19-Apr-68,Apr-19-1968,4/19/68,4/19/68,1968,4,19,Apr
8456118,Ted,Drury,13-Sep-71,Sep-13-1971,9/13/71,9/13/71,1971,9,13,Sep
8456513,Todd,Harkins,8-Oct-68,Oct-8-1968,10/8/68,10/8/68,1968,10,8,Oct
8448781,Jocelyn,Lemieux,18-Nov-67,Nov-18-1967,11/18/67,11/18/67,1967,11,18,Nov
8450504,Marc,Potvin,29-Jan-67,Jan-29-1967,1/29/67,1/29/67,1967,1,29,Jan
8450595,Brian,Propp,15-Feb-59,Feb-15-1959,2/15/59,2/15/59,1959,2,15,Feb
8450653,Paul,Ranheim,25-Jan-66,Jan-25-1966,1/25/66,1/25/66,1966,1,25,Jan
8451119,Jim,Sandlak,12-Dec-66,Dec-12-1966,12/12/66,12/12/66,1966,12,12,Dec
8459015,Kevin,Smyth,22-Nov-73,Nov-22-1973,11/22/73,11/22/73,1973,11,22,Nov
8458589,Jim,Storm,5-Feb-71,Feb-5-1971,2/5/71,2/5/71,1971,2,5,Feb
8451994,Darren,Turcotte,2-Mar-68,Mar-2-1968,3/2/68,3/2/68,1968,3,2,Mar
8455976,Edward,Crowley,3-May-70,May-3-1970,5/3/70,5/3/70,1970,5,3,May
8447247,Alexander,Godynyuk,27-Jan-70,Jan-27-1970,1/27/70,1/27/70,1970,1,27,Jan
8448543,Frantisek,Kucera,3-Feb-68,Feb-3-1968,2/3/68,2/3/68,1968,2,3,Feb
8449137,Bryan,Marchment,1-May-69,May-1-1969,5/1/69,5/1/69,1969,5,1,May
8449403,Brad,McCrimmon,29-Mar-59,Mar-29-1959,3/29/59,3/29/59,1959,3,29,Mar
8449442,Bob,Mcgill,27-Apr-62,Apr-27-1962,4/27/62,4/27/62,1962,4,27,Apr
8450223,James,Patrick,14-Jun-63,Jun-14-1963,6/14/63,6/14/63,1963,6,14,Jun
8459424,Chris,Pronger,10-Oct-74,Oct-10-1974,10/10/74,10/10/74,1974,10,10,Oct
8450743,Jeff,Reese,24-Mar-66,Mar-24-1966,3/24/66,3/24/66,1966,3,24,Mar
8445979,Jimmy,Carson,20-Jul-68,Jul-20-1968,7/20/68,7/20/68,1968,7,20,Jul
8446125,Kelly,Chase,25-Oct-67,Oct-25-1967,10/25/67,10/25/67,1967,10,25,Oct
8458983,Andrei,Nikolishin,25-Mar-73,Mar-25-1973,3/25/73,3/25/73,1973,3,25,Mar
8450812,Steven,Rice,26-May-71,May-26-1971,5/26/71,5/26/71,1971,5,26,May
8446778,Glen,Featherstone,8-Jul-68,Jul-8-1968,7/8/68,7/8/68,1968,7,8,Jul
8447630,Brian,Glynn,23-Nov-67,Nov-23-1967,11/23/67,11/23/67,1967,11,23,Nov
8459493,Marek,Malik,24-Jun-75,Jun-24-1975,6/24/75,6/24/75,1975,6,24,Jun
8452371,Glen,Wesley,2-Oct-68,Oct-2-1968,10/2/68,10/2/68,1968,10,2,Oct
8462114,Sami,Kapanen,14-Jun-73,Jun-14-1973,6/14/73,6/14/73,1973,6,14,Jun
8460484,Steve,Martins,13-Apr-72,Apr-13-1972,4/13/72,4/13/72,1972,4,13,Apr
8460495,Jeff,O'Neill,23-Feb-76,Feb-23-1976,2/23/76,2/23/76,1976,2,23,Feb
8451302,Brendan,Shanahan,23-Jan-69,Jan-23-1969,1/23/69,1/23/69,1969,1,23,Jan
8445700,Jeff,Brown,30-Apr-66,Apr-30-1966,4/30/66,4/30/66,1966,4,30,Apr
8446417,Gerald,Diduck,6-Apr-65,Apr-6-1965,4/6/65,4/6/65,1965,4,6,Apr
8459017,Jason,Mcbain,12-Apr-74,Apr-12-1974,4/12/74,4/12/74,1974,4,12,Apr
8457463,Jason,Muzzatti,3-Feb-70,Feb-3-1970,2/3/70,2/3/70,1970,2,3,Feb
8459023,Kevin,Brown,11-May-74,May-11-1974,5/11/74,5/11/74,1974,5,11,May
8446305,Jeff,Daniels,24-Jun-68,Jun-24-1968,6/24/68,6/24/68,1968,6,24,Jun
8447386,Stu,Grimson,20-May-65,May-20-1965,5/20/65,5/20/65,1965,5,20,May
8448489,Derek,King,11-Feb-67,Feb-11-1967,2/11/67,2/11/67,1967,2,11,Feb
8457203,Kent,Manderville,12-Apr-71,Apr-12-1971,4/12/71,4/12/71,1971,4,12,Apr
8460545,Chris,Murray,25-Oct-74,Oct-25-1974,10/25/74,10/25/74,1974,10,25,Oct
8450550,Keith,Primeau,24-Nov-71,Nov-24-1971,11/24/71,11/24/71,1971,11,24,Nov
8446051,Steve,Chiasson,14-Apr-67,Apr-14-1967,4/14/67,4/14/67,1967,4,14,Apr
8446117,Paul,Coffey,1-Jun-61,Jun-1-1961,6/1/61,6/1/61,1961,6,1,Jun
8447477,Kevin,Haller,5-Dec-70,Dec-5-1970,12/5/70,12/5/70,1970,12,5,Dec
8448797,Curtis,Leschyshyn,21-Sep-69,Sep-21-1969,9/21/69,9/21/69,1969,9,21,Sep
8459538,Nolan,Pratt,14-Aug-75,Aug-14-1975,8/14/75,8/14/75,1975,8,14,Aug
8462044,Jean-Sebastien,Giguere,16-May-77,May-16-1977,5/16/77,5/16/77,1977,5,16,May
8445007,Dave,Balon,2-Aug-38,Aug-2-1938,8/2/38,8/2/38,1938,8,2,Aug
8445137,Andre,Boudrias,19-Sep-43,Sep-19-1943,9/19/43,9/19/43,1943,9,19,Sep
8445363,Bob,Charlebois,27-May-44,May-27-1944,5/27/44,5/27/44,1944,5,27,May
8445505,Bill,Collins,13-Jul-43,Jul-13-1943,7/13/43,7/13/43,1943,7,13,Jul
8445521,Wayne,Connelly,16-Dec-39,Dec-16-1939,12/16/39,12/16/39,1939,12,16,Dec
8445827,Ray,Cullen,20-Sep-41,Sep-20-1941,9/20/41,9/20/41,1941,9,20,Sep
8446312,Sandy,Fitzpatrick,22-Dec-44,Dec-22-1944,12/22/44,12/22/44,1944,12,22,Dec
8446605,Bill,Goldsworthy,24-Aug-44,Aug-24-1944,8/24/44,8/24/44,1944,8,24,Aug
8446670,Murray,Hall,24-Nov-40,Nov-24-1940,11/24/40,11/24/40,1940,11,24,Nov
8446708,Duke,Harris,25-Feb-42,Feb-25-1942,2/25/42,2/25/42,1942,2,25,Feb
8446918,Bronco,Horvath,12-Mar-30,Mar-12-1930,3/12/30,3/12/30,1930,3,12,Mar
8447527,Len,Lunde,13-Nov-36,Nov-13-1936,11/13/36,11/13/36,1936,11,13,Nov
8447537,Parker,MacDonald,14-Jun-33,Jun-14-1933,6/14/33,6/14/33,1933,6,14,Jun
8447608,Milan,Marcetta,19-Sep-36,Sep-19-1936,9/19/36,9/19/36,1936,9,19,Sep
8447635,Bill,Masterton,13-Aug-38,Aug-13-1938,8/13/38,8/13/38,1938,8,13,Aug
8447695,Ted,McCaskill,29-Oct-36,Oct-29-1936,10/29/36,10/29/36,1936,10,29,Oct
8449440,Walt,McKechnie,19-Jun-47,Jun-19-1947,6/19/47,6/19/47,1947,6,19,Jun
8447834,Barrie,Meissner,26-Jul-46,Jul-26-1946,7/26/46,7/26/46,1946,7,26,Jul
8450196,J.P.,Parise,11-Dec-41,Dec-11-1941,12/11/41,12/11/41,1941,12,11,Dec
8448213,Andre,Pronovost,9-Jul-36,Jul-9-1936,7/9/36,7/9/36,1936,7,9,Jul
8449148,George,Standing,3-Aug-41,Aug-3-1941,8/3/41,8/3/41,1941,8,3,Aug
8451870,Ted,Taylor,25-Feb-42,Feb-25-1942,2/25/42,2/25/42,1942,2,25,Feb
8449227,Leo,Thiffault,16-Dec-44,Dec-16-1944,12/16/44,12/16/44,1944,12,16,Dec
8446601,Pete,Goegan,6-Mar-34,Mar-6-1934,3/6/34,3/6/34,1934,3,6,Mar
8447092,Don,Johns,13-Dec-37,Dec-13-1937,12/13/37,12/13/37,1937,12,13,Dec
8447107,Marshall,Johnston,6-Jun-41,Jun-6-1941,6/6/41,6/6/41,1941,6,6,Jun
8447710,Bob,McCord,30-Mar-34,Mar-30-1934,3/30/34,3/30/34,1934,3,30,Mar
8447807,Mike,McMahon Jr.,30-Aug-41,Aug-30-1941,8/30/41,8/30/41,1941,8,30,Aug
8447974,Lou,Nanne,2-Jun-41,Jun-2-1941,6/2/41,6/2/41,1941,6,2,Jun
8448157,Bill,Plager,6-Jul-45,Jul-6-1945,7/6/45,7/6/45,1945,7,6,Jul
8449214,Jean-Guy,Talbot,11-Jul-32,Jul-11-1932,7/11/32,7/11/32,1932,7,11,Jul
8449303,Moose,Vasko,11-Dec-35,Dec-11-1935,12/11/35,12/11/35,1935,12,11,Dec
8449603,Bob,Woytowich,18-Aug-41,Aug-18-1941,8/18/41,8/18/41,1941,8,18,Aug
8449806,Gary,Bauman,21-Jul-40,Jul-21-1940,7/21/40,7/21/40,1940,7,21,Jul
8450020,Cesare,Maniago,13-Jan-39,Jan-13-1939,1/13/39,1/13/39,1939,1,13,Jan
8450147,Carl,Wetzel,12-Dec-38,Dec-12-1938,12/12/38,12/12/38,1938,12,12,Dec
8445365,Mike,Chernoff,13-May-46,May-13-1946,5/13/46,5/13/46,1946,5,13,May
8445910,Gary,Dineen,24-Dec-43,Dec-24-1943,12/24/43,12/24/43,1943,12,24,Dec
8447352,Danny,Grant,21-Feb-46,Feb-21-1946,2/21/46,2/21/46,1946,2,21,Feb
8447105,Joey,Johnston,3-Mar-49,Mar-3-1949,3/3/49,3/3/49,1949,3,3,Mar
8447330,Claude,Larose,2-Mar-42,Mar-2-1942,3/2/42,3/2/42,1942,3,2,Mar
8448730,Danny,Lawson,30-Oct-47,Oct-30-1947,10/30/47,10/30/47,1947,10,30,Oct
8448068,Danny,O'Shea,15-Jun-45,Jun-15-1945,6/15/45,6/15/45,1945,6,15,Jun
8448063,Bill,Orban,20-Feb-44,Feb-20-1944,2/20/44,2/20/44,1944,2,20,Feb
8449061,Brian,Smith,6-Sep-40,Sep-6-1940,9/6/40,9/6/40,1940,9,6,Sep
8445111,Leo,Boivin,2-Aug-31,Aug-2-1931,8/2/31,8/2/31,1931,8,2,Aug
8446864,Larry,Hillman,5-Feb-37,Feb-5-1937,2/5/37,2/5/37,1937,2,5,Feb
8446865,Wayne,Hillman,13-Nov-38,Nov-13-1938,11/13/38,11/13/38,1938,11,13,Nov
8447549,Barry,MacKenzie,16-Aug-41,Aug-16-1941,8/16/41,8/16/41,1941,8,16,Aug
8448311,Tom,Reid,24-Jun-46,Jun-24-1946,6/24/46,6/24/46,1946,6,24,Jun
8448606,Duane,Rupp,29-Mar-38,Mar-29-1938,3/29/38,3/29/38,1938,3,29,Mar
8450102,Fern,Rivard,18-Jan-46,Jan-18-1946,1/18/46,1/18/46,1946,1,18,Jan
8445021,Bob,Barlow,17-Jun-35,Jun-17-1935,6/17/35,6/17/35,1935,6,17,Jun
8445289,Charlie,Burns,14-Feb-36,Feb-14-1936,2/14/36,2/14/36,1936,2,14,Feb
8446172,Grant,Erickson,28-Apr-47,Apr-28-1947,4/28/47,4/28/47,1947,4,28,Apr
8449396,Bob,Whitlock,16-Jul-49,Jul-16-1949,7/16/49,7/16/49,1949,7,16,Jul
8449481,Tommy,Williams,17-Apr-40,Apr-17-1940,4/17/40,4/17/40,1940,4,17,Apr
8447154,Barry,Gibbs,28-Sep-48,Sep-28-1948,9/28/48,9/28/48,1948,9,28,Sep
8447873,John,Miszuk,29-Sep-40,Sep-29-1940,9/29/40,9/29/40,1940,9,29,Sep
8448173,Tom,Polanic,2-Apr-43,Apr-2-1943,4/2/43,4/2/43,1943,4,2,Apr
8450737,Dick,Redmond,14-Aug-49,Aug-14-1949,8/14/49,8/14/49,1949,8,14,Aug
8449055,Darryl,Sly,3-Apr-39,Apr-3-1939,4/3/39,4/3/39,1939,4,3,Apr
8449839,Ken,Broderick,16-Feb-42,Feb-16-1942,2/16/42,2/16/42,1942,2,16,Feb
8447170,Gilles,Gilbert,31-Mar-49,Mar-31-1949,3/31/49,3/31/49,1949,3,31,Mar
8450152,Gump,Worsley,14-May-29,May-14-1929,5/14/29,5/14/29,1929,5,14,May
8445038,Norm,Beaudin,28-Nov-41,Nov-28-1941,11/28/41,11/28/41,1941,11,28,Nov
8445304,Terry,Caffery,1-Apr-49,Apr-1-1949,4/1/49,4/1/49,1949,4,1,Apr
8446482,Jude,Drouin,28-Oct-48,Oct-28-1948,10/28/48,10/28/48,1948,10,28,Oct
8447496,Ted,Hampson,11-Dec-36,Dec-11-1936,12/11/36,12/11/36,1936,12,11,Dec
8446729,Buster,Harvey,2-Apr-50,Apr-2-1950,4/2/50,4/2/50,1950,4,2,Apr
8446763,Bill,Heindl,13-May-46,May-13-1946,5/13/46,5/13/46,1946,5,13,May
8447265,Gord,Labossiere,2-Jan-40,Jan-2-1940,1/2/40,1/2/40,1940,1,2,Jan
8447880,Doug,Mohns,13-Dec-33,Dec-13-1933,12/13/33,12/13/33,1933,12,13,Dec
8448056,Murray,Oliver,14-Nov-37,Nov-14-1937,11/14/37,11/14/37,1937,11,14,Nov
8448464,Bobby,Rousseau,26-Jul-40,Jul-26-1940,7/26/40,7/26/40,1940,7,26,Jul
8448950,Dan,Seguin,7-Jun-48,Jun-7-1948,6/7/48,6/7/48,1948,6,7,Jun
8445274,Fred,Barrett,26-Jan-50,Jan-26-1950,1/26/50,1/26/50,1950,1,26,Jan
8446576,Gary,Geldart,14-Jun-50,Jun-14-1950,6/14/50,6/14/50,1950,6,14,Jun
8446717,Ted,Harris,18-Jul-36,Jul-18-1936,7/18/36,7/18/36,1936,7,18,Jul
8447906,Wayne,Muloin,24-Dec-41,Dec-24-1941,12/24/41,12/24/41,1941,12,24,Dec
8448040,Dennis,O'Brien,10-Jun-49,Jun-10-1949,6/10/49,6/10/49,1949,6,10,Jun
8445313,Craig,Cameron,19-Jul-45,Jul-19-1945,7/19/45,7/19/45,1945,7,19,Jul
8446563,Gary,Gambucci,27-Sep-46,Sep-27-1946,9/27/46,9/27/46,1946,9,27,Sep
8447774,Dennis,Hextall,17-Apr-43,Apr-17-1943,4/17/43,4/17/43,1943,4,17,Apr
8448001,Bob,Nevin,18-Mar-38,Mar-18-1938,3/18/38,3/18/38,1938,3,18,Mar
8448191,Dean,Prentice,5-Oct-32,Oct-5-1932,10/5/32,10/5/32,1932,10,5,Oct
8450168,Bob,Paradise,22-Apr-44,Apr-22-1944,4/22/44,4/22/44,1944,4,22,Apr
8445084,Don,Blackburn,14-May-38,May-14-1938,5/14/38,5/14/38,1938,5,14,May
8445820,Jerry,Byers,29-Mar-52,Mar-29-1952,3/29/52,3/29/52,1952,3,29,Mar
8446893,Terry,Holbrook,11-Jul-50,Jul-11-1950,7/11/50,7/11/50,1950,7,11,Jul
8447768,Jim,McElmury,3-Oct-49,Oct-3-1949,10/3/49,10/3/49,1949,10,3,Oct
8447781,Bruce,McIntosh,17-Mar-49,Mar-17-1949,3/17/49,3/17/49,1949,3,17,Mar
8445373,Rick,Chinnick,15-Aug-53,Aug-15-1953,8/15/53,8/15/53,1953,8,15,Aug
8446522,Blake,Dunlop,18-Apr-53,Apr-18-1953,4/18/53,4/18/53,1953,4,18,Apr
8446196,Tony,Featherstone,31-Jul-49,Jul-31-1949,7/31/49,7/31/49,1949,7,31,Jul
8447321,Alain,Langlais,9-Oct-50,Oct-9-1950,10/9/50,10/9/50,1950,10,9,Oct
8448033,Rod,Norrish,27-Nov-51,Nov-27-1951,11/27/51,11/27/51,1951,11,27,Nov
8448433,John,Rogers,10-Apr-53,Apr-10-1953,4/10/53,4/10/53,1953,4,10,Apr
8449149,Fred,Stanfield,4-May-44,May-4-1944,5/4/44,5/4/44,1944,5,4,May
8444865,Chris,Ahrens,31-Jul-52,Jul-31-1952,7/31/52,7/31/52,1952,7,31,Jul
8445070,Gary,Bergman,7-Oct-38,Oct-7-1938,10/7/38,10/7/38,1938,10,7,Oct
8445129,Henry,Boucha,1-Jun-51,Jun-1-1951,6/1/51,6/1/51,1951,6,1,Jun
8455907,Tom,Colley,21-Aug-53,Aug-21-1953,8/21/53,8/21/53,1953,8,21,Aug
8445530,Bob,Cook,6-Jan-46,Jan-6-1946,1/6/46,1/6/46,1946,1,6,Jan
8445807,Dave,Cressman,2-Jan-50,Jan-2-1950,1/2/50,1/2/50,1950,1,2,Jan
8446849,John,Flesch,15-Jul-53,Jul-15-1953,7/15/53,7/15/53,1953,7,15,Jul
8446634,Norm,Gratton,22-Dec-50,Dec-22-1950,12/22/50,12/22/50,1950,12,22,Dec
8447782,Ernie,Hicke,7-Nov-47,Nov-7-1947,11/7/47,11/7/47,1947,11,7,Nov
8447631,Don,Martineau,25-Apr-52,Apr-25-1952,4/25/52,4/25/52,1952,4,25,Apr
8447976,Rich,Nantais,27-Oct-54,Oct-27-1954,10/27/54,10/27/54,1954,10,27,Oct
8448439,Doug,Rombough,8-Jul-50,Jul-8-1950,7/8/50,7/8/50,1950,7,8,Jul
8451851,Dean,Talafous,25-Aug-53,Aug-25-1953,8/25/53,8/25/53,1953,8,25,Aug
8445079,Dwight,Bialowas,8-Sep-52,Sep-8-1952,9/8/52,9/8/52,1952,9,8,Sep
8447801,Doug,Hicks,29-May-55,May-29-1955,5/29/55,5/29/55,1955,5,29,May
8447538,Kim,MacDougall,29-Aug-54,Aug-29-1954,8/29/54,8/29/54,1954,8,29,Aug
8448886,Pete,Lopresti,23-May-54,May-23-1954,5/23/54,5/23/54,1954,5,23,May
8446846,Bryan,Hextall,23-May-41,May-23-1941,5/23/41,5/23/41,1941,5,23,May
8447929,Bill,Hogaboam,9-May-49,May-9-1949,5/9/49,5/9/49,1949,5,9,May
8447049,Pierre,Jarry,30-Mar-49,Mar-30-1949,3/30/49,3/30/49,1949,3,30,Mar
8448277,Steve,Jensen,14-Apr-55,Apr-14-1955,4/14/55,4/14/55,1955,4,14,Apr
8448788,Glen,Sather,2-Sep-43,Sep-2-1943,9/2/43,9/2/43,1943,9,2,Sep
8452574,Tim,Young,22-Feb-55,Feb-22-1955,2/22/55,2/22/55,1955,2,22,Feb
8446154,Jerry,Engele,26-Nov-50,Nov-26-1950,11/26/50,11/26/50,1950,11,26,Nov
8447663,Paul,Harrison,11-Feb-55,Feb-11-1955,2/11/55,2/11/55,1955,2,11,Feb
8446710,Roland,Eriksson,1-Mar-54,Mar-1-1954,3/1/54,3/1/54,1954,3,1,Mar
8446187,Bill,Fairbairn,7-Jan-47,Jan-7-1947,1/7/47,1/7/47,1947,1,7,Jan
8450409,Alex,Pirus,12-Jan-55,Jan-12-1955,1/12/55,1/12/55,1955,1,12,Jan
8450917,Jim,Roberts,8-Jun-56,Jun-8-1956,6/8/56,6/8/56,1956,6,8,Jun
8451325,Glen,Sharpley,6-Sep-56,Sep-6-1956,9/6/56,9/6/56,1956,9,6,Sep
8452577,Tom,Younghans,22-Jan-53,Jan-22-1953,1/22/53,1/22/53,1953,1,22,Jan
8445456,Nick,Beverley,21-Apr-47,Apr-21-1947,4/21/47,4/21/47,1947,4,21,Apr
8451528,Gary,Smith,4-Feb-44,Feb-4-1944,2/4/44,2/4/44,1944,2,4,Feb
8444943,Kent-Erik,Andersson,24-May-51,May-24-1951,5/24/51,5/24/51,1951,5,24,May
8445056,Harvey,Bennett,9-Aug-52,Aug-9-1952,8/9/52,8/9/52,1952,8,9,Aug
8445677,Per-Olov,Brasar,30-Sep-50,Sep-30-1950,9/30/50,9/30/50,1950,9,30,Sep
8447003,Jamie,Gallimore,28-Nov-57,Nov-28-1957,11/28/57,11/28/57,1957,11,28,Nov
8449033,Dean,Magee,29-Apr-55,Apr-29-1955,4/29/55,4/29/55,1955,4,29,Apr
8452692,Ron,Zanussi,31-Aug-56,Aug-31-1956,8/31/56,8/31/56,1956,8,31,Aug
8445597,Jim,Boo,11-Dec-54,Dec-11-1954,12/11/54,12/11/54,1954,12,11,Dec
8445810,Bill,Butters,10-Jan-51,Jan-10-1951,1/10/51,1/10/51,1951,1,10,Jan
8448201,Don,Jackson,2-Sep-56,Sep-2-1956,9/2/56,9/2/56,1956,9,2,Sep
8449315,Brad,Maxwell,8-Jul-57,Jul-8-1957,7/8/57,7/8/57,1957,7,8,Jul
8449316,Bryan,Maxwell,7-Sep-55,Sep-7-1955,9/7/55,9/7/55,1955,9,7,Sep
8445089,Chuck,Arnason,15-Jul-51,Jul-15-1951,7/15/51,7/15/51,1951,7,15,Jul
8445932,Jack,Carlson,23-Aug-54,Aug-23-1954,8/23/54,8/23/54,1954,8,23,Aug
8446074,Dan,Chicoine,30-Nov-57,Nov-30-1957,11/30/57,11/30/57,1957,11,30,Nov
8446541,Mike,Eaves,10-Jun-56,Jun-10-1956,6/10/56,6/10/56,1956,6,10,Jun
8448915,Al,MacAdam,16-Mar-52,Mar-16-1952,3/16/52,3/16/52,1952,3,16,Mar
8449109,Kris,Manery,24-Sep-54,Sep-24-1954,9/24/54,9/24/54,1954,9,24,Sep
8449284,Dennis,Maruk,17-Nov-55,Nov-17-1955,11/17/55,11/17/55,1955,11,17,Nov
8450259,Steve,Payne,16-Aug-58,Aug-16-1958,8/16/58,8/16/58,1958,8,16,Aug
8450491,Mike,Polich,19-Dec-52,Dec-19-1952,12/19/52,12/19/52,1952,12,19,Dec
8451476,Bobby,Smith,12-Feb-58,Feb-12-1958,2/12/58,2/12/58,1958,2,12,Feb
8445206,John,Baby,18-May-57,May-18-1957,5/18/57,5/18/57,1957,5,18,May
8449476,Jim,McKenny,1-Dec-46,Dec-1-1946,12/1/46,12/1/46,1946,12,1,Dec
8450508,Jean,Potvin,25-Mar-49,Mar-25-1949,3/25/49,3/25/49,1949,3,25,Mar
8451123,Gary,Sargent,18-Feb-54,Feb-18-1954,2/18/54,2/18/54,1954,2,18,Feb
8451531,Greg,Smith,18-Jul-55,Jul-18-1955,7/18/55,7/18/55,1955,7,18,Jul
8446602,Gary,Edwards,5-Oct-47,Oct-5-1947,10/5/47,10/5/47,1947,10,5,Oct
8449550,Gilles,Meloche,12-Jul-50,Jul-12-1950,7/12/50,7/12/50,1950,7,12,Jul
8446065,Steve,Christoff,23-Jan-58,Jan-23-1958,1/23/58,1/23/58,1958,1,23,Jan
8446439,Jim,Dobson,29-Feb-60,Feb-29-1960,2/29/60,2/29/60,1960,2,29,Feb
8446868,Rob,Flockhart,6-Feb-56,Feb-6-1956,2/6/56,2/6/56,1956,2,6,Feb
8446883,Jon,Fontas,11-Apr-58,Apr-11-1958,4/11/58,4/11/58,1958,4,11,Apr
8448636,Robbie,Laird,29-Dec-54,Dec-29-1954,12/29/54,12/29/54,1954,12,29,Dec
8449348,Tom,McCarthy,31-Jul-60,Jul-31-1960,7/31/60,7/31/60,1960,7,31,Jul
8452427,Tony,White,16-Jun-54,Jun-16-1954,6/16/54,6/16/54,1954,6,16,Jun
8447176,Curt,Giles,30-Nov-58,Nov-30-1958,11/30/58,11/30/58,1958,11,30,Nov
8447552,David,Hanson,12-Apr-54,Apr-12-1954,4/12/54,4/12/54,1954,4,12,Apr
8447667,Craig,Hartsburg,29-Jun-59,Jun-29-1959,6/29/59,6/29/59,1959,6,29,Jun
8448218,Steve,Janaszek,7-Jan-57,Jan-7-1957,1/7/57,1/7/57,1957,1,7,Jan
8448807,Jean,Levasseur,16-Jun-49,Jun-16-1949,6/16/49,6/16/49,1949,6,16,Jun
8445724,Neal,Broten,29-Nov-59,Nov-29-1959,11/29/59,11/29/59,1959,11,29,Nov
8446063,Dino,Ciccarelli,8-Feb-60,Feb-8-1960,2/8/60,2/8/60,1960,2,8,Feb
8446149,Joe,Contini,29-Jan-57,Jan-29-1957,1/29/57,1/29/57,1957,1,29,Jan
8446975,Ron,Friest,4-Nov-58,Nov-4-1958,11/4/58,11/4/58,1958,11,4,Nov
8449318,Kevin,Maxwell,30-Mar-60,Mar-30-1960,3/30/60,3/30/60,1960,3,30,Mar
8449546,Roger,Melin,25-Apr-56,Apr-25-1956,4/25/56,4/25/56,1956,4,25,Apr
8450133,Brad,Palmer,14-Sep-61,Sep-14-1961,9/14/61,9/14/61,1961,9,14,Sep
8451584,Ken,Solheim,27-Mar-61,Mar-27-1961,3/27/61,3/27/61,1961,3,27,Mar
8445722,Murray,Brumwell,31-Mar-60,Mar-31-1960,3/31/60,3/31/60,1960,3,31,Mar
8445381,Don,Beaupre,19-Sep-61,Sep-19-1961,9/19/61,9/19/61,1961,9,19,Sep
8446661,Anders,Hakansson,27-Apr-56,Apr-27-1956,4/27/56,4/27/56,1956,4,27,Apr
8447696,Peter,Hayek,16-Nov-57,Nov-16-1957,11/16/57,11/16/57,1957,11,16,Nov
8452575,Warren,Young,11-Jan-56,Jan-11-1956,1/11/56,1/11/56,1956,1,11,Jan
8448478,Udo,Kiessling,21-May-55,May-21-1955,5/21/55,5/21/55,1955,5,21,May
8449538,Ron,Meighan,26-May-63,May-26-1963,5/26/63,5/26/63,1963,5,26,May
8449933,Bill,Nyrop,23-Jul-52,Jul-23-1952,7/23/52,7/23/52,1952,7,23,Jul
8457716,Daniel,Poulin,19-Sep-57,Sep-19-1957,9/19/57,9/19/57,1957,9,19,Sep
8450827,Dave,Richter,8-Apr-60,Apr-8-1960,4/8/60,4/8/60,1960,4,8,Apr
8449588,Lindsay,Middlebrook,7-Sep-55,Sep-7-1955,9/7/55,9/7/55,1955,9,7,Sep
8445417,Brian,Bellows,1-Sep-64,Sep-1-1964,9/1/64,9/1/64,1964,9,1,Sep
8446809,George,Ferguson,22-Aug-52,Aug-22-1952,8/22/52,8/22/52,1952,8,22,Aug
8448260,Wes,Jarvis,30-May-58,May-30-1958,5/30/58,5/30/58,1958,5,30,May
8450474,Willi,Plett,7-Jun-55,Jun-7-1955,6/7/55,6/7/55,1955,6,7,Jun
8445433,Bob,Bergloff,26-Jul-58,Jul-26-1958,7/26/58,7/26/58,1958,7,26,Jul
8449111,Dan,Mandich,12-Jun-60,Jun-12-1960,6/12/60,6/12/60,1960,6,12,Jun
8452209,Randy,Velischek,10-Feb-62,Feb-10-1962,2/10/62,2/10/62,1962,2,10,Feb
8449291,Markus,Mattsson,30-Jul-57,Jul-30-1957,7/30/57,7/30/57,1957,7,30,Jul
8444897,Keith,Acton,15-Apr-58,Apr-15-1958,4/15/58,4/15/58,1958,4,15,Apr
8445118,Brent,Ashton,18-May-60,May-18-1960,5/18/60,5/18/60,1960,5,18,May
8445492,Scott,Bjugstad,2-Jun-61,Jun-2-1961,6/2/61,6/2/61,1961,6,2,Jun
8446159,Tim,Coulis,24-Feb-58,Feb-24-1958,2/24/58,2/24/58,1958,2,24,Feb
8447345,Dirk,Graham,29-Jul-59,Jul-29-1959,7/29/59,7/29/59,1959,7,29,Jul
8447934,Paul,Holmgren,2-Dec-55,Dec-2-1955,12/2/55,12/2/55,1955,12,2,Dec
8449795,Mark,Napier,28-Jan-57,Jan-28-1957,1/28/57,1/28/57,1957,1,28,Jan
8447863,Tom,Hirsch,27-Jan-63,Jan-27-1963,1/27/63,1/27/63,1963,1,27,Jan
8448274,David,Jensen,3-May-61,May-3-1961,5/3/61,5/3/61,1961,5,3,May
8448816,Craig,Levie,17-Aug-59,Aug-17-1959,8/17/59,8/17/59,1959,8,17,Aug
8448851,Lars,Lindgren,13-Oct-52,Oct-13-1952,10/13/52,10/13/52,1952,10,13,Oct
8451022,Bob,Rouse,18-Jun-64,Jun-18-1964,6/18/64,6/18/64,1964,6,18,Jun
8446011,Jon,Casey,29-Mar-62,Mar-29-1962,3/29/62,3/29/62,1962,3,29,Mar
8446212,Jim,Craig,31-May-57,May-31-1957,5/31/57,5/31/57,1957,5,31,May
8445054,Jim,Archibald,6-Jun-61,Jun-6-1961,6/6/61,6/6/61,1961,6,6,Jun
8445434,Bo,Berglund,6-Apr-55,Apr-6-1955,4/6/55,4/6/55,1955,4,6,Apr
8445463,Don,Biggs,4-Jul-65,Jul-4-1965,7/4/65,7/4/65,1965,7,4,Jul
8449164,John,Markell,10-Mar-56,Mar-10-1956,3/10/56,3/10/56,1956,3,10,Mar
8449277,Terry,Martin,25-Oct-55,Oct-25-1955,10/25/55,10/25/55,1955,10,25,Oct
8449445,Tony,McKegney,15-Feb-58,Feb-15-1958,2/15/58,2/15/58,1958,2,15,Feb
8451957,Tim,Trimper,28-Sep-59,Sep-28-1959,9/28/59,9/28/59,1959,9,28,Sep
8450558,Christopher,Pryor,23-Jan-61,Jan-23-1961,1/23/61,1/23/61,1961,1,23,Jan
8451587,Harold,Snepsts,24-Oct-54,Oct-24-1954,10/24/54,10/24/54,1954,10,24,Oct
8452484,Ron,Wilson,28-May-55,May-28-1955,5/28/55,5/28/55,1955,5,28,May
8449547,Roland,Melanson,28-Jun-60,Jun-28-1960,6/28/60,6/28/60,1960,6,28,Jun
8451121,Michael,Sands,6-Apr-63,Apr-6-1963,4/6/63,4/6/63,1963,4,6,Apr
8446356,Larry,Depalma,27-Oct-65,Oct-27-1965,10/27/65,10/27/65,1965,10,27,Oct
8447440,Marc,Habscheid,1-Mar-63,Mar-1-1963,3/1/63,3/1/63,1963,3,1,Mar
8447479,Mats,Hallin,19-Mar-58,Mar-19-1958,3/19/58,3/19/58,1958,3,19,Mar
8447975,Paul,Houck,12-Aug-63,Aug-12-1963,8/12/63,8/12/63,1963,8,12,Aug
8449887,Kent,Nilsson,31-Aug-56,Aug-31-1956,8/31/56,8/31/56,1956,8,31,Aug
8451535,Randy,Smith,15-Jul-65,Jul-15-1965,7/15/65,7/15/65,1965,7,15,Jul
8448643,Dave,Langevin,15-May-54,May-15-1954,5/15/54,5/15/54,1954,5,15,May
8451732,Bill,Stewart,6-Oct-57,Oct-6-1957,10/6/57,10/6/57,1957,10,6,Oct
8452227,Emanuel,Viveiros,8-Jan-66,Jan-8-1966,1/8/66,1/8/66,1966,1,8,Jan
8451845,Kari,Takko,23-Jun-62,Jun-23-1962,6/23/62,6/23/62,1962,6,23,Jun
8445690,Bob,Brooke,18-Dec-60,Dec-18-1960,12/18/60,12/18/60,1960,12,18,Dec
8447732,Raimo,Helminen,11-Mar-64,Mar-11-1964,3/11/64,3/11/64,1964,3,11,Mar
8448980,Brian,MacLellan,27-Oct-58,Oct-27-1958,10/27/58,10/27/58,1958,10,27,Oct
8450251,Mark,Pavelich,28-Feb-58,Feb-28-1958,2/28/58,2/28/58,1958,2,28,Feb
8451926,Sean,Toomey,27-Jun-65,Jun-27-1965,6/27/65,6/27/65,1965,6,27,Jun
8445625,Paul,Boutilier,3-May-63,May-3-1963,5/3/63,5/3/63,1963,5,3,May
8446045,Colin,Chisholm,25-Feb-63,Feb-25-1963,2/25/63,2/25/63,1963,2,25,Feb
8447436,Jari,Gronstrand,14-Nov-62,Nov-14-1962,11/14/62,11/14/62,1962,11,14,Nov
8446955,Frantisek,Musil,17-Dec-64,Dec-17-1964,12/17/64,12/17/64,1964,12,17,Dec
8445053,Dave,Archibald,14-Apr-69,Apr-14-1969,4/14/69,4/14/69,1969,4,14,Apr
8445197,Warren,Babe,7-Sep-68,Sep-7-1968,9/7/68,9/7/68,1968,9,7,Sep
8445580,Rick,Boh,18-May-64,May-18-1964,5/18/64,5/18/64,1964,5,18,May
8446013,Jay,Caufield,17-Jul-60,Jul-17-1960,7/17/60,7/17/60,1960,7,17,Jul
8446957,Curt,Fraser,12-Jan-58,Jan-12-1958,1/12/58,1/12/58,1958,1,12,Jan
8446997,Dave,Gagner,11-Dec-64,Dec-11-1964,12/11/64,12/11/64,1964,12,11,Dec
8449498,Basil,Mcrae,5-Jan-61,Jan-5-1961,1/5/61,1/5/61,1961,1,5,Jan
8449563,Mitchell,Messier,21-Aug-65,Aug-21-1965,8/21/65,8/21/65,1965,8,21,Aug
8449585,Patrick,Micheletti,11-Dec-63,Dec-11-1963,12/11/63,12/11/63,1963,12,11,Dec
8451035,Stephane,Roy,29-Jun-67,Jun-29-1967,6/29/67,6/29/67,1967,6,29,Jun
8451065,Terry,Ruskowski,31-Dec-54,Dec-31-1954,12/31/54,12/31/54,1954,12,31,Dec
8451235,Wally,Schreiber,15-Apr-62,Apr-15-1962,4/15/62,4/15/62,1962,4,15,Apr
8451301,George,Servinis,29-Apr-62,Apr-29-1962,4/29/62,4/29/62,1962,4,29,Apr
8451861,William,Terry,13-Jul-61,Jul-13-1961,7/13/61,7/13/61,1961,7,13,Jul
8451929,Kirk,Tomlinson,2-May-68,May-2-1968,5/2/68,5/2/68,1968,5,2,May
8452687,Richard,Zemlak,3-Mar-63,Mar-3-1963,3/3/63,3/3/63,1963,3,3,Mar
8445276,John,Barrett,1-Jul-58,Jul-1-1958,7/1/58,7/1/58,1958,7,1,Jul
8445435,Mike,Berger,2-Jun-67,Jun-2-1967,6/2/67,6/2/67,1967,6,2,Jun
8446042,Shawn,Chambers,11-Oct-66,Oct-11-1966,10/11/66,10/11/66,1966,10,11,Oct
8446424,Gord,Dineen,21-Sep-62,Sep-21-1962,9/21/62,9/21/62,1962,9,21,Sep
8446500,Ken,Duggan,21-Feb-63,Feb-21-1963,2/21/63,2/21/63,1963,2,21,Feb
8449122,Moe,Mantha,21-Jan-61,Jan-21-1961,1/21/61,1/21/61,1961,1,21,Jan
8450554,Pat,Price,24-Mar-55,Mar-24-1955,3/24/55,3/24/55,1955,3,24,Mar
8445253,Don,Barber,2-Dec-64,Dec-2-1964,12/2/64,12/2/64,1964,12,2,Dec
8445427,Perry,Berezan,5-Dec-64,Dec-5-1964,12/5/64,12/5/64,1964,12,5,Dec
8447067,Mike,Gartner,29-Oct-59,Oct-29-1959,10/29/59,10/29/59,1959,10,29,Oct
8447304,Steve,Gotaas,10-May-67,May-10-1967,5/10/67,5/10/67,1967,5,10,May
8447891,Ken,Hodge,13-Apr-66,Apr-13-1966,4/13/66,4/13/66,1966,4,13,Apr
8448394,Kevin,Kaminski,13-Mar-69,Mar-13-1969,3/13/69,3/13/69,1969,3,13,Mar
8449449,Michael,Mchugh,16-Aug-65,Aug-16-1965,8/16/65,8/16/65,1965,8,16,Aug
8449645,Mike,Modano,7-Jun-70,Jun-7-1970,6/7/70,6/7/70,1970,6,7,Jun
8450233,Dusan,Pasek,7-Sep-60,Sep-7-1960,9/7/60,9/7/60,1960,9,7,Sep
8446989,Link,Gaetz,2-Oct-68,Oct-2-1968,10/2/68,10/2/68,1968,10,2,Oct
8447569,Mark,Hardy,1-Feb-59,Feb-1-1959,2/1/59,2/1/59,1959,2,1,Feb
8448267,Paul,Jerrard,20-Apr-65,Apr-20-1965,4/20/65,4/20/65,1965,4,20,Apr
8448536,Dean,Kolstad,16-Jun-68,Jun-16-1968,6/16/68,6/16/68,1968,6,16,Jun
8448708,Reed,Larson,30-Jul-56,Jul-30-1956,7/30/56,7/30/56,1956,7,30,Jul
8449745,Larry,Murphy,8-Mar-61,Mar-8-1961,3/8/61,3/8/61,1961,3,8,Mar
8451382,Ville,Siren,11-Feb-64,Feb-11-1964,2/11/64,2/11/64,1964,2,11,Feb
8451869,Mark,Tinordi,9-May-66,May-9-1966,5/9/66,5/9/66,1966,5,9,May
8452695,Rob,Zettler,8-Mar-68,Mar-8-1968,3/8/68,3/8/68,1968,3,8,Mar
8449775,Jarmo,Myllys,29-May-65,May-29-1965,5/29/65,5/29/65,1965,5,29,May
8445245,Helmut,Balderis,31-Jul-52,Jul-31-1952,7/31/52,7/31/52,1952,7,31,Jul
8445725,Aaron,Broten,14-Nov-60,Nov-14-1960,11/14/60,11/14/60,1960,11,14,Nov
8446295,Ulf,Dahlen,21-Jan-67,Jan-21-1967,1/21/67,1/21/67,1967,1,21,Jan
8446452,Clark,Donatelli,22-Nov-65,Nov-22-1965,11/22/65,11/22/65,1965,11,22,Nov
8446497,Gaetan,Duchesne,11-Jul-62,Jul-11-1962,7/11/62,7/11/62,1962,7,11,Jul
8448662,Peter,Lappin,31-Dec-65,Dec-31-1965,12/31/65,12/31/65,1965,12,31,Dec
8448939,David,Mackey,24-Jul-66,Jul-24-1966,7/24/66,7/24/66,1966,7,24,Jul
8450167,Scott,Robinson,29-Mar-64,Mar-29-1964,3/29/64,3/29/64,1964,3,29,Mar
8451963,Mario,Thyer,29-Sep-66,Sep-29-1966,9/29/66,9/29/66,1966,9,29,Sep
8448755,Ken,Leiter,19-Apr-61,Apr-19-1961,4/19/61,4/19/61,1961,4,19,Apr
8449694,Jayson,More,12-Jan-69,Jan-12-1969,1/12/69,1/12/69,1969,1,12,Jan
8452503,Neil,Wilkinson,15-Aug-67,Aug-15-1967,8/15/67,8/15/67,1967,8,15,Aug
8445462,Daniel,Berthiaume,26-Jan-66,Jan-26-1966,1/26/66,1/26/66,1966,1,26,Jan
8445775,Marc,Bureau,19-May-66,May-19-1966,5/19/66,5/19/66,1966,5,19,May
8446213,Mike,Craig,6-Jun-71,Jun-6-1971,6/6/71,6/6/71,1971,6,6,Jun
8446718,Kevin,Evans,10-Jul-65,Jul-10-1965,7/10/65,7/10/65,1965,7,10,Jul
8451383,Ilkka,Sinisalo,10-Jul-58,Jul-10-1958,7/10/58,7/10/58,1958,7,10,Jul
8451567,Doug,Smail,2-Sep-57,Sep-2-1957,9/2/57,9/2/57,1957,9,2,Sep
8446288,Chris,Dahlquist,14-Dec-62,Dec-14-1962,12/14/62,12/14/62,1962,12,14,Dec
8448303,Jim,Johnson,8-Sep-62,Sep-8-1962,9/8/62,9/8/62,1962,9,8,Sep
8448987,Pat,Macleod,15-Jun-69,Jun-15-1969,6/15/69,6/15/69,1969,6,15,Jun
8451836,Peter,Taglianetti,15-Aug-63,Aug-15-1963,8/15/63,8/15/63,1963,8,15,Aug
8447701,Brian,Hayward,25-Jun-60,Jun-25-1960,6/25/60,6/25/60,1960,6,25,Jun
8446624,Todd,Elik,15-Apr-66,Apr-15-1966,4/15/66,4/15/66,1966,4,15,Apr
8456849,Trent,Klatt,30-Jan-71,Jan-30-1971,1/30/71,1/30/71,1971,1,30,Jan
8449093,Steve,Maltais,25-Jan-69,Jan-25-1969,1/25/69,1/25/69,1969,1,25,Jan
8449281,Steve,Martinson,21-Jun-57,Jun-21-1957,6/21/57,6/21/57,1957,6,21,Jun
8449633,Kip,Miller,11-Jun-69,Jun-11-1969,6/11/69,6/11/69,1969,6,11,Jun
8451517,Derrick,Smith,22-Jan-65,Jan-22-1965,1/22/65,1/22/65,1965,1,22,Jan
8445443,Brad,Berry,1-Apr-65,Apr-1-1965,4/1/65,4/1/65,1965,4,1,Apr
8455875,Enrico,Ciccone,10-Apr-70,Apr-10-1970,4/10/70,4/10/70,1970,4,10,Apr
8456531,Derian,Hatcher,4-Jun-72,Jun-4-1972,6/4/72,6/4/72,1972,6,4,Jun
8448845,Craig,Ludwig,15-Mar-61,Mar-15-1961,3/15/61,3/15/61,1961,3,15,Mar
8450642,Rob,Ramage,11-Jan-59,Jan-11-1959,1/11/59,1/11/59,1959,1,11,Jan
8451116,Scott,Sandelin,8-Aug-64,Aug-8-1964,8/8/64,8/8/64,1964,8,8,Aug
8451314,David,Shaw,25-May-64,May-25-1964,5/25/64,5/25/64,1964,5,25,May
8452248,Darcy,Wakaluk,14-Mar-66,Mar-14-1966,3/14/66,3/14/66,1966,3,14,Mar
8455526,Douglas,Barrault,21-Apr-70,Apr-21-1970,4/21/70,4/21/70,1970,4,21,Apr
8446208,Russ,Courtnall,2-Jun-65,Jun-2-1965,6/2/65,6/2/65,1965,6,2,Jun
8447177,Brent,Gilchrist,3-Apr-67,Apr-3-1967,4/3/67,4/3/67,1967,4,3,Apr
8449495,Mike,Mcphee,14-Jul-60,Jul-14-1960,7/14/60,7/14/60,1960,7,14,Jul
8450635,Dan,Quinn,1-Jun-65,Jun-1-1965,6/1/65,6/1/65,1965,6,1,Jun
8458036,Reid,Simpson,21-May-69,May-21-1969,5/21/69,5/21/69,1969,5,21,May
8458522,Richard,Matvichuk,5-Feb-73,Feb-5-1973,2/5/73,2/5/73,1973,2,5,Feb
8457399,Roy,Mitchell,14-Mar-69,Mar-14-1969,3/14/69,3/14/69,1969,3,14,Mar
8457589,Mark,Osiecki,23-Jul-68,Jul-23-1968,7/23/68,7/23/68,1968,7,23,Jul
8458043,Tommy,Sjodin,13-Aug-65,Aug-13-1965,8/13/65,8/13/65,1965,8,13,Aug
8445446,Serge,Bernier,29-Apr-47,Apr-29-1947,4/29/47,4/29/47,1947,4,29,Apr
8445481,Gilles,Bilodeau,31-Jul-55,Jul-31-1955,7/31/55,7/31/55,1955,7,31,Jul
8445666,Curt,Brackenbury,31-Jan-52,Jan-31-1952,1/31/52,1/31/52,1952,1,31,Jan
8446068,Ron,Chipperfield,28-Mar-54,Mar-28-1954,3/28/54,3/28/54,1954,3,28,Mar
8446101,Real,Cloutier,30-Jul-56,Jul-30-1956,7/30/56,7/30/56,1956,7,30,Jul
8446104,Roland,Cloutier,10-Jun-57,Jun-10-1957,6/10/57,6/10/57,1957,6,10,Jun
8446178,Alain,Cote,3-May-57,May-3-1957,5/3/57,5/3/57,1957,5,3,May
8446317,Richard,David,8-Apr-58,Apr-8-1958,4/8/58,4/8/58,1958,4,8,Apr
8446827,Bob,Fitchner,22-Dec-50,Dec-22-1950,12/22/50,12/22/50,1950,12,22,Dec
8446978,Robbie,Ftorek,2-Jan-52,Jan-2-1952,1/2/52,1/2/52,1952,1,2,Jan
8447310,Michel,Goulet,21-Apr-60,Apr-21-1960,4/21/60,4/21/60,1960,4,21,Apr
8447865,Jamie,Hislop,20-Jan-54,Jan-20-1954,1/20/54,1/20/54,1954,1,20,Jan
8448733,Rich,Leduc,24-Aug-51,Aug-24-1951,8/24/51,8/24/51,1951,8,24,Aug
8450467,Pierre,Plante,14-May-51,May-14-1951,5/14/51,5/14/51,1951,5,14,May
8450815,Jacques,Richard,7-Oct-52,Oct-7-1952,10/7/52,10/7/52,1952,10,7,Oct
8451134,Bernie,Saunders,21-Jun-56,Jun-21-1956,6/21/56,6/21/56,1956,6,21,Jun
8451432,Louis,Sleigher,23-Oct-58,Oct-23-1958,10/23/58,10/23/58,1958,10,23,Oct
8451565,John,Smrke,25-Feb-56,Feb-25-1956,2/25/56,2/25/56,1956,2,25,Feb
8451720,John,Stewart,2-Jan-54,Jan-2-1954,1/2/54,1/2/54,1954,1,2,Jan
8451722,Paul,Stewart,21-Mar-55,Mar-21-1955,3/21/55,3/21/55,1955,3,21,Mar
8451731,Blair,Stewart,15-Mar-53,Mar-15-1953,3/15/53,3/15/53,1953,3,15,Mar
8451856,Marc,Tardif,12-Jun-49,Jun-12-1949,6/12/49,6/12/49,1949,6,12,Jun
8451897,Reginald,Thomas,21-Apr-53,Apr-21-1953,4/21/53,4/21/53,1953,4,21,Apr
8445338,Paul,Baxter,25-Oct-55,Oct-25-1955,10/25/55,10/25/55,1955,10,25,Oct
8446774,Dave,Farrish,1-Aug-56,Aug-1-1956,8/1/56,8/1/56,1956,8,1,Aug
8447666,Gerry,Hart,1-Jan-48,Jan-1-1948,1/1/48,1/1/48,1948,1,1,Jan
8447930,Dale,Hoganson,8-Jul-49,Jul-8-1949,7/8/49,7/8/49,1949,7,8,Jul
8448294,Terry,Johnson,28-Nov-58,Nov-28-1958,11/28/58,11/28/58,1958,11,28,Nov
8448600,Francois,Lacombe,24-Feb-48,Feb-24-1948,2/24/48,2/24/48,1948,2,24,Feb
8448701,Garry,Lariviere,6-Dec-54,Dec-6-1954,12/6/54,12/6/54,1954,12,6,Dec
8448745,Barry,Legge,22-Oct-54,Oct-22-1954,10/22/54,10/22/54,1954,10,22,Oct
8451875,Gregory,Tebbutt,11-May-57,May-11-1957,5/11/57,5/11/57,1957,5,11,May
8446429,Michel,Dion,11-Feb-54,Feb-11-1954,2/11/54,2/11/54,1954,2,11,Feb
8447945,Goran,Hogosta,15-Apr-54,Apr-15-1954,4/15/54,4/15/54,1954,4,15,Apr
8448891,Ron,Low,21-Jun-50,Jun-21-1950,6/21/50,6/21/50,1950,6,21,Jun
8445169,Pierre,Aubry,15-Apr-60,Apr-15-1960,4/15/60,4/15/60,1960,4,15,Apr
8448117,Dale,Hunter,31-Jul-60,Jul-31-1960,7/31/60,7/31/60,1960,7,31,Jul
8450090,John,Paddock,9-Jun-54,Jun-9-1954,6/9/54,6/9/54,1954,6,9,Jun
8451688,Anton,Stastny,5-Aug-59,Aug-5-1959,8/5/59,8/5/59,1959,8,5,Aug
8451689,Peter,Stastny,18-Sep-56,Sep-18-1956,9/18/56,9/18/56,1956,9,18,Sep
8452368,John,Wensink,1-Apr-53,Apr-1-1953,4/1/53,4/1/53,1953,4,1,Apr
8446077,Kim,Clackson,13-Feb-55,Feb-13-1955,2/13/55,2/13/55,1955,2,13,Feb
8446530,Andre,Dupont,27-Jul-49,Jul-27-1949,7/27/49,7/27/49,1949,7,27,Jul
8449171,Mario,Marois,15-Dec-57,Dec-15-1957,12/15/57,12/15/57,1957,12,15,Dec
8450378,Dave,Pichette,4-Feb-60,Feb-4-1960,2/4/60,2/4/60,1960,2,4,Feb
8450953,Normand,Rochefort,28-Jan-61,Jan-28-1961,1/28/61,1/28/61,1961,1,28,Jan
8451883,Gaston,Therrien,27-May-60,May-27-1960,5/27/60,5/27/60,1960,5,27,May
8445609,Dan,Bouchard,12-Dec-50,Dec-12-1950,12/12/50,12/12/50,1950,12,12,Dec
8447344,Ron,Grahame,7-Jun-50,Jun-7-1950,6/7/50,6/7/50,1950,6,7,Jun
8450468,Michel,Plasse,1-Jun-48,Jun-1-1948,6/1/48,6/1/48,1948,6,1,Jun
8446981,Miroslav,Frycer,27-Sep-59,Sep-27-1959,9/27/59,9/27/59,1959,9,27,Sep
8447194,Jere,Gillis,18-Jan-57,Jan-18-1957,1/18/57,1/18/57,1957,1,18,Jan
8447790,Pat,Hickey,15-May-53,May-15-1953,5/15/53,5/15/53,1953,5,15,May
8450107,Wilf,Paiement,16-Oct-55,Oct-16-1955,10/16/55,10/16/55,1955,10,16,Oct
8451687,Marian,Stastny,8-Jan-53,Jan-8-1953,1/8/53,1/8/53,1953,1,8,Jan
8451850,Christian,Tanguay,4-Aug-62,Aug-4-1962,8/4/62,8/4/62,1962,8,4,Aug
8445583,Michel,Bolduc,13-Mar-61,Mar-13-1961,3/13/61,3/13/61,1961,3,13,Mar
8447482,Jean,Hamel,26-Jun-52,Jun-26-1952,6/26/52,6/26/52,1952,6,26,Jun
8449662,Randy,Moller,23-Aug-63,Aug-23-1963,8/23/63,8/23/63,1963,8,23,Aug
8449096,Clint,Malarchuk,1-May-61,May-1-1961,5/1/61,5/1/61,1961,5,1,May
8446551,Mike,Eagles,7-Mar-63,Mar-7-1963,3/7/63,3/7/63,1963,3,7,Mar
8447074,Jean-Marc,Gaulin,3-Mar-62,Mar-3-1962,3/3/62,3/3/62,1962,3,3,Mar
8451580,Dennis,Sobchuk,12-Jan-54,Jan-12-1954,1/12/54,1/12/54,1954,1,12,Jan
8451922,Tim,Tookey,29-Aug-60,Aug-29-1960,8/29/60,8/29/60,1960,8,29,Aug
8446635,Anders,Eldebrink,11-Dec-60,Dec-11-1960,12/11/60,12/11/60,1960,12,11,Dec
8448695,Rick,Lapointe,2-Aug-55,Aug-2-1955,8/2/55,8/2/55,1955,8,2,Aug
8449119,Jimmy,Mann,17-Apr-59,Apr-17-1959,4/17/59,4/17/59,1959,4,17,Apr
8451141,Jean-Francois,Sauve,23-Jan-60,Jan-23-1960,1/23/60,1/23/60,1960,1,23,Jan
8451144,Andre,Savard,2-Sep-53,Sep-2-1953,9/2/53,9/2/53,1953,9,2,Sep
8446437,Gord,Donnelly,5-Apr-62,Apr-5-1962,4/5/62,4/5/62,1962,4,5,Apr
8446443,Andre,Dore,11-Feb-58,Feb-11-1958,2/11/58,2/11/58,1958,2,11,Feb
8452156,John,Van Boxmeer,20-Nov-52,Nov-20-1952,11/20/52,11/20/52,1952,11,20,Nov
8446899,Brian,Ford,22-Sep-61,Sep-22-1961,9/22/61,9/22/61,1961,9,22,Sep
8446507,Luc,Dufour,13-Feb-63,Feb-13-1963,2/13/63,2/13/63,1963,2,13,Feb
8447393,Wayne,Groulx,2-Feb-65,Feb-2-1965,2/2/65,2/2/65,1965,2,2,Feb
8447985,Mike,Hough,6-Feb-63,Feb-6-1963,2/6/63,2/6/63,1963,2,6,Feb
8448563,Mark,Kumpel,7-Mar-61,Mar-7-1961,3/7/61,3/7/61,1961,3,7,Mar
8448763,Edward,Lee,17-Dec-61,Dec-17-1961,12/17/61,12/17/61,1961,12,17,Dec
8448773,Alain,Lemieux,24-May-61,May-24-1961,5/24/61,5/24/61,1961,5,24,May
8452197,Yvon,Vautour,10-Sep-56,Sep-10-1956,9/10/56,9/10/56,1956,9,10,Sep
8445418,Bruce,Bell,15-Feb-65,Feb-15-1965,2/15/65,2/15/65,1965,2,15,Feb
8447444,Roger,Hagglund,2-Jul-61,Jul-2-1961,7/2/61,7/2/61,1961,7,2,Jul
8448385,Claude,Julien,23-Apr-60,Apr-23-1960,4/23/60,4/23/60,1960,4,23,Apr
8448827,Peter,Loob,23-Jul-57,Jul-23-1957,7/23/57,7/23/57,1957,7,23,Jul
8451308,Richard,Sevigny,11-Apr-57,Apr-11-1957,4/11/57,4/11/57,1957,4,11,Apr
8448686,David,Latta,3-Jan-67,Jan-3-1967,1/3/67,1/3/67,1967,1,3,Jan
8450218,Steve,Patrick,4-Feb-61,Feb-4-1961,2/4/61,2/4/61,1961,2,4,Feb
8451753,Trevor,Stienburg,13-May-65,May-13-1965,5/13/65,5/13/65,1965,5,13,May
8444962,Peter,Andersson,2-Mar-62,Mar-2-1962,3/2/62,3/2/62,1962,3,2,Mar
8446372,Gilbert,Delorme,25-Nov-62,Nov-25-1962,11/25/62,11/25/62,1962,11,25,Nov
8446825,Steven,Finn,20-Aug-66,Aug-20-1966,8/20/66,8/20/66,1966,8,20,Aug
8450359,Robert,Picard,25-May-57,May-25-1957,5/25/57,5/25/57,1957,5,25,May
8450509,Daniel,Poudrier,15-Feb-64,Feb-15-1964,2/15/64,2/15/64,1964,2,15,Feb
8446363,Bill,Derlago,25-Aug-58,Aug-25-1958,8/25/58,8/25/58,1958,8,25,Aug
8447754,Yves,Heroux,27-Apr-65,Apr-27-1965,4/27/65,4/27/65,1965,4,27,Apr
8448627,Jason,Lafreniere,6-Dec-66,Dec-6-1966,12/6/66,12/6/66,1966,12,6,Dec
8448655,Lane,Lambert,18-Nov-64,Nov-18-1964,11/18/64,11/18/64,1964,11,18,Nov
8449589,Max,Middendorf,18-Apr-67,Apr-18-1967,4/18/67,4/18/67,1967,4,18,Apr
8449972,John,Ogrodnick,20-Jun-59,Jun-20-1959,6/20/59,6/20/59,1959,6,20,Jun
8450611,Ken,Quinney,23-May-65,May-23-1965,5/23/65,5/23/65,1965,5,23,May
8451330,Scott,Shaunessy,22-Jan-64,Jan-22-1964,1/22/64,1/22/64,1964,1,22,Jan
8451327,Doug,Shedden,29-Apr-61,Apr-29-1961,4/29/61,4/29/61,1961,4,29,Apr
8446935,Marc,Fortier,26-Feb-66,Feb-26-1966,2/26/66,2/26/66,1966,2,26,Feb
8447684,Alan,Haworth,1-Sep-60,Sep-1-1960,9/1/60,9/1/60,1960,9,1,Sep
8448204,Jeff,Jackson,24-Apr-65,Apr-24-1965,4/24/65,4/24/65,1965,4,24,Apr
8448567,Stu,Kulak,10-Mar-63,Mar-10-1963,3/10/63,3/10/63,1963,3,10,Mar
8449463,Ken,Mcrae,23-Apr-68,Apr-23-1968,4/23/68,4/23/68,1968,4,23,Apr
8449799,Mike,Natyshak,29-Nov-63,Nov-29-1963,11/29/63,11/29/63,1963,11,29,Nov
8444919,Tommy,Albelin,21-May-64,May-21-1964,5/21/64,5/21/64,1964,5,21,May
8445920,Terry,Carkner,7-Mar-66,Mar-7-1966,3/7/66,3/7/66,1966,3,7,Mar
8446435,Bobby,Dollas,31-Jan-65,Jan-31-1965,1/31/65,1/31/65,1965,1,31,Jan
8447388,Stephane,Guerard,12-Apr-68,Apr-12-1968,4/12/68,4/12/68,1968,4,12,Apr
8450809,Jean-Marc,Richard,8-Oct-66,Oct-8-1966,10/8/66,10/8/66,1966,10,8,Oct
8445693,Mario,Brunetta,25-Jan-67,Jan-25-1967,1/25/67,1/25/67,1967,1,25,Jan
8451837,Ron,Tugnutt,22-Oct-67,Oct-22-1967,10/22/67,10/22/67,1967,10,22,Oct
8445223,Joel,Baillargeon,6-Oct-64,Oct-6-1964,10/6/64,10/6/64,1964,10,6,Oct
8447962,Dean,Hopkins,6-Jun-59,Jun-6-1959,6/6/59,6/6/59,1959,6,6,Jun
8448483,Darin,Kimble,22-Nov-68,Nov-22-1968,11/22/68,11/22/68,1968,11,22,Nov
8449066,Jacques,Mailhot,5-Dec-61,Dec-5-1961,12/5/61,12/5/61,1961,12,5,Dec
8450483,Walt,Poddubny,14-Feb-60,Feb-14-1960,2/14/60,2/14/60,1960,2,14,Feb
8451101,Joe,Sakic,7-Jul-69,Jul-7-1969,7/7/69,7/7/69,1969,7,7,Jul
8452221,Mark,Vermette,3-Oct-67,Oct-3-1967,10/3/67,10/3/67,1967,10,3,Oct
8448255,Iiro,Jarvi,23-Mar-65,Mar-23-1965,3/23/65,3/23/65,1965,3,23,Mar
8451570,Greg,Smyth,23-Apr-66,Apr-23-1966,4/23/66,4/23/66,1966,4,23,Apr
8449286,Bob,Mason,22-Apr-61,Apr-22-1961,4/22/61,4/22/61,1961,4,22,Apr
8446353,Lucien,DeBlois,21-Jun-57,Jun-21-1957,6/21/57,6/21/57,1957,6,21,Jun
8446432,Daniel,Dore,9-Apr-70,Apr-9-1970,4/9/70,4/9/70,1970,4,9,Apr
8448624,Guy,Lafleur,20-Sep-51,Sep-20-1951,9/20/51,9/20/51,1951,9,20,Sep
8448870,Claude,Loiselle,29-May-63,May-29-1963,5/29/63,5/29/63,1963,5,29,May
8449698,Stephane,Morin,27-Mar-69,Mar-27-1969,3/27/69,3/27/69,1969,3,27,Mar
8451014,Jean-Marc,Routhier,2-Feb-68,Feb-2-1968,2/2/68,2/2/68,1968,2,2,Feb
8451117,Everett,Sanipass,13-Feb-68,Feb-13-1968,2/13/68,2/13/68,1968,2,13,Feb
8451297,Jaroslav,Sevcik,15-May-65,May-15-1965,5/15/65,5/15/65,1965,5,15,May
8451293,Brent,Severyn,22-Feb-66,Feb-22-1966,2/22/66,2/22/66,1966,2,22,Feb
8452226,Dan,Vincelette,1-Aug-67,Aug-1-1967,8/1/67,8/1/67,1967,8,1,Aug
8445204,Jamie,Baker,22-Mar-68,Mar-22-1968,3/22/68,3/22/68,1968,3,22,Mar
8446062,Joe,Cirella,9-May-63,May-9-1963,5/9/63,5/9/63,1963,5,9,May
8446475,Mario,Doyon,27-Aug-68,Aug-27-1968,8/27/68,8/27/68,1968,8,27,Aug
8446873,Bryan,Fogarty,11-Jun-69,Jun-11-1969,6/11/69,6/11/69,1969,6,11,Jun
8450348,Michel,Petit,12-Feb-64,Feb-12-1964,2/12/64,2/12/64,1964,2,12,Feb
8452516,Craig,Wolanin,27-Jul-67,Jul-27-1967,7/27/67,7/27/67,1967,7,27,Jul
8446831,Stephane,Fiset,17-Jun-70,Jun-17-1970,6/17/70,6/17/70,1970,6,17,Jun
8447291,Scott,Gordon,6-Feb-63,Feb-6-1963,2/6/63,2/6/63,1963,2,6,Feb
8449779,Sergei,Mylnikov,6-Oct-58,Oct-6-1958,10/6/58,10/6/58,1958,10,6,Oct
8451859,John,Tanner,17-Mar-71,Mar-17-1971,3/17/71,3/17/71,1971,3,17,Mar
8445202,Jamie,Baker,31-Aug-66,Aug-31-1966,8/31/66,8/31/66,1966,8,31,Aug
8448674,Claude,Lapointe,11-Oct-68,Oct-11-1968,10/11/68,10/11/68,1968,10,11,Oct
8457185,Bruce,Major,3-Jan-67,Jan-3-1967,1/3/67,1/3/67,1967,1,3,Jan
8449401,Michael,Mcneil,22-Jul-66,Jul-22-1966,7/22/66,7/22/66,1966,7,22,Jul
8449895,Owen,Nolan,12-Feb-72,Feb-12-1972,2/12/72,2/12/72,1972,2,12,Feb
8450267,Scott,Pearson,19-Dec-69,Dec-19-1969,12/19/69,12/19/69,1969,12,19,Dec
8450650,Herb,Raglan,5-Aug-67,Aug-5-1967,8/5/67,8/5/67,1967,8,5,Aug
8450889,Serge,Roberge,31-Mar-65,Mar-31-1965,3/31/65,3/31/65,1965,3,31,Mar
8451774,Mats,Sundin,13-Feb-71,Feb-13-1971,2/13/71,2/13/71,1971,2,13,Feb
8452019,Tony,Twist,9-May-68,May-9-1968,5/9/68,5/9/68,1968,5,9,May
8452159,Wayne,Van Dorp,19-May-61,May-19-1961,5/19/61,5/19/61,1961,5,19,May
8444957,Shawn,Anderson,7-Feb-68,Feb-7-1968,2/7/68,2/7/68,1968,2,7,Feb
8447363,Alexei,Gusarov,8-Jul-64,Jul-8-1964,7/8/64,7/8/64,1964,7,8,Jul
8456956,Dan,Lambert,12-Jan-70,Jan-12-1970,1/12/70,1/12/70,1970,1,12,Jan
8446089,Jacques,Cloutier,3-Jan-60,Jan-3-1960,1/3/60,1/3/60,1960,1,3,Jan
8446017,Gino,Cavallini,24-Nov-62,Nov-24-1962,11/24/62,11/24/62,1962,11,24,Nov
8455838,Stephane,Charbonneau,27-Jun-70,Jun-27-1970,6/27/70,6/27/70,1970,6,27,Jun
8456770,Valeri,Kamensky,18-Apr-66,Apr-18-1966,4/18/66,4/18/66,1966,4,18,Apr
8448534,John,Kordic,22-Mar-65,Mar-22-1965,3/22/65,3/22/65,1965,3,22,Mar
8450200,Greg,Paslawski,25-Aug-61,Aug-25-1961,8/25/61,8/25/61,1961,8,25,Aug
8458534,Martin,Rucinsky,11-Mar-71,Mar-11-1971,3/11/71,3/11/71,1971,3,11,Mar
8451917,John,Tonelli,23-Mar-57,Mar-23-1957,3/23/57,3/23/57,1957,3,23,Mar
8456283,Adam,Foote,10-Jul-71,Jul-10-1971,7/10/71,7/10/71,1971,7,10,Jul
8458582,Dave,Karpa,7-May-71,May-7-1971,5/7/71,5/7/71,1971,5,7,May
8456852,Jon,Klemm,8-Jan-70,Jan-8-1970,1/8/70,1/8/70,1970,1,8,Jan
8449136,Dave,Marcinyshyn,4-Feb-67,Feb-4-1967,2/4/67,2/4/67,1967,2,4,Feb
8457901,Andrew,Rymsha,10-Dec-68,Dec-10-1968,12/10/68,12/10/68,1968,12,10,Dec
8451840,Mikhail,Tatarinov,16-Jul-66,Jul-16-1966,7/16/66,7/16/66,1966,7,16,Jul
8455447,Niklas,Andersson,20-May-71,May-20-1971,5/20/71,5/20/71,1971,5,20,May
8448118,Tim,Hunter,10-Sep-60,Sep-10-1960,9/10/60,9/10/60,1960,9,10,Sep
8456882,Andrei,Kovalenko,7-Jun-70,Jun-7-1970,6/7/70,6/7/70,1970,6,7,Jun
8450817,Mike,Ricci,27-Oct-71,Oct-27-1971,10/27/71,10/27/71,1971,10,27,Oct
8458031,Chris,Simon,30-Jan-72,Jan-30-1972,1/30/72,1/30/72,1972,1,30,Jan
8446494,Steve,Duchesne,30-Jun-65,Jun-30-1965,6/30/65,6/30/65,1965,6,30,Jun
8456202,Leonard,Esau,16-Mar-68,Mar-16-1968,3/16/68,3/16/68,1968,3,16,Mar
8448048,Kerry,Huffman,3-Jan-68,Jan-3-1968,1/3/68,1/3/68,1968,1,3,Jan
8447775,Ron,Hextall,3-May-64,May-3-1964,5/3/64,5/3/64,1964,5,3,May
8445281,Bob,Bassen,6-May-65,May-6-1965,5/6/65,5/6/65,1965,5,6,May
8458538,Rene,Corbet,25-Jun-73,Jun-25-1973,6/25/73,6/25/73,1973,6,25,Jun
8456306,Iain,Fraser,10-Aug-69,Aug-10-1969,8/10/69,8/10/69,1969,8,10,Aug
8447091,Martin,Gelinas,5-Jun-70,Jun-5-1970,6/5/70,6/5/70,1970,6,5,Jun
8457069,Chris,Lindberg,16-Apr-67,Apr-16-1967,4/16/67,4/16/67,1967,4,16,Apr
8457533,Dwayne,Norris,8-Jan-70,Jan-8-1970,1/8/70,1/8/70,1970,1,8,Jan
8451152,Reginald,Savage,1-May-70,May-1-1970,5/1/70,5/1/70,1970,5,1,May
8459060,Paxton,Schulte,16-Jul-72,Jul-16-1972,7/16/72,7/16/72,1972,7,16,Jul
8451793,Ron,Sutter,2-Dec-63,Dec-2-1963,12/2/63,12/2/63,1963,12,2,Dec
8445803,Garth,Butcher,8-Jan-63,Jan-8-1963,1/8/63,1/8/63,1963,1,8,Jan
8446177,Alain,Cote,14-Apr-67,Apr-14-1967,4/14/67,4/14/67,1967,4,14,Apr
8456669,Mike,Hurlbut,7-Oct-66,Oct-7-1966,10/7/66,10/7/66,1966,10,7,Oct
8457312,Mike,Mckee,18-Jun-69,Jun-18-1969,6/18/69,6/18/69,1969,6,18,Jun
8457384,Aaron,Miller,11-Aug-71,Aug-11-1971,8/11/71,8/11/71,1971,8,11,Aug
8458373,Brad,Werenka,12-Feb-69,Feb-12-1969,2/12/69,2/12/69,1969,2,12,Feb
8458075,Garth,Snow,28-Jul-69,Jul-28-1969,7/28/69,7/28/69,1969,7,28,Jul
8459432,Jocelyn,Thibault,12-Jan-75,Jan-12-1975,1/12/75,1/12/75,1975,1,12,Jan
8446085,Wendel,Clark,25-Oct-66,Oct-25-1966,10/25/66,10/25/66,1966,10,25,Oct
8459436,Adam,Deadmarsh,10-May-75,May-10-1975,5/10/75,5/10/75,1975,5,10,May
8458520,Peter,Forsberg,20-Jul-73,Jul-20-1973,7/20/73,7/20/73,1973,7,20,Jul
8456647,Bill,Huard,24-Jun-67,Jun-24-1967,6/24/67,6/24/67,1967,6,24,Jun
8458805,Janne,Laukkanen,19-Mar-70,Mar-19-1970,3/19/70,3/19/70,1970,3,19,Mar
8448770,Sylvain,Lefebvre,14-Oct-67,Oct-14-1967,10/14/67,10/14/67,1967,10,14,Oct
8445454,John,Bethel,15-Jan-57,Jan-15-1957,1/15/57,1/15/57,1957,1,15,Jan
8446079,Dave,Christian,12-May-59,May-12-1959,5/12/59,5/12/59,1959,5,12,May
8446293,Pat,Daley,27-Mar-59,Mar-27-1959,3/27/59,3/27/59,1959,3,27,Mar
8446420,Wayne,Dillon,25-May-55,May-25-1955,5/25/55,5/25/55,1955,5,25,May
8447365,Hilliard,Graves,18-Oct-50,Oct-18-1950,10/18/50,10/18/50,1950,10,18,Oct
8447419,Bobby,Guindon,19-Nov-50,Nov-19-1950,11/19/50,11/19/50,1950,11,19,Nov
8447950,Larry,Hopkins,17-Mar-54,Mar-17-1954,3/17/54,3/17/54,1954,3,17,Mar
8448019,Dave,Hoyda,20-May-57,May-20-1957,5/20/57,5/20/57,1957,5,20,May
8448804,Bill,Lesuk,1-Nov-46,Nov-1-1946,11/1/46,11/1/46,1946,11,1,Nov
8448858,Willy,Lindstrom,5-May-51,May-5-1951,5/5/51,5/5/51,1951,5,5,May
8448912,Morris,Lukowich,1-Jun-56,Jun-1-1956,6/1/56,6/1/56,1956,6,1,Jun
8449190,Peter,Marsh,21-Dec-56,Dec-21-1956,12/21/56,12/21/56,1956,12,21,Dec
8447826,Gord,McTavish,3-Jun-54,Jun-3-1954,6/3/54,6/3/54,1954,6,3,Jun
8449650,Lyle,Moffatt,19-Mar-48,Mar-19-1948,3/19/48,3/19/48,1948,3,19,Mar
8450843,Bill,Riley,20-Sep-50,Sep-20-1950,9/20/50,9/20/50,1950,9,20,Sep
8450849,Gerry,Rioux,17-Feb-59,Feb-17-1959,2/17/59,2/17/59,1959,2,17,Feb
8451629,Lorne,Stamler,9-Aug-51,Aug-9-1951,8/9/51,8/9/51,1951,8,9,Aug
8451781,Peter,Sullivan,25-Jul-51,Jul-25-1951,7/25/51,7/25/51,1951,7,25,Jul
8451920,Glenn,Tomalty,23-Jul-54,Jul-23-1954,7/23/54,7/23/54,1954,7,23,Jul
8452495,Ron,Wilson,13-May-56,May-13-1956,5/13/56,5/13/56,1956,5,13,May
8444923,Mike,Amodeo,22-Jun-52,Jun-22-1952,6/22/52,6/22/52,1952,6,22,Jun
8445877,Al,Cameron,21-Oct-55,Oct-21-1955,10/21/55,10/21/55,1955,10,21,Oct
8445900,Scott,Campbell,22-Jun-57,Jun-22-1957,6/22/57,6/22/57,1957,6,22,Jun
8446168,Ross,Cory,4-Feb-57,Feb-4-1957,2/4/57,2/4/57,1957,2,4,Feb
8448959,Donald,MacIver,3-May-55,May-3-1955,5/3/55,5/3/55,1955,5,3,May
8449555,Barry,Melrose,15-Jul-56,Jul-15-1956,7/15/56,7/15/56,1956,7,15,Jul
8449927,Craig,Norwich,15-Dec-55,Dec-15-1955,12/15/55,12/15/55,1955,12,15,Dec
8451388,Lars,Sjoberg,5-Apr-44,Apr-5-1944,4/5/44,4/5/44,1944,4,5,Apr
8451529,Gord,Smith,17-Nov-49,Nov-17-1949,11/17/49,11/17/49,1949,11,17,Nov
8447483,Pierre,Hamel,16-Sep-52,Sep-16-1952,9/16/52,9/16/52,1952,9,16,Sep
8445353,Sandy,Beadle,12-Jul-60,Jul-12-1960,7/12/60,7/12/60,1960,7,12,Jul
8445643,Rick,Bowness,25-Jan-55,Jan-25-1955,1/25/55,1/25/55,1955,1,25,Jan
8446048,Dave,Chartier,15-Feb-61,Feb-15-1961,2/15/61,2/15/61,1961,2,15,Feb
8446498,Rick,Dudley,31-Jan-49,Jan-31-1949,1/31/49,1/31/49,1949,1,31,Jan
8446544,Murray,Eaves,10-May-60,May-10-1960,5/10/60,5/10/60,1960,5,10,May
8447115,Danny,Geoffrion,24-Jan-58,Jan-24-1958,1/24/58,1/24/58,1958,1,24,Jan
8448743,Doug,Lecuyer,10-Mar-58,Mar-10-1958,3/10/58,3/10/58,1958,3,10,Mar
8451691,Anders,Steen,28-Apr-55,Apr-28-1955,4/28/55,4/28/55,1955,4,28,Apr
8445520,Tom,Bladon,29-Dec-52,Dec-29-1952,12/29/52,12/29/52,1952,12,29,Dec
8448876,Barry,Long,31-Jan-49,Jan-31-1949,1/31/49,1/31/49,1949,1,31,Jan
8449731,Richard,Mulhern,1-Mar-55,Mar-1-1955,3/1/55,3/1/55,1955,3,1,Mar
8450465,Mark,Plantery,14-May-59,May-14-1959,5/14/59,5/14/59,1959,5,14,May
8451621,Don,Spring,16-Jun-59,Jun-16-1959,6/16/59,6/16/59,1959,6,16,Jun
8452419,William,Whelton,28-Aug-59,Aug-28-1959,8/28/59,8/28/59,1959,8,28,Aug
8448861,Ronald,Loustel,7-Mar-62,Mar-7-1962,3/7/62,3/7/62,1962,3,7,Mar
8445088,Scott,Arniel,17-Sep-62,Sep-17-1962,9/17/62,9/17/62,1962,9,17,Sep
8447685,Dale,Hawerchuk,4-Apr-63,Apr-4-1963,4/4/63,4/4/63,1963,4,4,Apr
8448860,Bengt,Lundholm,4-Aug-55,Aug-4-1955,8/4/55,8/4/55,1955,8,4,Aug
8448981,Paul,Maclean,9-Mar-58,Mar-9-1958,3/9/58,3/9/58,1958,3,9,Mar
8451697,Thomas,Steen,8-Jun-60,Jun-8-1960,6/8/60,6/8/60,1960,6,8,Jun
8451150,Serge,Savard,22-Jan-46,Jan-22-1946,1/22/46,1/22/46,1946,1,22,Jan
8452347,Tim,Watters,25-Jul-59,Jul-25-1959,7/25/59,7/25/59,1959,7,25,Jul
8451595,Doug,Soetaert,21-Apr-55,Apr-21-1955,4/21/55,4/21/55,1955,4,21,Apr
8445603,Laurie,Boschman,4-Jun-60,Jun-4-1960,6/4/60,6/4/60,1960,6,4,Jun
8445808,Jerry,Butler,27-Feb-51,Feb-27-1951,2/27/51,2/27/51,1951,2,27,Feb
8449742,Brian,Mullen,16-Mar-62,Mar-16-1962,3/16/62,3/16/62,1962,3,16,Mar
8445901,Wade,Campbell,2-Jan-61,Jan-2-1961,1/2/61,1/2/61,1961,1,2,Jan
8448577,Jim,Kyte,21-Mar-64,Mar-21-1964,3/21/64,3/21/64,1964,3,21,Mar
8447161,John,Gibson,2-Jul-59,Jul-2-1959,7/2/59,7/2/59,1959,7,2,Jul
8448688,Mike,Lauen,9-Feb-61,Feb-9-1961,2/9/61,2/9/61,1961,2,9,Feb
8449326,Andrew,Mcbain,18-Feb-65,Feb-18-1965,2/18/65,2/18/65,1965,2,18,Feb
8445938,Randy,Carlyle,19-Apr-56,Apr-19-1956,4/19/56,4/19/56,1956,4,19,Apr
8451257,Jyrki,Seppa,14-Nov-61,Nov-14-1961,11/14/61,11/14/61,1961,11,14,Nov
8445457,Marc,Behrend,11-Jan-61,Jan-11-1961,1/11/61,1/11/61,1961,1,11,Jan
8449884,Jim,Nill,11-Apr-58,Apr-11-1958,4/11/58,4/11/58,1958,4,11,Apr
8450497,Paul,Pooley,2-Aug-60,Aug-2-1960,8/2/60,8/2/60,1960,8,2,Aug
8451992,Perry,Turnbull,9-Mar-59,Mar-9-1959,3/9/59,3/9/59,1959,3,9,Mar
8446626,Dave,Ellett,30-Mar-64,Mar-30-1964,3/30/64,3/30/64,1964,3,30,Mar
8449458,Dan,Mcfall,8-Apr-63,Apr-8-1963,4/8/63,4/8/63,1963,4,8,Apr
8447940,Mark,Holden,12-Jun-57,Jun-12-1957,6/12/57,6/12/57,1957,6,12,Jun
8446468,Peter,Douris,19-Feb-66,Feb-19-1966,2/19/66,2/19/66,1966,2,19,Feb
8449540,Anssi,Melametsa,21-Jun-61,Jun-21-1961,6/21/61,6/21/61,1961,6,21,Jun
8451361,Dave,Silk,1-Jan-58,Jan-1-1958,1/1/58,1/1/58,1958,1,1,Jan
8451729,Ryan,Stewart,1-Jun-67,Jun-1-1967,6/1/67,6/1/67,1967,6,1,Jun
8446516,Iain,Duncan,4-Aug-63,Aug-4-1963,8/4/63,8/4/63,1963,8,4,Aug
8446682,Craig,Endean,13-Apr-68,Apr-13-1968,4/13/68,4/13/68,1968,4,13,Apr
8447485,Gilles,Hamel,18-Mar-60,Mar-18-1960,3/18/60,3/18/60,1960,3,18,Mar
8448253,Hannu,Jarvenpaa,19-May-63,May-19-1963,5/19/63,5/19/63,1963,5,19,May
8448366,Brad,Jones,26-Jun-65,Jun-26-1965,6/26/65,6/26/65,1965,6,26,Jun
8451008,Steve,Rooney,28-Jun-62,Jun-28-1962,6/28/62,6/28/62,1962,6,28,Jun
8449971,Fredrik,Olausson,5-Oct-66,Oct-5-1966,10/5/66,10/5/66,1966,10,5,Oct
8450311,Steve,Penney,2-Feb-61,Feb-2-1961,2/2/61,2/2/61,1961,2,2,Feb
8450727,Eldon,Reddick,6-Oct-64,Oct-6-1964,10/6/64,10/6/64,1964,10,6,Oct
8446676,Pat,Elynuik,30-Oct-67,Oct-30-1967,10/30/67,10/30/67,1967,10,30,Oct
8451981,Alfie,Turcotte,5-Jan-65,Jan-5-1965,1/5/65,1/5/65,1965,1,5,Jan
8446867,Todd,Flichel,14-Sep-64,Sep-14-1964,9/14/64,9/14/64,1964,9,14,Sep
8447292,Guy,Gosselin,6-Jun-64,Jun-6-1964,6/6/64,6/6/64,1964,6,6,Jun
8451239,Dwight,Schofield,25-Mar-56,Mar-25-1956,3/25/56,3/25/56,1956,3,25,Mar
8445654,Darren,Boyko,16-Jan-64,Jan-16-1964,1/16/64,1/16/64,1964,1,16,Jan
8448053,Brent,Hughes,5-Apr-66,Apr-5-1966,4/5/66,4/5/66,1966,4,5,Apr
8448116,Dave,Hunter,1-Jan-58,Jan-1-1958,1/1/58,1/1/58,1958,1,1,Jan
8448381,Anthony,Joseph,1-Mar-69,Mar-1-1969,3/1/69,3/1/69,1969,3,1,Mar
8448551,Markku,Kyllonen,2-Feb-62,Feb-2-1962,2/2/62,2/2/62,1962,2,2,Feb
8448678,Guy,Larose,31-Jul-67,Jul-31-1967,7/31/67,7/31/67,1967,7,31,Jul
8448758,Moe,Lemay,18-Feb-62,Feb-18-1962,2/18/62,2/18/62,1962,2,18,Feb
8447756,Matthew,Block,16-May-66,May-16-1966,5/16/66,5/16/66,1966,5,16,May
8446852,Steven,Fletcher,31-Mar-62,Mar-31-1962,3/31/62,3/31/62,1962,3,31,Mar
8449924,Teppo,Numminen,3-Jul-68,Jul-3-1968,7/3/68,7/3/68,1968,7,3,Jul
8446052,Alain,Chevrier,23-Apr-61,Apr-23-1961,4/23/61,4/23/61,1961,4,23,Apr
8446480,Tom,Draper,20-Nov-66,Nov-20-1966,11/20/66,11/20/66,1966,11,20,Nov
8446719,Bob,Essensa,14-Jan-65,Jan-14-1965,1/14/65,1/14/65,1965,1,14,Jan
8446127,Danton,Cole,10-Jan-67,Jan-10-1967,1/10/67,1/10/67,1967,1,10,Jan
8446735,Doug,Evans,2-Jun-63,Jun-2-1963,6/2/63,6/2/63,1963,6,2,Jun
8449488,Dave,Mcllwain,9-Jun-67,Jun-9-1967,6/9/67,6/9/67,1967,6,9,Jun
8449487,Brian,McReynolds,5-Jan-65,Jan-5-1965,1/5/65,1/5/65,1965,1,5,Jan
8451828,Phil,Sykes,18-Mar-59,Mar-18-1959,3/18/59,3/18/59,1959,3,18,Mar
8446243,Shawn,Cronin,20-Aug-63,Aug-20-1963,8/20/63,8/20/63,1963,8,20,Aug
8445382,Stephane,Beauregard,10-Jan-68,Jan-10-1968,1/10/68,1/10/68,1968,1,10,Jan
8455659,Luciano,Borsato,7-Jan-66,Jan-7-1966,1/7/66,1/7/66,1966,1,7,Jan
8446485,Kris,Draper,24-May-71,May-24-1971,5/24/71,5/24/71,1971,5,24,May
8446508,Craig,Duncanson,17-Mar-67,Mar-17-1967,3/17/67,3/17/67,1967,3,17,Mar
8446705,Bryan,Erickson,7-Mar-60,Mar-7-1960,3/7/60,3/7/60,1960,3,7,Mar
8448481,Sergei,Kharin,20-Feb-63,Feb-20-1963,2/20/63,2/20/63,1963,2,20,Feb
8449973,Eddie,Olczyk,16-Aug-66,Aug-16-1966,8/16/66,8/16/66,1966,8,16,Aug
8450073,Mark,Osborne,13-Aug-61,Aug-13-1961,8/13/61,8/13/61,1961,8,13,Aug
8452377,Simon,Wheeldon,30-Aug-66,Aug-30-1966,8/30/66,8/30/66,1966,8,30,Aug
8447989,Phil,Housley,9-Mar-64,Mar-9-1964,3/9/64,3/9/64,1964,3,9,Mar
8450486,Rudy,Poeschek,29-Sep-66,Sep-29-1966,9/29/66,9/29/66,1966,9,29,Sep
8455521,Stu,Barnes,25-Dec-70,Dec-25-1970,12/25/70,12/25/70,1970,12,25,Dec
8455879,Jason,Cirone,21-Feb-71,Feb-21-1971,2/21/71,2/21/71,1971,2,21,Feb
8456019,Evgeny,Davydov,27-May-67,May-27-1967,5/27/67,5/27/67,1967,5,27,May
8447673,Mike,Hartman,7-Feb-67,Feb-7-1967,2/7/67,2/7/67,1967,2,7,Feb
8448374,Bob,Joyce,11-Jul-66,Jul-11-1966,7/11/66,7/11/66,1966,7,11,Jul
8448765,John,Leblanc,21-Jan-64,Jan-21-1964,1/21/64,1/21/64,1964,1,21,Jan
8449761,Rob,Murray,4-Apr-67,Apr-4-1967,4/4/67,4/4/67,1967,4,4,Apr
8449773,Troy,Murray,31-Jul-62,Jul-31-1962,7/31/62,7/31/62,1962,7,31,Jul
8457847,Russ,Romaniuk,9-Jun-70,Jun-9-1970,6/9/70,6/9/70,1970,6,9,Jun
8451334,Darrin,Shannon,8-Dec-69,Dec-8-1969,12/8/69,12/8/69,1969,12,8,Dec
8451429,Petri,Skriko,13-Mar-62,Mar-13-1962,3/13/62,3/13/62,1962,3,13,Mar
8448449,Dean,Kennedy,18-Jan-63,Jan-18-1963,1/18/63,1/18/63,1963,1,18,Jan
8448633,Mike,Lalor,8-Mar-63,Mar-8-1963,3/8/63,3/8/63,1963,3,8,Mar
8450260,Kent,Paynter,27-Apr-65,Apr-27-1965,4/27/65,4/27/65,1965,4,27,Apr
8458715,Igor,Ulanov,1-Oct-69,Oct-1-1969,10/1/69,10/1/69,1969,10,1,Oct
8457559,Michael,O'Neill,3-Nov-67,Nov-3-1967,11/3/67,11/3/67,1967,11,3,Nov
8445683,Andy,Brickley,9-Aug-61,Aug-9-1961,8/9/61,8/9/61,1961,8,9,Aug
8446454,Tie,Domi,1-Nov-69,Nov-1-1969,11/1/69,11/1/69,1969,11,1,Nov
8446487,John,Druce,23-Feb-66,Feb-23-1966,2/23/66,2/23/66,1966,2,23,Feb
8448467,Alan,Kerr,28-Mar-64,Mar-28-1964,3/28/64,3/28/64,1964,3,28,Mar
8448487,Kris,King,18-Feb-66,Feb-18-1966,2/18/66,2/18/66,1966,2,18,Feb
8457061,Scott,Levins,30-Jan-70,Jan-30-1970,1/30/70,1/30/70,1970,1,30,Jan
8457981,Teemu,Selanne,3-Jul-70,Jul-3-1970,7/3/70,7/3/70,1970,7,3,Jul
8458487,Alexei,Zhamnov,1-Oct-70,Oct-1-1970,10/1/70,10/1/70,1970,10,1,Oct
8458953,Sergei,Bautin,11-Mar-67,Mar-11-1967,3/11/67,3/11/67,1967,3,11,Mar
8456153,Dallas,Eakins,20-Jan-67,Jan-20-1967,1/20/67,1/20/67,1967,1,20,Jan
8459359,Anatoli,Fedotov,11-May-66,May-11-1966,5/11/66,5/11/66,1966,5,11,May
8448014,Jim,Hrivnak,28-May-68,May-28-1968,5/28/68,5/28/68,1968,5,28,May
8456106,Dallas,Drake,4-Feb-69,Feb-4-1969,2/4/69,2/4/69,1969,2,4,Feb
8446832,Craig,Fisher,30-Jun-70,Jun-30-1970,6/30/70,6/30/70,1970,6,30,Jun
8459568,Michal,Grosek,1-Jun-75,Jun-1-1975,6/1/75,6/1/75,1975,6,1,Jun
8458613,Yan,Kaminsky,28-Jul-71,Jul-28-1971,7/28/71,7/28/71,1971,7,28,Jul
8449354,Kevin,McClelland,4-Jul-62,Jul-4-1962,7/4/62,7/4/62,1962,7,4,Jul
8458234,David,Tomlinson,8-May-68,May-8-1968,5/8/68,5/8/68,1968,5,8,May
8458321,Harije,Vitolinish,30-Apr-68,Apr-30-1968,4/30/68,4/30/68,1968,4,30,Apr
8452571,Paul,Ysebaert,15-May-66,May-15-1966,5/15/66,5/15/66,1966,5,15,May
8455629,Arto,Blomsten,16-Mar-65,Mar-16-1965,3/16/65,3/16/65,1965,3,16,Mar
8449123,Dave,Manson,27-Jan-67,Jan-27-1967,1/27/67,1/27/67,1967,1,27,Jan
8449328,Wayne,Mcbean,21-Feb-69,Feb-21-1969,2/21/69,2/21/69,1969,2,21,Feb
8458919,Oleg,Mikulchik,27-Jun-64,Jun-27-1964,6/27/64,6/27/64,1964,6,27,Jun
8458963,Boris,Mironov,21-Mar-72,Mar-21-1972,3/21/72,3/21/72,1972,3,21,Mar
8450620,Stephane,Quintal,22-Oct-68,Oct-22-1968,10/22/68,10/22/68,1968,10,22,Oct
8459020,Mark,Visheau,27-Jun-73,Jun-27-1973,6/27/73,6/27/73,1973,6,27,Jun
8446082,Tim,Cheveldae,15-Feb-68,Feb-15-1968,2/15/68,2/15/68,1968,2,15,Feb
8456156,Mike,Eastwood,1-Jul-67,Jul-1-1967,7/1/67,7/1/67,1967,7,1,Jul
8460550,Tavis,Hansen,17-Jun-75,Jun-17-1975,6/17/75,6/17/75,1975,6,17,Jun
8458974,Igor,Korolev,6-Sep-70,Sep-6-1970,9/6/70,9/6/70,1970,9,6,Sep
8457228,Craig,Martin,21-Jan-71,Jan-21-1971,1/21/71,1/21/71,1971,1,21,Jan
8445655,Greg,Brown,7-Mar-68,Mar-7-1968,3/7/68,3/7/68,1968,3,7,Mar
8458212,Brent,Thompson,9-Jan-71,Jan-9-1971,1/9/71,1/9/71,1971,1,9,Jan
8459140,Nikolai,Khabibulin,13-Jan-73,Jan-13-1973,1/13/73,1/13/73,1973,1,13,Jan
8455850,Denis,Chasse,7-Feb-70,Feb-7-1970,2/7/70,2/7/70,1970,2,7,Feb
8462038,Shane,Doan,10-Oct-76,Oct-10-1976,10/10/76,10/10/76,1976,10,10,Oct
8459518,Ravil,Gusmanov,25-Jun-72,Jun-25-1972,6/25/72,6/25/72,1972,6,25,Jun
8448222,Craig,Janney,26-Sep-67,Sep-26-1967,9/26/67,9/26/67,1967,9,26,Sep
8462035,Chad,Kilger,27-Nov-76,Nov-27-1976,11/27/76,11/27/76,1976,11,27,Nov
8460596,Craig,Mills,27-Aug-76,Aug-27-1976,8/27/76,8/27/76,1976,8,27,Aug
8457849,Ed,Ronan,21-Mar-68,Mar-21-1968,3/21/68,3/21/68,1968,3,21,Mar
8462063,Jason,Doig,29-Jan-77,Jan-29-1977,1/29/77,1/29/77,1977,1,29,Jan
8446826,Jeff,Finley,14-Apr-67,Apr-14-1967,4/14/67,4/14/67,1967,4,14,Apr
8457193,Stewart,Malgunas,21-Apr-70,Apr-21-1970,4/21/70,4/21/70,1970,4,21,Apr
8449749,Craig,Muni,19-Jul-62,Jul-19-1962,7/19/62,7/19/62,1962,7,19,Jul
8460521,Deron,Quint,12-Mar-76,Mar-12-1976,3/12/76,3/12/76,1976,3,12,Mar
8460493,Oleg,Tverdovsky,18-May-76,May-18-1976,5/18/76,5/18/76,1976,5,18,May
8457866,Dominic,Roussel,22-Feb-70,Feb-22-1970,2/22/70,2/22/70,1970,2,22,Feb
8444999,Ron,Andruff,10-Jul-53,Jul-10-1953,7/10/53,7/10/53,1953,7,10,Jul
8445309,Don,Cairns,8-Oct-55,Oct-8-1955,10/8/55,10/8/55,1955,10,8,Oct
8446253,Gary,Croteau,20-Jun-46,Jun-20-1946,6/20/46,6/20/46,1946,6,20,Jun
8446349,Barry,Dean,26-Feb-55,Feb-26-1955,2/26/55,2/26/55,1955,2,26,Feb
8446371,Ron,Delorme,3-Sep-55,Sep-3-1955,9/3/55,9/3/55,1955,9,3,Sep
8446378,Guy,Delparte,30-Aug-49,Aug-30-1949,8/30/49,8/30/49,1949,8,30,Aug
8445964,Denis,Dupere,21-Jun-48,Jun-21-1948,6/21/48,6/21/48,1948,6,21,Jun
8447047,Paul,Gardner,5-Mar-56,Mar-5-1956,3/5/56,3/5/56,1956,3,5,Mar
8446653,Danny,Gruen,26-Jun-52,Jun-26-1952,6/26/52,6/26/52,1952,6,26,Jun
8446944,Dave,Hudson,28-Dec-49,Dec-28-1949,12/28/49,12/28/49,1949,12,28,Dec
8448031,Simon,Nolet,23-Nov-41,Nov-23-1941,11/23/41,11/23/41,1941,11,23,Nov
8450631,Nelson,Pyatt,9-Sep-53,Sep-9-1953,9/9/53,9/9/53,1953,9,9,Sep
8448353,Phil,Roberto,1-Jan-49,Jan-1-1949,1/1/49,1/1/49,1949,1,1,Jan
8448460,Randy,Rota,16-Aug-50,Aug-16-1950,8/16/50,8/16/50,1950,8,16,Aug
8448999,Sean,Shanahan,8-Feb-51,Feb-8-1951,2/8/51,2/8/51,1951,2,8,Feb
8451403,Larry,Skinner,21-Apr-56,Apr-21-1956,4/21/56,4/21/56,1956,4,21,Apr
8445893,Colin,Campbell,28-Jan-53,Jan-28-1953,1/28/53,1/28/53,1953,1,28,Jan
8445965,Steve,Durbano,12-Dec-51,Dec-12-1951,12/12/51,12/12/51,1951,12,12,Dec
8446593,Tom,Edur,18-Nov-54,Nov-18-1954,11/18/54,11/18/54,1954,11,18,Nov
8447106,Larry,Johnston,20-Jul-43,Jul-20-1943,7/20/43,7/20/43,1943,7,20,Jul
8448498,Mike,Kitchen,1-Feb-56,Feb-1-1956,2/1/56,2/1/56,1956,2,1,Feb
8447373,Bryan,Lefley,18-Oct-48,Oct-18-1948,10/18/48,10/18/48,1948,10,18,Oct
8448760,Roger,Lemelin,6-Feb-54,Feb-6-1954,2/6/54,2/6/54,1954,2,6,Feb
8448190,Tracy,Pratt,8-Mar-43,Mar-8-1943,3/8/43,3/8/43,1943,3,8,Mar
8446794,Doug,Favell,5-Apr-45,Apr-5-1945,4/5/45,4/5/45,1945,4,5,Apr
8449491,Bill,McKenzie,12-Mar-49,Mar-12-1949,3/12/49,3/12/49,1949,3,12,Mar
8444908,Fred,Ahern Jr,12-Feb-52,Feb-12-1952,2/12/52,2/12/52,1952,2,12,Feb
8448283,Rick,Jodzio,3-Jun-54,Jun-3-1954,6/3/54,6/3/54,1954,6,3,Jun
8448501,Ralph,Klassen,15-Sep-55,Sep-15-1955,9/15/55,9/15/55,1955,9,15,Sep
8449813,Bob,Neely,9-Nov-53,Nov-9-1953,11/9/53,11/9/53,1953,11,9,Nov
8448012,Lou,Nistico,25-Jan-53,Jan-25-1953,1/25/53,1/25/53,1953,1,25,Jan
8451623,Andy,Spruce,17-Apr-54,Apr-17-1954,4/17/54,4/17/54,1954,4,17,Apr
8445397,Barry,Beck,3-Jun-57,Jun-3-1957,6/3/57,6/3/57,1957,6,3,Jun
8446058,Mike,Christie,20-Dec-49,Dec-20-1949,12/20/49,12/20/49,1949,12,20,Dec
8449325,John,McCahill,2-Dec-55,Dec-2-1955,12/2/55,12/2/55,1955,12,2,Dec
8450085,Dennis,Owchar,28-Mar-53,Mar-28-1953,3/28/53,3/28/53,1953,3,28,Mar
8451802,Mark,Suzor,5-Nov-56,Nov-5-1956,11/5/56,11/5/56,1956,11,5,Nov
8449978,Bill,Oleschuk,20-Jul-55,Jul-20-1955,7/20/55,7/20/55,1955,7,20,Jul
8445103,Don,Ashby,8-Mar-55,Mar-8-1955,3/8/55,3/8/55,1955,3,8,Mar
8446120,Rey,Comeau,25-Oct-48,Oct-25-1948,10/25/48,10/25/48,1948,10,25,Oct
8446539,Mike,Dwyer,16-Sep-57,Sep-16-1957,9/16/57,9/16/57,1957,9,16,Sep
8447191,Mike,Gillis,1-Dec-58,Dec-1-1958,12/1/58,12/1/58,1958,12,1,Dec
8448866,Bill,Lochead,13-Oct-54,Oct-13-1954,10/13/54,10/13/54,1954,10,13,Oct
8449571,Paul,Messier,27-Jan-58,Jan-27-1958,1/27/58,1/27/58,1958,1,27,Jan
8450091,Clayton,Pachal,21-Apr-56,Apr-21-1956,4/21/56,4/21/56,1956,4,21,Apr
8451100,Don,Saleski,10-Nov-49,Nov-10-1949,11/10/49,11/10/49,1949,11,10,Nov
8452155,Jack,Valiquette,18-Mar-56,Mar-18-1956,3/18/56,3/18/56,1956,3,18,Mar
8444988,Don,Awrey,18-Jul-43,Jul-18-1943,7/18/43,7/18/43,1943,7,18,Jul
8448285,Trevor,Johansen,30-Mar-57,Mar-30-1957,3/30/57,3/30/57,1957,3,30,Mar
8447238,Kevin,Krook,5-Apr-58,Apr-5-1958,4/5/58,4/5/58,1958,4,5,Apr
8448601,Michel,Lachance,11-May-55,May-11-1955,5/11/55,5/11/55,1955,5,11,May
8449371,Joe,Watson,6-Jul-43,Jul-6-1943,7/6/43,7/6/43,1943,7,6,Jul
8445158,Bob,Attwell,26-Dec-59,Dec-26-1959,12/26/59,12/26/59,1959,12,26,Dec
8445451,Doug,Berry,3-Jun-57,Jun-3-1957,6/3/57,6/3/57,1957,6,3,Jun
8449423,Lanny,Mcdonald,16-Feb-53,Feb-16-1953,2/16/53,2/16/53,1953,2,16,Feb
8450338,Steve,Peters,23-Jan-60,Jan-23-1960,1/23/60,1/23/60,1960,1,23,Jan
8450894,Rene,Robert,31-Dec-48,Dec-31-1948,12/31/48,12/31/48,1948,12,31,Dec
8451204,Bobby,Schmautz,28-Mar-45,Mar-28-1945,3/28/45,3/28/45,1945,3,28,Mar
8449004,Bobby,Sheehan,11-Jan-49,Jan-11-1949,1/11/49,1/11/49,1949,1,11,Jan
8451475,Barry,Smith,25-Apr-55,Apr-25-1955,4/25/55,4/25/55,1955,4,25,Apr
8451775,Peter,Sturgeon,12-Feb-54,Feb-12-1954,2/12/54,2/12/54,1954,2,12,Feb
8452304,David,Watson,19-May-58,May-19-1958,5/19/58,5/19/58,1958,5,19,May
8447140,Mario,Giallonardo,23-Sep-57,Sep-23-1957,9/23/57,9/23/57,1957,9,23,Sep
8449715,Kevin,Morrison,28-Oct-49,Oct-28-1949,10/28/49,10/28/49,1949,10,28,Oct
8451995,Dean,Turner,22-Jun-58,Jun-22-1958,6/22/58,6/22/58,1958,6,22,Jun
8445121,Hardy,Astrom,29-Mar-51,Mar-29-1951,3/29/51,3/29/51,1951,3,29,Mar
8446162,Ed,Cooper,28-Aug-60,Aug-28-1960,8/28/60,8/28/60,1960,8,28,Aug
8455965,Bobby,Crawford,27-May-60,May-27-1960,5/27/60,5/27/60,1960,5,27,May
8446419,Gary,Dillon,28-Feb-59,Feb-28-1959,2/28/59,2/28/59,1959,2,28,Feb
8446993,Paul,Gagne,6-Feb-62,Feb-6-1962,2/6/62,2/6/62,1962,2,6,Feb
8449623,Bob,Miller,28-Sep-56,Sep-28-1956,9/28/56,9/28/56,1956,9,28,Sep
8451857,Steve,Tambellini,14-May-58,May-14-1958,5/14/58,5/14/58,1958,5,14,May
8452290,Joseph,Ward,11-Feb-61,Feb-11-1961,2/11/61,2/11/61,1961,2,11,Feb
8445175,Les,Auge,16-May-53,May-16-1953,5/16/53,5/16/53,1953,5,16,May
8445212,Bill,Baker,29-Nov-56,Nov-29-1956,11/29/56,11/29/56,1956,11,29,Nov
8447568,Terry,Harper,27-Jan-40,Jan-27-1940,1/27/40,1/27/40,1940,1,27,Jan
8448071,Jack,Hughes,20-Jul-57,Jul-20-1957,7/20/57,7/20/57,1957,7,20,Jul
8448412,Jari,Kaarela,8-Aug-58,Aug-8-1958,8/8/58,8/8/58,1958,8,8,Aug
8449784,Phil,Myre,1-Nov-48,Nov-1-1948,11/1/48,11/1/48,1948,11,1,Nov
8450802,Glenn,Resch,10-Jul-48,Jul-10-1948,7/10/48,7/10/48,1948,7,10,Jul
8445878,Dave,Cameron,29-Jul-58,Jul-29-1958,7/29/58,7/29/58,1958,7,29,Jul
8446054,Richard,Chernomaz,1-Sep-63,Sep-1-1963,9/1/63,9/1/63,1963,9,1,Sep
8446939,Dwight,Foster,2-Apr-57,Apr-2-1957,4/2/57,4/2/57,1957,4,2,Apr
8447434,Peter,Gustavsson,30-Mar-58,Mar-30-1958,3/30/58,3/30/58,1958,3,30,Mar
8448426,Christer,Kellgren,15-Aug-58,Aug-15-1958,8/15/58,8/15/58,1958,8,15,Aug
8448474,Veli-Pekka,Ketola,28-Mar-48,Mar-28-1948,3/28/48,3/28/48,1948,3,28,Mar
8448706,Jeff,Larmer,10-Nov-62,Nov-10-1962,11/10/62,11/10/62,1962,11,10,Nov
8448808,Don,Lever,14-Nov-52,Nov-14-1952,11/14/52,11/14/52,1952,11,14,Nov
8448991,Bob,MacMillan,3-Dec-52,Dec-3-1952,12/3/52,12/3/52,1952,12,3,Dec
8449611,Paul,Miller,21-Aug-59,Aug-21-1959,8/21/59,8/21/59,1959,8,21,Aug
8450501,Jukka,Porvari,19-Jan-54,Jan-19-1954,1/19/54,1/19/54,1954,1,19,Jan
8452364,Stan,Weir,17-Mar-52,Mar-17-1952,3/17/52,3/17/52,1952,3,17,Mar
8448817,Tapio,Levo,24-Sep-55,Sep-24-1955,9/24/55,9/24/55,1955,9,24,Sep
8448885,Bob,Lorimer,25-Aug-53,Aug-25-1953,8/25/53,8/25/53,1953,8,25,Aug
8449580,Joe,Micheletti,24-Oct-54,Oct-24-1954,10/24/54,10/24/54,1954,10,24,Oct
8449880,Graeme,Nicolson,13-Jan-58,Jan-13-1958,1/13/58,1/13/58,1958,1,13,Jan
8448614,Richard,Laferriere,3-Jan-61,Jan-3-1961,1/3/61,1/3/61,1961,1,3,Jan
8445802,Rusty,Crawford,7-Nov-1885,Nov-7-1885,11/7/1885,1885-11-07,1885,11,7,Nov
8445844,Jack,Darragh,4-Dec-1890,Dec-4-1890,12/4/1890,1890-12-04,1890,12,4,Dec
8445874,Cy,Denneny,23-Dec-1891,Dec-23-1891,12/23/1891,1891-12-23,1891,12,23,Dec
8446581,Eddie,Gerard,22-Feb-1890,Feb-22-1890,2/22/1890,1890-02-22,1890,2,22,Feb
8447013,Harry,Hyland,2-Jan-1889,Jan-2-1889,1/2/1889,1889-01-02,1889,1,2,Jan
8447522,Ed,Lowrey,13-Aug-1891,Aug-13-1891,8/13/1891,1891-08-13,1891,8,13,Aug
8448011,Frank,Nighbor,26-Jan-1893,Jan-26-1893,1/26/1893,1893-01-26,1893,1,26,Jan
8445135,George,Boucher,19-Aug-1896,Aug-19-1896,8/19/1896,1896-08-19,1896,8,19,Aug
8445191,Morley,Bruce,7-Mar-1894,Mar-7-1894,3/7/1894,1894-03-07,1894,3,7,Mar
8447848,Horace,Merrill,30-Nov-1885,Nov-30-1885,11/30/1885,1885-11-30,1885,11,30,Nov
8448336,Dave,Ritchie,12-Jan-1892,Jan-12-1892,1/12/1892,1892-01-12,1892,1,12,Jan
8449025,Hamby,Shore,12-Feb-1886,Feb-12-1886,2/12/1886,1886-02-12,1886,2,12,Feb
8449817,Clint,Benedict,26-Sep-1892,Sep-26-1892,9/26/1892,1892-09-26,1892,9,26,Sep
8445168,Punch,Broadbent,13-Jul-1892,Jul-13-1892,7/13/1892,1892-07-13,1892,7,13,Jul
8445314,Harry,Cameron,6-Feb-1890,Feb-6-1890,2/6/1890,1890-02-06,1890,2,6,Feb
8445497,Sprague,Cleghorn,11-Mar-1890,Mar-11-1890,3/11/1890,1890-03-11,1890,3,11,Mar
8448441,Skene,Ronan,9-Feb-1889,Feb-9-1889,2/9/1889,1889-02-09,1889,2,9,Feb
8447791,Jack,MacKell,12-Apr-1896,Apr-12-1896,4/12/1896,1896-04-12,1896,4,12,Apr
8446629,Leth,Graham,10-Oct-1894,Oct-10-1894,10/10/1894,1894-10-10,1894,10,10,Oct
8445044,Billy,Bell,10-Jun-1891,Jun-10-1891,6/10/1891,1891-06-10,1891,6,10,Jun
8445134,Frank,Boucher,7-Oct-01,Oct-7-1901,10/7/01,10/7/01,1901,10,7,Oct
8445471,King,Clancy,25-Feb-03,Feb-25-1903,2/25/03,2/25/03,1903,2,25,Feb
8446767,Harry,Helman,28-Aug-1894,Aug-28-1894,8/28/1894,1894-08-28,1894,8,28,Aug
8446886,Lionel,Hitchman,3-Nov-01,Nov-3-1901,11/3/01,11/3/01,1901,11,3,Nov
8446298,Frank,Finnigan,9-Jul-03,Jul-9-1903,7/9/03,7/9/03,1903,7,9,Jul
8449090,Rod,Smylie,28-Sep-1895,Sep-28-1895,9/28/1895,1895-09-28,1895,9,28,Sep
8445319,Earl,Campbell,23-Jul-00,Jul-23-1900,7/23/00,7/23/00,1900,7,23,Jul
8449990,Sammy,Hebert,31-Mar-1894,Mar-31-1894,3/31/1894,1894-03-31,1894,3,31,Mar
8449077,Hooley,Smith,7-Jan-03,Jan-7-1903,1/7/03,1/7/03,1903,1,7,Jan
8446616,Ed,Gorman,25-Sep-1892,Sep-25-1892,9/25/1892,1892-09-25,1892,9,25,Sep
8449059,Alex,Smith,2-Apr-02,Apr-2-1902,4/2/02,4/2/02,1902,4,2,Apr
8449856,Alec,Connell,8-Feb-02,Feb-8-1902,2/8/02,2/8/02,1902,2,8,Feb
8445959,John,Duggan,17-Dec-1898,Dec-17-1898,12/17/1898,1898-12-17,1898,12,17,Dec
8447181,Hec,Kilrea,11-Jun-07,Jun-11-1907,6/11/07,6/11/07,1907,6,11,Jun
8444861,Jack,Adams,14-Jun-1895,Jun-14-1895,6/14/1895,1895-06-14,1895,6,14,Jun
8446673,Milt,Halliday,21-Sep-06,Sep-21-1906,9/21/06,9/21/06,1906,9,21,Sep
8447035,Stan,Jackson,27-Aug-1898,Aug-27-1898,8/27/1898,1898-08-27,1898,8,27,Aug
8446600,Sam,Godin,20-Sep-09,Sep-20-1909,9/20/09,9/20/09,1909,9,20,Sep
8446652,Len,Grosvenor,21-Jul-05,Jul-21-1905,7/21/05,7/21/05,1905,7,21,Jul
8445442,Gene,Chouinard,5-Jan-02,Jan-5-1902,1/5/02,1/5/02,1902,1,5,Jan
8449019,Al,Shields,10-May-07,May-10-1907,5/10/07,5/10/07,1907,5,10,May
8446144,Fred,Elliott,18-Feb-03,Feb-18-1903,2/18/03,2/18/03,1903,2,18,Feb
8447306,Joe,Lamb,18-Jun-06,Jun-18-1906,6/18/06,6/18/06,1906,6,18,Jun
8449246,Bill,Touhey,23-Mar-06,Mar-23-1906,3/23/06,3/23/06,1906,3,23,Mar
8445525,Harry,Connor,3-Dec-04,Dec-3-1904,12/3/04,12/3/04,1904,12,3,Dec
8445762,Danny,Cox,12-Oct-03,Oct-12-1903,10/12/03,10/12/03,1903,10,12,Oct
8446514,Art,Gagne,11-Oct-1897,Oct-11-1897,10/11/1897,1897-10-11,1897,10,11,Oct
8446924,Syd,Howe,28-Sep-11,Sep-28-1911,9/28/11,9/28/11,1911,9,28,Sep
8447183,Wally,Kilrea,18-Feb-09,Feb-18-1909,2/18/09,2/18/09,1909,2,18,Feb
8447012,Bill,Hutton,28-Jan-10,Jan-28-1910,1/28/10,1/28/10,1910,1,28,Jan
8449160,Harold,Starr,6-Jul-06,Jul-6-1906,7/6/06,7/6/06,1906,7,6,Jul
8447198,Ray,Kinsella,27-Jan-11,Jan-27-1911,1/27/11,1/27/11,1911,1,27,Jan
8448138,Eric,Pettinger,14-Dec-04,Dec-14-1904,12/14/04,12/14/04,1904,12,14,Dec
8445142,Leo,Bourgeault,17-Jan-03,Jan-17-1903,1/17/03,1/17/03,1903,1,17,Jan
8449060,Art,Smith,29-Nov-06,Nov-29-1906,11/29/06,11/29/06,1906,11,29,Nov
8449821,Bill,Beveridge,1-Jul-09,Jul-1-1909,7/1/09,7/1/09,1909,7,1,Jul
8446411,Gus,Forslund,25-Apr-08,Apr-25-1908,4/25/08,4/25/08,1908,4,25,Apr
8446557,Dutch,Gainor,10-Apr-04,Apr-10-1904,4/10/04,4/10/04,1904,4,10,Apr
8447523,Gerry,Lowrey,14-Feb-06,Feb-14-1906,2/14/06,2/14/06,1906,2,14,Feb
8447780,Bert,McInenly,6-May-06,May-6-1906,5/6/06,5/6/06,1906,5,6,May
8447859,Hib,Milks,1-Apr-1899,Apr-1-1899,4/1/1899,1899-04-01,1899,4,1,Apr
8448383,Earl,Roche,22-Feb-10,Feb-22-1910,2/22/10,2/22/10,1910,2,22,Feb
8448421,Des,Roche,1-Feb-09,Feb-1-1909,2/1/09,2/1/09,1909,2,1,Feb
8449381,Cooney,Weiland,5-Nov-04,Nov-5-1904,11/5/04,11/5/04,1904,11,5,Nov
8445262,Marty,Burke,28-Jan-05,Jan-28-1905,1/28/05,1/28/05,1905,1,28,Jan
8445293,Bert,Burry,2-Jul-06,Jul-2-1906,7/2/06,7/2/06,1906,7,2,Jul
8448428,Harvey,Rockburn,20-Aug-08,Aug-20-1908,8/20/08,8/20/08,1908,8,20,Aug
8445533,Bud,Cook,20-Nov-07,Nov-20-1907,11/20/07,11/20/07,1907,11,20,Nov
8446558,Percy,Galbraith,5-Dec-1898,Dec-5-1898,12/5/1898,1898-12-05,1898,12,5,Dec
8447132,Max,Kaminsky,19-Apr-13,Apr-19-1913,4/19/13,4/19/13,1913,4,19,Apr
8448789,Ted,Saunders,29-Aug-11,Aug-29-1911,8/29/11,8/29/11,1911,8,29,Aug
8449001,Gerry,Shannon,25-Oct-10,Oct-25-1910,10/25/10,10/25/10,1910,10,25,Oct
8449308,Carl,Voss,6-Jan-07,Jan-6-1907,1/6/07,1/6/07,1907,1,6,Jan
8449366,Nick,Wasnie,1-Jan-04,Jan-1-1904,1/1/04,1/1/04,1904,1,1,Jan
8445146,Ralph,Bowman,20-Jun-11,Jun-20-1911,6/20/11,6/20/11,1911,6,20,Jun
8446895,Flash,Hollett,13-Apr-12,Apr-13-1912,4/13/12,4/13/12,1912,4,13,Apr
8447130,Walter,Kalbfleish,18-Dec-11,Dec-18-1911,12/18/11,12/18/11,1911,12,18,Dec
8447371,Albert,Leduc,22-Nov-02,Nov-22-1902,11/22/02,11/22/02,1902,11,22,Nov
8445326,George,Carey,4-Nov-1892,Nov-4-1892,11/4/1892,1892-11-04,1892,11,4,Nov
8445972,Babe,Dye,13-May-1898,May-13-1898,5/13/1898,1898-05-13,1898,5,13,May
8447594,Joe,Malone,28-Feb-1890,Feb-28-1890,2/28/1890,1890-02-28,1890,2,28,Feb
8447674,Thomas,McCarthy,12-Apr-1893,Apr-12-1893,4/12/1893,1893-04-12,1893,4,12,Apr
8448212,Goldie,Prodgers,18-Oct-1891,Oct-18-1891,10/18/1891,1891-10-18,1891,10,18,Oct
8448349,Mickey,Roach,1-May-1895,May-1-1895,5/1/1895,1895-05-01,1895,5,1,May
8445330,Ed,Carpenter,15-Jun-1890,Jun-15-1890,6/15/1890,1890-06-15,1890,6,15,Jun
8445744,Billy,Coutu,1-Mar-1892,Mar-1-1892,3/1/1892,1892-03-01,1892,3,1,Mar
8447637,Joe,Matte,6-Mar-1893,Mar-6-1893,3/6/1893,1893-03-06,1893,3,6,Mar
8447765,Moylan,McDonnell,27-Aug-1889,Aug-27-1889,8/27/1889,1889-08-27,1889,8,27,Aug
8448315,Leo,Reise,1-Jun-1892,Jun-1-1892,6/1/1892,1892-06-01,1892,6,1,Jun
8450017,Howard,Lockhart,21-Mar-1895,Mar-21-1895,3/21/1895,1895-03-21,1895,3,21,Mar
8444956,Amos,Arbour,26-Jan-1895,Jan-26-1895,1/26/1895,1895-01-26,1895,1,26,Jan
8449551,Cully,Wilson,5-Jun-1892,Jun-5-1892,6/5/1892,1892-06-05,1892,6,5,Jun
8447907,Harry,Mummery,25-Aug-1889,Aug-25-1889,8/25/1889,1889-08-25,1889,8,25,Aug
8445131,Edmond,Bouchard,24-May-1892,May-24-1892,5/24/1892,1892-05-24,1892,5,24,May
8445255,Billy,Burch,20-Nov-00,Nov-20-1900,11/20/00,11/20/00,1900,11,20,Nov
8445571,Bert,Corbeau,9-Feb-1894,Feb-9-1894,2/9/1894,1894-02-09,1894,2,9,Feb
8449918,Jake,Forbes,4-Jul-1897,Jul-4-1897,7/4/1897,1897-07-04,1897,7,4,Jul
8445873,Corb,Denneny,25-Jan-1894,Jan-25-1894,1/25/1894,1894-01-25,1894,1,25,Jan
8446643,Red,Green,12-Dec-1899,Dec-12-1899,12/12/1899,1899-12-12,1899,12,12,Dec
8446644,Shorty,Green,17-Jul-1896,Jul-17-1896,7/17/1896,1896-07-17,1896,7,17,Jul
8448246,Ken,Randall,14-Dec-1887,Dec-14-1887,12/14/1887,1887-12-14,1887,12,14,Dec
8448948,Ganton,Scott,23-Mar-03,Mar-23-1903,3/23/03,3/23/03,1903,3,23,Mar
8446492,Charles,Fraser,22-Jul-1897,Jul-22-1897,7/22/1897,1897-07-22,1897,7,22,Jul
8449141,Jesse,Spring,18-Jan-01,Jan-18-1901,1/18/01,1/18/01,1901,1,18,Jan
8445644,Charlie,Cotch,21-Feb-00,Feb-21-1900,2/21/00,2/21/00,1900,2,21,Feb
8447323,Charlie,Langlois,25-Aug-1894,Aug-25-1894,8/25/1894,1894-08-25,1894,8,25,Aug
8447794,Alex,McKinnon,17-Apr-1895,Apr-17-1895,4/17/1895,1895-04-17,1895,4,17,Apr
8445071,Louis,Berlinquette,26-May-1887,May-26-1887,5/26/1887,1887-05-26,1887,5,26,May
8445496,Odie,Cleghorn,19-Sep-1891,Sep-19-1891,9/19/1891,1891-09-19,1891,9,19,Sep
8445648,Baldy,Cotton,5-Nov-02,Nov-5-1902,11/5/02,11/5/02,1902,11,5,Nov
8445843,Harold,Darragh,13-Sep-02,Sep-13-1902,9/13/02,9/13/02,1902,9,13,Sep
8447521,Fred,Lowrey,12-Aug-02,Aug-12-1902,8/12/02,8/12/02,1902,8,12,Aug
8447741,Duke,McCurry,13-Jun-00,Jun-13-1900,6/13/00,6/13/00,1900,6,13,Jun
8449049,Alf,Skinner,26-Jan-1896,Jan-26-1896,1/26/1896,1896-01-26,1896,1,26,Jan
8449392,Tex,White,26-Jun-00,Jun-26-1900,6/26/00,6/26/00,1900,6,26,Jun
8445514,Lionel,Conacher,24-May-01,May-24-1901,5/24/01,5/24/01,1901,5,24,May
8445955,Herb,Drury,2-Mar-1895,Mar-2-1895,3/2/1895,1895-03-02,1895,3,2,Mar
8449082,Rodger,Smith,26-Jul-1896,Jul-26-1896,7/26/1896,1896-07-26,1896,7,26,Jul
8450153,Roy,Worters,19-Oct-00,Oct-19-1900,10/19/00,10/19/00,1900,10,19,Oct
8444967,Ty,Arbour,29-Jun-1896,Jun-29-1896,6/29/1896,1896-06-29,1896,6,29,Jun
8447779,Mickey,McGuire,7-Jul-1898,Jul-7-1898,7/7/1898,1898-07-07,1898,7,7,Jul
8447795,John,McKinnon,15-Jul-02,Jul-15-1902,7/15/02,7/15/02,1902,7,15,Jul
8447655,Bert,McCaffrey,12-Apr-1893,Apr-12-1893,4/12/1893,1893-04-12,1893,4,12,Apr
8448462,Sam,Rothschild,16-Oct-1899,Oct-16-1899,10/16/1899,1899-10-16,1899,10,16,Oct
8446493,Frank,Fredrickson,11-Jun-1895,Jun-11-1895,6/11/1895,1895-06-11,1895,6,11,Jun
8447545,Mickey,MacKay,25-May-1894,May-25-1894,5/25/1894,1894-05-25,1894,5,25,May
8446907,Albert,Holway,24-Sep-02,Sep-24-1902,9/24/02,9/24/02,1902,9,24,Sep
8450043,Joe,Miller,6-Oct-00,Oct-6-1900,10/6/00,10/6/00,1900,10,6,Oct
8445029,Cliff,Barton,3-Sep-07,Sep-3-1907,9/3/07,9/3/07,1907,9,3,Sep
8445162,Archie,Briden,16-Jul-1898,Jul-16-1898,7/16/1898,1898-07-16,1898,7,16,Jul
8447050,James,Jarvis,7-Dec-07,Dec-7-1907,12/7/07,12/7/07,1907,12,7,Dec
8447602,Rennison,Manners,5-Feb-04,Feb-5-1904,2/5/04,2/5/04,1904,2,5,Feb
8446489,Gord,Fraser,3-Jan-02,Jan-3-1902,1/3/02,1/3/02,1902,1,3,Jan
8450117,Red,Spooner,24-Aug-10,Aug-24-1910,8/24/10,8/24/10,1910,8,24,Aug
8447534,Ron,Lyons,15-Feb-09,Feb-15-1909,2/15/09,2/15/09,1909,2,15,Feb
8447671,Eddie,McCalmon,30-May-02,May-30-1902,5/30/02,5/30/02,1902,5,30,May
8445741,D'arcy,Coulson,17-Feb-08,Feb-17-1908,2/17/08,2/17/08,1908,2,17,Feb
8445818,Stan,Crossett,18-Apr-00,Apr-18-1900,4/18/00,4/18/00,1900,4,18,Apr
8449861,Wilf,Cude,4-Jul-10,Jul-4-1910,7/4/10,7/4/10,1910,7,4,Jul
8445047,Pete,Bellefeuille,19-Oct-01,Oct-19-1901,10/19/01,10/19/01,1901,10,19,Oct
8446463,Frank,Foyston,2-Feb-1891,Feb-2-1891,2/2/1891,1891-02-02,1891,2,2,Feb
8446613,Fred,Gordon,6-May-00,May-6-1900,5/6/00,5/6/00,1900,5,6,May
8446727,Gizzy,Hart,1-Jun-02,Jun-1-1902,6/1/02,6/1/02,1902,6,1,Jun
8447143,Duke,Keats,21-Mar-1895,Mar-21-1895,3/21/1895,1895-03-21,1895,3,21,Mar
8447832,Harry,Meeking,4-Nov-1894,Nov-4-1894,11/4/1894,1894-11-04,1894,11,4,Nov
8448039,Russell,Oatman,19-Feb-05,Feb-19-1905,2/19/05,2/19/05,1905,2,19,Feb
8448332,Jim,Riley,25-May-1897,May-25-1897,5/25/1897,1897-05-25,1897,5,25,May
8449007,Johnny,Sheppard,23-Jul-03,Jul-23-1903,7/23/03,7/23/03,1903,7,23,Jul
8449310,Jack,Walker,29-Nov-1888,Nov-29-1888,11/29/1888,1888-11-29,1888,11,29,Nov
8444964,Jack,Arbour,7-Mar-1899,Mar-7-1899,3/7/1899,1899-03-07,1899,3,7,Mar
8445962,Art,Duncan,4-Jul-1891,Jul-4-1891,7/4/1891,1891-07-04,1891,7,4,Jul
8446662,Harold,Halderson,6-Jan-00,Jan-6-1900,1/6/00,1/6/00,1900,1,6,Jan
8447216,Hobie,Kitchen,8-Feb-04,Feb-8-1904,2/8/04,2/8/04,1904,2,8,Feb
8447517,Clem,Loughlin,15-Nov-1894,Nov-15-1894,11/15/1894,1894-11-15,1894,11,15,Nov
8449997,Hap,Holmes,21-Feb-1888,Feb-21-1888,2/21/1888,1888-02-21,1888,2,21,Feb
8450121,Herb,Stuart,30-Mar-1899,Mar-30-1899,3/30/1899,1899-03-30,1899,3,30,Mar
8444987,Larry,Aurie,8-Feb-05,Feb-8-1905,2/8/05,2/8/05,1905,2,8,Feb
8445541,Carson,Cooper,17-Jul-1899,Jul-17-1899,7/17/1899,1899-07-17,1899,7,17,Jul
8446750,George,Hay,10-Jan-1898,Jan-10-1898,1/10/1898,1898-01-10,1898,1,10,Jan
8448013,Reg,Noble,23-Jun-1896,Jun-23-1896,6/23/1896,1896-06-23,1896,6,23,Jun
8448080,Pete,Palangio,10-Sep-08,Sep-10-1908,9/10/08,9/10/08,1908,9,10,Sep
8449006,Frank,Sheppard,19-Oct-07,Oct-19-1907,10/19/07,10/19/07,1907,10,19,Oct
8445187,Stan,Brown,9-May-1898,May-9-1898,5/9/1898,1898-05-09,1898,5,9,May
8449254,Percy,Traub,23-Aug-1896,Aug-23-1896,8/23/1896,1896-08-23,1896,8,23,Aug
8445178,Bernie,Brophy,9-Aug-05,Aug-9-1905,8/9/05,8/9/05,1905,8,9,Aug
8445526,Bob,Connors,19-Oct-04,Oct-19-1904,10/19/04,10/19/04,1904,10,19,Oct
8445839,Frank,Daley,22-Aug-09,Aug-22-1909,8/22/09,8/22/09,1909,8,22,Aug
8446785,Jimmy,Herberts,31-Oct-1897,Oct-31-1897,10/31/1897,1897-10-31,1897,10,31,Oct
8447484,Herbie,Lewis,17-Apr-06,Apr-17-1906,4/17/06,4/17/06,1906,4,17,Apr
8445203,Bill,Brydge,22-Oct-01,Oct-22-1901,10/22/01,10/22/01,1901,10,22,Oct
8449897,Dolly,Dolson,23-May-1897,May-23-1897,5/23/1897,1897-05-23,1897,5,23,May
8446612,Ebbie,Goodfellow,9-Apr-07,Apr-9-1907,4/9/07,4/9/07,1907,4,9,Apr
8447654,Stan,McCabe,16-Jun-08,Jun-16-1908,6/16/08,6/16/08,1908,6,16,Jun
8446857,Henry,Hicks,10-Dec-00,Dec-10-1900,12/10/00,12/10/00,1900,12,10,Dec
8446966,James,Hughes,12-May-06,May-12-1906,5/12/06,5/12/06,1906,5,12,May
8447638,Joe,Matte,15-Mar-09,Mar-15-1909,3/15/09,3/15/09,1909,3,15,Mar
8446580,Gerry,Geran,3-Aug-1896,Aug-3-1896,8/3/1896,1896-08-03,1896,8,3,Aug
8447616,Jack,Marks,11-Jun-1885,Jun-11-1885,6/11/1885,1885-06-11,1885,6,11,Jun
8447761,Jack,McDonald,28-Feb-1887,Feb-28-1887,2/28/1887,1887-02-28,1887,2,28,Feb
8449181,Phil,Stevens,15-Feb-1893,Feb-15-1893,2/15/1893,1893-02-15,1893,2,15,Feb
8449231,Ken,Thompson,29-May-1881,May-29-1881,5/29/1881,1881-05-29,1881,5,29,May
8448052,George,O'Grady,8-Jun-1891,Jun-8-1891,6/8/1891,1891-06-08,1891,6,8,Jun
8448456,Art,Ross,13-Jan-1886,Jan-13-1886,1/13/1886,1886-01-13,1886,1,13,Jan
8449048,Raymie,Skilton,26-Sep-1889,Sep-26-1889,9/26/1889,1889-09-26,1889,9,26,Sep
8450014,Bert,Lindsay,23-Jul-1881,Jul-23-1881,7/23/1881,1881-07-23,1881,7,23,Jul
8445740,Jack,Coughlin,6-Jun-1892,Jun-6-1892,6/6/1892,1892-06-06,1892,6,6,Jun
8447816,George,McNaughton,4-Apr-1897,Apr-4-1897,4/4/1897,1897-04-04,1897,4,4,Apr
8449087,Tommy,Smith,27-Sep-1886,Sep-27-1886,9/27/1886,1886-09-27,1886,9,27,Sep
8449382,Alex,Wellington,4-Aug-1893,Aug-4-1893,8/4/1893,1893-08-04,1893,8,4,Aug
8447796,Fred,McLean,16-Mar-1893,Mar-16-1893,3/16/1893,1893-03-16,1893,3,16,Mar
8449843,Frank,Brophy,9-Aug-00,Aug-9-1900,8/9/00,8/9/00,1900,8,9,Aug
8445911,Chuck,Dinsmore,23-Jul-03,Jul-23-1903,7/23/03,7/23/03,1903,7,23,Jul
8448087,Ernie,Parkes,4-Nov-1898,Nov-4-1898,11/4/1898,1898-11-04,1898,11,4,Nov
8445308,Francis,Cain,22-Mar-1899,Mar-22-1899,3/22/1899,1899-03-22,1899,3,22,Mar
8445340,George,Carroll,3-Jun-1897,Jun-3-1897,6/3/1897,1897-06-03,1897,6,3,Jun
8447908,Dunc,Munro,19-Jan-01,Jan-19-1901,1/19/01,1/19/01,1901,1,19,Jan
8447912,Gerry,Munro,28-Nov-1897,Nov-28-1897,11/28/1897,1897-11-28,1897,11,28,Nov
8445346,Frank,Carson,12-Jan-02,Jan-12-1902,1/12/02,1/12/02,1902,1,12,Jan
8446914,George,Horne,27-Jun-04,Jun-27-1904,6/27/04,6/27/04,1904,6,27,Jun
8448141,Merlyn,Phillips,24-May-1899,May-24-1899,5/24/1899,1899-05-24,1899,5,24,May
8449038,Babe,Siebert,14-Jan-04,Jan-14-1904,1/14/04,1/14/04,1904,1,14,Jan
8449189,Nels,Stewart,29-Dec-02,Dec-29-1902,12/29/02,12/29/02,1902,12,29,Dec
8446152,Hap,Emms,12-Jan-05,Jan-12-1905,1/12/05,1/12/05,1905,1,12,Jan
8445923,Babe,Donnelly,22-Dec-1895,Dec-22-1895,12/22/1895,1895-12-22,1895,12,22,Dec
8445969,Red,Dutton,23-Jul-1898,Jul-23-1898,7/23/1898,1898-07-23,1898,7,23,Jul
8450144,Flat,Walsh,23-Mar-1897,Mar-23-1897,3/23/1897,1897-03-23,1897,3,23,Mar
8445183,Fred,Brown,15-Sep-00,Sep-15-1900,9/15/00,9/15/00,1900,9,15,Sep
8449341,Jimmy,Ward,1-Sep-06,Sep-1-1906,9/1/06,9/1/06,1906,9,1,Sep
8448372,Earl,Robinson,11-Mar-07,Mar-11-1907,3/11/07,3/11/07,1907,3,11,Mar
8449264,Dave,Trottier,25-Jun-06,Jun-25-1906,6/25/06,6/25/06,1906,6,25,Jun
8448034,Baldy,Northcott,7-Sep-08,Sep-7-1908,9/7/08,9/7/08,1908,9,7,Sep
8448140,Bill,Phillips,23-Sep-02,Sep-23-1902,9/23/02,9/23/02,1902,9,23,Sep
8449467,Archie,Wilcox,9-May-03,May-9-1903,5/9/03,5/9/03,1903,5,9,May
8449858,Abbie,Cox,19-Jul-04,Jul-19-1904,7/19/04,7/19/04,1904,7,19,Jul
8445233,Glenn,Brydson,7-Nov-10,Nov-7-1910,11/7/10,11/7/10,1910,11,7,Nov
8446753,Paul,Haynes,1-Mar-10,Mar-1-1910,3/1/10,3/1/10,1910,3,1,Mar
8446946,Al,Huggins,21-Dec-10,Dec-21-1910,12/21/10,12/21/10,1910,12,21,Dec
8446559,John,Gallagher,19-Jan-09,Jan-19-1909,1/19/09,1/19/09,1909,1,19,Jan
8447828,Jack,McVicar,4-Jun-04,Jun-4-1904,6/4/04,6/4/04,1904,6,4,Jun
8450009,Dave,Kerr,11-Jan-10,Jan-11-1910,1/11/10,1/11/10,1910,1,11,Jan
8445960,Lorne,Duguid,4-Apr-10,Apr-4-1910,4/4/10,4/4/10,1910,4,4,Apr
8450115,Normie,Smith,18-Mar-08,Mar-18-1908,3/18/08,3/18/08,1908,3,18,Mar
8445097,Mickey,Blake,31-Oct-12,Oct-31-1912,10/31/12,10/31/12,1912,10,31,Oct
8448159,Hugh,Plaxton,16-May-04,May-16-1904,5/16/04,5/16/04,1904,5,16,May
8445049,Andy,Bellemer,3-Jul-03,Jul-3-1903,7/3/03,7/3/03,1903,7,3,Jul
8449383,Cy,Wentworth,24-Jan-05,Jan-24-1905,1/24/05,1/24/05,1905,1,24,Jan
8445099,Russ,Blinco,12-Mar-08,Mar-12-1908,3/12/08,3/12/08,1908,3,12,Mar
8445307,Herb,Cain,24-Dec-12,Dec-24-1912,12/24/12,12/24/12,1912,12,24,Dec
8448605,Paul,Runge,10-Sep-08,Sep-10-1908,9/10/08,9/10/08,1908,9,10,Sep
8444989,Vern,Ayres,27-Apr-09,Apr-27-1909,4/27/09,4/27/09,1909,4,27,Apr
8446182,Stewart,Evans,19-Jun-08,Jun-19-1908,6/19/08,6/19/08,1908,6,19,Jun
8446502,Irv,Frew,16-Aug-07,Aug-16-1907,8/16/07,8/16/07,1907,8,16,Aug
8446631,Ted,Graham,30-Jan-06,Jan-30-1906,1/30/06,1/30/06,1906,1,30,Jan
8447560,Bill,MacKenzie,12-Dec-11,Dec-12-1911,12/12/11,12/12/11,1911,12,12,Dec
8445098,Toe,Blake,21-Aug-12,Aug-21-1912,8/21/12,8/21/12,1912,8,21,Aug
8446628,Bob,Gracie,8-Nov-10,Nov-8-1910,11/8/10,11/8/10,1910,11,8,Nov
8447614,Gus,Marker,1-Aug-07,Aug-1-1907,8/1/07,8/1/07,1907,8,1,Aug
8447809,Sammy,McManus,22-Oct-11,Oct-22-1911,10/22/11,10/22/11,1911,10,22,Oct
8447864,Bill,Miller,1-Aug-08,Aug-1-1908,8/1/08,8/1/08,1908,8,1,Aug
8449374,Aubrey,Webster,25-Sep-12,Sep-25-1912,9/25/12,9/25/12,1912,9,25,Sep
8449850,Lorne,Chabot,5-Oct-00,Oct-5-1900,10/5/00,10/5/00,1900,10,5,Oct
8447052,Roger,Jenkins,18-Nov-11,Nov-18-1911,11/18/11,11/18/11,1911,11,18,Nov
8445347,Gerry,Carson,10-Oct-05,Oct-10-1905,10/10/05,10/10/05,1905,10,10,Oct
8448241,Yip,Radley,27-Jun-08,Jun-27-1908,6/27/08,6/27/08,1908,6,27,Jun
8445537,Tom,Cook,7-May-07,May-7-1907,5/7/07,5/7/07,1907,5,7,May
8445817,Maurice,Croghan,19-Nov-14,Nov-19-1914,11/19/14,11/19/14,1914,11,19,Nov
8449071,Des,Smith,22-Feb-14,Feb-22-1914,2/22/14,2/22/14,1914,2,22,Feb
8445109,Rene,Boileau,18-May-04,May-18-1904,5/18/04,5/18/04,1904,5,18,May
8445312,Billy,Cameron,5-Dec-1896,Dec-5-1896,12/5/1896,1896-12-05,1896,12,5,Dec
8446665,Bob,Hall,13-Oct-1899,Oct-13-1899,10/13/1899,1899-10-13,1899,10,13,Oct
8447896,John,Morrison,4-Mar-1895,Mar-4-1895,3/4/1895,1895-03-04,1895,3,4,Mar
8449045,Joe,Simpson,13-Aug-1893,Aug-13-1893,8/13/1893,1893-08-13,1893,8,13,Aug
8450000,Joe,Ironstone,28-Jun-1898,Jun-28-1898,6/28/1898,1898-06-28,1898,6,28,Jun
8446877,Normie,Himes,13-Apr-03,Apr-13-1903,4/13/03,4/13/03,1903,4,13,Apr
8447289,Newsy,Lalonde,31-Oct-1888,Oct-31-1888,10/31/1888,1888-10-31,1888,10,31,Oct
8448949,Laurie,Scott,19-Jun-00,Jun-19-1900,6/19/00,6/19/00,1900,6,19,Jun
8445143,Clarence,Boucher,1-Nov-1896,Nov-1-1896,11/1/1896,1896-11-01,1896,11,1,Nov
8445026,Marty,Barry,8-Dec-05,Dec-8-1905,12/8/05,12/8/05,1905,12,8,Dec
8445133,Billy,Boucher,10-Nov-1899,Nov-10-1899,11/10/1899,1899-11-10,1899,11,10,Nov
8447827,Charley,McVeigh,29-Mar-1898,Mar-29-1898,3/29/1898,1898-03-29,1898,3,29,Mar
8445148,Billy,Boyd,15-May-1898,May-15-1898,5/15/1898,1898-05-15,1898,5,15,May
8445284,Roy,Burmister,12-Aug-06,Aug-12-1906,8/12/06,8/12/06,1906,8,12,Aug
8446897,Bill,Holmes,9-Mar-1899,Mar-9-1899,3/9/1899,1899-03-09,1899,3,9,Mar
8447634,George,Massecar,10-Jul-04,Jul-10-1904,7/10/04,7/10/04,1904,7,10,Jul
8448098,George,Patterson,22-May-06,May-22-1906,5/22/06,5/22/06,1906,5,22,May
8449983,Benny,Grant,14-Jul-08,Jul-14-1908,7/14/08,7/14/08,1908,7,14,Jul
8446954,Albert,Hughes,13-May-01,May-13-1901,5/13/01,5/13/01,1901,5,13,May
8447999,Mike,Neville,11-Oct-04,Oct-11-1904,10/11/04,10/11/04,1904,10,11,Oct
8445968,Duke,Dukowski,30-Aug-02,Aug-30-1902,8/30/02,8/30/02,1902,8,30,Aug
8448210,Ellie,Pringle,31-Aug-11,Aug-31-1911,8/31/11,8/31/11,1911,8,31,Aug
8445527,Eddie,Convey,16-Dec-10,Dec-16-1910,12/16/10,12/16/10,1910,12,16,Dec
8446245,Tommy,Filmore,14-Mar-06,Mar-14-1906,3/14/06,3/14/06,1906,3,14,Mar
8447054,Ed,Jeremiah,4-Nov-05,Nov-4-1905,11/4/05,11/4/05,1905,11,4,Nov
8447139,John,Keating,12-Feb-08,Feb-12-1908,2/12/08,2/12/08,1908,2,12,Feb
8449553,Hub,Wilson,13-May-09,May-13-1909,5/13/09,5/13/09,1909,5,13,May
8450104,Moe,Roberts,13-Dec-05,Dec-13-1905,12/13/05,12/13/05,1905,12,13,Dec
8445261,Eddie,Burke,3-Jun-07,Jun-3-1907,6/3/07,6/3/07,1907,6,3,Jun
8447036,Walter,Jackson,3-Jun-08,Jun-3-1908,6/3/08,6/3/08,1908,6,3,Jun
8447221,Lloyd,Klein,13-Jan-10,Jan-13-1910,1/13/10,1/13/10,1910,1,13,Jan
8447242,Gord,Kuhn,19-Nov-05,Nov-19-1905,11/19/05,11/19/05,1905,11,19,Nov
8447628,Ron,Martin,22-Aug-09,Aug-22-1909,8/22/09,8/22/09,1909,8,22,Aug
8449161,Wilf,Starr,22-Jul-09,Jul-22-1909,7/22/09,7/22/09,1909,7,22,Jul
8449238,Joe,Thorsteinson,19-Mar-05,Mar-19-1905,3/19/05,3/19/05,1905,3,19,Mar
8448298,Bill,Regan,11-Dec-08,Dec-11-1908,12/11/08,12/11/08,1908,12,11,Dec
8445362,Art,Chapman,29-May-06,May-29-1906,5/29/06,5/29/06,1906,5,29,May
8445518,Red,Conn,25-Oct-04,Oct-25-1904,10/25/04,10/25/04,1904,10,25,Oct
8446649,Lloyd,Gross,5-Sep-05,Sep-5-1905,9/5/05,9/5/05,1905,9,5,Sep
8448149,Hal,Picketts,22-Apr-09,Apr-22-1909,4/22/09,4/22/09,1909,4,22,Apr
8445926,John,Doran,24-May-11,May-24-1911,5/24/11,5/24/11,1911,5,24,May
8447924,Allan,Murray,10-Nov-08,Nov-10-1908,11/10/08,11/10/08,1908,11,10,Nov
8449133,Chris,Speyer,6-Feb-03,Feb-6-1903,2/6/03,2/6/03,1903,2,6,Feb
8450003,Percy,Jackson,21-Sep-07,Sep-21-1907,9/21/07,9/21/07,1907,9,21,Sep
8445333,Lorne,Carr,2-Jul-10,Jul-2-1910,7/2/10,7/2/10,1910,7,2,Jul
8446787,Fred,Hergerts,29-Jan-13,Jan-29-1913,1/29/13,1/29/13,1913,1,29,Jan
8446843,Orville,Heximer,16-Feb-10,Feb-16-1910,2/16/10,2/16/10,1910,2,16,Feb
8448055,Harry,Oliver,26-Oct-1898,Oct-26-1898,10/26/1898,1898-10-26,1898,10,26,Oct
8448946,Sweeney,Schriner,30-Nov-11,Nov-30-1911,11/30/11,11/30/11,1911,11,30,Nov
8444931,Tom,Anderson,9-Jul-10,Jul-9-1910,7/9/10,7/9/10,1910,7,9,Jul
8446771,Tony,Hemmerling,15-May-14,May-15-1914,5/15/14,5/15/14,1914,5,15,May
8449593,Eddie,Wiseman,28-Dec-12,Dec-28-1912,12/28/12,12/28/12,1912,12,28,Dec
8447056,Joe,Jerwa,20-Jan-07,Jan-20-1907,1/20/07,1/20/07,1907,1,20,Jan
8444982,Ossie,Asmundson,17-Nov-08,Nov-17-1908,11/17/08,11/17/08,1908,11,17,Nov
8445830,Les,Cunningham,4-Oct-13,Oct-4-1913,10/4/13,10/4/13,1913,10,4,Oct
8447027,Lloyd,Jackson,7-Jan-12,Jan-7-1912,1/7/12,1/7/12,1912,1,7,Jan
8447470,Pete,Leswick,12-Jul-18,Jul-12-1918,7/12/18,7/12/18,1918,7,12,Jul
8445042,Frank,Beisler,18-Oct-13,Oct-18-1913,10/18/13,10/18/13,1913,10,18,Oct
8446215,Wilf,Field,29-Apr-15,Apr-29-1915,4/29/15,4/29/15,1915,4,29,Apr
8448309,Gord,Reid,19-Feb-12,Feb-19-1912,2/19/12,2/19/12,1912,2,19,Feb
8450045,Alfie,Moore,1-Dec-05,Dec-1-1905,12/1/05,12/1/05,1905,12,1,Dec
8450151,Alex,Wood,15-Jan-11,Jan-15-1911,1/15/11,1/15/11,1911,1,15,Jan
8445037,Red,Beattie,2-Oct-07,Oct-2-1907,10/2/07,10/2/07,1907,10,2,Oct
8449022,Jack,Shill,12-Jan-13,Jan-12-1913,1/12/13,1/12/13,1913,1,12,Jan
8449128,John,Sorrell,16-Jan-06,Jan-16-1906,1/16/06,1/16/06,1906,1,16,Jan
8445854,Hap,Day,14-Jun-01,Jun-14-1901,6/14/01,6/14/01,1901,6,14,Jun
8447098,Ivan,Johnson,7-Dec-1898,Dec-7-1898,12/7/1898,1898-12-07,1898,12,7,Dec
8450105,Earl,Robertson,24-Nov-10,Nov-24-1910,11/24/10,11/24/10,1910,11,24,Nov
8446607,Leroy,Goldsworthy,18-Oct-06,Oct-18-1906,10/18/06,10/18/06,1906,10,18,Oct
8447023,Art,Jackson,15-Dec-15,Dec-15-1915,12/15/15,12/15/15,1915,12,15,Dec
8449235,Jack,Tomson,31-Jan-18,Jan-31-1918,1/31/18,1/31/18,1918,1,31,Jan
8444972,Murray,Armstrong,1-Jan-16,Jan-1-1916,1/1/16,1/1/16,1916,1,1,Jan
8445113,Buzz,Boll,6-Mar-11,Mar-6-1911,3/6/11,3/6/11,1911,3,6,Mar
8445512,Charlie,Conacher,20-Dec-09,Dec-20-1909,12/20/09,12/20/09,1909,12,20,Dec
8446553,Johnny,Gagnon,8-Jun-05,Jun-8-1905,6/8/05,6/8/05,1905,6,8,Jun
8447025,Busher,Jackson,19-Jan-11,Jan-19-1911,1/19/11,1/19/11,1911,1,19,Jan
8448440,Doc,Romnes,1-Jan-09,Jan-1-1909,1/1/09,1/1/09,1909,1,1,Jan
8446135,Pat,Egan,25-Apr-18,Apr-25-1918,4/25/18,4/25/18,1918,4,25,Apr
8449000,Chuck,Shannon,22-Mar-16,Mar-22-1916,3/22/16,3/22/16,1916,3,22,Mar
8449024,Eddie,Shore,25-Nov-02,Nov-25-1902,11/25/02,11/25/02,1902,11,25,Nov
8444874,Viv,Allen,9-Sep-16,Sep-9-1916,9/9/16,9/9/16,1916,9,9,Sep
8445060,Bill,Benson,29-Jul-20,Jul-29-1920,7/29/20,7/29/20,1920,7,29,Jul
8445579,Chuck,Corrigan,22-May-16,May-22-1916,5/22/16,5/22/16,1916,5,22,May
8446246,Lloyd,Finkbeiner,12-Apr-20,Apr-12-1920,4/12/20,4/12/20,1920,4,12,Apr
8446968,Fred,Hunt,17-Jan-18,Jan-17-1918,1/17/18,1/17/18,1918,1,17,Jan
8447148,Pete,Kelly,22-May-13,May-22-1913,5/22/13,5/22/13,1913,5,22,May
8447331,Norm,Larson,13-Oct-20,Oct-13-1920,10/13/20,10/13/20,1920,10,13,Oct
8448051,Peanuts,O'Flaherty,10-Apr-18,Apr-10-1918,4/10/18,4/10/18,1918,4,10,Apr
8449239,Fred,Thurier,11-Jan-16,Jan-11-1916,1/11/16,1/11/16,1916,1,11,Jan
8449636,Ralph,Wycherley,26-Feb-20,Feb-26-1920,2/26/20,2/26/20,1920,2,26,Feb
8445155,Andy,Branigan,11-Apr-22,Apr-11-1922,4/11/22,4/11/22,1922,4,11,Apr
8449053,Peter,Slobodian,24-Apr-18,Apr-24-1918,4/24/18,4/24/18,1918,4,24,Apr
8450096,Chuck,Rayner,11-Aug-20,Aug-11-1920,8/11/20,8/11/20,1920,8,11,Aug
8445334,Gene,Carrigan,5-Jul-07,Jul-5-1907,7/5/07,7/5/07,1907,7,5,Jul
8445754,Bill,Cowley,12-Jun-12,Jun-12-1912,6/12/12,6/12/12,1912,6,12,Jun
8446297,Ed,Finnigan,23-May-13,May-23-1913,5/23/13,5/23/13,1913,5,23,May
8447055,Frank,Jerwa,15-Mar-09,Mar-15-1909,3/15/09,3/15/09,1909,3,15,Mar
8448231,Fido,Purpur,26-Sep-14,Sep-26-1914,9/26/14,9/26/14,1914,9,26,Sep
8448334,Vic,Ripley,30-May-06,May-30-1906,5/30/06,5/30/06,1906,5,30,May
8449479,Burr,Williams,30-Aug-09,Aug-30-1909,8/30/09,8/30/09,1909,8,30,Aug
8445106,Ron,Boehm,14-Aug-43,Aug-14-1943,8/14/43,8/14/43,1943,8,14,Aug
8445151,Wally,Boyer,27-Sep-37,Sep-27-1937,9/27/37,9/27/37,1937,9,27,Sep
8445160,John,Brenneman,5-Jan-43,Jan-5-1943,1/5/43,1/5/43,1943,1,5,Jan
8445329,Alain,Caron,27-Apr-38,Apr-27-1938,4/27/38,4/27/38,1938,4,27,Apr
8445473,Terry,Clancy,2-Apr-43,Apr-2-1943,4/2/43,4/2/43,1943,4,2,Apr
8445837,Jean,Cusson,5-Oct-42,Oct-5-1942,10/5/42,10/5/42,1942,10,5,Oct
8446142,Gerry,Ehman,3-Nov-32,Nov-3-1932,11/3/32,11/3/32,1932,11,3,Nov
8446707,Billy,Harris,29-Jul-35,Jul-29-1935,7/29/35,7/29/35,1935,7,29,Jul
8446856,Bill,Hicke,31-Mar-38,Mar-31-1938,3/31/38,3/31/38,1938,3,31,Mar
8447338,Mike,Laughton,21-Feb-44,Feb-21-1944,2/21/44,2/21/44,1944,2,21,Feb
8448177,Larry,Popein,11-Aug-30,Aug-11-1930,8/11/30,8/11/30,1930,8,11,Aug
8449210,George,Swarbrick,16-Feb-42,Feb-16-1942,2/16/42,2/16/42,1942,2,16,Feb
8449213,Joe,Szura,18-Dec-38,Dec-18-1938,12/18/38,12/18/38,1938,12,18,Dec
8445036,Bob,Baun,9-Sep-36,Sep-9-1936,9/9/36,9/9/36,1936,9,9,Sep
8445305,Larry,Cahan,25-Dec-33,Dec-25-1933,12/25/33,12/25/33,1933,12,25,Dec
8445945,Kent,Douglas,6-Feb-36,Feb-6-1936,2/6/36,2/6/36,1936,2,6,Feb
8446155,Aut,Erickson,25-Jan-38,Jan-25-1938,1/25/38,1/25/38,1938,1,25,Jan
8446714,Ron,Harris,30-Jun-42,Jun-30-1942,6/30/42,6/30/42,1942,6,30,Jun
8447379,Bob,Lemieux,16-Dec-44,Dec-16-1944,12/16/44,12/16/44,1944,12,16,Dec
8449206,Bert,Marshall,22-Nov-43,Nov-22-1943,11/22/43,11/22/43,1943,11,22,Nov
8448049,Gerry,Odrowski,4-Oct-38,Oct-4-1938,10/4/38,10/4/38,1938,10,4,Oct
8449240,Tom,Thurlby,9-Nov-38,Nov-9-1938,11/9/38,11/9/38,1938,11,9,Nov
8449995,Charlie,Hodge,28-Jul-33,Jul-28-1933,7/28/33,7/28/33,1933,7,28,Jul
8445906,Bob,Dillabough,27-Apr-41,Apr-27-1941,4/27/41,4/27/41,1941,4,27,Apr
8446814,Norm,Ferguson,16-Oct-45,Oct-16-1945,10/16/45,10/16/45,1945,10,16,Oct
8447016,Earl,Ingarfield,25-Oct-34,Oct-25-1934,10/25/34,10/25/34,1934,10,25,Oct
8447048,Gary,Jarrett,3-Sep-42,Sep-3-1942,9/3/42,9/3/42,1942,9,3,Sep
8448133,Brian,Perry,6-Apr-44,Apr-6-1944,4/6/44,4/6/44,1944,4,6,Apr
8448354,Doug,Roberts,28-Oct-42,Oct-28-1942,10/28/42,10/28/42,1942,10,28,Oct
8448443,Len,Ronson,8-Jul-36,Jul-8-1936,7/8/36,7/8/36,1936,7,8,Jul
8449273,Gene,Ubriaco,26-Dec-37,Dec-26-1937,12/26/37,12/26/37,1937,12,26,Dec
8447639,Dick,Mattiussi,1-May-38,May-1-1938,5/1/38,5/1/38,1938,5,1,May
8452140,Carol,Vadnais,25-Sep-45,Sep-25-1945,9/25/45,9/25/45,1945,9,25,Sep
8449367,Bryan,Watson,14-Nov-42,Nov-14-1942,11/14/42,11/14/42,1942,11,14,Nov
8450154,Chris,Worthy,23-Oct-47,Oct-23-1947,10/23/47,10/23/47,1947,10,23,Oct
8445139,Barry,Boughner,29-Jan-48,Jan-29-1948,1/29/48,1/29/48,1948,1,29,Jan
8446697,Joe,Hardy,5-Dec-45,Dec-5-1945,12/5/45,12/5/45,1945,12,5,Dec
8447845,Howie,Menard,28-Apr-42,Apr-28-1942,4/28/42,4/28/42,1942,4,28,Apr
8448047,Don,O'Donoghue,27-Aug-49,Aug-27-1949,8/27/49,8/27/49,1949,8,27,Aug
8446926,Harry,Howell,28-Dec-32,Dec-28-1932,12/28/32,12/28/32,1932,12,28,Dec
8449877,Neil,Nicholson,12-Sep-49,Sep-12-1949,9/12/49,9/12/49,1949,9,12,Sep
8445400,Curt,Bennett,27-Mar-48,Mar-27-1948,3/27/48,3/27/48,1948,3,27,Mar
8445857,Butch,Deadmarsh,5-Apr-50,Apr-5-1950,4/5/50,4/5/50,1950,4,5,Apr
8447378,Bobby,Leiter,22-Mar-41,Mar-22-1941,3/22/41,3/22/41,1941,3,22,Mar
8447577,Billy,MacMillan,7-Mar-43,Mar-7-1943,3/7/43,3/7/43,1943,3,7,Mar
8447718,Keith,McCreary,19-Jun-40,Jun-19-1940,6/19/40,6/19/40,1940,6,19,Jun
8447897,Lew,Morrison,11-Feb-48,Feb-11-1948,2/11/48,2/11/48,1948,2,11,Feb
8448427,Leon,Rochefort,4-May-39,May-4-1939,5/4/39,5/4/39,1939,5,4,May
8448438,Larry,Romanchych,7-Sep-49,Sep-7-1949,9/7/49,9/7/49,1949,9,7,Sep
8449178,Morris,Stefaniw,10-Jan-48,Jan-10-1948,1/10/48,1/10/48,1948,1,10,Jan
8449185,John,Stewart,16-May-50,May-16-1950,5/16/50,5/16/50,1950,5,16,May
8445181,Arnie,Brown,28-Jan-42,Jan-28-1942,1/28/42,1/28/42,1942,1,28,Jan
8447178,Kerry,Ketter,20-Sep-47,Sep-20-1947,9/20/47,9/20/47,1947,9,20,Sep
8449110,Randy,Manery,10-Jan-49,Jan-10-1949,1/10/49,1/10/49,1949,1,10,Jan
8448147,Noel,Picard,25-Dec-38,Dec-25-1938,12/25/38,12/25/38,1938,12,25,Dec
8448194,Noel,Price,9-Dec-35,Dec-9-1935,12/9/35,12/9/35,1935,12,9,Dec
8448240,Pat,Quinn,29-Jan-43,Jan-29-1943,1/29/43,1/29/43,1943,1,29,Jan
8448911,Tom,Lysiak,22-Apr-53,Apr-22-1953,4/22/53,4/22/53,1953,4,22,Apr
8447767,Al,McDonough,6-Jun-50,Jun-6-1950,6/6/50,6/6/50,1950,6,6,Jun
8452150,Eric,Vail,16-Sep-53,Sep-16-1953,9/16/53,9/16/53,1953,9,16,Sep
8448399,Ed,Kea,19-Jan-48,Jan-19-1948,1/19/48,1/19/48,1948,1,19,Jan
8447452,Jean,Lemieux,31-May-52,May-31-1952,5/31/52,5/31/52,1952,5,31,May
8447925,Bob,Murray,16-Jul-48,Jul-16-1948,7/16/48,7/16/48,1948,7,16,Jul
8446057,Guy,Chouinard,20-Oct-56,Oct-20-1956,10/20/56,10/20/56,1956,10,20,Oct
8445998,Tim,Ecclestone,24-Sep-47,Sep-24-1947,9/24/47,9/24/47,1947,9,24,Sep
8447829,Gerry,Meehan,3-Sep-46,Sep-3-1946,9/3/46,9/3/46,1946,9,3,Sep
8447846,Vic,Mercredi,31-Mar-53,Mar-31-1953,3/31/53,3/31/53,1953,3,31,Mar
8445128,Cam,Botting,10-Mar-54,Mar-10-1954,3/10/54,3/10/54,1954,3,10,Mar
8446100,Bill,Clement,20-Dec-50,Dec-20-1950,12/20/50,12/20/50,1950,12,20,Dec
8446866,Bill,Flett,21-Jul-43,Jul-21-1943,7/21/43,7/21/43,1943,7,21,Jul
8447990,Ken,Houston,15-Sep-53,Sep-15-1953,9/15/53,9/15/53,1953,9,15,Sep
8447240,Dave,Kryskow,25-Dec-51,Dec-25-1951,12/25/51,12/25/51,1951,12,25,Dec
8447464,Rich,Lemieux,19-Apr-51,Apr-19-1951,4/19/51,4/19/51,1951,4,19,Apr
8449144,Claude,St. Sauveur,2-Jan-52,Jan-2-1952,1/2/52,1/2/52,1952,1,2,Jan
8445980,Larry,Carriere,30-Jan-52,Jan-30-1952,1/30/52,1/30/52,1952,1,30,Jan
8450805,Pat,Ribble,26-Apr-54,Apr-26-1954,4/26/54,4/26/54,1954,4,26,Apr
8447300,John,Gould,11-Apr-49,Apr-11-1949,4/11/49,4/11/49,1949,4,11,Apr
8451378,Bobby,Simpson,17-Nov-56,Nov-17-1956,11/17/56,11/17/56,1956,11,17,Nov
8451323,Dave,Shand,11-Aug-56,Aug-11-1956,8/11/56,8/11/56,1956,8,11,Aug
8448640,Bobby,Lalonde,27-Mar-51,Mar-27-1951,3/27/51,3/27/51,1951,3,27,Mar
8450347,Harold,Phillipoff,14-Feb-56,Feb-14-1956,2/14/56,2/14/56,1956,2,14,Feb
8446947,Greg,Fox,12-Aug-53,Aug-12-1953,8/12/53,8/12/53,1953,8,12,Aug
8452579,Miles,Zaharko,30-Apr-57,Apr-30-1957,4/30/57,4/30/57,1957,4,30,Apr
8445403,Yves,Belanger,30-Sep-52,Sep-30-1952,9/30/52,9/30/52,1952,9,30,Sep
8445591,Ivan,Boldirev,15-Aug-49,Aug-15-1949,8/15/49,8/15/49,1949,8,15,Aug
8445332,Gene,Carr,17-Sep-51,Sep-17-1951,9/17/51,9/17/51,1951,9,17,Sep
8448727,Don,Laurence,27-Jun-57,Jun-27-1957,6/27/57,6/27/57,1957,6,27,Jun
8448050,Gerry,O'Flaherty,31-Aug-50,Aug-31-1950,8/31/50,8/31/50,1950,8,31,Aug
8450566,Jean,Pronovost,18-Dec-45,Dec-18-1945,12/18/45,12/18/45,1945,12,18,Dec
8451025,Darcy,Rota,16-Feb-53,Feb-16-1953,2/16/53,2/16/53,1953,2,16,Feb
8449175,Brad,Marsh,31-Mar-58,Mar-31-1958,3/31/58,3/31/58,1958,3,31,Mar
8449736,Bob,Murdoch,20-Nov-46,Nov-20-1946,11/20/46,11/20/46,1946,11,20,Nov
8451075,Phil,Russell,21-Jul-52,Jul-21-1952,7/21/52,7/21/52,1952,7,21,Jul
8448963,Rod,Seiling,14-Nov-44,Nov-14-1944,11/14/44,11/14/44,1944,11,14,Nov
8448759,Rejean,Lemelin,19-Nov-54,Nov-19-1954,11/19/54,11/19/54,1954,11,19,Nov
8444899,Rick,Adduono,25-Jan-55,Jan-25-1955,1/25/55,1/25/55,1955,1,25,Jan
8447295,Dave,Gorman,8-Apr-55,Apr-8-1955,4/8/55,4/8/55,1955,4,8,Apr
8447305,Bobby,Gould,2-Sep-57,Sep-2-1957,9/2/57,9/2/57,1957,9,2,Sep
8447730,Paul,Henderson,28-Jan-43,Jan-28-1943,1/28/43,1/28/43,1943,1,28,Jan
8448144,Earl,Ingarfield,30-Jan-59,Jan-30-1959,1/30/59,1/30/59,1959,1,30,Jan
8451493,Brad,Smith,13-Apr-58,Apr-13-1958,4/13/58,4/13/58,1958,4,13,Apr
8452086,Garry,Unger,7-Dec-47,Dec-7-1947,12/7/47,12/7/47,1947,12,7,Dec
8445374,Serge,Beaudoin,30-Nov-52,Nov-30-1952,11/30/52,11/30/52,1952,11,30,Nov
8450670,Pekka,Rautakallio,25-Jul-53,Jul-25-1953,7/25/53,7/25/53,1953,7,25,Jul
8450795,Paul,Reinhart,8-Jan-60,Jan-8-1960,1/8/60,1/8/60,1960,1,8,Jan
8452288,Gordon,Wappel,26-Jul-58,Jul-26-1958,7/26/58,7/26/58,1958,7,26,Jul
8450835,Pat,Riggin,26-May-59,May-26-1959,5/26/59,5/26/59,1959,5,26,May
8445241,Doug,Buhr,29-Jun-49,Jun-29-1949,6/29/49,6/29/49,1949,6,29,Jun
8445258,Glen,Burdon,4-Aug-54,Aug-4-1954,8/4/54,8/4/54,1954,8,4,Aug
8445292,Robin,Burns,27-Aug-46,Aug-27-1946,8/27/46,8/27/46,1946,8,27,Aug
8446044,Guy,Charron,24-Jan-49,Jan-24-1949,1/24/49,1/24/49,1949,1,24,Jan
8445501,Gary,Coalter,8-Jul-50,Jul-8-1950,7/8/50,7/8/50,1950,7,8,Jul
8446495,Norm,Dube,12-Sep-51,Sep-12-1951,9/12/51,9/12/51,1951,9,12,Sep
8446584,Ed,Gilbert,12-Mar-52,Mar-12-1952,3/12/52,3/12/52,1952,3,12,Mar
8446730,Hugh,Harvey,25-Jun-49,Jun-25-1949,6/25/49,6/25/49,1949,6,25,Jun
8446912,Doug,Horbul,27-Jul-52,Jul-27-1952,7/27/52,7/27/52,1952,7,27,Jul
8448186,Lynn,Powis,7-Jul-49,Jul-7-1949,7/7/49,7/7/49,1949,7,7,Jul
8449112,Ted,Snell,28-May-46,May-28-1946,5/28/46,5/28/46,1946,5,28,May
8449604,John,Wright,9-Nov-48,Nov-9-1948,11/9/48,11/9/48,1948,11,9,Nov
8445035,Mike,Baumgartner,30-Jan-49,Jan-30-1949,1/30/49,1/30/49,1949,1,30,Jan
8445590,Mike,Boland,29-Oct-54,Oct-29-1954,10/29/54,10/29/54,1954,10,29,Oct
8445764,Bart,Crashley,15-Jun-46,Jun-15-1946,6/15/46,6/15/46,1946,6,15,Jun
8446736,Chris,Evans,14-Sep-46,Sep-14-1946,9/14/46,9/14/46,1946,9,14,Sep
8446919,Claude,Houde,8-Nov-47,Nov-8-1947,11/8/47,11/8/47,1947,11,8,Nov
8446959,Brent,Hughes,17-Jun-43,Jun-17-1943,6/17/43,6/17/43,1943,6,17,Jun
8447285,Jean-Guy,Lagace,5-Feb-45,Feb-5-1945,2/5/45,2/5/45,1945,2,5,Feb
8447376,Henry,Lehvonen,26-Aug-50,Aug-26-1950,8/26/50,8/26/50,1950,8,26,Aug
8447968,Ken,Murray,22-Jan-48,Jan-22-1948,1/22/48,1/22/48,1948,1,22,Jan
8450235,Dennis,Patterson,9-Jan-50,Jan-9-1950,1/9/50,1/9/50,1950,1,9,Jan
8447755,Denis,Herron,18-Jun-52,Jun-18-1952,6/18/52,6/18/52,1952,6,18,Jun
8449426,Peter,McDuffe,16-Feb-48,Feb-16-1948,2/16/48,2/16/48,1948,2,16,Feb
8446552,Germain,Gagnon,9-Dec-42,Dec-9-1942,12/9/42,12/9/42,1942,12,9,Dec
8448093,Craig,Patrick,20-May-46,May-20-1946,5/20/46,5/20/46,1946,5,20,May
8447764,Terry,McDonald,17-Jun-55,Jun-17-1955,6/17/55,6/17/55,1955,6,17,Jun
8445154,Lyle,Bradley,31-Jul-43,Jul-31-1943,7/31/43,7/31/43,1943,7,31,Jul
8447042,Dave,Gardner,23-Aug-52,Aug-23-1952,8/23/52,8/23/52,1952,8,23,Aug
8446588,Bob,Girard,12-Apr-49,Apr-12-1949,4/12/49,4/12/49,1949,4,12,Apr
8446905,Gary,Holt,1-Jan-52,Jan-1-1952,1/1/52,1/1/52,1952,1,1,Jan
8448571,Ken,Kuzyk,11-Aug-53,Aug-11-1953,8/11/53,8/11/53,1953,8,11,Aug
8449570,Wayne,Merrick,23-Apr-52,Apr-23-1952,4/23/52,4/23/52,1952,4,23,Apr
8449697,Angelo,Moretto,18-Sep-53,Sep-18-1953,9/18/53,9/18/53,1953,9,18,Sep
8447905,Jim,Moxey,28-May-53,May-28-1953,5/28/53,5/28/53,1953,5,28,May
8449737,Bob,Murdoch,29-Jan-54,Jan-29-1954,1/29/54,1/29/54,1954,1,29,Jan
8448085,Jim,Pappin,10-Sep-39,Sep-10-1939,9/10/39,9/10/39,1939,9,10,Sep
8448613,Gary,Sabourin,4-Dec-43,Dec-4-1943,12/4/43,12/4/43,1943,12,4,Dec
8451353,Rick,Shinske,31-May-55,May-31-1955,5/31/55,5/31/55,1955,5,31,May
8451365,Charlie,Simmer,20-Mar-54,Mar-20-1954,3/20/54,3/20/54,1954,3,20,Mar
8449139,Frank,Spring,19-Oct-49,Oct-19-1949,10/19/49,10/19/49,1949,10,19,Oct
8449180,Vern,Stenlund,11-Apr-56,Apr-11-1956,4/11/56,4/11/56,1956,4,11,Apr
8449455,Juha,Widing,4-Jul-47,Jul-4-1947,7/4/47,7/4/47,1947,7,4,Jul
8446976,Len,Frig,23-Oct-50,Oct-23-1950,10/23/50,10/23/50,1950,10,23,Oct
8447497,Rick,Hampton,14-Jun-56,Jun-14-1956,6/14/56,6/14/56,1956,6,14,Jun
8447060,Bjorn,Johansson,15-Jan-56,Jan-15-1956,1/15/56,1/15/56,1956,1,15,Jan
8447830,Brent,Meeke,10-Apr-52,Apr-10-1952,4/10/52,4/10/52,1952,4,10,Apr
8447996,Jim,Neilson,28-Nov-40,Nov-28-1940,11/28/40,11/28/40,1940,11,28,Nov
8448094,Glenn,Patrick,26-Apr-50,Apr-26-1950,4/26/50,4/26/50,1950,4,26,Apr
8450555,Thomas,Price,12-Jul-54,Jul-12-1954,7/12/54,7/12/54,1954,7,12,Jul
8451728,Bob,Stewart,10-Nov-50,Nov-10-1950,11/10/50,11/10/50,1950,11,10,Nov
8450114,Gary,Simmons,19-Jul-44,Jul-19-1944,7/19/44,7/19/44,1944,7,19,Jul
8448469,Reg,Kerr,16-Oct-57,Oct-16-1957,10/16/57,10/16/57,1957,10,16,Oct
8444872,Jeff,Allan,17-May-57,May-17-1957,5/17/57,5/17/57,1957,5,17,May
8447941,Randy,Holt,15-Jan-53,Jan-15-1953,1/15/53,1/15/53,1953,1,15,Jan
8450804,Darcy,Regier,27-Nov-56,Nov-27-1956,11/27/56,11/27/56,1956,11,27,Nov
8445806,Jimmy,Creighton,18-Nov-05,Nov-18-1905,11/18/05,11/18/05,1905,11,18,Nov
8448004,John,Newman,24-Apr-10,Apr-24-1910,4/24/10,4/24/10,1910,4,24,Apr
8449177,Frank,Steele,19-Mar-05,Mar-19-1905,3/19/05,3/19/05,1905,3,19,Mar
8449666,Doug,Young,1-Oct-08,Oct-1-1908,10/1/08,10/1/08,1908,10,1,Oct
8445358,Murph,Chamberlain,14-Feb-15,Feb-14-1915,2/14/15,2/14/15,1915,2,14,Feb
8446842,Red,Heron,31-Dec-17,Dec-31-1917,12/31/17,12/31/17,1917,12,31,Dec
8446860,Mel,Hill,15-Feb-14,Feb-15-1914,2/15/14,2/15/14,1914,2,15,Feb
8447150,Pep,Kelly,17-Jan-14,Jan-17-1914,1/17/14,1/17/14,1914,1,17,Jan
8447235,Joe,Krol,13-Aug-15,Aug-13-1915,8/13/15,8/13/15,1915,8,13,Aug
8447901,Ken,Mosdell,13-Jul-22,Jul-13-1922,7/13/22,7/13/22,1922,7,13,Jul
8449204,Bill,Summerhill,9-Jul-15,Jul-9-1915,7/9/15,7/9/15,1915,7,9,Jul
8449369,Harry,Watson,6-May-23,May-6-1923,5/6/23,5/6/23,1923,5,6,May
8445467,Jack,Church,24-May-15,May-24-1915,5/24/15,5/24/15,1915,5,24,May
8447226,Nick,Knott,23-Jul-20,Jul-23-1920,7/23/20,7/23/20,1920,7,23,Jul
8447647,Hazen,McAndrew,7-Aug-17,Aug-7-1917,8/7/17,8/7/17,1917,8,7,Aug
8446870,Larry,Floyd,1-May-61,May-1-1961,5/1/61,5/1/61,1961,5,1,May
8448844,Jan,Ludvig,17-Sep-61,Sep-17-1961,9/17/61,9/17/61,1961,9,17,Sep
8449140,Hector,Marini,27-Jan-57,Jan-27-1957,1/27/57,1/27/57,1957,1,27,Jan
8449656,Mike,Moher,26-Mar-62,Mar-26-1962,3/26/62,3/26/62,1962,3,26,Mar
8456667,Dave,Hutchison,2-May-52,May-2-1952,5/2/52,5/2/52,1952,5,2,May
8450135,Rob,Palmer,10-Sep-56,Sep-10-1956,9/10/56,9/10/56,1956,9,10,Sep
8448965,Shawn,MacKenzie,22-Aug-62,Aug-22-1962,8/22/62,8/22/62,1962,8,22,Aug
8445685,Mel,Bridgman,28-Apr-55,Apr-28-1955,4/28/55,4/28/55,1955,4,28,Apr
8447812,Tim,Higgins,7-Feb-58,Feb-7-1958,2/7/58,2/7/58,1958,2,7,Feb
8448288,John,Johannson,18-Oct-61,Oct-18-1961,10/18/61,10/18/61,1961,10,18,Oct
8449499,John,MacLean,20-Nov-64,Nov-20-1964,11/20/64,11/20/64,1964,11,20,Nov
8449320,Gary,McAdam,31-Dec-55,Dec-31-1955,12/31/55,12/31/55,1955,12,31,Dec
8449734,Grant,Mulvey,17-Sep-56,Sep-17-1956,9/17/56,9/17/56,1956,9,17,Sep
8451968,Rocky,Trottier,11-Apr-64,Apr-11-1964,4/11/64,4/11/64,1964,4,11,Apr
8446309,Ken,Daneyko,17-Apr-64,Apr-17-1964,4/17/64,4/17/64,1964,4,17,Apr
8446484,Bruce,Driver,29-Apr-62,Apr-29-1962,4/29/62,4/29/62,1962,4,29,Apr
8447753,Alan,Hepple,16-Aug-63,Aug-16-1963,8/16/63,8/16/63,1963,8,16,Aug
8447918,Bob,Hoffmeyer,27-Jul-55,Jul-27-1955,7/27/55,7/27/55,1955,7,27,Jul
8448811,Dave,Lewis,3-Jul-53,Jul-3-1953,7/3/53,7/3/53,1953,7,3,Jul
8444894,Greg,Adams,15-Aug-63,Aug-15-1963,8/15/63,8/15/63,1963,8,15,Aug
8449740,Kirk,Muller,8-Feb-66,Feb-8-1966,2/8/66,2/8/66,1966,2,8,Feb
8450539,Rich,Preston,22-May-52,May-22-1952,5/22/52,5/22/52,1952,5,22,May
8452490,Mitch,Wilson,15-Feb-60,Feb-15-1960,2/15/60,2/15/60,1960,2,15,Feb
8447806,Uli,Hiemer,21-Sep-62,Sep-21-1962,9/21/62,9/21/62,1962,9,21,Sep
8448408,Hannu,Kamppuri,1-Jul-57,Jul-1-1957,7/1/57,7/1/57,1957,7,1,Jul
8444947,Perry,Anderson,14-Oct-61,Oct-14-1961,10/14/61,10/14/61,1961,10,14,Oct
8446129,Pat,Conacher,1-May-59,May-1-1959,5/1/59,5/1/59,1959,5,1,May
8446448,Dan,Dorion,2-Mar-63,Mar-2-1963,3/2/63,3/2/63,1963,3,2,Mar
8449525,Peter,McNab,8-May-52,May-8-1952,5/8/52,5/8/52,1952,5,8,May
8451719,Allan,Stewart,31-Jan-64,Jan-31-1964,1/31/64,1/31/64,1964,1,31,Jan
8446405,Don,Dietrich,5-Apr-61,Apr-5-1961,4/5/61,4/5/61,1961,4,5,Apr
8445470,Craig,Billington,11-Sep-66,Sep-11-1966,9/11/66,9/11/66,1966,9,11,Sep
8449474,Kirk,McLean,26-Jun-66,Jun-26-1966,6/26/66,6/26/66,1966,6,26,Jun
8451743,Sam,St. Laurent,16-Feb-59,Feb-16-1959,2/16/59,2/16/59,1959,2,16,Feb
8445730,Doug,Brown,12-Jun-64,Jun-12-1964,6/12/64,6/12/64,1964,6,12,Jun
8445937,Anders,Carlsson,25-Nov-60,Nov-25-1960,11/25/60,11/25/60,1960,11,25,Nov
8448799,Tim,Lenardon,11-May-62,May-11-1962,5/11/62,5/11/62,1962,5,11,May
8445557,Timo,Blomqvist,23-Jan-61,Jan-23-1961,1/23/61,1/23/61,1961,1,23,Jan
8449167,Gordon,Mark,10-Sep-64,Sep-10-1964,9/10/64,9/10/64,1964,9,10,Sep
8450811,Steve,Richmond,11-Dec-59,Dec-11-1959,12/11/59,12/11/59,1959,12,11,Dec
8446971,Karl,Friesen,30-Jun-58,Jun-30-1958,6/30/58,6/30/58,1958,6,30,Jun
8451860,Chris,Terreri,15-Nov-64,Nov-15-1964,11/15/64,11/15/64,1964,11,15,Nov
8446072,Christopher,Cichocki,17-Sep-63,Sep-17-1963,9/17/63,9/17/63,1963,9,17,Sep
8446252,Troy,Crowder,3-May-68,May-3-1968,5/3/68,5/3/68,1968,5,3,May
8449095,David,Maley,24-Apr-63,Apr-24-1963,4/24/63,4/24/63,1963,4,24,Apr
8449513,George,McPhee,2-Jul-58,Jul-2-1958,7/2/58,7/2/58,1958,7,2,Jul
8451786,Patrik,Sundstrom,14-Dec-61,Dec-14-1961,12/14/61,12/14/61,1961,12,14,Dec
8448523,Jim,Korn,28-Jul-57,Jul-28-1957,7/28/57,7/28/57,1957,7,28,Jul
8448568,Tom,Kurvers,14-Sep-62,Sep-14-1962,9/14/62,9/14/62,1962,9,14,Sep
8449949,Jack,O'callahan,24-Jul-57,Jul-24-1957,7/24/57,7/24/57,1957,7,24,Jul
8451143,Bob,Sauve,17-Jun-55,Jun-17-1955,6/17/55,6/17/55,1955,6,17,Jun
8449718,Jon,Morris,6-May-66,May-6-1966,5/6/66,5/6/66,1966,5,6,May
8449964,Janne,Ojanen,9-Apr-68,Apr-9-1968,4/9/68,4/9/68,1968,4,9,Apr
8451901,Kevin,Todd,4-May-68,May-4-1968,5/4/68,5/4/68,1968,5,4,May
8446936,Corey,Foster,27-Oct-69,Oct-27-1969,10/27/69,10/27/69,1969,10,27,Oct
8448104,Jamie,Huscroft,9-Jan-67,Jan-9-1967,1/9/67,1/9/67,1967,1,9,Jan
8445657,Neil,Brady,12-Apr-68,Apr-12-1968,4/12/68,4/12/68,1968,4,12,Apr
8451784,Peter,Sundstrom,14-Dec-61,Dec-14-1961,12/14/61,12/14/61,1961,12,14,Dec
8452225,Claude,Vilgrain,1-Mar-63,Mar-1-1963,3/1/63,3/1/63,1963,3,1,Mar
8446789,Viacheslav,Fetisov,20-Apr-58,Apr-20-1958,4/20/58,4/20/58,1958,4,20,Apr
8448416,Alexei,Kasatonov,14-Oct-59,Oct-14-1959,10/14/59,10/14/59,1959,10,14,Oct
8451056,Reijo,Ruotsalainen,1-Apr-60,Apr-1-1960,4/1/60,4/1/60,1960,4,1,Apr
8451680,Sergei,Starikov,4-Dec-58,Dec-4-1958,12/4/58,12/4/58,1958,12,4,Dec
8446133,Zdeno,Ciger,19-Oct-69,Oct-19-1969,10/19/69,10/19/69,1969,10,19,Oct
8448772,Claude,Lemieux,16-Jul-65,Jul-16-1965,7/16/65,7/16/65,1965,7,16,Jul
8449029,Jeff,Madill,21-Jun-65,Jun-21-1965,6/21/65,6/21/65,1965,6,21,Jun
8449632,Jason,Miller,1-Mar-71,Mar-1-1971,3/1/71,3/1/71,1971,3,1,Mar
8449939,Myles,O'connor,2-Apr-67,Apr-2-1967,4/2/67,4/2/67,1967,4,2,Apr
8446026,Tom,Chorske,18-Sep-66,Sep-18-1966,9/18/66,9/18/66,1966,9,18,Sep
8455871,Jeffrey,Christian,30-Jul-70,Jul-30-1970,7/30/70,7/30/70,1970,7,30,Jul
8456100,Jim,Dowd,25-Dec-68,Dec-25-1968,12/25/68,12/25/68,1968,12,25,Dec
8456464,Bill,Guerin,9-Nov-70,Nov-9-1970,11/9/70,11/9/70,1970,11,9,Nov
8449094,Troy,Mallette,25-Feb-70,Feb-25-1970,2/25/70,2/25/70,1970,2,25,Feb
8449450,Randy,Mckay,25-Jan-67,Jan-25-1967,1/25/67,1/25/67,1967,1,25,Jan
8450825,Stephane,Richer,7-Jun-66,Jun-7-1966,6/7/66,6/7/66,1966,6,7,Jun
8457983,Alexander,Semak,11-Feb-66,Feb-11-1966,2/11/66,2/11/66,1966,2,11,Feb
8458483,Valeri,Zelepukin,17-Sep-68,Sep-17-1968,9/17/68,9/17/68,1968,9,17,Sep
8458517,Scott,Niedermayer,31-Aug-73,Aug-31-1973,8/31/73,8/31/73,1973,8,31,Aug
8451715,Scott,Stevens,1-Apr-64,Apr-1-1964,4/1/64,4/1/64,1964,4,1,Apr
8455710,Martin,Brodeur,6-May-72,May-6-1972,5/6/72,5/6/72,1972,5,6,May
8456191,Chad,Erickson,21-Aug-70,Aug-21-1970,8/21/70,8/21/70,1970,8,21,Aug
8456182,David,Emma,14-Jan-69,Jan-14-1969,1/14/69,1/14/69,1969,1,14,Jan
8456496,Ben,Hankinson,1-May-69,May-1-1969,5/1/69,5/1/69,1969,5,1,May
8449881,Bernie,Nicholls,24-Jun-61,Jun-24-1961,6/24/61,6/24/61,1961,6,24,Jun
8457646,Scott,Pellerin,9-Jan-70,Jan-9-1970,1/9/70,1/9/70,1970,1,9,Jan
8458152,Brian,Sullivan,23-Apr-69,Apr-23-1969,4/23/69,4/23/69,1969,4,23,Apr
8445977,Bobby,Carpenter,13-Jul-63,Jul-13-1963,7/13/63,7/13/63,1963,7,13,Jul
8449606,Corey,Millen,30-Mar-64,Mar-30-1964,3/30/64,3/30/64,1964,3,30,Mar
8450293,Mike,Peluso,8-Nov-65,Nov-8-1965,11/8/65,11/8/65,1965,11,8,Nov
8458954,Jason,Smith,2-Nov-73,Nov-2-1973,11/2/73,11/2/73,1973,11,2,Nov
8458978,Sergei,Brylin,13-Jan-74,Jan-13-1974,1/13/74,1/13/74,1974,1,13,Jan
8458525,Brian,Rolston,21-Feb-73,Feb-21-1973,2/21/73,2/21/73,1973,2,21,Feb
8445000,Dave,Andreychuk,29-Sep-63,Sep-29-1963,9/29/63,9/29/63,1963,9,29,Sep
8460542,Patrik,Elias,13-Apr-76,Apr-13-1976,4/13/76,4/13/76,1976,4,13,Apr
8459435,Denis,Pederson,10-Sep-75,Sep-10-1975,9/10/75,9/10/75,1975,9,10,Sep
8460719,Steve,Sullivan,6-Jul-74,Jul-6-1974,7/6/74,7/6/74,1974,7,6,Jul
8460465,Petr,Sykora,19-Nov-76,Nov-19-1976,11/19/76,11/19/76,1976,11,19,Nov
8451898,Steve,Thomas,15-Jul-63,Jul-15-1963,7/15/63,7/15/63,1963,7,15,Jul
8451905,Esa,Tikkanen,25-Jan-65,Jan-25-1965,1/25/65,1/25/65,1965,1,25,Jan
8459002,Cale,Hulse,10-Nov-73,Nov-10-1973,11/10/73,11/10/73,1973,11,10,Nov
8457661,Ricard,Persson,24-Aug-69,Aug-24-1969,8/24/69,8/24/69,1969,8,24,Aug
8457969,Corey,Schwab,4-Nov-70,Nov-4-1970,11/4/70,11/4/70,1970,11,4,Nov
8447206,Doug,Gilmour,25-Jun-63,Jun-25-1963,6/25/63,6/25/63,1963,6,25,Jun
8459486,Krzysztof,Oliwa,12-Apr-73,Apr-12-1973,4/12/73,4/12/73,1973,4,12,Apr
8459454,Jay,Pandolfo,27-Dec-74,Dec-27-1974,12/27/74,12/27/74,1974,12,27,Dec
8460515,Vadim,Sharifijanov,23-Dec-75,Dec-23-1975,12/23/75,12/23/75,1975,12,23,Dec
8452685,Peter,Zezel,22-Apr-65,Apr-22-1965,4/22/65,4/22/65,1965,4,22,Apr
8449957,Lyle,Odelein,21-Jul-68,Jul-21-1968,7/21/68,7/21/68,1968,7,21,Jul
8459429,Jason,Arnott,11-Oct-74,Oct-11-1974,10/11/74,10/11/74,1974,10,11,Oct
8462835,Sasha,Lakovic,7-Sep-71,Sep-7-1971,9/7/71,9/7/71,1971,9,7,Sep
8459461,Brendan,Morrison,15-Aug-75,Aug-15-1975,8/15/75,8/15/75,1975,8,15,Aug
8445568,Doug,Bodger,18-Jun-66,Jun-18-1966,6/18/66,6/18/66,1966,6,18,Jun
8455653,Brad,Bombardir,5-May-72,May-5-1972,5/5/72,5/5/72,1972,5,5,May
8459467,Vlastimil,Kroupa,27-Apr-75,Apr-27-1975,4/27/75,4/27/75,1975,4,27,Apr
8460561,Sheldon,Souray,13-Jul-76,Jul-13-1976,7/13/76,7/13/76,1976,7,13,Jul
8451805,Ken,Sutton,5-Nov-69,Nov-5-1969,11/5/69,11/5/69,1969,11,5,Nov
8458932,Richard,Shulmistra,1-Apr-71,Apr-1-1971,4/1/71,4/1/71,1971,4,1,Apr
8466371,John,Madden,4-May-73,May-4-1973,5/4/73,5/4/73,1973,5,4,May
8457491,Sergei,Nemchinov,14-Jan-64,Jan-14-1964,1/14/64,1/14/64,1964,1,14,Jan
8463638,Bryan,Muir,8-Jun-73,Jun-8-1973,6/8/73,6/8/73,1973,6,8,Jun
8459566,Steve,Brule,15-Jan-75,Jan-15-1975,1/15/75,1/15/75,1975,1,15,Jan
8467351,Scott,Gomez,23-Dec-79,Dec-23-1979,12/23/79,12/23/79,1979,12,23,Dec
8462037,Steve,Kelly,26-Oct-76,Oct-26-1976,10/26/76,10/26/76,1976,10,26,Oct
8449654,Alexander,Mogilny,18-Feb-69,Feb-18-1969,2/18/69,2/18/69,1969,2,18,Feb
8457191,Vladimir,Malakhov,30-Aug-68,Aug-30-1968,8/30/68,8/30/68,1968,8,30,Aug
8465185,Willie,Mitchell,23-Apr-77,Apr-23-1977,4/23/77,4/23/77,1977,4,23,Apr
8467856,Brian,Rafalski,28-Sep-73,Sep-28-1973,9/28/73,9/28/73,1973,9,28,Sep
8465005,Colin,White,12-Dec-77,Dec-12-1977,12/12/77,12/12/77,1977,12,12,Dec
8466261,Jiri,Bicek,3-Dec-78,Dec-3-1978,12/3/78,12/3/78,1978,12,3,Dec
8465003,Pierre,Dagenais,4-Mar-78,Mar-4-1978,3/4/78,3/4/78,1978,3,4,Mar
8468615,Michael,Danton,21-Oct-80,Oct-21-1980,10/21/80,10/21/80,1980,10,21,Oct
8466173,Stanislav,Gron,28-Oct-78,Oct-28-1978,10/28/78,10/28/78,1978,10,28,Oct
8458125,Turner,Stevenson,18-May-72,May-18-1972,5/18/72,5/18/72,1972,5,18,May
8467915,Mike,Commodore,7-Nov-79,Nov-7-1979,11/7/79,11/7/79,1979,11,7,Nov
8466288,Sascha,Goc,17-Apr-79,Apr-17-1979,4/17/79,4/17/79,1979,4,17,Apr
8458637,Sean,O'Donnell,13-Oct-71,Oct-13-1971,10/13/71,10/13/71,1971,10,13,Oct
8452157,John,Vanbiesbrouck,4-Sep-63,Sep-4-1963,9/4/63,9/4/63,1963,9,4,Sep
8467363,Christian,Berglund,12-Mar-80,Mar-12-1980,3/12/80,3/12/80,1980,3,12,Mar
8458645,Bruce,Gardiner,11-Feb-72,Feb-11-1972,2/11/72,2/11/72,1972,2,11,Feb
8467407,Brian,Gionta,18-Jan-79,Jan-18-1979,1/18/79,1/18/79,1979,1,18,Jan
8459457,Jamie,Langenbrunner,24-Jul-75,Jul-24-1975,7/24/75,7/24/75,1975,7,24,Jul
8449893,Joe,Nieuwendyk,10-Sep-66,Sep-10-1966,9/10/66,9/10/66,1966,9,10,Sep
8469610,Andreas,Salomonsson,19-Dec-73,Dec-19-1973,12/19/73,12/19/73,1973,12,19,Dec
8459065,Joel,Bouchard,23-Jan-74,Jan-23-1974,1/23/74,1/23/74,1974,1,23,Jan
8465044,Josef,Boumedienne,12-Jan-78,Jan-12-1978,1/12/78,1/12/78,1978,1,12,Jan
8465250,Andrei,Zyuzin,21-Jan-78,Jan-21-1978,1/21/78,1/21/78,1978,1,21,Jan
8466339,Scott,Clemmensen,23-Jul-77,Jul-23-1977,7/23/77,7/23/77,1977,7,23,Jul
8466159,Jean-Francois,Damphousse,21-Jul-79,Jul-21-1979,7/21/79,7/21/79,1979,7,21,Jul
8458557,Craig,Darby,26-Sep-72,Sep-26-1972,9/26/72,9/26/72,1972,9,26,Sep
8460501,Jeff,Friesen,5-Aug-76,Aug-5-1976,8/5/76,8/5/76,1976,8,5,Aug
8458959,Grant,Marshall,9-Jun-73,Jun-9-1973,6/9/73,6/9/73,1973,6,9,Jun
8467336,Mike,Rupp,13-Jan-80,Jan-13-1980,1/13/80,1/13/80,1980,1,13,Jan
8460689,Raymond,Giroux,20-Jul-76,Jul-20-1976,7/20/76,7/20/76,1976,7,20,Jul
8462159,Jan,Hrdina,5-Feb-76,Feb-5-1976,2/5/76,2/5/76,1976,2,5,Feb
8459428,Viktor,Kozlov,14-Feb-75,Feb-14-1975,2/14/75,2/14/75,1975,2,14,Feb
8448669,Igor,Larionov,3-Dec-60,Dec-3-1960,12/3/60,12/3/60,1960,12,3,Dec
8469499,Tuomas,Pihlman,13-Nov-82,Nov-13-1982,11/13/82,11/13/82,1982,11,13,Nov
8464968,Erik,Rasmussen,28-Mar-77,Mar-28-1977,3/28/77,3/28/77,1977,3,28,Mar
8462259,Rob,Skrlac,10-Jun-76,Jun-10-1976,6/10/76,6/10/76,1976,6,10,Jun
8468536,Aleksander,Suglobov,15-Jan-82,Jan-15-1982,1/15/82,1/15/82,1982,1,15,Jan
8462051,Sean,Brown,5-Nov-76,Nov-5-1976,11/5/76,11/5/76,1976,11,5,Nov
8468502,David,Hale,18-Jun-81,Jun-18-1981,6/18/81,6/18/81,1981,6,18,Jun
8468542,Paul,Martin,5-Mar-81,Mar-5-1981,3/5/81,3/5/81,1981,3,5,Mar
8470123,Cam,Janssen,15-Apr-84,Apr-15-1984,4/15/84,4/15/84,1984,4,15,Apr
8459391,Darren,Langdon,8-Jan-71,Jan-8-1971,1/8/71,1/8/71,1971,1,8,Jan
8470610,Zach,Parise,28-Jul-84,Jul-28-1984,7/28/84,7/28/84,1984,7,28,Jul
8470075,Jason,Ryznar,19-Feb-83,Feb-19-1983,2/19/83,2/19/83,1983,2,19,Feb
8470199,Barry,Tallackson,14-Apr-83,Apr-14-1983,4/14/83,4/14/83,1983,4,14,Apr
8460498,Jason,Wiemer,14-Apr-76,Apr-14-1976,4/14/76,4/14/76,1976,4,14,Apr
8460580,Brad,Lukowich,12-Aug-76,Aug-12-1976,8/12/76,8/12/76,1976,8,12,Aug
8459174,Dan,Mcgillis,1-Jul-72,Jul-1-1972,7/1/72,7/1/72,1972,7,1,Jul
8470920,David,Clarkson,31-Mar-84,Mar-31-1984,3/31/84,3/31/84,1984,3,31,Mar
8464983,Dan,Lacouture,18-Apr-77,Apr-18-1977,4/18/77,4/18/77,1977,4,18,Apr
8472355,Rod,Pelley,1-Sep-84,Sep-1-1984,9/1/84,9/1/84,1984,9,1,Sep
8471233,Travis,Zajac,13-May-85,May-13-1985,5/13/85,5/13/85,1985,5,13,May
8470335,Alexander,Brooks,21-Aug-76,Aug-21-1976,8/21/76,8/21/76,1976,8,21,Aug
8467540,Jim,Fahey,11-May-79,May-11-1979,5/11/79,5/11/79,1979,5,11,May
8471748,Mark,Fraser,29-Sep-86,Sep-29-1986,9/29/86,9/29/86,1986,9,29,Sep
8472382,Andy,Greene,30-Oct-82,Oct-30-1982,10/30/82,10/30/82,1982,10,30,Oct
8465025,Arron,Asham,13-Apr-78,Apr-13-1978,4/13/78,4/13/78,1978,4,13,Apr
8468123,Noah,Clarke,11-Jun-79,Jun-11-1979,6/11/79,6/11/79,1979,6,11,Jun
8464977,Dainius,Zubrus,16-Jun-78,Jun-16-1978,6/16/78,6/16/78,1978,6,16,Jun
8469992,Sheldon,Brookbank,3-Oct-80,Oct-3-1980,10/3/80,10/3/80,1980,10,3,Oct
8468597,Olli,Malmivaara,13-Mar-82,Mar-13-1982,3/13/82,3/13/82,1982,3,13,Mar
8466309,Mike,Mottau,19-Mar-78,Mar-19-1978,3/19/78,3/19/78,1978,3,19,Mar
8466353,Karel,Rachunek,27-Aug-79,Aug-27-1979,8/27/79,8/27/79,1979,8,27,Aug
8460626,Bryce,Salvador,11-Feb-76,Feb-11-1976,2/11/76,2/11/76,1976,2,11,Feb
8459463,Kevin,Weekes,4-Apr-75,Apr-4-1975,4/4/75,4/4/75,1975,4,4,Apr
8471764,Patrick,Davis,28-Dec-86,Dec-28-1986,12/28/86,12/28/86,1986,12,28,Dec
8474094,Matt,Halischuk,1-Jun-88,Jun-1-1988,6/1/88,6/1/88,1988,6,1,Jun
8471428,Pierre-Luc,Letourneau-Leblond,4-Jun-85,Jun-4-1985,6/4/85,6/4/85,1985,6,4,Jun
8470635,Petr,Vrana,29-Mar-85,Mar-29-1985,3/29/85,3/29/85,1985,3,29,Mar
8467436,Jay,Leach,2-Sep-79,Sep-2-1979,9/2/79,9/2/79,1979,9,2,Sep
8458536,Dean,McAmmond,15-Jun-73,Jun-15-1973,6/15/73,6/15/73,1973,6,15,Jun
8459427,Rob,Niedermayer,28-Dec-74,Dec-28-1974,12/28/74,12/28/74,1974,12,28,Dec
8473999,Nick,Palmieri,12-Jul-89,Jul-12-1989,7/12/89,7/12/89,1989,7,12,Jul
8467355,Andrew,Peters,5-May-80,May-5-1980,5/5/80,5/5/80,1980,5,5,May
8470225,Ilkka,Pikkarainen,19-Apr-81,Apr-19-1981,4/19/81,4/19/81,1981,4,19,Apr
8471636,Tim,Sestito,28-Aug-84,Aug-28-1984,8/28/84,8/28/84,1984,8,28,Aug
8471372,Ben,Walter,11-May-84,May-11-1984,5/11/84,5/11/84,1984,5,11,May
8473592,Vladimir,Zharkov,10-Jan-88,Jan-10-1988,1/10/88,1/10/88,1988,1,10,Jan
8473580,Matthew,Corrente,17-Mar-88,Mar-17-1988,3/17/88,3/17/88,1988,3,17,Mar
8467422,Rob,Davison,1-May-80,May-1-1980,5/1/80,5/1/80,1980,5,1,May
8471429,Tyler,Eckford,8-Sep-85,Sep-8-1985,9/8/85,9/8/85,1985,9,8,Sep
8473924,Cory,Murphy,13-Feb-78,Feb-13-1978,2/13/78,2/13/78,1978,2,13,Feb
8467343,Martin,Skoula,28-Oct-79,Oct-28-1979,10/28/79,10/28/79,1979,10,28,Oct
8471186,Yann,Danis,21-Jun-81,Jun-21-1981,6/21/81,6/21/81,1981,6,21,Jun
8472410,Stephen,Gionta,9-Oct-83,Oct-9-1983,10/9/83,10/9/83,1983,10,9,Oct
8474641,Adam,Henrique,6-Feb-90,Feb-6-1990,2/6/90,2/6/90,1990,2,6,Feb
8475185,Jacob,Josefson,2-Mar-91,Mar-2-1991,3/2/91,3/2/91,1991,3,2,Mar
8466216,Adam,Mair,15-Feb-79,Feb-15-1979,2/15/79,2/15/79,1979,2,15,Feb
8473927,Brad,Mills,3-May-83,May-3-1983,5/3/83,5/3/83,1983,5,3,May
8469483,David,Steckel,15-Mar-82,Mar-15-1982,3/15/82,3/15/82,1982,3,15,Mar
8474582,Mattias,Tedenby,21-Feb-90,Feb-21-1990,2/21/90,2/21/90,1990,2,21,Feb
8473605,Alexander,Vasyunov,22-Apr-88,Apr-22-1988,4/22/88,4/22/88,1988,4,22,Apr
8471816,Mark,Fayne,15-May-87,May-15-1987,5/15/87,5/15/87,1987,5,15,May
8471508,Olivier,Magnan,1-May-86,May-1-1986,5/1/86,5/1/86,1986,5,1,May
8466182,Henrik,Tallinder,10-Jan-79,Jan-10-1979,1/10/79,1/10/79,1979,1,10,Jan
8475060,Matt,Taormina,20-Oct-86,Oct-20-1986,10/20/86,10/20/86,1986,10,20,Oct
8475248,Alexander,Urbom,20-Dec-90,Dec-20-1990,12/20/90,12/20/90,1990,12,20,Dec
8468501,Anton,Volchenkov,25-Feb-82,Feb-25-1982,2/25/82,2/25/82,1982,2,25,Feb
8470093,Mike,McKenna,11-Apr-83,Apr-11-1983,4/11/83,4/11/83,1983,4,11,Apr
8470609,Steve,Bernier,31-Mar-85,Mar-31-1985,3/31/85,3/31/85,1985,3,31,Mar
8473646,Ryan,Carter,3-Aug-83,Aug-3-1983,8/3/83,8/3/83,1983,8,3,Aug
8467412,Alexei,Ponikarovsky,9-Apr-80,Apr-9-1980,4/9/80,4/9/80,1980,4,9,Apr
8469542,Stephane,Veilleux,16-Nov-81,Nov-16-1981,11/16/81,11/16/81,1981,11,16,Nov
8471365,Steven,Zalewski,20-Aug-86,Aug-20-1986,8/20/86,8/20/86,1986,8,20,Aug
8472394,Peter,Harrold,8-Jun-83,Jun-8-1983,6/8/83,6/8/83,1983,6,8,Jun
8476457,Adam,Larsson,12-Nov-92,Nov-12-1992,11/12/92,11/12/92,1992,11,12,Nov
8469623,Marek,Zidlicky,3-Feb-77,Feb-3-1977,2/3/77,2/3/77,1977,2,3,Feb
8473944,Matt,Anderson,31-Oct-82,Oct-31-1982,10/31/82,10/31/82,1982,10,31,Oct
8467428,Krys,Barch,26-Mar-80,Mar-26-1980,3/26/80,3/26/80,1980,3,26,Mar
8475637,Bobby,Butler,26-Apr-87,Apr-26-1987,4/26/87,4/26/87,1987,4,26,Apr
8471851,Matt,D'Agostini,23-Oct-86,Oct-23-1986,10/23/86,10/23/86,1986,10,23,Oct
8466398,Tom,Kostopoulos,24-Jan-79,Jan-24-1979,1/24/79,1/24/79,1979,1,24,Jan
8474681,Andrei,Loktionov,30-May-90,May-30-1990,5/30/90,5/30/90,1990,5,30,May
8476870,Stefan,Matteau,23-Feb-94,Feb-23-1994,2/23/94,2/23/94,1994,2,23,Feb
8476849,Harri,Pesonen,6-Aug-88,Aug-6-1988,8/6/88,8/6/88,1988,8,6,Aug
8475199,Eric,Gelinas,8-May-91,May-8-1991,5/8/91,5/8/91,1991,5,8,May
8471712,Jeff,Frazee,13-May-87,May-13-1987,5/13/87,5/13/87,1987,5,13,May
8476234,Keith,Kinkaid,4-Jul-89,Jul-4-1989,7/4/89,7/4/89,1989,7,4,Jul
8476423,Reid,Boucher,8-Sep-93,Sep-8-1993,9/8/93,9/8/93,1993,9,8,Sep
8477059,Damien,Brunner,9-Mar-86,Mar-9-1986,3/9/86,3/9/86,1986,3,9,Mar
8469622,Ryane,Clowe,30-Sep-82,Sep-30-1982,9/30/82,9/30/82,1982,9,30,Sep
8448208,Jaromir,Jagr,15-Feb-72,Feb-15-1972,2/15/72,2/15/72,1972,2,15,Feb
8471220,Rostislav,Olesz,10-Oct-85,Oct-10-1985,10/10/85,10/10/85,1985,10,10,Oct
8469462,Tuomo,Ruutu,16-Feb-83,Feb-16-1983,2/16/83,2/16/83,1983,2,16,Feb
8467545,Michael,Ryder,31-Mar-80,Mar-31-1980,3/31/80,3/31/80,1980,3,31,Mar
8476209,Mike,Sislo,20-Jan-88,Jan-20-1988,1/20/88,1/20/88,1988,1,20,Jan
8476227,Joe,Whitney,6-Feb-88,Feb-6-1988,2/6/88,2/6/88,1988,2,6,Feb
8475750,Jon,Merrill,3-Feb-92,Feb-3-1992,2/3/92,2/3/92,1992,2,3,Feb
8471239,Cory,Schneider,18-Mar-86,Mar-18-1986,3/18/86,3/18/86,1986,3,18,Mar
8469500,Michael,Cammalleri,8-Jun-82,Jun-8-1982,6/8/82,6/8/82,1982,6,8,Jun
8467899,Martin,Havlat,19-Apr-81,Apr-19-1981,4/19/81,4/19/81,1981,4,19,Apr
8469547,Jordin,Tootoo,2-Feb-83,Feb-2-1983,2/2/83,2/2/83,1983,2,2,Feb
8475274,Seth,Helgeson,8-Oct-90,Oct-8-1990,10/8/90,10/8/90,1990,10,8,Oct
8477127,Raman,Hrabarenka,24-Aug-92,Aug-24-1992,8/24/92,8/24/92,1992,8,24,Aug
8476923,Damon,Severson,7-Aug-94,Aug-7-1994,8/7/94,8/7/94,1994,8,7,Aug
8477010,Joseph,Blandisi,18-Jul-94,Jul-18-1994,7/18/94,7/18/94,1994,7,18,Jul
8476769,Bobby,Farnham,21-Jan-89,Jan-21-1989,1/21/89,1/21/89,1989,1,21,Jan
8478566,Sergey,Kalinin,17-Mar-91,Mar-17-1991,3/17/91,3/17/91,1991,3,17,Mar
8471311,Tyler,Kennedy,15-Jul-86,Jul-15-1986,7/15/86,7/15/86,1986,7,15,Jul
8474024,Jim,O'Brien,29-Jan-89,Jan-29-1989,1/29/89,1/29/89,1989,1,29,Jan
8476772,Brian,O'Neill,1-Jun-88,Jun-1-1988,6/1/88,6/1/88,1988,6,1,Jun
8475151,Kyle,Palmieri,1-Feb-91,Feb-1-1991,2/1/91,2/1/91,1991,2,1,Feb
8476370,Blake,Pietila,20-Feb-93,Feb-20-1993,2/20/93,2/20/93,1993,2,20,Feb
8475758,Devante,Smith-Pelly,14-Jun-92,Jun-14-1992,6/14/92,6/14/92,1992,6,14,Jun
8470740,Lee,Stempniak,4-Feb-83,Feb-4-1983,2/4/83,2/4/83,1983,2,4,Feb
8476200,Paul,Thompson,30-Nov-88,Nov-30-1988,11/30/88,11/30/88,1988,11,30,Nov
8473482,Jiri,Tlusty,16-Mar-88,Mar-16-1988,3/16/88,3/16/88,1988,3,16,Mar
8477425,Miles,Wood,13-Sep-95,Sep-13-1995,9/13/95,9/13/95,1995,9,13,Sep
8478401,Pavel,Zacha,6-Apr-97,Apr-6-1997,4/6/97,4/6/97,1997,4,6,Apr
8471752,Marc-Andre,Gragnani,11-Mar-87,Mar-11-1987,3/11/87,3/11/87,1987,3,11,Mar
8475186,John,Moore,19-Nov-90,Nov-19-1990,11/19/90,11/19/90,1990,11,19,Nov
8478584,Vojtech,Mozik,26-Dec-92,Dec-26-1992,12/26/92,12/26/92,1992,12,26,Dec
8477463,Steven,Santini,7-Mar-95,Mar-7-1995,3/7/95,3/7/95,1995,3,7,Mar
8473673,David,Schlemko,7-May-87,May-7-1987,5/7/87,5/7/87,1987,5,7,May
8474660,David,Warsofsky,30-May-90,May-30-1990,5/30/90,5/30/90,1990,5,30,May
8475809,Scott,Wedgewood,14-Aug-92,Aug-14-1992,8/14/92,8/14/92,1992,8,14,Aug
8475761,Beau,Bennett,27-Nov-91,Nov-27-1991,11/27/91,11/27/91,1991,11,27,Nov
8476399,Blake,Coleman,28-Nov-91,Nov-28-1991,11/28/91,11/28/91,1991,11,28,Nov
8469759,Vernon,Fiddler,9-May-80,May-9-1980,5/9/80,5/9/80,1980,5,9,May
8473989,Luke,Gazdic,25-Jul-89,Jul-25-1989,7/25/89,7/25/89,1989,7,25,Jul
8475791,Taylor,Hall,14-Nov-91,Nov-14-1991,11/14/91,11/14/91,1991,11,14,Nov
8479250,Nick,Lappin,1-Nov-92,Nov-1-1992,11/1/92,11/1/92,1992,11,1,Nov
8476474,Stefan,Noesen,12-Feb-93,Feb-12-1993,2/12/93,2/12/93,1993,2,12,Feb
8469707,PA,Parenteau,24-Mar-83,Mar-24-1983,3/24/83,3/24/83,1983,3,24,Mar
8477961,John,Quenneville,16-Apr-96,Apr-16-1996,4/16/96,4/16/96,1996,4,16,Apr
8479291,Kevin,Rooney,21-May-93,May-21-1993,5/21/93,5/21/93,1993,5,21,May
8478480,Blake,Speers,2-Jan-97,Jan-2-1997,1/2/97,1/2/97,1997,1,2,Jan
8476526,Ben,Thomson,16-Jan-93,Jan-16-1993,1/16/93,1/16/93,1993,1,16,Jan
8479483,Yohann,Auvitu,27-Jul-89,Jul-27-1989,7/27/89,7/27/89,1989,7,27,Jul
8480081,Michael,Kapla,19-Sep-94,Sep-19-1994,9/19/94,9/19/94,1994,9,19,Sep
8473933,Ben,Lovejoy,20-Feb-84,Feb-20-1984,2/20/84,2/20/84,1984,2,20,Feb
8474774,Dalton,Prout,13-Mar-90,Mar-13-1990,3/13/90,3/13/90,1990,3,13,Mar
8470724,Kyle,Quincey,12-Aug-85,Aug-12-1985,8/12/85,8/12/85,1985,8,12,Aug
8476798,Karl,Stollery,21-Nov-87,Nov-21-1987,11/21/87,11/21/87,1987,11,21,Nov
8470619,Brian,Boyle,18-Dec-84,Dec-18-1984,12/18/84,12/18/84,1984,12,18,Dec
8479407,Jesper,Bratt,30-Jul-98,Jul-30-1998,7/30/98,7/30/98,1998,7,30,Jul
8476207,Brian,Gibbons,26-Feb-88,Feb-26-1988,2/26/88,2/26/88,1988,2,26,Feb
8473546,Michael,Grabner,5-Oct-87,Oct-5-1987,10/5/87,10/5/87,1987,10,5,Oct
8474625,Jimmy,Hayes,21-Nov-89,Nov-21-1989,11/21/89,11/21/89,1989,11,21,Nov
8480002,Nico,Hischier,4-Jan-99,Jan-4-1999,1/4/99,1/4/99,1999,1,4,Jan
8475149,Marcus,Johansson,6-Oct-90,Oct-6-1990,10/6/90,10/6/90,1990,10,6,Oct
8474034,Pat,Maroon,23-Apr-88,Apr-23-1988,4/23/88,4/23/88,1988,4,23,Apr
8471226,Drew,Stafford,30-Oct-85,Oct-30-1985,10/30/85,10/30/85,1985,10,30,Oct
8477355,Will,Butcher,6-Jan-95,Jan-6-1995,1/6/95,1/6/95,1995,1,6,Jan
8477509,Mirco,Mueller,21-Mar-95,Mar-21-1995,3/21/95,3/21/95,1995,3,21,Mar
8475222,Sami,Vatanen,3-Jun-91,Jun-3-1991,6/3/91,6/3/91,1991,6,3,Jun
8478965,Kenneth,Appleby,10-Apr-95,Apr-10-1995,4/10/95,4/10/95,1995,4,10,Apr
8475663,Eddie,Lack,5-Jan-88,Jan-5-1988,1/5/88,1/5/88,1988,1,5,Jan
8475844,Kenny,Agostino,30-Apr-92,Apr-30-1992,4/30/92,4/30/92,1992,4,30,Apr
8479315,Joey,Anderson,19-Jun-98,Jun-19-1998,6/19/98,6/19/98,1998,6,19,Jun
8479414,Nathan,Bastian,6-Dec-97,Dec-6-1997,12/6/97,12/6/97,1997,12,6,Dec
8477520,Jean-Sebastien,Dea,8-Feb-94,Feb-8-1994,2/8/94,2/8/94,1994,2,8,Feb
8476545,Kurtis,Gabriel,20-Apr-93,Apr-20-1993,4/20/93,4/20/93,1993,4,20,Apr
8479330,Brandon,Gignac,7-Nov-97,Nov-7-1997,11/7/97,11/7/97,1997,11,7,Nov
8479415,Michael,McLeod,3-Feb-98,Feb-3-1998,2/3/98,2/3/98,1998,2,3,Feb
8478881,Brett,Seney,28-Feb-96,Feb-28-1996,2/28/96,2/28/96,1996,2,28,Feb
8474025,Eric,Tangradi,10-Feb-89,Feb-10-1989,2/10/89,2/10/89,1989,2,10,Feb
8476941,Connor,Carrick,13-Apr-94,Apr-13-1994,4/13/94,4/13/94,1994,4,13,Apr
8473468,Eric,Gryba,14-Apr-88,Apr-14-1988,4/14/88,4/14/88,1988,4,14,Apr
8477972,Josh,Jacobs,15-Feb-96,Feb-15-1996,2/15/96,2/15/96,1996,2,15,Feb
8476465,Ryan,Murphy,31-Mar-93,Mar-31-1993,3/31/93,3/31/93,1993,3,31,Mar
8478841,Colton,White,3-May-97,May-3-1997,5/3/97,5/3/97,1997,5,3,May
8480948,Egor,Yakovlev,17-Sep-91,Sep-17-1991,9/17/91,9/17/91,1991,9,17,Sep
8478406,Mackenzie,Blackwood,9-Dec-96,Dec-9-1996,12/9/96,12/9/96,1996,12,9,Dec
8480003,Jesper,Boqvist,30-Oct-98,Oct-30-1998,10/30/98,10/30/98,1998,10,30,Oct
8477038,Nikita,Gusev,8-Jul-92,Jul-8-1992,7/8/92,7/8/92,1992,7,8,Jul
8477401,John,Hayden,14-Feb-95,Feb-14-1995,2/14/95,2/14/95,1995,2,14,Feb
8481559,Jack,Hughes,14-May-01,May-14-2001,5/14/01,5/14/01,2001,5,14,May
8479511,Janne,Kuokkanen,25-May-98,May-25-1998,5/25/98,5/25/98,1998,5,25,May
8478447,Nick,Merkley,23-May-97,May-23-1997,5/23/97,5/23/97,1997,5,23,May
8474190,Wayne,Simmonds,26-Aug-88,Aug-26-1988,8/26/88,8/26/88,1988,8,26,Aug
8476043,Ben,Street,13-Feb-87,Feb-13-1987,2/13/87,2/13/87,1987,2,13,Feb
8476368,Fredrik,Claesson,24-Nov-92,Nov-24-1992,11/24/92,11/24/92,1992,11,24,Nov
8477541,Dakota,Mermis,5-Jan-94,Jan-5-1994,1/5/94,1/5/94,1994,1,5,Jan
8474056,P.K.,Subban,13-May-89,May-13-1989,5/13/89,5/13/89,1989,5,13,May
8476807,Matt,Tennyson,23-Apr-90,Apr-23-1990,4/23/90,4/23/90,1990,4,23,Apr
8475839,Louis,Domingue,6-Mar-92,Mar-6-1992,3/6/92,3/6/92,1992,3,6,Mar
8480213,Gilles,Senn,1-Mar-96,Mar-1-1996,3/1/96,3/1/96,1996,3,1,Mar
8481518,Nolan,Foote,29-Nov-00,Nov-29-2000,11/29/00,11/29/00,2000,11,29,Nov
8478421,A.J.,Greer,14-Dec-96,Dec-14-1996,12/14/96,12/14/96,1996,12,14,Dec
8477341,Andreas,Johnsson,21-Nov-94,Nov-21-1994,11/21/94,11/21/94,1994,11,21,Nov
8479573,Mikhail,Maltsev,12-Mar-98,Mar-12-1998,3/12/98,3/12/98,1998,3,12,Mar
8481068,Yegor,Sharangovich,6-Jun-98,Jun-6-1998,6/6/98,6/6/98,1998,6,6,Jun
8480226,Marin,Studenic,28-Oct-98,Oct-28-1998,10/28/98,10/28/98,1998,10,28,Oct
8481740,Tyce,Thompson,12-Jul-99,Jul-12-1999,7/12/99,7/12/99,1999,7,12,Jul
8480860,Kevin,Bahl,27-Jun-00,Jun-27-2000,6/27/00,6/27/00,2000,6,27,Jun
8475179,Dmitry,Kulikov,29-Oct-90,Oct-29-1990,10/29/90,10/29/90,1990,10,29,Oct
8476850,Ryan,Murray,27-Sep-93,Sep-27-1993,9/27/93,9/27/93,1993,9,27,Sep
8478399,Jonas,Siegenthaler,6-May-97,May-6-1997,5/6/97,5/6/97,1997,5,6,May
8480883,Ty,Smith,24-Mar-00,Mar-24-2000,3/24/00,3/24/00,2000,3,24,Mar
8477480,Eric,Comrie,6-Jul-95,Jul-6-1995,7/6/95,7/6/95,1995,7,6,Jul
8477180,Aaron,Dell,4-May-89,May-4-1989,5/4/89,5/4/89,1989,5,4,May
8478029,Chase,De Leo,25-Oct-95,Oct-25-1995,10/25/95,10/25/95,1995,10,25,Oct
8477512,Frederik,Gauthier,26-Apr-95,Apr-26-1995,4/26/95,4/26/95,1995,4,26,Apr
8482125,Alexander,Holtz,23-Jan-02,Jan-23-2002,1/23/02,1/23/02,2002,1,23,Jan
8482110,Dawson,Mercer,27-Oct-01,Oct-27-2001,10/27/01,10/27/01,2001,10,27,Oct
8475193,Tomas,Tatar,1-Dec-90,Dec-1-1990,12/1/90,12/1/90,1990,12,1,Dec
8476918,Jimmy,Vesey,26-May-93,May-26-1993,5/26/93,5/26/93,1993,5,26,May
8480188,Fabian,Zetterlund,25-Aug-99,Aug-25-1999,8/25/99,8/25/99,1999,8,25,Aug
8477419,Mason,Geertsen,19-Apr-95,Apr-19-1995,4/19/95,4/19/95,1995,4,19,Apr
8477435,Ryan,Graves,21-May-95,May-21-1995,5/21/95,5/21/95,1995,5,21,May
8476462,Dougie,Hamilton,17-Jun-93,Jun-17-1993,6/17/93,6/17/93,1993,6,17,Jun
8478868,Christian,Jaros,2-Apr-96,Apr-2-1996,4/2/96,4/2/96,1996,4,2,Apr
8481537,Nikita,Okhotiuk,4-Dec-00,Dec-4-2000,12/4/00,12/4/00,2000,12,4,Dec
8480054,Reilly,Walsh,21-Apr-99,Apr-21-1999,4/21/99,4/21/99,1999,4,21,Apr
8473541,Jonathan,Bernier,7-Aug-88,Aug-7-1988,8/7/88,8/7/88,1988,8,7,Aug
8482076,Nico,Daws,22-Dec-00,Dec-22-2000,12/22/00,12/22/00,2000,12,22,Dec
8476903,Jon,Gillies,22-Jan-94,Jan-22-1994,1/22/94,1/22/94,1994,1,22,Jan
8477202,Andrew,Hammond,11-Feb-88,Feb-11-1988,2/11/88,2/11/88,1988,2,11,Feb
8481033,Akira,Schmid,12-May-00,May-12-2000,5/12/00,5/12/00,2000,5,12,May
8475287,Erik,Haula,23-Mar-91,Mar-23-1991,3/23/91,3/23/91,1991,3,23,Mar
8477508,Curtis,Lazar,2-Feb-95,Feb-2-1995,2/2/95,2/2/95,1995,2,2,Feb
8478414,Timo,Meier,8-Oct-96,Oct-8-1996,10/8/96,10/8/96,1996,10,8,Oct
8476292,Ondrej,Palat,28-Mar-91,Mar-28-1991,3/28/91,3/28/91,1991,3,28,Mar
8482684,Luke,Hughes,9-Sep-03,Sep-9-2003,9/9/03,9/9/03,2003,9,9,Sep
8478507,John,Marino,21-May-97,May-21-1997,5/21/97,5/21/97,1997,5,21,May
8474090,Brendan,Smith,8-Feb-89,Feb-8-1989,2/8/89,2/8/89,1989,2,8,Feb
8477970,Vitek,Vanecek,9-Jan-96,Jan-9-1996,1/9/96,1/9/96,1996,1,9,Jan
8481578,Graeme,Clarke,24-Apr-01,Apr-24-2001,4/24/01,4/24/01,2001,4,24,Apr
8477931,Tomas,Nosek,1-Sep-92,Sep-1-1992,9/1/92,9/1/92,1992,9,1,Sep
8476919,Chris,Tierney,1-Jul-94,Jul-1-1994,7/1/94,7/1/94,1994,7,1,Jul
8475726,Tyler,Toffoli,24-Apr-92,Apr-24-1992,4/24/92,4/24/92,1992,4,24,Apr
8476525,Colin,Miller,29-Oct-92,Oct-29-1992,10/29/92,10/29/92,1992,10,29,Oct
8483495,Simon,Nemec,15-Feb-04,Feb-15-2004,2/15/04,2/15/04,2004,2,15,Feb
8444934,Paul,Andrea,31-Jul-41,Jul-31-1941,7/31/41,7/31/41,1941,7,31,Jul
8451624,Ron,Stackhouse,26-Aug-49,Aug-26-1949,8/26/49,8/26/49,1949,8,26,Aug
8450116,Bob,Sneddon,31-May-44,May-31-1944,5/31/44,5/31/44,1944,5,31,May
8445327,Wayne,Carleton,4-Aug-46,Aug-4-1946,8/4/46,8/4/46,1946,8,4,Aug
8446586,Stan,Gilbertson,29-Oct-44,Oct-29-1944,10/29/44,10/29/44,1944,10,29,Oct
8446666,Del,Hall,7-May-49,May-7-1949,5/7/49,5/7/49,1949,5,7,May
8446963,Frank,Hughes,1-Oct-49,Oct-1-1949,10/1/49,10/1/49,1949,10,1,Oct
8447275,Pete,Laframboise,18-Jan-50,Jan-18-1950,1/18/50,1/18/50,1950,1,18,Jan
8448729,Reggie,Leach,23-Apr-50,Apr-23-1950,4/23/50,4/23/50,1950,4,23,Apr
8448153,Gerry,Pinder,15-Sep-48,Sep-15-1948,9/15/48,9/15/48,1948,9,15,Sep
8452360,Tom,Webster,4-Oct-48,Oct-4-1948,10/4/48,10/4/48,1948,10,4,Oct
8445002,Ken,Baird,1-Feb-51,Feb-1-1951,2/1/51,2/1/51,1951,2,1,Feb
8447114,Jim,Jones,27-Jul-49,Jul-27-1949,7/27/49,7/27/49,1949,7,27,Jul
8449040,Al,Simmons,25-Sep-51,Sep-25-1951,9/25/51,9/25/51,1951,9,25,Sep
8451538,Rick,Smith,29-Jun-48,Jun-29-1948,6/29/48,6/29/48,1948,6,29,Jun
8449849,Lyle,Carter,29-Apr-45,Apr-29-1945,4/29/45,4/29/45,1945,4,29,Apr
8450011,Gary,Kurt,9-Mar-47,Mar-9-1947,3/9/47,3/9/47,1947,3,9,Mar
8447903,Morris,Mott,25-May-46,May-25-1946,5/25/46,5/25/46,1946,5,25,May
8449305,Pete,Vipond,8-Dec-49,Dec-8-1949,12/8/49,12/8/49,1949,12,8,Dec
8449034,Darryl,Maggs,6-Apr-49,Apr-6-1949,4/6/49,4/6/49,1949,4,6,Apr
8447648,Ted,McAneeley,7-Nov-50,Nov-7-1950,11/7/50,11/7/50,1950,11,7,Nov
8449772,Terry,Murray,20-Jul-50,Jul-20-1950,7/20/50,7/20/50,1950,7,20,Jul
8449914,Marv,Edwards,15-Aug-34,Aug-15-1934,8/15/34,8/15/34,1934,8,15,Aug
8447407,Bruce,Greig,9-May-53,May-9-1953,5/9/53,5/9/53,1953,5,9,May
8446928,Dave,Hrechkosy,1-Nov-51,Nov-1-1951,11/1/51,11/1/51,1951,11,1,Nov
8447009,Ron,Huston,8-Apr-45,Apr-8-1945,4/8/45,4/8/45,1945,4,8,Apr
8447168,Rick,Kessell,27-Jul-49,Jul-27-1949,7/27/49,7/27/49,1949,7,27,Jul
8447186,Wayne,King,4-Sep-51,Sep-4-1951,9/4/51,9/4/51,1951,9,4,Sep
8449435,Ray,Mckay,22-Aug-46,Aug-22-1946,8/22/46,8/22/46,1946,8,22,Aug
8449675,Hartland,Monahan,29-Mar-51,Mar-29-1951,3/29/51,3/29/51,1951,3,29,Mar
8450215,Larry,Patey,19-Mar-53,Mar-19-1953,3/19/53,3/19/53,1953,3,19,Mar
8445828,Barry,Cummins,25-Jan-49,Jan-25-1949,1/25/49,1/25/49,1949,1,25,Jan
8448973,Ron,Serafini,31-Oct-53,Oct-31-1953,10/31/53,10/31/53,1953,10,31,Oct
8448978,Paul,Shakes,4-Sep-52,Sep-4-1952,9/4/52,9/4/52,1952,9,4,Sep
8449852,Bob,Champoux,2-Dec-42,Dec-2-1942,12/2/42,12/2/42,1942,12,2,Dec
8450129,Ted,Tucker,7-May-49,May-7-1949,5/7/49,5/7/49,1949,5,7,May
8447339,Brian,Lavender,20-Apr-47,Apr-20-1947,4/20/47,4/20/47,1947,4,20,Apr
8449486,Butch,Williams,11-Sep-52,Sep-11-1952,9/11/52,9/11/52,1952,9,11,Sep
8449635,Larry,Wright,8-Oct-51,Oct-8-1951,10/8/51,10/8/51,1951,10,8,Oct
8450320,George,Pesut,17-Jun-53,Jun-17-1953,6/17/53,6/17/53,1953,6,17,Jun
8447038,Tim,Jacobs,28-Mar-52,Mar-28-1952,3/28/52,3/28/52,1952,3,28,Mar
8449841,Art,Brooks,4-Feb-1889,Feb-4-1889,2/4/1889,1889-02-04,1889,2,4,Feb
8447037,Paul,Jacobs,9-Mar-1884,Mar-9-1884,3/9/1884,1884-03-09,1884,3,9,Mar
8446761,Frank,Heffernan,12-Jan-1892,Jan-12-1892,1/12/1892,1892-01-12,1892,1,12,Jan
8450044,Ivan,Mitchell,9-Jul-1893,Jul-9-1893,7/9/1893,1893-07-09,1893,7,9,Jul
8449199,Billy,Stuart,1-Feb-00,Feb-1-1900,2/1/00,2/1/00,1900,2,1,Feb
8444936,Lloyd,Andrews,4-Nov-1894,Nov-4-1894,11/4/1894,1894-11-04,1894,11,4,Nov
8448030,Paddy,Nolan,1-Dec-1897,Dec-1-1897,12/1/1897,1897-12-01,1897,12,1,Dec
8449075,Glenn,Smith,25-Apr-1895,Apr-25-1895,4/25/1895,1895-04-25,1895,4,25,Apr
8449145,Ted,Stackhouse,2-Nov-1894,Nov-2-1894,11/2/1894,1894-11-02,1894,11,2,Nov
8450103,John Ross,Roach,23-Jun-00,Jun-23-1900,6/23/00,6/23/00,1900,6,23,Jun
8445882,Gerry,Denoird,4-Aug-02,Aug-4-1902,8/4/02,8/4/02,1902,8,4,Aug
8447518,Wilf,Loughlin,28-Feb-1896,Feb-28-1896,2/28/1896,1896-02-28,1896,2,28,Feb
8446300,Alvin,Fisher,5-Jan-1893,Jan-5-1893,1/5/1893,1893-01-05,1893,1,5,Jan
8448310,Reg,Reid,17-Feb-1899,Feb-17-1899,2/17/1899,1899-02-17,1899,2,17,Feb
8444851,Gordon,Spence,25-Jul-1897,Jul-25-1897,7/25/1897,1897-07-25,1897,7,25,Jul
8449002,Norm,Shay,3-Feb-1899,Feb-3-1899,2/3/1899,1899-02-03,1899,2,3,Feb
8444998,Ace,Bailey,3-Jul-03,Jul-3-1903,7/3/03,7/3/03,1903,7,3,Jul
8445345,Bill,Carson,25-Nov-00,Nov-25-1900,11/25/00,11/25/00,1900,11,25,Nov
8447144,Butch,Keeling,10-Aug-05,Aug-10-1905,8/10/05,8/10/05,1905,8,10,Aug
8448226,Al,Pudas,17-Feb-1899,Feb-17-1899,2/17/1899,1899-02-17,1899,2,17,Feb
8445850,Bob,Davis,2-Feb-1899,Feb-2-1899,2/2/1899,1899-02-02,1899,2,2,Feb
8446694,Emil,Hanson,18-Nov-07,Nov-18-1907,11/18/07,11/18/07,1907,11,18,Nov
8447879,Ron,Moffat,21-Aug-05,Aug-21-1905,8/21/05,8/21/05,1905,8,21,Aug
8445296,Walt,Buswell,6-Nov-07,Nov-6-1907,11/6/07,11/6/07,1907,11,6,Nov
8448139,Gord,Pettinger,11-Nov-11,Nov-11-1911,11/11/11,11/11/11,1911,11,11,Nov
8446458,Harry,Foster,25-Nov-07,Nov-25-1907,11/25/07,11/25/07,1907,11,25,Nov
8448357,Fred,Robertson,22-Oct-11,Oct-22-1911,10/22/11,10/22/11,1911,10,22,Oct
8445150,Irwin,Boyd,13-Nov-08,Nov-13-1908,11/13/08,11/13/08,1908,11,13,Nov
8447746,Bucko,McDonald,31-Oct-14,Oct-31-1914,10/31/14,10/31/14,1914,10,31,Oct
8445194,Mud,Bruneteau,28-Nov-14,Nov-28-1914,11/28/14,11/28/14,1914,11,28,Nov
8446590,Art,Giroux,6-Jun-08,Jun-6-1908,6/6/08,6/6/08,1908,6,6,Jun
8448463,Rolly,Roulston,12-Apr-11,Apr-12-1911,4/12/11,4/12/11,1911,4,12,Apr
8449014,John,Sherf,8-Apr-13,Apr-8-1913,4/8/13,4/8/13,1913,4,8,Apr
8445856,Don,Deacon,2-Jun-13,Jun-2-1913,6/2/13,6/2/13,1913,6,2,Jun
8447575,Howie,Mackie,30-Aug-13,Aug-30-1913,8/30/13,8/30/13,1913,8,30,Aug
8448066,Jimmy,Orlando,27-Feb-16,Feb-27-1916,2/27/16,2/27/16,1916,2,27,Feb
8449923,Jim,Franks,8-Nov-14,Nov-8-1914,11/8/14,11/8/14,1914,11,8,Nov
8445940,Ken,Doraty,23-Jun-06,Jun-23-1906,6/23/06,6/23/06,1906,6,23,Jun
8445952,Clarence,Drouillard,2-Mar-14,Mar-2-1914,3/2/14,3/2/14,1914,3,2,Mar
8444852,Ron,Hudson,14-Jul-11,Jul-14-1911,7/14/11,7/14/11,1911,7,14,Jul
8447501,Carl,Liscombe,17-May-15,May-17-1915,5/17/15,5/17/15,1915,5,17,May
8447904,Alex,Motter,20-Jun-13,Jun-20-1913,6/20/13,6/20/13,1913,6,20,Jun
8445075,Pete,Bessone,13-Jan-13,Jan-13-1913,1/13/13,1/13/13,1913,1,13,Jan
8449359,Eddie,Wares,19-Mar-15,Mar-19-1915,3/19/15,3/19/15,1915,3,19,Mar
8444857,Sid,Abel,22-Feb-18,Feb-22-1918,2/22/18,2/22/18,1918,2,22,Feb
8445074,Phil,Besler,9-Dec-13,Dec-9-1913,12/9/13,12/9/13,1913,12,9,Dec
8445182,Connie,Brown,11-Jan-17,Jan-11-1917,1/11/17,1/11/17,1917,1,11,Jan
8446583,Gus,Giesebrecht,14-Sep-17,Sep-14-1917,9/14/17,9/14/17,1917,9,14,Sep
8446651,Don,Grosso,12-Apr-15,Apr-12-1915,4/12/15,4/12/15,1915,4,12,Apr
8447141,Jack,Keating,9-Oct-16,Oct-9-1916,10/9/16,10/9/16,1916,10,9,Oct
8447182,Ken,Kilrea,16-Jan-19,Jan-16-1919,1/16/19,1/16/19,1919,1,16,Jan
8447633,Charlie,Mason,1-Feb-12,Feb-1-1912,2/1/12,2/1/12,1912,2,1,Feb
8449234,Bill,Thomson,23-Mar-14,Mar-23-1914,3/23/14,3/23/14,1914,3,23,Mar
8445295,Eddie,Bush,11-Jul-18,Jul-11-1918,7/11/18,7/11/18,1918,7,11,Jul
8447113,Buck,Jones,17-Aug-18,Aug-17-1918,8/17/18,8/17/18,1918,8,17,Aug
8449184,Jack,Stewart,6-May-17,May-6-1917,5/6/17,5/6/17,1917,5,6,May
8450126,Harvey,Teno,15-Feb-15,Feb-15-1915,2/15/15,2/15/15,1915,2,15,Feb
8450127,Tiny,Thompson,31-May-03,May-31-1903,5/31/03,5/31/03,1903,5,31,May
8445908,Cecil,Dillon,26-Apr-08,Apr-26-1908,4/26/08,4/26/08,1908,4,26,Apr
8446302,Joe,Fisher,4-Jul-16,Jul-4-1916,7/4/16,7/4/16,1916,7,4,Jul
8447747,Butch,McDonald,21-Nov-16,Nov-21-1916,11/21/16,11/21/16,1916,11,21,Nov
8448122,Bert,Peer,12-Nov-10,Nov-12-1910,11/12/10,11/12/10,1910,11,12,Nov
8449833,Claude,Bourque,31-Mar-15,Mar-31-1915,3/31/15,3/31/15,1915,3,31,Mar
8445193,Eddie,Bruneteau,1-Aug-19,Aug-1-1919,8/1/19,8/1/19,1919,8,1,Aug
8445349,Joe,Carveth,21-Mar-18,Mar-21-1918,3/21/18,3/21/18,1918,3,21,Mar
8445946,Les,Douglas,5-Dec-18,Dec-5-1918,12/5/18,12/5/18,1918,12,5,Dec
8446786,Art,Herchenratter,24-Nov-17,Nov-24-1917,11/24/17,11/24/17,1917,11,24,Nov
8447053,Bill,Jennings,28-Jun-17,Jun-28-1917,6/28/17,6/28/17,1917,6,28,Jun
8449472,Arch,Wilder,30-Apr-17,Apr-30-1917,4/30/17,4/30/17,1917,4,30,Apr
8445041,Dick,Behling,16-Mar-16,Mar-16-1916,3/16/16,3/16/16,1916,3,16,Mar
8447024,Harold,Jackson,1-Aug-18,Aug-1-1918,8/1/18,8/1/18,1918,8,1,Aug
8449393,Bob,Whitelaw,5-Oct-16,Oct-5-1916,10/5/16,10/5/16,1916,10,5,Oct
8450047,Johnny,Mowers,29-Oct-16,Oct-29-1916,10/29/16,10/29/16,1916,10,29,Oct
8445180,Adam,Brown,4-Feb-20,Feb-4-1920,2/4/20,2/4/20,1920,2,4,Feb
8445185,Gerry,Brown,7-Jul-17,Jul-7-1917,7/7/17,7/7/17,1917,7,7,Jul
8446861,Dutch,Hiller,11-May-15,May-11-1915,5/11/15,5/11/15,1915,5,11,May
8447824,Pat,McReavy,16-Jan-18,Jan-16-1918,1/16/18,1/16/18,1918,1,16,Jan
8447656,Doug,McCaig,24-Feb-19,Feb-24-1919,2/24/19,2/24/19,1919,2,24,Feb
8450131,Joe,Turner,28-Mar-19,Mar-28-1919,3/28/19,3/28/19,1919,3,28,Mar
8446903,John,Holota,25-Feb-21,Feb-25-1921,2/25/21,2/25/21,1921,2,25,Feb
8447649,Jud,McAtee,5-Feb-20,Feb-5-1920,2/5/20,2/5/20,1920,2,5,Feb
8448235,Bill,Quackenbush,2-Mar-22,Mar-2-1922,3/2/22,3/2/22,1922,3,2,Mar
8449041,Cully,Simon,8-May-18,May-8-1918,5/8/18,5/8/18,1918,5,8,May
8445055,Frank,Bennett,4-Mar-22,Mar-4-1922,3/4/22,3/4/22,1922,3,4,Mar
8445242,Tony,Bukovich,30-Aug-17,Aug-30-1917,8/30/17,8/30/17,1917,8,30,Aug
8445364,Lude,Check,22-May-19,May-22-1919,5/22/19,5/22/19,1919,5,22,May
8447532,Vic,Lynn,26-Jan-25,Jan-26-1925,1/26/25,1/26/25,1925,1,26,Jan
8448262,Billy,Reay,21-Aug-18,Aug-21-1918,8/21/18,8/21/18,1918,8,21,Aug
8448459,Roly,Rossignol,18-Oct-21,Oct-18-1921,10/18/21,10/18/21,1921,10,18,Oct
8448589,Bernie,Ruelle,23-Nov-20,Nov-23-1920,11/23/20,11/23/20,1920,11,23,Nov
8449067,Carl,Smith,18-Sep-17,Sep-18-1917,9/18/17,9/18/17,1917,9,18,Sep
8449070,Nakina,Smith,26-Jul-15,Jul-26-1915,7/26/15,7/26/15,1915,7,26,Jul
8445244,Hy,Buller,15-Mar-26,Mar-15-1926,3/15/26,3/15/26,1926,3,15,Mar
8447134,Francis,Kane,19-Jan-23,Jan-19-1923,1/19/23,1/19/23,1923,1,19,Jan
8449016,Gordon,Sherritt,8-Apr-19,Apr-8-1919,4/8/19,4/8/19,1919,4,8,Apr
8449690,Rudy,Zunich,24-Nov-10,Nov-24-1910,11/24/10,11/24/10,1910,11,24,Nov
8449896,Connie,Dion,11-Aug-18,Aug-11-1918,8/11/18,8/11/18,1918,8,11,Aug
8450019,Harry,Lumley,11-Nov-26,Nov-11-1926,11/11/26,11/11/26,1926,11,11,Nov
8445745,Gerry,Couture,6-Aug-25,Aug-6-1925,8/6/25,8/6/25,1925,8,6,Aug
8447500,Ted,Lindsay,29-Jul-25,Jul-29-1925,7/29/25,7/29/25,1925,7,29,Jul
8449226,Lorrain,Thibeault,2-Oct-18,Oct-2-1918,10/2/18,10/2/18,1918,10,2,Oct
8449599,Steve,Wojciechowski,25-Dec-22,Dec-25-1922,12/25/22,12/25/22,1922,12,25,Dec
8448951,Earl,Seibert,7-Dec-11,Dec-7-1911,12/7/11,12/7/11,1911,12,7,Dec
8445513,Jim,Conacher,5-May-21,May-5-1921,5/5/21,5/5/21,1921,5,5,May
8446573,Fern,Gauthier,31-Aug-19,Aug-31-1919,8/31/19,8/31/19,1919,8,31,Aug
8447530,Pat,Lundy,21-May-24,May-21-1924,5/21/24,5/21/24,1924,5,21,May
8447799,Rollie,McLenahan,26-Oct-21,Oct-26-1921,10/26/21,10/26/21,1921,10,26,Oct
8445517,Roy,Conacher,5-Oct-16,Oct-5-1916,10/5/16,10/5/16,1916,10,5,Oct
8445939,Lloyd,Doran,10-Jan-21,Jan-10-1921,1/10/21,1/10/21,1921,1,10,Jan
8446913,Pete,Horeck,15-Jun-23,Jun-15-1923,6/15/23,6/15/23,1923,6,15,Jun
8447486,Tony,Licari,9-Apr-21,Apr-9-1921,4/9/21,4/9/21,1921,4,9,Apr
8447544,Calum,MacKay,1-Jan-27,Jan-1-1927,1/1/27,1/1/27,1927,1,1,Jan
8447769,Jim,McFadden,15-Apr-20,Apr-15-1920,4/15/20,4/15/20,1920,4,15,Apr
8448947,Enio,Sclisizzi,1-Aug-25,Aug-1-1925,8/1/25,8/1/25,1925,8,1,Aug
8449043,Cliff,Simpson,4-Apr-23,Apr-4-1923,4/4/23,4/4/23,1923,4,4,Apr
8449216,Billy,Taylor,3-May-19,May-3-1919,5/3/19,5/3/19,1919,5,3,May
8445003,Doug,Baldwin,2-Nov-22,Nov-2-1922,11/2/22,11/2/22,1922,11,2,Nov
8445888,Al,Dewsbury,12-Apr-26,Apr-12-1926,4/12/26,4/12/26,1926,4,12,Apr
8447861,Hugh,Millar,3-Apr-21,Apr-3-1921,4/3/21,4/3/21,1921,4,3,Apr
8448317,Leo,Reise,7-Jun-22,Jun-7-1922,6/7/22,6/7/22,1922,6,7,Jun
8449042,Thain,Simon,24-Apr-22,Apr-24-1922,4/24/22,4/24/22,1922,4,24,Apr
8449802,Red,Almas,26-Apr-24,Apr-26-1924,4/26/24,4/26/24,1924,4,26,Apr
8446656,Bep,Guidolin,9-Dec-25,Dec-9-1925,12/9/25,12/9/25,1925,12,9,Dec
8447810,Max,McNab,21-Jun-24,Jun-21-1924,6/21/24,6/21/24,1924,6,21,Jun
8447894,Don,Morrison,14-Jul-23,Jul-14-1923,7/14/23,7/14/23,1923,7,14,Jul
8447898,Rod,Morrison,7-Oct-25,Oct-7-1925,10/7/25,10/7/25,1925,10,7,Oct
8448103,Marty,Pavelich,6-Nov-27,Nov-6-1927,11/6/27,11/6/27,1927,11,6,Nov
8449201,Barry,Sullivan,21-Sep-27,Sep-21-1927,9/21/27,9/21/27,1927,9,21,Sep
8446333,Lee,Fogolin,27-Feb-26,Feb-27-1926,2/27/26,2/27/26,1926,2,27,Feb
8447149,Red,Kelly,9-Jul-27,Jul-9-1927,7/9/27,7/9/27,1927,7,9,Jul
8448007,Ed,Nicholson,9-Sep-23,Sep-9-1923,9/9/23,9/9/23,1923,9,9,Sep
8450030,Tom,McGrattan,19-Oct-27,Oct-19-1927,10/19/27,10/19/27,1927,10,19,Oct
8446575,George,Gee,28-Jun-22,Jun-28-1922,6/28/22,6/28/22,1922,6,28,Jun
8446594,Fred,Glover,5-Jan-28,Jan-5-1928,1/5/28,1/5/28,1928,1,5,Jan
8448163,Nels,Podolsky,19-Dec-25,Dec-19-1925,12/19/25,12/19/25,1925,12,19,Dec
8448167,Bud,Poile,10-Feb-24,Feb-10-1924,2/10/24,2/10/24,1924,2,10,Feb
8448308,Gerry,Reid,13-Oct-28,Oct-13-1928,10/13/28,10/13/28,1928,10,13,Oct
8444992,Pete,Babando,10-May-25,May-10-1925,5/10/25,5/10/25,1925,5,10,May
8445082,Steve,Black,31-Mar-27,Mar-31-1927,3/31/27,3/31/27,1927,3,31,Mar
8446660,Gord,Haidy,11-Apr-28,Apr-11-1928,4/11/28,4/11/28,1928,4,11,Apr
8447788,Doug,McKay,28-May-29,May-28-1929,5/28/29,5/28/29,1929,5,28,May
8448136,Jimmy,Peters,2-Oct-22,Oct-2-1922,10/2/22,10/2/22,1922,10,2,Oct
8449050,Glen,Skov,26-Jan-31,Jan-26-1931,1/26/31,1/26/31,1931,1,26,Jan
8449556,Johnny,Wilson,14-Jun-29,Jun-14-1929,6/14/29,6/14/29,1929,6,14,Jun
8449557,Larry,Wilson,23-Oct-30,Oct-23-1930,10/23/30,10/23/30,1930,10,23,Oct
8447623,Clare,Martin,25-Feb-22,Feb-25-1922,2/25/22,2/25/22,1922,2,25,Feb
8448214,Marcel,Pronovost,15-Jun-30,Jun-15-1930,6/15/30,6/15/30,1930,6,15,Jun
8450111,Terry,Sawchuk,28-Dec-29,Dec-28-1929,12/28/29,12/28/29,1929,12,28,Dec
8445865,Alex,Delvecchio,4-Dec-31,Dec-4-1931,12/4/31,12/4/31,1931,12,4,Dec
8446640,Leo,Gravelle,10-Jun-25,Jun-10-1925,6/10/25,6/10/25,1925,6,10,Jun
8447044,Lou,Jankowski,27-Jun-31,Jun-27-1931,6/27/31,6/27/31,1931,6,27,Jun
8448223,Metro,Prystai,7-Nov-27,Nov-7-1927,11/7/27,11/7/27,1927,11,7,Nov
8449176,Vic,Stasiuk,23-May-29,May-23-1929,5/23/29,5/23/29,1929,5,23,May
8449183,Gaye,Stewart,23-Jun-23,Jun-23-1923,6/23/23,6/23/23,1923,6,23,Jun
8449598,Benny,Woit,7-Jan-28,Jan-7-1928,1/7/28,1/7/28,1928,1,7,Jan
8446603,Bob,Goldham,12-May-22,May-12-1922,5/12/22,5/12/22,1922,5,12,May
8448242,Rags,Raglan,4-Sep-27,Sep-4-1927,9/4/27,9/4/27,1927,9,4,Sep
8447471,Tony,Leswick,17-Mar-23,Mar-17-1923,3/17/23,3/17/23,1923,3,17,Mar
8446339,Bill,Folk,11-Jul-27,Jul-11-1927,7/11/27,7/11/27,1927,7,11,Jul
8449679,Larry,Zeidel,1-Jun-28,Jun-1-1928,6/1/28,6/1/28,1928,6,1,Jun
8445116,Marcel,Bonin,12-Sep-32,Sep-12-1932,9/12/32,9/12/32,1932,9,12,Sep
8446228,Guyle,Fielder,21-Nov-30,Nov-21-1930,11/21/30,11/21/30,1930,11,21,Nov
8449046,Reg,Sinclair,6-Mar-25,Mar-6-1925,3/6/25,3/6/25,1925,3,6,Mar
8446751,Jim,Hay,15-May-31,May-15-1931,5/15/31,5/15/31,1931,5,15,May
8446930,Steve,Hrymnak,3-Mar-26,Mar-3-1926,3/3/26,3/3/26,1926,3,3,Mar
8449988,Glenn,Hall,3-Oct-31,Oct-3-1931,10/3/31,10/3/31,1931,10,3,Oct
8445909,Bill,Dineen,18-Sep-32,Sep-18-1932,9/18/32,9/18/32,1932,9,18,Sep
8445956,Gilles,Dube,2-Jun-27,Jun-2-1927,6/2/27,6/2/27,1927,6,2,Jun
8447097,Earl,Johnson,28-Jun-31,Jun-28-1931,6/28/31,6/28/31,1931,6,28,Jun
8448305,Dutch,Reibel,21-Jul-30,Jul-21-1930,7/21/30,7/21/30,1930,7,21,Jul
8449153,Ed,Stankiewicz,1-Dec-29,Dec-1-1929,12/1/29,12/1/29,1929,12,1,Dec
8444873,Keith,Allen,21-Aug-23,Aug-21-1923,8/21/23,8/21/23,1923,8,21,Aug
8444955,Al,Arbour,1-Nov-32,Nov-1-1932,11/1/32,11/1/32,1932,11,1,Nov
8449968,Dave,Gatherum,28-Mar-32,Mar-28-1932,3/28/32,3/28/32,1932,3,28,Mar
8450149,Lefty,Wilson,15-Oct-19,Oct-15-1919,10/15/19,10/15/19,1919,10,15,Oct
8445851,Lorne,Davis,20-Jul-30,Jul-20-1930,7/20/30,7/20/30,1930,7,20,Jul
8448169,Don,Poile,1-Jun-32,Jun-1-1932,6/1/32,6/1/32,1932,6,1,Jun
8449685,Ed,Zeniuk,8-Mar-33,Mar-8-1933,3/8/33,3/8/33,1933,3,8,Mar
8445240,Johnny,Bucyk,12-May-35,May-12-1935,5/12/35,5/12/35,1935,5,12,May
8445294,Cummy,Burton,12-May-36,May-12-1936,5/12/36,5/12/36,1936,5,12,May
8445371,Real,Chevrefils,2-May-32,May-2-1932,5/2/32,5/2/32,1932,5,2,May
8445573,Norm,Corcoran,15-Aug-31,Aug-15-1931,8/15/31,8/15/31,1931,8,15,Aug
8445638,Murray,Costello,24-Feb-34,Feb-24-1934,2/24/34,2/24/34,1934,2,24,Feb
8446197,Lorne,Ferguson,26-May-30,May-26-1930,5/26/30,5/26/30,1930,5,26,May
8447837,Gerry,Melnyk,16-Sep-34,Sep-16-1934,9/16/34,9/16/34,1934,9,16,Sep
8448783,Ed,Sandford,20-Aug-28,Aug-20-1928,8/20/28,8/20/28,1928,8,20,Aug
8449244,Jerry,Toppazzini,29-Jul-31,Jul-29-1931,7/29/31,7/29/31,1931,7,29,Jul
8449274,Norm,Ullman,26-Dec-35,Dec-26-1935,12/26/35,12/26/35,1935,12,26,Dec
8446599,Warren,Godfrey,23-Mar-31,Mar-23-1931,3/23/31,3/23/31,1931,3,23,Mar
8446896,Gord,Hollingworth,24-Jul-33,Jul-24-1933,7/24/33,7/24/33,1933,7,24,Jul
8445001,Bob,Bailey,29-May-31,May-29-1931,5/29/31,5/29/31,1931,5,29,May
8445855,Billy,Dea,3-Apr-33,Apr-3-1933,4/3/33,4/3/33,1933,4,3,Apr
8447676,Tom,McCarthy,15-Sep-34,Sep-15-1934,9/15/34,9/15/34,1934,9,15,Sep
8447817,Billy,McNeill,26-Jan-36,Jan-26-1936,1/26/36,1/26/36,1936,1,26,Jan
8444878,Dale,Anderson,5-Mar-32,Mar-5-1932,3/5/32,3/5/32,1932,3,5,Mar
8449196,Gord,Strate,28-May-35,May-28-1935,5/28/35,5/28/35,1935,5,28,May
8447164,Forbes,Kennedy,18-Aug-35,Aug-18-1935,8/18/35,8/18/35,1935,8,18,Aug
8447179,Brian,Kilrea,21-Oct-34,Oct-21-1934,10/21/34,10/21/34,1934,10,21,Oct
8447287,Hec,Lalande,24-Nov-34,Nov-24-1934,11/24/34,11/24/34,1934,11,24,Nov
8447717,Bill,McCreary,2-Dec-34,Dec-2-1934,12/2/34,12/2/34,1934,12,2,Dec
8447818,Stu,McNeill,25-Sep-38,Sep-25-1938,9/25/38,9/25/38,1938,9,25,Sep
8447854,Nick,Mickoski,7-Dec-27,Dec-7-1927,12/7/27,12/7/27,1927,12,7,Dec
8448058,Dennis,Olson,9-Nov-34,Nov-9-1934,11/9/34,11/9/34,1934,11,9,Nov
8449063,Brian,Smith,6-Dec-37,Dec-6-1937,12/6/37,12/6/37,1937,12,6,Dec
8444876,Dave,Amadio,23-Apr-39,Apr-23-1939,4/23/39,4/23/39,1939,4,23,Apr
8446783,John,Hendrickson,5-Dec-36,Dec-5-1936,12/5/36,12/5/36,1936,12,5,Dec
8447786,Jack,McIntyre,8-Sep-30,Sep-8-1930,9/8/30,9/8/30,1930,9,8,Sep
8444858,Gene,Achtymichuk,7-Sep-32,Sep-7-1932,9/7/32,9/7/32,1932,9,7,Sep
8446301,Dunc,Fisher,30-Aug-27,Aug-30-1927,8/30/27,8/30/27,1927,8,30,Aug
8446898,Chuck,Holmes,21-Sep-34,Sep-21-1934,9/21/34,9/21/34,1934,9,21,Sep
8447274,Claude,Laforge,1-Jul-36,Jul-1-1936,7/1/36,7/1/36,1936,7,1,Jul
8447611,Lou,Marcon,28-May-35,May-28-1935,5/28/35,5/28/35,1935,5,28,May
8447899,Gus,Mortson,24-Jan-25,Jan-24-1925,1/24/25,1/24/25,1925,1,24,Jan
8450065,Bob,Perreault,28-Jan-31,Jan-28-1931,1/28/31,1/28/31,1931,1,28,Jan
8444868,Gary,Aldcorn,7-Mar-35,Mar-7-1935,3/7/35,3/7/35,1935,3,7,Mar
8445825,Barry,Cullen,16-Jun-35,Jun-16-1935,6/16/35,6/16/35,1935,6,16,Jun
8446342,Val,Fonteyne,2-Dec-33,Dec-2-1933,12/2/33,12/2/33,1933,12,2,Dec
8446664,Len,Haley,15-Sep-31,Sep-15-1931,9/15/31,9/15/31,1931,9,15,Sep
8449494,John,McKenzie,12-Dec-37,Dec-12-1937,12/12/37,12/12/37,1937,12,12,Dec
8449125,Bob,Solinger,23-Dec-25,Dec-23-1925,12/23/25,12/23/25,1925,12,23,Dec
8446657,Lloyd,Haddon,10-Aug-38,Aug-10-1938,8/10/38,8/10/38,1938,8,10,Aug
8447895,Jim,Morrison,11-Oct-31,Oct-11-1931,10/11/31,10/11/31,1931,10,11,Oct
8448259,Marc,Reaume,7-Feb-34,Feb-7-1934,2/7/34,2/7/34,1934,2,7,Feb
8449832,Gilles,Boisvert,15-Feb-33,Feb-15-1933,2/15/33,2/15/33,1933,2,15,Feb
8450100,Dennis,Riggin,11-Apr-36,Apr-11-1936,4/11/36,4/11/36,1936,4,11,Apr
8445898,Edward,Diachuk,16-Aug-36,Aug-16-1936,8/16/36,8/16/36,1936,8,16,Aug
8446595,Howie,Glover,14-Feb-35,Feb-14-1935,2/14/35,2/14/35,1935,2,14,Feb
8447093,Allan,Johnson,30-Mar-35,Mar-30-1935,3/30/35,3/30/35,1935,3,30,Mar
8447260,Leo,Labine,22-Jul-31,Jul-22-1931,7/22/31,7/22/31,1931,7,22,Jul
8447540,Bruce,MacGregor,26-Apr-41,Apr-26-1941,4/26/41,4/26/41,1941,4,26,Apr
8446759,Rich,Healey,12-Mar-38,Mar-12-1938,3/12/38,3/12/38,1938,3,12,Mar
8449667,Howie,Young,2-Aug-37,Aug-2-1937,8/2/37,8/2/37,1937,8,2,Aug
8449804,Hank,Bassen,6-Dec-32,Dec-6-1932,12/6/32,12/6/32,1932,12,6,Dec
8445108,Marc,Boileau,3-Sep-32,Sep-3-1932,9/3/32,9/3/32,1932,9,3,Sep
8447051,Larry,Jeffrey,12-Oct-40,Oct-12-1940,10/12/40,10/12/40,1940,10,12,Oct
8447502,Ed,Litzenberger,15-Jul-32,Jul-15-1932,7/15/32,7/15/32,1932,7,15,Jul
8447536,Lowell,MacDonald,30-Aug-41,Aug-30-1941,8/30/41,8/30/41,1941,8,30,Aug
8447627,Pit,Martin,9-Dec-43,Dec-9-1943,12/9/43,12/9/43,1943,12,9,Dec
8448347,Wayne,Rivers,1-Feb-42,Feb-1-1942,2/1/42,2/1/42,1942,2,1,Feb
8446513,Bill,Gadsby,8-Aug-27,Aug-8-1927,8/8/27,8/8/27,1927,8,8,Aug
8446143,Bo,Elik,17-Oct-29,Oct-17-1929,10/17/29,10/17/29,1929,10,17,Oct
8446195,Alex,Faulkner,21-May-36,May-21-1936,5/21/36,5/21/36,1936,5,21,May
8447117,Eddie,Joyal,8-May-40,May-8-1940,5/8/40,5/8/40,1940,5,8,May
8447284,Roger,Lafreniere,24-Jul-42,Jul-24-1942,7/24/42,7/24/42,1942,7,24,Jul
8449074,Floyd,Smith,16-May-35,May-16-1935,5/16/35,5/16/35,1935,5,16,May
8445020,Doug,Barkley,6-Jan-37,Jan-6-1937,1/6/37,1/6/37,1937,1,6,Jan
8447579,John,MacMillan,25-Oct-35,Oct-25-1935,10/25/35,10/25/35,1935,10,25,Oct
8449197,Art,Stratton,8-Oct-35,Oct-8-1935,10/8/35,10/8/35,1935,10,8,Oct
8445835,Ian,Cushenan,29-Nov-33,Nov-29-1933,11/29/33,11/29/33,1933,11,29,Nov
8447019,Ron,Ingram,5-Jul-33,Jul-5-1933,7/5/33,7/5/33,1933,7,5,Jul
8447322,Al,Langlois,6-Nov-34,Nov-6-1934,11/6/34,11/6/34,1934,11,6,Nov
8447875,Bill,Mitchell,22-Feb-30,Feb-22-1930,2/22/30,2/22/30,1930,2,22,Feb
8449132,Irv,Spencer,4-Dec-37,Dec-4-1937,12/4/37,12/4/37,1937,12,4,Dec
8449370,Jim,Watson,28-Jun-43,Jun-28-1943,6/28/43,6/28/43,1943,6,28,Jun
8449859,Roger,Crozier,16-Mar-42,Mar-16-1942,3/16/42,3/16/42,1942,3,16,Mar
8449986,Harrison,Gray,5-Sep-41,Sep-5-1941,9/5/41,9/5/41,1941,9,5,Sep
8450109,Pat,Rupp,12-Aug-42,Aug-12-1942,8/12/42,8/12/42,1942,8,12,Aug
8447921,Ron,Murphy,10-Apr-33,Apr-10-1933,4/10/33,4/10/33,1933,4,10,Apr
8448099,Butch,Paul,11-Sep-43,Sep-11-1943,9/11/43,9/11/43,1943,9,11,Sep
8448137,Jimmy,Peters,20-Jun-44,Jun-20-1944,6/20/44,6/20/44,1944,6,20,Jun
8449321,Bob,Wall,1-Dec-42,Dec-1-1942,12/1/42,12/1/42,1942,12,1,Dec
8445032,Andy,Bathgate,28-Aug-32,Aug-28-1932,8/28/32,8/28/32,1932,8,28,Aug
8449062,Peter,Mahovlich,10-Oct-46,Oct-10-1946,10/10/46,10/10/46,1946,10,10,Oct
8447744,Ab,McDonald,18-Feb-36,Feb-18-1936,2/18/36,2/18/36,1936,2,18,Feb
8447792,Don,McKenney,30-Apr-34,Apr-30-1934,4/30/34,4/30/34,1934,4,30,Apr
8445341,Dwight,Carruthers,7-Nov-44,Nov-7-1944,11/7/44,11/7/44,1944,11,7,Nov
8446434,Gary,Doak,25-Feb-46,Feb-25-1946,2/25/46,2/25/46,1946,2,25,Feb
8449967,George,Gardner,8-Oct-42,Oct-8-1942,10/8/42,10/8/42,1942,10,8,Oct
8444856,Gerry,Abel,25-Dec-44,Dec-25-1944,12/25/44,12/25/44,1944,12,25,Dec
8447453,Real,Lemieux,3-Jan-45,Jan-3-1945,1/3/45,1/3/45,1945,1,3,Jan
8448423,Dave,Rochefort,22-Jul-46,Jul-22-1946,7/22/46,7/22/46,1946,7,22,Jul
8446189,Bob,Falkenberg,1-Jan-46,Jan-1-1946,1/1/46,1/1/46,1946,1,1,Jan
8446728,Doug,Harvey,19-Dec-24,Dec-19-1924,12/19/24,12/19/24,1924,12,19,Dec
8444928,Ron,Anderson,29-Jul-45,Jul-29-1945,7/29/45,7/29/45,1945,7,29,Jul
8446754,Galen,Head,16-Apr-47,Apr-16-1947,4/16/47,4/16/47,1947,4,16,Apr
8448846,Nick,Libett,9-Dec-45,Dec-9-1945,12/9/45,12/9/45,1945,12,9,Dec
8449044,Frank,Mahovlich,10-Jan-38,Jan-10-1938,1/10/38,1/10/38,1938,1,10,Jan
8447619,Gary,Marsh,9-Mar-46,Mar-9-1946,3/9/46,3/9/46,1946,3,9,Mar
8447672,Rick,McCann,27-May-44,May-27-1944,5/27/44,5/27/44,1944,5,27,May
8448322,Dave,Richardson,11-Dec-40,Dec-11-1940,12/11/40,12/11/40,1940,12,11,Dec
8449179,Pete,Stemkowski,25-Aug-43,Aug-25-1943,8/25/43,8/25/43,1943,8,25,Aug
8449915,Roy,Edwards,12-Mar-37,Mar-12-1937,3/12/37,3/12/37,1937,3,12,Mar
8446747,Ed,Hatoum,7-Dec-47,Dec-7-1947,12/7/47,12/7/47,1947,12,7,Dec
8447362,Rene,Leclerc,12-Nov-47,Nov-12-1947,11/12/47,11/12/47,1947,11,12,Nov
8447885,Hank,Monteith,2-Oct-45,Oct-2-1945,10/2/45,10/2/45,1945,10,2,Oct
8449113,Sandy,Snow,11-Nov-46,Nov-11-1946,11/11/46,11/11/46,1946,11,11,Nov
8449130,Fred,Speck,22-Jul-47,Jul-22-1947,7/22/47,7/22/47,1947,7,22,Jul
8448178,Poul,Popiel,28-Feb-43,Feb-28-1943,2/28/43,2/28/43,1943,2,28,Feb
8447138,Al,Karlander,5-Nov-46,Nov-5-1946,11/5/46,11/5/46,1946,11,5,Nov
8447883,Garry,Monahan,20-Oct-46,Oct-20-1946,10/20/46,10/20/46,1946,10,20,Oct
8449307,Doug,Volmar,9-Jan-45,Jan-9-1945,1/9/45,1/9/45,1945,1,9,Jan
8445696,Carl,Brewer,21-Oct-38,Oct-21-1938,10/21/38,10/21/38,1938,10,21,Oct
8448249,Matt,Ravlich,12-Jul-38,Jul-12-1938,7/12/38,7/12/38,1938,7,12,Jul
8448437,Dale,Rolfe,30-Apr-40,Apr-30-1940,4/30/40,4/30/40,1940,4,30,Apr
8445067,Red,Berenson,8-Dec-39,Dec-8-1939,12/8/39,12/8/39,1939,12,8,Dec
8447239,Jim,Krulicki,9-Mar-48,Mar-9-1948,3/9/48,3/9/48,1948,3,9,Mar
8448892,Don,Luce,2-Oct-48,Oct-2-1948,10/2/48,10/2/48,1948,10,2,Oct
8447872,Tom,Miller,31-Mar-47,Mar-31-1947,3/31/47,3/31/47,1947,3,31,Mar
8450736,Mickey,Redmond,27-Dec-47,Dec-27-1947,12/27/47,12/27/47,1947,12,27,Dec
8449023,Jim,Shires,15-Nov-45,Nov-15-1945,11/15/45,11/15/45,1945,11,15,Nov
8445710,Larry,Brown,14-Apr-47,Apr-14-1947,4/14/47,4/14/47,1947,4,14,Apr
8447286,Serge,Lajeunesse,11-Jun-50,Jun-11-1950,6/11/50,6/11/50,1950,6,11,Jun
8448010,Jim,Niekamp,11-Mar-46,Mar-11-1946,3/11/46,3/11/46,1946,3,11,Mar
8448373,Mike,Robitaille,12-Feb-48,Feb-12-1948,2/12/48,2/12/48,1948,2,12,Feb
8449985,Gerry,Gray,28-Jan-48,Jan-28-1948,1/28/48,1/28/48,1948,1,28,Jan
8450037,Don,McLeod,24-Aug-46,Aug-24-1946,8/24/46,8/24/46,1946,8,24,Aug
8451076,Jim,Rutherford,17-Feb-49,Feb-17-1949,2/17/49,2/17/49,1949,2,17,Feb
8445511,Brian,Conacher,31-Aug-41,Aug-31-1941,8/31/41,8/31/41,1941,8,31,Aug
8446430,Marcel,Dionne,3-Aug-51,Aug-3-1951,8/3/51,8/3/51,1951,8,3,Aug
8447094,Danny,Johnson,1-Oct-44,Oct-1-1944,10/1/44,10/1/44,1944,10,1,Oct
8449207,Bill,Sutherland,10-Nov-34,Nov-10-1934,11/10/34,11/10/34,1934,11,10,Nov
8449844,Andy,Brown,15-Feb-44,Feb-15-1944,2/15/44,2/15/44,1944,2,15,Feb
8446290,Joe,Daley,20-Feb-43,Feb-20-1943,2/20/43,2/20/43,1943,2,20,Feb
8444997,Garnet,Bailey,13-Jun-48,Jun-13-1948,6/13/48,6/13/48,1948,6,13,Jun
8446340,Len,Fontaine,25-Feb-48,Feb-25-1948,2/25/48,2/25/48,1948,2,25,Feb
8445445,Thommie,Bergman,10-Dec-47,Dec-10-1947,12/10/47,12/10/47,1947,12,10,Dec
8448003,Rick,Newell,18-Feb-48,Feb-18-1948,2/18/48,2/18/48,1948,2,18,Feb
8449866,Denis,DeJordy,12-Nov-38,Nov-12-1938,11/12/38,11/12/38,1938,11,12,Nov
8445862,Nelson,Debenedet,31-Dec-47,Dec-31-1947,12/31/47,12/31/47,1947,12,31,Dec
8448525,Mike,Korney,15-Sep-53,Sep-15-1953,9/15/53,9/15/53,1953,9,15,Sep
8447529,Tord,Lundstrom,4-Mar-45,Mar-4-1945,3/4/45,3/4/45,1945,3,4,Mar
8446336,Rick,Foley,22-Sep-45,Sep-22-1945,9/22/45,9/22/45,1945,9,22,Sep
8447531,Jack,Lynch,28-May-52,May-28-1952,5/28/52,5/28/52,1952,5,28,May
8447802,Al,McLeod,17-Jun-49,Jun-17-1949,6/17/49,6/17/49,1949,6,17,Jun
8447836,Tom,Mellor,27-Jan-50,Jan-27-1950,1/27/50,1/27/50,1950,1,27,Jan
8449591,Murray,Wing,14-Oct-50,Oct-14-1950,10/14/50,10/14/50,1950,10,14,Oct
8447354,Doug,Grant,27-Jul-48,Jul-27-1948,7/27/48,7/27/48,1948,7,27,Jul
8450829,Terrance,Richardson,7-May-53,May-7-1953,5/7/53,5/7/53,1953,5,7,May
8444882,Earl,Anderson,24-Feb-51,Feb-24-1951,2/24/51,2/24/51,1951,2,24,Feb
8445430,Michel,Bergeron,11-Nov-54,Nov-11-1954,11/11/54,11/11/54,1954,11,11,Nov
8445101,Mike,Bloom,12-Apr-52,Apr-12-1952,4/12/52,4/12/52,1952,4,12,Apr
8445951,Rene,Drolet,13-Nov-44,Nov-13-1944,11/13/44,11/13/44,1944,11,13,Nov
8447742,Brian,McCutcheon,3-Aug-49,Aug-3-1949,8/3/49,8/3/49,1949,8,3,Aug
8447914,Brian,Murphy,20-Aug-47,Aug-20-1947,8/20/47,8/20/47,1947,8,20,Aug
8448035,Hank,Nowak,24-Nov-50,Nov-24-1950,11/24/50,11/24/50,1950,11,24,Nov
8450495,Dennis,Polonich,4-Dec-53,Dec-4-1953,12/4/53,12/4/53,1953,12,4,Dec
8445298,Frank,Bathe,27-Sep-54,Sep-27-1954,9/27/54,9/27/54,1954,9,27,Sep
8447973,Jim,Nahrgang,17-Apr-51,Apr-17-1951,4/17/51,4/17/51,1951,4,17,Apr
8448617,Barry,Salovaara,7-Jan-48,Jan-7-1948,1/7/48,1/7/48,1948,1,7,Jan
8448731,J.P.,Leblanc,20-Oct-46,Oct-20-1946,10/20/46,10/20/46,1946,10,20,Oct
8449104,Dan,Maloney,24-Sep-50,Sep-24-1950,9/24/50,9/24/50,1950,9,24,Sep
8447600,Ken,Mann,5-Sep-53,Sep-5-1953,9/5/53,9/5/53,1953,9,5,Sep
8449373,Brian,Watts,10-Sep-47,Sep-10-1947,9/10/47,9/10/47,1947,9,10,Sep
8449600,Mike,Wong,14-Jan-55,Jan-14-1955,1/14/55,1/14/55,1955,1,14,Jan
8449979,Ed,Giacomin,6-Jun-39,Jun-6-1939,6/6/39,6/6/39,1939,6,6,Jun
8445073,Fred,Berry,26-Mar-56,Mar-26-1956,3/26/56,3/26/56,1956,3,26,Mar
8446105,Stephen,Coates,27-Jul-50,Jul-27-1950,7/27/50,7/27/50,1950,7,27,Jul
8447147,Dave,Kelly,20-Sep-52,Sep-20-1952,9/20/52,9/20/52,1952,9,20,Sep
8447353,Fern,LeBlanc,12-Jan-56,Jan-12-1956,1/12/56,1/12/56,1956,1,12,Jan
8448335,Bob,Ritchie,20-Feb-55,Feb-20-1955,2/20/55,2/20/55,1955,2,20,Feb
8451172,Kevin,Schamehorn,28-Jul-56,Jul-28-1956,7/28/56,7/28/56,1956,7,28,Jul
8452456,Fred,Williams,1-Jul-56,Jul-1-1956,7/1/56,7/1/56,1956,7,1,Jul
8448363,Greg,Joly,30-May-54,May-30-1954,5/30/54,5/30/54,1954,5,30,May
8452477,Rick,Wilson,10-Aug-50,Aug-10-1950,8/10/50,8/10/50,1950,8,10,Aug
8446967,Dennis,Hull,19-Nov-44,Nov-19-1944,11/19/44,11/19/44,1944,11,19,Nov
8449377,Dale,McCourt,26-Jan-57,Jan-26-1957,1/26/57,1/26/57,1957,1,26,Jan
8449809,Vaclav,Nedomansky,14-Mar-44,Mar-14-1944,3/14/44,3/14/44,1944,3,14,Mar
8450475,Robert,Plumb,29-Aug-57,Aug-29-1957,8/29/57,8/29/57,1957,8,29,Aug
8451741,Andre,St. Laurent,16-Feb-53,Feb-16-1953,2/16/53,2/16/53,1953,2,16,Feb
8451892,Errol,Thompson,28-May-50,May-28-1950,5/28/50,5/28/50,1950,5,28,May
8452506,Paul,Woods,12-Apr-55,Apr-12-1955,4/12/55,4/12/55,1955,4,12,Apr
8447839,John,Hilworth,23-May-57,May-23-1957,5/23/57,5/23/57,1957,5,23,May
8449626,Perry,Miller,24-Jun-52,Jun-24-1952,6/24/52,6/24/52,1952,6,24,Jun
8452196,Rick,Vasko,1-Dec-57,Dec-1-1957,12/1/57,12/1/57,1957,12,1,Dec
8445599,Dan,Bolduc,6-Apr-53,Apr-6-1953,4/6/53,4/6/53,1953,4,6,Apr
8446329,Mal,Davis,10-Oct-56,Oct-10-1956,10/10/56,10/10/56,1956,10,10,Oct
8448599,Dan,Labraaten,5-Sep-51,Sep-5-1951,9/5/51,9/5/51,1951,9,5,Sep
8451355,Steven,Short,6-Apr-54,Apr-6-1954,4/6/54,4/6/54,1954,4,6,Apr
8451387,Bjorn,Skaare,29-Oct-58,Oct-29-1958,10/29/58,10/29/58,1958,10,29,Oct
8447220,Larry,Gloekner,25-Jan-56,Jan-25-1956,1/25/56,1/25/56,1956,1,25,Jan
8448025,Willie,Huber,15-Jan-58,Jan-15-1958,1/15/58,1/15/58,1958,1,15,Jan
8451835,John,Taft,8-May-54,May-8-1954,5/8/54,5/8/54,1954,5,8,May
8452122,Rogie,Vachon,8-Sep-45,Sep-8-1945,9/8/45,9/8/45,1945,9,8,Sep
8446876,Mike,Foligno,29-Jan-59,Jan-29-1959,1/29/59,1/29/59,1959,1,29,Jan
8447800,Glenn,Hicks,28-Aug-58,Aug-28-1958,8/28/58,8/28/58,1958,8,28,Aug
8446099,Rejean,Cloutier,15-Feb-60,Feb-15-1960,2/15/60,2/15/60,1960,2,15,Feb
8445546,Mike,Blaisdell,18-Jan-60,Jan-18-1960,1/18/60,1/18/60,1960,1,18,Jan
8446996,Jody,Gage,29-Nov-59,Nov-29-1959,11/29/59,11/29/59,1959,11,29,Nov
8448503,Mark,Kirton,3-Feb-58,Feb-3-1958,2/3/58,2/3/58,1958,2,3,Feb
8450221,Joe,Paterson,25-Jun-60,Jun-25-1960,6/25/60,6/25/60,1960,6,25,Jun
8448275,Al,Jensen,27-Nov-58,Nov-27-1958,11/27/58,11/27/58,1958,11,27,Nov
8448749,Claude,Legris,11-Jun-56,Jun-11-1956,6/11/56,6/11/56,1956,6,11,Jun
8448899,Larry,Lozinski,16-Oct-58,Oct-16-1958,10/16/58,10/16/58,1958,10,16,Oct
8447062,Danny,Gare,14-May-54,May-14-1954,5/14/54,5/14/54,1954,5,14,May
8448873,Mark,Lofthouse,21-Apr-57,Apr-21-1957,4/21/57,4/21/57,1957,4,21,Apr
8449735,Don,Murdoch,25-Oct-56,Oct-25-1956,10/25/56,10/25/56,1956,10,25,Oct
8449934,Ted,Nolan,7-Apr-58,Apr-7-1958,4/7/58,4/7/58,1958,4,7,Apr
8451513,Derek,Smith,31-Jul-54,Jul-31-1954,7/31/54,7/31/54,1954,7,31,Jul
8451241,Jim,Schoenfeld,4-Sep-52,Sep-4-1952,9/4/52,9/4/52,1952,9,4,Sep
8449582,Corrado,Micalef,20-Apr-61,Apr-20-1961,4/20/61,4/20/61,1961,4,20,Apr
8451701,Greg,Stefan,11-Feb-61,Feb-11-1961,2/11/61,2/11/61,1961,2,11,Feb
8446950,Bobby,Francis,5-Dec-58,Dec-5-1958,12/5/58,12/5/58,1958,12,5,Dec
8448505,Kelly,Kisio,18-Sep-59,Sep-18-1959,9/18/59,9/18/59,1959,9,18,Sep
8451938,Larry,Trader,7-Jul-63,Jul-7-1963,7/7/63,7/7/63,1963,7,7,Jul
8446531,Ron,Duguay,6-Jul-57,Jul-6-1957,7/6/57,7/6/57,1957,7,6,Jul
8448289,Brian,Johnson,1-Apr-60,Apr-1-1960,4/1/60,4/1/60,1960,4,1,Apr
8448326,Eddie,Johnstone,2-Mar-54,Mar-2-1954,3/2/54,3/2/54,1954,3,2,Mar
8452578,Steve,Yzerman,9-May-65,May-9-1965,5/9/65,5/9/65,1965,5,9,May
8449121,Bob,Manno,31-Oct-56,Oct-31-1956,10/31/56,10/31/56,1956,10,31,Oct
8450206,Brad,Park,6-Jul-48,Jul-6-1948,7/6/48,7/6/48,1948,7,6,Jul
8449618,Eddie,Mio,31-Jan-54,Jan-31-1954,1/31/54,1/31/54,1954,1,31,Jan
8445789,Shawn,Burr,1-Jul-66,Jul-1-1966,7/1/66,7/1/66,1966,7,1,Jul
8446034,Frantisek,Cernik,3-Jun-53,Jun-3-1953,6/3/53,6/3/53,1953,6,3,Jun
8447001,Gerard,Gallant,2-Sep-63,Sep-2-1963,9/2/63,9/2/63,1963,9,2,Sep
8448519,Joey,Kocur,21-Dec-64,Dec-21-1964,12/21/64,12/21/64,1964,12,21,Dec
8451386,Darryl,Sittler,18-Sep-50,Sep-18-1950,9/18/50,9/18/50,1950,9,18,Sep
8446037,Milan,Chalupa,4-Jun-53,Jun-4-1953,6/4/53,6/4/53,1953,6,4,Jun
8452583,Rick,Zombo,8-May-63,May-8-1963,5/8/63,5/8/63,1963,5,8,May
8445983,Billy,Carroll,19-Jan-59,Jan-19-1959,1/19/59,1/19/59,1959,1,19,Jan
8446546,Bruce,Eakin,28-Sep-62,Sep-28-1962,9/28/62,9/28/62,1962,9,28,Sep
8448490,Petr,Klima,23-Dec-64,Dec-23-1964,12/23/64,12/23/64,1964,12,23,Dec
8449951,Adam,Oates,27-Aug-62,Aug-27-1962,8/27/62,8/27/62,1962,8,27,Aug
8450561,Bob,Probert,5-Jun-65,Jun-5-1965,6/5/65,6/5/65,1965,6,5,Jun
8451600,Ted,Speers,28-Jan-61,Jan-28-1961,1/28/61,1/28/61,1961,1,28,Jan
8451686,Ray,Staszak,1-Dec-62,Dec-1-1962,12/1/62,12/1/62,1962,12,1,Dec
8446972,Tim,Friday,5-Mar-61,Mar-5-1961,3/5/61,3/5/61,1961,3,5,Mar
8448762,Jim,Leavins,28-Jul-60,Jul-28-1960,7/28/60,7/28/60,1960,7,28,Jul
8449941,Mike,O'connell,25-Nov-55,Nov-25-1955,11/25/55,11/25/55,1955,11,25,Nov
8452206,Darren,Veitch,24-Apr-60,Apr-24-1960,4/24/60,4/24/60,1960,4,24,Apr
8448628,Mark,Laforest,10-Jul-62,Jul-10-1962,7/10/62,7/10/62,1962,7,10,Jul
8450626,Chris,Pusey,20-Jun-65,Jun-20-1965,6/20/65,6/20/65,1965,6,20,Jun
8448541,Dale,Krentz,19-Dec-61,Dec-19-1961,12/19/61,12/19/61,1961,12,19,Dec
8448641,Mark,Lamb,3-Aug-64,Aug-3-1964,8/3/64,8/3/64,1964,8,3,Aug
8449751,Joe,Murphy,16-Oct-67,Oct-16-1967,10/16/67,10/16/67,1967,10,16,Oct
8451255,Ric,Seiling,16-Dec-57,Dec-16-1957,12/16/57,12/16/57,1957,12,16,Dec
8447481,Doug,Halward,1-Nov-55,Nov-1-1955,11/1/55,11/1/55,1955,11,1,Nov
8451329,Jeff,Sharples,28-Jul-67,Jul-28-1967,7/28/67,7/28/67,1967,7,28,Jul
8447505,Glen,Hanlon,20-Feb-57,Feb-20-1957,2/20/57,2/20/57,1957,2,20,Feb
8446029,John,Chabot,18-May-62,May-18-1962,5/18/62,5/18/62,1962,5,18,May
8446791,Brent,Fedyk,8-Mar-67,Mar-8-1967,3/8/67,3/8/67,1967,3,8,Mar
8447364,Adam,Graves,12-Apr-68,Apr-12-1968,4/12/68,4/12/68,1968,4,12,Apr
8446637,Darren,Eliot,26-Nov-61,Nov-26-1961,11/26/61,11/26/61,1961,11,26,Nov
8448123,Miroslav,Ihnacak,19-Feb-62,Feb-19-1962,2/19/62,2/19/62,1962,2,19,Feb
8445559,John,Blum,8-Oct-59,Oct-8-1959,10/8/59,10/8/59,1959,10,8,Oct
8449663,John,Mokosak,7-Sep-63,Sep-7-1963,9/7/63,9/7/63,1963,9,7,Sep
8446803,Bernie,Federko,12-May-56,May-12-1956,5/12/56,5/12/56,1956,5,12,May
8448455,Sheldon,Kennedy,15-Jun-69,Jun-15-1969,6/15/69,6/15/69,1969,6,15,Jun
8449462,Chris,Mcrae,25-Aug-65,Aug-25-1965,8/25/65,8/25/65,1965,8,25,Aug
8446418,Peter,Dineen,14-Jun-60,Jun-14-1960,6/14/60,6/14/60,1960,6,14,Jun
8449723,Dean,Morton,12-Jul-68,Jul-12-1968,7/12/68,7/12/68,1968,7,12,Jul
8450658,Yves,Racine,7-Feb-69,Feb-7-1969,2/7/69,2/7/69,1969,2,7,Feb
8451102,Borje,Salming,17-Apr-51,Apr-17-1951,4/17/51,4/17/51,1951,4,17,Apr
8445489,Tom,Bissett,13-Mar-66,Mar-13-1966,3/13/66,3/13/66,1966,3,13,Mar
8446788,Sergei,Fedorov,13-Dec-69,Dec-13-1969,12/13/69,12/13/69,1969,12,13,Dec
8448499,Scott,King,25-Jun-67,Jun-25-1967,6/25/67,6/25/67,1967,6,25,Jun
8449399,William,Mcdougall,10-Aug-66,Aug-10-1966,8/10/66,8/10/66,1966,8,10,Aug
8449607,Kevin,Miller,2-Sep-65,Sep-2-1965,9/2/65,9/2/65,1965,9,2,Sep
8458020,Gary,Shuchuk,17-Feb-67,Feb-17-1967,2/17/67,2/17/67,1967,2,17,Feb
8451359,Mike,Sillinger,29-Jun-71,Jun-29-1971,6/29/71,6/29/71,1971,6,29,Jun
8452148,Dennis,Vial,10-Apr-69,Apr-10-1969,4/10/69,4/10/69,1969,4,10,Apr
8446455,Per,Djoos,11-May-68,May-11-1968,5/11/68,5/11/68,1968,5,11,May
8447402,Rick,Green,20-Feb-56,Feb-20-1956,2/20/56,2/20/56,1956,2,20,Feb
8448482,Gordon,Kruppke,2-Apr-69,Apr-2-1969,4/2/69,4/2/69,1969,4,2,Apr
8448675,Chris,Luongo,17-Mar-67,Mar-17-1967,3/17/67,3/17/67,1967,3,17,Mar
8452444,Bob,Wilkie,11-Feb-69,Feb-11-1969,2/11/69,2/11/69,1969,2,11,Feb
8445458,Allan,Bester,26-Mar-64,Mar-26-1964,3/26/64,3/26/64,1964,3,26,Mar
8447005,David,Gagnon,31-Oct-67,Oct-31-1967,10/31/67,10/31/67,1967,10,31,Oct
8455984,Jim,Cummins,15-May-70,May-15-1970,5/15/70,5/15/70,1970,5,15,May
8458524,Martin,Lapointe,12-Sep-73,Sep-12-1973,9/12/73,9/12/73,1973,9,12,Sep
8451343,Ray,Sheppard,27-May-66,May-27-1966,5/27/66,5/27/66,1966,5,27,May
8456870,Vladimir,Konstantinov,19-Mar-67,Mar-19-1967,3/19/67,3/19/67,1967,3,19,Mar
8457063,Nicklas,Lidstrom,28-Apr-70,Apr-28-1970,4/28/70,4/28/70,1970,4,28,Apr
8450834,Vincent,Riendeau,20-Apr-66,Apr-20-1966,4/20/66,4/20/66,1966,4,20,Apr
8456597,Jim,Hiller,13-May-69,May-13-1969,5/13/69,5/13/69,1969,5,13,May
8458468,Jason,York,20-May-70,May-20-1970,5/20/70,5/20/70,1970,5,20,May
8455408,Micah,Aivazoff,4-May-69,May-4-1969,5/4/69,5/4/69,1969,5,4,May
8456734,Greg,Johnson,16-Mar-71,Mar-16-1971,3/16/71,3/16/71,1971,3,16,Mar
8458982,Darren,McCarty,1-Apr-72,Apr-1-1972,4/1/72,4/1/72,1972,4,1,Apr
8450269,Mark,Pederson,14-Jan-68,Jan-14-1968,1/14/68,1/14/68,1968,1,14,Jan
8458192,Tim,Taylor,6-Feb-69,Feb-6-1969,2/6/69,2/6/69,1969,2,6,Feb
8447458,Bob,Halkidis,5-Mar-66,Mar-5-1966,3/5/66,3/5/66,1966,3,5,Mar
8458519,Aaron,Ward,17-Jan-73,Jan-17-1973,1/17/73,1/17/73,1973,1,17,Jan
8448142,Peter,Ing,28-Apr-69,Apr-28-1969,4/28/69,4/28/69,1969,4,28,Apr
8458568,Chris,Osgood,26-Nov-72,Nov-26-1972,11/26/72,11/26/72,1972,11,26,Nov
8446715,Bob,Errey,21-Sep-64,Sep-21-1964,9/21/64,9/21/64,1964,9,21,Sep
8448566,Mike,Krushelnyski,27-Apr-60,Apr-27-1960,4/27/60,4/27/60,1960,4,27,Apr
8457318,Andrew,Mckim,6-Jul-70,Jul-6-1970,7/6/70,7/6/70,1970,7,6,Jul
8446792,Mark,Ferner,5-Sep-65,Sep-5-1965,9/5/65,9/5/65,1965,9,5,Sep
8450645,Mike,Ramsey,3-Dec-60,Dec-3-1960,12/3/60,12/3/60,1960,12,3,Dec
8452217,Mike,Vernon,24-Feb-63,Feb-24-1963,2/24/63,2/24/63,1963,2,24,Feb
8460540,Mathieu,Dandenault,3-Feb-76,Feb-3-1976,2/3/76,2/3/76,1976,2,3,Feb
8459001,Kirk,Maltby,22-Dec-72,Dec-22-1972,12/22/72,12/22/72,1972,12,22,Dec
8452285,Wes,Walz,15-May-70,May-15-1970,5/15/70,5/15/70,1970,5,15,May
8459443,Anders,Eriksson,9-Jan-75,Jan-9-1975,1/9/75,1/9/75,1975,1,9,Jan
8458546,Jamie,Pushor,11-Feb-73,Feb-11-1973,2/11/73,2/11/73,1973,2,11,Feb
8459357,Kevin,Hodson,27-Mar-72,Mar-27-1972,3/27/72,3/27/72,1972,3,27,Mar
8460743,Tomas,Holmstrom,23-Jan-73,Jan-23-1973,1/23/73,1/23/73,1973,1,23,Jan
8458590,Mike,Knuble,4-Jul-72,Jul-4-1972,7/4/72,7/4/72,1972,7,4,Jul
8457186,Mark,Major,20-Mar-70,Mar-20-1970,3/20/70,3/20/70,1970,3,20,Mar
8451122,Tomas,Sandstrom,4-Sep-64,Sep-4-1964,9/4/64,9/4/64,1964,9,4,Sep
8462087,Darryl,Laplante,28-Mar-77,Mar-28-1977,3/28/77,3/28/77,1977,3,28,Mar
8460513,Yan,Golubovsky,9-Mar-76,Mar-9-1976,3/9/76,3/9/76,1976,3,9,Mar
8449009,Jamie,Macoun,17-Aug-61,Aug-17-1961,8/17/61,8/17/61,1961,8,17,Aug
8458672,Dmitri,Mironov,25-Dec-65,Dec-25-1965,12/25/65,12/25/65,1965,12,25,Dec
8462080,Philippe,Audet,4-Jun-77,Jun-4-1977,6/4/77,6/4/77,1977,6,4,Jun
8460061,Stacy,Roest,15-Mar-74,Mar-15-1974,3/15/74,3/15/74,1974,3,15,Mar
8447187,Todd,Gill,9-Nov-65,Nov-9-1965,11/9/65,11/9/65,1965,11,9,Nov
8450651,Bill,Ranford,14-Dec-66,Dec-14-1966,12/14/66,12/14/66,1966,12,14,Dec
8459298,Marc,Rodgers,16-Mar-72,Mar-16-1972,3/16/72,3/16/72,1972,3,16,Mar
8466286,B.J.,Young,23-Jul-77,Jul-23-1977,7/23/77,7/23/77,1977,7,23,Jul
8467349,Jiri,Fischer,31-Jul-80,Jul-31-1980,7/31/80,7/31/80,1980,7,31,Jul
8464976,Jesse,Wallin,10-Mar-78,Mar-10-1978,3/10/78,3/10/78,1978,3,10,Mar
8459308,Manny,Legace,4-Feb-73,Feb-4-1973,2/4/73,2/4/73,1973,2,4,Feb
8452535,Ken,Wregget,25-Mar-64,Mar-25-1964,3/25/64,3/25/64,1964,3,25,Mar
8464960,Boyd,Devereaux,16-Apr-78,Apr-16-1978,4/16/78,4/16/78,1978,4,16,Apr
8462056,Maxim,Kuznetsov,24-Mar-77,Mar-24-1977,3/24/77,3/24/77,1977,3,24,Mar
8468224,Sean,Avery,10-Apr-80,Apr-10-1980,4/10/80,4/10/80,1980,4,10,Apr
8467514,Pavel,Datsyuk,20-Jul-78,Jul-20-1978,7/20/78,7/20/78,1978,7,20,Jul
8448091,Brett,Hull,9-Aug-64,Aug-9-1964,8/9/64,8/9/64,1964,8,9,Aug
8450941,Luc,Robitaille,17-Feb-66,Feb-17-1966,2/17/66,2/17/66,1966,2,17,Feb
8447687,Dominik,Hasek,29-Jan-65,Jan-29-1965,1/29/65,1/29/65,1965,1,29,Jan
8468083,Henrik,Zetterberg,9-Oct-80,Oct-9-1980,10/9/80,10/9/80,1980,10,9,Oct
8459490,Patrick,Boileau,22-Feb-75,Feb-22-1975,2/22/75,2/22/75,1975,2,22,Feb
8469701,Dmitri,Bykov,5-May-77,May-5-1977,5/5/77,5/5/77,1977,5,5,May
8458454,Jason,Woolley,27-Jul-69,Jul-27-1969,7/27/69,7/27/69,1969,7,27,Jul
8448382,Curtis,Joseph,29-Apr-67,Apr-29-1967,4/29/67,4/29/67,1967,4,29,Apr
8467381,Ryan,Barnes,30-Jan-80,Jan-30-1980,1/30/80,1/30/80,1980,1,30,Jan
8468732,Darryl,Bootland,2-Nov-81,Nov-2-1981,11/2/81,11/2/81,1981,11,2,Nov
8470201,Jiri,Hudler,4-Jan-84,Jan-4-1984,1/4/84,1/4/84,1984,1,4,Jan
8456966,Robert,Lang,19-Dec-70,Dec-19-1970,12/19/70,12/19/70,1970,12,19,Dec
8467323,Mark,Mowers,16-Feb-74,Feb-16-1974,2/16/74,2/16/74,1974,2,16,Feb
8470418,Nathan,Robinson,31-Dec-81,Dec-31-1981,12/31/81,12/31/81,1981,12,31,Dec
8458537,Ray,Whitney,8-May-72,May-8-1972,5/8/72,5/8/72,1972,5,8,May
8468509,Niklas,Kronwall,12-Jan-81,Jan-12-1981,1/12/81,1/12/81,1981,1,12,Jan
8459550,Anders,Myrvold,12-Aug-75,Aug-12-1975,8/12/75,8/12/75,1975,8,12,Aug
8459484,Jamie,Rivers,16-Mar-75,Mar-16-1975,3/16/75,3/16/75,1975,3,16,Mar
8459028,Marc,Lamothe,27-Feb-74,Feb-27-1974,2/27/74,2/27/74,1974,2,27,Feb
8466149,Daniel,Cleary,18-Dec-78,Dec-18-1978,12/18/78,12/18/78,1978,12,18,Dec
8470047,Valtteri,Filppula,20-Mar-84,Mar-20-1984,3/20/84,3/20/84,1984,3,20,Mar
8471309,Johan,Franzen,23-Dec-79,Dec-23-1979,12/23/79,12/23/79,1979,12,23,Dec
8468518,Tomas,Kopecky,5-Feb-82,Feb-5-1982,2/5/82,2/5/82,1982,2,5,Feb
8462062,Donald,MacLean,14-Jan-77,Jan-14-1977,1/14/77,1/14/77,1977,1,14,Jan
8467463,Mikael,Samuelsson,23-Dec-76,Dec-23-1976,12/23/76,12/23/76,1976,12,23,Dec
8458929,Cory,Cross,3-Jan-71,Jan-3-1971,1/3/71,1/3/71,1971,1,3,Jan
8471187,Brett,Lebda,15-Jan-82,Jan-15-1982,1/15/82,1/15/82,1982,1,15,Jan
8468534,Andreas,Lilja,13-Jul-75,Jul-13-1975,7/13/75,7/13/75,1975,7,13,Jul
8470657,Jimmy,Howard,26-Mar-84,Mar-26-1984,3/26/84,3/26/84,1984,3,26,Mar
8459444,Todd,Bertuzzi,2-Feb-75,Feb-2-1975,2/2/75,2/2/75,1975,2,2,Feb
8466260,Kyle,Calder,5-Jan-79,Jan-5-1979,1/5/79,1/5/79,1979,1,5,Jan
8470018,Matt,Ellis,31-Aug-81,Aug-31-1981,8/31/81,8/31/81,1981,8,31,Aug
8467564,Matt,Hussey,28-May-79,May-28-1979,5/28/79,5/28/79,1979,5,28,May
8466200,Josh,Langfeld,17-Jul-77,Jul-17-1977,7/17/77,7/17/77,1977,7,17,Jul
8462258,Danny,Markov,30-Jul-76,Jul-30-1976,7/30/76,7/30/76,1976,7,30,Jul
8470061,Derek,Meech,21-Apr-84,Apr-21-1984,4/21/84,4/21/84,1984,4,21,Apr
8459636,Brad,Norton,13-Feb-75,Feb-13-1975,2/13/75,2/13/75,1975,2,13,Feb
8469732,Joey,MacDonald,7-Feb-80,Feb-7-1980,2/7/80,2/7/80,1980,2,7,Feb
8471716,Justin,Abdelkader,25-Feb-87,Feb-25-1987,2/25/87,2/25/87,1987,2,25,Feb
8465992,Aaron,Downey,27-Aug-74,Aug-27-1974,8/27/74,8/27/74,1974,8,27,Aug
8471794,Darren,Helm,21-Jan-87,Jan-21-1987,1/21/87,1/21/87,1987,1,21,Jan
8471668,Mattias,Ritola,14-Mar-87,Mar-14-1987,3/14/87,3/14/87,1987,3,14,Mar
8470318,Jonathan,Ericsson,2-Mar-84,Mar-2-1984,3/2/84,3/2/84,1984,3,2,Mar
8471011,Garrett,Stafford,28-Jan-80,Jan-28-1980,1/28/80,1/28/80,1980,1,28,Jan
8467331,Brad,Stuart,6-Nov-79,Nov-6-1979,11/6/79,11/6/79,1979,11,6,Nov
8474551,Ville,Leino,6-Oct-83,Oct-6-1983,10/6/83,10/6/83,1983,10,6,Oct
8469152,Ty,Conklin,30-Mar-76,Mar-30-1976,3/30/76,3/30/76,1976,3,30,Mar
8470622,Patrick,Eaves,1-May-84,May-1-1984,5/1/84,5/1/84,1984,5,1,May
8457261,Brad,May,29-Nov-71,Nov-29-1971,11/29/71,11/29/71,1971,11,29,Nov
8470778,Drew,Miller,17-Feb-84,Feb-17-1984,2/17/84,2/17/84,1984,2,17,Feb
8470232,Kris,Newbury,19-Feb-82,Feb-19-1982,2/19/82,2/19/82,1982,2,19,Feb
8467928,Doug,Janik,26-Mar-80,Mar-26-1980,3/26/80,3/26/80,1980,3,26,Mar
8471693,Jakub,Kindl,10-Feb-87,Feb-10-1987,2/10/87,2/10/87,1987,2,10,Feb
8473558,Cory,Emmerton,1-Jun-88,Jun-1-1988,6/1/88,6/1/88,1988,6,1,Jun
8473569,Jan,Mursak,20-Jan-88,Jan-20-1988,1/20/88,1/20/88,1988,1,20,Jan
8464962,Ruslan,Salei,2-Nov-74,Nov-2-1974,11/2/74,11/2/74,1974,11,2,Nov
8474591,Tom,McCollum,7-Dec-89,Dec-7-1989,12/7/89,12/7/89,1989,12,7,Dec
8474168,Joakim,Andersson,5-Feb-89,Feb-5-1989,2/5/89,2/5/89,1989,2,5,Feb
8474552,Fabian,Brunnstrom,6-Feb-85,Feb-6-1985,2/6/85,2/6/85,1985,2,6,Feb
8472368,Chris,Conner,23-Dec-83,Dec-23-1983,12/23/83,12/23/83,1983,12,23,Dec
8474679,Gustav,Nyquist,1-Sep-89,Sep-1-1989,9/1/89,9/1/89,1989,9,1,Sep
8475772,Riley,Sheahan,7-Dec-91,Dec-7-1991,12/7/91,12/7/91,1991,12,7,Dec
8470273,Ian,White,4-Jun-84,Jun-4-1984,6/4/84,6/4/84,1984,6,4,Jun
8469470,Carlo,Colaiacovo,27-Jan-83,Jan-27-1983,1/27/83,1/27/83,1983,1,27,Jan
8477215,Danny,DeKeyser,7-Mar-90,Mar-7-1990,3/7/90,3/7/90,1990,3,7,Mar
8467478,Kent,Huskins,4-May-79,May-4-1979,5/4/79,5/4/79,1979,5,4,May
8474873,Brian,Lashoff,16-Jul-90,Jul-16-1990,7/16/90,7/16/90,1990,7,16,Jul
8475361,Jonas,Gustavsson,24-Oct-84,Oct-24-1984,10/24/84,10/24/84,1984,10,24,Oct
8475852,Petr,Mrazek,14-Feb-92,Feb-14-1992,2/14/92,2/14/92,1992,2,14,Feb
8460621,Daniel,Alfredsson,11-Dec-72,Dec-11-1972,12/11/72,12/11/72,1972,12,11,Dec
8475296,Mitch,Callahan,17-Aug-91,Aug-17-1991,8/17/91,8/17/91,1991,8,17,Aug
8475157,Landon,Ferraro,8-Aug-91,Aug-8-1991,8/8/91,8/8/91,1991,8,8,Aug
8476822,Luke,Glendening,28-Apr-89,Apr-28-1989,4/28/89,4/28/89,1989,4,28,Apr
8476430,Tomas,Jurco,28-Dec-92,Dec-28-1992,12/28/92,12/28/92,1992,12,28,Dec
8467330,David,Legwand,17-Aug-80,Aug-17-1980,8/17/80,8/17/80,1980,8,17,Aug
8475800,Teemu,Pulkkinen,2-Jan-92,Jan-2-1992,1/2/92,1/2/92,1992,1,2,Jan
8469457,Stephen,Weiss,3-Apr-83,Apr-3-1983,4/3/83,4/3/83,1983,4,3,Apr
8475332,Adam,Almquist,27-Feb-91,Feb-27-1991,2/27/91,2/27/91,1991,2,27,Feb
8476289,Alexey,Marchenko,2-Jan-92,Jan-2-1992,1/2/92,1/2/92,1992,1,2,Jan
8476443,Xavier,Ouellet,29-Jul-93,Jul-29-1993,7/29/93,7/29/93,1993,7,29,Jul
8476450,Ryan,Sproul,13-Jan-93,Jan-13-1993,1/13/93,1/13/93,1993,1,13,Jan
8467396,Erik,Cole,6-Nov-78,Nov-6-1978,11/6/78,11/6/78,1978,11,6,Nov
8475250,Andrej,Nestrasil,22-Feb-91,Feb-22-1991,2/22/91,2/22/91,1991,2,22,Feb
8476960,Andreas,Athanasiou,6-Aug-94,Aug-6-1994,8/6/94,8/6/94,1994,8,6,Aug
8477946,Dylan,Larkin,30-Jul-96,Jul-30-1996,7/30/96,7/30/96,1996,7,30,Jul
8477511,Anthony,Mantha,16-Sep-94,Sep-16-1994,9/16/94,9/16/94,1994,9,16,Sep
8467389,Brad,Richards,2-May-80,May-2-1980,5/2/80,5/2/80,1980,5,2,May
8471242,Mike,Green,12-Oct-85,Oct-12-1985,10/12/85,10/12/85,1985,10,12,Oct
8477479,Tyler,Bertuzzi,24-Feb-95,Feb-24-1995,2/24/95,2/24/95,1995,2,24,Feb
8478371,Matt,Lorito,3-Jul-90,Jul-3-1990,7/3/90,7/3/90,1990,7,3,Jul
8470144,Frans,Nielsen,24-Apr-84,Apr-24-1984,4/24/84,4/24/84,1984,4,24,Apr
8468505,Steve,Ott,19-Aug-82,Aug-19-1982,8/19/82,8/19/82,1982,8,19,Aug
8478431,Evgeny,Svechnikov,31-Oct-96,Oct-31-1996,10/31/96,10/31/96,1996,10,31,Oct
8470598,Thomas,Vanek,19-Jan-84,Jan-19-1984,1/19/84,1/19/84,1984,1,19,Jan
8475324,Nick,Jensen,21-Sep-90,Sep-21-1990,9/21/90,9/21/90,1990,9,21,Sep
8479252,Dan,Renouf,1-Jun-94,Jun-1-1994,6/1/94,6/1/94,1994,6,1,Jun
8476418,Robbie,Russo,15-Feb-93,Feb-15-1993,2/15/93,2/15/93,1993,2,15,Feb
8477225,Jared,Coreau,5-Nov-91,Nov-5-1991,11/5/91,11/5/91,1991,11,5,Nov
8471266,David,Booth,24-Nov-84,Nov-24-1984,11/24/84,11/24/84,1984,11,24,Nov
8476924,Martin,Frk,5-Oct-93,Oct-5-1993,10/5/93,10/5/93,1993,10,5,Oct
8477994,Dominic,Turgeon,25-Feb-96,Feb-25-1996,2/25/96,2/25/96,1996,2,25,Feb
8476293,Scott,Wilson,24-Apr-92,Apr-24-1992,4/24/92,4/24/92,1992,4,24,Apr
8470110,Trevor,Daley,9-Oct-83,Oct-9-1983,10/9/83,10/9/83,1983,10,9,Oct
8478176,Joe,Hicketts,4-May-96,May-4-1996,5/4/96,5/4/96,1996,5,4,May
8474722,Luke,Witkowski,14-Apr-90,Apr-14-1990,4/14/90,4/14/90,1990,4,14,Apr
8478036,Christoffer,Ehn,5-Apr-96,Apr-5-1996,4/5/96,4/5/96,1996,4,5,Apr
8481433,Taro,Hirose,30-Jun-96,Jun-30-1996,6/30/96,6/30/96,1996,6,30,Jun
8481426,Ryan,Kuffner,12-Jun-96,Jun-12-1996,6/12/96,6/12/96,1996,6,12,Jun
8475263,Wade,Megan,22-Jul-90,Jul-22-1990,7/22/90,7/22/90,1990,7,22,Jul
8476477,Matt,Puempel,24-Jan-93,Jan-24-1993,1/24/93,1/24/93,1993,1,24,Jan
8479992,Michael,Rasmussen,17-Apr-99,Apr-17-1999,4/17/99,4/17/99,1999,4,17,Apr
8480821,Filip,Zadina,27-Nov-99,Nov-27-1999,11/27/99,11/27/99,1999,11,27,Nov
8477455,Jacob,de la Rose,20-May-95,May-20-1995,5/20/95,5/20/95,1995,5,20,May
8477474,Madison,Bowey,22-Apr-95,Apr-22-1995,4/22/95,4/22/95,1995,4,22,Apr
8477865,Jake,Chelios,8-Mar-91,Mar-8-1991,3/8/91,3/8/91,1991,3,8,Mar
8479395,Dennis,Cholowski,15-Feb-98,Feb-15-1998,2/15/98,2/15/98,1998,2,15,Feb
8479425,Filip,Hronek,2-Nov-97,Nov-2-1997,11/2/97,11/2/97,1997,11,2,Nov
8475795,Dylan,McIlrath,20-Apr-92,Apr-20-1992,4/20/92,4/20/92,1992,4,20,Apr
8480161,Libor,Sulak,4-Mar-94,Mar-4-1994,3/4/94,3/4/94,1994,3,4,Mar
8480363,Kaden,Fulcher,23-Sep-98,Sep-23-1998,9/23/98,9/23/98,1998,9,23,Sep
8477454,Adam,Erne,20-Apr-95,Apr-20-1995,4/20/95,4/20/95,1995,4,20,Apr
8477952,Robby,Fabbri,22-Jan-96,Jan-22-1996,1/22/96,1/22/96,1996,1,22,Jan
8474040,Sam,Gagner,10-Aug-89,Aug-10-1989,8/10/89,8/10/89,1989,8,10,Aug
8477943,Brendan,Perlini,27-Apr-96,Apr-27-1996,4/27/96,4/27/96,1996,4,27,Apr
8479379,Givani,Smith,27-Feb-98,Feb-27-1998,2/27/98,2/27/98,1998,2,27,Feb
8478857,Dmytro,Timashov,1-Oct-96,Oct-1-1996,10/1/96,10/1/96,1996,10,1,Oct
8473415,Alex,Biega,4-Apr-88,Apr-4-1988,4/4/88,4/4/88,1988,4,4,Apr
8474597,Cody,Goloubef,30-Nov-89,Nov-30-1989,11/30/89,11/30/89,1989,11,30,Nov
8480184,Gustav,Lindstrm,20-Oct-98,Oct-20-1998,10/20/98,10/20/98,1998,10,20,Oct
8475747,Patrik,Nemeth,8-Feb-92,Feb-8-1992,2/8/92,2/8/92,1992,2,8,Feb
8475717,Calvin,Pickard,15-Apr-92,Apr-15-1992,4/15/92,4/15/92,1992,4,15,Apr
8482240,Mathias ,Brome,29-Jul-94,Jul-29-1994,7/29/94,7/29/94,1994,7,29,Jul
8476480,Vladislav,Namestnikov,22-Nov-92,Nov-22-1992,11/22/92,11/22/92,1992,11,22,Nov
8475209,Richard,Panik,7-Feb-91,Feb-7-1991,2/7/91,2/7/91,1991,2,7,Feb
8471676,Bobby,Ryan,17-Mar-87,Mar-17-1987,3/17/87,3/17/87,1987,3,17,Mar
8480813,Joe,Veleno,13-Jan-00,Jan-13-2000,1/13/00,1/13/00,2000,1,13,Jan
8477944,Jakub,Vrana,28-Feb-96,Feb-28-1996,2/28/96,2/28/96,1996,2,28,Feb
8477043,Christian,Djoos,6-Aug-94,Aug-6-1994,8/6/94,8/6/94,1994,8,6,Aug
8471686,Marc,Staal,13-Jan-87,Jan-13-1987,1/13/87,1/13/87,1987,1,13,Jan
8479442,Troy,Stecher,7-Apr-94,Apr-7-1994,4/7/94,4/7/94,1994,4,7,Apr
8471306,Thomas,Greiss,29-Jan-86,Jan-29-1986,1/29/86,1/29/86,1986,1,29,Jan
8477003,Riley,Barber,7-Feb-94,Feb-7-1994,2/7/94,2/7/94,1994,2,7,Feb
8479304,Kyle,Criscuolo,5-May-92,May-5-1992,5/5/92,5/5/92,1992,5,5,May
8476505,Turner,Elson,13-Sep-92,Sep-13-1992,9/13/92,9/13/92,1992,9,13,Sep
8478486,Chase,Pearson,23-Aug-97,Aug-23-1997,8/23/97,8/23/97,1997,8,23,Aug
8482078,Lucas,Raymond,28-Mar-02,Mar-28-2002,3/28/02,3/28/02,2002,3,28,Mar
8477240,Carter,Rowney,10-May-89,May-10-1989,5/10/89,5/10/89,1989,5,10,May
8476966,Gemel,Smith,16-Apr-94,Apr-16-1994,4/16/94,4/16/94,1994,4,16,Apr
8478477,Mitchell,Stephens,5-Feb-97,Feb-5-1997,2/5/97,2/5/97,1997,2,5,Feb
8476897,Oskar,Sundqvist,23-Mar-94,Mar-23-1994,3/23/94,3/23/94,1994,3,23,Mar
8480459,Pius,Suter,24-May-96,May-24-1996,5/24/96,5/24/96,1996,5,24,May
8479355,Olli,Juolevi,5-May-98,May-5-1998,5/5/98,5/5/98,1998,5,5,May
8475181,Nick,Leddy,20-Mar-91,Mar-20-1991,3/20/91,3/20/91,1991,3,20,Mar
8477851,Jordan,Oesterle,25-Jun-92,Jun-25-1992,6/25/92,6/25/92,1992,6,25,Jun
8481542,Moritz,Seider,6-Apr-01,Apr-6-2001,4/6/01,4/6/01,2001,4,6,Apr
8478013,Jake,Walman,20-Feb-96,Feb-20-1996,2/20/96,2/20/96,1996,2,20,Feb
8476433,Magnus,Hellberg,4-Apr-91,Apr-4-1991,4/4/91,4/4/91,1991,4,4,Apr
8477968,Alex,Nedeljkovic,7-Jan-96,Jan-7-1996,1/7/96,1/7/96,1996,1,7,Jan
8481013,Jonatan,Berggren,16-Jul-00,Jul-16-2000,7/16/00,7/16/00,2000,7,16,Jul
8475163,Alex,Chiasson,1-Oct-90,Oct-1-1990,10/1/90,10/1/90,1990,10,1,Oct
8477429,Andrew,Copp,8-Jul-94,Jul-8-1994,7/8/94,7/8/94,1994,7,8,Jul
8478512,Austin,Czarnik,12-Dec-92,Dec-12-1992,12/12/92,12/12/92,1992,12,12,Dec
8483464,Marco,Kasper,8-Apr-04,Apr-8-2004,4/8/04,4/8/04,2004,4,8,Apr
8477330,Dominik,Kubalik,21-Aug-95,Aug-21-1995,8/21/95,8/21/95,1995,8,21,Aug
8479644,Matt,Luff,5-May-97,May-5-1997,5/5/97,5/5/97,1997,5,5,May
8474102,David,Perron,28-May-88,May-28-1988,5/28/88,5/28/88,1988,5,28,May
8481725,Elmer,Soderblom,5-Jul-01,Jul-5-2001,7/5/01,7/5/01,2001,7,5,Jul
8475279,Ben,Chiarot,9-May-91,May-9-1991,5/9/91,5/9/91,1991,5,9,May
8482762,Simon,Edvinsson,5-Feb-03,Feb-5-2003,2/5/03,2/5/03,2003,2,5,Feb
8477462,Robert,Hagg,8-Feb-95,Feb-8-1995,2/8/95,2/8/95,1995,2,8,Feb
8476874,Olli,Maatta,22-Aug-94,Aug-22-1994,8/22/94,8/22/94,1994,8,22,Aug
8478024,Ville,Husso,6-Feb-95,Feb-6-1995,2/6/95,2/6/95,1995,2,6,Feb
8479944,Zach,Aston-Reese,10-Aug-94,Aug-10-1994,8/10/94,8/10/94,1994,8,10,Aug
8477456,J.T.,Compher,8-Apr-95,Apr-8-1995,4/8/95,4/8/95,1995,4,8,Apr
8479337,Alex,DeBrincat,18-Dec-97,Dec-18-1997,12/18/97,12/18/97,1997,12,18,Dec
8478432,Christian,Fischer,15-Apr-97,Apr-15-1997,4/15/97,4/15/97,1997,4,15,Apr
8474141,Patrick,Kane,19-Nov-88,Nov-19-1988,11/19/88,11/19/88,1988,11,19,Nov
8480011,Klim,Kostin,5-May-99,May-5-1999,5/5/99,5/5/99,1999,5,5,May
8478466,Daniel,Sprong,17-Mar-97,Mar-17-1997,3/17/97,3/17/97,1997,3,17,Mar
8476906,Shayne,Gostisbehere,20-Apr-93,Apr-20-1993,4/20/93,4/20/93,1993,4,20,Apr
8475718,Justin,Holl,30-Jan-92,Jan-30-1992,1/30/92,1/30/92,1992,1,30,Jan
8473507,Jeff,Petry,9-Dec-87,Dec-9-1987,12/9/87,12/9/87,1987,12,9,Dec
8479312,Alex,Lyon,9-Dec-92,Dec-9-1992,12/9/92,12/9/92,1992,12,9,Dec
8473503,James,Reimer,15-Mar-88,Mar-15-1988,3/15/88,3/15/88,1988,3,15,Mar
8446716,Smokey,Harris,11-Oct-1890,Oct-11-1890,10/11/1890,1890-10-11,1890,10,11,Oct
8445743,John,Ingram,19-Dec-1893,Dec-19-1893,12/19/1893,1893-12-19,1893,12,19,Dec
8447876,Herb,Mitchell,4-Jan-1896,Jan-4-1896,1/4/1896,1896-01-04,1896,1,4,Jan
8447890,Bernie,Morris,21-Aug-1890,Aug-21-1890,8/21/1890,1890-08-21,1890,8,21,Aug
8448297,George,Redding,6-Mar-03,Mar-6-1903,3/6/03,3/6/03,1903,3,6,Mar
8448584,Bobby,Rowe,19-Aug-1885,Aug-19-1885,8/19/1885,1885-08-19,1885,8,19,Aug
8448934,Werner,Schnarr,23-Mar-03,Mar-23-1903,3/23/03,3/23/03,1903,3,23,Mar
8449129,Emory,Sparrow,15-Sep-1898,Sep-15-1898,9/15/1898,1898-09-15,1898,9,15,Sep
8445061,Bobby,Benson,18-May-1894,May-18-1894,5/18/1894,1894-05-18,1894,5,18,May
8445536,Lloyd,Cook,21-Mar-1890,Mar-21-1890,3/21/1890,1890-03-21,1890,3,21,Mar
8446755,Fern,Headley,2-Mar-01,Mar-2-1901,3/2/01,3/2/01,1901,3,2,Mar
8449920,Hec,Fowler,14-Oct-1892,Oct-14-1892,10/14/1892,1892-10-14,1892,10,14,Oct
8450120,Charles,Stewart,13-Nov-1895,Nov-13-1895,11/13/1895,1895-11-13,1895,11,13,Nov
8445068,Fred,Bergdinon,22-Jun-06,Jun-22-1906,6/22/06,6/22/06,1906,6,22,Jun
8445152,John,Brackenborough,9-Feb-1897,Feb-9-1897,2/9/1897,1897-02-09,1897,2,9,Feb
8445306,Charles,Cahill,4-Jan-04,Jan-4-1904,1/4/04,1/4/04,1904,1,4,Jan
8446703,Hago,Harrington,13-Aug-04,Aug-13-1904,8/13/04,8/13/04,1904,8,13,Aug
8447329,Bonner,Larose,14-Feb-01,Feb-14-1901,2/14/01,2/14/01,1901,2,14,Feb
8450150,Hal,Winkler,20-Mar-1892,Mar-20-1892,3/20/1892,1892-03-20,1892,3,20,Mar
8445474,Dit,Clapper,9-Feb-07,Feb-9-1907,2/9/07,2/9/07,1907,2,9,Feb
8445488,Nobby,Clark,18-Jun-1897,Jun-18-1897,6/18/1897,1897-06-18,1897,6,18,Jun
8447337,Martin,Lauder,26-Jan-07,Jan-26-1907,1/26/07,1/26/07,1907,1,26,Jan
8448429,Eddie,Rodden,22-Mar-01,Mar-22-1901,3/22/01,3/22/01,1901,3,22,Mar
8447318,Myles,Lane,2-Oct-05,Oct-2-1905,10/2/05,10/2/05,1905,10,2,Oct
8448078,George,Owen,12-Feb-01,Feb-12-1901,2/12/01,2/12/01,1901,2,12,Feb
8449218,Bob,Taylor,12-Aug-04,Aug-12-1904,8/12/04,8/12/04,1904,8,12,Aug
8444850,Henry,Harris,28-Apr-06,Apr-28-1906,4/28/06,4/28/06,1906,4,28,Apr
8448188,Jack,Pratt,13-Apr-06,Apr-13-1906,4/13/06,4/13/06,1906,4,13,Apr
8449208,Max,Sutherland,8-Feb-07,Feb-8-1907,2/8/07,2/8/07,1907,2,8,Feb
8446702,Walter,Harnott,24-Sep-09,Sep-24-1909,9/24/09,9/24/09,1909,9,24,Sep
8448061,Jim,O'Neil,3-Apr-13,Apr-3-1913,4/3/13,4/3/13,1913,4,3,Apr
8449058,Don,Smillie,13-Sep-10,Sep-13-1910,9/13/10,9/13/10,1910,9,13,Sep
8445848,Bob,Davie,12-Sep-12,Sep-12-1912,9/12/12,9/12/12,1912,9,12,Sep
8448784,Charlie,Sands,23-Mar-11,Mar-23-1911,3/23/11,3/23/11,1911,3,23,Mar
8448179,Jack,Portland,30-Jul-12,Jul-30-1912,7/30/12,7/30/12,1912,7,30,Jul
8448233,Jean,Pusie,15-Oct-10,Oct-15-1910,10/15/10,10/15/10,1910,10,15,Oct
8448790,Tony,Savage,18-Jul-06,Jul-18-1906,7/18/06,7/18/06,1906,7,18,Jul
8445747,Bob,Blake,16-Aug-14,Aug-16-1914,8/16/14,8/16/14,1914,8,16,Aug
8445961,Woody,Dumart,23-Dec-16,Dec-23-1916,12/23/16,12/23/16,1916,12,23,Dec
8446582,Ray,Getliffe,3-Apr-14,Apr-3-1914,4/3/14,4/3/14,1914,4,3,Apr
8448331,Jack,Riley,29-Dec-10,Dec-29-1910,12/29/10,12/29/10,1910,12,29,Dec
8445034,Bobby,Bauer,16-Feb-15,Feb-16-1915,2/16/15,2/16/15,1915,2,16,Feb
8445535,Fred,Cook,18-Sep-03,Sep-18-1903,9/18/03,9/18/03,1903,9,18,Sep
8448931,Milt,Schmidt,5-Mar-18,Mar-5-1918,3/5/18,3/5/18,1918,3,5,Mar
8447606,Sylvio,Mantha,14-Apr-02,Apr-14-1902,4/14/02,4/14/02,1902,4,14,Apr
8446686,Red,Hamill,11-Jan-17,Jan-11-1917,1/11/17,1/11/17,1917,1,11,Jan
8445767,Jack,Crawford,26-Oct-16,Oct-26-1916,10/26/16,10/26/16,1916,10,26,Oct
8446509,Harry,Frost,17-Aug-14,Aug-17-1914,8/17/14,8/17/14,1914,8,17,Aug
8448258,Terry,Reardon,6-Apr-19,Apr-6-1919,4/6/19,4/6/19,1919,4,6,Apr
8449017,Jack,Shewchuk,19-Jun-17,Jun-19-1917,6/19/17,6/19/17,1917,6,19,Jun
8449836,Frank,Brimsek,26-Sep-15,Sep-26-1915,9/26/15,9/26/15,1915,9,26,Sep
8445190,Gordie,Bruce,9-May-19,May-9-1919,5/9/19,5/9/19,1919,5,9,May
8446648,Lloyd,Gronsdahl,10-May-21,May-10-1921,5/10/21,5/10/21,1921,5,10,May
8446835,Phil,Hergesheimer,9-Jul-14,Jul-9-1914,7/9/14,7/9/14,1914,7,9,Jul
8447612,Frank,Mario,25-Feb-21,Feb-25-1921,2/25/21,2/25/21,1921,2,25,Feb
8447773,Jack,McGill,19-Sep-20,Sep-19-1920,9/19/20,9/19/20,1920,9,19,Sep
8449229,Cliff,Thompson,9-Dec-18,Dec-9-1918,12/9/18,12/9/18,1918,12,9,Dec
8449863,Nick,Damore,10-Jul-16,Jul-10-1916,7/10/16,7/10/16,1916,7,10,Jul
8444986,Ozzie,Aubuchon,1-Jan-17,Jan-1-1917,1/1/17,1/1/17,1917,1,1,Jan
8445310,Norm,Calladine,30-Jul-16,Jul-30-1916,7/30/16,7/30/16,1916,7,30,Jul
8445866,Ab,DeMarco,10-May-16,May-10-1916,5/10/16,5/10/16,1916,5,10,May
8446561,Don,Gallinger,16-Apr-25,Apr-16-1925,4/16/25,4/16/25,1925,4,16,Apr
8448928,Jackie,Schmidt,11-Nov-24,Nov-11-1924,11/11/24,11/11/24,1924,11,11,Nov
8449021,Bill,Shill,6-Mar-23,Mar-6-1923,3/6/23,3/6/23,1923,3,6,Mar
8444877,Bill,Anderson,13-Dec-12,Dec-13-1912,12/13/12,12/13/12,1912,12,13,Dec
8445159,Tom,Brennan,22-Jan-22,Jan-22-1922,1/22/22,1/22/22,1922,1,22,Jan
8447229,Russ,Kopak,26-Apr-24,Apr-26-1924,4/26/24,4/26/24,1924,4,26,Apr
8448081,Aldo,Palazzari,25-Jul-18,Jul-25-1918,7/25/18,7/25/18,1918,7,25,Jul
8448344,Alan,Rittinger,28-Jan-25,Jan-28-1925,1/28/25,1/28/25,1925,1,28,Jan
8448792,Chuck,Scherza,15-Feb-23,Feb-15-1923,2/15/23,2/15/23,1923,2,15,Feb
8448927,Clarence,Schmidt,17-Sep-25,Sep-17-1925,9/17/25,9/17/25,1925,9,17,Sep
8447270,Guy,Labrie,11-Aug-20,Aug-11-1920,8/11/20,8/11/20,1920,8,11,Aug
8448930,Otto,Schmidt,5-Nov-26,Nov-5-1926,11/5/26,11/5/26,1926,11,5,Nov
8449478,John,Wilkinson,9-Jul-11,Jul-9-1911,7/9/11,7/9/11,1911,7,9,Jul
8449781,George,Abbott,3-Aug-11,Aug-3-1911,8/3/11,8/3/11,1911,8,3,Aug
8449857,Maurice,Courteau,18-Feb-20,Feb-18-1920,2/18/20,2/18/20,1920,2,18,Feb
8449960,Bert,Gardiner,25-Mar-13,Mar-25-1913,3/25/13,3/25/13,1913,3,25,Mar
8445831,Bill,Cupolo,8-Jan-24,Jan-8-1924,1/8/24,1/8/24,1924,1,8,Jan
8446234,Marcel,Fillion,28-May-23,May-28-1923,5/28/23,5/28/23,1923,5,28,May
8446570,Armand,Gaudreault,14-Jul-21,Jul-14-1921,7/14/21,7/14/21,1921,7,14,Jul
8446591,Jean-Paul,Gladu,20-Jun-21,Jun-20-1921,6/20/21,6/20/21,1921,6,20,Jun
8448586,Gino,Rozzini,24-Oct-18,Oct-24-1918,10/24/18,10/24/18,1918,10,24,Oct
8449081,Ken,Smith,8-May-24,May-8-1924,5/8/24,5/8/24,1924,5,8,May
8449233,Bill,Thoms,5-Mar-10,Mar-5-1910,3/5/10,3/5/10,1910,3,5,Mar
8446318,Fern,Flaman,25-Jan-27,Jan-25-1927,1/25/27,1/25/27,1927,1,25,Jan
8446777,Murray,Henderson,5-Sep-21,Sep-5-1921,9/5/21,9/5/21,1921,9,5,Sep
8449819,Harvey,Bennett,23-Jul-25,Jul-23-1925,7/23/25,7/23/25,1925,7,23,Jul
8449823,Paul,Bibeault,13-Apr-19,Apr-13-1919,4/13/19,4/13/19,1919,4,13,Apr
8445863,Armand,Delmonte,3-Jun-27,Jun-3-1927,6/3/27,6/3/27,1927,6,3,Jun
8447804,Mike,McMahon,1-Feb-15,Feb-1-1915,2/1/15,2/1/15,1915,2,1,Feb
8445025,Ed,Barry,12-Oct-19,Oct-12-1919,10/12/19,10/12/19,1919,10,12,Oct
8447526,Pentti,Lund,6-Dec-25,Dec-6-1925,12/6/25,12/6/25,1925,12,6,Dec
8447618,Mark,Marquess,26-Mar-25,Mar-26-1925,3/26/25,3/26/25,1925,3,26,Mar
8447650,Norm,McAtee,28-Jun-21,Jun-28-1921,6/28/21,6/28/21,1921,6,28,Jun
8448128,Johnny,Peirson,21-Jul-25,Jul-21-1925,7/21/25,7/21/25,1925,7,21,Jul
8448187,Babe,Pratt,7-Jan-16,Jan-7-1916,1/7/16,1/7/16,1916,1,7,Jan
8446726,Ed,Harrison,25-Jul-27,Jul-25-1927,7/25/27,7/25/27,1927,7,25,Jul
8447248,Arnie,Kullman,9-Oct-27,Oct-9-1927,10/9/27,10/9/27,1927,10,9,Oct
8447603,Ray,Manson,3-Dec-26,Dec-3-1926,12/3/26,12/3/26,1926,12,3,Dec
8448239,John,Quilty,21-Jan-21,Jan-21-1921,1/21/21,1/21/21,1921,1,21,Jan
8448446,Paul,Ronty,12-Jun-28,Jun-12-1928,6/12/28,6/12/28,1928,6,12,Jun
8449363,Grant,Warwick,11-Oct-21,Oct-11-1921,10/11/21,10/11/21,1921,10,11,Oct
8449560,Wally,Wilson,25-May-21,May-25-1921,5/25/21,5/25/21,1921,5,25,May
8445805,Dave,Creighton,24-Jun-30,Jun-24-1930,6/24/30,6/24/30,1930,6,24,Jun
8449245,Zellio,Toppazzini,5-Jan-30,Jan-5-1930,1/5/30,1/5/30,1930,1,5,Jan
8447241,Ed,Kryzanowski,14-Nov-25,Nov-14-1925,11/14/25,11/14/25,1925,11,14,Nov
8449855,Les,Colvin,8-Feb-21,Feb-8-1921,2/8/21,2/8/21,1921,2,8,Feb
8449977,Jack,Gelineau,11-Nov-24,Nov-11-1924,11/11/24,11/11/24,1924,11,11,Nov
8449992,Gord,Henry,17-Aug-26,Aug-17-1926,8/17/26,8/17/26,1926,8,17,Aug
8445078,Sam,Bettio,1-Dec-28,Dec-1-1928,12/1/28,12/1/28,1928,12,1,Dec
8445153,Bart,Bradley,29-Jul-30,Jul-29-1930,7/29/30,7/29/30,1930,7,29,Jul
8447595,Phil,Maloney,6-Oct-27,Oct-6-1927,10/6/27,10/6/27,1927,10,6,Oct
8449203,Red,Sullivan,24-Dec-29,Dec-24-1929,12/24/29,12/24/29,1929,12,24,Dec
8445301,Gord,Byers,11-Mar-30,Mar-11-1930,3/11/30,3/11/30,1930,3,11,Mar
8447520,Ross,Lowe,21-Sep-28,Sep-21-1928,9/21/28,9/21/28,1928,9,21,Sep
8449828,Richard,Bittner,12-Jan-22,Jan-12-1922,1/12/22,1/12/22,1922,1,12,Jan
8446184,Bill,Ezinicki,11-Mar-24,Mar-11-1924,3/11/24,3/11/24,1924,3,11,Mar
8444970,Bob,Armstrong,7-Apr-31,Apr-7-1931,4/7/31,4/7/31,1931,4,7,Apr
8447233,Steve,Kraftcheck,3-Mar-29,Mar-3-1929,3/3/29,3/3/29,1929,3,3,Mar
8447349,Hal,Laycoe,23-Jun-22,Jun-23-1922,6/23/22,6/23/22,1922,6,23,Jun
8448236,Max,Quackenbush,29-Aug-28,Aug-29-1928,8/29/28,8/29/28,1928,8,29,Aug
8448313,Ed,Reigle,19-Jun-24,Jun-19-1924,6/19/24,6/19/24,1924,6,19,Jun
8445027,Ray,Barry,4-Oct-28,Oct-4-1928,10/4/28,10/4/28,1928,10,4,Oct
8447547,Fleming,MacKell,30-Apr-29,Apr-30-1929,4/30/29,4/30/29,1929,4,30,Apr
8447257,Gus,Kyle,11-Sep-23,Sep-11-1923,9/11/23,9/11/23,1923,9,11,Sep
8449993,Jim,Henry,23-Oct-20,Oct-23-1920,10/23/20,10/23/20,1920,10,23,Oct
8447223,Joe,Klukay,6-Nov-22,Nov-6-1922,11/6/22,11/6/22,1922,11,6,Nov
8447624,Frank,Martin,1-May-33,May-1-1933,5/1/33,5/1/33,1933,5,1,May
8445105,Gus,Bodnar,24-Apr-23,Apr-24-1923,4/24/23,4/24/23,1923,4,24,Apr
8445188,Wayne,Brown,16-Nov-30,Nov-16-1930,11/16/30,11/16/30,1930,11,16,Nov
8446565,Cal,Gardner,30-Oct-24,Oct-30-1924,10/30/24,10/30/24,1924,10,30,Oct
8446566,Ray,Gariepy,4-Sep-28,Sep-4-1928,9/4/28,9/4/28,1928,9,4,Sep
8449221,Skip,Teal,17-Jul-33,Jul-17-1933,7/17/33,7/17/33,1933,7,17,Jul
8449552,Gord,Wilson,13-Aug-32,Aug-13-1932,8/13/32,8/13/32,1932,8,13,Aug
8445369,Don,Cherry,5-Feb-34,Feb-5-1934,2/5/34,2/5/34,1934,2,5,Feb
8449991,John,Henderson,25-Mar-33,Mar-25-1933,3/25/33,3/25/33,1933,3,25,Mar
8446764,Lionel,Heinrich,20-Apr-34,Apr-20-1934,4/20/34,4/20/34,1934,4,20,Apr
8448006,Al,Nicholson,26-Apr-36,Apr-26-1936,4/26/36,4/26/36,1936,4,26,Apr
8448083,Ed,Panagabko,17-May-34,May-17-1934,5/17/34,5/17/34,1934,5,17,May
8449223,Orval,Tessier,30-Jun-33,Jun-30-1933,6/30/33,6/30/33,1933,6,30,Jun
8448041,Ellard,O'Brien,27-May-30,May-27-1930,5/27/30,5/27/30,1930,5,27,May
8450068,Claude,Pronovost,22-Jul-35,Jul-22-1935,7/22/35,7/22/35,1935,7,22,Jul
8445039,Bob,Beckett,8-Apr-36,Apr-8-1936,4/8/36,4/8/36,1936,4,8,Apr
8445117,Buddy,Boone,11-Sep-32,Sep-11-1932,9/11/32,9/11/32,1932,9,11,Sep
8445303,Jack,Caffery,30-Jun-34,Jun-30-1934,6/30/34,6/30/34,1934,6,30,Jun
8448247,George,Ranieri,14-Jan-36,Jan-14-1936,1/14/36,1/14/36,1936,1,14,Jan
8448299,Larry,Regan,9-Aug-30,Aug-9-1930,8/9/30,8/9/30,1930,8,9,Aug
8445081,Jack,Bionda,18-Sep-33,Sep-18-1933,9/18/33,9/18/33,1933,9,18,Sep
8445366,Dick,Cherry,28-Mar-37,Mar-28-1937,3/28/37,3/28/37,1937,3,28,Mar
8446863,Floyd,Hillman,19-Nov-33,Nov-19-1933,11/19/33,11/19/33,1933,11,19,Nov
8449155,Allan,Stanley,1-Mar-26,Mar-1-1926,3/1/26,3/1/26,1926,3,1,Mar
8449865,Norm,Defelice,19-Jan-33,Jan-19-1933,1/19/33,1/19/33,1933,1,19,Jan
8450113,Don,Simmons,13-Sep-31,Sep-13-1931,9/13/31,9/13/31,1931,9,13,Sep
8444853,Norm,Johnson,27-Nov-32,Nov-27-1932,11/27/32,11/27/32,1932,11,27,Nov
8448064,Willie,O'Ree,15-Oct-35,Oct-15-1935,10/15/35,10/15/35,1935,10,15,Oct
8448150,Harry,Pidhirny,5-Mar-28,Mar-5-1928,3/5/28,3/5/28,1928,3,5,Mar
8449916,Claude,Evans,28-Apr-33,Apr-28-1933,4/28/33,4/28/33,1933,4,28,Apr
8450042,Al,Millar,18-Sep-29,Sep-18-1929,9/18/29,9/18/29,1929,9,18,Sep
8446577,Jean-Guy,Gendron,30-Aug-34,Aug-30-1934,8/30/34,8/30/34,1934,8,30,Aug
8447351,Larry,Leach,18-Jun-36,Jun-18-1936,6/18/36,6/18/36,1936,6,18,Jun
8448176,Dan,Poliziani,8-Jan-35,Jan-8-1935,1/8/35,1/8/35,1935,1,8,Jan
8448295,Gord,Redahl,28-Aug-35,Aug-28-1935,8/28/35,8/28/35,1935,8,28,Aug
8449647,Ken,Yackel,5-Mar-32,Mar-5-1932,3/5/32,3/5/32,1932,3,5,Mar
8450008,Don,Keenan,8-Aug-38,Aug-8-1938,8/8/38,8/8/38,1938,8,8,Aug
8445009,Stan,Baluik,5-Oct-35,Oct-5-1935,10/5/35,10/5/35,1935,10,5,Oct
8446515,Pierre,Gagne,5-Jun-40,Jun-5-1940,6/5/40,6/5/40,1940,6,5,Jun
8447835,Dick,Meissner,6-Jan-40,Jan-6-1940,1/6/40,1/6/40,1940,1,6,Jan
8449269,Gord,Turlick,17-Sep-39,Sep-17-1939,9/17/39,9/17/39,1939,9,17,Sep
8449069,Dallas,Smith,10-Oct-41,Oct-10-1941,10/10/41,10/10/41,1941,10,10,Oct
8449340,Don,Ward,19-Oct-35,Oct-19-1935,10/19/35,10/19/35,1935,10,19,Oct
8445028,Jimmy,Bartlett,27-May-32,May-27-1932,5/27/32,5/27/32,1932,5,27,May
8445348,Billy,Carter,2-Dec-37,Dec-2-1937,12/2/37,12/2/37,1937,12,2,Dec
8445377,Art,Chisholm,11-Nov-34,Nov-11-1934,11/11/34,11/11/34,1934,11,11,Nov
8448077,Gerry,Ouellette,1-Nov-38,Nov-1-1938,11/1/38,11/1/38,1938,11,1,Nov
8447406,Ted,Green,23-Mar-40,Mar-23-1940,3/23/40,3/23/40,1940,3,23,Mar
8449959,Bruce,Gamble,24-May-38,May-24-1938,5/24/38,5/24/38,1938,5,24,May
8446642,Terry,Gray,21-Mar-38,Mar-21-1938,3/21/38,3/21/38,1938,3,21,Mar
8447252,Orland,Kurtenbach,7-Sep-36,Sep-7-1936,9/7/36,9/7/36,1936,9,7,Sep
8448131,Cliff,Pennington,18-Apr-40,Apr-18-1940,4/18/40,4/18/40,1940,4,18,Apr
8449159,Pat,Stapleton,4-Jul-40,Jul-4-1940,7/4/40,7/4/40,1940,7,4,Jul
8449384,Ed,Westfall,19-Sep-40,Sep-19-1940,9/19/40,9/19/40,1940,9,19,Sep
8449851,Ed,Chadwick,8-May-33,May-8-1933,5/8/33,5/8/33,1933,5,8,May
8449989,Don,Head,30-Jun-33,Jun-30-1933,6/30/33,6/30/33,1933,6,30,Jun
8446585,Jeannot,Gilbert,29-Dec-40,Dec-29-1940,12/29/40,12/29/40,1940,12,29,Dec
8446858,Wayne,Hicks,9-Apr-37,Apr-9-1937,4/9/37,4/9/37,1937,4,9,Apr
8450005,Eddie,Johnston,24-Nov-35,Nov-24-1935,11/24/35,11/24/35,1935,11,24,Nov
8445943,Gary,Dornhoefer,2-Feb-43,Feb-2-1943,2/2/43,2/2/43,1943,2,2,Feb
8446760,Andy,Hebenton,3-Oct-29,Oct-3-1929,10/3/29,10/3/29,1929,10,3,Oct
8447021,Ted,Irvine,8-Dec-44,Dec-8-1944,12/8/44,12/8/44,1944,12,8,Dec
8447234,Skip,Krake,14-Oct-43,Oct-14-1943,10/14/43,10/14/43,1943,10,14,Oct
8448937,Ron,Schock,19-Dec-43,Dec-19-1943,12/19/43,12/19/43,1943,12,19,Dec
8447101,Tom,Johnson,18-Feb-28,Feb-18-1928,2/18/28,2/18/28,1928,2,18,Feb
8445005,Murray,Balfour,24-Aug-36,Aug-24-1936,8/24/36,8/24/36,1936,8,24,Aug
8446002,Wayne,Cashman,24-Jun-45,Jun-24-1945,6/24/45,6/24/45,1945,6,24,Jun
8447225,Bill,Knibbs,24-Jan-42,Jan-24-1942,1/24/42,1/24/42,1942,1,24,Jan
8447642,Wayne,Maxner,27-Sep-42,Sep-27-1942,9/27/42,9/27/42,1942,9,27,Sep
8446324,Reg,Fleming,21-Apr-36,Apr-21-1936,4/21/36,4/21/36,1936,4,21,Apr
8450054,Jack,Norris,5-Aug-42,Aug-5-1942,8/5/42,8/5/42,1942,8,5,Aug
8445816,Terry,Crisp,28-May-43,May-28-1943,5/28/43,5/28/43,1943,5,28,May
8449138,Don,Marcotte,15-Apr-47,Apr-15-1947,4/15/47,4/15/47,1947,4,15,Apr
8448671,Derek,Sanderson,16-Jun-46,Jun-16-1946,6/16/46,6/16/46,1946,6,16,Jun
8449192,Ron,Stewart,11-Jul-32,Jul-11-1932,7/11/32,7/11/32,1932,7,11,Jul
8444966,John,Arbour,28-Sep-45,Sep-28-1945,9/28/45,9/28/45,1945,9,28,Sep
8444980,Barry,Ashbee,28-Jul-39,Jul-28-1939,7/28/39,7/28/39,1939,7,28,Jul
8445852,Murray,Davison,10-Jun-38,Jun-10-1938,6/10/38,6/10/38,1938,6,10,Jun
8447617,Gilles,Marotte,7-Jun-45,Jun-7-1945,6/7/45,6/7/45,1945,6,7,Jun
8449853,Gerry,Cheevers,7-Dec-40,Dec-7-1940,12/7/40,12/7/40,1940,12,7,Dec
8450178,Bernie,Parent,3-Apr-45,Apr-3-1945,4/3/45,4/3/45,1945,4,3,Apr
8450101,Bob,Ring,6-Oct-46,Oct-6-1946,10/6/46,10/6/46,1946,10,6,Oct
8445239,Ron,Buchanan,15-Nov-44,Nov-15-1944,11/15/44,11/15/44,1944,11,15,Nov
8446887,Ted,Hodgson,30-Jun-45,Jun-30-1945,6/30/45,6/30/45,1945,6,30,Jun
8448882,Ross,Lonsberry,7-Feb-47,Feb-7-1947,2/7/47,2/7/47,1947,2,7,Feb
8450070,Bobby,Orr,20-Mar-48,Mar-20-1948,3/20/48,3/20/48,1948,3,20,Mar
8449473,Barry,Wilkins,28-Feb-47,Feb-28-1947,2/28/47,2/28/47,1947,2,28,Feb
8446722,Phil,Esposito,20-Feb-42,Feb-20-1942,2/20/42,2/20/42,1942,2,20,Feb
8447892,Ken,Hodge,25-Jun-44,Jun-25-1944,6/25/44,6/25/44,1944,6,25,Jun
8448974,Eddie,Shack,11-Feb-37,Feb-11-1937,2/11/37,2/11/37,1937,2,11,Feb
8449981,Andre,Gill,19-Sep-41,Sep-19-1941,9/19/41,9/19/41,1941,9,19,Sep
8444984,Steve,Atkinson,16-Oct-48,Oct-16-1948,10/16/48,10/16/48,1948,10,16,Oct
8447664,Jim,Harrison,9-Jul-47,Jul-9-1947,7/9/47,7/9/47,1947,7,9,Jul
8447513,Jim,Lorentz,1-May-47,May-1-1947,5/1/47,5/1/47,1947,5,1,May
8446574,Jean,Gauthier,29-Apr-37,Apr-29-1937,4/29/37,4/29/37,1937,4,29,Apr
8447007,Paul,Hurley,12-Jul-46,Jul-12-1946,7/12/46,7/12/46,1946,7,12,Jul
8450006,Joe,Junkin,8-Sep-46,Sep-8-1946,9/8/46,9/8/46,1946,9,8,Sep
8448935,Danny,Schock,30-Dec-48,Dec-30-1948,12/30/48,12/30/48,1948,12,30,Dec
8449131,Bill,Speer,20-Mar-42,Mar-20-1942,3/20/42,3/20/42,1942,3,20,Mar
8449337,Mike,Walton,3-Jan-45,Jan-3-1945,1/3/45,1/3/45,1945,1,3,Jan
8446752,Chris,Hayes,24-Aug-46,Aug-24-1946,8/24/46,8/24/46,1946,8,24,Aug
8450075,Terry,O'Reilly,7-Jun-51,Jun-7-1951,6/7/51,6/7/51,1951,6,7,Jun
8448135,Garry,Peters,9-Oct-42,Oct-9-1942,10/9/42,10/9/42,1942,10,9,Oct
8447116,Ron,Jones,11-Apr-51,Apr-11-1951,4/11/51,4/11/51,1951,4,11,Apr
8448043,Fred,O'Donnell,6-Dec-49,Dec-6-1949,12/6/49,12/6/49,1949,12,6,Dec
8449952,Chris,Oddleifson,7-Sep-50,Sep-7-1950,9/7/50,9/7/50,1950,9,7,Sep
8451335,Gregg,Sheppard,23-Apr-49,Apr-23-1949,4/23/49,4/23/49,1949,4,23,Apr
8449783,John,Adams,27-Jul-46,Jul-27-1946,7/27/46,7/27/46,1946,7,27,Jul
8449842,Ross,Brooks,17-Oct-37,Oct-17-1937,10/17/37,10/17/37,1937,10,17,Oct
8450066,Jacques,Plante,17-Jan-29,Jan-17-1929,1/17/29,1/17/29,1929,1,17,Jan
8446908,Dave,Forbes,16-Nov-48,Nov-16-1948,11/16/48,11/16/48,1948,11,16,Nov
8447157,Doug,Gibson,28-Sep-53,Sep-28-1953,9/28/53,9/28/53,1953,9,28,Sep
8446654,Bob,Gryp,6-May-50,May-6-1950,5/6/50,5/6/50,1950,5,6,May
8447014,Dave,Hynes,17-Apr-51,Apr-17-1951,4/17/51,4/17/51,1951,4,17,Apr
8446560,Darryl,Edestrand,6-Nov-45,Nov-6-1945,11/6/45,11/6/45,1945,11,6,Nov
8446095,Gordie,Clark,31-May-52,May-31-1952,5/31/52,5/31/52,1952,5,31,May
8446630,Rod,Graham,19-Aug-46,Aug-19-1946,8/19/46,8/19/46,1946,8,19,Aug
8447319,Steve,Langdon,23-Dec-53,Dec-23-1953,12/23/53,12/23/53,1953,12,23,Dec
8448248,Jake,Rathwell,12-Aug-47,Aug-12-1947,8/12/47,8/12/47,1947,8,12,Aug
8448785,Craig,Sarner,20-Jun-49,Jun-20-1949,6/20/49,6/20/49,1949,6,20,Jun
8448364,Stan,Jonathan,5-Sep-55,Sep-5-1955,9/5/55,9/5/55,1955,9,5,Sep
8448059,Paul,O'Neil,24-Aug-53,Aug-24-1953,8/24/53,8/24/53,1953,8,24,Aug
8450646,Jean,Ratelle,3-Oct-40,Oct-3-1940,10/3/40,10/3/40,1940,10,3,Oct
8448604,Kent,Ruhnke,18-Sep-52,Sep-18-1952,9/18/52,9/18/52,1952,9,18,Sep
8447596,Ray,Maluta,24-Jul-54,Jul-24-1954,7/24/54,7/24/54,1954,7,24,Jul
8449617,Mike,Milbury,17-Jun-52,Jun-17-1952,6/17/52,6/17/52,1952,6,17,Jun
8449672,Joe,Zanussi,25-Sep-47,Sep-25-1947,9/25/47,9/25/47,1947,9,25,Sep
8450098,Dave,Reece,13-Sep-48,Sep-13-1948,9/13/48,9/13/48,1948,9,13,Sep
8447441,Matti,Hagman,21-Sep-55,Sep-21-1955,9/21/55,9/21/55,1955,9,21,Sep
8449587,Rick,Middleton,4-Dec-53,Dec-4-1953,12/4/53,12/4/53,1953,12,4,Dec
8450344,Jim,Pettie,24-Oct-53,Oct-24-1953,10/24/53,10/24/53,1953,10,24,Oct
8446909,Mike,Forbes,20-Sep-57,Sep-20-1957,9/20/57,9/20/57,1957,9,20,Sep
8451253,Al,Secord,3-Mar-58,Mar-3-1958,3/3/58,3/3/58,1958,3,3,Mar
8451599,Thomas,Songin,20-Dec-53,Dec-20-1953,12/20/53,12/20/53,1953,12,20,Dec
8445867,Ab,DeMarco,27-Feb-49,Feb-27-1949,2/27/49,2/27/49,1949,2,27,Feb
8449020,Craig,MacTavish,15-Aug-58,Aug-15-1958,8/15/58,8/15/58,1958,8,15,Aug
8449702,Douglas,Morrison,1-Feb-60,Feb-1-1960,2/1/60,2/1/60,1960,2,1,Feb
8445621,Ray,Bourque,28-Dec-60,Dec-28-1960,12/28/60,12/28/60,1960,12,28,Dec
8445272,Marco,Baron,8-Apr-59,Apr-8-1959,4/8/59,4/8/59,1959,4,8,Apr
8451721,James,Stewart Jr,23-Apr-57,Apr-23-1957,4/23/57,4/23/57,1957,4,23,Apr
8446242,Keith,Crowder,6-Jan-59,Jan-6-1959,1/6/59,1/6/59,1959,1,6,Jan
8448411,Steve,Kasper,28-Sep-61,Sep-28-1961,9/28/61,9/28/61,1961,9,28,Sep
8449549,Larry,Melnyk,21-Feb-60,Feb-21-1960,2/21/60,2/21/60,1960,2,21,Feb
8446255,Bruce,Crowder,25-Mar-57,Mar-25-1957,3/25/57,3/25/57,1957,3,25,Mar
8446807,Tom,Fergus,16-Jun-62,Jun-16-1962,6/16/62,6/16/62,1962,6,16,Jun
8448818,Normand,Leveille,10-Jan-63,Jan-10-1963,1/10/63,1/10/63,1963,1,10,Jan
8447822,Randy,Hillier,30-Mar-60,Mar-30-1960,3/30/60,3/30/60,1960,3,30,Mar
8449651,Mike,Moffat,4-Feb-62,Feb-4-1962,2/4/62,2/4/62,1962,2,4,Feb
8449504,Daniel,McLellan,10-Feb-63,Feb-10-1963,2/10/63,2/10/63,1963,2,10,Feb
8448515,Gord,Kluzak,4-Mar-64,Mar-4-1964,3/4/64,3/4/64,1964,3,4,Mar
8450343,Pete,Peeters,17-Aug-57,Aug-17-1957,8/17/57,8/17/57,1957,8,17,Aug
8445821,Lyndon,Byers,29-Feb-64,Feb-29-1964,2/29/64,2/29/64,1964,2,29,Feb
8446205,Geoff,Courtnall,18-Aug-62,Aug-18-1962,8/18/62,8/18/62,1962,8,18,Aug
8446445,Dave,Donnelly,2-Feb-62,Feb-2-1962,2/2/62,2/2/62,1962,2,2,Feb
8448328,Greg,Johnston,14-Jan-65,Jan-14-1965,1/14/65,1/14/65,1965,1,14,Jan
8448533,Doug,Kostynski,23-Feb-63,Feb-23-1963,2/23/63,2/23/63,1963,2,23,Feb
8449168,Nevin,Markwart,9-Dec-64,Dec-9-1964,12/9/64,12/9/64,1964,12,9,Dec
8450773,Dave,Reid,15-May-64,May-15-1964,5/15/64,5/15/64,1964,5,15,May
8446263,Brian,Curran,5-Nov-63,Nov-5-1963,11/5/63,11/5/63,1963,11,5,Nov
8448694,Guy,Lapointe,18-Mar-48,Mar-18-1948,3/18/48,3/18/48,1948,3,18,Mar
8448410,Doug,Keans,7-Jan-58,Jan-7-1958,1/7/58,1/7/58,1958,1,7,Jan
8447296,Butch,Goring,22-Oct-49,Oct-22-1949,10/22/49,10/22/49,1949,10,22,Oct
8448857,Ken,Linseman,11-Aug-58,Aug-11-1958,8/11/58,8/11/58,1958,8,11,Aug
8446316,Cleon,Daskalakis,29-Sep-62,Sep-29-1962,9/29/62,9/29/62,1962,9,29,Sep
8451372,Frank,Simonetti,11-Sep-62,Sep-11-1962,9/11/62,9/11/62,1962,9,11,Sep
8451894,Mats,Thelin,30-Mar-61,Mar-30-1961,3/30/61,3/30/61,1961,3,30,Mar
8451831,Don,Sylvestri,2-Jun-61,Jun-2-1961,6/2/61,6/2/61,1961,6,2,Jun
8445790,Randy,Burridge,7-Jan-66,Jan-7-1966,1/7/66,1/7/66,1966,1,7,Jan
8445989,John,Carter,3-May-63,May-3-1963,5/3/63,5/3/63,1963,5,3,May
8449624,Jay,Miller,16-Jul-60,Jul-16-1960,7/16/60,7/16/60,1960,7,16,Jul
8449892,Kraig,Nienhuis,9-May-61,May-9-1961,5/9/61,5/9/61,1961,5,9,May
8450204,Dave,Pasin,8-Jul-66,Jul-8-1966,7/8/66,7/8/66,1966,7,8,Jul
8451913,Michael,Thelven,7-Jan-61,Jan-7-1961,1/7/61,1/7/61,1961,1,7,Jan
8447335,Thomas,Gradin,18-Feb-56,Feb-18-1956,2/18/56,2/18/56,1956,2,18,Feb
8449812,Cam,Neely,6-Jun-65,Jun-6-1965,6/6/65,6/6/65,1965,6,6,Jun
8451820,Bob,Sweeney,25-Jan-64,Jan-25-1964,1/25/64,1/25/64,1964,1,25,Jan
8450993,Roberto,Romano,26-Oct-62,Oct-26-1962,10/26/62,10/26/62,1962,10,26,Oct
8445425,Paul,Beraldo,5-Oct-67,Oct-5-1967,10/5/67,10/5/67,1967,10,5,Oct
8447463,Taylor,Hall,20-Feb-64,Feb-20-1964,2/20/64,2/20/64,1964,2,20,Feb
8448768,Tommy,Lehman,3-Feb-64,Feb-3-1964,2/3/64,2/3/64,1964,2,3,Feb
8449297,Alan,May,14-Jan-67,Jan-14-1967,1/14/67,1/14/67,1967,1,14,Jan
8449950,Billy,O'Dwyer,25-Jan-60,Jan-25-1960,1/25/60,1/25/60,1960,1,25,Jan
8451712,Mike,Stevens,30-Dec-65,Dec-30-1965,12/30/65,12/30/65,1965,12,30,Dec
8447690,Greg,Hawgood,10-Aug-68,Aug-10-1968,8/10/68,8/10/68,1968,8,10,Aug
8451344,Bruce,Shoebottom,20-Aug-65,Aug-20-1965,8/20/65,8/20/65,1965,8,20,Aug
8449681,Andy,Moog,18-Feb-60,Feb-18-1960,2/18/60,2/18/60,1960,2,18,Feb
8446083,Rob,Cimetta,15-Feb-70,Feb-15-1970,2/15/70,2/15/70,1970,2,15,Feb
8446869,Ron,Flockhart,10-Oct-60,Oct-10-1960,10/10/60,10/10/60,1960,10,10,Oct
8447435,Paul,Guay,2-Sep-63,Sep-2-1963,9/2/63,9/2/63,1963,9,2,Sep
8449657,Carl,Mokosak,22-Sep-62,Sep-22-1962,9/22/62,9/22/62,1962,9,22,Sep
8450477,Ray,Podloski,5-Jan-66,Jan-5-1966,1/5/66,1/5/66,1966,1,5,Jan
8446504,Dale,Dunbar,14-Oct-61,Oct-14-1961,10/14/61,10/14/61,1961,10,14,Oct
8447004,Garry,Galley,16-Apr-63,Apr-16-1963,4/16/63,4/16/63,1963,4,16,Apr
8451819,Don,Sweeney,17-Aug-66,Aug-17-1966,8/17/66,8/17/66,1966,8,17,Aug
8445814,John,Byce,9-Aug-67,Aug-9-1967,8/9/67,8/9/67,1967,8,9,Aug
8446225,Louis,Crawford,5-Nov-62,Nov-5-1962,11/5/62,11/5/62,1962,11,5,Nov
8447957,Ron,Hoover,28-Oct-66,Oct-28-1966,10/28/66,10/28/66,1966,10,28,Oct
8448422,Jarmo,Kekalainen,3-Jul-66,Jul-3-1966,7/3/66,7/3/66,1966,7,3,Jul
8450512,Dave,Poulin,17-Dec-58,Dec-17-1958,12/17/58,12/17/58,1958,12,17,Dec
8451954,Graeme,Townshend,23-Oct-65,Oct-23-1965,10/23/65,10/23/65,1965,10,23,Oct
8445385,Bob,Beers,20-May-67,May-20-1967,5/20/67,5/20/67,1967,5,20,May
8452449,Jim,Wiemer,9-Jan-61,Jan-9-1961,1/9/61,1/9/61,1961,1,9,Jan
8445254,Ralph,Barahona,16-Nov-65,Nov-16-1965,11/16/65,11/16/65,1965,11,16,Nov
8448676,Jeff,Lazaro,21-Mar-68,Mar-21-1968,3/21/68,3/21/68,1968,3,21,Mar
8449883,Chris,Nilan,9-Feb-58,Feb-9-1958,2/9/58,2/9/58,1958,2,9,Feb
8451083,Vladimir,Ruzicka,6-Jun-63,Jun-6-1963,6/6/63,6/6/63,1963,6,6,Jun
8451718,Shayne,Stevenson,26-Oct-70,Oct-26-1970,10/26/70,10/26/70,1970,10,26,Oct
8458434,Chris,Winnes,12-Feb-68,Feb-12-1968,2/12/68,2/12/68,1968,2,12,Feb
8447489,Ken,Hammond,22-Aug-63,Aug-22-1963,8/22/63,8/22/63,1963,8,22,Aug
8446368,Matt,Delguidice,5-Mar-67,Mar-5-1967,3/5/67,3/5/67,1967,3,5,Mar
8446937,Norm,Foster,10-Feb-65,Feb-10-1965,2/10/65,2/10/65,1965,2,10,Feb
8446450,Brian,Dobbin,18-Aug-66,Aug-18-1966,8/18/66,8/18/66,1966,8,18,Aug
8456087,Ted,Donato,28-Apr-69,Apr-28-1969,4/28/69,4/28/69,1969,4,28,Apr
8456382,Matthew,Glennon,20-Sep-68,Sep-20-1968,9/20/68,9/20/68,1968,9,20,Sep
8456556,Steve,Heinze,30-Jan-70,Jan-30-1970,1/30/70,1/30/70,1970,1,30,Jan
8456760,Joe,Juneau,5-Jan-68,Jan-5-1968,1/5/68,1/5/68,1968,1,5,Jan
8448764,Stephen,Leach,16-Jan-66,Jan-16-1966,1/16/66,1/16/66,1966,1,16,Jan
8458532,Glen,Murray,1-Nov-72,Nov-1-1972,11/1/72,11/1/72,1972,11,1,Nov
8458554,Jozef,Stumpel,20-Jul-72,Jul-20-1972,7/20/72,7/20/72,1972,7,20,Jul
8451862,Dave,Thomlinson,22-Oct-66,Oct-22-1966,10/22/66,10/22/66,1966,10,22,Oct
8452224,Jim,Vesey,29-Sep-65,Sep-29-1965,9/29/65,9/29/65,1965,9,29,Sep
8445917,Jack,Capuano,7-Jul-66,Jul-7-1966,7/7/66,7/7/66,1966,7,7,Jul
8456683,Gord,Hynes,22-Jul-66,Jul-22-1966,7/22/66,7/22/66,1966,7,22,Jul
8450518,Petr,Prajzler,21-Sep-65,Sep-21-1965,9/21/65,9/21/65,1965,9,21,Sep
8455506,Darren,Banks,18-May-66,May-18-1966,5/18/66,5/18/66,1966,5,18,May
8458909,Dimitri,Kvartalnov,25-Mar-66,Mar-25-1966,3/25/66,3/25/66,1966,3,25,Mar
8459072,Grigori,Panteleev,17-Nov-72,Nov-17-1972,11/17/72,11/17/72,1972,11,17,Nov
8458069,Bryan,Smolinski,27-Dec-71,Dec-27-1971,12/27/71,12/27/71,1971,12,27,Dec
8451827,Tim,Sweeney,12-Apr-67,Apr-12-1967,4/12/67,4/12/67,1967,4,12,Apr
8458469,C.J.,Young,1-Jan-68,Jan-1-1968,1/1/68,1/1/68,1968,1,1,Jan
8458991,Sergei,Zholtok,2-Dec-72,Dec-2-1972,12/2/72,12/2/72,1972,12,2,Dec
8459192,Denis,Chervyakov,20-Apr-70,Apr-20-1970,4/20/70,4/20/70,1970,4,20,Apr
8448717,Dominic,Lavoie,21-Nov-67,Nov-21-1967,11/21/67,11/21/67,1967,11,21,Nov
8457803,Stephane,Richer,23-Apr-66,Apr-23-1966,4/23/66,4/23/66,1966,4,23,Apr
8455501,Mike,Bales,6-Aug-71,Aug-6-1971,8/6/71,8/6/71,1971,8,6,Aug
8455633,John,Blue,19-Feb-66,Feb-19-1966,2/19/66,2/19/66,1966,2,19,Feb
8458620,Mariusz,Czerkawski,13-Apr-72,Apr-13-1972,4/13/72,4/13/72,1972,4,13,Apr
8459722,Fred,Knipscheer,3-Sep-69,Sep-3-1969,9/3/69,9/3/69,1969,9,3,Sep
8449174,Daniel,Marois,3-Oct-68,Oct-3-1968,10/3/68,10/3/68,1968,10,3,Oct
8458126,Cameron,Stewart,18-Sep-71,Sep-18-1971,9/18/71,9/18/71,1971,9,18,Sep
8456455,John,Gruden,4-Jun-70,Jun-4-1970,6/4/70,6/4/70,1970,6,4,Jun
8448124,Al,Iafrate,21-Mar-66,Mar-21-1966,3/21/66,3/21/66,1966,3,21,Mar
8451657,Paul,Stanton,22-Jun-67,Jun-22-1967,6/22/67,6/22/67,1967,6,22,Jun
8456512,Brett,Harkins,2-Jul-70,Jul-2-1970,7/2/70,7/2/70,1970,7,2,Jul
8456932,Daniel,Lacroix,11-Mar-69,Mar-11-1969,3/11/69,3/11/69,1969,3,11,Mar
8449079,Mikko,Makela,28-Feb-65,Feb-28-1965,2/28/65,2/28/65,1965,2,28,Feb
8457406,Sandy,Moger,21-Mar-69,Mar-21-1969,3/21/69,3/21/69,1969,3,21,Mar
8449796,Mats,Naslund,31-Oct-59,Oct-31-1959,10/31/59,10/31/59,1959,10,31,Oct
8457841,Jon,Rohloff,3-Oct-69,Oct-3-1969,10/3/69,10/3/69,1969,10,3,Oct
8451290,Jeff,Serowik,10-Jan-67,Jan-10-1967,1/10/67,1/10/67,1967,1,10,Jan
8460318,Blaine,Lacher,5-Sep-70,Sep-5-1970,9/5/70,9/5/70,1970,9,5,Sep
8460319,Clayton,Beddoes,10-Nov-70,Nov-10-1970,11/10/70,11/10/70,1970,11,10,Nov
8456658,Ryan,Hughes,17-Jan-72,Jan-17-1972,1/17/72,1/17/72,1972,1,17,Jan
8449743,Joe,Mullen,26-Feb-57,Feb-26-1957,2/26/57,2/26/57,1957,2,26,Feb
8457636,Davis,Payne,24-Sep-70,Sep-24-1970,9/24/70,9/24/70,1970,9,24,Sep
8460639,Andre,Roy,8-Feb-75,Feb-8-1975,2/8/75,2/8/75,1975,2,8,Feb
8460836,Kevin,Sawyer,18-Feb-74,Feb-18-1974,2/18/74,2/18/74,1974,2,18,Feb
8451711,Kevin,Stevens,15-Apr-65,Apr-15-1965,4/15/65,4/15/65,1965,4,15,Apr
8451925,Rick,Tocchet,9-Apr-64,Apr-9-1964,4/9/64,4/9/64,1964,4,9,Apr
8446081,Dean,Chynoweth,30-Oct-68,Oct-30-1968,10/30/68,10/30/68,1968,10,30,Oct
8461676,Mark,Cornforth,13-Nov-72,Nov-13-1972,11/13/72,11/13/72,1972,11,13,Nov
8462040,Kyle,McLaren,18-Jun-77,Jun-18-1977,6/18/77,6/18/77,1977,6,18,Jun
8458327,Philip,Von Stefenelli,10-Apr-69,Apr-10-1969,4/10/69,4/10/69,1969,4,10,Apr
8459048,Scott,Bailey,2-May-72,May-2-1972,5/2/72,5/2/72,1972,5,2,May
8459306,Robbie,Tallas,20-Mar-73,Mar-20-1973,3/20/73,3/20/73,1973,3,20,Mar
8459439,Jason,Allison,29-May-75,May-29-1975,5/29/75,5/29/75,1975,5,29,May
8459156,Anson,Carter,6-Jun-74,Jun-6-1974,6/6/74,6/6/74,1974,6,6,Jun
8446408,Rob,DiMaio,19-Feb-68,Feb-19-1968,2/19/68,2/19/68,1968,2,19,Feb
8466001,Pierre-Claude,Drouin,22-Apr-74,Apr-22-1974,4/22/74,4/22/74,1974,4,22,Apr
8459230,Trent,McCleary,8-Sep-72,Sep-8-1972,9/8/72,9/8/72,1972,9,8,Sep
8459325,Jean-Yves,Roy,17-Feb-69,Feb-17-1969,2/17/69,2/17/69,1969,2,17,Feb
8459441,Landon,Wilson,13-Mar-75,Mar-13-1975,3/13/75,3/13/75,1975,3,13,Mar
8457194,Dean,Malkoc,26-Jan-70,Jan-26-1970,1/26/70,1/26/70,1970,1,26,Jan
8457805,Barry,Richter,11-Sep-70,Sep-11-1970,9/11/70,9/11/70,1970,9,11,Sep
8462183,Yevgeny,Shaldybin,29-Jul-75,Jul-29-1975,7/29/75,7/29/75,1975,7,29,Jul
8459144,Mattias,Timander,16-Apr-74,Apr-16-1974,4/16/74,4/16/74,1974,4,16,Apr
8458968,Jim,Carey,31-May-74,May-31-1974,5/31/74,5/31/74,1974,5,31,May
8462075,Paxton,Schafer,26-Feb-76,Feb-26-1976,2/26/76,2/26/76,1976,2,26,Feb
8462209,P.J.,Axelsson,26-Feb-75,Feb-26-1975,2/26/75,2/26/75,1975,2,26,Feb
8459527,Shawn,Bates,3-Apr-75,Apr-3-1975,4/3/75,4/3/75,1975,4,3,Apr
8445323,Ken,Baumgartner,11-Mar-66,Mar-11-1966,3/11/66,3/11/66,1966,3,11,Mar
8448484,Dmitri,Khristich,23-Jul-69,Jul-23-1969,7/23/69,7/23/69,1969,7,23,Jul
8462126,Cameron,Mann,20-Apr-77,Apr-20-1977,4/20/77,4/20/77,1977,4,20,Apr
8460488,Kirk,Nielsen,19-Oct-73,Oct-19-1973,10/19/73,10/19/73,1973,10,19,Oct
8459654,Joel,Prpic,25-Sep-74,Sep-25-1974,9/25/74,9/25/74,1974,9,25,Sep
8466035,Sergei,Samsonov,27-Oct-78,Oct-27-1978,10/27/78,10/27/78,1978,10,27,Oct
8458155,Mike,Sullivan,27-Feb-68,Feb-27-1968,2/27/68,2/27/68,1968,2,27,Feb
8466138,Joe,Thornton,2-Jul-79,Jul-2-1979,7/2/79,7/2/79,1979,7,2,Jul
8459628,Hal,Gill,6-Apr-75,Apr-6-1975,4/6/75,4/6/75,1975,4,6,Apr
8448740,Grant,Ledyard,19-Nov-61,Nov-19-1961,11/19/61,11/19/61,1961,11,19,Nov
8459249,Darren,Van Impe,18-May-73,May-18-1973,5/18/73,5/18/73,1973,5,18,May
8459089,Ken,Belanger,14-May-74,May-14-1974,5/14/74,5/14/74,1974,5,14,May
8458960,Peter,Ferraro,24-Jan-73,Jan-24-1973,1/24/73,1/24/73,1973,1,24,Jan
8466368,Jay,Henderson,17-Sep-78,Sep-17-1978,9/17/78,9/17/78,1978,9,17,Sep
8466316,Antti,Laaksonen,3-Oct-73,Oct-3-1973,10/3/73,10/3/73,1973,10,3,Oct
8460054,Marquis,Mathieu,31-May-73,May-31-1973,5/31/73,5/31/73,1973,5,31,May
8460588,Eric,Nickulas,25-Mar-75,Mar-25-1975,3/25/75,3/25/75,1975,3,25,Mar
8467403,Peter,Nordstrom,26-Jul-74,Jul-26-1974,7/26/74,7/26/74,1974,7,26,Jul
8467325,Andre,Savage,27-May-75,May-27-1975,5/27/75,5/27/75,1975,5,27,May
8458185,Chris,Taylor,6-Mar-72,Mar-6-1972,3/6/72,3/6/72,1972,3,6,Mar
8467374,Jonathan,Girard,27-May-80,May-27-1980,5/27/80,5/27/80,1980,5,27,May
8459262,Brandon,Smith,25-Feb-73,Feb-25-1973,2/25/73,2/25/73,1973,2,25,Feb
8458300,Dennis,Vaske,11-Oct-67,Oct-11-1967,10/11/67,10/11/67,1967,10,11,Oct
8460099,Terry,Virtue,12-Aug-70,Aug-12-1970,8/12/70,8/12/70,1970,8,12,Aug
8468120,Mikko,Eloranta,24-Aug-72,Aug-24-1972,8/24/72,8/24/72,1972,8,24,Aug
8458950,Joe,Hulbig,29-Sep-73,Sep-29-1973,9/29/73,9/29/73,1973,9,29,Sep
8458565,Sean,Pronger,30-Nov-72,Nov-30-1972,11/30/72,11/30/72,1972,11,30,Nov
8466166,Jeff,Zehr,10-Dec-78,Dec-10-1978,12/10/78,12/10/78,1978,12,10,Dec
8464961,Johnathan,Aitken,24-May-78,May-24-1978,5/24/78,5/24/78,1978,5,24,May
8466145,Nick,Boynton,14-Jan-79,Jan-14-1979,1/14/79,1/14/79,1979,1,14,Jan
8449516,Marty,McSorley,18-May-63,May-18-1963,5/18/63,5/18/63,1963,5,18,May
8460715,John,Grahame,31-Aug-75,Aug-31-1975,8/31/75,8/31/75,1975,8,31,Aug
8466197,Lee,Goren,26-Dec-77,Dec-26-1977,12/26/77,12/26/77,1977,12,26,Dec
8459472,Eric,Manlow,7-Apr-75,Apr-7-1975,4/7/75,4/7/75,1975,4,7,Apr
8458947,Andrei,Nazarov,22-May-74,May-22-1974,5/22/74,5/22/74,1974,5,22,May
8465192,Samuel,Pahlsson,17-Dec-77,Dec-17-1977,12/17/77,12/17/77,1977,12,17,Dec
8458347,Dixon,Ward,23-Sep-68,Sep-23-1968,9/23/68,9/23/68,1968,9,23,Sep
8468748,Pavel,Kolarik,24-Oct-72,Oct-24-1972,10/24/72,10/24/72,1972,10,24,Oct
8468654,Jarno,Kultanen,8-Jan-73,Jan-8-1973,1/8/73,1/8/73,1973,1,8,Jan
8468717,Zdenek,Kutlak,13-Feb-80,Feb-13-1980,2/13/80,2/13/80,1980,2,13,Feb
8457706,Peter,Popovic,10-Feb-68,Feb-10-1968,2/10/68,2/10/68,1968,2,10,Feb
8458986,Patrick,Traverse,14-Mar-74,Mar-14-1974,3/14/74,3/14/74,1974,3,14,Mar
8467453,Andrew,Raycroft,4-May-80,May-4-1980,5/4/80,5/4/80,1980,5,4,May
8464715,Peter,Skudra,24-Apr-73,Apr-24-1973,4/24/73,4/24/73,1973,4,24,Apr
8459996,Dennis,Bonvie,23-Jul-73,Jul-23-1973,7/23/73,7/23/73,1973,7,23,Jul
8459545,John,Emmons,17-Aug-74,Aug-17-1974,8/17/74,8/17/74,1974,8,17,Aug
8468517,Andy,Hilbert,6-Feb-81,Feb-6-1981,2/6/81,2/6/81,1981,2,6,Feb
8445423,Benoit,Hogue,28-Oct-66,Oct-28-1966,10/28/66,10/28/66,1966,10,28,Oct
8468539,Ivan,Huml,6-Sep-81,Sep-6-1981,9/6/81,9/6/81,1981,9,6,Sep
8457319,Marty,Mcinnis,2-Jun-70,Jun-2-1970,6/2/70,6/2/70,1970,6,2,Jun
8465960,P.J.,Stock,26-May-75,May-26-1975,5/26/75,5/26/75,1975,5,26,May
8460601,Tony,Tuzzolino,9-Oct-75,Oct-9-1975,10/9/75,10/9/75,1975,10,9,Oct
8458477,Rob,Zamuner,17-Sep-69,Sep-17-1969,9/17/69,9/17/69,1969,9,17,Sep
8464959,Ric,Jackman,28-Jun-78,Jun-28-1978,6/28/78,6/28/78,1978,6,28,Jun
8459553,Chris,Kelleher,23-Mar-75,Mar-23-1975,3/23/75,3/23/75,1975,3,23,Mar
8449902,Jeff,Norton,25-Nov-65,Nov-25-1965,11/25/65,11/25/65,1965,11,25,Nov
8460582,Matthew,Herr,26-May-76,May-26-1976,5/26/76,5/26/76,1976,5,26,May
8459033,Brantt,Myhres,18-Mar-74,Mar-18-1974,3/18/74,3/18/74,1974,3,18,Mar
8468507,Martin,Samuelsson,25-Jan-82,Jan-25-1982,1/25/82,1/25/82,1982,1,25,Jan
8468531,Kris,Vernarsky,5-Apr-82,Apr-5-1982,4/5/82,4/5/82,1982,4,5,Apr
8462032,Bryan,Berard,5-Mar-77,Mar-5-1977,3/5/77,3/5/77,1977,3,5,Mar
8458560,Rich,Brennan,26-Nov-72,Nov-26-1972,11/26/72,11/26/72,1972,11,26,Nov
8457421,Ian,Moran,24-Aug-72,Aug-24-1972,8/24/72,8/24/72,1972,8,24,Aug
8469472,Shaone,Morrisonn,23-Dec-82,Dec-23-1982,12/23/82,12/23/82,1982,12,23,Dec
8447449,Jeff,Hackett,1-Jun-68,Jun-1-1968,6/1/68,6/1/68,1968,6,1,Jun
8460703,Tim,Thomas,15-Apr-74,Apr-15-1974,4/15/74,4/15/74,1974,4,15,Apr
8470638,Patrice,Bergeron,24-Jul-85,Jul-24-1985,7/24/85,7/24/85,1985,7,24,Jul
8469847,Carl,Corazzini,21-Apr-79,Apr-21-1979,4/21/79,4/21/79,1979,4,21,Apr
8460931,Doug,Doull,31-May-74,May-31-1974,5/31/74,5/31/74,1974,5,31,May
8456430,Travis,Green,20-Dec-70,Dec-20-1970,12/20/70,12/20/70,1970,12,20,Dec
8467444,Patrick,Leahy,9-Jun-79,Jun-9-1979,6/9/79,6/9/79,1979,6,9,Jun
8465041,Craig,MacDonald,7-Apr-77,Apr-7-1977,4/7/77,4/7/77,1977,4,7,Apr
8458566,Sandy,McCarthy,15-Jun-72,Jun-15-1972,6/15/72,6/15/72,1972,6,15,Jun
8468778,Colton,Orr,3-Mar-82,Mar-3-1982,3/3/82,3/3/82,1982,3,3,Mar
8468553,Sergei,Zinovjev,4-Mar-80,Mar-4-1980,3/4/80,3/4/80,1980,3,4,Mar
8458951,Sergei,Gonchar,13-Apr-74,Apr-13-1974,4/13/74,4/13/74,1974,4,13,Apr
8467887,Jeff,Jillson,24-Jul-80,Jul-24-1980,7/24/80,7/24/80,1980,7,24,Jul
8457714,Felix,Potvin,23-Jun-71,Jun-23-1971,6/23/71,6/23/71,1971,6,23,Jun
8468504,Brad,Boyes,17-Apr-82,Apr-17-1982,4/17/82,4/17/82,1982,4,17,Apr
8446830,Tom,Fitzgerald,28-Aug-68,Aug-28-1968,8/28/68,8/28/68,1968,8,28,Aug
8466300,Ben,Guite,17-Jul-78,Jul-17-1978,7/17/78,7/17/78,1978,7,17,Jul
8467700,Eric,Healey,20-Jan-75,Jan-20-1975,1/20/75,1/20/75,1975,1,20,Jan
8462094,Brad,Isbister,7-May-77,May-7-1977,5/7/77,5/7/77,1977,5,7,May
8460507,Wayne,Primeau,4-Jun-76,Jun-4-1976,6/4/76,6/4/76,1976,6,4,Jun
8460533,Dave,Scatchard,20-Feb-76,Feb-20-1976,2/20/76,2/20/76,1976,2,20,Feb
8470223,Yan,Stastny,30-Sep-82,Sep-30-1982,9/30/82,9/30/82,1982,9,30,Sep
8464979,Marco,Sturm,8-Sep-78,Sep-8-1978,9/8/78,9/8/78,1978,9,8,Sep
8469626,Andrew,Alberts,30-Jun-81,Jun-30-1981,6/30/81,6/30/81,1981,6,30,Jun
8469795,Kevin,Dallman,26-Feb-81,Feb-26-1981,2/26/81,2/26/81,1981,2,26,Feb
8469684,Milan,Jurcina,7-Jun-83,Jun-7-1983,6/7/83,6/7/83,1983,6,7,Jun
8448769,Brian,Leetch,3-Mar-68,Mar-3-1968,3/3/68,3/3/68,1968,3,3,Mar
8467889,David,Tanabe,19-Jul-80,Jul-19-1980,7/19/80,7/19/80,1980,7,19,Jul
8469653,Jordan,Sigalet,19-Feb-81,Feb-19-1981,2/19/81,2/19/81,1981,2,19,Feb
8470084,Hannu,Toivonen,18-May-84,May-18-1984,5/18/84,5/18/84,1984,5,18,May
8469666,Brandon,Bochenski,4-Apr-82,Apr-4-1982,4/4/82,4/4/82,1982,4,4,Apr
8469458,Stanislav,Chistov,17-Apr-83,Apr-17-1983,4/17/83,4/17/83,1983,4,17,Apr
8470004,Jeff,Hoggan,1-Feb-78,Feb-1-1978,2/1/78,2/1/78,1978,2,1,Feb
8471713,Petr,Kalus,29-Jun-87,Jun-29-1987,6/29/87,6/29/87,1987,6,29,Jun
8473548,Phil,Kessel,2-Oct-87,Oct-2-1987,10/2/87,10/2/87,1987,10,2,Oct
8469467,Chuck,Kobasew,17-Apr-82,Apr-17-1982,4/17/82,4/17/82,1982,4,17,Apr
8471276,David,Krejci,28-Apr-86,Apr-28-1986,4/28/86,4/28/86,1986,4,28,Apr
8466174,Jeremy,Reich,11-Feb-79,Feb-11-1979,2/11/79,2/11/79,1979,2,11,Feb
8468103,Petr,Tenkrat,31-May-77,May-31-1977,5/31/77,5/31/77,1977,5,31,May
8470775,Nate,Thompson,5-Oct-84,Oct-5-1984,10/5/84,10/5/84,1984,10,5,Oct
8467378,Bobby,Allen,14-Nov-78,Nov-14-1978,11/14/78,11/14/78,1978,11,14,Nov
8469044,Wade,Brookbank,29-Sep-77,Sep-29-1977,9/29/77,9/29/77,1977,9,29,Sep
8465009,Zdeno,Chara,18-Mar-77,Mar-18-1977,3/18/77,3/18/77,1977,3,18,Mar
8459181,Nathan,Dempsey,14-Jul-74,Jul-14-1974,7/14/74,7/14/74,1974,7,14,Jul
8466333,Andrew,Ference,17-Mar-79,Mar-17-1979,3/17/79,3/17/79,1979,3,17,Mar
8471696,Matt,Lashoff,29-Sep-86,Sep-29-1986,9/29/86,9/29/86,1986,9,29,Sep
8466144,Paul,Mara,7-Sep-79,Sep-7-1979,9/7/79,9/7/79,1979,9,7,Sep
8471765,Jonathan,Sigalet,12-Feb-86,Feb-12-1986,2/12/86,2/12/86,1986,2,12,Feb
8469770,Dennis,Wideman,20-Mar-83,Mar-20-1983,3/20/83,3/20/83,1983,3,20,Mar
8467879,Brian,Finley,3-Jul-81,Jul-3-1981,7/3/81,7/3/81,1981,7,3,Jul
8467364,Philippe,Sauve,27-Feb-80,Feb-27-1980,2/27/80,2/27/80,1980,2,27,Feb
8473473,Milan,Lucic,7-Jun-88,Jun-7-1988,6/7/88,6/7/88,1988,6,7,Jun
8471229,Petteri,Nokelainen,16-Jan-86,Jan-16-1986,1/16/86,1/16/86,1986,1,16,Jan
8469752,Pascal,Pelletier,16-Jun-83,Jun-16-1983,6/16/83,6/16/83,1983,6,16,Jun
8462093,Peter,Schaefer,12-Jul-77,Jul-12-1977,7/12/77,7/12/77,1977,7,12,Jul
8471743,Vladimir,Sobotka,2-Jul-87,Jul-2-1987,7/2/87,7/2/87,1987,7,2,Jul
8465978,Shawn,Thornton,23-Jul-77,Jul-23-1977,7/23/77,7/23/77,1977,7,23,Jul
8471436,Matt,Hunwick,21-May-85,May-21-1985,5/21/85,5/21/85,1985,5,21,May
8467913,Alex,Auld,7-Jan-81,Jan-7-1981,1/7/81,1/7/81,1981,1,7,Jan
8458988,Manny,Fernandez,27-Aug-74,Aug-27-1974,8/27/74,8/27/74,1974,8,27,Aug
8471695,Tuukka,Rask,10-Mar-87,Mar-10-1987,3/10/87,3/10/87,1987,3,10,Mar
8470700,Byron,Bitz,21-Jul-84,Jul-21-1984,7/21/84,7/21/84,1984,7,21,Jul
8471277,Martins,Karsums,26-Feb-86,Feb-26-1986,2/26/86,2/26/86,1986,2,26,Feb
8471747,Mikko,Lehtonen,1-Apr-87,Apr-1-1987,4/1/87,4/1/87,1987,4,1,Apr
8470366,Martin,St. Pierre,11-Aug-83,Aug-11-1983,8/11/83,8/11/83,1983,8,11,Aug
8459122,Stephane,Yelle,9-May-74,May-9-1974,5/9/74,5/9/74,1974,5,9,May
8470187,Johnny,Boychuk,19-Jan-84,Jan-19-1984,1/19/84,1/19/84,1984,1,19,Jan
8468927,Steve,Montador,21-Dec-79,Dec-21-1979,12/21/79,12/21/79,1979,12,21,Dec
8464994,Steve,Begin,14-Jun-78,Jun-14-1978,6/14/78,6/14/78,1978,6,14,Jun
8474045,Zach,Hamill,23-Sep-88,Sep-23-1988,9/23/88,9/23/88,1988,9,23,Sep
8470970,Drew,Larman,15-May-85,May-15-1985,5/15/85,5/15/85,1985,5,15,May
8468707,Guillaume,Lefebvre,7-May-81,May-7-1981,5/7/81,5/7/81,1981,5,7,May
8473419,Brad,Marchand,11-May-88,May-11-1988,5/11/88,5/11/88,1988,5,11,May
8470230,Daniel,Paille,15-Apr-84,Apr-15-1984,4/15/84,4/15/84,1984,4,15,Apr
8459534,Miroslav,Satan,22-Oct-74,Oct-22-1974,10/22/74,10/22/74,1974,10,22,Oct
8465056,Trent,Whitfield,17-Jun-77,Jun-17-1977,6/17/77,6/17/77,1977,6,17,Jun
8473550,Andrew,Bodnarchuk,11-Jul-88,Jul-11-1988,7/11/88,7/11/88,1988,7,11,Jul
8471717,Adam,McQuaid,12-Oct-86,Oct-12-1986,10/12/86,10/12/86,1986,10,12,Oct
8464966,Derek,Morris,24-Aug-78,Aug-24-1978,8/24/78,8/24/78,1978,8,24,Aug
8474511,Jeff,Penner,13-Apr-87,Apr-13-1987,4/13/87,4/13/87,1987,4,13,Apr
8469619,Dennis,Seidenberg,18-Jul-81,Jul-18-1981,7/18/81,7/18/81,1981,7,18,Jul
8471188,Andy,Wozniewski,25-May-80,May-25-1980,5/25/80,5/25/80,1980,5,25,May
8474657,Jamie,Arniel,16-Nov-89,Nov-16-1989,11/16/89,11/16/89,1989,11,16,Nov
8470169,Gregory,Campbell,17-Dec-83,Dec-17-1983,12/17/83,12/17/83,1983,12,17,Dec
8475150,Jordan,Caron,2-Nov-90,Nov-2-1990,11/2/90,11/2/90,1990,11,2,Nov
8470596,Nathan,Horton,29-May-85,May-29-1985,5/29/85,5/29/85,1985,5,29,May
8467967,Chris,Kelly,11-Nov-80,Nov-11-1980,11/11/80,11/11/80,1980,11,11,Nov
8475794,Tyler,Seguin,31-Jan-92,Jan-31-1992,1/31/92,1/31/92,1992,1,31,Jan
8474749,Matt,Bartkowski,4-Jun-88,Jun-4-1988,6/4/88,6/4/88,1988,6,4,Jun
8465200,Tomas,Kaberle,2-Mar-78,Mar-2-1978,3/2/78,3/2/78,1978,3,2,Mar
8474000,Steven,Kampfer,24-Sep-88,Sep-24-1988,9/24/88,9/24/88,1988,9,24,Sep
8476211,Carter,Camper,6-Jul-88,Jul-6-1988,7/6/88,7/6/88,1988,7,6,Jul
8470636,Josh,Hennessy,7-Feb-85,Feb-7-1985,2/7/85,2/7/85,1985,2,7,Feb
8475283,Lane,MacDermid,25-Aug-89,Aug-25-1989,8/25/89,8/25/89,1989,8,25,Aug
8471678,Benoit,Pouliot,29-Sep-86,Sep-29-1986,9/29/86,9/29/86,1986,9,29,Sep
8474607,Max,Sauve,30-Jan-90,Jan-30-1990,1/30/90,1/30/90,1990,1,30,Jan
8466215,Joe,Corvo,20-Jun-77,Jun-20-1977,6/20/77,6/20/77,1977,6,20,Jun
8476792,Torey,Krug,12-Apr-91,Apr-12-1991,4/12/91,4/12/91,1991,4,12,Apr
8468636,Greg,Zanon,5-Jun-80,Jun-5-1980,6/5/80,6/5/80,1980,6,5,Jun
8471418,Anton,Khudobin,7-May-86,May-7-1986,5/7/86,5/7/86,1986,5,7,May
8460612,Marty,Turco,13-Aug-75,Aug-13-1975,8/13/75,8/13/75,1975,8,13,Aug
8471246,Chris,Bourque,29-Jan-86,Jan-29-1986,1/29/86,1/29/86,1986,1,29,Jan
8473484,Kaspars,Daugavins,18-May-88,May-18-1988,5/18/88,5/18/88,1988,5,18,May
8471262,Carl,Soderberg,12-Oct-85,Oct-12-1985,10/12/85,10/12/85,1985,10,12,Oct
8475727,Ryan,Spooner,30-Jan-92,Jan-30-1992,1/30/92,1/30/92,1992,1,30,Jan
8470704,Jamie,Tardif,23-Jan-85,Jan-23-1985,1/23/85,1/23/85,1985,1,23,Jan
8469534,Aaron,Johnson,30-Apr-83,Apr-30-1983,4/30/83,4/30/83,1983,4,30,Apr
8462033,Wade,Redden,12-Jun-77,Jun-12-1977,6/12/77,6/12/77,1977,6,12,Jun
8475414,Craig,Cunningham,13-Sep-90,Sep-13-1990,9/13/90,9/13/90,1990,9,13,Sep
8470626,Loui,Eriksson,17-Jul-85,Jul-17-1985,7/17/85,7/17/85,1985,7,17,Jul
8475845,Justin,Florek,18-May-90,May-18-1990,5/18/90,5/18/90,1990,5,18,May
8475671,Matt,Fraser,20-May-90,May-20-1990,5/20/90,5/20/90,1990,5,20,May
8462042,Jarome,Iginla,1-Jul-77,Jul-1-1977,7/1/77,7/1/77,1977,7,1,Jul
8471280,Nick,Johnson,24-Dec-85,Dec-24-1985,12/24/85,12/24/85,1985,12,24,Dec
8476435,Alex,Khokhlachev,9-Sep-93,Sep-9-1993,9/9/93,9/9/93,1993,9,9,Sep
8477228,Matt,Lindblad,23-Mar-90,Mar-23-1990,3/23/90,3/23/90,1990,3,23,Mar
8475191,Reilly,Smith,1-Apr-91,Apr-1-1991,4/1/91,4/1/91,1991,4,1,Apr
8471236,Andrej,Meszaros,13-Oct-85,Oct-13-1985,10/13/85,10/13/85,1985,10,13,Oct
8476191,Kevan,Miller,15-Nov-87,Nov-15-1987,11/15/87,11/15/87,1987,11,15,Nov
8470714,Corey,Potter,5-Jan-84,Jan-5-1984,1/5/84,1/5/84,1984,1,5,Jan
8475902,Zach,Trotman,26-Aug-90,Aug-26-1990,8/26/90,8/26/90,1990,8,26,Aug
8473434,Chad,Johnson,10-Jun-86,Jun-10-1986,6/10/86,6/10/86,1986,6,10,Jun
8476844,Niklas,Svedberg,4-Sep-89,Sep-4-1989,9/4/89,9/4/89,1989,9,4,Sep
8475792,Brett,Connolly,2-May-92,May-2-1992,5/2/92,5/2/92,1992,5,2,May
8476363,Brian,Ferlin,3-Jun-92,Jun-3-1992,6/3/92,6/3/92,1992,6,3,Jun
8467346,Simon,Gagne,29-Feb-80,Feb-29-1980,2/29/80,2/29/80,1980,2,29,Feb
8476495,Seth,Griffith,4-Jan-93,Jan-4-1993,1/4/93,1/4/93,1993,1,4,Jan
8477956,David,Pastrnak,25-May-96,May-25-1996,5/25/96,5/25/96,1996,5,25,May
8472365,Bobby,Robins,17-Oct-81,Oct-17-1981,10/17/81,10/17/81,1981,10,17,Oct
8470171,Max,Talbot,11-Feb-84,Feb-11-1984,2/11/84,2/11/84,1984,2,11,Feb
8476476,Joe,Morrow,9-Dec-92,Dec-9-1992,12/9/92,12/9/92,1992,12,9,Dec
8476876,Malcolm,Subban,21-Dec-93,Dec-21-1993,12/21/93,12/21/93,1993,12,21,Dec
8478569,Noel,Acciari,1-Dec-91,Dec-1-1991,12/1/91,12/1/91,1991,12,1,Dec
8473492,Matt,Beleskey,7-Jun-88,Jun-7-1988,6/7/88,6/7/88,1988,6,7,Jun
8478564,Joonas,Kemppainen,7-Apr-88,Apr-7-1988,4/7/88,4/7/88,1988,4,7,Apr
8475292,Tyler,Randell,15-Jun-91,Jun-15-1991,6/15/91,6/15/91,1991,6,15,Jun
8474736,Zac,Rinaldo,15-Jun-90,Jun-15-1990,6/15/90,6/15/90,1990,6,15,Jun
8478366,Frank,Vatrano,14-Mar-94,Mar-14-1994,3/14/94,3/14/94,1994,3,14,Mar
8474019,Tommy,Cross,12-Sep-89,Sep-12-1989,9/12/89,9/12/89,1989,9,12,Sep
8475625,Matt,Irwin,29-Nov-87,Nov-29-1987,11/29/87,11/29/87,1987,11,29,Nov
8468639,John-Michael,Liles,25-Nov-80,Nov-25-1980,11/25/80,11/25/80,1980,11,25,Nov
8470655,David,Backes,1-May-84,May-1-1984,5/1/84,5/1/84,1984,5,1,May
8477320,Anton,Blidh,14-Mar-95,Mar-14-1995,3/14/95,3/14/95,1995,3,14,Mar
8477417,Peter,Cehlarik,2-Aug-95,Aug-2-1995,8/2/95,8/2/95,1995,8,2,Aug
8478417,Jakob,Forsbacka Karlsson,31-Oct-96,Oct-31-1996,10/31/96,10/31/96,1996,10,31,Oct
8478046,Danton,Heinen,5-Jul-95,Jul-5-1995,7/5/95,7/5/95,1995,7,5,Jul
8476374,Sean,Kuraly,20-Jan-93,Jan-20-1993,1/20/93,1/20/93,1993,1,20,Jan
8468575,Dominic,Moore,3-Aug-80,Aug-3-1980,8/3/80,8/3/80,1980,8,3,Aug
8474062,Riley,Nash,9-May-89,May-9-1989,5/9/89,5/9/89,1989,5,9,May
8477213,Tim,Schaller,16-Nov-90,Nov-16-1990,11/16/90,11/16/90,1990,11,16,Nov
8478443,Brandon,Carlo,26-Nov-96,Nov-26-1996,11/26/96,11/26/96,1996,11,26,Nov
8476891,Matt,Grzelcyk,5-Jan-94,Jan-5-1994,1/5/94,1/5/94,1994,1,5,Jan
8479325,Charlie,McAvoy,21-Dec-97,Dec-21-1997,12/21/97,12/21/97,1997,12,21,Dec
8476303,Rob,O'Gara,6-Jul-93,Jul-6-1993,7/6/93,7/6/93,1993,7,6,Jul
8475876,Zane,McIntyre,20-Aug-92,Aug-20-1992,8/20/92,8/20/92,1992,8,20,Aug
8478075,Anders,Bjork,5-Aug-96,Aug-5-1996,8/5/96,8/5/96,1996,8,5,Aug
8477529,Colby,Cave,26-Dec-94,Dec-26-1994,12/26/94,12/26/94,1994,12,26,Dec
8478498,Jake,DeBrusk,17-Oct-96,Oct-17-1996,10/17/96,10/17/96,1996,10,17,Oct
8477987,Ryan,Donato,9-Apr-96,Apr-9-1996,4/9/96,4/9/96,1996,4,9,Apr
8470041,Rick,Nash,16-Jun-84,Jun-16-1984,6/16/84,6/16/84,1984,6,16,Jun
8475224,Jordan,Szwarz,14-May-91,May-14-1991,5/14/91,5/14/91,1991,5,14,May
8474739,Tommy,Wingels,12-Apr-88,Apr-12-1988,4/12/88,4/12/88,1988,4,12,Apr
8474207,Nick,Holden,15-May-87,May-15-1987,5/15/87,5/15/87,1987,5,15,May
8474008,Paul,Carey,24-Sep-88,Sep-24-1988,9/24/88,9/24/88,1988,9,24,Sep
8475745,Charlie,Coyle,2-Mar-92,Mar-2-1992,3/2/92,3/2/92,1992,3,2,Mar
8479365,Trent,Frederic,11-Feb-98,Feb-11-1998,2/11/98,2/11/98,1998,2,11,Feb
8480901,Karson,Kuhlman,26-Sep-95,Sep-26-1995,9/26/95,9/26/95,1995,9,26,Sep
8475807,Joakim,Nordstrom,25-Feb-92,Feb-25-1992,2/25/92,2/25/92,1992,2,25,Feb
8478485,Zach,Senyshyn,30-Mar-97,Mar-30-1997,3/30/97,3/30/97,1997,3,30,Mar
8475780,Chris,Wagner,27-May-91,May-27-1991,5/27/91,5/27/91,1991,5,27,May
8477365,Connor,Clifton,28-Apr-95,Apr-28-1995,4/28/95,4/28/95,1995,4,28,Apr
8478468,Jeremy,Lauzon,28-Apr-97,Apr-28-1997,4/28/97,4/28/97,1997,4,28,Apr
8480001,Urho,Vaakanainen,1-Jan-99,Jan-1-1999,1/1/99,1/1/99,1999,1,1,Jan
8478415,Jakub,Zboril,21-Feb-97,Feb-21-1997,2/21/97,2/21/97,1997,2,21,Feb
8470860,Jaroslav,Halak,13-May-85,May-13-1985,5/13/85,5/13/85,1985,5,13,May
8476867,Brendan,Gaunce,25-Mar-94,Mar-25-1994,3/25/94,3/25/94,1994,3,25,Mar
8478888,Cameron,Hughes,9-Oct-96,Oct-9-1996,10/9/96,10/9/96,1996,10,9,Oct
8478131,Ondrej,Kase,8-Nov-95,Nov-8-1995,11/8/95,11/8/95,1995,11,8,Nov
8480944,Par,Lindholm,5-Oct-91,Oct-5-1991,10/5/91,10/5/91,1991,10,5,Oct
8476439,Brett,Ritchie,1-Jul-93,Jul-1-1993,7/1/93,7/1/93,1993,7,1,Jul
8477941,Nick,Ritchie,5-Dec-95,Dec-5-1995,12/5/95,12/5/95,1995,12,5,Dec
8480021,Jack,Studnicka,18-Feb-99,Feb-18-1999,2/18/99,2/18/99,1999,2,18,Feb
8478435,Dan,Vladar,20-Aug-97,Aug-20-1997,8/20/97,8/20/97,1997,8,20,Aug
8475735,Greg,McKegg,17-Jun-92,Jun-17-1992,6/17/92,6/17/92,1992,6,17,Jun
8475225,Craig,Smith,5-Sep-89,Sep-5-1989,9/5/89,9/5/89,1989,9,5,Sep
8479546,Oskar,Steen,9-Mar-98,Mar-9-1998,3/9/98,3/9/98,1998,3,9,Mar
8482072,Jack,Ahcan,18-May-97,May-18-1997,5/18/97,5/18/97,1997,5,18,May
8476422,Mike,Reilly,13-Jul-93,Jul-13-1993,7/13/93,7/13/93,1993,7,13,Jul
8475797,Jarred,Tinordi,20-Feb-92,Feb-20-1992,2/20/92,2/20/92,1992,2,20,Feb
8480280,Jeremy,Swayman,24-Nov-98,Nov-24-1998,11/24/98,11/24/98,1998,11,24,Nov
8476396,Steven,Fogarty,19-Apr-93,Apr-19-1993,4/19/93,4/19/93,1993,4,19,Apr
8473422,Nick,Foligno,31-Oct-87,Oct-31-1987,10/31/87,10/31/87,1987,10,31,Oct
8482834,Jesper,Froden,21-Sep-94,Sep-21-1994,9/21/94,9/21/94,1994,9,21,Sep
8483397,Marc,McLaughlin,26-Jul-99,Jul-26-1999,7/26/99,7/26/99,1999,7,26,Jul
8477384,Josh,Brown,21-Jan-94,Jan-21-1994,1/21/94,1/21/94,1994,1,21,Jan
8475762,Derek,Forbort,4-Mar-92,Mar-4-1992,3/4/92,3/4/92,1992,3,4,Mar
8477343,Tyler,Lewington,5-Dec-94,Dec-5-1994,12/5/94,12/5/94,1994,12,5,Dec
8476854,Hampus,Lindholm,20-Jan-94,Jan-20-1994,1/20/94,1/20/94,1994,1,20,Jan
8476999,Linus,Ullmark,31-Jul-93,Jul-31-1993,7/31/93,7/31/93,1993,7,31,Jul
8477903,Garnet,Hathaway,23-Nov-91,Nov-23-1991,11/23/91,11/23/91,1991,11,23,Nov
8479533,Joona,Koppanen,25-Feb-98,Feb-25-1998,2/25/98,2/25/98,1998,2,25,Feb
8480880,Jakub,Lauko,28-Mar-00,Mar-28-2000,3/28/00,3/28/00,2000,3,28,Mar
8479968,Vinni,Lettieri,6-Feb-95,Feb-6-1995,2/6/95,2/6/95,1995,2,6,Feb
8475200,Dmitry,Orlov,23-Jul-91,Jul-23-1991,7/23/91,7/23/91,1991,7,23,Jul
8471873,Anton,Stralman,1-Aug-86,Aug-1-1986,8/1/86,8/1/86,1986,8,1,Aug
8481556,John,Beecher,5-Apr-01,Apr-5-2001,4/5/01,4/5/01,2001,4,5,Apr
8479987,Morgan,Geekie,20-Jul-98,Jul-20-1998,7/20/98,7/20/98,1998,7,20,Jul
8483567,Georgii,Merkulov,10-Oct-00,Oct-10-2000,10/10/00,10/10/00,2000,10,10,Oct
8483505,Matthew,Poitras,10-Mar-04,Mar-10-2004,3/10/04,3/10/04,2004,3,10,Mar
8474037,James,van Riemsdyk,4-May-89,May-4-1989,5/4/89,5/4/89,1989,5,4,May
8482511,Mason,Lohrei,17-Jan-01,Jan-17-2001,1/17/01,1/17/01,2001,1,17,Jan
8474031,Kevin,Shattenkirk,29-Jan-89,Jan-29-1989,1/29/89,1/29/89,1989,1,29,Jan
8483548,Brandon,Bussi,25-Jun-98,Jun-25-1998,6/25/98,6/25/98,1998,6,25,Jun
8470611,Eric,Fehr,7-Sep-85,Sep-7-1985,9/7/85,9/7/85,1985,9,7,Sep
8471451,Aaron,Gagnon,24-Apr-86,Apr-24-1986,4/24/86,4/24/86,1986,4,24,Apr
8470854,Tanner,Glass,29-Nov-83,Nov-29-1983,11/29/83,11/29/83,1983,11,29,Nov
8468881,Jason,Jaffray,30-Jun-81,Jun-30-1981,6/30/81,6/30/81,1981,6,30,Jun
8474050,Brett,MacLean,24-Dec-88,Dec-24-1988,12/24/88,12/24/88,1988,12,24,Dec
8471694,Kenndal,McArdle,4-Jan-87,Jan-4-1987,1/4/87,1/4/87,1987,1,4,Jan
8468704,Antti,Miettinen,3-Jul-80,Jul-3-1980,7/3/80,7/3/80,1980,7,3,Jul
8476460,Mark,Scheifele,15-Mar-93,Mar-15-1993,3/15/93,3/15/93,1993,3,15,Mar
8469581,Kyle,Wellwood,16-May-83,May-16-1983,5/16/83,5/16/83,1983,5,16,May
8471482,Grant,Clitsome,14-Apr-85,Apr-14-1985,4/14/85,4/14/85,1985,4,14,Apr
8471978,Brett,Festerling,3-Mar-86,Mar-3-1986,3/3/86,3/3/86,1986,3,3,Mar
8470780,Mark,Flood,29-Sep-84,Sep-29-1984,9/29/84,9/29/84,1984,9,29,Sep
8470905,Randy,Jones,23-Jul-81,Jul-23-1981,7/23/81,7/23/81,1981,7,23,Jul
8466140,Olli,Jokinen,5-Dec-78,Dec-5-1978,12/5/78,12/5/78,1978,12,5,Dec
8474061,Anthony,Peluso,18-Apr-89,Apr-18-1989,4/18/89,4/18/89,1989,4,18,Apr
8471390,Mike,Santorelli,14-Dec-85,Dec-14-1985,12/14/85,12/14/85,1985,12,14,Dec
8474674,James,Wright,24-Mar-90,Mar-24-1990,3/24/90,3/24/90,1990,3,24,Mar
8474743,Zach,Redmond,26-Jul-88,Jul-26-1988,7/26/88,7/26/88,1988,7,26,Jul
8471219,Al,Montoya,13-Feb-85,Feb-13-1985,2/13/85,2/13/85,1985,2,13,Feb
8474012,John,Albert,19-Jan-89,Jan-19-1989,1/19/89,1/19/89,1989,1,19,Jan
8473564,Michael,Frolik,17-Feb-88,Feb-17-1988,2/17/88,2/17/88,1988,2,17,Feb
8474603,Eric,O'Dell,21-Jun-90,Jun-21-1990,6/21/90,6/21/90,1990,6,21,Jun
8471682,Devin,Setoguchi,1-Jan-87,Jan-1-1987,1/1/87,1/1/87,1987,1,1,Jan
8474184,Keaton,Ellerby,5-Nov-88,Nov-5-1988,11/5/88,11/5/88,1988,11,5,Nov
8475815,Julian,Melchiori,6-Dec-91,Dec-6-1991,12/6/91,12/6/91,1991,12,6,Dec
8471385,Adam,Pardy,29-Mar-84,Mar-29-1984,3/29/84,3/29/84,1984,3,29,Mar
8476885,Jacob,Trouba,26-Feb-94,Feb-26-1994,2/26/94,2/26/94,1994,2,26,Feb
8474636,Michael,Hutchinson,2-Mar-90,Mar-2-1990,3/2/90,3/2/90,1990,3,2,Mar
8474001,TJ,Galiardi,22-Apr-88,Apr-22-1988,4/22/88,4/22/88,1988,4,22,Apr
8476392,Adam,Lowry,29-Mar-93,Mar-29-1993,3/29/93,3/29/93,1993,3,29,Mar
8473618,Mathieu,Perreault,5-Jan-88,Jan-5-1988,1/5/88,1/5/88,1988,1,5,Jan
8475567,Julien,Brouillette,5-Dec-86,Dec-5-1986,12/5/86,12/5/86,1986,12,5,Dec
8469531,Jay,Harrison,3-Nov-82,Nov-3-1982,11/3/82,11/3/82,1982,11,3,Nov
8474574,Tyler,Myers,1-Feb-90,Feb-1-1990,2/1/90,2/1/90,1990,2,1,Feb
8476469,Joel,Armia,31-May-93,May-31-1993,5/31/93,5/31/93,1993,5,31,May
8477448,Marko,Dano,30-Nov-94,Nov-30-1994,11/30/94,11/30/94,1994,11,30,Nov
8477940,Nikolaj,Ehlers,14-Feb-96,Feb-14-1996,2/14/96,2/14/96,1996,2,14,Feb
8476910,Scott,Kosmachuk,24-Jan-94,Jan-24-1994,1/24/94,1/24/94,1994,1,24,Jan
8477076,JC,Lipon,10-Jul-93,Jul-10-1993,7/10/93,7/10/93,1993,7,10,Jul
8477464,Nic,Petan,22-Mar-95,Mar-22-1995,3/22/95,3/22/95,1995,3,22,Mar
8479293,Brandon,Tanev,31-Dec-91,Dec-31-1991,12/31/91,12/31/91,1991,12,31,Dec
8477504,Josh,Morrissey,28-Mar-95,Mar-28-1995,3/28/95,3/28/95,1995,3,28,Mar
8476945,Connor,Hellebuyck,19-May-93,May-19-1993,5/19/93,5/19/93,1993,5,19,May
8478398,Kyle,Connor,9-Dec-96,Dec-9-1996,12/9/96,12/9/96,1996,12,9,Dec
8475769,Quinton,Howden,21-Jan-92,Jan-21-1992,1/21/92,1/21/92,1992,1,21,Jan
8479339,Patrik,Laine,19-Apr-98,Apr-19-1998,4/19/98,4/19/98,1998,4,19,Apr
8473574,Shawn,Matthias,19-Feb-88,Feb-19-1988,2/19/88,2/19/88,1988,2,19,Feb
8478458,Jack,Roslovic,29-Jan-97,Jan-29-1997,1/29/97,1/29/97,1997,1,29,Jan
8478031,Nelson,Nogier,27-May-96,May-27-1996,5/27/96,5/27/96,1996,5,27,May
8473565,Brian,Strait,4-Jan-88,Jan-4-1988,1/4/88,1/4/88,1988,1,4,Jan
8468611,Matt,Hendricks,17-Jun-81,Jun-17-1981,6/17/81,6/17/81,1981,6,17,Jun
8477962,Brendan,Lemieux,15-Mar-96,Mar-15-1996,3/15/96,3/15/96,1996,3,15,Mar
8471669,Paul,Stastny,27-Dec-85,Dec-27-1985,12/27/85,12/27/85,1985,12,27,Dec
8478915,Sami,Niku,10-Oct-96,Oct-10-1996,10/10/96,10/10/96,1996,10,10,Oct
8477359,Tucker,Poolman,8-Jun-93,Jun-8-1993,6/8/93,6/8/93,1993,6,8,Jun
8473461,Steve,Mason,29-May-88,May-29-1988,5/29/88,5/29/88,1988,5,29,May
8478891,Mason,Appleton,15-Jan-96,Jan-15-1996,1/15/96,1/15/96,1996,1,15,Jan
8475763,Kevin,Hayes,8-May-92,May-8-1992,5/8/92,5/8/92,1992,5,8,May
8480005,Kristian,Vesalainen,1-Jun-99,Jun-1-1999,6/1/99,6/1/99,1999,6,1,Jun
8476470,Nathan,Beaulieu,5-Dec-92,Dec-5-1992,12/5/92,12/5/92,1992,12,5,Dec
8476799,Cameron,Schilling,7-Oct-88,Oct-7-1988,10/7/88,10/7/88,1988,10,7,Oct
8476316,Laurent,Brossoit,23-Mar-93,Mar-23-1993,3/23/93,3/23/93,1993,3,23,Mar
8475268,Gabriel,Bourque,23-Sep-90,Sep-23-1990,9/23/90,9/23/90,1990,9,23,Sep
8481642,Andrei,Chibisov,26-Feb-93,Feb-26-1993,2/26/93,2/26/93,1993,2,26,Feb
8475236,Cody,Eakin,24-May-91,May-24-1991,5/24/91,5/24/91,1991,5,24,May
8481019,David,Gustafsson,11-Apr-00,Apr-11-2000,4/11/00,4/11/00,2000,4,11,Apr
8478424,Jansen,Harkins,23-May-97,May-23-1997,5/23/97,5/23/97,1997,5,23,May
8473914,Mark,Letestu,4-Feb-85,Feb-4-1985,2/4/85,2/4/85,1985,2,4,Feb
8481649,Joona,Luoto,26-Sep-97,Sep-26-1997,9/26/97,9/26/97,1997,9,26,Sep
8476400,Logan,Shaw,5-Oct-92,Oct-5-1992,10/5/92,10/5/92,1992,10,5,Oct
8476406,Nicholas,Shore,26-Sep-92,Sep-26-1992,9/26/92,9/26/92,1992,9,26,Sep
8478058,CJ,Suess,17-Mar-94,Mar-17-1994,3/17/94,3/17/94,1994,3,17,Mar
8475868,Anthony,Bitetto,15-Jul-90,Jul-15-1990,7/15/90,7/15/90,1990,7,15,Jul
8477472,Carl,Dahlstrom,28-Jan-95,Jan-28-1995,1/28/95,1/28/95,1995,1,28,Jan
8476331,Dylan,DeMelo,1-May-93,May-1-1993,5/1/93,5/1/93,1993,5,1,May
8481572,Ville,Heinola,2-Mar-01,Mar-2-2001,3/2/01,3/2/01,2001,3,2,Mar
8480145,Neal,Pionk,29-Jul-95,Jul-29-1995,7/29/95,7/29/95,1995,7,29,Jul
8474579,Luca,Sbisa,30-Jan-90,Jan-30-1990,1/30/90,1/30/90,1990,1,30,Jan
8479400,Pierre-Luc,Dubois,24-Jun-98,Jun-24-1998,6/24/98,6/24/98,1998,6,24,Jun
8473453,Trevor,Lewis,8-Jan-87,Jan-8-1987,1/8/87,1/8/87,1987,1,8,Jan
8476952,Dominic,Toninato,9-Mar-94,Mar-9-1994,3/9/94,3/9/94,1994,3,9,Mar
8474818,Jordie,Benn,26-Jul-87,Jul-26-1987,7/26/87,7/26/87,1987,7,26,Jul
8479378,Logan,Stanley,26-May-98,May-26-1998,5/26/98,5/26/98,1998,5,26,May
8480289,Morgan,Barron,2-Dec-98,Dec-2-1998,12/2/98,12/2/98,1998,12,2,Dec
8478996,Adam,Brooks,6-May-96,May-6-1996,5/6/96,5/6/96,1996,5,6,May
8479591,Michael,Eyssimont,9-Sep-96,Sep-9-1996,9/9/96,9/9/96,1996,9,9,Sep
8482408,Jeff,Malott,7-Aug-96,Aug-7-1996,8/7/96,8/7/96,1996,8,7,Aug
8482149,Cole,Perfetti,1-Jan-02,Jan-1-2002,1/1/02,1/1/02,2002,1,1,Jan
8478040,Austin,Poganski,16-Feb-96,Feb-16-1996,2/16/96,2/16/96,1996,2,16,Feb
8480443,Kristian,Reichel,11-Jun-98,Jun-11-1998,6/11/98,6/11/98,1998,6,11,Jun
8477482,Zach,Sanford,9-Nov-94,Nov-9-1994,11/9/94,11/9/94,1994,11,9,Nov
8480990,Declan,Chisholm,12-Jan-00,Jan-12-2000,1/12/00,1/12/00,2000,1,12,Jan
8475455,Brenden,Dillon,13-Nov-90,Nov-13-1990,11/13/90,11/13/90,1990,11,13,Nov
8480192,Johnathan,Kovacevic,12-Jul-97,Jul-12-1997,7/12/97,7/12/97,1997,7,12,Jul
8480049,Dylan,Samberg,24-Jan-99,Jan-24-1999,1/24/99,1/24/99,1999,1,24,Jan
8477220,Nate,Schmidt,16-Jul-91,Jul-16-1991,7/16/91,7/16/91,1991,7,16,Jul
8479536,Axel,Jonsson-Fjallby,10-Feb-98,Feb-10-1998,2/10/98,2/10/98,1998,2,10,Feb
8477357,Saku,Maenalanen,29-May-94,May-29-1994,5/29/94,5/29/94,1994,5,29,May
8475799,Nino,Niederreiter,8-Sep-92,Sep-8-1992,9/8/92,9/8/92,1992,9,8,Sep
8478831,Kevin,Stenlund,20-Sep-96,Sep-20-1996,9/20/96,9/20/96,1996,9,20,Sep
8478476,Kyle,Capobianco,13-Aug-97,Aug-13-1997,8/13/97,8/13/97,1997,8,13,Aug
8479496,David,Rittich,19-Aug-92,Aug-19-1992,8/19/92,8/19/92,1992,8,19,Aug
8480113,Alex,Iafallo,21-Dec-93,Dec-21-1993,12/21/93,12/21/93,1993,12,21,Dec
8480845,Rasmus,Kupari,15-Mar-00,Mar-15-2000,3/15/00,3/15/00,2000,3,15,Mar
8480014,Gabriel,Vilardi,16-Aug-99,Aug-16-1999,8/16/99,8/16/99,1999,8,16,Aug
8445662,Steve,Bozek,26-Nov-60,Nov-26-1960,11/26/60,11/26/60,1960,11,26,Nov
8445728,David,Bruce,7-Oct-64,Oct-7-1964,10/7/64,10/7/64,1964,10,7,Oct
8455949,Edward,Courtenay,2-Feb-68,Feb-2-1968,2/2/68,2/2/68,1968,2,2,Feb
8446210,Craig,Coxe,21-Jan-64,Jan-21-1964,1/21/64,1/21/64,1964,1,21,Jan
8458711,Dale,Craigwell,24-Apr-71,Apr-24-1971,4/24/71,4/24/71,1971,4,24,Apr
8458516,Pat,Falloon,22-Sep-72,Sep-22-1972,9/22/72,9/22/72,1972,9,22,Sep
8458808,Mikhail,Kravets,12-Nov-63,Nov-12-1963,11/12/63,11/12/63,1963,11,12,Nov
8450523,Wayne,Presley,23-Mar-65,Mar-23-1965,3/23/65,3/23/65,1965,3,23,Mar
8457747,Jean-Francois,Quintin,28-May-69,May-28-1969,5/28/69,5/28/69,1969,5,28,May
8451596,Dave,Snuggerud,20-Jun-66,Jun-20-1966,6/20/66,6/20/66,1966,6,20,Jun
8455911,Michael,Colman,4-Aug-68,Aug-4-1968,8/4/68,8/4/68,1968,8,4,Aug
8448794,Rick,Lessard,9-Jan-68,Jan-9-1968,1/9/68,1/9/68,1968,1,9,Jan
8457974,Claudio,Scremin,28-May-68,May-28-1968,5/28/68,5/28/68,1968,5,28,May
8458504,David,Williams,25-Aug-67,Aug-25-1967,8/25/67,8/25/67,1967,8,25,Aug
8452489,Doug,Wilson,5-Jul-57,Jul-5-1957,7/5/57,7/5/57,1957,7,5,Jul
8456264,Wade,Flaherty,11-Jan-68,Jan-11-1968,1/11/68,1/11/68,1968,1,11,Jan
8456692,Arturs,Irbe,2-Feb-67,Feb-2-1967,2/2/67,2/2/67,1967,2,2,Feb
8445335,Robin,Bawa,23-Jun-66,Jun-23-1966,6/23/66,6/23/66,1966,6,23,Jun
8458761,Mark,Beaufait,13-May-70,May-13-1970,5/13/70,5/13/70,1970,5,13,May
8456347,Rob,Gaudreau,20-Jan-70,Jan-20-1970,1/20/70,1/20/70,1970,1,20,Jan
8449412,Hubie,Mcdonough,7-Aug-63,Aug-7-1963,8/7/63,8/7/63,1963,8,7,Aug
8458647,Jaroslav,Otevrel,16-Sep-68,Sep-16-1968,9/16/68,9/16/68,1968,9,16,Sep
8458559,Dody,Wood,18-Mar-72,Mar-18-1972,3/18/72,3/18/72,1972,3,18,Mar
8458507,Peter,Ahola,14-May-68,May-14-1968,5/14/68,5/14/68,1968,5,14,May
8458544,Sandis,Ozolinsh,3-Aug-72,Aug-3-1972,8/3/72,8/3/72,1972,8,3,Aug
8457642,Tom,Pederson,14-Jan-70,Jan-14-1970,1/14/70,1/14/70,1970,1,14,Jan
8458492,Doug,Zmolek,3-Nov-70,Nov-3-1970,11/3/70,11/3/70,1970,11,3,Nov
8455752,Viacheslav,Butsayev,13-Jun-70,Jun-13-1970,6/13/70,6/13/70,1970,6,13,Jun
8445918,Dave,Capuano,27-Jul-68,Jul-27-1968,7/27/68,7/27/68,1968,7,27,Jul
8456183,Gary,Emmons,20-Dec-63,Dec-20-1963,12/20/63,12/20/63,1963,12,20,Dec
8449163,Sergei,Makarov,19-Jun-58,Jun-19-1958,6/19/58,6/19/58,1958,6,19,Jun
8458755,Jeff,Mclean,6-Oct-69,Oct-6-1969,10/6/69,10/6/69,1969,10,6,Oct
8458940,Mike,Rathje,11-May-74,May-11-1974,5/11/74,5/11/74,1974,5,11,May
8459059,Michal,Sykora,5-Jul-73,Jul-5-1973,7/5/73,7/5/73,1973,7,5,Jul
8452246,Jimmy,Waite,15-Apr-69,Apr-15-1969,4/15/69,4/15/69,1969,4,15,Apr
8459683,Ilya,Byakin,2-Feb-63,Feb-2-1963,2/2/63,2/2/63,1963,2,2,Feb
8445712,Dave,Brown,12-Oct-62,Oct-12-1962,10/12/62,10/12/62,1962,10,12,Oct
8459011,Jan,Caloun,20-Dec-72,Dec-20-1972,12/20/72,12/20/72,1972,12,20,Dec
8459479,Ville,Peltonen,24-May-73,May-24-1973,5/24/73,5/24/73,1973,5,24,May
8460558,Alexei,Yegorov,21-May-75,May-21-1975,5/21/75,5/21/75,1975,5,21,May
8459035,Marcus,Ragnarsson,13-Aug-71,Aug-13-1971,8/13/71,8/13/71,1971,8,13,Aug
8457928,Geoff,Sarjeant,30-Nov-69,Nov-30-1969,11/30/69,11/30/69,1969,11,30,Nov
8446733,Todd,Ewen,22-Mar-66,Mar-22-1966,3/22/66,3/22/66,1966,3,22,Mar
8447350,Tony,Granato,25-Jul-64,Jul-25-1964,7/25/64,7/25/64,1964,7,25,Jul
8458879,Chris,Lipuma,23-Mar-71,Mar-23-1971,3/23/71,3/23/71,1971,3,23,Mar
8459112,Jason,Widmer,1-Aug-73,Aug-1-1973,8/1/73,8/1/73,1973,8,1,Aug
8445386,Ed,Belfour,21-Apr-65,Apr-21-1965,4/21/65,4/21/65,1965,4,21,Apr
8448020,Kelly,Hrudey,13-Jan-61,Jan-13-1961,1/13/61,1/13/61,1961,1,13,Jan
8460629,Alexander,Korolyuk,15-Jan-76,Jan-15-1976,1/15/76,1/15/76,1976,1,15,Jan
8448834,Dave,Lowry,14-Feb-65,Feb-14-1965,2/14/65,2/14/65,1965,2,14,Feb
8466139,Patrick,Marleau,15-Sep-79,Sep-15-1979,9/15/79,9/15/79,1979,9,15,Sep
8449295,Stephane,Matteau,2-Sep-69,Sep-2-1969,9/2/69,9/2/69,1969,9,2,Sep
8459332,Barry,Potomski,24-Nov-72,Nov-24-1972,11/24/72,11/24/72,1972,11,24,Nov
8447979,Bill,Houlder,11-Mar-67,Mar-11-1967,3/11/67,3/11/67,1967,3,11,Mar
8446303,Vincent,Damphousse,17-Dec-67,Dec-17-1967,12/17/67,12/17/67,1967,12,17,Dec
8459256,Alex,Hicks,4-Sep-69,Sep-4-1969,9/4/69,9/4/69,1969,9,4,Sep
8451709,Ronnie,Stern,11-Jan-67,Jan-11-1967,1/11/67,1/11/67,1967,1,11,Jan
8466158,Scott,Hannan,23-Jan-79,Jan-23-1979,1/23/79,1/23/79,1979,1,23,Jan
8451804,Gary,Suter,24-Jun-64,Jun-24-1964,6/24/64,6/24/64,1964,6,24,Jun
8458693,Sean,Gauthier,28-Mar-71,Mar-28-1971,3/28/71,3/28/71,1971,3,28,Mar
8459431,Todd,Harvey,17-Feb-75,Feb-17-1975,2/17/75,2/17/75,1975,2,17,Feb
8459430,Niklas,Sundstrom,6-Jun-75,Jun-6-1975,6/6/75,6/6/75,1975,6,6,Jun
8460705,Evgeni,Nabokov,25-Jul-75,Jul-25-1975,7/25/75,7/25/75,1975,7,25,Jul
8465059,Matt,Bradley,13-Jun-78,Jun-13-1978,6/13/78,6/13/78,1978,6,13,Jun
8456903,Paul,Kruse,15-Mar-70,Mar-15-1970,3/15/70,3/15/70,1970,3,15,Mar
8459412,Jim,Montgomery,30-Jun-69,Jun-30-1969,6/30/69,6/30/69,1969,6,30,Jun
8466343,Mark,Smith,24-Oct-77,Oct-24-1977,10/24/77,10/24/77,1977,10,24,Oct
8451972,Scott,Thornton,9-Jan-71,Jan-9-1971,1/9/71,1/9/71,1971,1,9,Jan
8462147,Miikka,Kiprusoff,26-Oct-76,Oct-26-1976,10/26/76,10/26/76,1976,10,26,Oct
8468130,Hannes,Hyvonen,29-Aug-75,Aug-29-1975,8/29/75,8/29/75,1975,8,29,Aug
8455505,Steve,Bancroft,6-Oct-70,Oct-6-1970,10/6/70,10/6/70,1970,10,6,Oct
8462117,Vesa,Toskala,20-May-77,May-20-1977,5/20/77,5/20/77,1977,5,20,May
8467357,Jonathan,Cheechoo,15-Jul-80,Jul-15-1980,7/15/80,7/15/80,1980,7,15,Jul
8468028,Niko,Dimitrakos,21-May-79,May-21-1979,5/21/79,5/21/79,1979,5,21,May
8462227,Ryan,Kraft,7-Nov-75,Nov-7-1975,11/7/75,11/7/75,1975,11,7,Nov
8468150,Lynn,Loyns,22-Feb-81,Feb-22-1981,2/22/81,2/22/81,1981,2,22,Feb
8462105,Alyn,McCauley,29-May-77,May-29-1977,5/29/77,5/29/77,1977,5,29,May
8468726,Chad,Wiseman,25-Mar-81,Mar-25-1981,3/25/81,3/25/81,1981,3,25,Mar
8467438,Miroslav,Zalesak,2-Jan-80,Jan-2-1980,1/2/80,1/2/80,1980,1,2,Jan
8467475,Jesse,Fibiger,4-Apr-78,Apr-4-1978,4/4/78,4/4/78,1978,4,4,Apr
8459522,John,Jakopin,16-May-75,May-16-1975,5/16/75,5/16/75,1975,5,16,May
8460534,Curtis,Brown,12-Feb-76,Feb-12-1976,2/12/76,2/12/76,1976,2,12,Feb
8460595,Nisse,Ekman,11-Mar-76,Mar-11-1976,3/11/76,3/11/76,1976,3,11,Mar
8469473,Marcel,Goc,24-Aug-83,Aug-24-1983,8/24/83,8/24/83,1983,8,24,Aug
8470599,Milan,Michalek,7-Dec-84,Dec-7-1984,12/7/84,12/7/84,1984,12,7,Dec
8465016,Scott,Parker,29-Jan-78,Jan-29-1978,1/29/78,1/29/78,1978,1,29,Jan
8469555,Christian,Ehrhoff,6-Jul-82,Jul-6-1982,7/6/82,7/6/82,1982,7,6,Jul
8457222,Jason,Marshall,22-Feb-71,Feb-22-1971,2/22/71,2/22/71,1971,2,22,Feb
8470575,Tom,Preissing,3-Dec-78,Dec-3-1978,12/3/78,12/3/78,1978,12,3,Dec
8466210,Ville,Nieminen,6-Apr-77,Apr-6-1977,4/6/77,4/6/77,1977,4,6,Apr
8470574,Grant,Stevenson,15-Oct-81,Oct-15-1981,10/15/81,10/15/81,1981,10,15,Oct
8467931,Matt,Carkner,3-Nov-80,Nov-3-1980,11/3/80,11/3/80,1980,11,3,Nov
8470640,Matt,Carle,25-Sep-84,Sep-25-1984,9/25/84,9/25/84,1984,9,25,Sep
8470324,Josh,Gorges,14-Aug-84,Aug-14-1984,8/14/84,8/14/84,1984,8,14,Aug
8468114,Douglas,Murray,12-Mar-80,Mar-12-1980,3/12/80,3/12/80,1980,3,12,Mar
8468646,Nolan,Schaefer,15-Jan-80,Jan-15-1980,1/15/80,1/15/80,1980,1,15,Jan
8467335,Mark,Bell,5-Aug-80,Aug-5-1980,8/5/80,8/5/80,1980,8,5,Aug
8468463,Mathieu,Darche,26-Nov-76,Nov-26-1976,11/26/76,11/26/76,1976,11,26,Nov
8459640,Mike,Grier,5-Jan-75,Jan-5-1975,1/5/75,1/5/75,1975,1,5,Jan
8470794,Joe,Pavelski,11-Jul-84,Jul-11-1984,7/11/84,7/11/84,1984,7,11,Jul
8469587,Tomas,Plihal,28-Mar-83,Mar-28-1983,3/28/83,3/28/83,1983,3,28,Mar
8459004,Craig,Rivet,13-Sep-74,Sep-13-1974,9/13/74,9/13/74,1974,9,13,Sep
8471709,Marc-Edouard,Vlasic,30-Mar-87,Mar-30-1987,3/30/87,3/30/87,1987,3,30,Mar
8469629,Tom,Cavanagh,24-Mar-82,Mar-24-1982,3/24/82,3/24/82,1982,3,24,Mar
8471641,Mike,Iggulden,9-Nov-82,Nov-9-1982,11/9/82,11/9/82,1982,11,9,Nov
8471235,Lukas,Kaspar,23-Sep-85,Sep-23-1985,9/23/85,9/23/85,1985,9,23,Sep
8471338,Torrey,Mitchell,30-Jan-85,Jan-30-1985,1/30/85,1/30/85,1985,1,30,Jan
8450978,Jeremy,Roenick,17-Jan-70,Jan-17-1970,1/17/70,1/17/70,1970,1,17,Jan
8462535,Jody,Shelley,7-Feb-76,Feb-7-1976,2/7/76,2/7/76,1976,2,7,Feb
8466285,Brian,Campbell,23-May-79,May-23-1979,5/23/79,5/23/79,1979,5,23,May
8467909,Alexei,Semenov,10-Apr-81,Apr-10-1981,4/10/81,4/10/81,1981,4,10,Apr
8462052,Brian,Boucher,2-Jan-77,Jan-2-1977,1/2/77,1/2/77,1977,1,2,Jan
8469556,Dimitri,Patzold,3-Feb-83,Feb-3-1983,2/3/83,2/3/83,1983,2,3,Feb
8471516,Riley,Armstrong,8-Nov-84,Nov-8-1984,11/8/84,11/8/84,1984,11,8,Nov
8473465,Jamie,McGinn,5-Aug-88,Aug-5-1988,8/5/88,8/5/88,1988,8,5,Aug
8468635,Travis,Moen,6-Apr-82,Apr-6-1982,4/6/82,4/6/82,1982,4,6,Apr
8471521,Brad,Staubitz,28-Jul-84,Jul-28-1984,7/28/84,7/28/84,1984,7,28,Jul
8472215,Ryan,Vesce,7-Apr-82,Apr-7-1982,4/7/82,4/7/82,1982,4,7,Apr
8445550,Rob,Blake,10-Dec-69,Dec-10-1969,12/10/69,12/10/69,1969,12,10,Dec
8467096,Dan,Boyle,12-Jul-76,Jul-12-1976,7/12/76,7/12/76,1976,7,12,Jul
8471810,Derek,Joslin,17-Mar-87,Mar-17-1987,3/17/87,3/17/87,1987,3,17,Mar
8474053,Logan,Couture,28-Mar-89,Mar-28-1989,3/28/89,3/28/89,1989,3,28,Mar
8473600,Benn,Ferriero,29-Apr-87,Apr-29-1987,4/29/87,4/29/87,1987,4,29,Apr
8470131,Dwight,Helminen,22-Jun-83,Jun-22-1983,6/22/83,6/22/83,1983,6,22,Jun
8467334,Manny,Malhotra,18-May-80,May-18-1980,5/18/80,5/18/80,1980,5,18,May
8473562,John,McCarthy,9-Aug-86,Aug-9-1986,8/9/86,8/9/86,1986,8,9,Aug
8473712,Frazer,McLaren,29-Oct-87,Oct-29-1987,10/29/87,10/29/87,1987,10,29,Oct
8459687,Scott,Nichol,31-Dec-74,Dec-31-1974,12/31/74,12/31/74,1974,12,31,Dec
8470580,Jed,Ortmeyer,3-Sep-78,Sep-3-1978,9/3/78,9/3/78,1978,9,3,Sep
8470086,Joe,Callahan,20-Dec-82,Dec-20-1982,12/20/82,12/20/82,1982,12,20,Dec
8474218,Jason,Demers,9-Jun-88,Jun-9-1988,6/9/88,6/9/88,1988,6,9,Jun
8468577,Niclas,Wallin,20-Feb-75,Feb-20-1975,2/20/75,2/20/75,1975,2,20,Feb
8471956,Andrew,Desjardins,27-Jul-86,Jul-27-1986,7/27/86,7/27/86,1986,7,27,Jul
8474850,Brandon,Mashinter,20-Sep-88,Sep-20-1988,9/20/88,9/20/88,1988,9,20,Sep
8459514,Jamal,Mayers,24-Oct-74,Oct-24-1974,10/24/74,10/24/74,1974,10,24,Oct
8474027,Justin,Braun,10-Feb-87,Feb-10-1987,2/10/87,2/10/87,1987,2,10,Feb
8474531,Mike,Moore,12-Dec-84,Dec-12-1984,12/12/84,12/12/84,1984,12,12,Dec
8474550,Antti,Niemi,29-Aug-83,Aug-29-1983,8/29/83,8/29/83,1983,8,29,Aug
8467511,Antero,Niittymaki,18-Jun-80,Jun-18-1980,6/18/80,6/18/80,1980,6,18,Jun
8471774,Alex,Stalock,28-Jul-87,Jul-28-1987,7/28/87,7/28/87,1987,7,28,Jul
8462129,Michal,Handzus,11-Mar-77,Mar-11-1977,3/11/77,3/11/77,1977,3,11,Mar
8469685,Andrew,Murray,6-Nov-81,Nov-6-1981,11/6/81,11/6/81,1981,11,6,Nov
8468515,Brad,Winchester,1-Mar-81,Mar-1-1981,3/1/81,3/1/81,1981,3,1,Mar
8471476,Daniel,Winnik,6-Mar-85,Mar-6-1985,3/6/85,3/6/85,1985,3,6,Mar
8470613,Brent,Burns,9-Mar-85,Mar-9-1985,3/9/85,3/9/85,1985,3,9,Mar
8468213,Jim,Vandermeer,21-Feb-80,Feb-21-1980,2/21/80,2/21/80,1980,2,21,Feb
8470063,Adam,Burish,6-Jan-83,Jan-6-1983,1/6/83,1/6/83,1983,1,6,Jan
8471996,Bracken,Kearns,12-May-81,May-12-1981,5/12/81,5/12/81,1981,5,12,May
8471842,Tim,Kennedy,30-Apr-86,Apr-30-1986,4/30/86,4/30/86,1986,4,30,Apr
8471700,Matt,Pelech,4-Sep-87,Sep-4-1987,9/4/87,9/4/87,1987,9,4,Sep
8473536,James,Sheppard,25-Apr-88,Apr-25-1988,4/25/88,4/25/88,1988,4,25,Apr
8468485,Raffi,Torres,8-Oct-81,Oct-8-1981,10/8/81,10/8/81,1981,10,8,Oct
8474032,Nick,Petrecki,11-Jul-89,Jul-11-1989,7/11/89,7/11/89,1989,7,11,Jul
8471371,Mike,Brown,24-Jun-85,Jun-24-1985,6/24/85,6/24/85,1985,6,24,Jun
8475878,Freddie,Hamilton,1-Jan-92,Jan-1-1992,1/1/92,1/1/92,1992,1,1,Jan
8477227,Eriah,Hayes,7-Jul-88,Jul-7-1988,7/7/88,7/7/88,1988,7,7,Jul
8476881,Tomas,Hertl,12-Nov-93,Nov-12-1993,11/12/93,11/12/93,1993,11,12,Nov
8476442,Matt,Nieto,5-Nov-92,Nov-5-1992,11/5/92,11/5/92,1992,11,5,Nov
8476624,Barclay,Goodrow,26-Feb-93,Feb-26-1993,2/26/93,2/26/93,1993,2,26,Feb
8474230,Micheal,Haley,30-Mar-86,Mar-30-1986,3/30/86,3/30/86,1986,3,30,Mar
8477922,Melker,Karlsson,18-Jul-90,Jul-18-1990,7/18/90,7/18/90,1990,7,18,Jul
8474516,Bryan,Lerg,20-Jan-86,Jan-20-1986,1/20/86,1/20/86,1986,1,20,Jan
8475775,Tye,McGinn,29-Jul-90,Jul-29-1990,7/29/90,7/29/90,1990,7,29,Jul
8473722,John,Scott,26-Sep-82,Sep-26-1982,9/26/82,9/26/82,1982,9,26,Sep
8474727,Ben,Smith,11-Jul-88,Jul-11-1988,7/11/88,7/11/88,1988,7,11,Jul
8476549,Daniil,Tarasov,20-Jun-91,Jun-20-1991,6/20/91,6/20/91,1991,6,20,Jun
8476166,Taylor,Fedun,4-Jun-88,Jun-4-1988,6/4/88,6/4/88,1988,6,4,Jun
8477234,Troy,Grosenick,27-Aug-89,Aug-27-1989,8/27/89,8/27/89,1989,8,27,Aug
8477846,Ryan,Carpenter,18-Jan-91,Jan-18-1991,1/18/91,1/18/91,1991,1,18,Jan
8475820,Joonas,Donskoi,13-Apr-92,Apr-13-1992,4/13/92,4/13/92,1992,4,13,Apr
8477958,Nikolay,Goldobin,7-Oct-95,Oct-7-1995,10/7/95,10/7/95,1995,10,7,Oct
8474096,Nick,Spaling,19-Sep-88,Sep-19-1988,9/19/88,9/19/88,1988,9,19,Sep
8468208,Joel,Ward,2-Dec-80,Dec-2-1980,12/2/80,12/2/80,1980,12,2,Dec
8471392,Roman,Polak,28-Apr-86,Apr-28-1986,4/28/86,4/28/86,1986,4,28,Apr
8474889,Martin,Jones,10-Jan-90,Jan-10-1990,1/10/90,1/10/90,1990,1,10,Jan
8474571,Mikkel,Boedker,16-Dec-89,Dec-16-1989,12/16/89,12/16/89,1989,12,16,Dec
8471498,Jannik,Hansen,15-Mar-86,Mar-15-1986,3/15/86,3/15/86,1986,3,15,Mar
8478099,Kevin,Labanc,12-Dec-95,Dec-12-1995,12/12/95,12/12/95,1995,12,12,Dec
8476982,Danny,O'Regan,30-Jan-94,Jan-30-1994,1/30/94,1/30/94,1994,1,30,Jan
8475834,Marcus,Sorensen,7-Apr-92,Apr-7-1992,4/7/92,4/7/92,1992,4,7,Apr
8475841,Tim,Heed,27-Jan-91,Jan-27-1991,1/27/91,1/27/91,1991,1,27,Jan
8479580,Dylan,Gambrell,26-Aug-96,Aug-26-1996,8/26/96,8/26/96,1996,8,26,Aug
8477046,Joakim,Ryan,17-Jun-93,Jun-17-1993,6/17/93,6/17/93,1993,6,17,Jun
8478078,Rourke,Chartier,3-Apr-96,Apr-3-1996,4/3/96,4/3/96,1996,4,3,Apr
8480780,Lukas,Radil,5-Aug-90,Aug-5-1990,8/5/90,8/5/90,1990,8,5,Aug
8480965,Antti,Suomela,17-Mar-94,Mar-17-1994,3/17/94,3/17/94,1994,3,17,Mar
8474578,Erik,Karlsson,31-May-90,May-31-1990,5/31/90,5/31/90,1990,5,31,May
8478136,Jake,Middleton,2-Jan-96,Jan-2-1996,1/2/96,1/2/96,1996,1,2,Jan
8480160,Radim,Simek,20-Sep-92,Sep-20-1992,9/20/92,9/20/92,1992,9,20,Sep
8481640,Lean,Bergmann,4-Oct-98,Oct-4-1998,10/4/98,10/4/98,1998,10,4,Oct
8479571,Joachim,Blichfeld,17-Jul-98,Jul-17-1998,7/17/98,7/17/98,1998,7,17,Jul
8477380,Jonny,Brodzinski,19-Jun-93,Jun-19-1993,6/19/93,6/19/93,1993,6,19,Jun
8479393,Noah,Gregor,28-Jul-98,Jul-28-1998,7/28/98,7/28/98,1998,7,28,Jul
8481516,Joel,Kellman,25-May-94,May-25-1994,5/25/94,5/25/94,1994,5,25,May
8477983,Maxim,Letunov,20-Feb-96,Feb-20-1996,2/20/96,2/20/96,1996,2,20,Feb
8480384,Alexander,TRUE,17-Jul-97,Jul-17-1997,7/17/97,7/17/97,1997,7,17,Jul
8481515,Danil,Yurtaykin,1-Jul-97,Jul-1-1997,7/1/97,7/1/97,1997,7,1,Jul
8476953,Trevor,Carrick,4-Jul-94,Jul-4-1994,7/4/94,7/4/94,1994,7,4,Jul
8475869,Brandon,Davidson,21-Aug-91,Aug-21-1991,8/21/91,8/21/91,1991,8,21,Aug
8479983,Mario,Ferraro,17-Sep-98,Sep-17-1998,9/17/98,9/17/98,1998,9,17,Sep
8481812,Nikolai,Knyzhov,20-Mar-98,Mar-20-1998,3/20/98,3/20/98,1998,3,20,Mar
8478870,Rudolfs,Balcers,8-Apr-97,Apr-8-1997,4/8/97,4/8/97,1997,4,8,Apr
8482222,Alexander,Barabanov,17-Jun-94,Jun-17-1994,6/17/94,6/17/94,1994,6,17,Jun
8480276,Ivan,Chekhovich,4-Jan-99,Jan-4-1999,1/4/99,1/4/99,1999,1,4,Jan
8480053,Sasha,Chmelevski,9-Jun-99,Jun-9-1999,6/9/99,6/9/99,1999,6,9,Jun
8482248,Fredrik ,Handemark,27-Aug-93,Aug-27-1993,8/27/93,8/27/93,1993,8,27,Aug
8481077,John,Leonard,7-Aug-98,Aug-7-1998,8/7/98,8/7/98,1998,8,7,Aug
8479705,Jeffrey,Viel,28-Jan-97,Jan-28-1997,1/28/97,1/28/97,1997,1,28,Jan
8478467,Nicolas,Meloche,18-Jul-97,Jul-18-1997,7/18/97,7/18/97,1997,7,18,Jul
8482369,Brinson,Pasichnuk,24-Nov-97,Nov-24-1997,11/24/97,11/24/97,1997,11,24,Nov
8474688,Greg,Pateryn,20-Jun-90,Jun-20-1990,6/20/90,6/20/90,1990,6,20,Jun
8471227,Devan,Dubnyk,4-May-86,May-4-1986,5/4/86,5/4/86,1986,5,4,May
8480373,Josef,Korenar,31-Jan-98,Jan-31-1998,1/31/98,1/31/98,1998,1,31,Jan
8482246,Alexei,Melnichuk,29-Jun-98,Jun-29-1998,6/29/98,6/29/98,1998,6,29,Jun
8474009,Nick,Bonino,20-Apr-88,Apr-20-1988,4/20/88,4/20/88,1988,4,20,Apr
8482133,Thomas,Bordeleau,3-Jan-02,Jan-3-2002,1/3/02,1/3/02,2002,1,3,Jan
8471699,Andrew,Cogliano,14-Jun-87,Jun-14-1987,6/14/87,6/14/87,1987,6,14,Jun
8479373,Jonathan,Dahlen,20-Dec-97,Dec-20-1997,12/20/97,12/20/97,1997,12,20,Dec
8476288,Ryan,Dzingel,9-Mar-92,Mar-9-1992,3/9/92,3/9/92,1992,3,9,Mar
8482667,William,Eklund,12-Oct-02,Oct-12-2002,10/12/02,10/12/02,2002,10,12,Oct
8479981,Jonah,Gadjovich,12-Oct-98,Oct-12-1998,10/12/98,10/12/98,1998,10,12,Oct
8480304,Jayden,Halbgewachs,22-Mar-97,Mar-22-1997,3/22/97,3/22/97,1997,3,22,Mar
8478967,Lane,Pederson,4-Aug-97,Aug-4-1997,8/4/97,8/4/97,1997,8,4,Aug
8482197,Adam,Raska,25-Sep-01,Sep-25-2001,9/25/01,9/25/01,2001,9,25,Sep
8480060,Scott,Reedy,4-Apr-99,Apr-4-1999,4/4/99,4/4/99,1999,4,4,Apr
8481061,Jasper,Weatherby,22-Jan-98,Jan-22-1998,1/22/98,1/22/98,1998,1,22,Jan
8481701,Santeri,Hatakka,15-Jan-01,Jan-15-2001,1/15/01,1/15/01,2001,1,15,Jan
8481552,Artemi,Kniazev,4-Jan-01,Jan-4-2001,1/4/01,1/4/01,2001,1,4,Jan
8477034,Jaycob,Megna,10-Dec-92,Dec-10-1992,12/10/92,12/10/92,1992,12,10,Dec
8480847,Ryan,Merkley,14-Aug-00,Aug-14-2000,8/14/00,8/14/00,2000,8,14,Aug
8478499,Adin,Hill,11-May-96,May-11-1996,5/11/96,5/11/96,1996,5,11,May
8478039,Kaapo,Kahkonen,16-Aug-96,Aug-16-1996,8/16/96,8/16/96,1996,8,16,Aug
8479313,Zach,Sawchenko,30-Dec-97,Dec-30-1997,12/30/97,12/30/97,1997,12,30,Dec
8475461,Andrew,Agozzino,3-Jan-91,Jan-3-1991,1/3/91,1/3/91,1991,1,3,Jan
8482101,Danil,Gushchin,6-Feb-02,Feb-6-2002,2/6/02,2/6/02,2002,2,6,Feb
8480822,Martin,Kaut,2-Oct-99,Oct-2-1999,10/2/99,10/2/99,1999,10,2,Oct
8479316,Luke,Kunin,4-Dec-97,Dec-4-1997,12/4/97,12/4/97,1997,12,4,Dec
8478067,Oskar,Lindblom,15-Aug-96,Aug-15-1996,8/15/96,8/15/96,1996,8,15,Aug
8478904,Steven,Lorentz,13-Apr-96,Apr-13-1996,4/13/96,4/13/96,1996,4,13,Apr
8480216,Jacob,Peterson,19-Jul-99,Jul-19-1999,7/19/99,7/19/99,1999,7,19,Jul
8482181,Tristen,Robins,15-Nov-01,Nov-15-2001,11/15/01,11/15/01,2001,11,15,Nov
8481477,Nico,Sturm,3-May-95,May-3-1995,5/3/95,5/3/95,1995,5,3,May
8476988,Matt,Benning,25-May-94,May-25-1994,5/25/94,5/25/94,1994,5,25,May
8482824,Nick,Cicek,29-May-00,May-29-2000,5/29/00,5/29/00,2000,5,29,May
8476449,Scott,Harrington,10-Mar-93,Mar-10-1993,3/10/93,3/10/93,1993,3,10,Mar
8479439,Jacob,MacDonald,26-Feb-93,Feb-26-1993,2/26/93,2/26/93,1993,2,26,Feb
8476884,Derrick,Pouliot,16-Jan-94,Jan-16-1994,1/16/94,1/16/94,1994,1,16,Jan
8481567,Henry,Thrun,12-Mar-01,Mar-12-2001,3/12/01,3/12/01,2001,3,12,Mar
8480199,Eetu,Makiniemi,19-Apr-99,Apr-19-1999,4/19/99,4/19/99,1999,4,19,Apr
8477473,Justin,Bailey,1-Jul-95,Jul-1-1995,7/1/95,7/1/95,1995,7,1,Jul
8477407,Anthony,Duclair,26-Aug-95,Aug-26-1995,8/26/95,8/26/95,1995,8,26,Aug
8475798,Mikael,Granlund,26-Feb-92,Feb-26-1992,2/26/92,2/26/92,1992,2,26,Feb
8474884,Mike,Hoffman,24-Nov-89,Nov-24-1989,11/24/89,11/24/89,1989,11,24,Nov
8480884,Calen,Addison,11-Apr-00,Apr-11-2000,4/11/00,4/11/00,2000,4,11,Apr
8477335,Kyle,Burroughs,12-Jul-95,Jul-12-1995,7/12/95,7/12/95,1995,7,12,Jul
8480834,Ty,Emberson,23-May-00,May-23-2000,5/23/00,5/23/00,2000,5,23,May
8480172,Jan,Rutta,29-Jul-90,Jul-29-1990,7/29/90,7/29/90,1990,7,29,Jul
8448121,Mel,Pearson,29-Apr-38,Apr-29-1938,4/29/38,4/29/38,1938,4,29,Apr
8448345,Bob,Rivard,1-Aug-39,Aug-1-1939,8/1/39,8/1/39,1939,8,1,Aug
8448923,Ken,Schinkel,27-Nov-32,Nov-27-1932,11/27/32,11/27/32,1932,11,27,Nov
8447228,George,Konik,4-May-37,May-4-1937,5/4/37,5/4/37,1937,5,4,May
8447324,Ted,Lanyon,11-Jun-39,Jun-11-1939,6/11/39,6/11/39,1939,6,11,Jun
8447580,Al,MacNeil,27-Sep-35,Sep-27-1935,9/27/35,9/27/35,1935,9,27,Sep
8447657,Dunc,McCallum,29-Mar-40,Mar-29-1940,3/29/40,3/29/40,1940,3,29,Mar
8449825,Les,Binkley,6-Jun-34,Jun-6-1934,6/6/34,6/6/34,1934,6,6,Jun
8444952,Lou,Angotti,16-Jan-38,Jan-16-1938,1/16/38,1/16/38,1938,1,16,Jan
8447359,Bill,Lecaine,11-Mar-40,Mar-11-1940,3/11/40,3/11/40,1940,3,11,Mar
8449092,Ron,Snell,11-Aug-48,Aug-11-1948,8/11/48,8/11/48,1948,8,11,Aug
8449209,Garry,Swain,11-Sep-47,Sep-11-1947,9/11/47,9/11/47,1947,9,11,Sep
8445024,Doug,Barrie,2-Oct-46,Oct-2-1946,10/2/46,10/2/46,1946,10,2,Oct
8445163,Michel,Briere,21-Oct-49,Oct-21-1949,10/21/49,10/21/49,1949,10,21,Oct
8446696,Nick,Harbaruk,16-Aug-43,Aug-16-1943,8/16/43,8/16/43,1943,8,16,Aug
8445083,Bob,Blackburn,1-Feb-38,Feb-1-1938,2/1/38,2/1/38,1938,2,1,Feb
8445022,Syl,Apps,1-Aug-47,Aug-1-1947,8/1/47,8/1/47,1947,8,1,Aug
8445325,Steve,Cardwell,13-Aug-50,Aug-13-1950,8/13/50,8/13/50,1950,8,13,Aug
8450490,Greg,Polis,8-Aug-50,Aug-8-1950,8/8/50,8/8/50,1950,8,8,Aug
8449671,Rod,Zaine,18-May-46,May-18-1946,5/18/46,5/18/46,1946,5,18,May
8447137,Sheldon,Kannegiesser,15-Aug-47,Aug-15-1947,8/15/47,8/15/47,1947,8,15,Aug
8448595,Yvon,Labre,29-Nov-49,Nov-29-1949,11/29/49,11/29/49,1949,11,29,Nov
8449996,Paul,Hoganson,12-Nov-49,Nov-12-1949,11/12/49,11/12/49,1949,11,12,Nov
8450051,Cam,Newton,25-Feb-50,Feb-25-1950,2/25/50,2/25/50,1950,2,25,Feb
8447793,Brian,McKenzie,16-Mar-51,Mar-16-1951,3/16/51,3/16/51,1951,3,16,Mar
8448032,Joe,Noris,26-Oct-51,Oct-26-1951,10/26/51,10/26/51,1951,10,26,Oct
8445792,Dave,Burrows,11-Jan-49,Jan-11-1949,1/11/49,1/11/49,1949,1,11,Jan
8446917,Tim,Horton,12-Jan-30,Jan-12-1930,1/12/30,1/12/30,1930,1,12,Jan
8448642,Ron,Lalonde,30-Oct-52,Oct-30-1952,10/30/52,10/30/52,1952,10,30,Oct
8452365,Jim,Wiley,28-Apr-50,Apr-28-1950,4/28/50,4/28/50,1950,4,28,Apr
8445460,Wayne,Bianchin,6-Sep-53,Sep-6-1953,9/6/53,9/6/53,1953,9,6,Sep
8448434,Bob,Kelly,6-Jun-46,Jun-6-1946,6/6/46,6/6/46,1946,6,6,Jun
8447525,Bernie,Lukowich,18-Mar-52,Mar-18-1952,3/18/52,3/18/52,1952,3,18,Mar
8447808,Bob,McManama,7-Oct-51,Oct-7-1951,10/7/51,10/7/51,1951,10,7,Oct
8445080,Larry,Bignell,7-Jan-50,Jan-7-1950,1/7/50,1/7/50,1950,1,7,Jan
8448175,Gary,Inness,28-May-49,May-28-1949,5/28/49,5/28/49,1949,5,28,May
8445069,Yves,Bergeron,11-Jan-52,Jan-11-1952,1/11/52,1/11/52,1952,1,11,Jan
8446658,Vic,Hadfield,4-Oct-40,Oct-4-1940,10/4/40,10/4/40,1940,10,4,Oct
8448420,Rick,Kehoe,15-Jul-51,Jul-15-1951,7/15/51,7/15/51,1951,7,15,Jul
8448189,Kelly,Pratt,8-Feb-53,Feb-8-1953,2/8/53,2/8/53,1953,2,8,Feb
8449200,Bob,Stumpf,25-Apr-53,Apr-25-1953,4/25/53,4/25/53,1953,4,25,Apr
8446780,Mario,Faubert,2-Dec-54,Dec-2-1954,12/2/54,12/2/54,1954,12,2,Dec
8450004,Bob,Johnson,12-Nov-48,Nov-12-1948,11/12/48,11/12/48,1948,11,12,Nov
8446170,Jacques,Cossette,20-Jun-54,Jun-20-1954,6/20/54,6/20/54,1954,6,20,Jun
8449299,Ed,Van Impe,27-May-40,May-27-1940,5/27/40,5/27/40,1940,5,27,May
8448710,Gordon,Laxton,16-Mar-55,Mar-16-1955,3/16/55,3/16/55,1955,3,16,Mar
8450123,Bobby,Taylor,24-Jan-45,Jan-24-1945,1/24/45,1/24/45,1945,1,24,Jan
8446035,Blair,Chapman,13-Jun-56,Jun-13-1956,6/13/56,6/13/56,1956,6,13,Jun
8445614,Mike,Corrigan,11-Jan-46,Jan-11-1946,1/11/46,1/11/46,1946,1,11,Jan
8447533,Steve,Lyon,16-May-52,May-16-1952,5/16/52,5/16/52,1952,5,16,May
8450148,Dunc,Wilson,22-Mar-48,Mar-22-1948,3/22/48,3/22/48,1948,3,22,Mar
8445350,Tom,Cassidy,15-Mar-52,Mar-15-1952,3/15/52,3/15/52,1952,3,15,Mar
8446320,Kim,Davis,31-May-57,May-31-1957,5/31/57,5/31/57,1957,5,31,May
8447492,Jim,Hamilton,18-Jan-57,Jan-18-1957,1/18/57,1/18/57,1957,1,18,Jan
8448741,Peter,Lee,2-Jan-56,Jan-2-1956,1/2/56,1/2/56,1956,1,2,Jan
8451245,Dave,Schultz,14-Oct-49,Oct-14-1949,10/14/49,10/14/49,1949,10,14,Oct
8451614,Brian,Spencer,3-Sep-49,Sep-3-1949,9/3/49,9/3/49,1949,9,3,Sep
8450097,Greg,Redquest,30-Jul-56,Jul-30-1956,7/30/56,7/30/56,1956,7,30,Jul
8448495,Orest,Kindrachuk,14-Sep-50,Sep-14-1950,9/14/50,9/14/50,1950,9,14,Sep
8449531,Michael,Meeker,23-Feb-58,Feb-23-1958,2/23/58,2/23/58,1958,2,23,Feb
8451246,Rod,Schutt,13-Oct-56,Oct-13-1956,10/13/56,10/13/56,1956,10,13,Oct
8448045,Lex,Hudson,31-Dec-55,Dec-31-1955,12/31/55,12/31/55,1955,12,31,Dec
8451853,Dale,Tallon,19-Oct-50,Oct-19-1950,10/19/50,10/19/50,1950,10,19,Oct
8447931,Rob,Holland,10-Sep-57,Sep-10-1957,9/10/57,9/10/57,1957,9,10,Sep
8450806,Nick,Ricci,26-Apr-54,Apr-26-1954,4/26/54,4/26/54,1954,4,26,Apr
8445771,Mike,Bullard,10-Mar-61,Mar-10-1961,3/10/61,3/10/61,1961,3,10,Mar
8450848,Gary,Rissling,18-Aug-56,Aug-18-1956,8/18/56,8/18/56,1956,8,18,Aug
8446061,Marc,Chorney,8-Nov-59,Nov-8-1959,11/8/59,11/8/59,1959,11,8,Nov
8446805,Tony,Feltrin,6-Dec-61,Dec-6-1961,12/6/61,12/6/61,1961,12,6,Dec
8452521,Bennett,Wolf,23-Oct-59,Oct-23-1959,10/23/59,10/23/59,1959,10,23,Oct
8447076,Steve,Gatzos,22-Jun-61,Jun-22-1961,6/22/61,6/22/61,1961,6,22,Jun
8447346,Pat,Graham,25-May-61,May-25-1961,5/25/61,5/25/61,1961,5,25,May
8447515,Dave,Hannan,26-Nov-61,Nov-26-1961,11/26/61,11/26/61,1961,11,26,Nov
8449738,Paul,Mulvey,27-Sep-58,Sep-27-1958,9/27/58,9/27/58,1958,9,27,Sep
8445653,Randy,Boyd,23-Jan-62,Jan-23-1962,1/23/62,1/23/62,1962,1,23,Jan
8447984,Greg,Hotham,7-Mar-56,Mar-7-1956,3/7/56,3/7/56,1956,3,7,Mar
8447063,Rob,Garner,17-Aug-58,Aug-17-1958,8/17/58,8/17/58,1958,8,17,Aug
8448026,Tim,Hrynewich,2-Oct-63,Oct-2-1963,10/2/63,10/2/63,1963,10,2,Oct
8451791,Rich,Sutter,2-Dec-63,Dec-2-1963,12/2/63,12/2/63,1963,12,2,Dec
8445796,Rod,Buskas,7-Jan-61,Jan-7-1961,1/7/61,1/7/61,1961,1,7,Jan
8448847,Brian,Lundberg,5-Jun-60,Jun-5-1960,6/5/60,6/5/60,1960,6,5,Jun
8451990,Ian,Turnbull,22-Dec-53,Dec-22-1953,12/22/53,12/22/53,1953,12,22,Dec
8445629,Phil,Bourque,8-Jun-62,Jun-8-1962,6/8/62,6/8/62,1962,6,8,Jun
8445773,Ted,Bulley,25-Mar-55,Mar-25-1955,3/25/55,3/25/55,1955,3,25,Mar
8446358,Dean,Defazio,16-Apr-63,Apr-16-1963,4/16/63,4/16/63,1963,4,16,Apr
8448656,Mitch,Lamoureux,22-Aug-62,Aug-22-1962,8/22/62,8/22/62,1962,8,22,Aug
8448841,Troy,Loney,21-Sep-63,Sep-21-1963,9/21/63,9/21/63,1963,9,21,Sep
8448837,Darren,Lowe,13-Oct-60,Oct-13-1960,10/13/60,10/13/60,1960,10,13,Oct
8450053,Thomas,O'Regan,29-Dec-61,Dec-29-1961,12/29/61,12/29/61,1961,12,29,Dec
8451029,Tom,Roulston,20-Nov-57,Nov-20-1957,11/20/57,11/20/57,1957,11,20,Nov
8451099,Rocky,Saganiuk,15-Dec-57,Dec-15-1957,12/15/57,12/15/57,1957,12,15,Dec
8451127,Grant,Sasser,13-Feb-64,Feb-13-1964,2/13/64,2/13/64,1964,2,13,Feb
8451867,Mark,Taylor,1-Jun-58,Jun-1-1958,6/1/58,6/1/58,1958,6,1,Jun
8451904,Thomas,Thornbury,17-Mar-63,Mar-17-1963,3/17/63,3/17/63,1963,3,17,Mar
8446039,Todd,Charlesworth,22-Mar-65,Mar-22-1965,3/22/65,3/22/65,1965,3,22,Mar
8447217,Bob,Gladney,27-Aug-57,Aug-27-1957,8/27/57,8/27/57,1957,8,27,Aug
8449346,Kevin,McCarthy,14-Jul-57,Jul-14-1957,7/14/57,7/14/57,1957,7,14,Jul
8451223,Norm,Schmidt,24-Jan-63,Jan-24-1963,1/24/63,1/24/63,1963,1,24,Jan
8451958,Vincent,Tremblay,2-Oct-60,Oct-2-1960,10/2/60,10/2/60,1960,10,2,Oct
8445410,Roger,Belanger Jr.,1-Dec-65,Dec-1-1965,12/1/65,12/1/65,1965,12,1,Dec
8447089,Bob,Geale,17-Apr-62,Apr-17-1962,4/17/62,4/17/62,1962,4,17,Apr
8448265,Arto,Javanainen,8-Apr-59,Apr-8-1959,4/8/59,4/8/59,1959,4,8,Apr
8448782,Mario,Lemieux,5-Oct-65,Oct-5-1965,10/5/65,10/5/65,1965,10,5,Oct
8449443,James,McGeough,13-Apr-63,Apr-13-1963,4/13/63,4/13/63,1963,4,13,Apr
8450339,Petteri,Lehto,13-Mar-61,Mar-13-1961,3/13/61,3/13/61,1961,3,13,Mar
8449414,Joe,McDonnell,11-May-61,May-11-1961,5/11/61,5/11/61,1961,5,11,May
8451018,Mike,Rowe,8-Mar-65,Mar-8-1965,3/8/65,3/8/65,1965,3,8,Mar
8446962,Dan,Frawley,2-Jun-62,Jun-2-1962,6/2/62,6/2/62,1962,6,2,Jun
8449288,Dwight,Mathiasen,5-Dec-63,Dec-5-1963,12/5/63,12/5/63,1963,12,5,Dec
8451376,Craig,Simpson,15-Feb-67,Feb-15-1967,2/15/67,2/15/67,1967,2,15,Feb
8447165,Lee,Giffin,1-Apr-67,Apr-1-1967,4/1/67,4/1/67,1967,4,1,Apr
8448520,Chris,Kontos,10-Dec-63,Dec-10-1963,12/10/63,12/10/63,1963,12,10,Dec
8448712,Kevin,Lavallee,16-Sep-61,Sep-16-1961,9/16/61,9/16/61,1961,9,16,Sep
8445415,Neil,Belland,3-Apr-61,Apr-3-1961,4/3/61,4/3/61,1961,4,3,Apr
8447390,Steve,Guenette,13-Nov-65,Nov-13-1965,11/13/65,11/13/65,1965,11,13,Nov
8444918,Brad,Aitken,30-Oct-67,Oct-30-1967,10/30/67,10/30/67,1967,10,30,Oct
8445861,Jock,Callander,23-Apr-61,Apr-23-1961,4/23/61,4/23/61,1961,4,23,Apr
8447033,Perry,Ganchar,28-Oct-63,Oct-28-1963,10/28/63,10/28/63,1963,10,28,Oct
8447433,Kenneth,Gruhl,13-Sep-59,Sep-13-1959,9/13/59,9/13/59,1959,9,13,Sep
8448406,Mark,Kachowski,20-Feb-65,Feb-20-1965,2/20/65,2/20/65,1965,2,20,Feb
8449312,Patrick,Mayer,24-Jul-61,Jul-24-1961,7/24/61,7/24/61,1961,7,24,Jul
8447263,Dave,Goertz,28-Mar-65,Mar-28-1965,3/28/65,3/28/65,1965,3,28,Mar
8445275,Tom,Barrasso,31-Mar-65,Mar-31-1965,3/31/65,3/31/65,1965,3,31,Mar
8452576,Wendell,Young,1-Aug-63,Aug-1-1963,8/1/63,8/1/63,1963,8,1,Aug
8451516,Doug,Smith,17-May-63,May-17-1963,5/17/63,5/17/63,1963,5,17,May
8451858,Tony,Tanti,7-Sep-63,Sep-7-1963,9/7/63,9/7/63,1963,9,7,Sep
8448029,Jiri,Hrdina,5-Jan-58,Jan-5-1958,1/5/58,1/5/58,1958,1,5,Jan
8450560,Ken,Priestlay,24-Aug-67,Aug-24-1967,8/24/67,8/24/67,1967,8,24,Aug
8451965,Bryan,Trottier,17-Jul-56,Jul-17-1956,7/17/56,7/17/56,1956,7,17,Jul
8450089,Jim,Paek,7-Apr-67,Apr-7-1967,4/7/67,4/7/67,1967,4,7,Apr
8449583,David,Michayluk,18-May-62,May-18-1962,5/18/62,5/18/62,1962,5,18,May
8457451,Glenn,Mulvenna,18-Feb-67,Feb-18-1967,2/18/67,2/18/67,1967,2,18,Feb
8457481,Michael,Needham,4-Apr-70,Apr-4-1970,4/4/70,4/4/70,1970,4,4,Apr
8446050,Jeff,Chychrun,3-May-66,May-3-1966,5/3/66,5/3/66,1966,5,3,May
8457490,Todd,Nelson,15-May-69,May-15-1969,5/15/69,5/15/69,1969,5,15,May
8451105,Kjell,Samuelsson,18-Oct-58,Oct-18-1958,10/18/58,10/18/58,1958,10,18,Oct
8458955,Martin,Straka,3-Sep-72,Sep-3-1972,9/3/72,9/3/72,1972,9,3,Sep
8456120,Justin,Duberman,23-Mar-70,Mar-23-1970,3/23/70,3/23/70,1970,3,23,Mar
8456782,Ladislav,Karabin,16-Feb-70,Feb-16-1970,2/16/70,2/16/70,1970,2,16,Feb
8458530,Markus,Naslund,30-Jul-73,Jul-30-1973,7/30/73,7/30/73,1973,7,30,Jul
8458662,Ed,Patterson,14-Nov-72,Nov-14-1972,11/14/72,11/14/72,1972,11,14,Nov
8455452,Greg,Andrusak,14-Nov-69,Nov-14-1969,11/14/69,11/14/69,1969,11,14,Nov
8457479,Pat,Neaton,21-May-71,May-21-1971,5/21/71,5/21/71,1971,5,21,May
8456090,Robert,Dopson,21-Aug-67,Aug-21-1967,8/21/67,8/21/67,1967,8,21,Aug
8445283,Len,Barrie,4-Jun-69,Jun-4-1969,6/4/69,6/4/69,1969,6,4,Jun
8458552,Rusty,Fitzgerald,4-Oct-72,Oct-4-1972,10/4/72,10/4/72,1972,10,4,Oct
8448046,Mike,Hudson,6-Feb-67,Feb-6-1967,2/6/67,2/6/67,1967,2,6,Feb
8460541,Richard,Park,27-May-76,May-27-1976,5/27/76,5/27/76,1976,5,27,May
8445413,Drake,Berehowsky,3-Jan-72,Jan-3-1972,1/3/72,1/3/72,1972,1,3,Jan
8448822,Francois,Leroux,18-Apr-70,Apr-18-1970,4/18/70,4/18/70,1970,4,18,Apr
8459051,Philippe,De Rouville,7-Aug-74,Aug-7-1974,8/7/74,8/7/74,1974,8,7,Aug
8456150,Joe,Dziedzic,18-Dec-71,Dec-18-1971,12/18/71,12/18/71,1971,12,18,Dec
8448664,Brad,Lauer,27-Oct-66,Oct-27-1966,10/27/66,10/27/66,1966,10,27,Oct
8449807,Petr,Nedved,9-Dec-71,Dec-9-1971,12/9/71,12/9/71,1971,12,9,Dec
8459483,Dave,Roche,13-Jun-75,Jun-13-1975,6/13/75,6/13/75,1975,6,13,Jun
8458521,Alek,Stojanov,25-Apr-73,Apr-25-1973,4/25/73,4/25/73,1973,4,25,Apr
8460514,Chris,Wells,12-Nov-75,Nov-12-1975,11/12/75,11/12/75,1975,11,12,Nov
8458778,Peter,Allen,6-Mar-70,Mar-6-1970,3/6/70,3/6/70,1970,3,6,Mar
8459447,Stefan,Bergqvist,10-Mar-75,Mar-10-1975,3/10/75,3/10/75,1975,3,10,Mar
8446286,J.J.,Daigneault,12-Oct-65,Oct-12-1965,10/12/65,10/12/65,1965,10,12,Oct
8458494,Sergei,Zubov,22-Jul-70,Jul-22-1970,7/22/70,7/22/70,1970,7,22,Jul
8445017,Shawn,Antoski,25-Mar-70,Mar-25-1970,3/25/70,3/25/70,1970,3,25,Mar
8455575,Josef,Beranek,25-Oct-69,Oct-25-1969,10/25/69,10/25/69,1969,10,25,Oct
8458650,Andreas,Johansson,19-May-73,May-19-1973,5/19/73,5/19/73,1973,5,19,May
8457570,Roman,Oksiuta,21-Aug-70,Aug-21-1970,8/21/70,8/21/70,1970,8,21,Aug
8459474,Domenic,Pittis,1-Oct-74,Oct-1-1974,10/1/74,10/1/74,1974,10,1,Oct
8452161,Garry,Valk,27-Nov-67,Nov-27-1967,11/27/67,11/27/67,1967,11,27,Nov
8458526,Tyler,Wright,6-Apr-73,Apr-6-1973,4/6/73,4/6/73,1973,4,6,Apr
8447680,Kevin,Hatcher,9-Sep-66,Sep-9-1966,9/9/66,9/9/66,1966,9,9,Sep
8458942,Darius,Kasparaitis,16-Oct-72,Oct-16-1972,10/16/72,10/16/72,1972,10,16,Oct
8459579,Patrick,Lalime,7-Jul-74,Jul-7-1974,7/7/74,7/7/74,1974,7,7,Jul
8462843,Robert,Dome,29-Jan-79,Jan-29-1979,1/29/79,1/29/79,1979,1,29,Jan
8459021,Chris,Ferraro,24-Jan-73,Jan-24-1973,1/24/73,1/24/73,1973,1,24,Jan
8462054,Aleksey,Morozov,16-Feb-77,Feb-16-1977,2/16/77,2/16/77,1977,2,16,Feb
8460548,Sven,Butenschon,22-Mar-76,Mar-22-1976,3/22/76,3/22/76,1976,3,22,Mar
8458965,Tuomas,Gronman,22-Mar-74,Mar-22-1974,3/22/74,3/22/74,1974,3,22,Mar
8459019,Matthew,Barnaby,4-May-73,May-4-1973,5/4/73,5/4/73,1973,5,4,May
8459147,Brian,Bonin,28-Nov-73,Nov-28-1973,11/28/73,11/28/73,1973,11,28,Nov
8456602,Todd,Hlushko,7-Feb-70,Feb-7-1970,2/7/70,2/7/70,1970,2,7,Feb
8458609,Dan,Kesa,23-Nov-71,Nov-23-1971,11/23/71,11/23/71,1971,11,23,Nov
8458529,Alex,Kovalev,24-Feb-73,Feb-24-1973,2/24/73,2/24/73,1973,2,24,Feb
8448775,Patrick,Lebeau,17-Mar-70,Mar-17-1970,3/17/70,3/17/70,1970,3,17,Mar
8461658,Ryan,Savoia,6-May-73,May-6-1973,5/6/73,5/6/73,1973,5,6,May
8466436,Martin,Sonnenberg,23-Jan-78,Jan-23-1978,1/23/78,1/23/78,1978,1,23,Jan
8459672,German,Titov,16-Oct-65,Oct-16-1965,10/16/65,10/16/65,1965,10,16,Oct
8462824,Harry,York,16-Apr-74,Apr-16-1974,4/16/74,4/16/74,1974,4,16,Apr
8459179,Victor,Ignatjev,26-Apr-70,Apr-26-1970,4/26/70,4/26/70,1970,4,26,Apr
8464982,Pavel,Skrbek,9-Aug-78,Aug-9-1978,8/9/78,8/9/78,1978,8,9,Aug
8462102,Jean-Sebastien,Aubin,19-Jul-77,Jul-19-1977,7/19/77,7/19/77,1977,7,19,Jul
8455666,Bob,Boughner,8-Mar-71,Mar-8-1971,3/8/71,3/8/71,1971,3,8,Mar
8459700,Hans,Jonsson,2-Aug-73,Aug-2-1973,8/2/73,8/2/73,1973,8,2,Aug
8465058,Michal,Rozsival,3-Sep-78,Sep-3-1978,9/3/78,9/3/78,1978,9,3,Sep
8458048,John,Slaney,7-Feb-72,Feb-7-1972,2/7/72,2/7/72,1972,2,7,Feb
8459074,Daniel,Trebil,10-Apr-74,Apr-10-1974,4/10/74,4/10/74,1974,4,10,Apr
8460563,Greg,Crozier,6-Jul-76,Jul-6-1976,7/6/76,7/6/76,1976,7,6,Jul
8467347,Milan,Kraft,17-Jan-80,Jan-17-1980,1/17/80,1/17/80,1980,1,17,Jan
8464875,Steve,McKenna,21-Aug-73,Aug-21-1973,8/21/73,8/21/73,1973,8,21,Aug
8467543,Toby,Petersen,27-Oct-78,Oct-27-1978,10/27/78,10/27/78,1978,10,27,Oct
8468753,Roman,Simicek,4-Nov-71,Nov-4-1971,11/4/71,11/4/71,1971,11,4,Nov
8468438,Billy,Tibbetts,14-Oct-74,Oct-14-1974,10/14/74,10/14/74,1974,10,14,Oct
8466203,Josef,Melichar,20-Jan-79,Jan-20-1979,1/20/79,1/20/79,1979,1,20,Jan
8465962,Rich,Parent,29-Mar-73,Mar-29-1973,3/29/73,3/29/73,1973,3,29,Mar
8467880,Kris,Beech,5-Feb-81,Feb-5-1981,2/5/81,2/5/81,1981,2,5,Feb
8468532,Shane,Endicott,21-Dec-81,Dec-21-1981,12/21/81,12/21/81,1981,12,21,Dec
8465220,Eric,Meloche,1-May-76,May-1-1976,5/1/76,5/1/76,1976,5,1,May
8459146,Jeff,Toms,4-Jun-74,Jun-4-1974,6/4/74,6/4/74,1974,6,4,Jun
8466189,Rick,Berry,4-Nov-78,Nov-4-1978,11/4/78,11/4/78,1978,11,4,Nov
8459448,Mike,Wilson,26-Feb-75,Feb-26-1975,2/26/75,2/26/75,1975,2,26,Feb
8459423,Alexandre,Daigle,7-Feb-75,Feb-7-1975,2/7/75,2/7/75,1975,2,7,Feb
8458638,Brian,Holzinger,10-Oct-72,Oct-10-1972,10/10/72,10/10/72,1972,10,10,Oct
8458990,Mathias,Johansson,22-Feb-74,Feb-22-1974,2/22/74,2/22/74,1974,2,22,Feb
8467891,Konstantin,Koltsov,17-Apr-81,Apr-17-1981,4/17/81,4/17/81,1981,4,17,Apr
8467902,Michal,Sivek,21-Jan-81,Jan-21-1981,1/21/81,1/21/81,1981,1,21,Jan
8469568,Tomas,Surovy,24-Sep-81,Sep-24-1981,9/24/81,9/24/81,1981,9,24,Sep
8464964,Dan,Focht,31-Dec-77,Dec-31-1977,12/31/77,12/31/77,1977,12,31,Dec
8465252,Richard,Lintner,15-Nov-77,Nov-15-1977,11/15/77,11/15/77,1977,11,15,Nov
8467907,Ross,Lupaschuk,19-Jan-81,Jan-19-1981,1/19/81,1/19/81,1981,1,19,Jan
8468498,Brooks,Orpik,26-Sep-80,Sep-26-1980,9/26/80,9/26/80,1980,9,26,Sep
8460757,Dick,Tarnstrom,20-Jan-75,Jan-20-1975,1/20/75,1/20/75,1975,1,20,Jan
8467959,Sebastien,Caron,25-Jun-80,Jun-25-1980,6/25/80,6/25/80,1980,6,25,Jun
8467988,Ryan,Malone,1-Dec-79,Dec-1-1979,12/1/79,12/1/79,1979,12,1,Dec
8467924,Matt,Murley,17-Dec-79,Dec-17-1979,12/17/79,12/17/79,1979,12,17,Dec
8470030,Lasse,Pirjeta,4-Apr-74,Apr-4-1974,4/4/74,4/4/74,1974,4,4,Apr
8460664,Steve,Webb,30-Apr-75,Apr-30-1975,4/30/75,4/30/75,1975,4,30,Apr
8460500,Nolan,Baumgartner,23-Mar-76,Mar-23-1976,3/23/76,3/23/76,1976,3,23,Mar
8467452,Rob,Scuderi,30-Dec-78,Dec-30-1978,12/30/78,12/30/78,1978,12,30,Dec
8459645,Martin,Strbak,15-Jan-75,Jan-15-1975,1/15/75,1/15/75,1975,1,15,Jan
8459289,Martin,Brochu,10-Mar-73,Mar-10-1973,3/10/73,3/10/73,1973,3,10,Mar
8469613,Andy,Chiodo,25-Apr-83,Apr-25-1983,4/25/83,4/25/83,1983,4,25,Apr
8470594,Marc-Andre,Fleury,28-Nov-84,Nov-28-1984,11/28/84,11/28/84,1984,11,28,Nov
8459615,Eric,Boguniecki,6-May-75,May-6-1975,5/6/75,5/6/75,1975,5,6,May
8471675,Sidney,Crosby,7-Aug-87,Aug-7-1987,8/7/87,8/7/87,1987,8,7,Aug
8448622,John,Leclair,5-Jul-69,Jul-5-1969,7/5/69,7/5/69,1969,7,5,Jul
8466320,Niklas,Nordgren,28-Jun-79,Jun-28-1979,6/28/79,6/28/79,1979,6,28,Jun
8468604,Michel,Ouellet,5-Mar-82,Mar-5-1982,3/5/82,3/5/82,1982,3,5,Mar
8458540,Ziggy,Palffy,5-May-72,May-5-1972,5/5/72,5/5/72,1972,5,5,May
8467886,Jani,Rita,25-Jul-81,Jul-25-1981,7/25/81,7/25/81,1981,7,25,Jul
8459109,Ryan,Vandenbussche,28-Feb-73,Feb-28-1973,2/28/73,2/28/73,1973,2,28,Feb
8459008,Eric,Cairns,27-Jun-74,Jun-27-1974,6/27/74,6/27/74,1974,6,27,Jun
8459558,Alain,Nasreddine,10-Jul-75,Jul-10-1975,7/10/75,7/10/75,1975,7,10,Jul
8458838,Steve,Poapst,3-Jan-69,Jan-3-1969,1/3/69,1/3/69,1969,1,3,Jan
8470309,Ryan,Whitney,19-Feb-83,Feb-19-1983,2/19/83,2/19/83,1983,2,19,Feb
8467430,Dany,Sabourin,2-Sep-80,Sep-2-1980,9/2/80,9/2/80,1980,9,2,Sep
8462060,Georges,Laraque,7-Dec-76,Dec-7-1976,12/7/76,12/7/76,1976,12,7,Dec
8471215,Evgeni,Malkin,31-Jul-86,Jul-31-1986,7/31/86,7/31/86,1986,7,31,Jul
8450900,Gary,Roberts,23-May-66,May-23-1966,5/23/66,5/23/66,1966,5,23,May
8467393,Jarkko,Ruutu,23-Aug-75,Aug-23-1975,8/23/75,8/23/75,1975,8,23,Aug
8473533,Jordan,Staal,10-Sep-88,Sep-10-1988,9/10/88,9/10/88,1988,9,10,Sep
8468750,Micki,Dupont,15-Apr-80,Apr-15-1980,4/15/80,4/15/80,1980,4,15,Apr
8467580,Mark,Eaton,6-May-77,May-6-1977,5/6/77,5/6/77,1977,5,6,May
8471724,Kris,Letang,24-Apr-87,Apr-24-1987,4/24/87,4/24/87,1987,4,24,Apr
8470283,Tim,Brent,10-Mar-84,Mar-10-1984,3/10/84,3/10/84,1984,3,10,Mar
8470663,Jonathan,Filewich,2-Oct-84,Oct-2-1984,10/2/84,10/2/84,1984,10,2,Oct
8467925,Adam,Hall,14-Aug-80,Aug-14-1980,8/14/80,8/14/80,1980,8,14,Aug
8470295,Connor,James,25-Aug-82,Aug-25-1982,8/25/82,8/25/82,1982,8,25,Aug
8470383,Chris,Minard,18-Nov-81,Nov-18-1981,11/18/81,11/18/81,1981,11,18,Nov
8468503,Nathan,Smith,9-Feb-82,Feb-9-1982,2/9/82,2/9/82,1982,2,9,Feb
8470625,Ryan,Stone,20-Mar-85,Mar-20-1985,3/20/85,3/20/85,1985,3,20,Mar
8468510,Jeff,Taffe,19-Feb-81,Feb-19-1981,2/19/81,2/19/81,1981,2,19,Feb
8471274,Alex,Goligoski,30-Jul-85,Jul-30-1985,7/30/85,7/30/85,1985,7,30,Jul
8458172,Darryl,Sydor,13-May-72,May-13-1972,5/13/72,5/13/72,1972,5,13,May
8465166,Craig,Adams,26-Apr-77,Apr-26-1977,4/26/77,4/26/77,1977,4,26,Apr
8470713,Paul,Bissonnette,11-Mar-85,Mar-11-1985,3/11/85,3/11/85,1985,3,11,Mar
8473997,Luca,Caputi,1-Oct-88,Oct-1-1988,10/1/88,10/1/88,1988,10,1,Oct
8465951,Matt,Cooke,7-Sep-78,Sep-7-1978,9/7/78,9/7/78,1978,9,7,Sep
8468172,Ruslan,Fedotenko,18-Jan-79,Jan-18-1979,1/18/79,1/18/79,1979,1,18,Jan
8468252,Eric,Godard,7-Mar-80,Mar-7-1980,3/7/80,3/7/80,1980,3,7,Mar
8474138,Dustin,Jeffrey,27-Feb-88,Feb-27-1988,2/27/88,2/27/88,1988,2,27,Feb
8471480,Janne,Pesonen,11-May-82,May-11-1982,5/11/82,5/11/82,1982,5,11,May
8472361,Bill,Thomas,20-Jun-83,Jun-20-1983,6/20/83,6/20/83,1983,6,20,Jun
8473734,Tim,Wallace,6-Aug-84,Aug-6-1984,8/6/84,8/6/84,1984,8,6,Aug
8467937,Mike,Zigomanis,17-Jan-81,Jan-17-1981,1/17/81,1/17/81,1981,1,17,Jan
8458527,Philippe,Boucher,24-Mar-73,Mar-24-1973,3/24/73,3/24/73,1973,3,24,Mar
8474202,John,Curry,27-Feb-84,Feb-27-1984,2/27/84,2/27/84,1984,2,27,Feb
8464999,Mathieu,Garon,9-Jan-78,Jan-9-1978,1/9/78,1/9/78,1978,1,9,Jan
8468674,Deryk,Engelland,3-Apr-82,Apr-3-1982,4/3/82,4/3/82,1982,4,3,Apr
8470317,Nate,Guenin,10-Dec-82,Dec-10-1982,12/10/82,12/10/82,1982,12,10,Dec
8467917,Jordan,Leopold,3-Aug-80,Aug-3-1980,8/3/80,8/3/80,1980,8,3,Aug
8462045,Jay,McKee,8-Sep-77,Sep-8-1977,9/8/77,9/8/77,1977,9,8,Sep
8462161,Brent,Johnson,12-Mar-77,Mar-12-1977,3/12/77,3/12/77,1977,3,12,Mar
8474708,Alexander,Pechurskiy,4-Jun-90,Jun-4-1990,6/4/90,6/4/90,1990,6,4,Jun
8467964,Mike,Comrie,11-Sep-80,Sep-11-1980,9/11/80,9/11/80,1980,9,11,Sep
8470065,Ryan,Craig,6-Jan-82,Jan-6-1982,1/6/82,1/6/82,1982,1,6,Jan
8471707,James,Neal,3-Sep-87,Sep-3-1987,9/3/87,9/3/87,1987,9,3,Sep
8471856,Joe,Vitale,20-Aug-85,Aug-20-1985,8/20/85,8/20/85,1985,8,20,Aug
8467927,Andrew,Hutchinson,24-Mar-80,Mar-24-1980,3/24/80,3/24/80,1980,3,24,Mar
8469760,Zbynek,Michalek,23-Dec-82,Dec-23-1982,12/23/82,12/23/82,1982,12,23,Dec
8471702,Matt,Niskanen,6-Dec-86,Dec-6-1986,12/6/86,12/6/86,1986,12,6,Dec
8470896,Steve,MacIntyre,8-Aug-80,Aug-8-1980,8/8/80,8/8/80,1980,8,8,Aug
8470644,Colin,McDonald,30-Sep-84,Sep-30-1984,9/30/84,9/30/84,1984,9,30,Sep
8471811,Cal,O'Reilly,30-Sep-86,Sep-30-1986,9/30/86,9/30/86,1986,9,30,Sep
8474145,Robert,Bortuzzo,18-Mar-89,Mar-18-1989,3/18/89,3/18/89,1989,3,18,Mar
8475155,Simon,Despres,27-Jul-91,Jul-27-1991,7/27/91,7/27/91,1991,7,27,Jul
8470678,Alexandre,Picard,5-Jul-85,Jul-5-1985,7/5/85,7/5/85,1985,7,5,Jul
8473539,Carl,Sneep,5-Nov-87,Nov-5-1987,11/5/87,11/5/87,1987,11,5,Nov
8475097,Brad,Thiessen,19-Mar-86,Mar-19-1986,3/19/86,3/19/86,1986,3,19,Mar
8474576,Zach,Boychuk,4-Oct-89,Oct-4-1989,10/4/89,10/4/89,1989,10,4,Oct
8469638,Jussi,Jokinen,1-Apr-83,Apr-1-1983,4/1/83,4/1/83,1983,4,1,Apr
8466160,Brenden,Morrow,16-Jan-79,Jan-16-1979,1/16/79,1/16/79,1979,1,16,Jan
8473942,Trevor,Smith,8-Feb-85,Feb-8-1985,2/8/85,2/8/85,1985,2,8,Feb
8474091,Brandon,Sutter,14-Feb-89,Feb-14-1989,2/14/89,2/14/89,1989,2,14,Feb
8470798,Dylan,Reese,29-Aug-84,Aug-29-1984,8/29/84,8/29/84,1984,8,29,Aug
8460712,Tomas,Vokoun,2-Jul-76,Jul-2-1976,7/2/76,7/2/76,1976,7,2,Jul
8471832,Nick,Drazenovic,14-Jan-87,Jan-14-1987,1/14/87,1/14/87,1987,1,14,Jan
8473682,Andrew,Ebbett,2-Jan-83,Jan-2-1983,1/2/83,1/2/83,1983,1,2,Jan
8477126,Jayson,Megna,1-Feb-90,Feb-1-1990,2/1/90,2/1/90,1990,2,1,Feb
8476522,Adam,Payerl,4-Mar-91,Mar-4-1991,3/4/91,3/4/91,1991,3,4,Mar
8467881,Taylor,Pyatt,19-Aug-81,Aug-19-1981,8/19/81,8/19/81,1981,8,19,Aug
8475119,Zach,Sill,24-May-88,May-24-1988,5/24/88,5/24/88,1988,5,24,May
8476158,Harry,Zolnierczyk,1-Sep-87,Sep-1-1987,9/1/87,9/1/87,1987,9,1,Sep
8475208,Brian,Dumoulin,6-Sep-91,Sep-6-1991,9/6/91,9/6/91,1991,9,6,Sep
8475194,Philip,Samuelsson,26-Jul-91,Jul-26-1991,7/26/91,7/26/91,1991,7,26,Jul
8473553,Jeff,Zatkoff,9-Jun-87,Jun-9-1987,6/9/87,6/9/87,1987,6,9,Jun
8476062,Mark,Arcobello,12-Aug-88,Aug-12-1988,8/12/88,8/12/88,1988,8,12,Aug
8471260,Blake,Comeau,18-Feb-86,Feb-18-1986,2/18/86,2/18/86,1986,2,18,Feb
8471703,Steve,Downie,3-Apr-87,Apr-3-1987,4/3/87,4/3/87,1987,4,3,Apr
8471887,Patric,Hornqvist,1-Jan-87,Jan-1-1987,1/1/87,1/1/87,1987,1,1,Jan
8473970,Rob,Klinkhammer,12-Aug-86,Aug-12-1986,8/12/86,8/12/86,1986,8,12,Aug
8470654,Maxim,Lapierre,29-Mar-85,Mar-29-1985,3/29/85,3/29/85,1985,3,29,Mar
8475810,Bryan,Rust,11-May-92,May-11-1992,5/11/92,5/11/92,1992,5,11,May
8476339,Dominik,Uher,31-Dec-92,Dec-31-1992,12/31/92,12/31/92,1992,12,31,Dec
8471710,Taylor,Chorney,27-Apr-87,Apr-27-1987,4/27/87,4/27/87,1987,4,27,Apr
8474013,Ian,Cole,21-Feb-89,Feb-21-1989,2/21/89,2/21/89,1989,2,21,Feb
8476326,Josh,Archibald,6-Oct-92,Oct-6-1992,10/6/92,10/6/92,1992,10,6,Oct
8464989,Matt,Cullen,2-Nov-76,Nov-2-1976,11/2/76,11/2/76,1976,11,2,Nov
8474176,Carl,Hagelin,23-Aug-88,Aug-23-1988,8/23/88,8/23/88,1988,8,23,Aug
8475832,Tom,Kuhnhackl,21-Jan-92,Jan-21-1992,1/21/92,1/21/92,1992,1,21,Jan
8476147,Kael,Mouillierat,9-Dec-87,Dec-9-1987,12/9/87,12/9/87,1987,12,9,Dec
8478928,Sergei,Plotnikov,3-Jun-90,Jun-3-1990,6/3/90,6/3/90,1990,6,3,Jun
8471331,Kevin,Porter,12-Mar-86,Mar-12-1986,3/12/86,3/12/86,1986,3,12,Mar
8473542,Tom,Sestito,28-Sep-87,Sep-28-1987,9/28/87,9/28/87,1987,9,28,Sep
8477839,Conor,Sheary,8-Jun-92,Jun-8-1992,6/8/92,6/8/92,1992,6,8,Jun
8478866,Dominik,Simon,8-Aug-94,Aug-8-1994,8/8/94,8/8/94,1994,8,8,Aug
8476431,Adam,Clendening,26-Oct-92,Oct-26-1992,10/26/92,10/26/92,1992,10,26,Oct
8474602,Justin,Schultz,6-Jul-90,Jul-6-1990,7/6/90,7/6/90,1990,7,6,Jul
8476899,Matt,Murray,25-May-94,May-25-1994,5/25/94,5/25/94,1994,5,25,May
8477404,Jake,Guentzel,6-Oct-94,Oct-6-1994,10/6/94,10/6/94,1994,10,6,Oct
8476302,Frank,Corrado,26-Mar-93,Mar-26-1993,3/26/93,3/26/93,1993,3,26,Mar
8474611,Cameron,Gaunce,19-Mar-90,Mar-19-1990,3/19/90,3/19/90,1990,3,19,Mar
8476162,Steve,Oleksy,4-Feb-86,Feb-4-1986,2/4/86,2/4/86,1986,2,4,Feb
8477244,Chad,Ruhwedel,7-May-90,May-7-1990,5/7/90,5/7/90,1990,5,7,May
8468309,Mark,Streit,11-Dec-77,Dec-11-1977,12/11/77,12/11/77,1977,12,11,Dec
8477237,Mike,Condon,27-Apr-90,Apr-27-1990,4/27/90,4/27/90,1990,4,27,Apr
8477465,Tristan,Jarry,29-Apr-95,Apr-29-1995,4/29/95,4/29/95,1995,4,29,Apr
8473544,Derick,Brassard,22-Sep-87,Sep-22-1987,9/22/87,9/22/87,1987,9,22,Sep
8477591,Josh,Jooris,14-Jul-90,Jul-14-1990,7/14/90,7/14/90,1990,7,14,Jul
8471817,Ryan,Reaves,20-Jan-87,Jan-20-1987,1/20/87,1/20/87,1987,1,20,Jan
8476467,Jamie,Oleksiak,21-Dec-92,Dec-21-1992,12/21/92,12/21/92,1992,12,21,Dec
8479193,Casey,DeSmith,13-Aug-91,Aug-13-1991,8/13/91,8/13/91,1991,8,13,Aug
8475760,Nick,Bjugstad,17-Jul-92,Jul-17-1992,7/17/92,7/17/92,1992,7,17,Jul
8476927,Teddy,Blueger,15-Aug-94,Aug-15-1994,8/15/94,8/15/94,1994,8,15,Aug
8474683,Derek,Grant,20-Apr-90,Apr-20-1990,4/20/90,4/20/90,1990,4,20,Apr
8480341,Adam,Johnson,22-Jun-94,Jun-22-1994,6/22/94,6/22/94,1994,6,22,Jun
8477955,Jared,McCann,31-May-96,May-31-1996,5/31/96,5/31/96,1996,5,31,May
8476871,Tanner,Pearson,10-Aug-92,Aug-10-1992,8/10/92,8/10/92,1992,8,10,Aug
8475253,Garrett,Wilson,16-Mar-91,Mar-16-1991,3/16/91,3/16/91,1991,3,16,Mar
8475790,Erik,Gudbranson,7-Jan-92,Jan-7-1992,1/7/92,1/7/92,1992,1,7,Jan
8471677,Jack,Johnson,13-Jan-87,Jan-13-1987,1/13/87,1/13/87,1987,1,13,Jan
8477969,Marcus,Pettersson,8-May-96,May-8-1996,5/8/96,5/8/96,1996,5,8,May
8480945,Juuso,Riikola,9-Nov-93,Nov-9-1993,11/9/93,11/9/93,1993,11,9,Nov
8478074,Anthony,Angello,6-Mar-96,Mar-6-1996,3/6/96,3/6/96,1996,3,6,Mar
8476974,Thomas,Di Pauli,29-Apr-94,Apr-29-1994,4/29/94,4/29/94,1994,4,29,Apr
8476851,Alex,Galchenyuk,12-Feb-94,Feb-12-1994,2/12/94,2/12/94,1994,2,12,Feb
8480946,Dominik,Kahun,2-Jul-95,Jul-2-1995,7/2/95,7/2/95,1995,7,2,Jul
8478043,Sam,Lafferty,6-Mar-95,Mar-6-1995,3/6/95,3/6/95,1995,3,6,Mar
8478542,Evan,Rodrigues,28-Jul-93,Jul-28-1993,7/28/93,7/28/93,1993,7,28,Jul
8475722,Jason,Zucker,16-Jan-92,Jan-16-1992,1/16/92,1/16/92,1992,1,16,Jan
8470604,Jeff,Carter,1-Jan-85,Jan-1-1985,1/1/85,1/1/85,1985,1,1,Jan
8477680,Josh,Currie,29-Oct-92,Oct-29-1992,10/29/92,10/29/92,1992,10,29,Oct
8477919,Frederick,Gaudreau,1-May-93,May-1-1993,5/1/93,5/1/93,1993,5,1,May
8476873,Mark,Jankowski,13-Sep-94,Sep-13-1994,9/13/94,9/13/94,1994,9,13,Sep
8477953,Kasperi,Kapanen,23-Jul-96,Jul-23-1996,7/23/96,7/23/96,1996,7,23,Jul
8482055,Drew,O'Connor,9-Jun-98,Jun-9-1998,6/9/98,6/9/98,1998,6,9,Jun
8474098,Colton,Sceviour,20-Apr-89,Apr-20-1989,4/20/89,4/20/89,1989,4,20,Apr
8482241,Radim,Zohorna,29-Apr-96,Apr-29-1996,4/29/96,4/29/96,1996,4,29,Apr
8476879,Cody,Ceci,21-Dec-93,Dec-21-1993,12/21/93,12/21/93,1993,12,21,Dec
8477814,Kevin,Czuczman,9-Jan-91,Jan-9-1991,1/9/91,1/9/91,1991,1,9,Jan
8478017,Mark,Friedman,25-Dec-95,Dec-25-1995,12/25/95,12/25/95,1995,12,25,Dec
8480058,Pierre-Olivier,Joseph,1-Jul-99,Jul-1-1999,7/1/99,7/1/99,1999,7,1,Jul
8476875,Mike,Matheson,27-Feb-94,Feb-27-1994,2/27/94,2/27/94,1994,2,27,Feb
8474134,Yannick,Weber,23-Sep-88,Sep-23-1988,9/23/88,9/23/88,1988,9,23,Sep
8476509,Maxime,Lagace,12-Jan-93,Jan-12-1993,1/12/93,1/12/93,1993,1,12,Jan
8479512,Kasper,Bjorkqvist,10-Jul-97,Jul-10-1997,7/10/97,7/10/97,1997,7,10,Jul
8480842,Filip,Hallander,29-Jun-00,Jun-29-2000,6/29/00,6/29/00,2000,6,29,Jun
8476934,Brock,McGinn,2-Feb-94,Feb-2-1994,2/2/94,2/2/94,1994,2,2,Feb
8481703,Valtteri,Puustinen,4-Jun-99,Jun-4-1999,6/4/99,6/4/99,1999,6,4,Jun
8476483,Rickard,Rakell,5-May-93,May-5-1993,5/5/93,5/5/93,1993,5,5,May
8479465,Drake,Caggiula,20-Jun-94,Jun-20-1994,6/20/94,6/20/94,1994,6,20,Jun
8480836,Jonathan,Gruden,4-May-00,May-4-2000,5/4/00,5/4/00,2000,5,4,May
8479423,Alex,Nylander,2-Mar-98,Mar-2-1998,3/2/98,3/2/98,1998,3,2,Mar
8480068,Ryan,Poehling,3-Jan-99,Jan-3-1999,1/3/99,1/3/99,1999,1,3,Jan
8481591,Sam,Poulin,25-Feb-01,Feb-25-2001,2/25/01,2/25/01,2001,2,25,Feb
8474682,Dustin,Tokarski,16-Sep-89,Sep-16-1989,9/16/89,9/16/89,1989,9,16,Sep
8474189,Lars,Eller,8-May-89,May-8-1989,5/8/89,5/8/89,1989,5,8,May
8481206,John,Ludvig,2-Aug-00,Aug-2-2000,8/2/00,8/2/00,2000,8,2,Aug
8478854,Ryan,Shea,11-Feb-97,Feb-11-1997,2/11/97,2/11/97,1997,2,11,Feb
8445437,Tim,Bergland,11-Jan-65,Jan-11-1965,1/11/65,1/11/65,1965,1,11,Jan
8445672,Brian,Bradley,21-Jan-65,Jan-21-1965,1/21/65,1/21/65,1965,1,21,Jan
8446226,Adam,Creighton,2-Jun-65,Jun-2-1965,6/2/65,6/2/65,1965,6,2,Jun
8456117,Stan,Drulia,5-Jan-68,Jan-5-1968,1/5/68,1/5/68,1968,1,5,Jan
8449677,Michel,Mongeau,9-Feb-65,Feb-9-1965,2/9/65,2/9/65,1965,2,9,Feb
8450071,Keith,Osborne,2-Apr-69,Apr-2-1969,4/2/69,4/2/69,1969,4,2,Apr
8457883,Jason,Ruff,27-Jan-70,Jan-27-1970,1/27/70,1/27/70,1970,1,27,Jan
8451291,Anatoli,Semenov,5-Mar-62,Mar-5-1962,3/5/62,3/5/62,1962,3,5,Mar
8451381,Martin,Simard,25-Jan-66,Jan-25-1966,1/25/66,1/25/66,1966,1,25,Jan
8451987,John,Tucker,29-Sep-64,Sep-29-1964,9/29/64,9/29/64,1964,9,29,Sep
8458938,Roman,Hamrlik,12-Apr-74,Apr-12-1974,4/12/74,4/12/74,1974,4,12,Apr
8450742,Joe,Reekie,22-Feb-65,Feb-22-1965,2/22/65,2/22/65,1965,2,22,Feb
8458825,Shawn,Rivers,30-Jan-71,Jan-30-1971,1/30/71,1/30/71,1971,1,30,Jan
8445438,Jean Claude,Bergeron,14-Oct-68,Oct-14-1968,10/14/68,10/14/68,1968,10,14,Oct
8448207,Pat,Jablonski,20-Jun-67,Jun-20-1967,6/20/67,6/20/67,1967,6,20,Jun
8448776,David,Littman,13-Jun-67,Jun-13-1967,6/13/67,6/13/67,1967,6,13,Jun
8459425,Chris,Gratton,5-Jul-75,Jul-5-1975,7/5/75,7/5/75,1975,7,5,Jul
8458985,Brent,Gretzky,20-Feb-72,Feb-20-1972,2/20/72,2/20/72,1972,2,20,Feb
8451146,Denis,Savard,4-Feb-61,Feb-4-1961,2/4/61,2/4/61,1961,2,4,Feb
8455843,Eric,Charron,14-Jan-70,Jan-14-1970,1/14/70,1/14/70,1970,1,14,Jan
8446501,Donald,Dufresne,10-Apr-67,Apr-10-1967,4/10/67,4/10/67,1967,4,10,Apr
8450627,Daren,Puppa,23-Mar-65,Mar-23-1965,3/23/65,3/23/65,1965,3,23,Mar
8460628,Alexander,Selivanov,23-Mar-71,Mar-23-1971,3/23/71,3/23/71,1971,3,23,Mar
8450471,Adrian,Plavsic,13-Jan-70,Jan-13-1970,1/13/70,1/13/70,1970,1,13,Jan
8459206,Allan,Egeland,31-Jan-73,Jan-31-1973,1/31/73,1/31/73,1973,1,31,Jan
8459010,Aaron,Gavey,22-Feb-74,Feb-22-1974,2/22/74,2/22/74,1974,2,22,Feb
8462036,Daymond,Langkow,27-Sep-76,Sep-27-1976,9/27/76,9/27/76,1976,9,27,Sep
8458962,Drew,Bannister,9-Apr-74,Apr-9-1974,4/9/74,4/9/74,1974,4,9,Apr
8459081,Derek,Wilkinson,29-Jul-74,Jul-29-1974,7/29/74,7/29/74,1974,7,29,Jul
8458964,Paul,Brousseau,18-Sep-73,Sep-18-1973,9/18/73,9/18/73,1973,9,18,Sep
8459415,Brent,Peterson,20-Jul-72,Jul-20-1972,7/20/72,7/20/72,1972,7,20,Jul
8452366,Jay,Wells,18-May-59,May-18-1959,5/18/59,5/18/59,1959,5,18,May
8460494,Jason,Bonsignore,15-Apr-76,Apr-15-1976,4/15/76,4/15/76,1976,4,15,Apr
8456031,Louie,Debrusk,19-Mar-71,Mar-19-1971,3/19/71,3/19/71,1971,3,19,Mar
8457785,Mikael,Renberg,5-May-72,May-5-1972,5/5/72,5/5/72,1972,5,5,May
8462434,Corey,Spring,31-May-71,May-31-1971,5/31/71,5/31/71,1971,5,31,May
8459574,Darcy,Tucker,15-Mar-75,Mar-15-1975,3/15/75,3/15/75,1975,3,15,Mar
8452240,Mick,Vukota,14-Sep-66,Sep-14-1966,9/14/66,9/14/66,1966,9,14,Sep
8458543,Jassen,Cullimore,4-Dec-72,Dec-4-1972,12/4/72,12/4/72,1972,12,4,Dec
8456149,Karl,Dykhuis,8-Jul-72,Jul-8-1972,7/8/72,7/8/72,1972,7,8,Jul
8462059,Mike,Mcbain,12-Jan-77,Jan-12-1977,1/12/77,1/12/77,1977,1,12,Jan
8458956,David,Wilkie,30-May-74,May-30-1974,5/30/74,5/30/74,1974,5,30,May
8462247,Zac,Bierk,17-Sep-76,Sep-17-1976,9/17/76,9/17/76,1976,9,17,Sep
8446829,Mark,Fitzpatrick,13-Nov-68,Nov-13-1968,11/13/68,11/13/68,1968,11,13,Nov
8465125,Xavier,Delisle,24-May-77,May-24-1977,5/24/77,5/24/77,1977,5,24,May
8460654,Colin,Forbes,16-Feb-76,Feb-16-1976,2/16/76,2/16/76,1976,2,16,Feb
8467329,Vincent,Lecavalier,21-Apr-80,Apr-21-1980,4/21/80,4/21/80,1980,4,21,Apr
8466242,Karel,Betik,28-Oct-78,Oct-28-1978,10/28/78,10/28/78,1978,10,28,Oct
8462096,Sergey,Gusev,31-Jul-75,Jul-31-1975,7/31/75,7/31/75,1975,7,31,Jul
8459038,Sami,Helenius,22-Jan-74,Jan-22-1974,1/22/74,1/22/74,1974,1,22,Jan
8464969,Mario,Larocque,24-Apr-78,Apr-24-1978,4/24/78,4/24/78,1978,4,24,Apr
8451789,Petr,Svoboda,14-Feb-66,Feb-14-1966,2/14/66,2/14/66,1966,2,14,Feb
8466162,Ben,Clymer,11-Apr-78,Apr-11-1978,4/11/78,4/11/78,1978,4,11,Apr
8465020,Gordie,Dwyer,25-Jan-78,Jan-25-1978,1/25/78,1/25/78,1978,1,25,Jan
8466195,Matt,Elich,22-Sep-78,Sep-22-1978,9/22/78,9/22/78,1978,9,22,Sep
8466198,Kyle,Freadrich,28-Dec-78,Dec-28-1978,12/28/78,12/28/78,1978,12,28,Dec
8462071,Dwayne,Hay,11-Feb-77,Feb-11-1977,2/11/77,2/11/77,1977,2,11,Feb
8460527,Ryan,Johnson,14-Jun-76,Jun-14-1976,6/14/76,6/14/76,1976,6,14,Jun
8466109,Mike,Johnson,3-Oct-74,Oct-3-1974,10/3/74,10/3/74,1974,10,3,Oct
8468160,Dale,Rominski,1-Oct-75,Oct-1-1975,10/1/75,10/1/75,1975,10,1,Oct
8459047,Jeff,Shevalier,14-Mar-74,Mar-14-1974,3/14/74,3/14/74,1974,3,14,Mar
8464970,Jaroslav,Svejkovsky,1-Oct-76,Oct-1-1976,10/1/76,10/1/76,1976,10,1,Oct
8460763,Pavel,Torgaev,25-Jan-66,Jan-25-1966,1/25/66,1/25/66,1966,1,25,Jan
8458941,Todd,Warriner,3-Jan-74,Jan-3-1974,1/3/74,1/3/74,1974,1,3,Jan
8468000,Kaspars,Astashenko,17-Feb-75,Feb-17-1975,2/17/75,2/17/75,1975,2,17,Feb
8456576,Ian,Herbers,18-Jul-67,Jul-18-1967,7/18/67,7/18/67,1967,7,18,Jul
8464990,Marek,Posmyk,15-Sep-78,Sep-15-1978,9/15/78,9/15/78,1978,9,15,Sep
8464981,Cory,Sarich,16-Aug-78,Aug-16-1978,8/16/78,8/16/78,1978,8,16,Aug
8460516,Dan,Cloutier,22-Apr-76,Apr-22-1976,4/22/76,4/22/76,1976,4,22,Apr
8459523,Dieter,Kochan,11-May-74,May-11-1974,5/11/74,5/11/74,1974,5,11,May
8467397,Dimitri,Afanasenkov,12-May-80,May-12-1980,5/12/80,5/12/80,1980,5,12,May
8467920,Sheldon,Keefe,17-Sep-80,Sep-17-1980,9/17/80,9/17/80,1980,9,17,Sep
8468561,Alexandre,Kharitonov,30-Mar-76,Mar-30-1976,3/30/76,3/30/76,1976,3,30,Mar
8466378,Martin,St. Louis,18-Jun-75,Jun-18-1975,6/18/75,6/18/75,1975,6,18,Jun
8468743,Thomas,Ziegler,9-Jun-78,Jun-9-1978,6/9/78,6/9/78,1978,6,9,Jun
8459053,Adrian,Aucoin,3-Jul-73,Jul-3-1973,7/3/73,7/3/73,1973,7,3,Jul
8467901,Kristian,Kudroc,21-May-81,May-21-1981,5/21/81,5/21/81,1981,5,21,May
8460711,Craig,Millar,12-Jul-76,Jul-12-1976,7/12/76,7/12/76,1976,7,12,Jul
8460520,Stan,Neckar,22-Dec-75,Dec-22-1975,12/22/75,12/22/75,1975,12,22,Dec
8467940,Evgeny,Konstantinov,29-Mar-81,Mar-29-1981,3/29/81,3/29/81,1981,3,29,Mar
8468488,Nikita,Alexeev,27-Dec-81,Dec-27-1981,12/27/81,12/27/81,1981,12,27,Dec
8467557,Martin,Cibak,17-May-80,May-17-1980,5/17/80,5/17/80,1980,5,17,May
8460509,Chris,Dingman,6-Jul-76,Jul-6-1976,7/6/76,7/6/76,1976,7,6,Jul
8467961,Jimmie,Olvestad,16-Feb-80,Feb-16-1980,2/16/80,2/16/80,1980,2,16,Feb
8459492,Vinny,Prospal,17-Feb-75,Feb-17-1975,2/17/75,2/17/75,1975,2,17,Feb
8460821,Gaetan,Royer,13-Mar-76,Mar-13-1976,3/13/76,3/13/76,1976,3,13,Mar
8462633,Ryan,Tobler,13-May-76,May-13-1976,5/13/76,5/13/76,1976,5,13,May
8462085,Shane,Willis,13-Jun-77,Jun-13-1977,6/13/77,6/13/77,1977,6,13,Jun
8458605,Juha,Ylonen,13-Feb-72,Feb-13-1972,2/13/72,2/13/72,1972,2,13,Feb
8467345,Mathieu,Biron,29-Apr-80,Apr-29-1980,4/29/80,4/29/80,1980,4,29,Apr
8469456,Alexander,Svitov,3-Nov-82,Nov-3-1982,11/3/82,11/3/82,1982,11,3,Nov
8451059,Darren,Rumble,23-Jan-69,Jan-23-1969,1/23/69,1/23/69,1969,1,23,Jan
8458943,Cory,Stillman,20-Dec-73,Dec-20-1973,12/20/73,12/20/73,1973,12,20,Dec
8458542,Jim,Campbell,3-Feb-73,Feb-3-1973,2/3/73,2/3/73,1973,2,3,Feb
8467373,Norman,Milley,14-Feb-80,Feb-14-1980,2/14/80,2/14/80,1980,2,14,Feb
8470076,Darren,Reid,8-May-83,May-8-1983,5/8/83,5/8/83,1983,5,8,May
8470876,Nick,Tarnasky,25-Nov-84,Nov-25-1984,11/25/84,11/25/84,1984,11,25,Nov
8468035,Timo,Helbling,21-Jul-81,Jul-21-1981,7/21/81,7/21/81,1981,7,21,Jul
8470784,Doug,O'Brien,16-Feb-84,Feb-16-1984,2/16/84,2/16/84,1984,2,16,Feb
8470085,Paul,Ranger,12-Sep-84,Sep-12-1984,9/12/84,9/12/84,1984,9,12,Sep
8470813,Gerald,Coleman,3-Apr-85,Apr-3-1985,4/3/85,4/3/85,1985,4,3,Apr
8468706,Brian,Eklund,24-May-80,May-24-1980,5/24/80,5/24/80,1980,5,24,May
8471767,Blair,Jones,27-Sep-86,Sep-27-1986,9/27/86,9/27/86,1986,9,27,Sep
8467962,Kyle,Wanvig,29-Jan-81,Jan-29-1981,1/29/81,1/29/81,1981,1,29,Jan
8466147,Jason,Ward,16-Jan-79,Jan-16-1979,1/16/79,1/16/79,1979,1,16,Jan
8462225,Filip,Kuba,29-Dec-76,Dec-29-1976,12/29/76,12/29/76,1976,12,29,Dec
8470839,Shane,O'Brien,9-Aug-83,Aug-9-1983,8/9/83,8/9/83,1983,8,9,Aug
8450824,Luke,Richardson,26-Mar-69,Mar-26-1969,3/26/69,3/26/69,1969,3,26,Mar
8462055,Marc,Denis,1-Aug-77,Aug-1-1977,8/1/77,8/1/77,1977,8,1,Aug
8466303,Johan,Holmqvist,24-May-78,May-24-1978,5/24/78,5/24/78,1978,5,24,May
8471403,Karri,Ramo,1-Jul-86,Jul-1-1986,7/1/86,7/1/86,1986,7,1,Jul
8467831,Jeff,Halpern,3-May-76,May-3-1976,5/3/76,5/3/76,1976,5,3,May
8462081,Jan,Hlavac,20-Sep-76,Sep-20-1976,9/20/76,9/20/76,1976,9,20,Sep
8471206,Junior,Lessard,26-May-80,May-26-1980,5/26/80,5/26/80,1980,5,26,May
8467939,Dan,Jancevski,15-Jun-81,Jun-15-1981,6/15/81,6/15/81,1981,6,15,Jun
8471314,Mike,Lundin,24-Sep-84,Sep-24-1984,9/24/84,9/24/84,1984,9,24,Sep
8470634,Matt,Smaby,14-Oct-84,Oct-14-1984,10/14/84,10/14/84,1984,10,14,Oct
8469608,Mike,Smith,22-Mar-82,Mar-22-1982,3/22/82,3/22/82,1982,3,22,Mar
8468626,David,Koci,12-May-81,May-12-1981,5/12/81,5/12/81,1981,5,12,May
8469820,Zenon,Konopka,2-Jan-81,Jan-2-1981,1/2/81,1/2/81,1981,1,2,Jan
8468523,Matt,Pettinger,22-Oct-80,Oct-22-1980,10/22/80,10/22/80,1980,10,22,Oct
8469755,Brandon,Segal,12-Jul-83,Jul-12-1983,7/12/83,7/12/83,1983,7,12,Jul
8471736,Radek,Smolenak,3-Dec-86,Dec-3-1986,12/3/86,12/3/86,1986,12,3,Dec
8474564,Steven,Stamkos,7-Feb-90,Feb-7-1990,2/7/90,2/7/90,1990,2,7,Feb
8473898,Paul,Szczechura,30-Nov-85,Nov-30-1985,11/30/85,11/30/85,1985,11,30,Nov
8468085,Radim,Vrbata,13-Jun-81,Jun-13-1981,6/13/81,6/13/81,1981,6,13,Jun
8470192,Steve,Eminger,31-Oct-83,Oct-31-1983,10/31/83,10/31/83,1983,10,31,Oct
8456588,Jamie,Heward,30-Mar-71,Mar-30-1971,3/30/71,3/30/71,1971,3,30,Mar
8475073,Geoff,Kinrade,29-Jul-85,Jul-29-1985,7/29/85,7/29/85,1985,7,29,Jul
8469477,Lukas,Krajicek,11-Mar-83,Mar-11-1983,3/11/83,3/11/83,1983,3,11,Mar
8471704,Vladimir,Mihalik,29-Jan-87,Jan-29-1987,1/29/87,1/29/87,1987,1,29,Jan
8471359,Janne,Niskala,22-Sep-81,Sep-22-1981,9/22/81,9/22/81,1981,9,22,Sep
8469564,Richard,Petiot,20-Aug-82,Aug-20-1982,8/20/82,8/20/82,1982,8,20,Aug
8473433,Kevin,Quick,29-Mar-88,Mar-29-1988,3/29/88,3/29/88,1988,3,29,Mar
8473501,Ty,Wishart,19-May-88,May-19-1988,5/19/88,5/19/88,1988,5,19,May
8473474,Riku,Helenius,1-Mar-88,Mar-1-1988,3/1/88,3/1/88,1988,3,1,Mar
8448535,Olie,Kolzig,6-Apr-70,Apr-6-1970,4/6/70,4/6/70,1970,4,6,Apr
8466292,Todd,Fedoruk,13-Feb-79,Feb-13-1979,2/13/79,2/13/79,1979,2,13,Feb
8465026,Mark,Parrish,2-Feb-77,Feb-2-1977,2/2/77,2/2/77,1977,2,2,Feb
8473962,Teddy,Purcell,8-Sep-85,Sep-8-1985,9/8/85,9/8/85,1985,9,8,Sep
8467338,Alex,Tanguay,21-Nov-79,Nov-21-1979,11/21/79,11/21/79,1979,11,21,Nov
8475167,Victor,Hedman,18-Dec-90,Dec-18-1990,12/18/90,12/18/90,1990,12,18,Dec
8471711,Scott,Jackson,5-Feb-87,Feb-5-1987,2/5/87,2/5/87,1987,2,5,Feb
8460503,Mattias,Ohlund,9-Sep-76,Sep-9-1976,9/9/76,9/9/76,1976,9,9,Sep
8467408,Matt,Walker,7-Apr-80,Apr-7-1980,4/7/80,4/7/80,1980,4,7,Apr
8470176,Sean,Bergenheim,8-Feb-84,Feb-8-1984,2/8/84,2/8/84,1984,2,8,Feb
8474085,Johan,Harju,15-May-86,May-15-1986,5/15/86,5/15/86,1986,5,15,May
8470615,Marc-Antoine,Pouliot,22-May-85,May-22-1985,5/22/85,5/22/85,1985,5,22,May
8474095,Dana,Tyrell,23-Apr-89,Apr-23-1989,4/23/89,4/23/89,1989,4,23,Apr
8469765,Marc-Andre,Bergeron,13-Oct-80,Oct-13-1980,10/13/80,10/13/80,1980,10,13,Oct
8466142,Eric,Brewer,17-Apr-79,Apr-17-1979,4/17/79,4/17/79,1979,4,17,Apr
8470804,Mathieu,Roy,10-Aug-83,Aug-10-1983,8/10/83,8/10/83,1983,8,10,Aug
8471413,Mike,Vernace,26-May-86,May-26-1986,5/26/86,5/26/86,1986,5,26,May
8473638,Cedrick,Desjardins,30-Sep-85,Sep-30-1985,9/30/85,9/30/85,1985,9,30,Sep
8468540,Dan,Ellis,19-Jun-80,Jun-19-1980,6/19/80,6/19/80,1980,6,19,Jun
8460806,Dwayne,Roloson,12-Oct-69,Oct-12-1969,10/12/69,10/12/69,1969,10,12,Oct
8471916,Mike,Angelidis,27-Jun-85,Jun-27-1985,6/27/85,6/27/85,1985,6,27,Jun
8476806,JT,Brown,2-Jul-90,Jul-2-1990,7/2/90,7/2/90,1990,7,2,Jul
8474201,Pierre-Cedric,Labrie,6-Dec-86,Dec-6-1986,12/6/86,12/6/86,1986,12,6,Dec
8471768,Tom,Pyatt,14-Feb-87,Feb-14-1987,2/14/87,2/14/87,1987,2,14,Feb
8471634,Ryan,Shannon,2-Mar-83,Mar-2-1983,3/2/83,3/2/83,1983,3,2,Mar
8471312,JT,Wyman,27-Feb-86,Feb-27-1986,2/27/86,2/27/86,1986,2,27,Feb
8474048,Keith,Aulie,11-Jun-89,Jun-11-1989,6/11/89,6/11/89,1989,6,11,Jun
8470774,Bruno,Gervais,3-Oct-84,Oct-3-1984,10/3/84,10/3/84,1984,10,3,Oct
8475118,Matt,Gilroy,20-Jul-84,Jul-20-1984,7/20/84,7/20/84,1984,7,20,Jul
8471683,Brian,Lee,26-Mar-87,Mar-26-1987,3/26/87,3/26/87,1987,3,26,Mar
8471705,Brendan,Mikkelson,22-Jun-87,Jun-22-1987,6/22/87,6/22/87,1987,6,22,Jun
8475104,Evan,Oberg,16-Feb-88,Feb-16-1988,2/16/88,2/16/88,1988,2,16,Feb
8476195,Cory,Conacher,14-Dec-89,Dec-14-1989,12/14/89,12/14/89,1989,12,14,Dec
8470647,B.J.,Crombeen,10-Jul-85,Jul-10-1985,7/10/85,7/10/85,1985,7,10,Jul
8474870,Tyler,Johnson,29-Jul-90,Jul-29-1990,7/29/90,7/29/90,1990,7,29,Jul
8473986,Alex,Killorn,14-Sep-89,Sep-14-1989,9/14/89,9/14/89,1989,9,14,Sep
8474717,Mark,Barberio,23-Mar-90,Mar-23-1990,3/23/90,3/23/90,1990,3,23,Mar
8475462,Radko,Gudas,5-Jun-90,Jun-5-1990,6/5/90,6/5/90,1990,6,5,Jun
8465202,Sami,Salo,2-Sep-74,Sep-2-1974,9/2/74,9/2/74,1974,9,2,Sep
8477205,Andrej,Sustr,29-Nov-90,Nov-29-1990,11/29/90,11/29/90,1990,11,29,Nov
8471750,Ben,Bishop,21-Nov-86,Nov-21-1986,11/21/86,11/21/86,1986,11,21,Nov
8474765,Anders,Lindback,3-May-88,May-3-1988,5/3/88,5/3/88,1988,5,3,May
8471339,Ryan,Callahan,21-Mar-85,Mar-21-1985,3/21/85,3/21/85,1985,3,21,Mar
8476453,Nikita,Kucherov,17-Jun-93,Jun-17-1993,6/17/93,6/17/93,1993,6,17,Jun
8477832,Cody,Kunyk,20-May-90,May-20-1990,5/20/90,5/20/90,1990,5,20,May
8476975,Cedric,Paquette,13-Aug-93,Aug-13-1993,8/13/93,8/13/93,1993,8,13,Aug
8468745,Jean-Philippe,Cote,22-Apr-82,Apr-22-1982,4/22/82,4/22/82,1982,4,22,Apr
8477082,Dmitry,Korobov,12-Mar-89,Mar-12-1989,3/12/89,3/12/89,1989,3,12,Mar
8474497,Michael,Kostka,28-Nov-85,Nov-28-1985,11/28/85,11/28/85,1985,11,28,Nov
8477356,Kristers,Gudlevskis,31-Jul-92,Jul-31-1992,7/31/92,7/31/92,1992,7,31,Jul
8471663,Mike,Blunden,15-Dec-86,Dec-15-1986,12/15/86,12/15/86,1986,12,15,Dec
8477494,Jonathan,Drouin,28-Mar-95,Mar-28-1995,3/28/95,3/28/95,1995,3,28,Mar
8476539,Jonathan,Marchessault,27-Dec-90,Dec-27-1990,12/27/90,12/27/90,1990,12,27,Dec
8474520,Jason,Garrison,13-Nov-84,Nov-13-1984,11/13/84,11/13/84,1984,11,13,Nov
8476886,Slater,Koekkoek,18-Feb-94,Feb-18-1994,2/18/94,2/18/94,1994,2,18,Feb
8476300,Nikita,Nesterov,28-Mar-93,Mar-28-1993,3/28/93,3/28/93,1993,3,28,Mar
8476883,Andrei,Vasilevskiy,25-Jul-94,Jul-25-1994,7/25/94,7/25/94,1994,7,25,Jul
8473588,Erik,Condra,6-Aug-86,Aug-6-1986,8/6/86,8/6/86,1986,8,6,Aug
8476826,Yanni,Gourde,15-Dec-91,Dec-15-1991,12/15/91,12/15/91,1991,12,15,Dec
8477326,Joel,Vermin,5-Feb-92,Feb-5-1992,2/5/92,2/5/92,1992,2,5,Feb
8475739,Michael,Bournival,31-May-92,May-31-1992,5/31/92,5/31/92,1992,5,31,May
8475254,Gabriel,Dumont,6-Oct-90,Oct-6-1990,10/6/90,10/6/90,1990,10,6,Oct
8475278,Byron,Froese,12-Mar-91,Mar-12-1991,3/12/91,3/12/91,1991,3,12,Mar
8476285,Matthew,Peca,27-Apr-93,Apr-27-1993,4/27/93,4/27/93,1993,4,27,Apr
8478010,Brayden,Point,13-Mar-96,Mar-13-1996,3/13/96,3/13/96,1996,3,13,Mar
8476911,Tanner,Richard,6-Apr-93,Apr-6-1993,4/6/93,4/6/93,1993,4,6,Apr
8477009,Jake,Dotchin,24-Mar-94,Mar-24-1994,3/24/94,3/24/94,1994,3,24,Mar
8469514,Peter,Budaj,18-Sep-82,Sep-18-1982,9/18/82,9/18/82,1982,9,18,Sep
8478519,Anthony,Cirelli,15-Jul-97,Jul-15-1997,7/15/97,7/15/97,1997,7,15,Jul
8476468,J.T.,Miller,14-Mar-93,Mar-14-1993,3/14/93,3/14/93,1993,3,14,Mar
8471958,Dan,Girardi,29-Apr-84,Apr-29-1984,4/29/84,4/29/84,1984,4,29,Apr
8474151,Ryan,McDonagh,13-Jun-89,Jun-13-1989,6/13/89,6/13/89,1989,6,13,Jun
8479410,Mikhail,Sergachev,25-Jun-98,Jun-25-1998,6/25/98,6/25/98,1998,6,25,Jun
8478472,Mathieu,Joseph,9-Feb-97,Feb-9-1997,2/9/97,2/9/97,1997,2,9,Feb
8478365,Danick,Martel,12-Dec-94,Dec-12-1994,12/12/94,12/12/94,1994,12,12,Dec
8478416,Erik,Cernak,28-May-97,May-28-1997,5/28/97,5/28/97,1997,5,28,May
8475277,Edward,Pasquale,20-Nov-90,Nov-20-1990,11/20/90,11/20/90,1990,11,20,Nov
8477409,Carter,Verhaeghe,14-Aug-95,Aug-14-1995,8/14/95,8/14/95,1995,8,14,Aug
8480186,Alexander,Volkov,2-Aug-97,Aug-2-1997,8/2/97,8/2/97,1997,8,2,Aug
8474568,Luke,Schenn,2-Nov-89,Nov-2-1989,11/2/89,11/2/89,1989,11,2,Nov
8470147,Curtis,McElhinney,23-May-83,May-23-1983,5/23/83,5/23/83,1983,5,23,May
8479718,Alex,Barr-Boulet,21-May-97,May-21-1997,5/21/97,5/21/97,1997,5,21,May
8479525,Ross,Colton,11-Sep-96,Sep-11-1996,9/11/96,9/11/96,1996,9,11,Sep
8478069,Daniel,Walcott,19-Feb-94,Feb-19-1994,2/19/94,2/19/94,1994,2,19,Feb
8480158,Andreas,Borgman,18-Jun-95,Jun-18-1995,6/18/95,6/18/95,1995,6,18,Jun
8479984,Cal,Foote,13-Dec-98,Dec-13-1998,12/13/98,12/13/98,1998,12,13,Dec
8475233,David,Savard,22-Oct-90,Oct-22-1990,10/22/90,10/22/90,1990,10,22,Oct
8478049,Ben,Thomas,28-May-96,May-28-1996,5/28/96,5/28/96,1996,5,28,May
8476444,Christopher,Gibson,27-Dec-92,Dec-27-1992,12/27/92,12/27/92,1992,12,27,Dec
8477930,Pierre-Edouard,Bellemare,6-Mar-85,Mar-6-1985,3/6/85,3/6/85,1985,3,6,Mar
8477461,Remi,Elie,16-Apr-95,Apr-16-1995,4/16/95,4/16/95,1995,4,16,Apr
8480863,Gabriel,Fortier,6-Feb-00,Feb-6-2000,2/6/00,2/6/00,2000,2,6,Feb
8479542,Brandon,Hagel,27-Aug-98,Aug-27-1998,8/27/98,8/27/98,1998,8,27,Aug
8479383,Boris,Katchouk,18-Jun-98,Jun-18-1998,6/18/98,6/18/98,1998,6,18,Jun
8477426,Nicholas,Paul,20-Mar-95,Mar-20-1995,3/20/95,3/20/95,1995,3,20,Mar
8470621,Corey,Perry,16-May-85,May-16-1985,5/16/85,5/16/85,1985,5,16,May
8479390,Taylor,Raddysh,18-Feb-98,Feb-18-1998,2/18/98,2/18/98,1998,2,18,Feb
8479413,Sean,Day,9-Jan-98,Jan-9-1998,1/9/98,1/9/98,1998,1,9,Jan
8478178,Darren,Raddysh,28-Feb-96,Feb-28-1996,2/28/96,2/28/96,1996,2,28,Feb
8481597,Hugo,Alnefelt,4-Jun-01,Jun-4-2001,6/4/01,6/4/01,2001,6,4,Jun
8470880,Brian,Elliott,9-Apr-85,Apr-9-1985,4/9/85,4/9/85,1985,4,9,Apr
8479661,Tanner,Jeannot,29-May-97,May-29-1997,5/29/97,5/29/97,1997,5,29,May
8481043,Cole,Koepke,17-May-98,May-17-1998,5/17/98,5/17/98,1998,5,17,May
8477938,Haydn,Fleury,8-Jul-96,Jul-8-1996,7/8/96,7/8/96,1996,7,8,Jul
8479026,Philippe,Myers,25-Jan-97,Jan-25-1997,1/25/97,1/25/97,1997,1,25,Jan
8480246,Nick,Perbix,15-Jun-98,Jun-15-1998,6/15/98,6/15/98,1998,6,15,Jun
8477353,Tyler,Motte,10-Mar-95,Mar-10-1995,3/10/95,3/10/95,1995,3,10,Mar
8475766,Austin,Watson,13-Jan-92,Jan-13-1992,1/13/92,1/13/92,1992,1,13,Jan
8482929,Emil,Martinsen Lilleberg,2-Feb-01,Feb-2-2001,2/2/01,2/2/01,2001,2,2,Feb
8482144,Jack,Thompson,19-Mar-02,Mar-19-2002,3/19/02,3/19/02,2002,3,19,Mar
8475177,Calvin,de Haan,9-May-91,May-9-1991,5/9/91,5/9/91,1991,5,9,May
8477992,Jonas,Johansson,19-Sep-95,Sep-19-1995,9/19/95,9/19/95,1995,9,19,Sep
8446692,Pat,Hannigan,5-Mar-36,Mar-5-1936,3/5/36,3/5/36,1936,3,5,Mar
8446889,Ed,Hoekstra,4-Nov-37,Nov-4-1937,11/4/37,11/4/37,1937,11,4,Nov
8447099,Jim,Johnson,7-Nov-42,Nov-7-1942,11/7/42,11/7/42,1942,11,7,Nov
8448079,Rosaire,Paiement,12-Aug-45,Aug-12-1945,8/12/45,8/12/45,1945,8,12,Aug
8448966,Brit,Selby,27-Mar-45,Mar-27-1945,3/27/45,3/27/45,1945,3,27,Mar
8449605,Keith,Wright,13-Apr-44,Apr-13-1944,4/13/44,4/13/44,1944,4,13,Apr
8445006,Terry,Ball,29-Nov-44,Nov-29-1944,11/29/44,11/29/44,1944,11,29,Nov
8446690,John,Hanna,5-Apr-35,Apr-5-1935,4/5/35,4/5/35,1935,4,5,Apr
8447584,Ralph,MacSweyn,8-Sep-42,Sep-8-1942,9/8/42,9/8/42,1942,9,8,Sep
8448129,Roger,Pelletier,22-Jun-45,Jun-22-1945,6/22/45,6/22/45,1945,6,22,Jun
8445302,Mike,Byers,11-Sep-46,Sep-11-1946,9/11/46,9/11/46,1946,9,11,Sep
8446765,Earl,Heiskala,30-Nov-42,Nov-30-1942,11/30/42,11/30/42,1942,11,30,Nov
8448786,Dick,Sarrazin,22-Jan-46,Jan-22-1946,1/22/46,1/22/46,1946,1,22,Jan
8449154,Myron,Stankiewicz,4-Dec-35,Dec-4-1935,12/4/35,12/4/35,1935,12,4,Dec
8446663,Larry,Hale,9-Oct-41,Oct-9-1941,10/9/41,10/9/41,1941,10,9,Oct
8446098,Bobby,Clarke,13-Aug-49,Aug-13-1949,8/13/49,8/13/49,1949,8,13,Aug
8448444,Bob,Kelly,25-Nov-50,Nov-25-1950,11/25/50,11/25/50,1950,11,25,Nov
8448924,Cliff,Schmautz,17-Mar-39,Mar-17-1939,3/17/39,3/17/39,1939,3,17,Mar
8445179,Willie,Brossart,29-May-49,May-29-1949,5/29/49,5/29/49,1949,5,29,May
8447589,Jim,Mair,15-May-46,May-15-1946,5/15/46,5/15/46,1946,5,15,May
8447145,Larry,Keenan,1-Oct-40,Oct-1-1940,10/1/40,10/1/40,1940,10,1,Oct
8447853,Larry,Mickey,21-Oct-43,Oct-21-1943,10/21/43,10/21/43,1943,10,21,Oct
8450198,Michel,Parizeau,9-Apr-48,Apr-9-1948,4/9/48,4/9/48,1948,4,9,Apr
8445252,Bill,Barber,11-Jul-52,Jul-11-1952,7/11/52,7/11/52,1952,7,11,Jul
8452319,Jimmy,Watson,19-Aug-52,Aug-19-1952,8/19/52,8/19/52,1952,8,19,Aug
8449811,Michel,Belhumeur,2-Sep-49,Sep-2-1949,9/2/49,9/2/49,1949,9,2,Sep
8445749,Bruce,Cowick,18-Aug-51,Aug-18-1951,8/18/51,8/18/51,1951,8,18,Aug
8445112,Mike,Boland,16-Dec-49,Dec-16-1949,12/16/49,12/16/49,1949,12,16,Dec
8448067,Randy,Osburn,26-Nov-52,Nov-26-1952,11/26/52,11/26/52,1952,11,26,Nov
8451385,Bob,Sirois,6-Feb-54,Feb-6-1954,2/6/54,2/6/54,1954,2,6,Feb
8447293,Larry,Goodenough,19-Jan-53,Jan-19-1953,1/19/53,1/19/53,1953,1,19,Jan
8451695,Wayne,Stephenson,29-Jan-45,Jan-29-1945,1/29/45,1/29/45,1945,1,29,Jan
8450048,Jerome,Mrazek,15-Oct-51,Oct-15-1951,10/15/51,10/15/51,1951,10,15,Oct
8445860,Drew,Callander,17-Aug-56,Aug-17-1956,8/17/56,8/17/56,1956,8,17,Aug
8447819,Al,Hill,22-Apr-55,Apr-22-1955,4/22/55,4/22/55,1955,4,22,Apr
8446291,Bob,Dailey,3-May-53,May-3-1953,5/3/53,5/3/53,1953,5,3,May
8446274,Jim,Cunningham,15-Aug-56,Aug-15-1956,8/15/56,8/15/56,1956,8,15,Aug
8451626,Rick,St. Croix,3-Jan-55,Jan-3-1955,1/3/55,1/3/55,1955,1,3,Jan
8446741,John Paul,Evans,2-May-54,May-2-1954,5/2/54,5/2/54,1954,5,2,May
8447302,Tom,Gorence,11-Mar-57,Mar-11-1957,3/11/57,3/11/57,1957,3,11,Mar
8448894,Daniel,Lucas,28-Feb-58,Feb-28-1958,2/28/58,2/28/58,1958,2,28,Feb
8450540,Yves,Preston,14-Jun-56,Jun-14-1956,6/14/56,6/14/56,1956,6,14,Jun
8452220,Dennis,Ververgaert,30-Mar-53,Mar-30-1953,3/30/53,3/30/53,1953,3,30,Mar
8446111,Glen,Cochrane,29-Jan-58,Jan-29-1958,1/29/58,1/29/58,1958,1,29,Jan
8452492,Behn,Wilson,19-Dec-58,Dec-19-1958,12/19/58,12/19/58,1958,12,19,Dec
8449691,Robbie,Moore,3-May-54,May-3-1954,5/3/54,5/3/54,1954,5,3,May
8449704,Gary,Morrison,8-Nov-55,Nov-8-1955,11/8/55,11/8/55,1955,11,8,Nov
8445798,Mike,Busniuk,13-Dec-51,Dec-13-1951,12/13/51,12/13/51,1951,12,13,Dec
8446711,Thomas,Eriksson,16-Oct-59,Oct-16-1959,10/16/59,10/16/59,1959,10,16,Oct
8452461,Gord,Williams,10-Apr-60,Apr-10-1960,4/10/60,4/10/60,1960,4,10,Apr
8445626,Mark,Botell,27-Aug-61,Aug-27-1961,8/27/61,8/27/61,1961,8,27,Aug
8451559,Steven,Smith,4-Apr-63,Apr-4-1963,4/4/63,4/4/63,1963,4,4,Apr
8448853,Pelle,Lindbergh,24-May-59,May-24-1959,5/24/59,5/24/59,1959,5,24,May
8446828,Ross,Fitzpatrick,7-Oct-60,Oct-7-1960,10/7/60,10/7/60,1960,10,7,Oct
8446538,Miroslav,Dvorak,11-Oct-51,Oct-11-1951,10/11/51,10/11/51,1951,10,11,Oct
8446982,Bob,Froese,30-Jun-58,Jun-30-1958,6/30/58,6/30/58,1958,6,30,Jun
8448700,Michel,Larocque,6-Apr-52,Apr-6-1952,4/6/52,4/6/52,1952,4,6,Apr
8447439,Len,Hachborn,4-Sep-61,Sep-4-1961,9/4/61,9/4/61,1961,9,4,Sep
8451653,Daryl,Stanley,2-Dec-62,Dec-2-1962,12/2/62,12/2/62,1962,12,2,Dec
8445421,Todd,Bergen,11-Jul-63,Jul-11-1963,7/11/63,7/11/63,1963,7,11,Jul
8451758,Michael,Stothers,22-Feb-62,Feb-22-1962,2/22/62,2/22/62,1962,2,22,Feb
8448269,Darren,Jensen,27-May-60,May-27-1960,5/27/60,5/27/60,1960,5,27,May
8446618,Pelle,Eklund,22-Mar-63,Mar-22-1963,3/22/63,3/22/63,1963,3,22,Mar
8445440,Craig,Berube,17-Dec-65,Dec-17-1965,12/17/65,12/17/65,1965,12,17,Dec
8446970,Mark,Freer,14-Jul-68,Jul-14-1968,7/14/68,7/14/68,1968,7,14,Jul
8451260,Glen,Seabrooke,11-Sep-67,Sep-11-1967,9/11/67,9/11/67,1967,9,11,Sep
8449763,Mike,Murray,29-Aug-66,Aug-29-1966,8/29/66,8/29/66,1966,8,29,Aug
8451016,Magnus,Roupe,23-Mar-63,Mar-23-1963,3/23/63,3/23/63,1963,3,23,Mar
8446796,David,Fenyves,29-Apr-60,Apr-29-1960,4/29/60,4/29/60,1960,4,29,Apr
8451010,Bill,Root,6-Sep-59,Sep-6-1959,9/6/59,9/6/59,1959,9,6,Sep
8447563,Jeff,Harding,6-Apr-69,Apr-6-1969,4/6/69,4/6/69,1969,4,6,Apr
8446306,Marc,D'amour,29-May-61,May-29-1961,5/29/61,5/29/61,1961,5,29,May
8447963,Tony,Horacek,3-Feb-67,Feb-3-1967,2/3/67,2/3/67,1967,2,3,Feb
8448268,Chris,Jensen,28-Oct-63,Oct-28-1963,10/28/63,10/28/63,1963,10,28,Oct
8448603,Normand,Lacombe,18-Oct-64,Oct-18-1964,10/18/64,10/18/64,1964,10,18,Oct
8449037,Kevin,Maguire,5-Jan-63,Jan-5-1963,1/5/63,1/5/63,1963,1,5,Jan
8445266,Murray,Baron,1-Jun-67,Jun-1-1967,6/1/67,6/1/67,1967,6,1,Jun
8448677,Jiri,Latal,2-Feb-67,Feb-2-1967,2/2/67,2/2/67,1967,2,2,Feb
8451094,Shawn,Sabol,13-Apr-66,Apr-13-1966,4/13/66,4/13/66,1966,4,13,Apr
8447920,Bruce,Hoffort,30-Jul-66,Jul-30-1966,7/30/66,7/30/66,1966,7,30,Jul
8445065,Bill,Armstrong,25-Jun-66,Jun-25-1966,6/25/66,6/25/66,1966,6,25,Jun
8456008,Kimbi,Daniels,19-Jan-72,Jan-19-1972,1/19/72,1/19/72,1972,1,19,Jan
8447961,Martin,Hostak,11-Nov-67,Nov-11-1967,11/11/67,11/11/67,1967,11,11,Nov
8448547,Dale,Kushner,13-Jun-66,Jun-13-1966,6/13/66,6/13/66,1966,6,13,Jun
8449776,Patrick,Murray,20-Aug-69,Aug-20-1969,8/20/69,8/20/69,1969,8,20,Aug
8455646,Claude,Boivin,1-Mar-70,Mar-1-1970,3/1/70,3/1/70,1970,3,1,Mar
8445735,Rod,Brind'Amour,9-Aug-70,Aug-9-1970,8/9/70,8/9/70,1970,8,9,Aug
8455920,John,Conroy,17-Jan-66,Jan-17-1966,1/17/66,1/17/66,1966,1,17,Jan
8446296,Rod,Dallman,26-Jan-67,Jan-26-1967,1/26/67,1/26/67,1967,1,26,Jan
8458564,Yanick,Dupre,20-Nov-72,Nov-20-1972,11/20/72,11/20/72,1972,11,20,Nov
8456874,Dan,Kordic,18-Apr-71,Apr-18-1971,4/18/71,4/18/71,1971,4,18,Apr
8458652,Andrei,Lomakin,3-Apr-64,Apr-3-1964,4/3/64,4/3/64,1964,4,3,Apr
8445419,Brian,Benning,10-Jun-66,Jun-10-1966,6/10/66,6/10/66,1966,6,10,Jun
8456227,Andre,Faust,7-Oct-69,Oct-7-1969,10/7/69,10/7/69,1969,10,7,Oct
8458515,Eric,Lindros,28-Feb-73,Feb-28-1973,2/28/73,2/28/73,1973,2,28,Feb
8458952,Jason,Bowen,9-Nov-73,Nov-9-1973,11/9/73,11/9/73,1973,11,9,Nov
8449453,Ryan,Mcgill,28-Feb-69,Feb-28-1969,2/28/69,2/28/69,1969,2,28,Feb
8449797,Ric,Nattress,25-May-62,May-25-1962,5/25/62,5/25/62,1962,5,25,May
8458636,Dmitry,Yushkevich,19-Nov-71,Nov-19-1971,11/19/71,11/19/71,1971,11,19,Nov
8458080,Tommy,Soderstrom,17-Jul-69,Jul-17-1969,7/17/69,7/17/69,1969,7,17,Jul
8458600,Aris,Brimanis,14-Mar-72,Mar-14-1972,3/14/72,3/14/72,1972,3,14,Mar
8459498,Milos,Holan,22-Apr-71,Apr-22-1971,4/22/71,4/22/71,1971,4,22,Apr
8446134,Frederic,Chabot,12-Feb-68,Feb-12-1968,2/12/68,2/12/68,1968,2,12,Feb
8446415,Gilbert,Dionne,19-Sep-70,Sep-19-1970,9/19/70,9/19/70,1970,9,19,Sep
8456759,Patrik,Juhlin,24-Apr-70,Apr-24-1970,4/24/70,4/24/70,1970,4,24,Apr
8457704,Shjon,Podein,5-Mar-68,Mar-5-1968,3/5/68,3/5/68,1968,3,5,Mar
8446407,Eric,Desjardins,14-Jun-69,Jun-14-1969,6/14/69,6/14/69,1969,6,14,Jun
8458202,Chris,Therien,14-Dec-71,Dec-14-1971,12/14/71,12/14/71,1971,12,14,Dec
8458508,Philip,Crowe,14-Apr-70,Apr-14-1970,4/14/70,4/14/70,1970,4,14,Apr
8450088,Joel,Otto,29-Oct-61,Oct-29-1961,10/29/61,10/29/61,1961,10,29,Oct
8459614,Paul,Healey,20-Mar-75,Mar-20-1975,3/20/75,3/20/75,1975,3,20,Mar
8459458,Janne,Niinimaa,22-May-75,May-22-1975,5/22/75,5/22/75,1975,5,22,May
8456745,Keith,Jones,8-Nov-68,Nov-8-1968,11/8/68,11/8/68,1968,11,8,Nov
8459889,Mike,Maneluk,1-Oct-73,Oct-1-1973,10/1/73,10/1/73,1973,10,1,Oct
8460660,Roman,Vopat,21-Apr-76,Apr-21-1976,4/21/76,4/21/76,1976,4,21,Apr
8462058,Brian,Wesenberg,9-May-77,May-9-1977,5/9/77,5/9/77,1977,5,9,May
8458385,Peter,White,15-Mar-69,Mar-15-1969,3/15/69,3/15/69,1969,3,15,Mar
8458485,Jason,Zent,15-Apr-71,Apr-15-1971,4/15/71,4/15/71,1971,4,15,Apr
8466092,Ryan,Bast,27-Aug-75,Aug-27-1975,8/27/75,8/27/75,1975,8,27,Aug
8462416,Andy,Delmore,26-Dec-76,Dec-26-1976,12/26/76,12/26/76,1976,12,26,Dec
8462165,Dimitri,Tertyshny,25-Dec-76,Dec-25-1976,12/25/76,12/25/76,1976,12,25,Dec
8466165,Jean-Marc,Pelletier,4-Mar-78,Mar-4-1978,3/4/78,3/4/78,1978,3,4,Mar
8449961,Gino,Odjick,7-Sep-70,Sep-7-1970,9/7/70,9/7/70,1970,9,7,Sep
8459499,Steve,Washburn,10-Apr-75,Apr-10-1975,4/10/75,4/10/75,1975,4,10,Apr
8459536,Jeff,Lank,1-Mar-75,Mar-1-1975,3/1/75,3/1/75,1975,3,1,Mar
8467500,Tomas,Divisek,19-Jul-79,Jul-19-1979,7/19/79,7/19/79,1979,7,19,Jul
8467541,Petr,Hubacek,2-Sep-79,Sep-2-1979,9/2/79,9/2/79,1979,9,2,Sep
8467732,Kirby,Law,11-Mar-77,Mar-11-1977,3/11/77,3/11/77,1977,3,11,Mar
8462068,Chris,McAllister,16-Jun-75,Jun-16-1975,6/16/75,6/16/75,1975,6,16,Jun
8457686,Derek,Plante,17-Jan-71,Jan-17-1971,1/17/71,1/17/71,1971,1,17,Jan
8468508,Justin,Williams,4-Oct-81,Oct-4-1981,10/4/81,10/4/81,1981,10,4,Oct
8458598,Brad,Tiley,5-Jul-71,Jul-5-1971,7/5/71,7/5/71,1971,7,5,Jul
8468651,Roman,Cechmanek,2-Mar-71,Mar-2-1971,3/2/71,3/2/71,1971,3,2,Mar
8467895,Maxime,Ouellet,17-Jun-81,Jun-17-1981,6/17/81,6/17/81,1981,6,17,Jun
8465067,Jesse,Boulerice,10-Aug-78,Aug-10-1978,8/10/78,8/10/78,1978,8,10,Aug
8459246,Donald,Brashear,7-Jan-72,Jan-7-1972,1/7/72,1/7/72,1972,1,7,Jan
8467877,Pavel,Brendl,23-Mar-81,Mar-23-1981,3/23/81,3/23/81,1981,3,23,Mar
8459069,Jiri,Dopita,2-Dec-68,Dec-2-1968,12/2/68,12/2/68,1968,12,2,Dec
8459521,Marty,Murray,16-Feb-75,Feb-16-1975,2/16/75,2/16/75,1975,2,16,Feb
8468081,Vaclav,Pletka,8-Jun-79,Jun-8-1979,6/8/79,6/8/79,1979,6,8,Jun
8460770,Kim,Johnsson,16-Mar-76,Mar-16-1976,3/16/76,3/16/76,1976,3,16,Mar
8467558,Bruno,St. Jacques,22-Aug-80,Aug-22-1980,8/22/80,8/22/80,1980,8,22,Aug
8458738,Neil,Little,18-Dec-71,Dec-18-1971,12/18/71,12/18/71,1971,12,18,Dec
8455429,Tony,Amonte,2-Aug-70,Aug-2-1970,8/2/70,8/2/70,1970,8,2,Aug
8467342,Eric,Chouinard,8-Jul-80,Jul-8-1980,7/8/80,7/8/80,1980,7,8,Jul
8462112,Ian,MacNeil,27-Apr-77,Apr-27-1977,4/27/77,4/27/77,1977,4,27,Apr
8451093,Joe,Sacco,4-Feb-69,Feb-4-1969,2/4/69,2/4/69,1969,2,4,Feb
8469544,Patrick,Sharp,27-Dec-81,Dec-27-1981,12/27/81,12/27/81,1981,12,27,Dec
8467440,Mike,Siklenka,18-Dec-79,Dec-18-1979,12/18/79,12/18/79,1979,12,18,Dec
8462127,Radovan,Somik,7-May-77,May-7-1977,5/7/77,5/7/77,1977,5,7,May
8460587,Jamie,Wright,13-May-76,May-13-1976,5/13/76,5/13/76,1976,5,13,May
8465093,Robert,Esche,22-Jan-78,Jan-22-1978,1/22/78,1/22/78,1978,1,22,Jan
8465028,Boyd,Kane,18-Apr-78,Apr-18-1978,4/18/78,4/18/78,1978,4,18,Apr
8460739,Mike,Peluso,2-Sep-74,Sep-2-1974,9/2/74,9/2/74,1974,9,2,Sep
8467966,Branko,Radivojevic,24-Nov-80,Nov-24-1980,11/24/80,11/24/80,1980,11,24,Nov
8470137,Joni,Pitkanen,19-Sep-83,Sep-19-1983,9/19/83,9/19/83,1983,9,19,Sep
8470244,Matt,Ellison,8-Dec-83,Dec-8-1983,12/8/83,12/8/83,1983,12,8,Dec
8469844,Josh,Gratton,9-Sep-82,Sep-9-1982,9/9/82,9/9/82,1982,9,9,Sep
8466184,Pat,Kavanagh,14-Mar-79,Mar-14-1979,3/14/79,3/14/79,1979,3,14,Mar
8470680,Ryan,Potulny,5-Sep-84,Sep-5-1984,9/5/84,9/5/84,1984,9,5,Sep
8466230,Ryan,Ready,7-Nov-78,Nov-7-1978,11/7/78,11/7/78,1978,11,7,Nov
8470617,Mike,Richards,11-Feb-85,Feb-11-1985,2/11/85,2/11/85,1985,2,11,Feb
8470674,Stefan,Ruzicka,17-Feb-85,Feb-17-1985,2/17/85,2/17/85,1985,2,17,Feb
8458682,Brian,Savage,24-Feb-71,Feb-24-1971,2/24/71,2/24/71,1971,2,24,Feb
8469469,R.J.,Umberger,3-May-82,May-3-1982,5/3/82,5/3/82,1982,5,3,May
8462050,Denis,Gauthier,1-Oct-76,Oct-1-1976,10/1/76,10/1/76,1976,10,1,Oct
8469668,David,Printz,24-Jul-80,Jul-24-1980,7/24/80,7/24/80,1980,7,24,Jul
8470023,Wade,Skolney,24-Jun-81,Jun-24-1981,6/24/81,6/24/81,1981,6,24,Jun
8468786,Riley,Cote,16-Mar-82,Mar-16-1982,3/16/82,3/16/82,1982,3,16,Mar
8470005,Mark,Cullen,28-Oct-78,Oct-28-1978,10/28/78,10/28/78,1978,10,28,Oct
8470899,Triston,Grant,2-Feb-84,Feb-2-1984,2/2/84,2/2/84,1984,2,2,Feb
8470105,Scottie,Upshall,7-Oct-83,Oct-7-1983,10/7/83,10/7/83,1983,10,7,Oct
8466266,Mike,York,3-Jan-78,Jan-3-1978,1/3/78,1/3/78,1978,1,3,Jan
8467918,Martin,Grenier,2-Nov-80,Nov-2-1980,11/2/80,11/2/80,1980,11,2,Nov
8468487,Lars,Jonsson,2-Jan-82,Jan-2-1982,1/2/82,1/2/82,1982,1,2,Jan
8470743,Lasse,Kukkonen,18-Sep-81,Sep-18-1981,9/18/81,9/18/81,1981,9,18,Sep
8471692,Ryan,Parent,17-Mar-87,Mar-17-1987,3/17/87,3/17/87,1987,3,17,Mar
8469593,Jussi,Timonen,29-Jun-83,Jun-29-1983,6/29/83,6/29/83,1983,6,29,Jun
8462047,Martin,Biron,15-Aug-77,Aug-15-1977,8/15/77,8/15/77,1977,8,15,Aug
8471444,Martin,Houle,12-Feb-85,Feb-12-1985,2/12/85,2/12/85,1985,2,12,Feb
8468038,Michael,Leighton,19-May-81,May-19-1981,5/19/81,5/19/81,1981,5,19,May
8464975,Daniel,Brire,6-Oct-77,Oct-6-1977,10/6/77,10/6/77,1977,10,6,Oct
8473512,Claude,Giroux,12-Jan-88,Jan-12-1988,1/12/88,1/12/88,1988,1,12,Jan
8473904,Kyle,Greentree,15-Nov-83,Nov-15-1983,11/15/83,11/15/83,1983,11,15,Nov
8468486,Scott,Hartnell,18-Apr-82,Apr-18-1982,4/18/82,4/18/82,1982,4,18,Apr
8470207,Joffrey,Lupul,23-Sep-83,Sep-23-1983,9/23/83,9/23/83,1983,9,23,Sep
8470375,Patrick,Thoresen,7-Nov-83,Nov-7-1983,11/7/83,11/7/83,1983,11,7,Nov
8473635,Denis,Tolpeko,29-Jan-85,Jan-29-1985,1/29/85,1/29/85,1985,1,29,Jan
8459469,Rory,Fitzpatrick,11-Jan-75,Jan-11-1975,1/11/75,1/11/75,1975,1,11,Jan
8459670,Kimmo,Timonen,18-Mar-75,Mar-18-1975,3/18/75,3/18/75,1975,3,18,Mar
8470666,Daniel,Carcillo,28-Jan-85,Jan-28-1985,1/28/85,1/28/85,1985,1,28,Jan
8474177,Jon,Kalinski,25-May-87,May-25-1987,5/25/87,5/25/87,1987,5,25,May
8473568,Andreas,Nodl,28-Feb-87,Feb-28-1987,2/28/87,2/28/87,1987,2,28,Feb
8473932,Darroll,Powe,22-Jun-85,Jun-22-1985,6/22/85,6/22/85,1985,6,22,Jun
8474225,Nate,Raduns,17-May-84,May-17-1984,5/17/84,5/17/84,1984,5,17,May
8472248,Jared,Ross,18-Sep-82,Sep-18-1982,9/18/82,9/18/82,1982,9,18,Sep
8475115,Jamie,Fritsch,25-Feb-85,Feb-25-1985,2/25/85,2/25/85,1985,2,25,Feb
8475068,David,Sloane,6-Apr-85,Apr-6-1985,4/6/85,4/6/85,1985,4,6,Apr
8470996,Danny,Syvret,13-Jun-85,Jun-13-1985,6/13/85,6/13/85,1985,6,13,Jun
8467369,Ossi,Vaananen,18-Aug-80,Aug-18-1980,8/18/80,8/18/80,1980,8,18,Aug
8467361,Blair,Betts,16-Feb-80,Feb-16-1980,2/16/80,2/16/80,1980,2,16,Feb
8471336,David,Laliberte,17-Mar-86,Mar-17-1986,3/17/86,3/17/86,1986,3,17,Mar
8459094,Ian,Laperriere,19-Jan-74,Jan-19-1974,1/19/74,1/19/74,1974,1,19,Jan
8475381,Mika,Pyorala,13-Jul-81,Jul-13-1981,7/13/81,7/13/81,1981,7,13,Jul
8471756,Oskars,Bartulis,21-Jan-87,Jan-21-1987,1/21/87,1/21/87,1987,1,21,Jan
8470170,Ole-Kristian,Tollefsen,29-Mar-84,Mar-29-1984,3/29/84,3/29/84,1984,3,29,Mar
8475080,Johan,Backlund,24-Jul-81,Jul-24-1981,7/24/81,7/24/81,1981,7,24,Jul
8471781,Jeremy,Duchesne,17-Oct-86,Oct-17-1986,10/17/86,10/17/86,1986,10,17,Oct
8469548,Ray,Emery,28-Sep-82,Sep-28-1982,9/28/82,9/28/82,1982,9,28,Sep
8475603,Ben,Holmstrom,9-Apr-87,Apr-9-1987,4/9/87,4/9/87,1987,4,9,Apr
8471346,Kris,Versteeg,13-May-86,May-13-1986,5/13/86,5/13/86,1986,5,13,May
8474892,Eric,Wellwood,6-Mar-90,Mar-6-1990,3/6/90,3/6/90,1990,3,6,Mar
8470597,Nikolay,Zherdev,5-Nov-84,Nov-5-1984,11/5/84,11/5/84,1984,11,5,Nov
8475640,Erik,Gustafsson,15-Dec-88,Dec-15-1988,12/15/88,12/15/88,1988,12,15,Dec
8475683,Sergei,Bobrovsky,20-Sep-88,Sep-20-1988,9/20/88,9/20/88,1988,9,20,Sep
8476461,Sean,Couturier,7-Dec-92,Dec-7-1992,12/7/92,12/7/92,1992,12,7,Dec
8476177,Matt,Read,14-Jun-86,Jun-14-1986,6/14/86,6/14/86,1986,6,14,Jun
8475170,Brayden,Schenn,22-Aug-91,Aug-22-1991,8/22/91,8/22/91,1991,8,22,Aug
8474161,Jakub,Voracek,15-Aug-89,Aug-15-1989,8/15/89,8/15/89,1989,8,15,Aug
8474631,Marc-Andre,Bourdon,17-Sep-89,Sep-17-1989,9/17/89,9/17/89,1989,9,17,Sep
8471269,Nicklas,Grossmann,22-Jan-85,Jan-22-1985,1/22/85,1/22/85,1985,1,22,Jan
8475430,Brandon,Manning,4-Jun-90,Jun-4-1990,6/4/90,6/4/90,1990,6,4,Jun
8474163,Kevin,Marshall,10-Mar-89,Mar-10-1989,3/10/89,3/10/89,1989,3,10,Mar
8468524,Ilya,Bryzgalov,22-Jun-80,Jun-22-1980,6/22/80,6/22/80,1980,6,22,Jun
8475917,Jason,Akeson,3-Jun-90,Jun-3-1990,6/3/90,6/3/90,1990,6,3,Jun
8476872,Scott,Laughton,30-May-94,May-30-1994,5/30/94,5/30/94,1994,5,30,May
8470816,Jay,Rosehill,16-Jul-85,Jul-16-1985,7/16/85,7/16/85,1985,7,16,Jul
8475395,Matthew,Konan,3-Sep-91,Sep-3-1991,9/3/91,9/3/91,1991,9,3,Sep
8475342,Oliver,Lauridsen,24-Mar-89,Mar-24-1989,3/24/89,3/24/89,1989,3,24,Mar
8477290,Michael,Raffl,1-Dec-88,Dec-1-1988,12/1/88,12/1/88,1988,12,1,Dec
8471762,Chris,VandeVelde,15-Mar-87,Mar-15-1987,3/15/87,3/15/87,1987,3,15,Mar
8473584,Andrew,MacDonald,7-Sep-86,Sep-7-1986,9/7/86,9/7/86,1986,9,7,Sep
8476763,Calvin,Heeter,2-Nov-88,Nov-2-1988,11/2/88,11/2/88,1988,11,2,Nov
8476393,Nick,Cousins,20-Jul-93,Jul-20-1993,7/20/93,7/20/93,1993,7,20,Jul
8475723,Petr,Straka,15-Jun-92,Jun-15-1992,6/15/92,6/15/92,1992,6,15,Jun
8473466,Ryan,White,17-Mar-88,Mar-17-1988,3/17/88,3/17/88,1988,3,17,Mar
8475729,Mark,Alt,18-Oct-91,Oct-18-1991,10/18/91,10/18/91,1991,10,18,Oct
8474584,Michael,Del Zotto,24-Jun-90,Jun-24-1990,6/24/90,6/24/90,1990,6,24,Jun
8468513,Nick,Schultz,25-Aug-82,Aug-25-1982,8/25/82,8/25/82,1982,8,25,Aug
8467972,Rob,Zepp,7-Sep-81,Sep-7-1981,9/7/81,9/7/81,1981,9,7,Sep
8476955,Taylor,Leier,15-Feb-94,Feb-15-1994,2/15/94,2/15/94,1994,2,15,Feb
8475738,Jordan,Weal,15-Apr-92,Apr-15-1992,4/15/92,4/15/92,1992,4,15,Apr
8478563,Evgeny,Medvedev,27-Aug-82,Aug-27-1982,8/27/82,8/27/82,1982,8,27,Aug
8473607,Michal,Neuvirth,23-Mar-88,Mar-23-1988,3/23/88,3/23/88,1988,3,23,Mar
8470159,Boyd,Gordon,19-Oct-83,Oct-19-1983,10/19/83,10/19/83,1983,10,19,Oct
8478439,Travis,Konecny,11-Mar-97,Mar-11-1997,3/11/97,3/11/97,1997,3,11,Mar
8479648,Roman,Lyubimov,6-Jan-92,Jan-6-1992,1/6/92,1/6/92,1992,1,6,Jan
8477502,Samuel,Morin,12-Jul-95,Jul-12-1995,7/12/95,7/12/95,1995,7,12,Jul
8480087,Mike,Vecchione,25-Feb-93,Feb-25-1993,2/25/93,2/25/93,1993,2,25,Feb
8474668,Dale,Weise,5-Aug-88,Aug-5-1988,8/5/88,8/5/88,1988,8,5,Aug
8478500,Ivan,Provorov,13-Jan-97,Jan-13-1997,1/13/97,1/13/97,1997,1,13,Jan
8476932,Anthony,Stolarz,20-Jan-94,Jan-20-1994,1/20/94,1/20/94,1994,1,20,Jan
8477399,Tyrell,Goulbourne,26-Jan-94,Jan-26-1994,1/26/94,1/26/94,1994,1,26,Jan
8474627,Jori,Lehtera,23-Dec-87,Dec-23-1987,12/23/87,12/23/87,1987,12,23,Dec
8479974,Nolan,Patrick,19-Sep-98,Sep-19-1998,9/19/98,9/19/98,1998,9,19,Sep
8473440,Will,O'Neill,28-Apr-88,Apr-28-1988,4/28/88,4/28/88,1988,4,28,Apr
8477948,Travis,Sanheim,29-Mar-96,Mar-29-1996,3/29/96,3/29/96,1996,3,29,Mar
8477979,Nicolas,Aube-Kubel,10-May-96,May-10-1996,5/10/96,5/10/96,1996,5,10,May
8477451,Ryan,Hartman,20-Sep-94,Sep-20-1994,9/20/94,9/20/94,1994,9,20,Sep
8475260,Corban,Knight,10-Sep-90,Sep-10-1990,9/10/90,9/10/90,1990,9,10,Sep
8475321,Phil,Varone,4-Dec-90,Dec-4-1990,12/4/90,12/4/90,1990,12,4,Dec
8478844,Mikhail,Vorobyev,5-Jan-97,Jan-5-1997,1/5/97,1/5/97,1997,1,5,Jan
8477850,Christian,Folin,9-Feb-91,Feb-9-1991,2/9/91,2/9/91,1991,2,9,Feb
8479394,Carter,Hart,13-Aug-98,Aug-13-1998,8/13/98,8/13/98,1998,8,13,Aug
8475660,Cam,Talbot,5-Jul-87,Jul-5-1987,7/5/87,7/5/87,1987,7,5,Jul
8476404,Andy,Andreoff,17-May-91,May-17-1991,5/17/91,5/17/91,1991,5,17,May
8479382,Connor,Bunnaman,16-Apr-98,Apr-16-1998,4/16/98,4/16/98,1998,4,16,Apr
8480797,Joel,Farabee,25-Feb-00,Feb-25-2000,2/25/00,2/25/00,2000,2,25,Feb
8480028,Morgan,Frost,14-May-99,May-14-1999,5/14/99,5/14/99,1999,5,14,May
8478436,David,Kase,28-Jan-97,Jan-28-1997,1/28/97,1/28/97,1997,1,28,Jan
8475752,Tyler,Pitlick,1-Nov-91,Nov-1-1991,11/1/91,11/1/91,1991,11,1,Nov
8479424,German,Rubtsov,27-Jun-98,Jun-27-1998,6/27/98,6/27/98,1998,6,27,Jun
8473485,Chris,Stewart,30-Oct-87,Oct-30-1987,10/30/87,10/30/87,1987,10,30,Oct
8479358,Carsen,Twarynski,24-Nov-97,Nov-24-1997,11/24/97,11/24/97,1997,11,24,Nov
8479322,Wade,Allison,14-Oct-97,Oct-14-1997,10/14/97,10/14/97,1997,10,14,Oct
8482654,Jackson,Cates,26-Sep-97,Sep-26-1997,9/26/97,9/26/97,1997,9,26,Sep
8479550,Tanner,Laczynski,1-Jun-97,Jun-1-1997,6/1/97,6/1/97,1997,6,1,Jun
8480201,Maksim,Sushko,10-Feb-99,Feb-10-1999,2/10/99,2/10/99,1999,2,10,Feb
8476979,Erik,Gustafsson,14-Mar-92,Mar-14-1992,3/14/92,3/14/92,1992,3,14,Mar
8475613,Nate,Prosser,7-May-86,May-7-1986,5/7/86,5/7/86,1986,5,7,May
8481546,Cam,York,5-Jan-01,Jan-5-2001,1/5/01,1/5/01,2001,1,5,Jan
8481178,Egor,Zamula,30-Mar-00,Mar-30-2000,3/30/00,3/30/00,2000,3,30,Mar
8474715,Cam,Atkinson,5-Jun-89,Jun-5-1989,6/5/89,6/5/89,1989,6,5,Jun
8481553,Bobby,Brink,8-Jul-01,Jul-8-2001,7/8/01,7/8/01,2001,7,8,Jul
8477887,Patrick,Brown,29-May-92,May-29-1992,5/29/92,5/29/92,1992,5,29,May
8480220,Noah,Cates,5-Feb-99,Feb-5-1999,2/5/99,2/5/99,1999,2,5,Feb
8478173,Hayden,Hodgson,2-Mar-96,Mar-2-1996,3/2/96,3/2/96,1996,3,2,Mar
8479772,Zack,MacEwen,8-Jul-96,Jul-8-1996,7/8/96,7/8/96,1996,7,8,Jul
8479933,Gerry,Mayhew,31-Dec-92,Dec-31-1992,12/31/92,12/31/92,1992,12,31,Dec
8480019,Isaac,Ratcliffe,15-Feb-99,Feb-15-1999,2/15/99,2/15/99,1999,2,15,Feb
8482243,Linus,Sandin,19-May-96,May-19-1996,5/19/96,5/19/96,1996,5,19,May
8480015,Owen,Tippett,16-Feb-99,Feb-16-1999,2/16/99,2/16/99,1999,2,16,Feb
8478051,Max,Willman,13-Feb-95,Feb-13-1995,2/13/95,2/13/95,1995,2,13,Feb
8481521,Ronnie,Attard,20-Mar-99,Mar-20-1999,3/20/99,3/20/99,1999,3,20,Mar
8475246,Kevin,Connauton,23-Feb-90,Feb-23-1990,2/23/90,2/23/90,1990,2,23,Feb
8475176,Ryan,Ellis,3-Jan-91,Jan-3-1991,1/3/91,1/3/91,1991,1,3,Jan
8479534,Linus,Hogberg,4-Sep-98,Sep-4-1998,9/4/98,9/4/98,1998,9,4,Sep
8477499,Rasmus,Ristolainen,27-Oct-94,Oct-27-1994,10/27/94,10/27/94,1994,10,27,Oct
8476372,Nick,Seeler,3-Jun-93,Jun-3-1993,6/3/93,6/3/93,1993,6,3,Jun
8471735,Keith,Yandle,9-Sep-86,Sep-9-1986,9/9/86,9/9/86,1986,9,9,Sep
8478433,Felix,Sandstrom,12-Jan-97,Jan-12-1997,1/12/97,1/12/97,1997,1,12,Jan
8479356,Kieffer,Bellows,10-Jun-98,Jun-10-1998,6/10/98,6/10/98,1998,6,10,Jun
8475235,Nicolas,Deslauriers,22-Feb-91,Feb-22-1991,2/22/91,2/22/91,1991,2,22,Feb
8482452,Elliot,Desnoyers,21-Jan-02,Jan-21-2002,1/21/02,1/21/02,2002,1,21,Jan
8482159,Tyson,Foerster,18-Jan-02,Jan-18-2002,1/18/02,1/18/02,2002,1,18,Jan
8480245,Olle,Lycksell,24-Aug-99,Aug-24-1999,8/24/99,8/24/99,1999,8,24,Aug
8476310,Lukas,Sedlak,25-Feb-93,Feb-25-1993,2/25/93,2/25/93,1993,2,25,Feb
8477950,Tony,DeAngelo,24-Oct-95,Oct-24-1995,10/24/95,10/24/95,1995,10,24,Oct
8480874,Adam,Ginning,13-Jan-00,Jan-13-2000,1/13/00,1/13/00,2000,1,13,Jan
8481035,Samuel,Ersson,20-Oct-99,Oct-20-1999,10/20/99,10/20/99,1999,10,20,Oct
8479587,Rhett,Gardner,28-Feb-96,Feb-28-1996,2/28/96,2/28/96,1996,2,28,Feb
8480336,Sean,Walker,13-Nov-94,Nov-13-1994,11/13/94,11/13/94,1994,11,13,Nov
8448197,Joe,Primeau,29-Jan-06,Jan-29-1906,1/29/06,1/29/06,1906,1,29,Jan
8448244,Beattie,Ramsay,12-Dec-1895,Dec-12-1895,12/12/1895,1895-12-12,1895,12,12,Dec
8445093,Andy,Blair,27-Feb-08,Feb-27-1908,2/27/08,2/27/08,1908,2,27,Feb
8446641,Alex,Gray,21-Jun-1899,Jun-21-1899,6/21/1899,1899-06-21,1899,6,21,Jun
8446915,Red,Horner,28-May-09,May-28-1909,5/28/09,5/28/09,1909,5,28,May
8445234,Gord,Brydson,3-Jan-07,Jan-3-1907,1/3/07,1/3/07,1907,1,3,Jan
8447652,Cliff,McBride,10-Jan-09,Jan-10-1909,1/10/09,1/10/09,1909,1,10,Jan
8446674,Herb,Hamel,8-Jun-04,Jun-8-1904,6/8/04,6/8/04,1904,6,8,Jun
8446931,Rolly,Huard,6-Sep-02,Sep-6-1902,9/6/02,9/6/02,1902,9,6,Sep
8447473,Alex,Levinsky,2-Feb-10,Feb-2-1910,2/2/10,2/2/10,1910,2,2,Feb
8447870,Earl,Miller,12-Sep-05,Sep-12-1905,9/12/05,9/12/05,1905,9,12,Sep
8444863,Stew,Adams,16-Oct-04,Oct-16-1904,10/16/04,10/16/04,1904,10,16,Oct
8445947,Dave,Downie,11-Mar-09,Mar-11-1909,3/11/09,3/11/09,1909,3,11,Mar
8449987,George,Hainsworth,26-Jun-1895,Jun-26-1895,6/26/1895,1895-06-26,1895,6,26,Jun
8445846,Bob,Davidson,10-Feb-12,Feb-10-1912,2/10/12,2/10/12,1912,2,10,Feb
8447850,Nick,Metz,16-Feb-14,Feb-16-1914,2/16/14,2/16/14,1914,2,16,Feb
8447601,Norm,Mann,3-Mar-14,Mar-3-1914,3/3/14,3/3/14,1914,3,3,Mar
8447615,Jack,Markle,15-May-07,May-15-1907,5/15/07,5/15/07,1907,5,15,May
8446689,Reg,Hamilton,29-Apr-14,Apr-29-1914,4/29/14,4/29/14,1914,4,29,Apr
8444954,Syl,Apps,18-Jan-15,Jan-18-1915,1/18/15,1/18/15,1915,1,18,Jan
8445950,Gordie,Drillon,23-Oct-13,Oct-23-1913,10/23/13,10/23/13,1913,10,23,Oct
8447163,Bill,Kendall,1-Apr-10,Apr-1-1910,4/1/10,4/1/10,1910,4,1,Apr
8448088,George,Parsons,28-Jun-14,Jun-28-1914,6/28/14,6/28/14,1914,6,28,Jun
8446460,Jimmy,Fowler,6-Apr-15,Apr-6-1915,4/6/15,4/6/15,1915,4,6,Apr
8446923,Jack,Howard,15-Oct-11,Oct-15-1911,10/15/11,10/15/11,1911,10,15,Oct
8449837,Turk,Broda,15-May-14,May-15-1914,5/15/14,5/15/14,1914,5,15,May
8447133,Bingo,Kampman,12-Mar-14,Mar-12-1914,3/12/14,3/12/14,1914,3,12,Mar
8447320,Pete,Langelle,4-Nov-17,Nov-4-1917,11/4/17,11/4/17,1917,11,4,Nov
8447849,Don,Metz,10-Jan-16,Jan-10-1916,1/10/16,1/10/16,1916,1,10,Jan
8445439,Lex,Chisholm,1-Apr-15,Apr-1-1915,4/1/15,4/1/15,1915,4,1,Apr
8446610,Hank,Goldup,29-Oct-18,Oct-29-1918,10/29/18,10/29/18,1918,10,29,Oct
8449157,Wally,Stanowski,28-Apr-19,Apr-28-1919,4/28/19,4/28/19,1919,4,28,Apr
8450118,Phil,Stein,13-Sep-13,Sep-13-1913,9/13/13,9/13/13,1913,9,13,Sep
8447724,John,McCreedy,23-Mar-11,Mar-23-1911,3/23/11,3/23/11,1911,3,23,Mar
8445902,Ernie,Dickens,25-Jun-21,Jun-25-1921,6/25/21,6/25/21,1921,6,25,Jun
8445124,George,Boothman,25-Sep-16,Sep-25-1916,9/25/16,9/25/16,1916,9,25,Sep
8446409,Jack,Forsey,7-Nov-14,Nov-7-1914,11/7/14,11/7/14,1914,11,7,Nov
8446688,Jack,Hamilton,2-Jun-25,Jun-2-1925,6/2/25,6/2/25,1925,6,2,Jun
8447017,Johnny,Ingoldsby,21-Jun-24,Jun-21-1924,6/21/24,6/21/24,1924,6,21,Jun
8447166,Ted,Kennedy,12-Dec-25,Dec-12-1925,12/12/25,12/12/25,1925,12,12,Dec
8447644,Shep,Mayer,11-Sep-23,Sep-11-1923,9/11/23,9/11/23,1923,9,11,Sep
8447797,Jack,McLean,31-Jan-23,Jan-31-1923,1/31/23,1/31/23,1923,1,31,Jan
8445547,Bob,Copp,15-Nov-18,Nov-15-1918,11/15/18,11/15/18,1918,11,15,Nov
8449237,Rhys,Thomson,9-Aug-18,Aug-9-1918,8/9/18,8/9/18,1918,8,9,Aug
8445331,Red,Carr,29-Dec-16,Dec-29-1916,12/29/16,12/29/16,1916,12,29,Dec
8445963,Frank,Dunlap,10-Aug-24,Aug-10-1924,8/10/24,8/10/24,1924,8,10,Aug
8448062,Tom,O'Neill,28-Sep-23,Sep-28-1923,9/28/23,9/28/23,1923,9,28,Sep
8448192,Eric,Prentice,22-Aug-26,Aug-22-1926,8/22/26,8/22/26,1926,8,22,Aug
8449376,Don,Webster,3-Jul-24,Jul-3-1924,7/3/24,7/3/24,1924,7,3,Jul
8447109,Ross,Johnstone,7-Apr-26,Apr-7-1926,4/7/26,4/7/26,1926,4,7,Apr
8447893,Moe,Morris,3-Jan-21,Jan-3-1921,1/3/21,1/3/21,1921,1,3,Jan
8450021,Jean,Marois,11-May-24,May-11-1924,5/11/24,5/11/24,1924,5,11,May
8444995,Pete,Backor,29-Apr-19,Apr-29-1919,4/29/19,4/29/19,1919,4,29,Apr
8450029,Frank,McCool,27-Oct-18,Oct-27-1918,10/27/18,10/27/18,1918,10,27,Oct
8449236,Jimmy,Thomson,23-Feb-27,Feb-23-1927,2/23/27,2/23/27,1927,2,23,Feb
8449805,Baz,Bastien,29-Aug-19,Aug-29-1919,8/29/19,8/29/19,1919,8,29,Aug
8449816,Gordie,Bell,13-Mar-25,Mar-13-1925,3/13/25,3/13/25,1925,3,13,Mar
8447831,Howie,Meeker,4-Nov-24,Nov-4-1924,11/4/24,11/4/24,1924,11,4,Nov
8449084,Sid,Smith,11-Jul-25,Jul-11-1925,7/11/25,7/11/25,1925,7,11,Jul
8449219,Harry,Taylor,28-Mar-26,Mar-28-1926,3/28/26,3/28/26,1926,3,28,Mar
8445019,Bill,Barilko,25-Mar-27,Mar-25-1927,3/25/27,3/25/27,1927,3,25,Mar
8445107,Garth,Boesch,7-Oct-20,Oct-7-1920,10/7/20,10/7/20,1920,10,7,Oct
8445853,Bob,Dawes,29-Nov-24,Nov-29-1924,11/29/24,11/29/24,1924,11,29,Nov
8445063,Max,Bentley,1-Mar-20,Mar-1-1920,3/1/20,3/1/20,1920,3,1,Mar
8445637,Les,Costello,16-Feb-28,Feb-16-1928,2/16/28,2/16/28,1928,2,16,Feb
8447716,John,McCormack,2-Aug-25,Aug-2-1925,8/2/25,8/2/25,1925,8,2,Aug
8449052,Tod,Sloan,30-Nov-27,Nov-30-1927,11/30/27,11/30/27,1927,11,30,Nov
8449228,Cy,Thomas,5-Aug-26,Aug-5-1926,8/5/26,8/5/26,1926,8,5,Aug
8448618,Phil,Samis,28-Dec-27,Dec-28-1927,12/28/27,12/28/27,1927,12,28,Dec
8445095,Chuck,Blair,23-Jul-28,Jul-23-1928,7/23/28,7/23/28,1928,7,23,Jul
8445236,Al,Buchanan,17-May-27,May-17-1927,5/17/27,5/17/27,1927,5,17,May
8445351,Ray,Ceresino,24-Apr-29,Apr-24-1929,4/24/29,4/24/29,1929,4,24,Apr
8446693,Ray,Hannigan,14-Jul-27,Jul-14-1927,7/14/27,7/14/27,1927,7,14,Jul
8449241,Ray,Timgren,29-Sep-28,Sep-29-1928,9/29/28,9/29/28,1928,9,29,Sep
8447126,Bill,Juzda,29-Oct-20,Oct-29-1920,10/29/20,10/29/20,1920,10,29,Oct
8447153,Stan,Kemp,2-Mar-24,Mar-2-1924,3/2/24,3/2/24,1924,3,2,Mar
8447636,Frank,Mathers,29-Mar-24,Mar-29-1924,3/29/24,3/29/24,1924,3,29,Mar
8444971,George,Armstrong,6-Jul-30,Jul-6-1930,7/6/30,7/6/30,1930,7,6,Jul
8446745,Bob,Hassard,26-Mar-29,Mar-26-1929,3/26/29,3/26/29,1929,3,26,Mar
8447103,Bill,Johansen,27-Jul-28,Jul-27-1928,7/27/28,7/27/28,1928,7,27,Jul
8447855,Rudy,Migay,18-Nov-28,Nov-18-1928,11/18/28,11/18/28,1928,11,18,Nov
8444979,John,Arundel,4-Nov-27,Nov-4-1927,11/4/27,11/4/27,1927,11,4,Nov
8445115,Hugh,Bolton,15-Apr-29,Apr-15-1929,4/15/29,4/15/29,1929,4,15,Apr
8449202,Frank,Sullivan,16-Jun-29,Jun-16-1929,6/16/29,6/16/29,1929,6,16,Jun
8450026,Gilles,Mayer,24-Aug-30,Aug-24-1930,8/24/30,8/24/30,1930,8,24,Aug
8450108,Al,Rollins,9-Oct-26,Oct-9-1926,10/9/26,10/9/26,1926,10,9,Oct
8445018,Andy,Barbe,27-Jul-23,Jul-27-1923,7/27/23,7/27/23,1923,7,27,Jul
8445096,Dusty,Blair,15-Sep-29,Sep-15-1929,9/15/29,9/15/29,1929,9,15,Sep
8447474,Danny,Lewicki,12-Mar-31,Mar-12-1931,3/12/31,3/12/31,1931,3,12,Mar
8445004,Earl,Balfour,4-Jan-33,Jan-4-1933,1/4/33,1/4/33,1933,1,4,Jan
8447798,John,McLellan,6-Aug-28,Aug-6-1928,8/6/28,8/6/28,1928,8,6,Aug
8447998,Eric,Nesterenko,31-Oct-33,Oct-31-1933,10/31/33,10/31/33,1933,10,31,Oct
8448610,Bob,Sabourin,17-Mar-33,Mar-17-1933,3/17/33,3/17/33,1933,3,17,Mar
8446691,Gord,Hannigan,19-Jan-29,Jan-19-1929,1/19/29,1/19/29,1929,1,19,Jan
8447621,Willie,Marshall,1-Dec-31,Dec-1-1931,12/1/31,12/1/31,1931,12,1,Dec
8447643,Wally,Maxwell,24-Aug-33,Aug-24-1933,8/24/33,8/24/33,1933,8,24,Aug
8448307,Dave,Reid,11-Jan-34,Jan-11-1934,1/11/34,1/11/34,1934,1,11,Jan
8445826,Brian,Cullen,11-Nov-33,Nov-11-1933,11/11/33,11/11/33,1933,11,11,Nov
8445957,Dick,Duff,18-Feb-36,Feb-18-1936,2/18/36,2/18/36,1936,2,18,Feb
8446335,Gerry,Foley,22-Sep-32,Sep-22-1932,9/22/32,9/22/32,1932,9,22,Sep
8447041,Gerry,James,22-Oct-34,Oct-22-1934,10/22/34,10/22/34,1934,10,22,Oct
8447227,Paul,Knox,23-Nov-33,Nov-23-1933,11/23/33,11/23/33,1933,11,23,Nov
8447008,Ron,Hurst,18-May-31,May-18-1931,5/18/31,5/18/31,1931,5,18,May
8445259,Bill,Burega,13-Mar-32,Mar-13-1932,3/13/32,3/13/32,1932,3,13,Mar
8446589,Kenny,Girard,18-Dec-36,Dec-18-1936,12/18/36,12/18/36,1936,12,18,Dec
8448037,Mike,Nykoluk,11-Dec-34,Dec-11-1934,12/11/34,12/11/34,1934,12,11,Dec
8448227,Bob,Pulford,31-Mar-36,Mar-31-1936,3/31/36,3/31/36,1936,3,31,Mar
8445515,Pete,Conacher,29-Jul-32,Jul-29-1932,7/29/32,7/29/32,1932,7,29,Jul
8447632,Paul,Masnick,14-Apr-31,Apr-14-1931,4/14/31,4/14/31,1931,4,14,Apr
8445506,Gary,Collins,27-Sep-35,Sep-27-1935,9/27/35,9/27/35,1935,9,27,Sep
8448057,Bert,Olmstead,4-Sep-26,Sep-4-1926,9/4/26,9/4/26,1926,9,4,Sep
8449835,Johnny,Bower,8-Nov-24,Nov-8-1924,11/8/24,11/8/24,1924,11,8,Nov
8446004,Garry,Edmundson,6-May-32,May-6-1932,5/6/32,5/6/32,1932,5,6,May
8445819,Joe,Crozier,19-Feb-29,Feb-19-1929,2/19/29,2/19/29,1929,2,19,Feb
8447626,Jack,Martin,29-Nov-40,Nov-29-1940,11/29/40,11/29/40,1940,11,29,Nov
8450039,Gerry,McNamara,22-Sep-34,Sep-22-1934,9/22/34,9/22/34,1934,9,22,Sep
8447231,Les,Kozak,28-Oct-40,Oct-28-1940,10/28/40,10/28/40,1940,10,28,Oct
8444973,Norm,Armstrong,17-Oct-38,Oct-17-1938,10/17/38,10/17/38,1938,10,17,Oct
8445359,Andre,Champagne,19-Sep-43,Sep-19-1943,9/19/43,9/19/43,1943,9,19,Sep
8445949,Bruce,Draper,2-Oct-40,Oct-2-1940,10/2/40,10/2/40,1940,10,2,Oct
8447858,Jim,Mikol,11-Jun-38,Jun-11-1938,6/11/38,6/11/38,1938,6,11,Jun
8446668,Ron,Ellis,8-Jan-45,Jan-8-1945,1/8/45,1/8/45,1945,1,8,Jan
8447886,Dickie,Moore,6-Jan-31,Jan-6-1931,1/6/31,1/6/31,1931,1,6,Jan
8446562,Dick,Gamble,16-Nov-28,Nov-16-1928,11/16/28,11/16/28,1928,11,16,Nov
8447015,Brent,Imlach,16-Nov-46,Nov-16-1946,11/16/46,11/16/46,1946,11,16,Nov
8446880,Andre,Hinse,19-Apr-45,Apr-19-1945,4/19/45,4/19/45,1945,4,19,Apr
8447629,Tom,Martin,16-Oct-47,Oct-16-1947,10/16/47,10/16/47,1947,10,16,Oct
8448130,Mike,Pelyk,29-Sep-47,Sep-29-1947,9/29/47,9/29/47,1947,9,29,Sep
8446444,Jim,Dorey,17-Aug-47,Aug-17-1947,8/17/47,8/17/47,1947,8,17,Aug
8448152,Pierre,Pilote,11-Dec-31,Dec-11-1931,12/11/31,12/11/31,1931,12,11,Dec
8444859,Doug,Acomb,15-May-49,May-15-1949,5/15/49,5/15/49,1949,5,15,May
8449357,Ron,Ward,12-Sep-44,Sep-12-1944,9/12/44,9/12/44,1944,9,12,Sep
8447218,Brian,Glennie,29-Aug-46,Aug-29-1946,8/29/46,8/29/46,1946,8,29,Aug
8447787,Larry,McIntyre,13-Jul-49,Jul-13-1949,7/13/49,7/13/49,1949,7,13,Jul
8447970,Randy,Murray,24-Aug-45,Aug-24-1945,8/24/45,8/24/45,1945,8,24,Aug
8447997,Gordie,Nelson,10-May-47,May-10-1947,5/10/47,5/10/47,1947,5,10,May
8445164,Doug,Brindley,8-Jun-49,Jun-8-1949,6/8/49,6/8/49,1949,6,8,Jun
8447487,Bob,Liddington,15-Sep-48,Sep-15-1948,9/15/48,9/15/48,1948,9,15,Sep
8447610,Brian,Marchinko,2-Aug-48,Aug-2-1948,8/2/48,8/2/48,1948,8,2,Aug
8449265,Guy,Trottier,1-Apr-41,Apr-1-1941,4/1/41,4/1/41,1941,4,1,Apr
8451296,Brad,Selwood,18-Mar-48,Mar-18-1948,3/18/48,3/18/48,1948,3,18,Mar
8450031,Murray,McLachlan,20-Oct-48,Oct-20-1948,10/20/48,10/20/48,1948,10,20,Oct
8447620,Donnie,Marshall,23-Mar-32,Mar-23-1932,3/23/32,3/23/32,1932,3,23,Mar
8449057,Dale,Smedsmo,23-Apr-51,Apr-23-1951,4/23/51,4/23/51,1951,4,23,Apr
8446932,Dave,Fortier,17-Jun-51,Jun-17-1951,6/17/51,6/17/51,1951,6,17,Jun
8446647,John,Grisdale,23-Aug-48,Aug-23-1948,8/23/48,8/23/48,1948,8,23,Aug
8447528,Joe,Lundrigan,12-Sep-48,Sep-12-1948,9/12/48,9/12/48,1948,9,12,Sep
8449515,Gord,McRae,12-Apr-48,Apr-12-1948,4/12/48,4/12/48,1948,4,12,Apr
8447494,Inge,Hammarstrom,20-Jan-48,Jan-20-1948,1/20/48,1/20/48,1948,1,20,Jan
8449212,Bob,Sykes,26-Sep-51,Sep-26-1951,9/26/51,9/26/51,1951,9,26,Sep
8444869,Claire,Alexander,16-Jun-45,Jun-16-1945,6/16/45,6/16/45,1945,6,16,Jun
8446525,Dave,Dunn,19-Aug-48,Aug-19-1948,8/19/48,8/19/48,1948,8,19,Aug
8446567,Scott,Garland,16-May-52,May-16-1952,5/16/52,5/16/52,1952,5,16,May
8448024,Greg,Hubick,12-Nov-51,Nov-12-1951,11/12/51,11/12/51,1951,11,12,Nov
8449311,Kurt,Walker,10-Jun-54,Jun-10-1954,6/10/54,6/10/54,1954,6,10,Jun
8452295,Robert,Warner,13-Dec-50,Dec-13-1950,12/13/50,12/13/50,1950,12,13,Dec
8451891,Wayne,Thomas,9-Oct-47,Oct-9-1947,10/9/47,10/9/47,1947,10,9,Oct
8445613,Bruce,Boudreau,9-Jan-55,Jan-9-1955,1/9/55,1/9/55,1955,1,9,Jan
8446174,Paul,Evans,24-Feb-55,Feb-24-1955,2/24/55,2/24/55,1955,2,24,Feb
8447542,Blair,MacKasey,13-Dec-55,Dec-13-1955,12/13/55,12/13/55,1955,12,13,Dec
8450132,Mike,Palmateer,13-Jan-54,Jan-13-1954,1/13/54,1/13/54,1954,1,13,Jan
8445407,Alain,Belanger,18-Jan-56,Jan-18-1956,1/18/56,1/18/56,1956,1,18,Jan
8448367,Jimmy,Jones,2-Jan-53,Jan-2-1953,1/2/53,1/2/53,1953,1,2,Jan
8448401,Mike,Kaszycki,27-Feb-56,Feb-27-1956,2/27/56,2/27/56,1956,2,27,Feb
8452152,Rick,Vaive,14-May-59,May-14-1959,5/14/59,5/14/59,1959,5,14,May
8446076,Jiri,Crha,13-Apr-50,Apr-13-1950,4/13/50,4/13/50,1950,4,13,Apr
8450830,Curt,Ridley,23-Sep-51,Sep-23-1951,9/23/51,9/23/51,1951,9,23,Sep
8449407,William,McCreary,15-Apr-60,Apr-15-1960,4/15/60,4/15/60,1960,4,15,Apr
8451251,Ron,Sedlbauer,22-Oct-54,Oct-22-1954,10/22/54,10/22/54,1954,10,22,Oct
8446519,Vitezslav,Duris,5-Jan-54,Jan-5-1954,1/5/54,1/5/54,1954,1,5,Jan
8445167,Norm,Aubin,26-Jul-60,Jul-26-1960,7/26/60,7/26/60,1960,7,26,Jul
8447237,Ernie,Godden,13-Mar-61,Mar-13-1961,3/13/61,3/13/61,1961,3,13,Mar
8447658,Billy,Harris,29-Jan-52,Jan-29-1952,1/29/52,1/29/52,1952,1,29,Jan
8447811,Paul,Higgins,13-Jan-62,Jan-13-1962,1/13/62,1/13/62,1962,1,13,Jan
8450301,Fred,Perlini,12-Apr-62,Apr-12-1962,4/12/62,4/12/62,1962,4,12,Apr
8452549,Gary,Yaremchuk,15-Aug-61,Aug-15-1961,8/15/61,8/15/61,1961,8,15,Aug
8445416,Jim,Benning,29-Apr-63,Apr-29-1963,4/29/63,4/29/63,1963,4,29,Apr
8445584,Fred,Boimistruck,14-Jan-62,Jan-14-1962,1/14/62,1/14/62,1962,1,14,Jan
8449410,Darwin,McCutcheon,19-Apr-62,Apr-19-1962,4/19/62,4/19/62,1962,4,19,Apr
8450179,Robert,Parent,19-Feb-58,Feb-19-1958,2/19/58,2/19/58,1958,2,19,Feb
8444896,Russ,Adam,5-May-61,May-5-1961,5/5/61,5/5/61,1961,5,5,May
8445582,Serge,Boisvert,1-Jun-59,Jun-1-1959,6/1/59,6/1/59,1959,6,1,Jun
8446311,Dan,Daoust,29-Feb-60,Feb-29-1960,2/29/60,2/29/60,1960,2,29,Feb
8448125,Peter,Ihnacak,3-May-57,May-3-1957,5/3/57,5/3/57,1957,5,3,May
8448754,Gary,Leeman,19-Feb-64,Feb-19-1964,2/19/64,2/19/64,1964,2,19,Feb
8449035,Marc,Magnan,17-Jan-62,Jan-17-1962,1/17/62,1/17/62,1962,1,17,Jan
8449882,Frank,Nigro,11-Feb-60,Feb-11-1960,2/11/60,2/11/60,1960,2,11,Feb
8451763,Ken,Strong,9-May-63,May-9-1963,5/9/63,5/9/63,1963,5,9,May
8451882,Greg,Terrion,2-May-60,May-2-1960,5/2/60,5/2/60,1960,5,2,May
8452219,Leigh,Verstraete,6-Jan-62,Jan-6-1962,1/6/62,1/6/62,1962,1,6,Jan
8452453,Rod,Willard,1-May-60,May-1-1960,5/1/60,5/1/60,1960,5,1,May
8447205,Gaston,Gingras,13-Feb-59,Feb-13-1959,2/13/59,2/13/59,1959,2,13,Feb
8449925,Gary,Nylund,28-Oct-63,Oct-28-1963,10/28/63,10/28/63,1963,10,28,Oct
8446171,Rich,Costello,27-Jun-63,Jun-27-1963,6/27/63,6/27/63,1963,6,27,Jun
8446473,Bruce,Dowie,9-Dec-62,Dec-9-1962,12/9/62,12/9/62,1962,12,9,Dec
8448657,Larry,Landon,4-May-58,May-4-1958,5/4/58,5/4/58,1958,5,4,May
8448687,Derek,Laxdal,21-Feb-66,Feb-21-1966,2/21/66,2/21/66,1966,2,21,Feb
8448494,Bill,Kitchen,10-Feb-60,Feb-10-1960,2/10/60,2/10/60,1960,2,10,Feb
8450464,Cam,Plante,12-Mar-64,Mar-12-1964,3/12/64,3/12/64,1964,3,12,Mar
8445449,Tim,Bernhardt,17-Jan-58,Jan-17-1958,1/17/58,1/17/58,1958,1,17,Jan
8447909,Dan,Hodgson,29-Aug-65,Aug-29-1965,8/29/65,8/29/65,1965,8,29,Aug
8446597,Don,Edwards,28-Sep-55,Sep-28-1955,9/28/55,9/28/55,1955,9,28,Sep
8444914,Mike,Allison,28-Mar-61,Mar-28-1961,3/28/61,3/28/61,1961,3,28,Mar
8446737,Daryl,Evans,12-Jan-61,Jan-12-1961,1/12/61,1/12/61,1961,1,12,Jan
8446782,Ted,Fauss,30-Jun-61,Jun-30-1961,6/30/61,6/30/61,1961,6,30,Jun
8452154,Val,James,14-Feb-57,Feb-14-1957,2/14/57,2/14/57,1957,2,14,Feb
8452547,Ken,Yaremchuk,1-Jan-64,Jan-1-1964,1/1/64,1/1/64,1964,1,1,Jan
8446517,Jerome,Dupont,21-Feb-62,Feb-21-1962,2/21/62,2/21/62,1962,2,21,Feb
8448667,Rick,Lanz,16-Sep-61,Sep-16-1961,9/16/61,9/16/61,1961,9,16,Sep
8446299,Marty,Dallman,15-Feb-63,Feb-15-1963,2/15/63,2/15/63,1963,2,15,Feb
8449475,Sean,Mckenna,7-Mar-62,Mar-7-1962,3/7/62,3/7/62,1962,3,7,Mar
8446364,Dale,Degray,3-Sep-63,Sep-3-1963,9/3/63,9/3/63,1963,9,3,Sep
8445087,Tim,Armstrong,12-May-67,May-12-1967,5/12/67,5/12/67,1967,5,12,May
8448713,Craig,Laughlin,14-Sep-57,Sep-14-1957,9/14/57,9/14/57,1957,9,14,Sep
8446503,Rocky,Dundas,30-Jan-67,Jan-30-1967,1/30/67,1/30/67,1967,1,30,Jan
8446952,Lou,Franceschetti,28-Mar-58,Mar-28-1958,3/28/58,3/28/58,1958,3,28,Mar
8449439,John,McIntyre,29-Apr-69,Apr-29-1969,4/29/69,4/29/69,1969,4,29,Apr
8450807,Bobby,Reynolds,14-Jul-67,Jul-14-1967,7/14/67,7/14/67,1967,7,14,Jul
8451915,Gilles,Thibaudeau,4-Mar-63,Mar-4-1963,3/4/63,3/4/63,1963,3,4,Mar
8444945,Glenn,Anderson,2-Oct-60,Oct-2-1960,10/2/60,10/2/60,1960,10,2,Oct
8447693,Todd,Hawkins,2-Aug-66,Aug-2-1966,8/2/66,8/2/66,1966,8,2,Aug
8457640,Rob,Pearson,8-Mar-71,Mar-8-1971,3/8/71,3/8/71,1971,3,8,Mar
8446991,Grant,Fuhr,28-Sep-62,Sep-28-1962,9/28/62,9/28/62,1962,9,28,Sep
8452287,Rick,Wamsley,25-May-59,May-25-1959,5/25/59,5/25/59,1959,5,25,May
8445424,Bill,Berg,21-Oct-67,Oct-21-1967,10/21/67,10/21/67,1967,10,21,Oct
8459013,Nikolai,Borschevsky,12-Jan-65,Jan-12-1965,1/12/65,1/12/65,1965,1,12,Jan
8459085,Patrik,Augusta,13-Nov-69,Nov-13-1969,11/13/69,11/13/69,1969,11,13,Nov
8456567,Darby,Hendrickson,28-Aug-72,Aug-28-1972,8/28/72,8/28/72,1972,8,28,Aug
8458616,Alexei,Kudashov,21-Jul-71,Jul-21-1971,7/21/71,7/21/71,1971,7,21,Jul
8456933,Eric,Lacroix,15-Jul-71,Jul-15-1971,7/15/71,7/15/71,1971,7,15,Jul
8458561,Yanic,Perreault,4-Apr-71,Apr-4-1971,4/4/71,4/4/71,1971,4,4,Apr
8457905,David,Sacco,31-Jul-70,Jul-31-1970,7/31/70,7/31/70,1970,7,31,Jul
8459361,Frank,Bialowas,25-Sep-70,Sep-25-1970,9/25/70,9/25/70,1970,9,25,Sep
8457232,Matt,Martin,30-Apr-71,Apr-30-1971,4/30/71,4/30/71,1971,4,30,Apr
8458659,Chris,Snell,12-May-71,May-12-1971,5/12/71,5/12/71,1971,5,12,May
8456080,Paul,Di Pietro,8-Sep-70,Sep-8-1970,9/8/70,9/8/70,1970,9,8,Sep
8459546,Zdenek,Nedved,3-Mar-75,Mar-3-1975,3/3/75,3/3/75,1975,3,3,Mar
8450832,Mike,Ridley,8-Jul-63,Jul-8-1963,7/8/63,7/8/63,1963,7,8,Jul
8451089,Warren,Rychel,12-May-67,May-12-1967,5/12/67,5/12/67,1967,5,12,May
8452501,Randy,Wood,12-Oct-63,Oct-12-1963,10/12/63,10/12/63,1963,10,12,Oct
8459434,Kenny,Jonsson,6-Oct-74,Oct-6-1974,10/6/74,10/6/74,1974,10,6,Oct
8458945,Brandon,Convery,4-Feb-74,Feb-4-1974,2/4/74,2/4/74,1974,2,4,Feb
8458666,Kelly,Fairchild,9-Apr-73,Apr-9-1973,4/9/73,4/9/73,1973,4,9,Apr
8460539,Sean,Haggerty,11-Feb-76,Feb-11-1976,2/11/76,2/11/76,1976,2,11,Feb
8459748,Mark,Kolesar,23-Jan-73,Jan-23-1973,1/23/73,1/23/73,1973,1,23,Jan
8449669,Sergio,Momesso,4-Sep-65,Sep-4-1965,9/4/65,9/4/65,1965,9,4,Sep
8460742,Sergei,Berezin,5-Nov-71,Nov-5-1971,11/5/71,11/5/71,1971,11,5,Nov
8462649,John,Craighead,23-Nov-71,Nov-23-1971,11/23/71,11/23/71,1971,11,23,Nov
8459032,Ralph,Intranuovo,11-Dec-73,Dec-11-1973,12/11/73,12/11/73,1973,12,11,Dec
8460522,Jason,Podollan,18-Feb-76,Feb-18-1976,2/18/76,2/18/76,1976,2,18,Feb
8459464,Shayne,Toporowski,6-Aug-75,Aug-6-1975,8/6/75,8/6/75,1975,8,6,Aug
8458796,Brian,Wiseman,13-Jul-71,Jul-13-1971,7/13/71,7/13/71,1971,7,13,Jul
8458948,David,Cooper,2-Nov-73,Nov-2-1973,11/2/73,11/2/73,1973,11,2,Nov
8462069,Denis,Smith,13-May-77,May-13-1977,5/13/77,5/13/77,1977,5,13,May
8462046,Jeff,Ware,19-May-77,May-19-1977,5/19/77,5/19/77,1977,5,19,May
8458576,Marcel,Cousineau,30-Apr-73,Apr-30-1973,4/30/73,4/30/73,1973,4,30,Apr
8459446,Kevyn,Adams,8-Oct-74,Oct-8-1974,10/8/74,10/8/74,1974,10,8,Oct
8459995,Lonny,Bohonos,20-May-73,May-20-1973,5/20/73,5/20/73,1973,5,20,May
8458611,Mike,Kennedy,13-Apr-72,Apr-13-1972,4/13/72,4/13/72,1972,4,13,Apr
8460747,Per,Gustafsson,4-Jun-70,Jun-4-1970,6/4/70,6/4/70,1970,6,4,Jun
8447709,Glenn,Healy,23-Aug-62,Aug-23-1962,8/23/62,8/23/62,1962,8,23,Aug
8456000,Kevin,Dahl,30-Dec-68,Dec-30-1968,12/30/68,12/30/68,1968,12,30,Dec
8456793,Alexander,Karpovtsev,7-Apr-70,Apr-7-1970,4/7/70,4/7/70,1970,4,7,Apr
8459158,Jonas,Hoglund,29-Aug-72,Aug-29-1972,8/29/72,8/29/72,1972,8,29,Aug
8465094,Dmitriy,Yakushin,21-Jan-78,Jan-21-1978,1/21/78,1/21/78,1978,1,21,Jan
8460502,Wade,Belak,3-Jul-76,Jul-3-1976,7/3/76,7/3/76,1976,7,3,Jul
8446167,Shayne,Corson,13-Aug-66,Aug-13-1966,8/13/66,8/13/66,1966,8,13,Aug
8462034,Aki,Berg,28-Jul-77,Jul-28-1977,7/28/77,7/28/77,1977,7,28,Jul
8459462,Bryan,McCabe,8-Jun-75,Jun-8-1975,6/8/75,6/8/75,1975,6,8,Jun
8467510,Petr,Svoboda,20-Jun-80,Jun-20-1980,6/20/80,6/20/80,1980,6,20,Jun
8450767,Robert,Reichel,25-Jun-71,Jun-25-1971,6/25/71,6/25/71,1971,6,25,Jun
8459519,Bob,Wren,16-Sep-74,Sep-16-1974,9/16/74,9/16/74,1974,9,16,Sep
8448824,Jyrki,Lumme,16-Jul-66,Jul-16-1966,7/16/66,7/16/66,1966,7,16,Jul
8462057,Marc,Moro,17-Jul-77,Jul-17-1977,7/17/77,7/17/77,1977,7,17,Jul
8469491,Karel,Pilar,23-Dec-77,Dec-23-1977,12/23/77,12/23/77,1977,12,23,Dec
8468243,Sebastien,Centomo,26-Mar-81,Mar-26-1981,3/26/81,3/26/81,1981,3,26,Mar
8466171,Harold,Druken,26-Jan-79,Jan-26-1979,1/26/79,1/26/79,1979,1,26,Jan
8464965,Josh,Holden,18-Jan-78,Jan-18-1978,1/18/78,1/18/78,1978,1,18,Jan
8470162,Matt,Stajan,19-Dec-83,Dec-19-1983,12/19/83,12/19/83,1983,12,19,Dec
8459014,Robert,Svehla,2-Jan-69,Jan-2-1969,1/2/69,1/2/69,1969,1,2,Jan
8456830,Trevor,Kidd,29-Mar-72,Mar-29-1972,3/29/72,3/29/72,1972,3,29,Mar
8468550,Mikael,Tellqvist,19-Sep-79,Sep-19-1979,9/19/79,9/19/79,1979,9,19,Sep
8456729,Craig,Johnson,18-Mar-72,Mar-18-1972,3/18/72,3/18/72,1972,3,18,Mar
8466431,Brad,Leeb,27-Aug-79,Aug-27-1979,8/27/79,8/27/79,1979,8,27,Aug
8462072,Nathan,Perrott,8-Dec-76,Dec-8-1976,12/8/76,12/8/76,1976,12,8,Dec
8462182,Clarke,Wilm,24-Oct-76,Oct-24-1976,10/24/76,10/24/76,1976,10,24,Oct
8468112,Pierre,Hedin,19-Feb-78,Feb-19-1978,2/19/78,2/19/78,1978,2,19,Feb
8448287,Calle,Johansson,14-Feb-67,Feb-14-1967,2/14/67,2/14/67,1967,2,14,Feb
8469615,Maxim,Kondratiev,20-Jan-83,Jan-20-1983,1/20/83,1/20/83,1983,1,20,Jan
8468868,Ben,Ondrus,25-Jun-82,Jun-25-1982,6/25/82,6/25/82,1982,6,25,Jun
8467565,John,Pohl,29-Jun-79,Jun-29-1979,6/29/79,6/29/79,1979,6,29,Jun
8470257,Alexander,Steen,1-Mar-84,Mar-1-1984,3/1/84,3/1/84,1984,3,1,Mar
8470809,Jeremy,Williams,26-Jan-84,Jan-26-1984,1/26/84,1/26/84,1984,1,26,Jan
8469516,Brendan,Bell,31-Mar-83,Mar-31-1983,3/31/83,3/31/83,1983,3,31,Mar
8468105,Alexander,Khavanov,30-Jan-72,Jan-30-1972,1/30/72,1/30/72,1972,1,30,Jan
8470058,Staffan,Kronwall,10-Sep-82,Sep-10-1982,9/10/82,9/10/82,1982,9,10,Sep
8460620,Bates,Battaglia,13-Dec-75,Dec-13-1975,12/13/75,12/13/75,1975,12,13,Dec
8458976,Michael,Peca,26-Mar-74,Mar-26-1974,3/26/74,3/26/74,1974,3,26,Mar
8467488,Erik,Westrum,26-Jul-79,Jul-26-1979,7/26/79,7/26/79,1979,7,26,Jul
8467844,Jason,Blake,2-Sep-73,Sep-2-1973,9/2/73,9/2/73,1973,9,2,Sep
8470986,Darryl,Boyce,7-Jul-84,Jul-7-1984,7/7/84,7/7/84,1984,7,7,Jul
8471399,Robbie,Earl,2-Jun-85,Jun-2-1985,6/2/85,6/2/85,1985,6,2,Jun
8472334,Alex,Foster,26-Aug-84,Aug-26-1984,8/26/84,8/26/84,1984,8,26,Aug
8470301,Andre,Deveaux,23-Feb-84,Feb-23-1984,2/23/84,2/23/84,1984,2,23,Feb
8471362,Mikhail,Grabovski,31-Jan-84,Jan-31-1984,1/31/84,1/31/84,1984,1,31,Jan
8467943,Niklas,Hagman,5-Dec-79,Dec-5-1979,12/5/79,12/5/79,1979,12,5,Dec
8470373,Jeff,Hamilton,4-Sep-77,Sep-4-1977,9/4/77,9/4/77,1977,9,4,Sep
8475087,Christian,Hanson,10-Mar-86,Mar-10-1986,3/10/86,3/10/86,1986,3,10,Mar
8469681,Ryan,Hollweg,23-Apr-83,Apr-23-1983,4/23/83,4/23/83,1983,4,23,Apr
8473579,Nikolay,Kulemin,14-Jul-86,Jul-14-1986,7/14/86,7/14/86,1986,7,14,Jul
8470750,John,Mitchell,22-Jan-85,Jan-22-1985,1/22/85,1/22/85,1985,1,22,Jan
8468113,Jeff,Finger,18-Dec-79,Dec-18-1979,12/18/79,12/18/79,1979,12,18,Dec
8467531,Jonas,Frogren,28-Aug-80,Aug-28-1980,8/28/80,8/28/80,1980,8,28,Aug
8471746,Phil,Oreskovic,26-Jan-87,Jan-26-1987,1/26/87,1/26/87,1987,1,26,Jan
8472338,Jaime,Sifers,18-Jan-83,Jan-18-1983,1/18/83,1/18/83,1983,1,18,Jan
8467350,Mike,Van Ryn,14-May-79,May-14-1979,5/14/79,5/14/79,1979,5,14,May
8469675,Martin,Gerber,3-Sep-74,Sep-3-1974,9/3/74,9/3/74,1974,9,3,Sep
8471302,Justin,Pogge,22-Apr-86,Apr-22-1986,4/22/86,4/22/86,1986,4,22,Apr
8475098,Tyler,Bozak,19-Mar-86,Mar-19-1986,3/19/86,3/19/86,1986,3,19,Mar
8475638,Brayden,Irwin,24-Mar-87,Mar-24-1987,3/24/87,3/24/87,1987,3,24,Mar
8475172,Nazem,Kadri,6-Oct-90,Oct-6-1990,10/6/90,10/6/90,1990,10,6,Oct
8467882,Jamie,Lundmark,16-Jan-81,Jan-16-1981,1/16/81,1/16/81,1981,1,16,Jan
8469464,Fredrik,Sjostrom,6-May-83,May-6-1983,5/6/83,5/6/83,1983,5,6,May
8473537,Viktor,Stalberg,17-Jan-86,Jan-17-1986,1/17/86,1/17/86,1986,1,17,Jan
8467491,Rickard,Wallin,9-Apr-80,Apr-9-1980,4/9/80,4/9/80,1980,4,9,Apr
8467400,Francois,Beauchemin,4-Jun-80,Jun-4-1980,6/4/80,6/4/80,1980,6,4,Jun
8474125,Carl,Gunnarsson,9-Nov-86,Nov-9-1986,11/9/86,11/9/86,1986,11,9,Nov
8469460,Mike,Komisarek,19-Jan-82,Jan-19-1982,1/19/82,1/19/82,1982,1,19,Jan
8470602,Dion,Phaneuf,10-Apr-85,Apr-10-1985,4/10/85,4/10/85,1985,4,10,Apr
8474577,Joe,Colborne,30-Jan-90,Jan-30-1990,1/30/90,1/30/90,1990,1,30,Jan
8474192,Matt,Frattin,3-Jan-88,Jan-3-1988,1/3/88,1/3/88,1988,1,3,Jan
8475950,Marcel,Mueller,10-Jul-88,Jul-10-1988,7/10/88,7/10/88,1988,7,10,Jul
8473560,Korbinian,Holzer,16-Feb-88,Feb-16-1988,2/16/88,2/16/88,1988,2,16,Feb
8475154,Carter,Ashton,1-Apr-91,Apr-1-1991,4/1/91,4/1/91,1991,4,1,Apr
8467878,Tim,Connolly,7-May-81,May-7-1981,5/7/81,5/7/81,1981,5,7,May
8470697,Philippe,Dupuis,24-Apr-85,Apr-24-1985,4/24/85,4/24/85,1985,4,24,Apr
8472424,Ryan,Hamilton,15-Apr-85,Apr-15-1985,4/15/85,4/15/85,1985,4,15,Apr
8468695,Matthew,Lombardi,18-Mar-82,Mar-18-1982,3/18/82,3/18/82,1982,3,18,Mar
8471742,Cody,Franson,8-Aug-87,Aug-8-1987,8/8/87,8/8/87,1987,8,8,Aug
8474581,Jake,Gardiner,4-Jul-90,Jul-4-1990,7/4/90,7/4/90,1990,7,4,Jul
8475680,Jussi,Rynnas,22-May-87,May-22-1987,5/22/87,5/22/87,1987,5,22,May
8475681,Ben,Scrivens,11-Sep-86,Sep-11-1986,9/11/86,9/11/86,1986,9,11,Sep
8473463,Leo,Komarov,23-Jan-87,Jan-23-1987,1/23/87,1/23/87,1987,1,23,Jan
8469508,Jay,McClement,2-Mar-83,Mar-2-1983,3/2/83,3/2/83,1983,3,2,Mar
8470672,Ryan,O'Byrne,19-Jul-84,Jul-19-1984,7/19/84,7/19/84,1984,7,19,Jul
8476805,Spencer,Abbott,30-Apr-88,Apr-30-1988,4/30/88,4/30/88,1988,4,30,Apr
8470867,Troy,Bodie,25-Jan-85,Jan-25-1985,1/25/85,1/25/85,1985,1,25,Jan
8471245,Dave,Bolland,5-Jun-86,Jun-5-1986,6/5/86,6/5/86,1986,6,5,Jun
8476304,David,Broll,4-Jan-93,Jan-4-1993,1/4/93,1/4/93,1993,1,4,Jan
8475309,Jerry,D'Amigo,19-Feb-91,Feb-19-1991,2/19/91,2/19/91,1991,2,19,Feb
8475190,Jamie,Devane,20-Feb-91,Feb-20-1991,2/20/91,2/20/91,1991,2,20,Feb
8475180,Peter,Holland,14-Jan-91,Jan-14-1991,1/14/91,1/14/91,1991,1,14,Jan
8476410,Josh,Leivo,26-May-93,May-26-1993,5/26/93,5/26/93,1993,5,26,May
8471664,Mason,Raymond,17-Sep-85,Sep-17-1985,9/17/85,9/17/85,1985,9,17,Sep
8468162,Jerred,Smithson,4-Feb-79,Feb-4-1979,2/4/79,2/4/79,1979,2,4,Feb
8469476,Tim,Gleason,29-Jan-83,Jan-29-1983,1/29/83,1/29/83,1983,1,29,Jan
8475774,Petter,Granberg,27-Aug-92,Aug-27-1992,8/27/92,8/27/92,1992,8,27,Aug
8476853,Morgan,Rielly,9-Mar-94,Mar-9-1994,3/9/94,3/9/94,1994,3,9,Mar
8469569,Drew,MacIntyre,24-Jun-83,Jun-24-1983,6/24/83,6/24/83,1983,6,24,Jun
8478376,Casey,Bailey,27-Oct-91,Oct-27-1991,10/27/91,10/27/91,1991,10,27,Oct
8475842,Sam,Carrick,4-Feb-92,Feb-4-1992,2/4/92,2/4/92,1992,2,4,Feb
8475295,Brandon,Kozun,8-Mar-90,Mar-8-1990,3/8/90,3/8/90,1990,3,8,Mar
8470152,Joakim,Lindstrom,5-Dec-83,Dec-5-1983,12/5/83,12/5/83,1983,12,5,Dec
8474113,TJ,Brennan,3-Apr-89,Apr-3-1989,4/3/89,4/3/89,1989,4,3,Apr
8475148,Tim,Erixon,24-Feb-91,Feb-24-1991,2/24/91,2/24/91,1991,2,24,Feb
8474748,Andrew,MacWilliam,25-Mar-90,Mar-25-1990,3/25/90,3/25/90,1990,3,25,Mar
8476478,Stuart,Percy,18-May-93,May-18-1993,5/18/93,5/18/93,1993,5,18,May
8462196,Stephane,Robidas,3-Mar-77,Mar-3-1977,3/3/77,3/3/77,1977,3,3,Mar
8477015,Connor,Brown,14-Jan-94,Jan-14-1994,1/14/94,1/14/94,1994,1,14,Jan
8471733,Rich,Clune,25-Apr-87,Apr-25-1987,4/25/87,4/25/87,1987,4,25,Apr
8471862,Colin,Greening,9-Mar-86,Mar-9-1986,3/9/86,3/9/86,1986,3,9,Mar
8475786,Zach,Hyman,9-Jun-92,Jun-9-1992,6/9/92,6/9/92,1992,6,9,Jun
8469639,Brooks,Laich,23-Jun-83,Jun-23-1983,6/23/83,6/23/83,1983,6,23,Jun
8476894,Brendan,Leipsic,19-May-94,May-19-1994,5/19/94,5/19/94,1994,5,19,May
8477427,Tobias,Lindberg,22-Jul-95,Jul-22-1995,7/22/95,7/22/95,1995,7,22,Jul
8477939,William,Nylander,1-May-96,May-1-1996,5/1/96,5/1/96,1996,5,1,May
8478373,Nikita,Soshnikov,14-Oct-93,Oct-14-1993,10/14/93,10/14/93,1993,10,14,Oct
8474638,Andrew,Campbell,4-Feb-88,Feb-4-1988,2/4/88,2/4/88,1988,2,4,Feb
8477033,Viktor,Loov,16-Nov-92,Nov-16-1992,11/16/92,11/16/92,1992,11,16,Nov
8475716,Martin,Marincin,18-Feb-92,Feb-18-1992,2/18/92,2/18/92,1992,2,18,Feb
8477642,Rinat,Valiev,11-May-95,May-11-1995,5/11/95,5/11/95,1995,5,11,May
8476343,Garret,Sparks,28-Jun-93,Jun-28-1993,6/28/93,6/28/93,1993,6,28,Jun
8478483,Mitchell,Marner,5-May-97,May-5-1997,5/5/97,5/5/97,1997,5,5,May
8474709,Matt,Martin,8-May-89,May-8-1989,5/8/89,5/8/89,1989,5,8,May
8479318,Auston,Matthews,17-Sep-97,Sep-17-1997,9/17/97,9/17/97,1997,9,17,Sep
8479458,Nikita,Zaitsev,29-Oct-91,Oct-29-1991,10/29/91,10/29/91,1991,10,29,Oct
8475883,Frederik,Andersen,2-Oct-89,Oct-2-1989,10/2/89,10/2/89,1989,10,2,Oct
8477312,Antoine,Bibeau,1-May-94,May-1-1994,5/1/94,5/1/94,1994,5,1,May
8473523,Jhonas,Enroth,25-Jun-88,Jun-25-1988,6/25/88,6/25/88,1988,6,25,Jun
8469521,Tomas,Plekanec,31-Oct-82,Oct-31-1982,10/31/82,10/31/82,1982,10,31,Oct
8478408,Travis,Dermott,22-Dec-96,Dec-22-1996,12/22/96,12/22/96,1996,12,22,Dec
8480157,Calle,Rosen,2-Feb-94,Feb-2-1994,2/2/94,2/2/94,1994,2,2,Feb
8474589,Tyler,Ennis,6-Oct-89,Oct-6-1989,10/6/89,10/6/89,1989,10,6,Oct
8479675,Trevor,Moore,31-Mar-95,Mar-31-1995,3/31/95,3/31/95,1995,3,31,Mar
8475166,John,Tavares,20-Sep-90,Sep-20-1990,9/20/90,9/20/90,1990,9,20,Sep
8474162,Jake,Muzzin,21-Feb-89,Feb-21-1989,2/21/89,2/21/89,1989,2,21,Feb
8480943,Igor,Ozhiganov,13-Oct-92,Oct-13-1992,10/13/92,10/13/92,1992,10,13,Oct
8476857,Pontus,Aberg,23-Sep-93,Sep-23-1993,9/23/93,9/23/93,1993,9,23,Sep
8475160,Kyle,Clifford,13-Jan-91,Jan-13-1991,1/13/91,1/13/91,1991,1,13,Jan
8478115,Pierre,Engvall,31-May-96,May-31-1996,5/31/96,5/31/96,1996,5,31,May
8477021,Alex,Kerfoot,11-Aug-94,Aug-11-1994,8/11/94,8/11/94,1994,8,11,Aug
8479510,Egor,Korshkov,10-Jul-96,Jul-10-1996,7/10/96,7/10/96,1996,7,10,Jul
8478843,Denis,Malgin,18-Jan-97,Jan-18-1997,1/18/97,1/18/97,1997,1,18,Jan
8478975,Mason,Marchment,18-Jun-95,Jun-18-1995,6/18/95,6/18/95,1995,6,18,Jun
8481624,Ilya,Mikheyev,10-Oct-94,Oct-10-1994,10/10/94,10/10/94,1994,10,10,Oct
8481582,Nicholas,Robertson,11-Sep-01,Sep-11-2001,9/11/01,9/11/01,2001,9,11,Sep
8469455,Jason,Spezza,13-Jun-83,Jun-13-1983,6/13/83,6/13/83,1983,6,13,Jun
8475197,Tyson,Barrie,26-Jul-91,Jul-26-1991,7/26/91,7/26/91,1991,7,26,Jul
8475857,Kevin,Gravel,6-Mar-92,Mar-6-1992,3/6/92,3/6/92,1992,3,6,Mar
8480043,Timothy,Liljegren,30-Apr-99,Apr-30-1999,4/30/99,4/30/99,1999,4,30,Apr
8480873,Rasmus,Sandin,7-Mar-00,Mar-7-2000,3/7/00,3/7/00,2000,3,7,Mar
8475789,Jack,Campbell,9-Jan-92,Jan-9-1992,1/9/92,1/9/92,1992,1,9,Jan
8479288,Kasimir,Kaskisuo,2-Oct-93,Oct-2-1993,10/2/93,10/2/93,1993,10,2,Oct
8476329,Travis,Boyd,14-Sep-93,Sep-14-1993,9/14/93,9/14/93,1993,9,14,Sep
8477149,Scott,Sabourin,30-Jul-92,Jul-30-1992,7/30/92,7/30/92,1992,7,30,Jul
8474673,TJ,Brodie,7-Jun-90,Jun-7-1990,6/7/90,6/7/90,1990,6,7,Jun
8477018,Ben,Hutton,20-Apr-93,Apr-20-1993,4/20/93,4/20/93,1993,4,20,Apr
8482247,Mikko,Lehtonen,16-Jan-94,Jan-16-1994,1/16/94,1/16/94,1994,1,16,Jan
8481720,Nick,Abruzzese,4-Jun-99,Jun-4-1999,6/4/99,6/4/99,1999,6,4,Jun
8478020,Michael,Amadio,13-May-96,May-13-1996,5/13/96,5/13/96,1996,5,13,May
8476278,Colin,Blackwell,28-Mar-93,Mar-28-1993,3/28/93,3/28/93,1993,3,28,Mar
8478047,Michael,Bunting,17-Sep-95,Sep-17-1995,9/17/95,9/17/95,1995,9,17,Sep
8480144,David,Kampf,12-Jan-95,Jan-12-1995,1/12/95,1/12/95,1995,1,12,Jan
8482815,Kirill,Semyonov,27-Oct-94,Oct-27-1994,10/27/94,10/27/94,1994,10,27,Oct
8482634,Alex,Steeves,10-Dec-99,Dec-10-1999,12/10/99,12/10/99,1999,12,10,Dec
8470966,Mark,Giordano,3-Oct-83,Oct-3-1983,10/3/83,10/3/83,1983,10,3,Oct
8480950,Ilya,Lyubushkin,6-Apr-94,Apr-6-1994,4/6/94,4/6/94,1994,4,6,Apr
8479729,Kristians,Rubins,11-Dec-97,Dec-11-1997,12/11/97,12/11/97,1997,12,11,Dec
8478902,Erik,Kallgren,14-Oct-96,Oct-14-1996,10/14/96,10/14/96,1996,10,14,Oct
8479361,Joseph,Woll,12-Jul-98,Jul-12-1998,7/12/98,7/12/98,1998,7,12,Jul
8480977,Semyon,Der-Arguchintsev,15-Sep-00,Sep-15-2000,9/15/00,9/15/00,2000,9,15,Sep
8480995,Pontus,Holmberg,9-Mar-99,Mar-9-1999,3/9/99,3/9/99,1999,3,9,Mar
8478211,Dryden,Hunt,24-Nov-95,Nov-24-1995,11/24/95,11/24/95,1995,11,24,Nov
8475714,Calle,Jarnkrok,25-Sep-91,Sep-25-1991,9/25/91,9/25/91,1991,9,25,Sep
8482720,Matthew,Knies,17-Oct-02,Oct-17-2002,10/17/02,10/17/02,2002,10,17,Oct
8482259,Bobby,McMann,15-Jun-96,Jun-15-1996,6/15/96,6/15/96,1996,6,15,Jun
8475158,Ryan,O'Reilly,7-Feb-91,Feb-7-1991,2/7/91,2/7/91,1991,2,7,Feb
8480439,Mac,Hollowell,26-Sep-98,Sep-26-1998,9/26/98,9/26/98,1998,9,26,Sep
8480820,Filip,Kral,20-Oct-99,Oct-20-1999,10/20/99,10/20/99,1999,10,20,Oct
8476931,Jake,McCabe,12-Oct-93,Oct-12-1993,10/12/93,10/12/93,1993,10,12,Oct
8479376,Victor,Mete,7-Jun-98,Jun-7-1998,6/7/98,6/7/98,1998,6,7,Jun
8479982,Conor,Timmins,18-Sep-98,Sep-18-1998,9/18/98,9/18/98,1998,9,18,Sep
8483183,Jett,Alexander,8-Nov-99,Nov-8-1999,11/8/99,11/8/99,1999,11,8,Nov
8478492,Ilya,Samsonov,22-Feb-97,Feb-22-1997,2/22/97,2/22/97,1997,2,22,Feb
8477503,Max,Domi,2-Mar-95,Mar-2-1995,3/2/95,3/2/95,1995,3,2,Mar
8481122,Simon,Benoit,19-Sep-98,Sep-19-1998,9/19/98,9/19/98,1998,9,19,Sep
8475906,John,Klingberg,14-Aug-92,Aug-14-1992,8/14/92,8/14/92,1992,8,14,Aug
8478021,William,Lagesson,22-Feb-96,Feb-22-1996,2/22/96,2/22/96,1996,2,22,Feb
8483710,Dennis,Hildeby,19-Aug-01,Aug-19-2001,8/19/01,8/19/01,2001,8,19,Aug
8446623,Phil,Goyette,31-Oct-33,Oct-31-1933,10/31/33,10/31/33,1933,10,31,Oct
8448162,Billy,Inglis,11-May-43,May-11-1943,5/11/43,5/11/43,1943,5,11,May
8447745,Brian,McDonald,23-Mar-45,Mar-23-1945,3/23/45,3/23/45,1945,3,23,Mar
8448069,Kevin,O'Shea,28-May-47,May-28-1947,5/28/47,5/28/47,1947,5,28,May
8450308,Gilbert,Perreault,13-Nov-50,Nov-13-1950,11/13/50,11/13/50,1950,11,13,Nov
8449646,Randy,Wyrozub,8-Apr-50,Apr-8-1950,4/8/50,4/8/50,1950,4,8,Apr
8447488,Al,Hamilton,20-Aug-46,Aug-20-1946,8/20/46,8/20/46,1946,8,20,Aug
8447971,Hap,Myers,28-Jul-47,Jul-28-1947,7/28/47,7/28/47,1947,7,28,Jul
8451880,Paul,Terbenche,16-Sep-45,Sep-16-1945,9/16/45,9/16/45,1945,9,16,Sep
8446488,Dave,Dryden,5-Sep-41,Sep-5-1941,9/5/41,9/5/41,1941,9,5,Sep
8449275,Richard,Martin,26-Jul-51,Jul-26-1951,7/26/51,7/26/51,1951,7,26,Jul
8450640,Craig,Ramsay,17-Mar-51,Mar-17-1951,3/17/51,3/17/51,1951,3,17,Mar
8445800,Ron,Busniuk,13-Aug-48,Aug-13-1948,8/13/48,8/13/48,1948,8,13,Aug
8446713,Hugh,Harris,7-Jun-48,Jun-7-1948,6/7/48,6/7/48,1948,6,7,Jun
8448330,Bob,Richer,5-Mar-51,Mar-5-1951,3/5/51,3/5/51,1951,3,5,Mar
8449917,Rocky,Farr,7-Apr-47,Apr-7-1947,4/7/47,4/7/47,1947,4,7,Apr
8447445,Bill,Hajt,18-Nov-51,Nov-18-1951,11/18/51,11/18/51,1951,11,18,Nov
8448524,Jerry,Korab,15-Sep-48,Sep-15-1948,9/15/48,9/15/48,1948,9,15,Sep
8445695,Gary,Bromley,19-Jan-50,Jan-19-1950,1/19/50,1/19/50,1950,1,19,Jan
8445889,Michel,Deziel,31-Jan-54,Jan-31-1954,1/31/54,1/31/54,1954,1,31,Jan
8447825,Bryan,McSheffrey,25-Sep-52,Sep-25-1952,9/25/52,9/25/52,1952,9,25,Sep
8451910,Morris,Titanic,7-Jan-53,Jan-7-1953,1/7/53,1/7/53,1953,1,7,Jan
8446871,Lee,Fogolin,7-Feb-55,Feb-7-1955,2/7/55,2/7/55,1955,2,7,Feb
8447420,Jocelyn,Guevremont,1-Mar-51,Mar-1-1951,3/1/51,3/1/51,1951,3,1,Mar
8447783,Paul,McIntosh,13-Mar-54,Mar-13-1954,3/13/54,3/13/54,1954,3,13,Mar
8449868,Gerry,Desjardins,22-Jul-44,Jul-22-1944,7/22/44,7/22/44,1944,7,22,Jul
8445676,Ken,Breitenbach,9-Jan-55,Jan-9-1955,1/9/55,1/9/55,1955,1,9,Jan
8448532,Joe,Kowal,3-Feb-56,Feb-3-1956,2/3/56,2/3/56,1956,2,3,Feb
8451907,Alex,Tidey,5-Jan-55,Jan-5-1955,1/5/55,1/5/55,1955,1,5,Jan
8450641,Wayne,Ramsey,31-Jan-57,Jan-31-1957,1/31/57,1/31/57,1957,1,31,Jan
8450469,Larry,Playfair,23-Jun-58,Jun-23-1958,6/23/58,6/23/58,1958,6,23,Jun
8448170,Randy,Ireland,5-Apr-57,Apr-5-1957,4/5/57,4/5/57,1957,4,5,Apr
8449678,Robert,Mongrain,31-Aug-59,Aug-31-1959,8/31/59,8/31/59,1959,8,31,Aug
8451053,Lindy,Ruff,17-Feb-60,Feb-17-1960,2/17/60,2/17/60,1960,2,17,Feb
8449660,Mike,Moller,16-Jun-62,Jun-16-1962,6/16/62,6/16/62,1962,6,16,Jun
8446547,Jeff,Eatough,2-Jun-63,Jun-2-1963,6/2/63,6/2/63,1963,6,2,Jun
8448644,Yvon,Lambert,20-May-50,May-20-1950,5/20/50,5/20/50,1950,5,20,May
8446821,Ron,Fischer,12-Apr-59,Apr-12-1959,4/12/59,4/12/59,1959,4,12,Apr
8451777,Kai,Suikkanen,29-Jun-59,Jun-29-1959,6/29/59,6/29/59,1959,6,29,Jun
8452233,Hannu,Virta,22-Mar-63,Mar-22-1963,3/22/63,3/22/63,1963,3,22,Mar
8452279,James,Walsh,26-Oct-56,Oct-26-1956,10/26/56,10/26/56,1956,10,26,Oct
8450919,Geordie,Robertson,1-Aug-59,Aug-1-1959,8/1/59,8/1/59,1959,8,1,Aug
8448654,Chris,Langevin,27-Nov-59,Nov-27-1959,11/27/59,11/27/59,1959,11,27,Nov
8452215,Claude,Verret,20-Apr-63,Apr-20-1963,4/20/63,4/20/63,1963,4,20,Apr
8450057,Gaetano,Orlando,13-Nov-62,Nov-13-1962,11/13/62,11/13/62,1962,11,13,Nov
8448387,Timo,Jutila,24-Dec-63,Dec-24-1963,12/24/63,12/24/63,1963,12,24,Dec
8449103,Dave,Maloney,31-Jul-56,Jul-31-1956,7/31/56,7/31/56,1956,7,31,Jul
8447447,Richard,Hajdu,10-Apr-65,Apr-10-1965,4/10/65,4/10/65,1965,4,10,Apr
8446679,Brian,Engblom,27-Jan-55,Jan-27-1955,1/27/55,1/27/55,1955,1,27,Jan
8447919,Jim,Hofford,4-Oct-64,Oct-4-1964,10/4/64,10/4/64,1964,10,4,Oct
8445729,Paul,Brydges,21-Jun-65,Jun-21-1965,6/21/65,6/21/65,1965,6,21,Jun
8447193,Clark,Gillies,7-Apr-54,Apr-7-1954,4/7/54,4/7/54,1954,4,7,Apr
8448821,Robert,Logan,22-Feb-64,Feb-22-1964,2/22/64,2/22/64,1964,2,22,Feb
8451080,Christian,Ruuttu,20-Feb-64,Feb-20-1964,2/20/64,2/20/64,1964,2,20,Feb
8451940,Doug,Trapp,28-Nov-65,Nov-28-1965,11/28/65,11/28/65,1965,11,28,Nov
8446449,Mike,Donnelly,10-Oct-63,Oct-10-1963,10/10/63,10/10/63,1963,10,10,Oct
8448202,Jim,Jackson,1-Feb-60,Feb-1-1960,2/1/60,2/1/60,1960,2,1,Feb
8449577,Scott,Metcalfe,6-Jan-67,Jan-6-1967,1/6/67,1/6/67,1967,1,6,Jan
8451991,Pierre,Turgeon,28-Aug-69,Aug-28-1969,8/28/69,8/28/69,1969,8,28,Aug
8449461,Donald,Mcsween,9-Jun-64,Jun-9-1964,6/9/64,6/9/64,1964,6,9,Jun
8448391,Trent,Kaese,9-Sep-67,Sep-9-1967,9/9/67,9/9/67,1967,9,9,Sep
8449608,Brad,Miller,23-Jul-69,Jul-23-1969,7/23/69,7/23/69,1969,7,23,Jul
8447369,Francois,Guay,8-Jun-68,Jun-8-1968,6/8/68,6/8/68,1968,6,8,Jun
8448793,Darcy,Loewen,26-Feb-69,Feb-26-1969,2/26/69,2/26/69,1969,2,26,Feb
8448859,Steve,Ludzik,3-Apr-61,Apr-3-1961,4/3/61,4/3/61,1961,4,3,Apr
8449664,Mitchell,Molloy,10-Oct-65,Oct-10-1965,10/10/65,10/10/65,1965,10,10,Oct
8450678,Rob,Ray,8-Jun-68,Jun-8-1968,6/8/68,6/8/68,1968,6,8,Jun
8451140,Joel,Savage,25-Dec-69,Dec-25-1969,12/25/69,12/25/69,1969,12,25,Dec
8451175,Jiri,Sejba,22-Jul-62,Jul-22-1962,7/22/62,7/22/62,1962,7,22,Jul
8455874,Peter,Ciavaglia,15-Jul-69,Jul-15-1969,7/15/69,7/15/69,1969,7,15,Jul
8448626,Pat,LaFontaine,22-Feb-65,Feb-22-1965,2/22/65,2/22/65,1965,2,22,Feb
8450234,Colin,Patterson,11-May-60,May-11-1960,5/11/60,5/11/60,1960,5,11,May
8455805,Keith,Carney,3-Feb-70,Feb-3-1970,2/3/70,2/3/70,1970,2,3,Feb
8456401,Viktor,Gordiouk,11-Apr-70,Apr-11-1970,4/11/70,4/11/70,1970,4,11,Apr
8459044,Yuri,Khmylev,9-Aug-64,Aug-9-1964,8/9/64,8/9/64,1964,8,9,Aug
8457134,Doug,Macdonald,8-Feb-69,Feb-8-1969,2/8/69,2/8/69,1969,2,8,Feb
8458208,John,Thomas,18-Jan-70,Jan-18-1970,1/18/70,1/18/70,1970,1,18,Jan
8458549,Jason,Dawe,29-May-73,May-29-1973,5/29/73,5/29/73,1973,5,29,May
8459591,Sergei,Petrenko,10-Sep-68,Sep-10-1968,9/10/68,9/10/68,1968,9,10,Sep
8459139,Todd,Simon,21-Apr-72,Apr-21-1972,4/21/72,4/21/72,1972,4,21,Apr
8455478,Mark,Astley,30-Mar-69,Mar-30-1969,3/30/69,3/30/69,1969,3,30,Mar
8459460,Denis,Tsygurov,26-Feb-71,Feb-26-1971,2/26/71,2/26/71,1971,2,26,Feb
8458586,Peter,Ambroziak,15-Sep-71,Sep-15-1971,9/15/71,9/15/71,1971,9,15,Sep
8448038,Charlie,Huddy,2-Jun-59,Jun-2-1959,6/2/59,6/2/59,1959,6,2,Jun
8459016,Dean,Melanson,19-Nov-73,Nov-19-1973,11/19/73,11/19/73,1973,11,19,Nov
8451685,Robb,Stauber,25-Nov-67,Nov-25-1967,11/25/67,11/25/67,1967,11,25,Nov
8458883,Rob,Conn,3-Sep-68,Sep-3-1968,9/3/68,9/3/68,1968,9,3,Sep
8456695,Dane,Jackson,17-May-70,May-17-1970,5/17/70,5/17/70,1970,5,17,May
8459641,Barrie,Moore,22-May-75,May-22-1975,5/22/75,5/22/75,1975,5,22,May
8460579,Vaclav,Varada,26-Apr-76,Apr-26-1976,4/26/76,4/26/76,1976,4,26,Apr
8458800,Andrei,Trefilov,31-Aug-69,Aug-31-1969,8/31/69,8/31/69,1969,8,31,Aug
8460529,Jason,Holland,30-Apr-76,Apr-30-1976,4/30/76,4/30/76,1976,4,30,Apr
8460517,Rhett,Warrener,27-Jan-76,Jan-27-1976,1/27/76,1/27/76,1976,1,27,Jan
8467550,David,Moravec,24-Mar-73,Mar-24-1973,3/24/73,3/24/73,1973,3,24,Mar
8460239,Vladimir,Tsyplakov,18-Apr-69,Apr-18-1969,4/18/69,4/18/69,1969,4,18,Apr
8467354,Dmitri,Kalinin,22-Jul-80,Jul-22-1980,7/22/80,7/22/80,1980,7,22,Jul
8464957,J-P,Dumont,1-Apr-78,Apr-1-1978,4/1/78,4/1/78,1978,4,1,Apr
8466156,Mika,Noronen,17-Jun-79,Jun-17-1979,6/17/79,6/17/79,1979,6,17,Jun
8467502,Ales,Kotalik,23-Dec-78,Dec-23-1978,12/23/78,12/23/78,1978,12,23,Dec
8467908,Milan,Bartovic,9-Apr-81,Apr-9-1981,4/9/81,4/9/81,1981,4,9,Apr
8468700,Paul,Gaustad,3-Feb-82,Feb-3-1982,2/3/82,2/3/82,1982,2,3,Feb
8462077,Jochen,Hecht,21-Jun-77,Jun-21-1977,6/21/77,6/21/77,1977,6,21,Jun
8467376,Jaroslav,Kristek,16-Mar-80,Mar-16-1980,3/16/80,3/16/80,1980,3,16,Mar
8468738,Sean,McMorrow,19-Jan-82,Jan-19-1982,1/19/82,1/19/82,1982,1,19,Jan
8470239,Radoslav,Hecl,11-Oct-74,Oct-11-1974,10/11/74,10/11/74,1974,10,11,Oct
8468011,Ryan,Miller,17-Jul-80,Jul-17-1980,7/17/80,7/17/80,1980,7,17,Jul
8460562,Chris,Drury,20-Aug-76,Aug-20-1976,8/20/76,8/20/76,1976,8,20,Aug
8469506,Jason,Pominville,30-Nov-82,Nov-30-1982,11/30/82,11/30/82,1982,11,30,Nov
8469485,Derek,Roy,4-May-83,May-4-1983,5/4/83,5/4/83,1983,5,4,May
8460508,Brad,Brown,27-Dec-75,Dec-27-1975,12/27/75,12/27/75,1975,12,27,Dec
8469475,Jiri,Novotny,12-Aug-83,Aug-12-1983,8/12/83,8/12/83,1983,8,12,Aug
8465042,Toni,Lydman,25-Sep-77,Sep-25-1977,9/25/77,9/25/77,1977,9,25,Sep
8469509,Nathan,Paetsch,30-Mar-83,Mar-30-1983,3/30/83,3/30/83,1983,3,30,Mar
8471388,Patrick,Kaleta,8-Jun-86,Jun-8-1986,6/8/86,6/8/86,1986,6,8,Jun
8471419,Mark,Mancari,11-Jul-85,Jul-11-1985,7/11/85,7/11/85,1985,7,11,Jul
8467905,Michael,Ryan,16-May-80,May-16-1980,5/16/80,5/16/80,1980,5,16,May
8471452,Mike,Card,18-Feb-86,Feb-18-1986,2/18/86,2/18/86,1986,2,18,Feb
8471256,Michael,Funk,15-Aug-86,Aug-15-1986,8/15/86,8/15/86,1986,8,15,Aug
8471284,Andrej,Sekera,8-Jun-86,Jun-8-1986,6/8/86,6/8/86,1986,6,8,Jun
8467439,Jaroslav,Spacek,11-Feb-74,Feb-11-1974,2/11/74,2/11/74,1974,2,11,Feb
8473426,Mike,Weber,16-Dec-87,Dec-16-1987,12/16/87,12/16/87,1987,12,16,Dec
8471804,Nathan,Gerbe,24-Jul-87,Jul-24-1987,7/24/87,7/24/87,1987,7,24,Jul
8471761,Chris,Butler,27-Oct-86,Oct-27-1986,10/27/86,10/27/86,1986,10,27,Oct
8469591,Cody,McCormick,18-Apr-83,Apr-18-1983,4/18/83,4/18/83,1983,4,18,Apr
8474609,Luke,Adam,18-Jun-90,Jun-18-1990,6/18/90,6/18/90,1990,6,18,Jun
8474038,Paul,Byron,27-Apr-89,Apr-27-1989,4/27/89,4/27/89,1989,4,27,Apr
8475220,Marcus,Foligno,10-Aug-91,Aug-10-1991,8/10/91,8/10/91,1991,8,10,Aug
8474570,Cody,Hodgson,18-Feb-90,Feb-18-1990,2/18/90,2/18/90,1990,2,18,Feb
8475178,Zack,Kassian,24-Jan-91,Jan-24-1991,1/24/91,1/24/91,1991,1,24,Jan
8474130,Corey,Tropp,25-Jul-89,Jul-25-1989,7/25/89,7/25/89,1989,7,25,Jul
8475102,Travis,Turnbull,7-Jul-86,Jul-7-1986,7/7/86,7/7/86,1986,7,7,Jul
8474500,Derek,Whitmore,17-Dec-84,Dec-17-1984,12/17/84,12/17/84,1984,12,17,Dec
8471701,Joe,Finley,29-Jun-87,Jun-29-1987,6/29/87,6/29/87,1987,6,29,Jun
8475188,Brayden,McNabb,21-Jan-91,Jan-21-1991,1/21/91,1/21/91,1991,1,21,Jan
8467344,Robyn,Regehr,19-Apr-80,Apr-19-1980,4/19/80,4/19/80,1980,4,19,Apr
8470685,Alexander,Sulzer,30-May-84,May-30-1984,5/30/84,5/30/84,1984,5,30,May
8476808,Brian,Flynn,26-Jul-88,Jul-26-1988,7/26/88,7/26/88,1988,7,26,Jul
8476888,Mikhail,Grigorenko,16-May-94,May-16-1994,5/16/94,5/16/94,1994,5,16,May
8475796,Mark,Pysyk,11-Jan-92,Jan-11-1992,1/11/92,1/11/92,1992,1,11,Jan
8476878,Zemgus,Girgensons,5-Jan-94,Jan-5-1994,1/5/94,1/5/94,1994,1,5,Jan
8475728,Johan,Larsson,25-Jul-92,Jul-25-1992,7/25/92,7/25/92,1992,7,25,Jul
8470852,Matt,Moulson,1-Nov-83,Nov-1-1983,11/1/83,11/1/83,1983,11,1,Nov
8474059,Linus,Omark,5-Feb-87,Feb-5-1987,2/5/87,2/5/87,1987,2,5,Feb
8473571,Jamie,McBain,25-Feb-88,Feb-25-1988,2/25/88,2/25/88,1988,2,25,Feb
8477507,Nikita,Zadorov,16-Apr-95,Apr-16-1995,4/16/95,4/16/95,1995,4,16,Apr
8475252,Matt,Hackett,7-Mar-90,Mar-7-1990,3/7/90,3/7/90,1990,3,7,Mar
8475303,Connor,Knapp,1-May-90,May-1-1990,5/1/90,5/1/90,1990,5,1,May
8476319,Nathan,Lieuwen,8-Aug-91,Aug-8-1991,8/8/91,8/8/91,1991,8,8,Aug
8474610,Zac,Dalpe,1-Nov-89,Nov-1-1989,11/1/89,11/1/89,1989,11,1,Nov
8477933,Sam,Reinhart,6-Nov-95,Nov-6-1995,11/6/95,11/6/95,1995,11,6,Nov
8470378,Andre,Benoit,6-Jan-84,Jan-6-1984,1/6/84,1/6/84,1984,1,6,Jan
8470729,Tyson,Strachan,30-Oct-84,Oct-30-1984,10/30/84,10/30/84,1984,10,30,Oct
8477092,Andrey,Makarov,20-Apr-93,Apr-20-1993,4/20/93,4/20/93,1993,4,20,Apr
8476401,Daniel,Catenacci,9-Mar-93,Mar-9-1993,3/9/93,3/9/93,1993,3,9,Mar
8478403,Jack,Eichel,28-Oct-96,Oct-28-1996,10/28/96,10/28/96,1996,10,28,Oct
8477392,Hudson,Fasching,28-Jul-95,Jul-28-1995,7/28/95,7/28/95,1995,7,28,Jul
8476766,Cole,Schneider,26-Aug-90,Aug-26-1990,8/26/90,8/26/90,1990,8,26,Aug
8479268,Casey,Nelson,18-Jul-92,Jul-18-1992,7/18/92,7/18/92,1992,7,18,Jul
8476309,Jason,Kasdorf,18-May-92,May-18-1992,5/18/92,5/18/92,1992,5,18,May
8475215,Robin,Lehner,24-Jul-91,Jul-24-1991,7/24/91,7/24/91,1991,7,24,Jul
8477491,Nick,Baptiste,4-Aug-95,Aug-4-1995,8/4/95,8/4/95,1995,8,4,Aug
8477478,William,Carrier,20-Dec-94,Dec-20-1994,12/20/94,12/20/94,1994,12,20,Dec
8477391,Sean,Malone,30-Apr-95,Apr-30-1995,4/30/95,4/30/95,1995,4,30,Apr
8473449,Kyle,Okposo,16-Apr-88,Apr-16-1988,4/16/88,4/16/88,1988,4,16,Apr
8480083,C.J.,Smith,1-Dec-94,Dec-1-1994,12/1/94,12/1/94,1994,12,1,Dec
8477041,Brady,Austin,16-Jun-93,Jun-16-1993,6/16/93,6/16/93,1993,6,16,Jun
8475982,Erik,Burgdoerfer,11-Dec-88,Dec-11-1988,12/11/88,12/11/88,1988,12,11,Dec
8473992,Justin,Falk,11-Oct-88,Oct-11-1988,10/11/88,10/11/88,1988,10,11,Oct
8478425,Brendan,Guhle,29-Jul-97,Jul-29-1997,7/29/97,7/29/97,1997,7,29,Jul
8475195,Anders,Nilsson,19-Mar-90,Mar-19-1990,3/19/90,3/19/90,1990,3,19,Mar
8479999,Casey,Mittelstadt,22-Nov-98,Nov-22-1998,11/22/98,11/22/98,1998,11,22,Nov
8475325,Jordan,Nolan,23-Jun-89,Jun-23-1989,6/23/89,6/23/89,1989,6,23,Jun
8479755,Victor,Antipin,6-Dec-92,Dec-6-1992,12/6/92,12/6/92,1992,12,6,Dec
8474618,Marco,Scandella,23-Feb-90,Feb-23-1990,2/23/90,2/23/90,1990,2,23,Feb
8476330,Adam,Wilcox,26-Nov-92,Nov-26-1992,11/26/92,11/26/92,1992,11,26,Nov
8473534,Patrik,Berglund,2-Jun-88,Jun-2-1988,6/2/88,6/2/88,1988,6,2,Jun
8478109,Victor,Olofsson,18-Jul-95,Jul-18-1995,7/18/95,7/18/95,1995,7,18,Jul
8475784,Jeff,Skinner,16-May-92,May-16-1992,5/16/92,5/16/92,1992,5,16,May
8479420,Tage,Thompson,30-Oct-97,Oct-30-1997,10/30/97,10/30/97,1997,10,30,Oct
8478840,Will,Borgen,19-Dec-96,Dec-19-1996,12/19/96,12/19/96,1996,12,19,Dec
8480839,Rasmus,Dahlin,13-Apr-00,Apr-13-2000,4/13/00,4/13/00,2000,4,13,Apr
8477986,Brandon,Montour,11-Apr-94,Apr-11-1994,4/11/94,4/11/94,1994,4,11,Apr
8480935,Lawrence,Pilut,30-Dec-95,Dec-30-1995,12/30/95,12/30/95,1995,12,30,Dec
8475622,Carter,Hutton,19-Dec-85,Dec-19-1985,12/19/85,12/19/85,1985,12,19,Dec
8479335,Rasmus,Asplund,3-Dec-97,Dec-3-1997,12/3/97,12/3/97,1997,12,3,Dec
8475748,Dalton,Smith,30-Jun-92,Jun-30-1992,6/30/92,6/30/92,1992,6,30,Jun
8477337,John,Gilmour,17-May-93,May-17-1993,5/17/93,5/17/93,1993,5,17,May
8480035,Henri,Jokiharju,17-Jun-99,Jun-17-1999,6/17/99,6/17/99,1999,6,17,Jun
8481528,Dylan,Cozens,9-Feb-01,Feb-9-2001,2/9/01,2/9/01,2001,2,9,Feb
8479419,Brett,Murray,20-Jul-98,Jul-20-1998,7/20/98,7/20/98,1998,7,20,Jul
8476356,Tobias,Rieder,10-Jan-93,Jan-10-1993,1/10/93,1/10/93,1993,1,10,Jan
8481626,Arttu,Ruotsalainen,29-Oct-97,Oct-29-1997,10/29/97,10/29/97,1997,10,29,Oct
8470595,Eric,Staal,29-Oct-84,Oct-29-1984,10/29/84,10/29/84,1984,10,29,Oct
8480196,Jacob,Bryson,18-Nov-97,Nov-18-1997,11/18/97,11/18/97,1997,11,18,Nov
8480807,Mattias,Samuelsson,14-Mar-00,Mar-14-2000,3/14/00,3/14/00,2000,3,14,Mar
8475920,Michael,Houser,13-Sep-92,Sep-13-1992,9/13/92,9/13/92,1992,9,13,Sep
8480045,Ukko-Pekka,Luukkonen,9-Mar-99,Mar-9-1999,3/9/99,3/9/99,1999,3,9,Mar
8482061,Brandon,Biro,11-Mar-98,Mar-11-1998,3/11/98,3/11/98,1998,3,11,Mar
8476994,Vinnie,Hinostroza,3-Apr-94,Apr-3-1994,4/3/94,4/3/94,1994,4,3,Apr
8481522,Peyton,Krebs,26-Jan-01,Jan-26-2001,1/26/01,1/26/01,2001,1,26,Jan
8477974,Ryan,MacInnis,14-Feb-96,Feb-14-1996,2/14/96,2/14/96,1996,2,14,Feb
8482175,JJ,Peterka,14-Jan-02,Jan-14-2002,1/14/02,1/14/02,2002,1,14,Jan
8482097,Jack,Quinn,19-Sep-01,Sep-19-2001,9/19/01,9/19/01,2001,9,19,Sep
8477949,Alex,Tuch,10-May-96,May-10-1996,5/10/96,5/10/96,1996,5,10,May
8479578,Casey,Fitzgerald,25-Feb-97,Feb-25-1997,2/25/97,2/25/97,1997,2,25,Feb
8482671,Owen,Power,22-Nov-02,Nov-22-2002,11/22/02,11/22/02,2002,11,22,Nov
8479289,Ethan,Prow,17-Nov-92,Nov-17-1992,11/17/92,11/17/92,1992,11,17,Nov
8478846,Christian,Wolanin,17-Mar-95,Mar-17-1995,3/17/95,3/17/95,1995,3,17,Mar
8467950,Craig,Anderson,21-May-81,May-21-1981,5/21/81,5/21/81,1981,5,21,May
8478413,Jordan,Greenway,16-Feb-97,Feb-16-1997,2/16/97,2/16/97,1997,2,16,Feb
8479370,Tyson,Jost,14-Mar-98,Mar-14-1998,3/14/98,3/14/98,1998,3,14,Mar
8481751,Lukas,Rousek,20-Apr-99,Apr-20-1999,4/20/99,4/20/99,1999,4,20,Apr
8479348,Kale,Clague,5-Jun-98,Jun-5-1998,6/5/98,6/5/98,1998,6,5,Jun
8479602,Jeremy,Davies,4-Dec-96,Dec-4-1996,12/4/96,12/4/96,1996,12,4,Dec
8479388,Riley,Stillman,9-Mar-98,Mar-9-1998,3/9/98,3/9/98,1998,3,9,Mar
8482221,Devon,Levi,27-Dec-01,Dec-27-2001,12/27/01,12/27/01,2001,12,27,Dec
8484145,Zach,Benson,12-May-05,May-12-2005,5/12/05,5/12/05,2005,5,12,May
8480762,Eric,Robinson,14-Jun-95,Jun-14-1995,6/14/95,6/14/95,1995,6,14,Jun
8473446,Erik,Johnson,21-Mar-88,Mar-21-1988,3/21/88,3/21/88,1988,3,21,Mar
8481564,Ryan,Johnson,24-Jul-01,Jul-24-2001,7/24/01,7/24/01,2001,7,24,Jul
8459161,Steven,Halko,8-Mar-74,Mar-8-1974,3/8/74,3/8/74,1974,3,8,Mar
8456595,Sean,Hill,14-Feb-70,Feb-14-1970,2/14/70,2/14/70,1970,2,14,Feb
8460007,Michael,Rucinski,30-Mar-75,Mar-30-1975,3/30/75,3/30/75,1975,3,30,Mar
8458981,Mike,Fountain,26-Jan-72,Jan-26-1972,1/26/72,1/26/72,1972,1,26,Jan
8462197,Byron,Ritchie,24-Apr-77,Apr-24-1977,4/24/77,4/24/77,1977,4,24,Apr
8467418,Tommy,Vestlund,29-Dec-74,Dec-29-1974,12/29/74,12/29/74,1974,12,29,Dec
8460506,Eric,Fichaud,4-Nov-75,Nov-4-1975,11/4/75,11/4/75,1975,11,4,Nov
8467097,Greg,Koehler,27-Feb-75,Feb-27-1975,2/27/75,2/27/75,1975,2,27,Feb
8467416,Josef,Vasicek,12-Sep-80,Sep-12-1980,9/12/80,9/12/80,1980,9,12,Sep
8465184,Greg,Kuznik,12-Jun-78,Jun-12-1978,6/12/78,6/12/78,1978,6,12,Jun
8459451,Tyler,Moss,29-Jun-75,Jun-29-1975,6/29/75,6/29/75,1975,6,29,Jun
8467535,Jaroslav,Svoboda,1-Jun-80,Jun-1-1980,6/1/80,6/1/80,1980,6,1,Jun
8456547,Bret,Hedican,10-Aug-70,Aug-10-1970,8/10/70,8/10/70,1970,8,10,Aug
8466157,Nikos,Tselios,20-Jan-79,Jan-20-1979,1/20/79,1/20/79,1979,1,20,Jan
8468560,Ryan,Bayda,9-Dec-80,Dec-9-1980,12/9/80,12/9/80,1980,12,9,Dec
8466163,Brad,Defauw,10-Nov-77,Nov-10-1977,11/10/77,11/10/77,1977,11,10,Nov
8467337,Jeff,Heerema,17-Jan-80,Jan-17-1980,1/17/80,1/17/80,1980,1,17,Jan
8468512,Tomas,Kurka,14-Dec-81,Dec-14-1981,12/14/81,12/14/81,1981,12,14,Dec
8468047,Damian,Surma,22-Jan-81,Jan-22-1981,1/22/81,1/22/81,1981,1,22,Jan
8460523,Mike,Watt,31-Mar-76,Mar-31-1976,3/31/76,3/31/76,1976,3,31,Mar
8469515,Tomas,Malec,13-May-82,May-13-1982,5/13/82,5/13/82,1982,5,13,May
8467340,Patrick,Desrochers,27-Oct-79,Oct-27-1979,10/27/79,10/27/79,1979,10,27,Oct
8467922,Brett,Lysak,30-Dec-80,Dec-30-1980,12/30/80,12/30/80,1980,12,30,Dec
8465035,Joey,Tetarenko,3-Mar-78,Mar-3-1978,3/3/78,3/3/78,1978,3,3,Mar
8467957,Brad,Fast,21-Feb-80,Feb-21-1980,2/21/80,2/21/80,1980,2,21,Feb
8467469,Allan,Rourke,6-Mar-80,Mar-6-1980,3/6/80,3/6/80,1980,3,6,Mar
8460497,Jamie,Storr,28-Dec-75,Dec-28-1975,12/28/75,12/28/75,1975,12,28,Dec
8469779,Keith,Aucoin,6-Nov-78,Nov-6-1978,11/6/78,11/6/78,1978,11,6,Nov
8469132,David,Gove,4-May-78,May-4-1978,5/4/78,5/4/78,1978,5,4,May
8469812,Chad,LaRose,27-Mar-82,Mar-27-1982,3/27/82,3/27/82,1982,3,27,Mar
8458361,Doug,Weight,21-Jan-71,Jan-21-1971,1/21/71,1/21/71,1971,1,21,Jan
8470265,Anton,Babchuk,6-May-84,May-6-1984,5/6/84,5/6/84,1984,5,6,May
8470624,Danny,Richmond,1-Aug-84,Aug-1-1984,8/1/84,8/1/84,1984,8,1,Aug
8470320,Cam,Ward,29-Feb-84,Feb-29-1984,2/29/84,2/29/84,1984,2,29,Feb
8465189,Trevor,Letowski,5-Apr-77,Apr-5-1977,4/5/77,4/5/77,1977,4,5,Apr
8459547,Scott,Walker,19-Jul-73,Jul-19-1973,7/19/73,7/19/73,1973,7,19,Jul
8470101,Tim,Conboy,22-Mar-82,Mar-22-1982,3/22/82,3/22/82,1982,3,22,Mar
8470821,Joe,Jensen,6-Feb-83,Feb-6-1983,2/6/83,2/6/83,1983,2,6,Feb
8469522,Brandon,Nolan,18-Jul-83,Jul-18-1983,7/18/83,7/18/83,1983,7,18,Jul
8471282,Casey,Borer,28-Jul-85,Jul-28-1985,7/28/85,7/28/85,1985,7,28,Jul
8470208,Joey,Mormina,29-Jun-82,Jun-29-1982,6/29/82,6/29/82,1982,6,29,Jun
8470302,Patrick,Dwyer,22-Jun-83,Jun-22-1983,6/22/83,6/22/83,1983,6,22,Jun
8471477,Jakub,Petruzalek,24-Apr-85,Apr-24-1985,4/24/85,4/24/85,1985,4,24,Apr
8471321,Brett,Carson,29-Nov-85,Nov-29-1985,11/29/85,11/29/85,1985,11,29,Nov
8470988,Bryan,Rodney,22-Apr-84,Apr-22-1984,4/22/84,4/22/84,1984,4,22,Apr
8474137,Drayson,Bowman,8-Mar-89,Mar-8-1989,3/8/89,3/8/89,1989,3,8,Mar
8470064,Steven,Goertzen,26-May-84,May-26-1984,5/26/84,5/26/84,1984,5,26,May
8473496,Oskar,Osala,26-Dec-87,Dec-26-1987,12/26/87,12/26/87,1987,12,26,Dec
8474220,Jerome,Samson,4-Sep-87,Sep-4-1987,9/4/87,9/4/87,1987,9,4,Sep
8471251,Justin,Peters,30-Aug-86,Aug-30-1986,8/30/86,8/30/86,1986,8,30,Aug
8473444,Jon,Matsumoto,13-Oct-86,Oct-13-1986,10/13/86,10/13/86,1986,10,13,Oct
8470649,Patrick,O'Sullivan,1-Feb-85,Feb-1-1985,2/1/85,2/1/85,1985,2,1,Feb
8471840,Brett,Sutter,2-Jun-87,Jun-2-1987,6/2/87,6/2/87,1987,6,2,Jun
8467332,Bryan,Allen,21-Aug-80,Aug-21-1980,8/21/80,8/21/80,1980,8,21,Aug
8476819,Jeremy,Welsh,30-Apr-88,Apr-30-1988,4/30/88,4/30/88,1988,4,30,Apr
8475753,Justin,Faulk,20-Mar-92,Mar-20-1992,3/20/92,3/20/92,1992,3,20,Mar
8473610,Bobby,Sanguinetti,29-Feb-88,Feb-29-1988,2/29/88,2/29/88,1988,2,29,Feb
8474729,Mike,Murphy,15-Jan-89,Jan-15-1989,1/15/89,1/15/89,1989,1,15,Jan
8471853,Nicolas,Blanchard,31-May-87,May-31-1987,5/31/87,5/31/87,1987,5,31,May
8470120,Alexander,Semin,3-Mar-84,Mar-3-1984,3/3/84,3/3/84,1984,3,3,Mar
8474615,Jared,Staal,21-Aug-90,Aug-21-1990,8/21/90,8/21/90,1990,8,21,Aug
8474052,Chris,Terry,7-Apr-89,Apr-7-1989,4/7/89,4/7/89,1989,4,7,Apr
8473908,Kevin,Westgarth,7-Feb-84,Feb-7-1984,2/7/84,2/7/84,1984,2,7,Feb
8474135,Brett,Bellemore,25-Jun-88,Jun-25-1988,6/25/88,6/25/88,1988,6,25,Jun
8474661,Michal,Jordan,17-Jul-90,Jul-17-1990,7/17/90,7/17/90,1990,7,17,Jul
8477496,Elias,Lindholm,2-Dec-94,Dec-2-1994,12/2/94,12/2/94,1994,12,2,Dec
8474030,Aaron,Palushaj,7-Sep-89,Sep-7-1989,9/7/89,9/7/89,1989,9,7,Sep
8474089,Brad,Malone,20-May-89,May-20-1989,5/20/89,5/20/89,1989,5,20,May
8476437,Victor,Rask,1-Mar-93,Mar-1-1993,3/1/93,3/1/93,1993,3,1,Mar
8475826,Justin,Shugg,24-Dec-91,Dec-24-1991,12/24/91,12/24/91,1991,12,24,Dec
8475980,Brody,Sutter,26-Sep-91,Sep-26-1991,9/26/91,9/26/91,1991,9,26,Sep
8476944,Brendan,Woods,11-Jun-92,Jun-11-1992,6/11/92,6/11/92,1992,6,11,Jun
8475732,Danny,Biega,29-Sep-91,Sep-29-1991,9/29/91,9/29/91,1991,9,29,Sep
8474519,Jack,Hillen,24-Jan-86,Jan-24-1986,1/24/86,1/24/86,1986,1,24,Jan
8476397,Keegan,Lowe,29-Mar-93,Mar-29-1993,3/29/93,3/29/93,1993,3,29,Mar
8475294,Rasmus,Rissanen,13-Jul-91,Jul-13-1991,7/13/91,7/13/91,1991,7,13,Jul
8476858,Phillip,Di Giuseppe,9-Oct-93,Oct-9-1993,10/9/93,10/9/93,1993,10,9,Oct
8478585,Derek,Ryan,29-Dec-86,Dec-29-1986,12/29/86,12/29/86,1986,12,29,Dec
8477566,Sergey,Tolchinsky,3-Feb-95,Feb-3-1995,2/3/95,2/3/95,1995,2,3,Feb
8478396,Noah,Hanifin,25-Jan-97,Jan-25-1997,1/25/97,1/25/97,1997,1,25,Jan
8477488,Brett,Pesce,15-Nov-94,Nov-15-1994,11/15/94,11/15/94,1994,11,15,Nov
8476958,Jaccob,Slavin,1-May-94,May-1-1994,5/1/94,5/1/94,1994,5,1,May
8470222,James,Wisniewski,21-Feb-84,Feb-21-1984,2/21/84,2/21/84,1984,2,21,Feb
8478427,Sebastian,Aho,26-Jul-97,Jul-26-1997,7/26/97,7/26/97,1997,7,26,Jul
8471254,Bryan,Bickell,9-Mar-86,Mar-9-1986,3/9/86,3/9/86,1986,3,9,Mar
8479249,Andrew,Poturalski,14-Jan-94,Jan-14-1994,1/14/94,1/14/94,1994,1,14,Jan
8476427,Ty,Rattie,5-Feb-93,Feb-5-1993,2/5/93,2/5/93,1993,2,5,Feb
8476882,Teuvo,Teravainen,11-Sep-94,Sep-11-1994,9/11/94,9/11/94,1994,9,11,Sep
8478027,Lucas,Wallmark,5-Sep-95,Sep-5-1995,9/5/95,9/5/95,1995,9,5,Sep
8477458,Valentin,Zykov,15-May-95,May-15-1995,5/15/95,5/15/95,1995,5,15,May
8476403,Klas,Dahlbeck,6-Jul-91,Jul-6-1991,7/6/91,7/6/91,1991,7,6,Jul
8478562,Jakub,Nakladal,30-Dec-87,Dec-30-1987,12/30/87,12/30/87,1987,12,30,Dec
8479115,Jorge ,Alves,30-Jan-79,Jan-30-1979,1/30/79,1/30/79,1979,1,30,Jan
8477998,Warren,Foegele,1-Apr-96,Apr-1-1996,4/1/96,4/1/96,1996,4,1,Apr
8475323,Marcus,Kruger,27-May-90,May-27-1990,5/27/90,5/27/90,1990,5,27,May
8480039,Martin,Necas,15-Jan-99,Jan-15-1999,1/15/99,1/15/99,1999,1,15,Jan
8478462,Nicolas,Roy,5-Feb-97,Feb-5-1997,2/5/97,2/5/97,1997,2,5,Feb
8477981,Roland,McKeown,20-Jan-96,Jan-20-1996,1/20/96,1/20/96,1996,1,20,Jan
8477845,Trevor,van Riemsdyk,24-Jul-91,Jul-24-1991,7/24/91,7/24/91,1991,7,24,Jul
8474152,Scott,Darling,22-Dec-88,Dec-22-1988,12/22/88,12/22/88,1988,12,22,Dec
8478056,Clark,Bishop,29-Mar-96,Mar-29-1996,3/29/96,3/29/96,1996,3,29,Mar
8475907,Micheal,Ferland,20-Apr-92,Apr-20-1992,4/20/92,4/20/92,1992,4,20,Apr
8476921,Jordan,Martinook,25-Jul-92,Jul-25-1992,7/25/92,7/25/92,1992,7,25,Jul
8478839,Aleksi,Saarela,7-Jan-97,Jan-7-1997,1/7/97,1/7/97,1997,1,7,Jan
8480830,Andrei,Svechnikov,26-Mar-00,Mar-26-2000,3/26/00,3/26/00,2000,3,26,Mar
8479402,Jake,Bean,9-Jun-98,Jun-9-1998,6/9/98,6/9/98,1998,6,9,Jun
8479328,Julien,Gauthier,15-Oct-97,Oct-15-1997,10/15/97,10/15/97,1997,10,15,Oct
8480185,Eetu,Luostarinen,2-Sep-98,Sep-2-1998,9/2/98,9/2/98,1998,9,2,Sep
8476389,Vincent,Trocheck,11-Jul-93,Jul-11-1993,7/11/93,7/11/93,1993,7,11,Jul
8476441,Joel,Edmundson,28-Jun-93,Jun-28-1993,6/28/93,6/28/93,1993,6,28,Jun
8476869,Brady,Skjei,26-Mar-94,Mar-26-1994,3/26/94,3/26/94,1994,3,26,Mar
8479188,David ,Ayres,12-Aug-77,Aug-12-1977,8/12/77,8/12/77,1977,8,12,Aug
8476341,Anton,Forsberg,27-Nov-92,Nov-27-1992,11/27/92,11/27/92,1992,11,27,Nov
8475855,Jesper,Fast,2-Dec-91,Dec-2-1991,12/2/91,12/2/91,1991,12,2,Dec
8476323,Max,McCormick,1-May-92,May-1-1992,5/1/92,5/1/92,1992,5,1,May
8480776,Sheldon,Rempal,7-Aug-95,Aug-7-1995,8/7/95,8/7/95,1995,8,7,Aug
8475213,Drew,Shore,29-Jan-91,Jan-29-1991,1/29/91,1/29/91,1991,1,29,Jan
8475825,Jani,Hakanp,31-Mar-92,Mar-31-1992,3/31/92,3/31/92,1992,3,31,Mar
8480466,Joey ,Keane,2-Jul-99,Jul-2-1999,7/2/99,7/2/99,1999,7,2,Jul
8479320,Max,Lajoie,5-Nov-97,Nov-5-1997,11/5/97,11/5/97,1997,11,5,Nov
8480835,Jack,Drury,3-Feb-00,Feb-3-2000,2/3/00,2/3/00,2000,2,3,Feb
8482093,Seth,Jarvis,1-Feb-02,Feb-1-2002,2/1/02,2/1/02,2002,2,1,Feb
8480829,Jesperi,Kotkaniemi,6-Jul-00,Jul-6-2000,7/6/00,7/6/00,2000,7,6,Jul
8474613,Derek,Stepan,18-Jun-90,Jun-18-1990,6/18/90,6/18/90,1990,6,18,Jun
8478451,Ethan,Bear,26-Jun-97,Jun-26-1997,6/26/97,6/26/97,1997,6,26,Jun
8478970,Jalen,Chatfield,15-May-96,May-15-1996,5/15/96,5/15/96,1996,5,15,May
8481611,Pyotr,Kochetkov,25-Jun-99,Jun-25-1999,6/25/99,6/25/99,1999,6,25,Jun
8479581,Jack,LaFontaine,6-Jan-98,Jan-6-1998,1/6/98,1/6/98,1998,1,6,Jan
8477293,Antti,Raanta,12-May-89,May-12-1989,5/12/89,5/12/89,1989,5,12,May
8476907,Mackenzie,MacEachern,9-Mar-94,Mar-9-1994,3/9/94,3/9/94,1994,3,9,Mar
8474157,Max,Pacioretty,20-Nov-88,Nov-20-1988,11/20/88,11/20/88,1988,11,20,Nov
8479344,Jesse,Puljujarvi,7-May-98,May-7-1998,5/7/98,5/7/98,1998,5,7,May
8479639,Dylan,Coghlan,19-Feb-98,Feb-19-1998,2/19/98,2/19/98,1998,2,19,Feb
8470719,Alexandre,Bolduc,26-Jun-85,Jun-26-1985,6/26/85,6/26/85,1985,6,26,Jun
8471231,Kyle,Chipchura,19-Feb-86,Feb-19-1986,2/19/86,2/19/86,1986,2,19,Feb
8468064,Martin,Erat,29-Aug-81,Aug-29-1981,8/29/81,8/29/81,1981,8,29,Aug
8477715,Tyler,Gaudet,4-Apr-93,Apr-4-1993,4/4/93,4/4/93,1993,4,4,Apr
8471691,Martin,Hanzal,20-Feb-87,Feb-20-1987,2/20/87,2/20/87,1987,2,20,Feb
8474793,Justin,Hodgman,27-Jun-88,Jun-27-1988,6/27/88,6/27/88,1988,6,27,Jun
8471232,Lauri,Korpikoski,28-Jul-86,Jul-28-1986,7/28/86,7/28/86,1986,7,28,Jul
8476451,Lucas,Lessio,23-Jan-93,Jan-23-1993,1/23/93,1/23/93,1993,1,23,Jan
8474646,Brandon,McMillan,22-Mar-90,Mar-22-1990,3/22/90,3/22/90,1990,3,22,Mar
8469664,David,Moss,28-Dec-81,Dec-28-1981,12/28/81,12/28/81,1981,12,28,Dec
8476868,Henrik,Samuelsson,7-Feb-94,Feb-7-1994,2/7/94,2/7/94,1994,2,7,Feb
8475996,Brendan,Shinnimin,7-Jan-91,Jan-7-1991,1/7/91,1/7/91,1991,1,7,Jan
8468535,Antoine,Vermette,20-Jul-82,Jul-20-1982,7/20/82,7/20/82,1982,7,20,Jul
8475171,Oliver,Ekman-Larsson,17-Jul-91,Jul-17-1991,7/17/91,7/17/91,1991,7,17,Jul
8475759,Brandon,Gormley,18-Feb-92,Feb-18-1992,2/18/92,2/18/92,1992,2,18,Feb
8476473,Connor,Murphy,26-Mar-93,Mar-26-1993,3/26/93,3/26/93,1993,3,26,Mar
8474628,Michael,Stone,7-Jun-90,Jun-7-1990,6/7/90,6/7/90,1990,6,7,Jun
8473589,Chris,Summers,5-Feb-88,Feb-5-1988,2/5/88,2/5/88,1988,2,5,Feb
8477460,Laurent,Dauphin,27-Mar-95,Mar-27-1995,3/27/95,3/27/95,1995,3,27,Mar
8470755,Brad,Richardson,4-Feb-85,Feb-4-1985,2/4/85,2/4/85,1985,2,4,Feb
8478137,Jiri,Sekac,10-Jun-92,Jun-10-1992,6/10/92,6/10/92,1992,6,10,Jun
8474554,Eric,Selleck,20-Oct-87,Oct-20-1987,10/20/87,10/20/87,1987,10,20,Oct
8475749,Christian,Thomas,26-May-92,May-26-1992,5/26/92,5/26/92,1992,5,26,May
8474588,Viktor,Tikhonov,12-May-88,May-12-1988,5/12/88,5/12/88,1988,5,12,May
8475206,Stefan,Elliott,30-Jan-91,Jan-30-1991,1/30/91,1/30/91,1991,1,30,Jan
8474005,Alex,Grant,20-Jan-89,Jan-20-1989,1/20/89,1/20/89,1989,1,20,Jan
8478999,Niklas ,Treutle,29-Apr-91,Apr-29-1991,4/29/91,4/29/91,1991,4,29,Apr
8478474,Lawson,Crouse,23-Jun-97,Jun-23-1997,6/23/97,6/23/97,1997,6,23,Jun
8477989,Christian,Dvorak,2-Feb-96,Feb-2-1996,2/2/96,2/2/96,1996,2,2,Feb
8479343,Clayton,Keller,29-Jul-98,Jul-29-1998,7/29/98,7/29/98,1998,7,29,Jul
8478440,Dylan,Strome,7-Mar-97,Mar-7-1997,3/7/97,3/7/97,1997,3,7,Mar
8479345,Jakob,Chychrun,31-Mar-98,Mar-31-1998,3/31/98,3/31/98,1998,3,31,Mar
8476986,Marek,Langhamer,22-Jul-94,Jul-22-1994,7/22/94,7/22/94,1994,7,22,Jul
8474131,Mario,Kempe,19-Sep-88,Sep-19-1988,9/19/88,9/19/88,1988,9,19,Sep
8477810,Joel,Hanley,8-Jun-91,Jun-8-1991,6/8/91,6/8/91,1991,6,8,Jun
8471769,Niklas,Hjalmarsson,6-Jun-87,Jun-6-1987,6/6/87,6/6/87,1987,6,6,Jun
8477634,Trevor,Murphy,17-Jul-95,Jul-17-1995,7/17/95,7/17/95,1995,7,17,Jul
8475311,Darcy,Kuemper,5-May-90,May-5-1990,5/5/90,5/5/90,1990,5,5,May
8478856,Conor,Garland,11-Mar-96,Mar-11-1996,3/11/96,3/11/96,1996,3,11,Mar
8477951,Nick,Schmaltz,23-Feb-96,Feb-23-1996,2/23/96,2/23/96,1996,2,23,Feb
8480112,Hunter,Miska,7-Jul-95,Jul-7-1995,7/7/95,7/7/95,1995,7,7,Jul
8475808,Michael,Chaput,9-Apr-92,Apr-9-1992,4/9/92,4/9/92,1992,4,9,Apr
8480849,Barrett,Hayton,9-Jun-00,Jun-9-2000,6/9/00,6/9/00,2000,6,9,Jun
8480913,Jordan,Gross,9-May-95,May-9-1995,5/9/95,5/9/95,1995,5,9,May
8474604,Aaron,Ness,18-May-90,May-18-1990,5/18/90,5/18/90,1990,5,18,May
8480890,Jan,Jenik,15-Sep-00,Sep-15-2000,9/15/00,9/15/00,2000,9,15,Sep
8481599,Victor,Soderstrom,26-Feb-01,Feb-26-2001,2/26/01,2/26/01,2001,2,26,Feb
8481031,Ivan,Prosvetov,5-Mar-99,Mar-5-1999,3/5/99,3/5/99,1999,3,5,Mar
8474291,Jay,Beagle,16-Oct-85,Oct-16-1985,10/16/85,10/16/85,1985,10,16,Oct
8479619,Michael,Carcone,19-May-96,May-19-1996,5/19/96,5/19/96,1996,5,19,May
8478147,Bokondji,Imama,3-Aug-96,Aug-3-1996,8/3/96,8/3/96,1996,8,3,Aug
8476436,Dmitrij,Jaskin,23-Mar-93,Mar-23-1993,3/23/93,3/23/93,1993,3,23,Mar
8481711,Matias,Maccelli,14-Oct-00,Oct-14-2000,10/14/00,10/14/00,2000,10,14,Oct
8480855,Jack,McBain,6-Jan-00,Jan-6-2000,1/6/00,1/6/00,2000,1,6,Jan
8481827,Ben,McCartney,13-Jul-01,Jul-13-2001,7/13/01,7/13/01,2001,7,13,Jul
8477070,Liam,O'Brien,29-Jul-94,Jul-29-1994,7/29/94,7/29/94,1994,7,29,Jul
8474849,Antoine,Roussel,21-Nov-89,Nov-21-1989,11/21/89,11/21/89,1989,11,21,Nov
8480979,Nathan,Smith,19-Oct-98,Oct-19-1998,10/19/98,10/19/98,1998,10,19,Oct
8479341,Cam,Dineen,19-Jun-98,Jun-19-1998,6/19/98,6/19/98,1998,6,19,Jun
8481609,Vladislav,Kolyachonok,26-May-01,May-26-2001,5/26/01,5/26/01,2001,5,26,May
8478062,Dysin,Mayo,17-Aug-96,Aug-17-1996,8/17/96,8/17/96,1996,8,17,Aug
8482655,J.J.,Moser,6-Jun-00,Jun-6-2000,6/6/00,6/6/00,2000,6,6,Jun
8474667,Harri,Sateri,29-Dec-89,Dec-29-1989,12/29/89,12/29/89,1989,12,29,Dec
8478872,Karel,Vejmelka,25-May-96,May-25-1996,5/25/96,5/25/96,1996,5,25,May
8482699,Dylan,Guenther,10-Apr-03,Apr-10-2003,4/10/03,4/10/03,2003,4,10,Apr
8483597,Milos,Kelemen,6-Jul-99,Jul-6-1999,7/6/99,7/6/99,1999,7,6,Jul
8480891,Michael,Kesselring,13-Jan-00,Jan-13-2000,1/13/00,1/13/00,2000,1,13,Jan
8482067,Connor,Mackey,12-Sep-96,Sep-12-1996,9/12/96,9/12/96,1996,9,12,Sep
8479976,Juuso,Valimaki,6-Oct-98,Oct-6-1998,10/6/98,10/6/98,1998,10,6,Oct
8478971,Connor,Ingram,31-Mar-97,Mar-31-1997,3/31/97,3/31/97,1997,3,31,Mar
8483431,Logan,Cooley,4-May-04,May-4-2004,5/4/04,5/4/04,2004,5,4,May
8477993,Justin,Kirkland,2-Aug-96,Aug-2-1996,8/2/96,8/2/96,1996,8,2,Aug
8476856,Matt,Dumba,25-Jul-94,Jul-25-1994,7/25/94,7/25/94,1994,7,25,Jul
8480434,Sean,Durzi,21-Oct-98,Oct-21-1998,10/21/98,10/21/98,1998,10,21,Oct
8446266,Denis,Cyr,4-Feb-61,Feb-4-1961,2/4/61,2/4/61,1961,2,4,Feb
8447843,Dave,Hindmarch,15-Oct-58,Oct-15-1958,10/15/58,10/15/58,1958,10,15,Oct
8449457,Alex,McKendry,21-Nov-56,Nov-21-1956,11/21/56,11/21/56,1956,11,21,Nov
8449569,Greg,Meredith,23-Feb-58,Feb-23-1958,2/23/58,2/23/58,1958,2,23,Feb
8450303,Jim,Peplinski,24-Oct-60,Oct-24-1960,10/24/60,10/24/60,1960,10,24,Oct
8452466,Bert,Wilson,17-Oct-49,Oct-17-1949,10/17/49,10/17/49,1949,10,17,Oct
8446265,Tony,Curtale,29-Jan-62,Jan-29-1962,1/29/62,1/29/62,1962,1,29,Jan
8445395,Eddy,Beers,12-Oct-59,Oct-12-1959,10/12/59,10/12/59,1959,10,12,Oct
8446677,Kari,Eloranta,29-Feb-56,Feb-29-1956,2/29/56,2/29/56,1956,2,29,Feb
8448960,Al,Macinnis,11-Jul-63,Jul-11-1963,7/11/63,7/11/63,1963,7,11,Jul
8451993,Randy,Turnbull,7-Feb-62,Feb-7-1962,2/7/62,2/7/62,1962,2,7,Feb
8447498,Gord,Hampson,13-Feb-59,Feb-13-1959,2/13/59,2/13/59,1959,2,13,Feb
8447571,Tim,Harrer,10-May-57,May-10-1957,5/10/57,5/10/57,1957,5,10,May
8448203,Kari,Jalonen,6-Jan-60,Jan-6-1960,1/6/60,1/6/60,1960,1,6,Jan
8450852,Pierre,Rioux,1-Feb-62,Feb-1-1962,2/1/62,2/1/62,1962,2,1,Feb
8450845,Doug,Risebrough,29-Jan-54,Jan-29-1954,1/29/54,1/29/54,1954,1,29,Jan
8452254,Howard,Walker,8-May-58,May-8-1958,5/8/58,5/8/58,1958,5,8,May
8448555,Richard,Kromm,29-Mar-64,Mar-29-1964,3/29/64,3/29/64,1964,3,29,Mar
8448848,Hakan,Loob,3-Jul-60,Jul-3-1960,7/3/60,7/3/60,1960,7,3,Jul
8451735,Tony,Stiles,12-Aug-59,Aug-12-1959,8/12/59,8/12/59,1959,8,12,Aug
8447554,Keith,Hanson,26-Apr-57,Apr-26-1957,4/26/57,4/26/57,1957,4,26,Apr
8445277,Robin,Bartel,16-May-61,May-16-1961,5/16/61,5/16/61,1961,5,16,May
8452496,Rik,Wilson,17-Jun-62,Jun-17-1962,6/17/62,6/17/62,1962,6,17,Jun
8447437,Kevan,Guy,16-Jul-65,Jul-16-1965,7/16/65,7/16/65,1965,7,16,Jul
8446294,Doug,Dadswell,7-Feb-64,Feb-7-1964,2/7/64,2/7/64,1964,2,7,Feb
8445752,Randy,Bucyk,9-Nov-62,Nov-9-1962,11/9/62,11/9/62,1962,11,9,Nov
8446847,Theo,Fleury,29-Jun-68,Jun-29-1968,6/29/68,6/29/68,1968,6,29,Jun
8450547,Sergei,Priakin,7-Dec-63,Dec-7-1963,12/7/63,12/7/63,1963,12,7,Dec
8450792,David,Reierson,30-Aug-64,Aug-30-1964,8/30/64,8/30/64,1964,8,30,Aug
8451097,Ken,Sabourin,28-Apr-66,Apr-28-1966,4/28/66,4/28/66,1966,4,28,Apr
8445436,Jonas,Bergqvist,26-Sep-62,Sep-26-1962,9/26/62,9/26/62,1962,9,26,Sep
8448292,Roger,Johansson,17-Apr-67,Apr-17-1967,4/17/67,4/17/67,1967,4,17,Apr
8456288,Thomas,Forslund,24-Nov-68,Nov-24-1968,11/24/68,11/24/68,1968,11,24,Nov
8457574,Darryl,Olsen,7-Oct-66,Oct-7-1966,10/7/66,10/7/66,1966,10,7,Oct
8452556,Trent,Yawney,29-Sep-65,Sep-29-1965,9/29/65,9/29/65,1965,9,29,Sep
8457996,Warren,Sharples,1-Mar-68,Mar-1-1968,3/1/68,3/1/68,1968,3,1,Mar
8456544,Shawn,Heaphy,27-Nov-68,Nov-27-1968,11/27/68,11/27/68,1968,11,27,Nov
8451427,Brian,Skrudland,31-Jul-63,Jul-31-1963,7/31/63,7/31/63,1963,7,31,Jul
8447450,David,Haas,23-Jul-68,Jul-23-1968,7/23/68,7/23/68,1968,7,23,Jul
8458707,David,Struch,11-Feb-71,Feb-11-1971,2/11/71,2/11/71,1971,2,11,Feb
8458314,Vesa,Viitakoski,13-Feb-71,Feb-13-1971,2/13/71,2/13/71,1971,2,13,Feb
8457955,Brad,Schlegel,22-Jul-68,Jul-22-1968,7/22/68,7/22/68,1968,7,22,Jul
8458456,Kevin,Wortman,22-Feb-69,Feb-22-1969,2/22/69,2/22/69,1969,2,22,Feb
8456170,Neil,Eisenhut,9-Feb-67,Feb-9-1967,2/9/67,2/9/67,1967,2,9,Feb
8457436,Scott,Morrow,18-Jun-69,Jun-18-1969,6/18/69,6/18/69,1969,6,18,Jun
8459466,Jamie,Allison,13-May-75,May-13-1975,5/13/75,5/13/75,1975,5,13,May
8456235,Craig,Ferguson,8-Apr-70,Apr-8-1970,4/8/70,4/8/70,1970,4,8,Apr
8458533,Niklas,Sundblad,3-Jan-73,Jan-3-1973,1/3/73,1/3/73,1973,1,3,Jan
8460782,Todd,Simpson,28-May-73,May-28-1973,5/28/73,5/28/73,1973,5,28,May
8458751,Marko,Jantunen,14-Feb-71,Feb-14-1971,2/14/71,2/14/71,1971,2,14,Feb
8459295,Dale,Mctavish,28-Feb-72,Feb-28-1972,2/28/72,2/28/72,1972,2,28,Feb
8458966,Chris,O'Sullivan,15-May-74,May-15-1974,5/15/74,5/15/74,1974,5,15,May
8455445,Erik,Andersson,19-Aug-71,Aug-19-1971,8/19/71,8/19/71,1971,8,19,Aug
8464993,Travis,Brigley,16-Jun-77,Jun-16-1977,6/16/77,6/16/77,1977,6,16,Jun
8458969,Valeri,Bure,13-Jun-74,Jun-13-1974,6/13/74,6/13/74,1974,6,13,Jun
8463019,Eric,Landry,20-Jan-75,Jan-20-1975,1/20/75,1/20/75,1975,1,20,Jan
8465977,Sergei,Varlamov,21-Jul-78,Jul-21-1978,7/21/78,7/21/78,1978,7,21,Jul
8462099,Rocky,Thompson,8-Aug-77,Aug-8-1977,8/8/77,8/8/77,1977,8,8,Aug
8456121,Steve,Dubinsky,9-Jul-70,Jul-9-1970,7/9/70,7/9/70,1970,7,9,Jul
8459318,Greg,Pankewicz,6-Nov-70,Nov-6-1970,11/6/70,11/6/70,1970,11,6,Nov
8458972,Jeff,Shantz,10-Oct-73,Oct-10-1973,10/10/73,10/10/73,1973,10,10,Oct
8451558,Steve,Smith,30-Apr-63,Apr-30-1963,4/30/63,4/30/63,1963,4,30,Apr
8459456,Lee,Sorochan,9-Sep-75,Sep-9-1975,9/9/75,9/9/75,1975,9,9,Sep
8459252,Fred,Brathwaite,24-Nov-72,Nov-24-1972,11/24/72,11/24/72,1972,11,24,Nov
8465036,Tyrone,Garner,27-Jul-78,Jul-27-1978,7/27/78,7/27/78,1978,7,27,Jul
8460567,Chris,Clark,8-Mar-76,Mar-8-1976,3/8/76,3/8/76,1976,3,8,Mar
8462135,Benoit,Gratton,28-Dec-76,Dec-28-1976,12/28/76,12/28/76,1976,12,28,Dec
8458949,Sergei,Krivokrasov,15-Apr-74,Apr-15-1974,4/15/74,4/15/74,1974,4,15,Apr
8467884,Oleg,Saprykin,12-Feb-81,Feb-12-1981,2/12/81,2/12/81,1981,2,12,Feb
8467319,Darrel,Scoville,13-Oct-75,Oct-13-1975,10/13/75,10/13/75,1975,10,13,Oct
8455919,Craig,Conroy,4-Sep-71,Sep-4-1971,9/4/71,9/4/71,1971,9,4,Sep
8466143,Daniel,Tkaczuk,10-Jun-79,Jun-10-1979,6/10/79,6/10/79,1979,6,10,Jun
8458585,Igor,Kravchuk,13-Sep-66,Sep-13-1966,9/13/66,9/13/66,1966,9,13,Sep
8465066,Ryan,Christie,3-Jul-78,Jul-3-1978,7/3/78,7/3/78,1978,7,3,Jul
8468656,Jukka,Hentunen,3-May-74,May-3-1974,5/3/74,5/3/74,1974,5,3,May
8466971,Blake,Sloan,27-Jul-75,Jul-27-1975,7/27/75,7/27/75,1975,7,27,Jul
8459624,Alan,Letang,4-Sep-75,Sep-4-1975,9/4/75,9/4/75,1975,9,4,Sep
8458266,Roman,Turek,21-May-70,May-21-1970,5/21/70,5/21/70,1970,5,21,May
8459559,Rick,Mrozik,2-Jan-75,Jan-2-1975,1/2/75,1/2/75,1975,1,2,Jan
8458562,Jamie,McLennan,30-Jun-71,Jun-30-1971,6/30/71,6/30/71,1971,6,30,Jun
8464984,Josh,Green,16-Nov-77,Nov-16-1977,11/16/77,11/16/77,1977,11,16,Nov
8462149,Jason,Morgan,9-Oct-76,Oct-9-1976,10/9/76,10/9/76,1976,10,9,Oct
8465253,Marcus,Nilson,1-Mar-78,Mar-1-1978,3/1/78,3/1/78,1978,3,1,Mar
8468432,Steve,Reinprecht,7-May-76,May-7-1976,5/7/76,5/7/76,1976,5,7,May
8468853,Brennan,Evans,6-Jan-82,Jan-6-1982,1/6/82,1/6/82,1982,1,6,Jan
8470336,Carsen,Germyn,22-Feb-82,Feb-22-1982,2/22/82,2/22/82,1982,2,22,Feb
8466181,Kristian,Huselius,10-Nov-78,Nov-10-1978,11/10/78,11/10/78,1978,11,10,Nov
8462084,Mike,Leclerc,10-Nov-76,Nov-10-1976,11/10/76,11/10/76,1976,11,10,Nov
8470180,Eric,Nystrom,14-Feb-83,Feb-14-1983,2/14/83,2/14/83,1983,2,14,Feb
8470346,Richie,Regehr,17-Jan-83,Jan-17-1983,1/17/83,1/17/83,1983,1,17,Jan
8471310,Dustin,Boyd,16-Jul-86,Jul-16-1986,7/16/86,7/16/86,1986,7,16,Jul
8469557,Tomi,Maki,19-Aug-83,Aug-19-1983,8/19/83,8/19/83,1983,8,19,Aug
8471283,Brandon,Prust,16-Mar-84,Mar-16-1984,3/16/84,3/16/84,1984,3,16,Mar
8466146,Brad,Ference,2-Apr-79,Apr-2-1979,4/2/79,4/2/79,1979,4,2,Apr
8470632,Tim,Ramholt,2-Nov-84,Nov-2-1984,11/2/84,11/2/84,1984,11,2,Nov
8471819,Matt,Keetley,27-Apr-86,Apr-27-1986,4/27/86,4/27/86,1986,4,27,Apr
8474150,Mikael,Backlund,17-Mar-89,Mar-17-1989,3/17/89,3/17/89,1989,3,17,Mar
8471504,Rene,Bourque,10-Dec-81,Dec-10-1981,12/10/81,12/10/81,1981,12,10,Dec
8471237,Kris,Chucko,13-Mar-86,Mar-13-1986,3/13/86,3/13/86,1986,3,13,Mar
8471185,Curtis,Glencross,28-Dec-82,Dec-28-1982,12/28/82,12/28/82,1982,12,28,Dec
8468887,Warren,Peters,10-Jul-82,Jul-10-1982,7/10/82,7/10/82,1982,7,10,Jul
8470189,David,Van Der Gulik,20-Apr-83,Apr-20-1983,4/20/83,4/20/83,1983,4,20,Apr
8474076,John,Negrin,25-Mar-89,Mar-25-1989,3/25/89,3/25/89,1989,3,25,Mar
8470274,Chris,Higgins,2-Jun-83,Jun-2-1983,6/2/83,6/2/83,1983,6,2,Jun
8467977,Brian,McGrattan,2-Sep-81,Sep-2-1981,9/2/81,9/2/81,1981,9,2,Sep
8470151,Jay,Bouwmeester,27-Sep-83,Sep-27-1983,9/27/83,9/27/83,1983,9,27,Sep
8474642,Lance,Bouma,25-Mar-90,Mar-25-1990,3/25/90,3/25/90,1990,3,25,Mar
8469120,Raitis,Ivanans,3-Jan-79,Jan-3-1979,1/3/79,1/3/79,1979,1,3,Jan
8469490,Tim,Jackman,14-Nov-81,Nov-14-1981,11/14/81,11/14/81,1981,11,14,Nov
8470648,Stefan,Meyer,20-Jul-85,Jul-20-1985,7/20/85,7/20/85,1985,7,20,Jul
8474587,Greg,Nemisz,5-Jun-90,Jun-5-1990,6/5/90,6/5/90,1990,6,5,Jun
8475431,Henrik,Karlsson,27-Nov-83,Nov-27-1983,11/27/83,11/27/83,1983,11,27,Nov
8474049,Akim,Aliu,24-Apr-89,Apr-24-1989,4/24/89,4/24/89,1989,4,24,Apr
8476466,Sven,Baertschi,5-Oct-92,Oct-5-1992,10/5/92,10/5/92,1992,10,5,Oct
8470708,Guillaume,Desbiens,20-Apr-85,Apr-20-1985,4/20/85,4/20/85,1985,4,20,Apr
8475264,Roman,Horak,21-May-91,May-21-1991,5/21/91,5/21/91,1991,5,21,May
8468499,Krys,Kolanos,27-Jul-81,Jul-27-1981,7/27/81,7/27/81,1981,7,27,Jul
8473921,Joe,Piskula,5-Jul-84,Jul-5-1984,7/5/84,7/5/84,1984,7,5,Jul
8473953,Derek,Smith,13-Oct-84,Oct-13-1984,10/13/84,10/13/84,1984,10,13,Oct
8473414,Leland,Irving,11-Apr-88,Apr-11-1988,4/11/88,4/11/88,1988,4,11,Apr
8474844,Carter,Bancks,9-Aug-89,Aug-9-1989,8/9/89,8/9/89,1989,8,9,Aug
8476834,Roman,Cervenka,10-Dec-85,Dec-10-1985,12/10/85,12/10/85,1985,12,10,Dec
8475196,Ben,Hanowski,18-Oct-90,Oct-18-1990,10/18/90,10/18/90,1990,10,18,Oct
8475733,Max,Reinhart,4-Feb-92,Feb-4-1992,2/4/92,2/4/92,1992,2,4,Feb
8474837,Mark,Cundari,23-Apr-90,Apr-23-1990,4/23/90,4/23/90,1990,4,23,Apr
8471433,Daniel,Taylor,28-Apr-86,Apr-28-1986,4/28/86,4/28/86,1986,4,28,Apr
8475833,Bill,Arnold,13-May-92,May-13-1992,5/13/92,5/13/92,1992,5,13,May
8476346,Johnny,Gaudreau,13-Aug-93,Aug-13-1993,8/13/93,8/13/93,1993,8,13,Aug
8476440,Markus,Granlund,16-Apr-93,Apr-16-1993,4/16/93,4/16/93,1993,4,16,Apr
8470877,David,Jones,10-Aug-84,Aug-10-1984,8/10/84,8/10/84,1984,8,10,Aug
8477497,Sean,Monahan,12-Oct-94,Oct-12-1994,10/12/94,10/12/94,1994,10,12,Oct
8477847,Bryce,Van Brabant,12-Nov-91,Nov-12-1991,11/12/91,11/12/91,1991,11,12,Nov
8476827,Chad,Billins,26-May-89,May-26-1989,5/26/89,5/26/89,1989,5,26,May
8475648,Chris,Breen,29-Jun-89,Jun-29-1989,6/29/89,6/29/89,1989,6,29,Jun
8471729,Kris,Russell,2-May-87,May-2-1987,5/2/87,5/2/87,1987,5,2,May
8471222,Ladislav,Smid,1-Feb-86,Feb-1-1986,2/1/86,2/1/86,1986,2,1,Feb
8476452,Tyler,Wotherspoon,12-Mar-93,Mar-12-1993,3/12/93,3/12/93,1993,3,12,Mar
8473499,Reto,Berra,3-Jan-87,Jan-3-1987,1/3/87,1/3/87,1987,1,3,Jan
8475299,Joni,Ortio,16-Apr-91,Apr-16-1991,4/16/91,4/16/91,1991,4,16,Apr
8477935,Sam,Bennett,20-Jun-96,Jun-20-1996,6/20/96,6/20/96,1996,6,20,Jun
8475650,Brandon,Bollig,31-Jan-87,Jan-31-1987,1/31/87,1/31/87,1987,1,31,Jan
8477486,Emile,Poirier,14-Dec-94,Dec-14-1994,12/14/94,12/14/94,1994,12,14,Dec
8477913,David,Wolf,15-Sep-89,Sep-15-1989,9/15/89,9/15/89,1989,9,15,Sep
8476244,Raphael,Diaz,9-Jan-86,Jan-9-1986,1/9/86,1/9/86,1986,1,9,Jan
8476967,Brett,Kulak,6-Jan-94,Jan-6-1994,1/6/94,1/6/94,1994,1,6,Jan
8475829,John,Ramage,7-Feb-91,Feb-7-1991,2/7/91,2/7/91,1991,2,7,Feb
8473972,Jonas,Hiller,12-Feb-82,Feb-12-1982,2/12/82,2/12/82,1982,2,12,Feb
8477445,Hunter,Shinkaruk,13-Oct-94,Oct-13-1994,10/13/94,10/13/94,1994,10,13,Oct
8476279,Jyrki,Jokipakka,20-Aug-91,Aug-20-1991,8/20/91,8/20/91,1991,8,20,Aug
8478430,Oliver,Kylington,19-May-97,May-19-1997,5/19/97,5/19/97,1997,5,19,May
8476890,Patrick,Sieloff,15-May-94,May-15-1994,5/15/94,5/15/94,1994,5,15,May
8473404,Niklas,Backstrom,13-Feb-78,Feb-13-1978,2/13/78,2/13/78,1978,2,13,Feb
8471426,Troy,Brouwer,17-Aug-85,Aug-17-1985,8/17/85,8/17/85,1985,8,17,Aug
8479314,Matthew,Tkachuk,11-Dec-97,Dec-11-1997,12/11/97,12/11/97,1997,12,11,Dec
8475223,Linden,Vey,17-Jul-91,Jul-17-1991,7/17/91,7/17/91,1991,7,17,Jul
8478397,Rasmus,Andersson,27-Oct-96,Oct-27-1996,10/27/96,10/27/96,1996,10,27,Oct
8480330,Spencer,Foo,19-May-94,May-19-1994,5/19/94,5/19/94,1994,5,19,May
8475949,Marek,Hrivik,28-Aug-91,Aug-28-1991,8/28/91,8/28/91,1991,8,28,Aug
8477449,Morgan,Klimchuk,2-Mar-95,Mar-2-1995,3/2/95,3/2/95,1995,3,2,Mar
8479066,Ryan,Lomberg,9-Dec-94,Dec-9-1994,12/9/94,12/9/94,1994,12,9,Dec
8478233,Andrew,Mangiapane,4-Apr-96,Apr-4-1996,4/4/96,4/4/96,1996,4,4,Apr
8474612,Travis,Hamonic,16-Aug-90,Aug-16-1990,8/16/90,8/16/90,1990,8,16,Aug
8479346,Dillon,Dube,20-Jul-98,Jul-20-1998,7/20/98,7/20/98,1998,7,20,Jul
8476409,Alan,Quine,25-Feb-93,Feb-25-1993,2/25/93,2/25/93,1993,2,25,Feb
8477510,Kerby,Rychel,7-Oct-94,Oct-7-1994,10/7/94,10/7/94,1994,10,7,Oct
8480147,Oscar,Fantenberg,7-Oct-91,Oct-7-1991,10/7/91,10/7/91,1991,10,7,Oct
8477210,Buddy,Robinson,30-Sep-91,Sep-30-1991,9/30/91,9/30/91,1991,9,30,Sep
8481630,Alexander,Yelesin,7-Feb-96,Feb-7-1996,2/7/96,2/7/96,1996,2,7,Feb
8478446,Glenn,Gawdin,25-Mar-97,Mar-25-1997,3/25/97,3/25/97,1997,3,25,Mar
8479547,Matthew,Phillips,6-Apr-98,Apr-6-1998,4/6/98,4/6/98,1998,4,6,Apr
8480008,Adam,Ruzicka,11-May-99,May-11-1999,5/11/99,5/11/99,1999,5,11,May
8475690,Chris,Tanev,20-Dec-89,Dec-20-1989,12/20/89,12/20/89,1989,12,20,Dec
8474593,Jacob,Markstrom,31-Jan-90,Jan-31-1990,1/31/90,1/31/90,1990,1,31,Jan
8481501,Artyom,Zagidulin,8-Aug-95,Aug-8-1995,8/8/95,8/8/95,1995,8,8,Aug
8482652,Walker,Duehr,23-Nov-97,Nov-23-1997,11/23/97,11/23/97,1997,11,23,Nov
8482679,Matt,Coronato,14-Nov-02,Nov-14-2002,11/14/02,11/14/02,2002,11,14,Nov
8476456,Jonathan,Huberdeau,4-Jun-93,Jun-4-1993,6/4/93,6/4/93,1993,6,4,Jun
8481592,Jakob,Pelletier,7-Mar-01,Mar-7-2001,3/7/01,3/7/01,2001,3,7,Mar
8480084,Nick,DeSimone,21-Nov-94,Nov-21-1994,11/21/94,11/21/94,1994,11,21,Nov
8478502,Dennis,Gilbert,30-Oct-96,Oct-30-1996,10/30/96,10/30/96,1996,10,30,Oct
8477346,MacKenzie,Weegar,7-Jan-94,Jan-7-1994,1/7/94,1/7/94,1994,1,7,Jan
8481692,Dustin,Wolf,16-Apr-01,Apr-16-2001,4/16/01,4/16/01,2001,4,16,Apr
8481028,Martin,Pospisil,19-Nov-99,Nov-19-1999,11/19/99,11/19/99,1999,11,19,Nov
8482074,Connor,Zary,25-Sep-01,Sep-25-2001,9/25/01,9/25/01,2001,9,25,Sep
8482165,Yan,Kuznetsov,9-Mar-02,Mar-9-2002,3/9/02,3/9/02,2002,3,9,Mar
8448119,Evariste,Payer,12-Dec-1887,Dec-12-1887,12/12/1887,1887-12-12,1887,12,12,Dec
8448154,Didier,Pitre,1-Sep-1883,Sep-1-1883,9/1/1883,1883-09-01,1883,9,1,Sep
8446669,Joe,Hall,3-May-1882,May-3-1882,5/3/1882,1882-05-03,1882,5,3,May
8447348,Jack,Laviolette,27-Jul-1879,Jul-27-1879,7/27/1879,1879-07-27,1879,7,27,Jul
8450137,Georges,Vezina,21-Jan-1887,Jan-21-1887,1/21/1887,1887-01-21,1887,1,21,Jan
8445914,Fred,Doherty,15-Aug-1887,Aug-15-1887,8/15/1887,1887-08-15,1887,8,15,Aug
8449072,Don,Smith,3-Jun-1888,Jun-3-1888,6/3/1888,1888-06-03,1888,6,3,Jun
8447815,Howard,McNamara,3-Aug-1893,Aug-3-1893,8/3/1893,1893-08-03,1893,8,3,Aug
8445317,Dave,Campbell,27-Apr-1896,Apr-27-1896,4/27/1896,1896-04-27,1896,4,27,Apr
8447110,Aurel,Joliat,29-Aug-01,Aug-29-1901,8/29/01,8/29/01,1901,8,29,Aug
8445136,Bobby,Boucher,14-Feb-04,Feb-14-1904,2/14/04,2/14/04,1904,2,14,Feb
8447888,Howie,Morenz,21-Sep-02,Sep-21-1902,9/21/02,9/21/02,1902,9,21,Sep
8447111,Rene,Joliat,25-Apr-1898,Apr-25-1898,4/25/1898,1898-04-25,1898,4,25,Apr
8447272,Roland,Lafleur,21-Mar-1899,Mar-21-1899,3/21/1899,1899-03-21,1899,3,21,Mar
8447641,Johnny,Matz,1-Jun-1891,Jun-1-1891,6/1/1891,1891-06-01,1891,6,1,Jun
8445578,Roger,Cormier,23-Mar-05,Mar-23-1905,3/23/05,3/23/05,1905,3,23,Mar
8447328,Wildor,Larochelle,23-Sep-06,Sep-23-1906,9/23/06,9/23/06,1906,9,23,Sep
8447465,Hec,Lepine,7-Dec-1897,Dec-7-1897,12/7/1897,1897-12-07,1897,12,7,Dec
8447466,Pit,Lepine,30-Jul-01,Jul-30-1901,7/30/01,7/30/01,1901,7,30,Jul
8448101,Rollie,Paulhus,1-Sep-02,Sep-1-1902,9/1/02,9/1/02,1902,9,1,Sep
8450012,Frenchy,Lacroix,21-Oct-1897,Oct-21-1897,10/21/1897,1897-10-21,1897,10,21,Oct
8450099,Herb,Rheaume,12-Jan-00,Jan-12-1900,1/12/00,1/12/00,1900,1,12,Jan
8446572,Art,Gauthier,10-Oct-04,Oct-10-1904,10/10/04,10/10/04,1904,10,10,Oct
8447283,Leo,Lafrance,3-Nov-02,Nov-3-1902,11/3/02,11/3/02,1902,11,3,Nov
8446564,Herb,Gardiner,8-May-1891,May-8-1891,5/8/1891,1891-05-08,1891,5,8,May
8447887,Amby,Moran,3-Apr-1895,Apr-3-1895,4/3/1895,1895-04-03,1895,4,3,Apr
8446571,Leo,Gaudreault,19-Oct-05,Oct-19-1905,10/19/05,10/19/05,1905,10,19,Oct
8447884,Armand,Mondou,27-Jun-05,Jun-27-1905,6/27/05,6/27/05,1905,6,27,Jun
8447468,Art,Lesieur,13-Sep-07,Sep-13-1907,9/13/07,9/13/07,1907,9,13,Sep
8447604,Georges,Mantha,29-Nov-08,Nov-29-1908,11/29/08,11/29/08,1908,11,29,Nov
8448346,Gus,Rivers,19-Nov-09,Nov-19-1909,11/19/09,11/19/09,1909,11,19,Nov
8450050,Mickey,Murray,14-Oct-1898,Oct-14-1898,10/14/1898,1898-10-14,1898,10,14,Oct
8444870,Art,Alexandre,2-Mar-09,Mar-2-1909,3/2/09,3/2/09,1909,3,2,Mar
8447691,Walt,McCartney,26-Apr-11,Apr-26-1911,4/26/11,4/26/11,1911,4,26,Apr
8447969,Leo,Murray,15-Feb-06,Feb-15-1906,2/15/06,2/15/06,1906,2,15,Feb
8448251,Paul,Raymond,27-Feb-13,Feb-27-1913,2/27/13,2/27/13,1913,2,27,Feb
8447282,Adie,Lafrance,13-Jan-12,Jan-13-1912,1/13/12,1/13/12,1912,1,13,Jan
8445504,Norm,Collings,6-May-10,May-6-1910,5/6/10,5/6/10,1910,5,6,May
8445824,Nels,Crutchfield,12-Jul-11,Jul-12-1911,7/12/11,7/12/11,1911,7,12,Jul
8447739,Bob,McCulley,8-Feb-14,Feb-8-1914,2/8/14,2/8/14,1914,2,8,Feb
8447777,Jack,McGill,3-Nov-10,Nov-3-1910,11/3/10,11/3/10,1910,11,3,Nov
8445057,Max,Bennett,4-Nov-12,Nov-4-1912,11/4/12,11/4/12,1912,11,4,Nov
8445140,Conrad,Bourcier,28-May-16,May-28-1916,5/28/16,5/28/16,1916,5,28,May
8445141,Jean,Bourcier,3-Jan-11,Jan-3-1911,1/3/11,1/3/11,1911,1,3,Jan
8445746,Rosie,Couture,24-Jul-05,Jul-24-1905,7/24/05,7/24/05,1905,7,24,Jul
8445884,Joffre,Desilets,16-Apr-15,Apr-16-1915,4/16/15,4/16/15,1915,4,16,Apr
8445953,Polly,Drouin,16-Jan-16,Jan-16-1916,1/16/16,1/16/16,1916,1,16,Jan
8447516,Rod,Lorrain,26-Jul-14,Jul-26-1914,7/26/14,7/26/14,1914,7,26,Jul
8446621,Red,Goupille,2-Sep-15,Sep-2-1915,9/2/15,9/2/15,1915,9,2,Sep
8447467,Gaston,Leroux,9-Jan-13,Jan-9-1913,1/9/13,1/9/13,1913,1,9,Jan
8445184,George,Brown,17-May-12,May-17-1912,5/17/12,5/17/12,1912,5,17,May
8445868,Tony,Demers,22-Jul-17,Jul-22-1917,7/22/17,7/22/17,1917,7,22,Jul
8447598,Gus,Mancuso,11-Apr-14,Apr-11-1914,4/11/14,4/11/14,1914,4,11,Apr
8449543,Don,Willson,1-Jan-14,Jan-1-1914,1/1/14,1/1/14,1914,1,1,Jan
8448250,Armand,Raymond,12-Jan-13,Jan-12-1913,1/12/13,1/12/13,1913,1,12,Jan
8449976,Paul,Gauthier,6-Mar-15,Mar-6-1915,3/6/15,3/6/15,1915,3,6,Mar
8449262,Marcel,Tremblay,4-Jul-15,Jul-4-1915,7/4/15,7/4/15,1915,7,4,Jul
8449266,Lou,Trudel,21-Jul-12,Jul-21-1912,7/21/12,7/21/12,1912,7,21,Jul
8447847,Bill,Meronek,15-Apr-17,Apr-15-1917,4/15/17,4/15/17,1917,4,15,Apr
8448171,Gordie,Poirier,27-Oct-14,Oct-27-1914,10/27/14,10/27/14,1914,10,27,Oct
8450007,Mike,Karakas,12-Dec-11,Dec-12-1911,12/12/11,12/12/11,1911,12,12,Dec
8444862,John,Adams,5-May-20,May-5-1920,5/5/20,5/5/20,1920,5,5,May
8445059,Joe,Benoit,27-Feb-16,Feb-27-1916,2/27/16,2/27/16,1916,2,27,Feb
8446627,Tony,Graboski,9-May-16,May-9-1916,5/9/16,5/9/16,1916,5,9,May
8447271,Elmer,Lach,22-Jan-18,Jan-22-1918,1/22/18,1/22/18,1918,1,22,Jan
8449086,Stu,Smith,25-Sep-18,Sep-25-1918,9/25/18,9/25/18,1918,9,25,Sep
8448257,Ken,Reardon,1-Apr-21,Apr-1-1921,4/1/21,4/1/21,1921,4,1,Apr
8449047,Alex,Singbush,31-Jan-14,Jan-31-1914,1/31/14,1/31/14,1914,1,31,Jan
8445841,Bunny,Dame,6-Dec-13,Dec-6-1913,12/6/13,12/6/13,1913,12,6,Dec
8446659,Jim,Haggarty,14-Apr-14,Apr-14-1914,4/14/14,4/14/14,1914,4,14,Apr
8446762,Gerry,Heffernan,24-Jul-16,Jul-24-1916,7/24/16,7/24/16,1916,7,24,Jul
8447309,Leo,Lamoureux,1-Oct-16,Oct-1-1916,10/1/16,10/1/16,1916,10,1,Oct
8447889,Pete,Morin,8-Dec-15,Dec-8-1915,12/8/15,12/8/15,1915,12,8,Dec
8448042,Buddy,O'Connor,21-Jun-16,Jun-21-1916,6/21/16,6/21/16,1916,6,21,Jun
8449268,Connie,Tudin,21-Sep-17,Sep-21-1917,9/21/17,9/21/17,1917,9,21,Sep
8445132,Butch,Bouchard,11-Sep-20,Sep-11-1920,9/11/20,9/11/20,1920,9,11,Sep
8445891,Marcel,Dheere,19-Dec-20,Dec-19-1920,12/19/20,12/19/20,1920,12,19,Dec
8447372,Bobby,Lee,28-Dec-11,Dec-28-1911,12/28/11,12/28/11,1911,12,28,Dec
8447587,John,Mahaffy,18-Jul-19,Jul-18-1919,7/18/19,7/18/19,1919,7,18,Jul
8447772,Irv,McGibbon,11-Oct-14,Oct-11-1914,10/11/14,10/11/14,1914,10,11,Oct
8448321,Maurice,Richard,4-Aug-21,Aug-4-1921,8/4/21,8/4/21,1921,8,4,Aug
8449056,Alex,Smart,29-May-18,May-29-1918,5/29/18,5/29/18,1918,5,29,May
8446699,Glen,Harmon,2-Jan-21,Jan-2-1921,1/2/21,1/2/21,1921,1,2,Jan
8447273,Ernie,Laforce,23-Jun-16,Jun-23-1916,6/23/16,6/23/16,1916,6,23,Jun
8447588,Frank,Mailley,1-Aug-16,Aug-1-1916,8/1/16,8/1/16,1916,8,1,Aug
8448145,Charlie,Phillips,10-May-17,May-10-1917,5/10/17,5/10/17,1917,5,10,May
8445320,Tod,Campeau,4-Jun-23,Jun-4-1923,6/4/23,6/4/23,1923,6,4,Jun
8446230,Bob,Fillion,12-Jul-21,Jul-12-1921,7/12/21,7/12/21,1921,7,12,Jul
8447590,Fern,Majeau,3-May-16,May-3-1916,5/3/16,5/3/16,1916,5,3,May
8449335,Bobby,Walton,5-Aug-12,Aug-5-1912,8/5/12,8/5/12,1912,8,5,Aug
8449372,Phil,Watson,24-Apr-14,Apr-24-1914,4/24/14,4/24/14,1914,4,24,Apr
8449910,Bill,Durnan,22-Jan-16,Jan-22-1916,1/22/16,1/22/16,1916,1,22,Jan
8446148,Eddie,Emberg,18-Nov-21,Nov-18-1921,11/18/21,11/18/21,1921,11,18,Nov
8447058,Rosario,Joanette,27-Jul-19,Jul-27-1919,7/27/19,7/27/19,1919,7,27,Jul
8449263,Nils,Tremblay,26-Jul-23,Jul-26-1923,7/26/23,7/26/23,1923,7,26,Jul
8445999,Frank,Eddolls,5-Jul-21,Jul-5-1921,7/5/21,7/5/21,1921,7,5,Jul
8449146,Butch,Stahan,29-Oct-18,Oct-29-1918,10/29/18,10/29/18,1918,10,29,Oct
8447546,Murdo,MacKay,8-Aug-17,Aug-8-1917,8/8/17,8/8/17,1917,8,8,Aug
8448158,Gerry,Plamondon,5-Jan-25,Jan-5-1925,1/5/25,1/5/25,1925,1,5,Jan
8449390,Moe,White,28-Jul-19,Jul-28-1919,7/28/19,7/28/19,1919,7,28,Jul
8444871,George,Allen,27-Jul-14,Jul-27-1914,7/27/14,7/27/14,1914,7,27,Jul
8447476,Doug,Lewis,3-Mar-21,Mar-3-1921,3/3/21,3/3/21,1921,3,3,Mar
8447539,Hub,Macey,13-Apr-21,Apr-13-1921,4/13/21,4/13/21,1921,4,13,Apr
8448086,George,Pargeter,24-Feb-23,Feb-24-1923,2/24/23,2/24/23,1923,2,24,Feb
8447374,Roger,Leger,26-Mar-19,Mar-26-1919,3/26/19,3/26/19,1919,3,26,Mar
8445344,Bob,Carse,19-Jul-19,Jul-19-1919,7/19/19,7/19/19,1919,7,19,Jul
8445833,Floyd,Curry,11-Aug-25,Aug-11-1925,8/11/25,8/11/25,1925,8,11,Aug
8445967,Norm,Dussault,26-Sep-25,Sep-26-1925,9/26/25,9/26/25,1925,9,26,Sep
8447509,Jacques,Locas,12-Feb-26,Feb-12-1926,2/12/26,2/12/26,1926,2,12,Feb
8448333,Rip,Riopelle,30-Jan-22,Jan-30-1922,1/30/22,1/30/22,1922,1,30,Jan
8448358,George,Robertson,11-May-28,May-11-1928,5/11/28,5/11/28,1928,5,11,May
8450041,Gerry,McNeil,17-Apr-26,Apr-17-1926,4/17/26,4/17/26,1926,4,17,Apr
8445944,Eddie,Dorohoy,13-Mar-29,Mar-13-1929,3/13/29,3/13/29,1929,3,13,Mar
8447582,Bud,MacPherson,31-Mar-27,Mar-31-1927,3/31/27,3/31/27,1927,3,31,Mar
8445872,Lulu,Denis,7-Jun-28,Jun-7-1928,6/7/28,6/7/28,1928,6,7,Jun
8446464,Bob,Frampton,20-Jan-29,Jan-20-1929,1/20/29,1/20/29,1929,1,20,Jan
8446511,Bob,Fryday,5-Dec-28,Dec-5-1928,12/5/28,12/5/28,1928,12,5,Dec
8446885,Bert,Hirschfeld,1-Mar-29,Mar-1-1929,3/1/29,3/1/29,1929,3,1,Mar
8447833,Paul,Meger,17-Feb-29,Feb-17-1929,2/17/29,2/17/29,1929,2,17,Feb
8445408,Jean,Beliveau,31-Aug-31,Aug-31-1931,8/31/31,8/31/31,1931,8,31,Aug
8445257,Fred,Burchell,9-Jan-31,Jan-9-1931,1/9/31,1/9/31,1931,1,9,Jan
8445883,Gerard,Desaulniers,31-Dec-28,Dec-31-1928,12/31/28,12/31/28,1928,12,31,Dec
8446579,Bernie,Geoffrion,16-Feb-31,Feb-16-1931,2/16/31,2/16/31,1931,2,16,Feb
8447129,Vern,Kaiser,28-Sep-26,Sep-28-1926,9/28/26,9/28/26,1926,9,28,Sep
8447184,Frank,King,7-Mar-29,Mar-7-1929,3/7/29,3/7/29,1929,3,7,Mar
8447814,Sid,McNabney,15-Jan-29,Jan-15-1929,1/15/29,1/15/29,1929,1,15,Jan
8448350,Claude,Robert,10-Aug-28,Aug-10-1928,8/10/28,8/10/28,1928,8,10,Aug
8445832,Hugh,Currie,22-Oct-25,Oct-22-1925,10/22/25,10/22/25,1925,10,22,Oct
8447597,Tom,Manastersky,7-Mar-29,Mar-7-1929,3/7/29,3/7/29,1929,3,7,Mar
8447645,Eddie,Mazur,25-Jul-29,Jul-25-1929,7/25/29,7/25/29,1929,7,25,Jul
8448386,Ernie,Roche,4-Feb-30,Feb-4-1930,2/4/30,2/4/30,1930,2,4,Feb
8449142,Dollard,St. Laurent,12-May-29,May-12-1929,5/12/29,5/12/29,1929,5,12,May
8447593,Cliff,Malone,4-Sep-25,Sep-4-1925,9/4/25,9/4/25,1925,9,4,Sep
8447512,Stan,Long,6-Nov-29,Nov-6-1929,11/6/29,11/6/29,1929,11,6,Nov
8444854,Reg,Abbott,4-Feb-30,Feb-4-1930,2/4/30,2/4/30,1930,2,4,Feb
8444879,Doug,Anderson,20-Oct-27,Oct-20-1927,10/20/27,10/20/27,1927,10,20,Oct
8447022,Ivan,Irwin,13-Mar-27,Mar-13-1927,3/13/27,3/13/27,1927,3,13,Mar
8448583,Roland,Rousseau,1-Dec-29,Dec-1-1929,12/1/29,12/1/29,1929,12,1,Dec
8450049,Hal,Murphy,6-Jul-27,Jul-6-1927,7/6/27,7/6/27,1927,7,6,Jul
8445636,Andre,Corriveau,15-May-28,May-15-1928,5/15/28,5/15/28,1928,5,15,May
8445091,Garry,Blaine,19-Apr-33,Apr-19-1933,4/19/33,4/19/33,1933,4,19,Apr
8447308,Jean-Paul,Lamirande,21-Aug-24,Aug-21-1924,8/21/24,8/21/24,1924,8,21,Aug
8447361,Jack,LeClair,30-May-29,May-30-1929,5/30/29,5/30/29,1929,5,30,May
8448582,Guy,Rousseau,21-Dec-34,Dec-21-1934,12/21/34,12/21/34,1934,12,21,Dec
8447651,George,McAvoy,21-Jun-31,Jun-21-1931,6/21/31,6/21/31,1931,6,21,Jun
8449824,Andre,Binette,2-Dec-33,Dec-2-1933,12/2/33,12/2/33,1933,12,2,Dec
8445171,Connie,Broden,6-Apr-32,Apr-6-1932,4/6/32,4/6/32,1932,4,6,Apr
8448215,Claude,Provost,17-Sep-33,Sep-17-1933,9/17/33,9/17/33,1933,9,17,Sep
8448320,Henri,Richard,29-Feb-36,Feb-29-1936,2/29/36,2/29/36,1936,2,29,Feb
8445500,Wally,Clune,20-Feb-30,Feb-20-1930,2/20/30,2/20/30,1930,2,20,Feb
8445886,Jacques,Deslauriers,3-Sep-28,Sep-3-1928,9/3/28,9/3/28,1928,9,3,Sep
8449270,Bob,Turner,31-Jan-34,Jan-31-1934,1/31/34,1/31/34,1934,1,31,Jan
8444996,Ralph,Backstrom,18-Sep-37,Sep-18-1937,9/18/37,9/18/37,1937,9,18,Sep
8445809,Glen,Cressman,29-Aug-34,Aug-29-1934,8/29/34,8/29/34,1934,8,29,Aug
8449089,Stan,Smrke,2-Sep-28,Sep-2-1928,9/2/28,9/2/28,1928,9,2,Sep
8449554,Jerry,Wilson,10-Apr-37,Apr-10-1937,4/10/37,4/10/37,1937,4,10,Apr
8445147,Jack,Bownass,27-Jul-30,Jul-27-1930,7/27/30,7/27/30,1930,7,27,Jul
8449785,Don,Aiken,1-Jan-32,Jan-1-1932,1/1/32,1/1/32,1932,1,1,Jan
8449840,Len,Broderick,11-Oct-38,Oct-11-1938,10/11/38,10/11/38,1938,10,11,Oct
8449862,Claude,Cyr,27-Mar-39,Mar-27-1939,3/27/39,3/27/39,1939,3,27,Mar
8446888,Cec,Hoekstra,2-Apr-35,Apr-2-1935,4/2/35,4/2/35,1935,4,2,Apr
8451960,J.C.,Tremblay,22-Jan-39,Jan-22-1939,1/22/39,1/22/39,1939,1,22,Jan
8449256,Gilles,Tremblay,17-Dec-38,Dec-17-1938,12/17/38,12/17/38,1938,12,17,Dec
8446687,Chuck,Hamilton,18-Jan-39,Jan-18-1939,1/18/39,1/18/39,1939,1,18,Jan
8446343,Lou,Fontinato,20-Jan-32,Jan-20-1932,1/20/32,1/20/32,1932,1,20,Jan
8445166,Gerry,Brisson,3-Sep-37,Sep-3-1937,9/3/37,9/3/37,1937,9,3,Sep
8447325,Jacques,Laperriere,22-Nov-41,Nov-22-1941,11/22/41,11/22/41,1941,11,22,Nov
8452247,Ernie,Wakely,27-Nov-40,Nov-27-1940,11/27/40,11/27/40,1940,11,27,Nov
8446200,Yvan,Cournoyer,22-Nov-43,Nov-22-1943,11/22/43,11/22/43,1943,11,22,Nov
8446812,John,Ferguson,5-Sep-38,Sep-5-1938,9/5/38,9/5/38,1938,9,5,Sep
8448356,Jimmy,Roberts,9-Apr-40,Apr-9-1940,4/9/40,4/9/40,1940,4,9,Apr
8450046,Jean-Guy,Morissette,16-Dec-37,Dec-16-1937,12/16/37,12/16/37,1937,12,16,Dec
8448756,Jacques,Lemaire,7-Sep-45,Sep-7-1945,9/7/45,9/7/45,1945,9,7,Sep
8445072,Bob,Berry,29-Nov-43,Nov-29-1943,11/29/43,11/29/43,1943,11,29,Nov
8445126,Christian,Bordeleau,23-Sep-47,Sep-23-1947,9/23/47,9/23/47,1947,9,23,Sep
8446645,Lucien,Grenier,3-Nov-46,Nov-3-1946,11/3/46,11/3/46,1946,11,3,Nov
8446720,Tony,Esposito,23-Apr-43,Apr-23-1943,4/23/43,4/23/43,1943,4,23,Apr
8447988,Rejean,Houle,25-Oct-49,Oct-25-1949,10/25/49,10/25/49,1949,10,25,Oct
8446933,Fran,Huck,4-Dec-45,Dec-4-1945,12/4/45,12/4/45,1945,12,4,Dec
8450472,Lawrence,Pleau,29-Jun-47,Jun-29-1947,6/29/47,6/29/47,1947,6,29,Jun
8445834,Paul,Curtis,29-Sep-47,Sep-29-1947,9/29/47,9/29/47,1947,9,29,Sep
8448735,Chuck,Lefley,20-Jan-50,Jan-20-1950,1/20/50,1/20/50,1950,1,20,Jan
8445612,Pierre,Bouchard,20-Feb-48,Feb-20-1948,2/20/48,2/20/48,1948,2,20,Feb
8446490,Ken,Dryden,8-Aug-47,Aug-8-1947,8/8/47,8/8/47,1947,8,8,Aug
8451354,Steve,Shutt,1-Jul-52,Jul-1-1952,7/1/52,7/1/52,1952,7,1,Jul
8452488,Murray,Wilson,7-Nov-51,Nov-7-1951,11/7/51,11/7/51,1951,11,7,Nov
8450936,Larry,Robinson,2-Jun-51,Jun-2-1951,6/2/51,6/2/51,1951,6,2,Jun
8446998,Bob,Gainey,13-Dec-53,Dec-13-1953,12/13/53,12/13/53,1953,12,13,Dec
8447290,Glenn,Goldup,26-Apr-53,Apr-26-1953,4/26/53,4/26/53,1953,4,26,Apr
8451959,Mario,Tremblay,2-Sep-56,Sep-2-1956,9/2/56,9/2/56,1956,9,2,Sep
8446047,Rick,Chartraw,13-Jul-54,Jul-13-1954,7/13/54,7/13/54,1954,7,13,Jul
8449676,Pierre,Mondou,27-Nov-55,Nov-27-1955,11/27/55,11/27/55,1955,11,27,Nov
8446147,Cam,Connor,10-Aug-54,Aug-10-1954,8/10/54,8/10/54,1954,8,10,Aug
8449874,Dan,Newman,26-Jan-52,Jan-26-1952,1/26/52,1/26/52,1952,1,26,Jan
8448651,Rod,Langway,3-May-57,May-3-1957,5/3/57,5/3/57,1957,5,3,May
8448369,Yvan,Joly,6-Feb-60,Feb-6-1960,2/6/60,2/6/60,1960,2,6,Feb
8450938,Morris,Robinson,29-May-57,May-29-1957,5/29/57,5/29/57,1957,5,29,May
8446036,Guy,Carbonneau,18-Mar-60,Mar-18-1960,3/18/60,3/18/60,1960,3,18,Mar
8452445,Doug,Wickenheiser,30-Mar-61,Mar-30-1961,3/30/61,3/30/61,1961,3,30,Mar
8450074,David,Orleski,26-Dec-59,Dec-26-1959,12/26/59,12/26/59,1959,12,26,Dec
8452281,Ryan,Walter,23-Apr-58,Apr-23-1958,4/23/58,4/23/58,1958,4,23,Apr
8445267,Normand,Baron,15-Dec-57,Dec-15-1957,12/15/57,12/15/57,1957,12,15,Dec
8444917,Dave,Allison,14-Apr-59,Apr-14-1959,4/14/59,4/14/59,1959,4,14,Apr
8445936,Kent,Carlson,11-Jan-62,Jan-11-1962,1/11/62,1/11/62,1962,1,11,Jan
8447088,Jocelyn,Gauvreau,4-Mar-64,Mar-4-1964,3/4/64,3/4/64,1964,3,4,Mar
8451058,Thomas,Rundqvist,4-May-60,May-4-1960,5/4/60,5/4/60,1960,5,4,May
8451874,Jeffrey,Teal,30-May-60,May-30-1960,5/30/60,5/30/60,1960,5,30,May
8451033,Patrick,Roy,5-Oct-65,Oct-5-1965,10/5/65,10/5/65,1965,10,5,Oct
8446287,Kjell,Dahlin,2-Mar-63,Mar-2-1963,3/2/63,3/2/63,1963,3,2,Mar
8445905,Dom,Campedelli,3-Apr-64,Apr-3-1964,4/3/64,4/3/64,1964,4,3,Apr
8446043,Jose,Charbonneau,2-Nov-66,Nov-2-1966,11/2/66,11/2/66,1966,11,2,Nov
8445734,Benoit,Brunet,24-Aug-68,Aug-24-1968,8/24/68,8/24/68,1968,8,24,Aug
8448415,Mike,Keane,29-May-67,May-29-1967,5/29/67,5/29/67,1967,5,29,May
8448719,Stephan,Lebeau,28-Feb-68,Feb-28-1968,2/28/68,2/28/68,1968,2,28,Feb
8446723,Randy,Exelby,13-Aug-65,Aug-13-1965,8/13/65,8/13/65,1965,8,13,Aug
8446009,Ed,Cristofoli,14-May-67,May-14-1967,5/14/67,5/14/67,1967,5,14,May
8446397,Martin,Desjardins,28-Jan-67,Jan-28-1967,1/28/67,1/28/67,1967,1,28,Jan
8450657,Andre,Racicot,9-Jun-69,Jun-9-1969,6/9/69,6/9/69,1969,6,9,Jun
8450890,Mario,Roberge,25-Jan-64,Jan-25-1964,1/25/64,1/25/64,1964,1,25,Jan
8445739,Patrice,Brisebois,27-Jan-71,Jan-27-1971,1/27/71,1/27/71,1971,1,27,Jan
8447079,Luc,Gauthier,19-Apr-64,Apr-19-1964,4/19/64,4/19/64,1964,4,19,Apr
8455564,Jesse,Belanger,15-Jun-69,Jun-15-1969,6/15/69,6/15/69,1969,6,15,Jun
8455801,Patrik,Carnback,1-Feb-68,Feb-1-1968,2/1/68,2/1/68,1968,2,1,Feb
8456848,Patric,Kjellberg,17-Jun-69,Jun-17-1969,6/17/69,6/17/69,1969,6,17,Jun
8458641,Oleg,Petrov,18-Apr-71,Apr-18-1971,4/18/71,4/18/71,1971,4,18,Apr
8456274,Gerry,Fleming,16-Oct-66,Oct-16-1966,10/16/66,10/16/66,1966,10,16,Oct
8457991,Pierre,Sevigny,8-Sep-71,Sep-8-1971,9/8/71,9/8/71,1971,9,8,Sep
8458287,Lindsay,Vallis,12-Jan-71,Jan-12-1971,1/12/71,1/12/71,1971,1,12,Jan
8459100,Christian,Proulx,10-Dec-73,Dec-10-1973,12/10/73,12/10/73,1973,12,10,Dec
8456917,Les,Kuntar,28-Jul-69,Jul-28-1969,7/28/69,7/28/69,1969,7,28,Jul
8459494,Sebastien,Bordeleau,15-Feb-75,Feb-15-1975,2/15/75,2/15/75,1975,2,15,Feb
8458705,Scott,Fraser,3-May-72,May-3-1972,5/3/72,5/3/72,1972,5,3,May
8459442,Saku,Koivu,23-Nov-74,Nov-23-1974,11/23/74,11/23/74,1974,11,23,Nov
8446376,Robert,Dirk,20-Aug-66,Aug-20-1966,8/20/66,8/20/66,1966,8,20,Aug
8458555,Francois,Groleau,23-Jan-73,Jan-23-1973,1/23/73,1/23/73,1973,1,23,Jan
8460560,Marko,Kiprusoff,6-Jun-72,Jun-6-1972,6/6/72,6/6/72,1972,6,6,Jun
8458604,Patrick,Labrecque,6-Mar-71,Mar-6-1971,3/6/71,3/6/71,1971,3,6,Mar
8460535,Jose,Theodore,13-Sep-76,Sep-13-1976,9/13/76,9/13/76,1976,9,13,Sep
8462252,Eric,Houde,19-Dec-76,Dec-19-1976,12/19/76,12/19/76,1976,12,19,Dec
8459602,David,Ling,9-Jan-75,Jan-9-1975,1/9/75,1/9/75,1975,1,9,Jan
8462039,Terry,Ryan,14-Jan-77,Jan-14-1977,1/14/77,1/14/77,1977,1,14,Jan
8464971,Matt,Higgins,29-Oct-77,Oct-29-1977,10/29/77,10/29/77,1977,10,29,Oct
8466130,Andrei,Bashkirov,22-Jun-70,Jun-22-1970,6/22/70,6/22/70,1970,6,22,Jun
8460015,Sylvain,Blouin,21-May-74,May-21-1974,5/21/74,5/21/74,1974,5,21,May
8462113,Jonathan,Delisle,30-Jun-77,Jun-30-1977,6/30/77,6/30/77,1977,6,30,Jun
8459305,Jean-Francois,Jomphe,28-Dec-72,Dec-28-1972,12/28/72,12/28/72,1972,12,28,Dec
8458660,Dave,Morissette,24-Dec-71,Dec-24-1971,12/24/71,12/24/71,1971,12,24,Dec
8462088,Miloslav,Guren,24-Sep-76,Sep-24-1976,9/24/76,9/24/76,1976,9,24,Sep
8458518,Scott,Lachance,22-Oct-72,Oct-22-1972,10/22/72,10/22/72,1972,10,22,Oct
8459114,Juha,Lind,2-Jan-74,Jan-2-1974,1/2/74,1/2/74,1974,1,2,Jan
8448825,Trevor,Linden,11-Apr-70,Apr-11-1970,4/11/70,4/11/70,1970,4,11,Apr
8467371,Mike,Ribeiro,10-Feb-80,Feb-10-1980,2/10/80,2/10/80,1980,2,10,Feb
8465914,Francis,Bouillon,17-Oct-75,Oct-17-1975,10/17/75,10/17/75,1975,10,17,Oct
8462073,Christian,Laflamme,24-Nov-76,Nov-24-1976,11/24/76,11/24/76,1976,11,24,Nov
8467445,Francis,Belanger,15-Jan-78,Jan-15-1978,1/15/78,1/15/78,1978,1,15,Jan
8464998,Jan,Bulis,18-Mar-78,Mar-18-1978,3/18/78,3/18/78,1978,3,18,Mar
8467534,Johan,Witehall,7-Jan-72,Jan-7-1972,1/7/72,1/7/72,1972,1,7,Jan
8460735,Richard,Zednik,6-Jan-76,Jan-6-1976,1/6/76,1/6/76,1976,1,6,Jan
8464972,Matthieu,Descteaux,23-Sep-77,Sep-23-1977,9/23/77,9/23/77,1977,9,23,Sep
8467496,Andrei,Markov,20-Dec-78,Dec-20-1978,12/20/78,12/20/78,1978,12,20,Dec
8465090,Andreas,Dackell,29-Dec-72,Dec-29-1972,12/29/72,12/29/72,1972,12,29,Dec
8468496,Marcel,Hossa,12-Oct-81,Oct-12-1981,10/12/81,10/12/81,1981,10,12,Oct
8452147,Shaun,Van Allen,29-Aug-67,Aug-29-1967,8/29/67,8/29/67,1967,8,29,Aug
8469558,Martti,Jarventie,4-Apr-76,Apr-4-1976,4/4/76,4/4/76,1976,4,4,Apr
8469800,Olivier,Michaud,14-Sep-83,Sep-14-1983,9/14/83,9/14/83,1983,9,14,Sep
8468558,Jozef,Balej,22-Feb-82,Feb-22-1982,2/22/82,2/22/82,1982,2,22,Feb
8460105,Radek,Bonk,9-Jan-76,Jan-9-1976,1/9/76,1/9/76,1976,1,9,Jan
8469807,Jonathan,Ferland,9-Feb-83,Feb-9-1983,2/9/83,2/9/83,1983,2,9,Feb
8470603,Andrei,Kostitsyn,3-Feb-85,Feb-3-1985,2/3/85,2/3/85,1985,2,3,Feb
8469528,Garth,Murray,17-Sep-82,Sep-17-1982,9/17/82,9/17/82,1982,9,17,Sep
8469478,Alexander,Perezhogin,10-Aug-83,Aug-10-1983,8/10/83,8/10/83,1983,8,10,Aug
8466290,David,Aebischer,7-Feb-78,Feb-7-1978,2/7/78,2/7/78,1978,2,7,Feb
8469658,Cristobal,Huet,3-Sep-75,Sep-3-1975,9/3/75,9/3/75,1975,9,3,Sep
8471670,Guillaume,Latendresse,24-May-87,May-24-1987,5/24/87,5/24/87,1987,5,24,May
8469489,Duncan,Milroy,8-Feb-83,Feb-8-1983,2/8/83,2/8/83,1983,2,8,Feb
8471859,Sergei,Kostitsyn,20-Mar-87,Mar-20-1987,3/20/87,3/20/87,1987,3,20,Mar
8470705,Corey,Locke,8-May-84,May-8-1984,5/8/84,5/8/84,1984,5,8,May
8471457,Gregory,Stewart,21-May-86,May-21-1986,5/21/86,5/21/86,1986,5,21,May
8471679,Carey,Price,16-Aug-87,Aug-16-1987,8/16/87,8/16/87,1987,8,16,Aug
8467392,Alex,Henry,18-Oct-79,Oct-18-1979,10/18/79,10/18/79,1979,10,18,Oct
8471976,David,Desharnais,14-Sep-86,Sep-14-1986,9/14/86,9/14/86,1986,9,14,Sep
8474436,Brock,Trotter,16-Jan-87,Jan-16-1987,1/16/87,1/16/87,1987,1,16,Jan
8470623,Shawn,Belle,3-Jan-85,Jan-3-1985,1/3/85,1/3/85,1985,1,3,Jan
8473438,Mathieu,Carle,30-Sep-87,Sep-30-1987,9/30/87,9/30/87,1987,9,30,Sep
8475372,Andreas,Engqvist,23-Dec-87,Dec-23-1987,12/23/87,12/23/87,1987,12,23,Dec
8475641,Brendon,Nash,31-Mar-87,Mar-31-1987,3/31/87,3/31/87,1987,3,31,Mar
8473608,Blake,Geoffrion,3-Feb-88,Feb-3-1988,2/3/88,2/3/88,1988,2,3,Feb
8475183,Louis,Leblanc,26-Jan-91,Jan-26-1991,1/26/91,1/26/91,1991,1,26,Jan
8470329,Chris,Campoli,9-Jul-84,Jul-9-1984,7/9/84,7/9/84,1984,7,9,Jul
8471296,Alexei,Emelin,25-Apr-86,Apr-25-1986,4/25/86,4/25/86,1986,4,25,Apr
8473647,Frdric,St-Denis,23-Jan-86,Jan-23-1986,1/23/86,1/23/86,1986,1,23,Jan
8475848,Brendan,Gallagher,6-May-92,May-6-1992,5/6/92,5/6/92,1992,5,6,May
8474518,Davis,Drewiske,22-Nov-84,Nov-22-1984,11/22/84,11/22/84,1984,11,22,Nov
8475889,Patrick,Holland,7-Jan-92,Jan-7-1992,1/7/92,1/7/92,1992,1,7,Jan
8475198,Joonas,Nattinen,3-Jan-91,Jan-3-1991,1/3/91,1/3/91,1991,1,3,Jan
8468095,George,Parros,29-Dec-79,Dec-29-1979,12/29/79,12/29/79,1979,12,29,Dec
8477413,Sven,Andrighetto,21-Mar-93,Mar-21-1993,3/21/93,3/21/93,1993,3,21,Mar
8470104,Tom,Gilbert,10-Jan-83,Jan-10-1983,1/10/83,1/10/83,1983,1,10,Jan
8477901,Daniel,Carr,1-Nov-91,Nov-1-1991,11/1/91,11/1/91,1991,11,1,Nov
8476479,Phillip,Danault,24-Feb-93,Feb-24-1993,2/24/93,2/24/93,1993,2,24,Feb
8470039,Tomas,Fleischmann,16-May-84,May-16-1984,5/16/84,5/16/84,1984,5,16,May
8473431,Bud,Holloway,1-Mar-88,Mar-1-1988,3/1/88,3/1/88,1988,3,1,Mar
8476948,Charles,Hudon,23-Jun-94,Jun-23-1994,6/23/94,6/23/94,1994,6,23,Jun
8477446,Michael,McCarron,7-Mar-95,Mar-7-1995,3/7/95,3/7/95,1995,3,7,Mar
8473658,Victor,Bartley,17-Feb-88,Feb-17-1988,2/17/88,2/17/88,1988,2,17,Feb
8476379,Darren,Dietz,17-Jul-93,Jul-17-1993,7/17/93,7/17/93,1993,7,17,Jul
8475782,Morgan,Ellis,30-Apr-92,Apr-30-1992,4/30/92,4/30/92,1992,4,30,Apr
8478963,Ryan,Johnston,14-Feb-92,Feb-14-1992,2/14/92,2/14/92,1992,2,14,Feb
8478004,Brett,Lernout,24-Sep-95,Sep-24-1995,9/24/95,9/24/95,1995,9,24,Sep
8479292,Charlie,Lindgren,18-Dec-93,Dec-18-1993,12/18/93,12/18/93,1993,12,18,Dec
8474100,Dwight,King,5-Jul-89,Jul-5-1989,7/5/89,7/5/89,1989,7,5,Jul
8477476,Artturi,Lehkonen,4-Jul-95,Jul-4-1995,7/4/95,7/4/95,1995,7,4,Jul
8478561,Andreas,Martinsen,13-Jun-90,Jun-13-1990,6/13/90,6/13/90,1990,6,13,Jun
8471228,Alexander,Radulov,5-Jul-86,Jul-5-1986,7/5/86,7/5/86,1986,7,5,Jul
8477957,Nikita,Scherbak,30-Dec-95,Dec-30-1995,12/30/95,12/30/95,1995,12,30,Dec
8476381,Andrew,Shaw,20-Jul-91,Jul-20-1991,7/20/91,7/20/91,1991,7,20,Jul
8470642,Shea,Weber,14-Aug-85,Aug-14-1985,8/14/85,8/14/85,1985,8,14,Aug
8469466,Ales,Hemsky,13-Aug-83,Aug-13-1983,8/13/83,8/13/83,1983,8,13,Aug
8473991,Karl,Alzner,24-Sep-88,Sep-24-1988,9/24/88,9/24/88,1988,9,24,Sep
8480143,Jakub,Jerabek,12-May-91,May-12-1991,5/12/91,5/12/91,1991,5,12,May
8478454,Noah,Juulsen,2-Apr-97,Apr-2-1997,4/2/97,4/2/97,1997,4,2,Apr
8475968,Alex,Belzile,31-Aug-91,Aug-31-1991,8/31/91,8/31/91,1991,8,31,Aug
8478133,Jake,Evans,2-Jun-96,Jun-2-1996,6/2/96,6/2/96,1996,6,2,Jun
8480018,Nick,Suzuki,10-Aug-99,Aug-10-1999,8/10/99,8/10/99,1999,8,10,Aug
8478838,Lukas,Vejdemo,25-Jan-96,Jan-25-1996,1/25/96,1/25/96,1996,1,25,Jan
8479985,Cale,Fleury,19-Nov-98,Nov-19-1998,11/19/98,11/19/98,1998,11,19,Nov
8481105,Otto,Leskinen,6-Feb-97,Feb-6-1997,2/6/97,2/6/97,1997,2,6,Feb
8477467,Gustav,Olofsson,1-Dec-94,Dec-1-1994,12/1/94,12/1/94,1994,12,1,Dec
8480051,Cayden,Primeau,11-Aug-99,Aug-11-1999,8/11/99,8/11/99,1999,8,11,Aug
8476981,Josh,Anderson,7-May-94,May-7-1994,5/7/94,5/7/94,1994,5,7,May
8481540,Cole,Caufield,2-Jan-01,Jan-2-2001,1/2/01,1/2/01,2001,1,2,Jan
8481058,Jesse,Ylnen,3-Oct-99,Oct-3-1999,10/3/99,10/3/99,1999,10,3,Oct
8481014,Alexander,Romanov,6-Jan-00,Jan-6-2000,1/6/00,1/6/00,2000,1,6,Jan
8474596,Jake,Allen,7-Aug-90,Aug-7-1990,8/7/90,8/7/90,1990,8,7,Aug
8477631,Brandon,Baddock,29-Mar-95,Mar-29-1995,3/29/95,3/29/95,1995,3,29,Mar
8481093,Rafael,Harvey-Pinard,6-Jan-99,Jan-6-1999,1/6/99,1/6/99,1999,1,6,Jan
8480858,Cam,Hillis,24-Jun-00,Jun-24-2000,6/24/00,6/24/00,2000,6,24,Jun
8479543,Michael,Pezzetta,13-Mar-98,Mar-13-1998,3/13/98,3/13/98,1998,3,13,Mar
8479514,Rem,Pitlick,2-Apr-97,Apr-2-1997,4/2/97,4/2/97,1997,4,2,Apr
8482111,Justin,Barron,15-Nov-01,Nov-15-2001,11/15/01,11/15/01,2001,11,15,Nov
8480887,Jordan,Harris,7-Jul-00,Jul-7-2000,7/7/00,7/7/00,2000,7,7,Jul
8481555,Mattias,Norlinder,12-Apr-00,Apr-12-2000,4/12/00,4/12/00,2000,4,12,Apr
8481461,Corey,Schueneman,2-Sep-95,Sep-2-1995,9/2/95,9/2/95,1995,9,2,Sep
8475227,Chris,Wideman,7-Jan-90,Jan-7-1990,1/7/90,1/7/90,1990,1,7,Jan
8478933,Michael,McNiven,9-Jul-97,Jul-9-1997,7/9/97,7/9/97,1997,7,9,Jul
8478470,Sam,Montembeault,30-Oct-96,Oct-30-1996,10/30/96,10/30/96,1996,10,30,Oct
8483424,Owen,Beck,3-Feb-04,Feb-3-2004,2/3/04,2/3/04,2004,2,3,Feb
8483549,Lucas,Condotta,19-Jun-97,Jun-19-1997,6/19/97,6/19/97,1997,6,19,Jun
8481523,Kirby,Dach,21-Jan-01,Jan-21-2001,1/21/01,1/21/01,2001,1,21,Jan
8474149,Evgenii,Dadonov,12-Mar-89,Mar-12-1989,3/12/89,3/12/89,1989,3,12,Mar
8482081,Sean,Farrell,2-Nov-01,Nov-2-2001,11/2/01,11/2/01,2001,11,2,Nov
8478495,Denis,Gurianov,7-Jun-97,Jun-7-1997,6/7/97,6/7/97,1997,6,7,Jun
8478409,Anthony,Richard,20-Dec-96,Dec-20-1996,12/20/96,12/20/96,1996,12,20,Dec
8483515,Juraj,Slafkovsky,30-Mar-04,Mar-30-2004,3/30/04,3/30/04,2004,3,30,Mar
8480034,Joel,Teasdale,11-Mar-99,Mar-11-1999,3/11/99,3/11/99,1999,3,11,Mar
8479329,Frederic,Allard,27-Dec-97,Dec-27-1997,12/27/97,12/27/97,1997,12,27,Dec
8482087,Kaiden,Guhle,18-Jan-02,Jan-18-2002,1/18/02,1/18/02,2002,1,18,Jan
8482964,Arber,Xhekaj,30-Jan-01,Jan-30-2001,1/30/01,1/30/01,2001,1,30,Jan
8482476,Emil,Heineman,16-Nov-01,Nov-16-2001,11/16/01,11/16/01,2001,11,16,Nov
8481618,Alex,Newhook,28-Jan-01,Jan-28-2001,1/28/01,1/28/01,2001,1,28,Jan
8481593,Jayden,Struble,8-Sep-01,Sep-8-2001,9/8/01,9/8/01,2001,9,8,Sep
8444929,Ron,Anderson,21-Jan-50,Jan-21-1950,1/21/50,1/21/50,1950,1,21,Jan
8445704,Gord,Brooks,11-Sep-50,Sep-11-1950,9/11/50,9/11/50,1950,9,11,Sep
8446141,Jack,Egers,28-Jan-49,Jan-28-1949,1/28/49,1/28/49,1949,1,28,Jan
8446512,Larry,Fullan,11-Aug-49,Aug-11-1949,8/11/49,8/11/49,1949,8,11,Aug
8446929,Jim,Hrycuik,7-Oct-49,Oct-7-1949,10/7/49,10/7/49,1949,10,7,Oct
8449248,Mike,Marson,24-Jul-55,Jul-24-1955,7/24/55,7/24/55,1955,7,24,Jul
8448009,Paul,Nicholson,16-Feb-54,Feb-16-1954,2/16/54,2/16/54,1954,2,16,Feb
8450290,Andre,Peloffy,25-Feb-51,Feb-25-1951,2/25/51,2/25/51,1951,2,25,Feb
8444926,Murray,Anderson,28-Aug-49,Aug-28-1949,8/28/49,8/28/49,1949,8,28,Aug
8447857,Bill,Mikkelson,21-May-48,May-21-1948,5/21/48,5/21/48,1948,5,21,May
8445667,Rick,Bragnalo,1-Dec-51,Dec-1-1951,12/1/51,12/1/51,1951,12,1,Dec
8447196,Brian,Kinsella,11-Feb-54,Feb-11-1954,2/11/54,2/11/54,1954,2,11,Feb
8447314,Mike,Lampman,20-Apr-50,Apr-20-1950,4/20/50,4/20/50,1950,4,20,Apr
8449158,Brian,Stapleton,25-Dec-51,Dec-25-1951,12/25/51,12/25/51,1951,12,25,Dec
8445114,Larry,Bolonchuk,26-Feb-52,Feb-26-1952,2/26/52,2/26/52,1952,2,26,Feb
8448649,Gord,Lane,31-Mar-53,Mar-31-1953,3/31/53,3/31/53,1953,3,31,Mar
8449500,Robert,McLean,19-Jan-54,Jan-19-1954,1/19/54,1/19/54,1954,1,19,Jan
8451162,Peter,Scamurra,23-Feb-55,Feb-23-1955,2/23/55,2/23/55,1955,2,23,Feb
8452519,Bernie,Wolfe,18-Dec-51,Dec-18-1951,12/18/51,12/18/51,1951,12,18,Dec
8446921,Alex,Forsyth,6-Jan-55,Jan-6-1955,1/6/55,1/6/55,1955,1,6,Jan
8450216,Douglas,Patey,28-Dec-56,Dec-28-1956,12/28/56,12/28/56,1956,12,28,Dec
8448967,Steve,Self,9-May-50,May-9-1950,5/9/50,5/9/50,1950,5,9,May
8445793,Nelson,Burton,6-Nov-57,Nov-6-1957,11/6/57,11/6/57,1957,11,6,Nov
8447245,Eddy,Godin,29-Mar-57,Mar-29-1957,3/29/57,3/29/57,1957,3,29,Mar
8445388,Jim,Bedard,14-Nov-56,Nov-14-1956,11/14/56,11/14/56,1956,11,14,Nov
8446543,Rolf,Edberg,29-Sep-50,Sep-29-1950,9/29/50,9/29/50,1950,9,29,Sep
8451803,Leif,Svensson,18-Jul-51,Jul-18-1951,7/18/51,7/18/51,1951,7,18,Jul
8451956,Brent,Tremblay,1-Nov-57,Nov-1-1957,11/1/57,11/1/57,1957,11,1,Nov
8445619,Rollie,Boutin,6-Nov-57,Nov-6-1957,11/6/57,11/6/57,1957,11,6,Nov
8446019,Tony,Cassolato,7-May-56,May-7-1956,5/7/56,5/7/56,1956,5,7,May
8446103,Steve,Clippingdale,29-Apr-56,Apr-29-1956,4/29/56,4/29/56,1956,4,29,Apr
8446269,Glen,Currie,18-Jul-58,Jul-18-1958,7/18/58,7/18/58,1958,7,18,Jul
8447429,Bengt-Ake,Gustafsson,23-Mar-58,Mar-23-1958,3/23/58,3/23/58,1958,3,23,Mar
8448746,Antero,Lehtonen,12-Apr-54,Apr-12-1954,4/12/54,4/12/54,1954,4,12,Apr
8449889,Claude,Noel,31-Oct-55,Oct-31-1955,10/31/55,10/31/55,1955,10,31,Oct
8450482,Harvie,Pocza,22-Sep-59,Sep-22-1959,9/22/59,9/22/59,1959,9,22,Sep
8450655,Errol,Rausse,18-May-59,May-18-1959,5/18/59,5/18/59,1959,5,18,May
8448975,Paul,MacKinnon,6-Nov-58,Nov-6-1958,11/6/58,11/6/58,1958,11,6,Nov
8451887,Greg,Theberge,3-Sep-59,Sep-3-1959,9/3/59,9/3/59,1959,9,3,Sep
8448351,Jay,Johnston,28-Feb-58,Feb-28-1958,2/28/58,2/28/58,1958,2,28,Feb
8448898,Dwayne,Lowdermilk,9-Jan-58,Jan-9-1958,1/9/58,1/9/58,1958,1,9,Jan
8449507,James,McTaggart,31-Mar-60,Mar-31-1960,3/31/60,3/31/60,1960,3,31,Mar
8450209,Dave,Parro,30-Apr-57,Apr-30-1957,4/30/57,4/30/57,1957,4,30,Apr
8445477,Todd,Bidner,5-Jul-61,Jul-5-1961,7/5/61,7/5/61,1961,7,5,Jul
8451363,Mike,Siltala,5-Aug-63,Aug-5-1963,8/5/63,8/5/63,1963,8,5,Aug
8451737,Roland,Stoltz,15-Aug-54,Aug-15-1954,8/15/54,8/15/54,1954,8,15,Aug
8452153,Chris,Valentine,6-Dec-61,Dec-6-1961,12/6/61,12/6/61,1961,12,6,Dec
8445858,Eric,Calder,26-Jul-63,Jul-26-1963,7/26/63,7/26/63,1963,7,26,Jul
8445870,Tony,Camazzola,11-Sep-62,Sep-11-1962,9/11/62,9/11/62,1962,9,11,Sep
8449938,Milan,Novy,23-Sep-51,Sep-23-1951,9/23/51,9/23/51,1951,9,23,Sep
8447805,Andre,Hidi,5-Jun-60,Jun-5-1960,6/5/60,6/5/60,1960,6,5,Jun
8451108,Gary,Sampson,24-Aug-59,Aug-24-1959,8/24/59,8/24/59,1959,8,24,Aug
8448752,Mikko,Leinonen,15-Jul-55,Jul-15-1955,7/15/55,7/15/55,1955,7,15,Jul
8445375,Yves,Beaudoin,7-Jan-65,Jan-7-1965,1/7/65,1/7/65,1965,1,7,Jan
8449259,Grant,Martin,3-Mar-62,Mar-3-1962,3/3/62,3/3/62,1962,3,3,Mar
8447391,Jeff,Greenlaw,28-Feb-68,Feb-28-1968,2/28/68,2/28/68,1968,2,28,Feb
8449621,Kelly,Miller,3-Mar-63,Mar-3-1963,3/3/63,3/3/63,1963,3,3,Mar
8450408,Michal,Pivonka,28-Jan-66,Jan-28-1966,1/28/66,1/28/66,1966,1,28,Jan
8446014,Paul,Cavallini,13-Oct-65,Oct-13-1965,10/13/65,10/13/65,1965,10,13,Oct
8450820,Michael,Richard,7-Sep-66,Sep-7-1966,9/7/66,9/7/66,1966,9,7,Sep
8446779,Chris,Felix,27-May-64,May-27-1964,5/27/64,5/27/64,1964,5,27,May
8450680,Alain,Raymond,23-Jun-65,Jun-23-1965,6/23/65,6/23/65,1965,6,23,Jun
8448663,Tyler,Larter,12-Mar-68,Mar-12-1968,3/12/68,3/12/68,1968,3,12,Mar
8449289,Jim,Mathieson,24-Jan-70,Jan-24-1970,1/24/70,1/24/70,1970,1,24,Jan
8451509,Dennis,Smith,27-Jul-66,Jul-27-1966,7/27/66,7/27/66,1966,7,27,Jul
8452017,Brian,Tutt,9-Jan-62,Jan-9-1962,1/9/62,1/9/62,1962,1,9,Jan
8450624,John,Purves,12-Feb-68,Feb-12-1968,2/12/68,2/12/68,1968,2,12,Feb
8451261,Steve,Seftel,14-May-68,May-14-1968,5/14/68,5/14/68,1968,5,14,May
8445201,Bob,Babcock,3-Aug-68,Aug-3-1968,8/3/68,8/3/68,1968,8,3,Aug
8448777,Kenneth,Lovsin,4-Dec-66,Dec-4-1966,12/4/66,12/4/66,1966,12,4,Dec
8458572,Steve,Konowalchuk,11-Nov-72,Nov-11-1972,11/11/72,11/11/72,1972,11,11,Nov
8458528,Pat,Peake,28-May-73,May-28-1973,5/28/73,5/28/73,1973,5,28,May
8459007,Martin,Gendron,15-Feb-74,Feb-15-1974,2/15/74,2/15/74,1974,2,15,Feb
8458550,Jeff,Nelson,18-Dec-72,Dec-18-1972,12/18/72,12/18/72,1972,12,18,Dec
8458989,Stefan,Ustorf,3-Jan-74,Jan-3-1974,1/3/74,1/3/74,1974,1,3,Jan
8459433,Brendan,Witt,20-Feb-75,Feb-20-1975,2/20/75,2/20/75,1975,2,20,Feb
8460851,Jan,Benda,28-Apr-72,Apr-28-1972,4/28/72,4/28/72,1972,4,28,Apr
8462048,Brad,Church,14-Nov-76,Nov-14-1976,11/14/76,11/14/76,1976,11,14,Nov
8459110,Ryan,Mulhern,11-Jan-73,Jan-11-1973,1/11/73,1/11/73,1973,1,11,Jan
8458535,Trevor,Halverson,6-Apr-71,Apr-6-1971,4/6/71,4/6/71,1971,4,6,Apr
8457037,Patrice,Lefebvre,28-Jun-67,Jun-28-1967,6/28/67,6/28/67,1967,6,28,Jun
8465071,Alexei,Tezikov,22-Jun-78,Jun-22-1978,6/22/78,6/22/78,1978,6,22,Jun
8451013,Michael,Rosati,7-Jan-68,Jan-7-1968,1/7/68,1/7/68,1968,1,7,Jan
8462053,Miika,Elomo,21-Apr-77,Apr-21-1977,4/21/77,4/21/77,1977,4,21,Apr
8464958,Alexander,Volchkov,25-Sep-77,Sep-25-1977,9/25/77,9/25/77,1977,9,25,Sep
8468541,Jakub,Cutta,29-Dec-81,Dec-29-1981,12/29/81,12/29/81,1981,12,29,Dec
8458680,Corey,Hirsch,1-Jul-72,Jul-1-1972,7/1/72,7/1/72,1972,7,1,Jul
8465230,Ivan,Ciernik,30-Oct-77,Oct-30-1977,10/30/77,10/30/77,1977,10,30,Oct
8467429,Chris,Corrinet,29-Oct-78,Oct-29-1978,10/29/78,10/29/78,1978,10,29,Oct
8467553,Michael,Farrell,20-Oct-78,Oct-20-1978,10/20/78,10/20/78,1978,10,20,Oct
8467360,Stephen,Peat,10-Mar-80,Mar-10-1980,3/10/80,3/10/80,1980,3,10,Mar
8468506,Brian,Sutherby,1-Mar-82,Mar-1-1982,3/1/82,3/1/82,1982,3,1,Mar
8466170,Jean-Francois,Fortin,15-Mar-79,Mar-15-1979,3/15/79,3/15/79,1979,3,15,Mar
8467054,Todd,Rohloff,16-Jan-74,Jan-16-1974,1/16/74,1/16/74,1974,1,16,Jan
8467910,Nolan,Yonkman,1-Apr-81,Apr-1-1981,4/1/81,4/1/81,1981,4,1,Apr
8462120,Sebastien,Charpentier,18-Apr-77,Apr-18-1977,4/18/77,4/18/77,1977,4,18,Apr
8459328,Melvin,Angelstad,31-Oct-71,Oct-31-1971,10/31/71,10/31/71,1971,10,31,Oct
8469539,Owen,Fussey,2-Apr-83,Apr-2-1983,4/2/83,4/2/83,1983,4,2,Apr
8469920,Graham,Mink,21-May-79,May-21-1979,5/21/79,5/21/79,1979,5,21,May
8465178,Andrei,Podkonicky,9-May-78,May-9-1978,5/9/78,5/9/78,1978,5,9,May
8470479,Garret,Stroshein,4-Apr-80,Apr-4-1980,4/4/80,4/4/80,1980,4,4,Apr
8468005,Roman,Tvrdon,29-Jan-81,Jan-29-1981,1/29/81,1/29/81,1981,1,29,Jan
8468798,Darcy,Verot,13-Jul-76,Jul-13-1976,7/13/76,7/13/76,1976,7,13,Jul
8465113,Brian,Willsie,16-Mar-78,Mar-16-1978,3/16/78,3/16/78,1978,3,16,Mar
8464986,Chris,Hajt,5-Jul-78,Jul-5-1978,7/5/78,7/5/78,1978,7,5,Jul
8468413,Dwayne,Zinger,5-Jul-76,Jul-5-1976,7/5/76,7/5/76,1976,7,5,Jul
8467497,Rastislav,Stana,10-Jan-80,Jan-10-1980,1/10/80,1/10/80,1980,1,10,Jan
8467548,Matthew,Yeats,6-Apr-79,Apr-6-1979,4/6/79,4/6/79,1979,4,6,Apr
8470150,Jonas,Johansson,18-Mar-84,Mar-18-1984,3/18/84,3/18/84,1984,3,18,Mar
8470134,Jakub,Klepis,5-Jun-84,Jun-5-1984,6/5/84,6/5/84,1984,6,5,Jun
8471214,Alex,Ovechkin,17-Sep-85,Sep-17-1985,9/17/85,9/17/85,1985,9,17,Sep
8468800,Louis,Robitaille,16-Mar-82,Mar-16-1982,3/16/82,3/16/82,1982,3,16,Mar
8466208,Petr,Sykora,21-Dec-78,Dec-21-1978,12/21/78,12/21/78,1978,12,21,Dec
8470850,Joey,Tenute,2-Apr-83,Apr-2-1983,4/2/83,4/2/83,1983,4,2,Apr
8468086,Alexandre,Giroux,16-Jun-81,Jun-16-1981,6/16/81,6/16/81,1981,6,16,Jun
8467365,John,Erskine,26-Jun-80,Jun-26-1980,6/26/80,6/26/80,1980,6,26,Jun
8472375,Jamie,Hunt,20-Apr-84,Apr-20-1984,4/20/84,4/20/84,1984,4,20,Apr
8468184,Lawrence,Nycholat,7-May-79,May-7-1979,5/7/79,5/7/79,1979,5,7,May
8471240,Jeff,Schultz,25-Feb-86,Feb-25-1986,2/25/86,2/25/86,1986,2,25,Feb
8473563,Nicklas,Backstrom,23-Nov-87,Nov-23-1987,11/23/87,11/23/87,1987,11,23,Nov
8466232,Quintin,Laing,8-Jun-79,Jun-8-1979,6/8/79,6/8/79,1979,6,8,Jun
8471279,Sami,Lepisto,17-Oct-84,Oct-17-1984,10/17/84,10/17/84,1984,10,17,Oct
8465012,Tom,Poti,22-Mar-77,Mar-22-1977,3/22/77,3/22/77,1977,3,22,Mar
8471409,Andrew,Gordon,13-Dec-85,Dec-13-1985,12/13/85,12/13/85,1985,12,13,Dec
8473913,Sean,Collins,30-Oct-83,Oct-30-1983,10/30/83,10/30/83,1983,10,30,Oct
8459406,Bryan,Helmer,15-Jul-72,Jul-15-1972,7/15/72,7/15/72,1972,7,15,Jul
8468846,Tyler,Sloan,15-Mar-81,Mar-15-1981,3/15/81,3/15/81,1981,3,15,Mar
8473575,Semyon,Varlamov,27-Apr-88,Apr-27-1988,4/27/88,4/27/88,1988,4,27,Apr
8466251,Jason,Chimera,2-May-79,May-2-1979,5/2/79,5/2/79,1979,5,2,May
8471483,Kyle,Wilson,15-Dec-84,Dec-15-1984,12/15/84,12/15/84,1984,12,15,Dec
8474590,John,Carlson,10-Jan-90,Jan-10-1990,1/10/90,1/10/90,1990,1,10,Jan
8470294,DJ,King,27-Jun-84,Jun-27-1984,6/27/84,6/27/84,1984,6,27,Jun
8468599,Brian,Fahey,2-Mar-81,Mar-2-1981,3/2/81,3/2/81,1981,3,2,Mar
8474651,Braden,Holtby,16-Sep-89,Sep-16-1989,9/16/89,9/16/89,1989,9,16,Sep
8474383,Joel,Rechlicz,14-Jun-87,Jun-14-1987,6/14/87,6/14/87,1987,6,14,Jun
8474649,Tomas,Kundratek,26-Dec-89,Dec-26-1989,12/26/89,12/26/89,1989,12,26,Dec
8475619,Aaron,Volpatti,30-May-85,May-30-1985,5/30/85,5/30/85,1985,5,30,May
8476880,Tom,Wilson,29-Mar-94,Mar-29-1994,3/29/94,3/29/94,1994,3,29,Mar
8471234,Wojtek,Wolski,24-Feb-86,Feb-24-1986,2/24/86,2/24/86,1986,2,24,Feb
8475831,Philipp,Grubauer,25-Nov-91,Nov-25-1991,11/25/91,11/25/91,1991,11,25,Nov
8475161,Chris,Brown,3-Feb-91,Feb-3-1991,2/3/91,2/3/91,1991,2,3,Feb
8474598,Nicolas,Deschamps,6-Jan-90,Jan-6-1990,1/6/90,1/6/90,1990,1,6,Jan
8475744,Evgeny,Kuznetsov,19-May-92,May-19-1992,5/19/92,5/19/92,1992,5,19,May
8475247,Michael,Latta,25-May-91,May-25-1991,5/25/91,5/25/91,1991,5,25,May
8473505,Peter,LeBlanc,3-Feb-88,Feb-3-1988,2/3/88,2/3/88,1988,2,3,Feb
8471208,Dustin,Penner,28-Sep-82,Sep-28-1982,9/28/82,9/28/82,1982,9,28,Sep
8471708,Ryan,Stoa,13-Apr-87,Apr-13-1987,4/13/87,4/13/87,1987,4,13,Apr
8475602,Casey,Wellman,18-Oct-87,Oct-18-1987,10/18/87,10/18/87,1987,10,18,Oct
8475275,Patrick,Wey,21-Mar-91,Mar-21-1991,3/21/91,3/21/91,1991,3,21,Mar
8477444,Andre,Burakovsky,9-Feb-95,Feb-9-1995,2/9/95,2/9/95,1995,2,9,Feb
8475816,Stanislav,Galiev,17-Jan-92,Jan-17-1992,1/17/92,1/17/92,1992,1,17,Jan
8474744,Sean,Collins,29-Dec-88,Dec-29-1988,12/29/88,12/29/88,1988,12,29,Dec
8471698,T.J.,Oshie,23-Dec-86,Dec-23-1986,12/23/86,12/23/86,1986,12,23,Dec
8476905,Chandler,Stephenson,22-Apr-94,Apr-22-1994,4/22/94,4/22/94,1994,4,22,Apr
8475598,Ryan,Stanton,20-Jul-89,Jul-20-1989,7/20/89,7/20/89,1989,7,20,Jul
8475291,Garrett,Mitchell,2-Sep-91,Sep-2-1991,9/2/91,9/2/91,1991,9,2,Sep
8478063,Shane,Gersich,10-Jul-96,Jul-10-1996,7/10/96,7/10/96,1996,7,10,Jul
8476344,Tyler,Graovac,27-Apr-93,Apr-27-1993,4/27/93,4/27/93,1993,4,27,Apr
8477573,Nathan,Walker,7-Feb-94,Feb-7-1994,2/7/94,2/7/94,1994,2,7,Feb
8479482,Michal,Kempny,8-Sep-90,Sep-8-1990,9/8/90,9/8/90,1990,9,8,Sep
8475343,Nic,Dowd,27-May-90,May-27-1990,5/27/90,5/27/90,1990,5,27,May
8477831,Pheonix,Copley,18-Jan-92,Jan-18-1992,1/18/92,1/18/92,1992,1,18,Jan
8479359,Beck,Malenstyn,4-Feb-98,Feb-4-1998,2/4/98,2/4/98,1998,2,4,Feb
8477314,Brian,Pinho,11-May-95,May-11-1995,5/11/95,5/11/95,1995,5,11,May
8475958,Michael,Sgarbossa,25-Jul-92,Jul-25-1992,7/25/92,7/25/92,1992,7,25,Jul
8480796,Martin,Fehervary,6-Oct-99,Oct-6-1999,10/6/99,10/6/99,1999,10,6,Oct
8477544,Philippe,Maillet,7-Nov-92,Nov-7-1992,11/7/92,11/7/92,1992,11,7,Nov
8481580,Connor,McMichael,15-Jan-01,Jan-15-2001,1/15/01,1/15/01,2001,1,15,Jan
8479516,Garrett,Pilon,13-Apr-98,Apr-13-1998,4/13/98,4/13/98,1998,4,13,Apr
8482148,Hendrix,Lapierre,9-Feb-02,Feb-9-2002,2/9/02,2/9/02,2002,2,9,Feb
8481517,Brett,Leason,30-Apr-99,Apr-30-1999,4/30/99,4/30/99,1999,4,30,Apr
8481656,Aliaksei,Protas,6-Jan-01,Jan-6-2001,1/6/01,1/6/01,2001,1,6,Jan
8481441,Joe,Snively,1-Jan-96,Jan-1-1996,1/1/96,1/1/96,1996,1,1,Jan
8480823,Alexander,Alexeyev,15-Nov-99,Nov-15-1999,11/15/99,11/15/99,1999,11,15,Nov
8479321,Lucas,Johansen,16-Nov-97,Nov-16-1997,11/16/97,11/16/97,1997,11,16,Nov
8477457,Zach,Fucale,28-May-95,May-28-1995,5/28/95,5/28/95,1995,5,28,May
8479404,Henrik,Borgstrom,6-Aug-97,Aug-6-1997,8/6/97,8/6/97,1997,8,6,Aug
8477947,Sonny,Milano,12-May-96,May-12-1996,5/12/96,5/12/96,1996,5,12,May
8478506,Gabriel,Carlsson,2-Jan-97,Jan-2-1997,1/2/97,1/2/97,1997,1,2,Jan
8482861,Vincent,Iorio,14-Nov-02,Nov-14-2002,11/14/02,11/14/02,2002,11,14,Nov
8482411,Hunter,Shepard,7-Nov-95,Nov-7-1995,11/7/95,11/7/95,1995,11,7,Nov
8444924,Jim,Anderson,1-Dec-30,Dec-1-1930,12/1/30,12/1/30,1930,12,1,Dec
8445316,Bryan,Campbell,27-Mar-44,Mar-27-1944,3/27/44,3/27/44,1944,3,27,Mar
8445572,Mike,Corbett,4-Oct-42,Oct-4-1942,10/4/42,10/4/42,1942,10,4,Oct
8446964,Howie,Hughes,4-Apr-39,Apr-4-1939,4/4/39,4/4/39,1939,4,4,Apr
8448371,Doug,Robinson,27-Aug-40,Aug-27-1940,8/27/40,8/27/40,1940,8,27,Aug
8447381,Jacques,Lemieux,8-Apr-43,Apr-8-1943,4/8/43,4/8/43,1943,4,8,Apr
8447967,Jim,Murray,25-Nov-43,Nov-25-1943,11/25/43,11/25/43,1943,11,25,Nov
8449389,Bill,White,26-Aug-39,Aug-26-1939,8/26/39,8/26/39,1939,8,26,Aug
8445966,Jacques,Caron,21-Apr-39,Apr-21-1939,4/21/39,4/21/39,1939,4,21,Apr
8450110,Wayne,Rutledge,5-Jan-42,Jan-5-1942,1/5/42,1/5/42,1942,1,5,Jan
8445958,Marc,Dufour,11-Sep-41,Sep-11-1941,9/11/41,9/11/41,1941,9,11,Sep
8449151,Jim,Stanfield,1-Jan-47,Jan-1-1947,1/1/47,1/1/47,1947,1,1,Jan
8445328,Brian,Carlin,13-Jun-50,Jun-13-1950,6/13/50,6/13/50,1950,6,13,Jun
8451525,Billy,Smith,12-Dec-50,Dec-12-1950,12/12/50,12/12/50,1950,12,12,Dec
8446890,Phil,Hoene,15-Mar-49,Mar-15-1949,3/15/49,3/15/49,1949,3,15,Mar
8448538,Don,Kozak,2-Feb-52,Feb-2-1952,2/2/52,2/2/52,1952,2,2,Feb
8449143,Frank,St. Marseille,14-Dec-39,Dec-14-1939,12/14/39,12/14/39,1939,12,14,Dec
8452210,Vic,Venasky,6-Mar-51,Mar-6-1951,3/6/51,3/6/51,1951,3,6,Mar
8448518,Neil,Komadoski,5-Nov-51,Nov-5-1951,11/5/51,11/5/51,1951,11,5,Nov
8449744,Mike,Murphy,12-Sep-50,Sep-12-1950,9/12/50,9/12/50,1950,9,12,Sep
8449483,Tom,Williams,7-Feb-51,Feb-7-1951,2/7/51,2/7/51,1951,2,7,Feb
8444890,Dennis,Abgrall,24-Apr-53,Apr-24-1953,4/24/53,4/24/53,1953,4,24,Apr
8449596,Jim,Witherspoon,3-Oct-51,Oct-3-1951,10/3/51,10/3/51,1951,10,3,Oct
8452258,Russell,Walker,24-May-53,May-24-1953,5/24/53,5/24/53,1953,5,24,May
8451866,Dave,Taylor,4-Dec-55,Dec-4-1955,12/4/55,12/4/55,1955,12,4,Dec
8447707,Mark,Heaslip,26-Dec-51,Dec-26-1951,12/26/51,12/26/51,1951,12,26,Dec
8448805,Mario,Lessard,25-Jun-54,Jun-25-1954,6/25/54,6/25/54,1954,6,25,Jun
8445931,Steve,Carlson,26-Aug-55,Aug-26-1955,8/26/55,8/26/55,1955,8,26,Aug
8448015,Don,Howse,28-Jul-52,Jul-28-1952,7/28/52,7/28/52,1952,7,28,Jul
8448435,John Paul,Kelly,15-Nov-59,Nov-15-1959,11/15/59,11/15/59,1959,11,15,Nov
8445602,Dan,Bonar,23-Sep-56,Sep-23-1956,9/23/56,9/23/56,1956,9,23,Sep
8446945,Jim,Fox,18-May-60,May-18-1960,5/18/60,5/18/60,1960,5,18,May
8449700,David,Morrison,12-Jun-62,Jun-12-1962,6/12/62,6/12/62,1962,6,12,Jun
8452243,Don,Waddell,19-Aug-58,Aug-19-1958,8/19/58,8/19/58,1958,8,19,Aug
8450094,Paul,Pageau,1-Oct-59,Oct-1-1959,10/1/59,10/1/59,1959,10,1,Oct
8447951,Warren,Holmes,18-Feb-57,Feb-18-1957,2/18/57,2/18/57,1957,2,18,Feb
8451939,Brock,Tredway,23-Jun-59,Jun-23-1959,6/23/59,6/23/59,1959,6,23,Jun
8445551,Mike,Blake,6-Apr-56,Apr-6-1956,4/6/56,4/6/56,1956,4,6,Apr
8445269,Blair,Barnes,21-Sep-60,Sep-21-1960,9/21/60,9/21/60,1960,9,21,Sep
8445558,Rick,Blight,17-Oct-55,Oct-17-1955,10/17/55,10/17/55,1955,10,17,Oct
8447032,Dave,Gans,6-Jun-64,Jun-6-1964,6/6/64,6/6/64,1964,6,6,Jun
8447212,Pierre,Giroux,17-Nov-55,Nov-17-1955,11/17/55,11/17/55,1955,11,17,Nov
8448185,Ulf,Isaksson,19-Mar-54,Mar-19-1954,3/19/54,3/19/54,1954,3,19,Mar
8447993,Viktor,Nechayev,28-Jan-55,Jan-28-1955,1/28/55,1/28/55,1955,1,28,Jan
8445711,Jim,Brown,1-Mar-60,Mar-1-1960,3/1/60,3/1/60,1960,3,1,Mar
8447729,Peter,Helander,4-Dec-51,Dec-4-1951,12/4/51,12/4/51,1951,12,4,Dec
8451237,Howard,Scruton,6-Oct-62,Oct-6-1962,10/6/62,10/6/62,1962,10,6,Oct
8448715,Gary,Laskoski,6-Jun-59,Jun-6-1959,6/6/59,6/6/59,1959,6,6,Jun
8445680,Dan,Brennan,1-Oct-62,Oct-1-1962,10/1/62,10/1/62,1962,10,1,Oct
8448273,Dean,Jenkins,21-Nov-59,Nov-21-1959,11/21/59,11/21/59,1959,11,21,Nov
8448631,Bob,Laforest,19-May-63,May-19-1963,5/19/63,5/19/63,1963,5,19,May
8447719,Mike,Heidt,4-Nov-63,Nov-4-1963,11/4/63,11/4/63,1963,11,4,Nov
8451259,Steve,Seguin,10-Apr-64,Apr-10-1964,4/10/64,4/10/64,1964,4,10,Apr
8452452,Brian,Wilks,22-Feb-66,Feb-22-1966,2/22/66,2/22/66,1966,2,22,Feb
8450735,Craig,Redmond,22-Sep-65,Sep-22-1965,9/22/65,9/22/65,1965,9,22,Sep
8448219,Bob,Janecyk,18-May-57,May-18-1957,5/18/57,5/18/57,1957,5,18,May
8450350,Lyle,Phair,8-Mar-61,Mar-8-1961,3/8/61,3/8/61,1961,3,8,Mar
8445617,Bob,Bourne,21-Jun-54,Jun-21-1954,6/21/54,6/21/54,1954,6,21,Jun
8448637,Tom,Laidlaw,15-Apr-58,Apr-15-1958,4/15/58,4/15/58,1958,4,15,Apr
8447357,Dan,Gratton,7-Dec-66,Dec-7-1966,12/7/66,12/7/66,1966,12,7,Dec
8448553,Bob,Kudelski,3-Mar-64,Mar-3-1964,3/3/64,3/3/64,1964,3,3,Mar
8446684,John,English,3-May-66,May-3-1966,5/3/66,5/3/66,1966,5,3,May
8447121,Eric,Germain,26-Jun-66,Jun-26-1966,6/26/66,6/26/66,1966,6,26,Jun
8448682,Denis,Larocque,5-Oct-67,Oct-5-1967,10/5/67,10/5/67,1967,10,5,Oct
8446199,Sylvain,Couturier,23-Apr-68,Apr-23-1968,4/23/68,4/23/68,1968,4,23,Apr
8447400,Wayne,Gretzky,26-Jan-61,Jan-26-1961,1/26/61,1/26/61,1961,1,26,Jan
8448830,Igor,Liba,4-Nov-60,Nov-4-1960,11/4/60,11/4/60,1960,11,4,Nov
8452252,Gord,Walker,12-Aug-65,Aug-12-1965,8/12/65,8/12/65,1965,8,12,Aug
8448823,Mikael,Lindholm,19-Dec-64,Dec-19-1964,12/19/64,12/19/64,1964,12,19,Dec
8451236,Ron,Scott,21-Jul-60,Jul-21-1960,7/21/60,7/21/60,1960,7,21,Jul
8445738,Francis,Breault,11-May-67,May-11-1967,5/11/67,5/11/67,1967,5,11,May
8446126,Rene,Chapdelaine,27-Sep-66,Sep-27-1966,9/27/66,9/27/66,1966,9,27,Sep
8447699,Rick,Hayward,25-Feb-66,Feb-25-1966,2/25/66,2/25/66,1966,2,25,Feb
8456784,Kyosti,Karjalainen,19-Jun-67,Jun-19-1967,6/19/67,6/19/67,1967,6,19,Jun
8448569,Jari,Kurri,18-May-60,May-18-1960,5/18/60,5/18/60,1960,5,18,May
8457282,Shawn,McCosh,5-Jun-69,Jun-5-1969,6/5/69,6/5/69,1969,6,5,Jun
8458394,Sean,Whyte,4-May-70,May-4-1970,5/4/70,5/4/70,1970,5,4,May
8456411,David,Goverde,9-Apr-70,Apr-9-1970,4/9/70,4/9/70,1970,4,9,Apr
8458556,Guy,Leveque,28-Dec-72,Dec-28-1972,12/28/72,12/28/72,1972,12,28,Dec
8457083,Lonnie,Loach,14-Apr-68,Apr-14-1968,4/14/68,4/14/68,1968,4,14,Apr
8457984,Thomas,Semchuk,22-Sep-71,Sep-22-1971,9/22/71,9/22/71,1971,9,22,Sep
8458412,Darryl,Williams,29-Feb-68,Feb-29-1968,2/29/68,2/29/68,1968,2,29,Feb
8456855,Rick,Knickle,26-Feb-60,Feb-26-1960,2/26/60,2/26/60,1960,2,26,Feb
8446250,Dan,Currie,15-Mar-68,Mar-15-1968,3/15/68,3/15/68,1968,3,15,Mar
8449755,Rob,Murphy,7-Apr-69,Apr-7-1969,4/7/69,4/7/69,1969,4,7,Apr
8458593,Keith,Redmond,25-Oct-72,Oct-25-1972,10/25/72,10/25/72,1972,10,25,Oct
8458975,Justin,Hocking,9-Jan-74,Jan-9-1974,1/9/74,1/9/74,1974,1,9,Jan
8456709,Bob,Jay,8-Nov-65,Nov-8-1965,11/8/65,11/8/65,1965,11,8,Nov
8458820,Rob,Cowie,3-Nov-67,Nov-3-1967,11/3/67,11/3/67,1967,11,3,Nov
8458539,Eric,Lavigne,4-Nov-72,Nov-4-1972,11/4/72,11/4/72,1972,11,4,Nov
8458622,Pauli,Jaks,25-Jan-72,Jan-25-1972,1/25/72,1/25/72,1972,1,25,Jan
8455763,Dan,Bylsma,19-Sep-70,Sep-19-1970,9/19/70,9/19/70,1970,9,19,Sep
8458579,Nathan,LaFayette,17-Feb-73,Feb-17-1973,2/17/73,2/17/73,1973,2,17,Feb
8456985,Steve,Larouche,14-Apr-71,Apr-14-1971,4/14/71,4/14/71,1971,4,14,Apr
8458183,Patrice,Tardif,30-Oct-70,Oct-30-1970,10/30/70,10/30/70,1970,10,30,Oct
8460551,Vitali,Yachmenev,8-Jan-75,Jan-8-1975,1/8/75,1/8/75,1975,1,8,Jan
8459500,Ruslam,Batyrshin,19-Feb-75,Feb-19-1975,2/19/75,2/19/75,1975,2,19,Feb
8458984,Mattias,Norstrom,2-Jan-72,Jan-2-1972,1/2/72,1/2/72,1972,1,2,Jan
8458993,Jan,Vopat,22-Mar-73,Mar-22-1973,3/22/73,3/22/73,1973,3,22,Mar
8456441,Brent,Grieve,9-May-69,May-9-1969,5/9/69,5/9/69,1969,5,9,May
8457214,Chris,Marinucci,29-Dec-71,Dec-29-1971,12/29/71,12/29/71,1971,12,29,Dec
8465167,Kai,Nurminen,29-Mar-69,Mar-29-1969,3/29/69,3/29/69,1969,3,29,Mar
8460044,Brad,Smyth,13-Mar-73,Mar-13-1973,3/13/73,3/13/73,1973,3,13,Mar
8462078,Pavel,Rosa,7-Jun-77,Jun-7-1977,6/7/77,6/7/77,1977,6,7,Jun
8460701,Jan,Nemecek,14-Feb-76,Feb-14-1976,2/14/76,2/14/76,1976,2,14,Feb
8459198,Ryan,Bach,21-Oct-73,Oct-21-1973,10/21/73,10/21/73,1973,10,21,Oct
8467682,Brad,Chartrand,14-Dec-74,Dec-14-1974,12/14/74,12/14/74,1974,12,14,Dec
8459141,Marko,Tuomainen,25-Apr-72,Apr-25-1972,4/25/72,4/25/72,1972,4,25,Apr
8459569,Jere,Karalahti,25-Mar-75,Mar-25-1975,3/25/75,3/25/75,1975,3,25,Mar
8459543,Tomas,Vlasak,1-Feb-75,Feb-1-1975,2/1/75,2/1/75,1975,2,1,Feb
8468598,Lubomir,Visnovsky,11-Aug-76,Aug-11-1976,8/11/76,8/11/76,1976,8,11,Aug
8459132,Steve,Passmore,29-Jan-73,Jan-29-1973,1/29/73,1/29/73,1973,1,29,Jan
8460935,Travis,Scott,14-Sep-75,Sep-14-1975,9/14/75,9/14/75,1975,9,14,Sep
8469502,Jaroslav,Bednar,9-Nov-76,Nov-9-1976,11/9/76,11/9/76,1976,11,9,Nov
8467461,Ryan,Flinn,20-Apr-80,Apr-20-1980,4/20/80,4/20/80,1980,4,20,Apr
8451005,Cliff,Ronning,1-Oct-65,Oct-1-1965,10/1/65,10/1/65,1965,10,1,Oct
8458628,Rob,Valicevic,6-Jan-71,Jan-6-1971,1/6/71,1/6/71,1971,1,6,Jan
8459064,Derek,Armstrong,23-Apr-73,Apr-23-1973,4/23/73,4/23/73,1973,4,23,Apr
8468527,Jared,Aulin,15-Mar-82,Mar-15-1982,3/15/82,3/15/82,1982,3,15,Mar
8462239,Derek,Bekar,15-Sep-75,Sep-15-1975,9/15/75,9/15/75,1975,9,15,Sep
8468500,Alex,Frolov,19-Jun-82,Jun-19-1982,6/19/82,6/19/82,1982,6,19,Jun
8460599,Chris,Schmidt,1-Mar-76,Mar-1-1976,3/1/76,3/1/76,1976,3,1,Mar
8467499,Tomas,Zizka,10-Oct-79,Oct-10-1979,10/10/79,10/10/79,1979,10,10,Oct
8470606,Dustin,Brown,4-Nov-84,Nov-4-1984,11/4/84,11/4/84,1984,11,4,Nov
8470766,Esa,Pirnes,1-Apr-77,Apr-1-1977,4/1/77,4/1/77,1977,4,1,Apr
8462103,John,Tripp,4-May-77,May-4-1977,5/4/77,5/4/77,1977,5,4,May
8470268,Denis,Grebeshkov,11-Oct-83,Oct-11-1983,10/11/83,10/11/83,1983,10,11,Oct
8467341,Mathieu,Chouinard,11-Apr-80,Apr-11-1980,4/11/80,4/11/80,1980,4,11,Apr
8459648,Pavol,Demitra,29-Nov-74,Nov-29-1974,11/29/74,11/29/74,1974,11,29,Nov
8470001,Jeff,Giuliano,20-Jun-79,Jun-20-1979,6/20/79,6/20/79,1979,6,20,Jun
8470055,Petr,Kanko,7-Feb-84,Feb-7-1984,2/7/84,2/7/84,1984,2,7,Feb
8470637,Konstantin,Pushkarev,12-Feb-85,Feb-12-1985,2/12/85,2/12/85,1985,2,12,Feb
8471524,Matt,Ryan,12-Nov-83,Nov-12-1983,11/12/83,11/12/83,1983,11,12,Nov
8470620,Jeff,Tambellini,13-Apr-84,Apr-13-1984,4/13/84,4/13/84,1984,4,13,Apr
8467954,Adam,Hauser,27-May-80,May-27-1980,5/27/80,5/27/80,1980,5,27,May
8467391,Jason,LaBarbera,18-Jan-80,Jan-18-1980,1/18/80,1/18/80,1980,1,18,Jan
8473644,Gabe,Gauthier,20-Jan-84,Jan-20-1984,1/20/84,1/20/84,1984,1,20,Jan
8471685,Anze,Kopitar,24-Aug-87,Aug-24-1987,8/24/87,8/24/87,1987,8,24,Aug
8469720,Shay,Stephenson,13-Sep-83,Sep-13-1983,9/13/83,9/13/83,1983,9,13,Sep
8471224,Lauri,Tukonen,1-Sep-86,Sep-1-1986,9/1/86,9/1/86,1986,9,1,Sep
8470113,John,Zeiler,21-Nov-82,Nov-21-1982,11/21/82,11/21/82,1982,11,21,Nov
8470264,Barry,Brust,8-Aug-83,Aug-8-1983,8/8/83,8/8/83,1983,8,8,Aug
8470534,Yutaka,Fukufuji,17-Sep-82,Sep-17-1982,9/17/82,9/17/82,1982,9,17,Sep
8470744,Brady,Murray,17-Aug-84,Aug-17-1984,8/17/84,8/17/84,1984,8,17,Aug
8466304,Ladislav,Nagy,1-Jun-79,Jun-1-1979,6/1/79,6/1/79,1979,6,1,Jun
8473975,Erik,Ersberg,8-Mar-82,Mar-8-1982,3/8/82,3/8/82,1982,3,8,Mar
8471734,Jonathan,Quick,21-Jan-86,Jan-21-1986,1/21/86,1/21/86,1986,1,21,Jan
8474114,Oscar,Moller,22-Jan-89,Jan-22-1989,1/22/89,1/22/89,1989,1,22,Jan
8468526,Jarret,Stoll,24-Jun-82,Jun-24-1982,6/24/82,6/24/82,1982,6,24,Jun
8474563,Drew,Doughty,8-Dec-89,Dec-8-1989,12/8/89,12/8/89,1989,12,8,Dec
8470121,Matt,Greene,13-May-83,May-13-1983,5/13/83,5/13/83,1983,5,13,May
8471718,Marc-Andre,Cliche,23-Mar-87,Mar-23-1987,3/23/87,3/23/87,1987,3,23,Mar
8475086,Corey,Elkins,23-Feb-85,Feb-23-1985,2/23/85,2/23/85,1985,2,23,Feb
8471386,Scott,Parse,5-Sep-84,Sep-5-1984,9/5/84,9/5/84,1984,9,5,Sep
8460496,Ryan,Smyth,21-Feb-76,Feb-21-1976,2/21/76,2/21/76,1976,2,21,Feb
8474166,Alec,Martinez,26-Jul-87,Jul-26-1987,7/26/87,7/26/87,1987,7,26,Jul
8470662,Colin,Fraser,28-Jan-85,Jan-28-1985,1/28/85,1/28/85,1985,1,28,Jan
8467466,Trent,Hunter,5-Jul-80,Jul-5-1980,7/5/80,7/5/80,1980,7,5,Jul
8460504,Ethan,Moreau,22-Sep-75,Sep-22-1975,9/22/75,9/22/75,1975,9,22,Sep
8474594,Slava,Voynov,15-Jan-90,Jan-15-1990,1/15/90,1/15/90,1990,1,15,Jan
8468483,Marian,Gaborik,14-Feb-82,Feb-14-1982,2/14/82,2/14/82,1982,2,14,Feb
8476352,Michael,Mersch,2-Oct-92,Oct-2-1992,10/2/92,10/2/92,1992,10,2,Oct
8477960,Adrian,Kempe,13-Sep-96,Sep-13-1996,9/13/96,9/13/96,1996,9,13,Sep
8476983,Paul,LaDue,6-Sep-92,Sep-6-1992,9/6/92,9/6/92,1992,9,6,Sep
8477428,Justin,Auger,14-May-94,May-14-1994,5/14/94,5/14/94,1994,5,14,May
8476020,Andrew,Crescenzi,29-Jul-92,Jul-29-1992,7/29/92,7/29/92,1992,7,29,Jul
8480771,Daniel,Brickley,30-Mar-95,Mar-30-1995,3/30/95,3/30/95,1995,3,30,Mar
8477073,Kurtis,MacDermid,25-Mar-94,Mar-25-1994,3/25/94,3/25/94,1994,3,25,Mar
8479994,Jaret,Anderson-Dolan,12-Sep-99,Sep-12-1999,9/12/99,9/12/99,1999,9,12,Sep
8479336,Carl,Grundstrom,1-Dec-97,Dec-1-1997,12/1/97,12/1/97,1997,12,1,Dec
8481481,Blake,Lizotte,13-Dec-97,Dec-13-1997,12/13/97,12/13/97,1997,12,13,Dec
8478455,Austin,Wagner,23-Jun-97,Jun-23-1997,6/23/97,6/23/97,1997,6,23,Jun
8478911,Matt,Roy,1-Mar-95,Mar-1-1995,3/1/95,3/1/95,1995,3,1,Mar
8477361,Cal,Petersen,19-Oct-94,Oct-19-1994,10/19/94,10/19/94,1994,10,19,Oct
8476947,Nikolai,Prokhorkin,17-Sep-93,Sep-17-1993,9/17/93,9/17/93,1993,9,17,Sep
8479998,Mikey,Anderson,25-May-99,May-25-1999,5/25/99,5/25/99,1999,5,25,May
8481600,Tobias,Bjornfot,6-Apr-01,Apr-6-2001,4/6/01,4/6/01,2001,4,6,Apr
8480072,Lias,Andersson,13-Oct-98,Oct-13-1998,10/13/98,10/13/98,1998,10,13,Oct
8482124,Quinton,Byfield,19-Aug-02,Aug-19-2002,8/19/02,8/19/02,2002,8,19,Aug
8481560,Arthur,Kaliyev,26-Jun-01,Jun-26-2001,6/26/01,6/26/01,2001,6,26,Jun
8480221,Drake,Rymsha,6-Aug-98,Aug-6-1998,8/6/98,8/6/98,1998,8,6,Aug
8480467,Austin,Strand,17-Feb-97,Feb-17-1997,2/17/97,2/17/97,1997,2,17,Feb
8478042,Viktor,Arvidsson,8-Apr-93,Apr-8-1993,4/8/93,4/8/93,1993,4,8,Apr
8481239,Samuel,Fagemo,14-Mar-00,Mar-14-2000,3/14/00,3/14/00,2000,3,14,Mar
8478250,Vladimir,Tkachev,5-Oct-95,Oct-5-1995,10/5/95,10/5/95,1995,10,5,Oct
8481532,Alex,Turcotte,26-Feb-01,Feb-26-2001,2/26/01,2/26/01,2001,2,26,Feb
8476391,T.J.,Tynan,25-Feb-92,Feb-25-1992,2/25/92,2/25/92,1992,2,25,Feb
8471303,Alexander,Edler,21-Apr-86,Apr-21-1986,4/21/86,4/21/86,1986,4,21,Apr
8479421,Jacob,Moverare,31-Aug-98,Aug-31-1998,8/31/98,8/31/98,1998,8,31,Aug
8481606,Jordan,Spence,24-Feb-01,Feb-24-2001,2/24/01,2/24/01,2001,2,24,Feb
8477942,Kevin,Fiala,22-Jul-96,Jul-22-1996,7/22/96,7/22/96,1996,7,22,Jul
8482730,Brandt,Clarke,9-Feb-03,Feb-9-2003,2/9/03,2/9/03,2003,2,9,Feb
8478882,Vladislav,Gavrikov,21-Nov-95,Nov-21-1995,11/21/95,11/21/95,1995,11,21,Nov
8476914,Joonas,Korpisalo,28-Apr-94,Apr-28-1994,4/28/94,4/28/94,1994,4,28,Apr
8482155,Alex,Laferriere,28-Oct-01,Oct-28-2001,10/28/01,10/28/01,2001,10,28,Oct
8477971,Andreas,Englund,21-Jan-96,Jan-21-1996,1/21/96,1/21/96,1996,1,21,Jan
8447592,Wayne,Maki,10-Nov-44,Nov-10-1944,11/10/44,11/10/44,1944,11,10,Nov
8448348,Garth,Rizzuto,11-Sep-47,Sep-11-1947,9/11/47,9/11/47,1947,9,11,Sep
8449191,Ralph,Stewart,2-Dec-48,Dec-2-1948,12/2/48,12/2/48,1948,12,2,Dec
8449594,Jim,Wiste,18-Feb-46,Feb-18-1946,2/18/46,2/18/46,1946,2,18,Feb
8445100,Ken,Block,18-Mar-44,Mar-18-1944,3/18/44,3/18/44,1944,3,18,Mar
8446698,Jim,Hargreaves,2-May-50,May-2-1950,5/2/50,5/2/50,1950,5,2,May
8451169,John,Schella,9-May-47,May-9-1947,5/9/47,5/9/47,1947,5,9,May
8445104,Gregg,Boddy,19-Mar-49,Mar-19-1949,3/19/49,3/19/49,1949,3,19,Mar
8448400,Dennis,Kearns,27-Sep-45,Sep-27-1945,9/27/45,9/27/45,1945,9,27,Sep
8449913,Ed,Dyck,29-Oct-50,Oct-29-1950,10/29/50,10/29/50,1950,10,29,Oct
8446911,Ron,Homenuke,5-Jan-52,Jan-5-1952,1/5/52,1/5/52,1952,1,5,Jan
8449215,Don,Tannahill,21-Feb-49,Feb-21-1949,2/21/49,2/21/49,1949,2,21,Feb
8449468,Barry,Wilcox,23-Apr-48,Apr-23-1948,4/23/48,4/23/48,1948,4,23,Apr
8449846,Bruce,Bullock,9-May-49,May-9-1949,5/9/49,5/9/49,1949,5,9,May
8450032,Dave,McLelland,20-Nov-52,Nov-20-1952,11/20/52,11/20/52,1952,11,20,Nov
8445601,Paulin,Bordeleau,29-Jan-53,Jan-29-1953,1/29/53,1/29/53,1953,1,29,Jan
8446592,Dan,Gloor,4-Dec-52,Dec-4-1952,12/4/52,12/4/52,1952,12,4,Dec
8446619,Larry,Gould,16-Aug-52,Aug-16-1952,8/16/52,8/16/52,1952,8,16,Aug
8449117,Gene,Sobchuk,19-Feb-51,Feb-19-1951,2/19/51,2/19/51,1951,2,19,Feb
8449194,Steve,Stone,26-Sep-52,Sep-26-1952,9/26/52,9/26/52,1952,9,26,Sep
8446334,Peter,Folco,13-Aug-53,Aug-13-1953,8/13/53,8/13/53,1953,8,13,Aug
8447711,Dennis,McCord,28-Jul-52,Jul-28-1952,7/28/52,7/28/52,1952,7,28,Jul
8446988,Bob,Hurlburt,1-May-50,May-1-1950,5/1/50,5/1/50,1950,5,1,May
8450015,Ken,Lockett,30-Aug-47,Aug-30-1947,8/30/47,8/30/47,1947,8,30,Aug
8447086,Brad,Gassoff,13-Nov-55,Nov-13-1955,11/13/55,11/13/55,1955,11,13,Nov
